LIC MF Nifty 50 ETF,33580,LIC Mutual Fund,5.21,8.42,12.12,26.48,NIFTY 50 - TRI,15.73,15.99,,8.86,98,78,94,88,91,43,37,,LIC MF Nifty 50 ETF,Equity : ETFs,141,150,149,141,129,78,56,23,14.66,5.7,11.67,17.27,38.95,18.53,17.89,13.05,,,,,,,,
Samco Active Momentum Fund-Reg(G),47753,Samco Mutual Fund,5.8,11.67,14.34,,NIFTY 500 - TRI,,,,13.23,44,32,48,44,,,,,Samco Active Momentum Fund-Reg(G),Equity : Thematic,56,62,60,54,46,31,15,8,20.14,6.08,16.84,22.74,48.39,21.91,22.44,15.57,,,,,,,,
Bandhan Innovation Fund-Reg(G),48656,Bandhan Mutual Fund,6.1,,,,NIFTY 500 - TRI,,,,,,27,,,,,,,Bandhan Innovation Fund-Reg(G),Equity : Thematic,56,62,60,54,46,31,15,8,20.14,6.08,16.84,22.74,48.39,21.91,22.44,15.57,,,,,,,,
LIC MF BSE Sensex ETF,33579,LIC Mutual Fund,5.11,7.99,10.57,23.73,BSE SENSEX - TRI,15.2,15.61,,7.68,108,94,106,101,105,54,50,,LIC MF BSE Sensex ETF,Equity : ETFs,141,150,149,141,129,78,56,23,14.66,5.7,11.67,17.27,38.95,18.53,17.89,13.05,5.02,8.05,10.66,23.91,15.35,15.74,,16.98
Franklin India Corp Debt Fund-A(G),3381,Franklin Templeton Mutual Fund,0.62,1.77,3.47,6.47,NIFTY Corporate Bond Index,5.01,5.9,7.44,3.27,20,18,12,20,16,11,17,6,Franklin India Corp Debt Fund-A(G),Debt : Corporate Bond,21,21,21,21,21,19,18,12,3.58,0.69,1.81,3.77,6.8,5.17,6.51,7.25,,,,,,,,
HDFC Income Fund(G),1281,HDFC Mutual Fund,1.07,2.2,4.76,7.02,CRISIL Medium to Long Term Debt Index,4.4,5.35,6.48,4.71,1,5,2,1,10,8,8,8,HDFC Income Fund(G),Debt : Medium to Long Duration,52,52,52,52,52,11,11,11,3.75,0.86,1.94,3.92,6.83,5.27,5.83,6.72,,,,,,,,
Bank of India Mid & Small Cap Equity & Debt Fund-Reg(G),32972,Bank of India Mutual Fund,6.61,18.01,23.28,50.38,Nifty MidSmallcap 400 - TRI,23.14,25.1,,19.75,2,2,2,3,2,3,2,,Bank of India Mid & Small Cap Equity & Debt Fund-Reg(G),Hybrid : Equity Oriented,55,55,55,55,54,52,47,24,10.09,3.52,8.35,11.62,23.42,12.64,13.16,11.64,,,,,,,,
SBI Nifty Smallcap 250 Index Fund-Reg(G),46937,SBI Mutual Fund,7.91,23.87,26.51,61.07,Nifty Smallcap 250 - TRI,,,,20.22,41,21,18,31,30,,,,SBI Nifty Smallcap 250 Index Fund-Reg(G),Equity : Index Funds,105,121,114,103,95,42,23,18,17.56,6.41,14.83,20.52,45.84,18.76,16.7,12.85,,,,,,,,
HDFC Nifty G-Sec Jun 2027 Index Fund-Reg(G),46618,HDFC Mutual Fund,0.87,2.01,3.68,6.8,Nifty G-Sec Jun 2027 Index,,,,3.46,29,26,26,29,27,,,,HDFC Nifty G-Sec Jun 2027 Index Fund-Reg(G),Debt : Gilt,35,35,35,35,35,23,21,21,4.43,1.15,2.24,4.54,7.36,5.26,6.21,7.78,,,,,,,,
Mahindra Manulife Balanced Advantage Fund-Reg(G),45993,Mahindra Manulife Mutual Fund,3.84,6.82,11.56,28.36,NIFTY 50 Hybrid Composite Debt 50:50 Index,,,,10.26,9,8,20,10,4,,,,Mahindra Manulife Balanced Advantage Fund-Reg(G),Hybrid : Dynamic Asset Allocation,30,32,31,29,26,20,17,10,10.01,3.33,7.65,11.65,25.46,12.64,12.58,10.79,,,,,,,,
HDFC NIFTY G-Sec Jun 2036 Index Fund-Reg(G),47714,HDFC Mutual Fund,1.18,2.62,5.33,7.95,Nifty G-Sec Jun 2036 Index,,,,5.47,7,10,6,8,6,,,,HDFC NIFTY G-Sec Jun 2036 Index Fund-Reg(G),Debt : Long Duration,21,24,22,20,19,3,3,2,5.28,1.22,2.33,5.32,7.67,5.03,5.91,7.46,,,,,,,,
360 ONE Dynamic Bond Fund-Reg(G),17578,360 ONE Mutual Fund,1.1,1.92,4.63,7.74,CRISIL Dynamic Bond Index,6.02,6.51,7.17,4.53,7,12,15,7,5,5,10,10,360 ONE Dynamic Bond Fund-Reg(G),Debt : Dynamic Bond,22,22,22,22,22,21,21,18,4.35,1.13,2.11,4.46,7.22,5.57,6.19,7.3,,,,,,,,
JM Value Fund(G),1849,JM Financial Mutual Fund,6.35,23.24,30.35,64.26,BSE 500 - TRI,30.84,25.69,19.2,24.36,2,11,1,2,2,1,2,1,JM Value Fund(G),Equity : Value / Contra,22,22,22,22,22,19,17,14,18.52,6.19,15.58,22.01,48.96,23.44,21.7,16.74,5.8,13.88,19.36,38.7,19.71,19.69,,32.2
Kotak Quant Fund-Reg(G),48083,Kotak Mahindra Mutual Fund,6.59,18.41,26.0,,NIFTY 200 - TRI,,,,23.6,16,19,22,18,,,,,Kotak Quant Fund-Reg(G),Equity : Thematic,56,62,60,54,46,31,15,8,20.14,6.08,16.84,22.74,48.39,21.91,22.44,15.57,,,,,,,,
Invesco India Balanced Advantage Fund(G),2171,Invesco Mutual Fund,2.34,8.51,11.4,25.33,NIFTY 50 Hybrid Composite Debt 50:50 Index,12.89,11.34,10.8,9.41,16,29,10,12,10,7,11,6,Invesco India Balanced Advantage Fund(G),Hybrid : Dynamic Asset Allocation,30,32,31,29,26,20,17,10,10.01,3.33,7.65,11.65,25.46,12.64,12.58,10.79,,,,,,,,
Tata Gilt Securities Fund-Reg(G),3230,Tata Mutual Fund,0.77,1.78,4.22,6.53,CRISIL Dynamic Gilt Index,5.15,5.47,7.07,4.12,23,32,34,23,33,13,18,18,Tata Gilt Securities Fund-Reg(G),Debt : Gilt,35,35,35,35,35,23,21,21,4.43,1.15,2.24,4.54,7.36,5.26,6.21,7.78,,,,,,,,
Mirae Asset Equity Allocator FoF-Reg(G),45064,Mirae Asset Mutual Fund,6.1,12.94,18.67,36.32,NIFTY 200 - TRI,18.69,,,14.3,16,7,14,8,11,8,,,Mirae Asset Equity Allocator FoF-Reg(G),FoFs : Domestic,53,56,56,53,53,37,25,22,11.48,3.15,9.53,12.8,25.3,13.97,13.67,10.98,,,,,,,,
Parag Parikh Arbitrage Fund-Reg(G),48215,PPFAS Mutual Fund,0.7,1.94,3.9,,Nifty 50 Arbitrage - TRI,,,,3.75,19,11,17,19,,,,,Parag Parikh Arbitrage Fund-Reg(G),Hybrid : Arbitrage,26,26,26,26,24,24,21,10,3.76,0.67,1.94,3.95,7.68,5.44,5.05,5.87,,,,,,,,
Tata NIFTY 50 Index Fund-Reg(G),3247,Tata Mutual Fund,4.88,8.11,9.98,26.02,NIFTY 50 - TRI,15.09,15.52,12.48,8.59,85,100,87,92,76,29,11,9,Tata NIFTY 50 Index Fund-Reg(G),Equity : Index Funds,105,121,114,103,95,42,23,18,17.56,6.41,14.83,20.52,45.84,18.76,16.7,12.85,,,,,,,,
Aditya Birla SL Special Opp Fund-Reg(G),45096,Aditya Birla Sun Life Mutual Fund,5.7,14.87,18.04,42.75,BSE 500 - TRI,18.16,,,16.64,31,34,32,31,25,16,,,Aditya Birla SL Special Opp Fund-Reg(G),Equity : Thematic,56,62,60,54,46,31,15,8,20.14,6.08,16.84,22.74,48.39,21.91,22.44,15.57,5.8,13.88,19.36,38.7,19.71,19.69,,32.2
Mirae Asset Nifty Midcap 150 ETF,46105,Mirae Asset Mutual Fund,8.19,20.96,23.34,58.57,Nifty Midcap 150 - TRI,,,,20.81,35,11,26,34,24,,,,Mirae Asset Nifty Midcap 150 ETF,Equity : ETFs,141,150,149,141,129,78,56,23,14.66,5.7,11.67,17.27,38.95,18.53,17.89,13.05,,,,,,,,
Bandhan Nifty100 Low Volatility 30 Index Fund-Reg(G),46607,Bandhan Mutual Fund,4.72,6.17,13.5,29.79,Nifty100 Low Volatility 30 - TRI,,,,8.91,73,107,110,69,66,,,,Bandhan Nifty100 Low Volatility 30 Index Fund-Reg(G),Equity : Index Funds,105,121,114,103,95,42,23,18,17.56,6.41,14.83,20.52,45.84,18.76,16.7,12.85,,,,,,,,
Invesco India Ultra Short Duration Fund(G),13460,Invesco Mutual Fund,0.64,1.8,3.86,7.13,NIFTY Ultra Short Duration Debt Index,5.34,5.26,6.75,3.65,2,5,12,2,9,13,11,4,Invesco India Ultra Short Duration Fund(G),Debt : Ultra Short Duration,24,24,24,24,24,24,19,13,3.35,0.61,1.78,3.56,6.85,5.42,5.38,6.36,,,,,,,,
Sundaram Corp Bond Fund(G),2955,Sundaram Mutual Fund,0.68,1.83,3.7,6.72,NIFTY Corporate Bond Index,5.11,6.73,7.69,3.49,15,12,8,13,11,8,7,4,Sundaram Corp Bond Fund(G),Debt : Corporate Bond,21,21,21,21,21,19,18,12,3.58,0.69,1.81,3.77,6.8,5.17,6.51,7.25,,,,,,,,
360 ONE Balanced Hybrid Fund-Reg(G),48144,360 ONE Mutual Fund,4.11,11.2,13.45,,NIFTY 50 Hybrid Composite Debt 50:50 Index,,,,12.16,17,22,13,21,,,,,360 ONE Balanced Hybrid Fund-Reg(G),Hybrid : Equity Oriented,55,55,55,55,54,52,47,24,10.09,3.52,8.35,11.62,23.42,12.64,13.16,11.64,,,,,,,,
Axis NIFTY 50 ETF,33980,Axis Mutual Fund,5.2,8.41,12.15,26.72,NIFTY 50 - TRI,15.8,16.0,,8.88,93,81,96,86,81,36,36,,Axis NIFTY 50 ETF,Equity : ETFs,141,150,149,141,129,78,56,23,14.66,5.7,11.67,17.27,38.95,18.53,17.89,13.05,,,,,,,,
Canara Rob Infrastructure Fund-Reg(G),547,Canara Robeco Mutual Fund,6.62,32.71,40.97,70.34,BSE India Infrastructure Index - TRI,36.98,28.14,17.93,36.54,4,11,3,5,8,6,7,10,Canara Rob Infrastructure Fund-Reg(G),Equity : Sectoral - Infrastructure,19,19,19,19,19,19,19,18,30.91,6.8,25.3,35.98,70.04,34.33,26.8,17.64,,,,,,,,50.76
Bandhan Hybrid Equity Fund-Reg(G),34066,Bandhan Mutual Fund,3.48,8.38,12.06,24.29,BSE 200 - TRI,13.7,14.51,,9.54,31,29,29,25,26,24,16,,Bandhan Hybrid Equity Fund-Reg(G),Hybrid : Equity Oriented,55,55,55,55,54,52,47,24,10.09,3.52,8.35,11.62,23.42,12.64,13.16,11.64,5.4,12.35,18.25,36.32,18.83,18.88,,30.45
Motilal Oswal Nifty Smallcap 250 Index Fund-Reg(G),43811,Motilal Oswal Mutual Fund,7.62,22.27,22.12,61.89,Nifty Smallcap 250 - TRI,26.34,,,20.28,38,36,32,43,28,6,,,Motilal Oswal Nifty Smallcap 250 Index Fund-Reg(G),Equity : Index Funds,105,121,114,103,95,42,23,18,17.56,6.41,14.83,20.52,45.84,18.76,16.7,12.85,,,,,,,,
Aditya Birla SL CRISIL IBX Gilt Apr 2029 Index Fund-Reg(G),46950,Aditya Birla Sun Life Mutual Fund,0.89,2.05,3.87,6.96,CRISIL IBX Gilt Index - April 2029,,,,3.75,27,24,23,27,25,,,,Aditya Birla SL CRISIL IBX Gilt Apr 2029 Index Fund-Reg(G),Debt : Gilt,35,35,35,35,35,23,21,21,4.43,1.15,2.24,4.54,7.36,5.26,6.21,7.78,,,,,,,,
DSP Banking & Financial Services Fund-Reg(G),48350,DSP Mutual Fund,5.75,12.86,8.32,,Nifty Financial Services - TRI,,,,9.1,11,14,9,13,,,,,DSP Banking & Financial Services Fund-Reg(G),Equity : Sectoral - Financial Services,18,20,20,18,15,12,11,8,10.51,5.93,12.27,10.84,26.91,16.61,13.38,13.91,,,,,,,,
Aditya Birla SL Pharma & Healthcare Fund-Reg(G),37591,Aditya Birla Sun Life Mutual Fund,2.78,7.0,18.96,48.32,BSE Health Care - TRI,14.33,,,15.84,6,11,12,8,2,7,,,Aditya Birla SL Pharma & Healthcare Fund-Reg(G),Equity : Sectoral - Pharma,14,16,16,14,11,9,8,3,15.58,3.65,8.32,19.71,45.57,14.89,25.8,15.5,3.25,9.04,22.68,47.67,14.83,24.39,,35.08
PGIM India ELSS Tax Saver Fund-Reg(G),26780,PGIM India Mutual Fund,6.73,13.45,13.57,24.14,NIFTY 500 - TRI,16.47,17.57,,10.27,56,20,41,54,60,50,41,,PGIM India ELSS Tax Saver Fund-Reg(G),Equity : Tax Saving (ELSS),60,60,60,60,60,55,53,27,15.84,6.16,15.48,18.81,40.06,21.41,20.92,15.37,,,,,,,,
HDFC Dynamic Debt Fund(G),1274,HDFC Mutual Fund,1.24,2.24,4.59,7.6,NIFTY Composite Debt Index,6.59,6.62,6.83,4.42,8,7,10,9,6,2,8,15,HDFC Dynamic Debt Fund(G),Debt : Dynamic Bond,22,22,22,22,22,21,21,18,4.35,1.13,2.11,4.46,7.22,5.57,6.19,7.3,,,,,,,,
LIC MF Nifty 100 ETF,33578,LIC Mutual Fund,5.37,10.85,16.4,32.04,NIFTY 100 - TRI,16.63,16.6,,12.7,62,68,72,64,73,29,26,,LIC MF Nifty 100 ETF,Equity : ETFs,141,150,149,141,129,78,56,23,14.66,5.7,11.67,17.27,38.95,18.53,17.89,13.05,,,,,,,,
Samco Flexi Cap Fund-Reg(G),46217,Samco Mutual Fund,6.95,10.31,9.45,26.07,NIFTY 500 - TRI,,,,7.03,45,16,44,46,39,,,,Samco Flexi Cap Fund-Reg(G),Equity : Flexi Cap,46,48,47,46,41,29,26,19,17.03,6.36,15.38,19.74,40.68,19.58,19.05,15.44,,,,,,,,
Nippon India US Equity Opp Fund(G),19246,Nippon India Mutual Fund,1.57,3.21,13.98,27.62,S&P 500 - TRI,8.93,15.04,,12.79,4,5,4,4,2,2,2,,Nippon India US Equity Opp Fund(G),Equity : International,8,8,8,8,8,6,5,3,9.77,1.33,3.37,11.58,17.63,5.13,10.39,9.06,,,,,,,,
Aditya Birla SL ESG Integration Strategy Fund-Reg(G),44736,Aditya Birla Sun Life Mutual Fund,7.5,13.26,13.41,30.46,NIFTY100 ESG - TRI,13.3,,,12.61,45,12,41,46,40,28,,,Aditya Birla SL ESG Integration Strategy Fund-Reg(G),Equity : Thematic,56,62,60,54,46,31,15,8,20.14,6.08,16.84,22.74,48.39,21.91,22.44,15.57,,,,,,,,
Kotak Nifty 50 Index Fund-Reg(G),45556,Kotak Mahindra Mutual Fund,4.85,8.03,9.88,25.89,NIFTY 50 - TRI,,,,8.51,88,101,88,93,80,,,,Kotak Nifty 50 Index Fund-Reg(G),Equity : Index Funds,105,121,114,103,95,42,23,18,17.56,6.41,14.83,20.52,45.84,18.76,16.7,12.85,,,,,,,,
Nippon India Index Fund-BSE Sensex Plan(G),12865,Nippon India Mutual Fund,5.05,7.87,10.33,23.18,BSE SENSEX - TRI,14.59,14.93,12.16,7.47,96,90,93,87,88,36,19,16,Nippon India Index Fund-BSE Sensex Plan(G),Equity : Index Funds,105,121,114,103,95,42,23,18,17.56,6.41,14.83,20.52,45.84,18.76,16.7,12.85,5.02,8.05,10.66,23.91,15.35,15.74,,16.98
Franklin India NSE Nifty 50 Index Fund(G),942,Franklin Templeton Mutual Fund,5.13,8.23,11.84,25.69,NIFTY 50,14.96,15.02,12.27,8.6,84,79,83,74,81,32,18,13,Franklin India NSE Nifty 50 Index Fund(G),Equity : Index Funds,105,121,114,103,95,42,23,18,17.56,6.41,14.83,20.52,45.84,18.76,16.7,12.85,4.73,7.91,11.43,25.25,14.5,14.76,,17.92
Nippon India Nifty 50 Value 20 Index Fund-Reg(G),45289,Nippon India Mutual Fund,3.29,6.22,14.05,32.44,Nifty50 Value 20 - TRI,18.34,,,10.72,71,118,108,68,62,19,,,Nippon India Nifty 50 Value 20 Index Fund-Reg(G),Equity : Index Funds,105,121,114,103,95,42,23,18,17.56,6.41,14.83,20.52,45.84,18.76,16.7,12.85,,,,,,,,
SBI FMP-91-90D-Reg(G),48431,SBI Mutual Fund,0.57,,,,CRISIL Liquid Debt Index,,,,1.84,93,99,,,,,,,SBI FMP-91-90D-Reg(G),Debt : FTP/FMP,101,108,102,93,91,23,17,12,3.4,0.68,1.89,3.77,7.03,5.58,5.54,6.15,,,,,,,,
HDFC Non-Cyclical Consumer Fund-Reg(G),46357,HDFC Mutual Fund,4.79,14.71,16.53,,Nifty India Consumption - TRI,,,,12.84,12,16,12,11,,,,,HDFC Non-Cyclical Consumer Fund-Reg(G),Equity : Thematic - Consumption,16,17,17,16,13,13,13,8,14.77,5.97,15.24,18.33,34.54,20.72,19.86,16.19,,,,,,,,
ICICI Pru Silver ETF FOF(G),46215,ICICI Prudential Mutual Fund,4.45,22.19,21.86,23.53,Silver,,,,19.99,6,18,5,6,28,,,,ICICI Pru Silver ETF FOF(G),FoFs : Domestic,53,56,56,53,53,37,25,22,11.48,3.15,9.53,12.8,25.3,13.97,13.67,10.98,,,,,,,,
Tata Resources & Energy Fund-Reg(G),33731,Tata Mutual Fund,4.0,17.31,19.62,42.35,NIFTY COMMODITIES - TRI,19.35,25.33,,17.6,3,2,2,3,3,3,2,,Tata Resources & Energy Fund-Reg(G),Equity : Sectoral - Energy / Power,3,4,4,3,3,3,3,2,24.48,3.57,17.81,28.19,58.36,27.01,25.97,17.91,,,,,,,,
Baroda BNP Paribas Conservative Hybrid Fund-Reg(G),210,Baroda BNP Paribas Mutual Fund,1.59,3.96,6.55,12.34,CRISIL Hybrid 85+15 - Conservative Index,7.47,7.64,7.82,5.76,10,17,14,10,11,15,14,12,Baroda BNP Paribas Conservative Hybrid Fund-Reg(G),Hybrid : Debt Oriented (Conservative),19,19,19,19,19,19,18,18,6.05,2.0,4.42,6.8,12.95,8.83,8.59,8.26,,,,,,,,
Baroda BNP Paribas Focused Fund-Reg(G),32452,Baroda BNP Paribas Mutual Fund,7.8,19.83,24.52,42.26,NIFTY 500 - TRI,20.3,18.44,,20.81,13,6,7,12,16,11,13,,Baroda BNP Paribas Focused Fund-Reg(G),Equity : Flexi Cap,46,48,47,46,41,29,26,19,17.03,6.36,15.38,19.74,40.68,19.58,19.05,15.44,,,,,,,,
Motilal Oswal Liquid Fund-Reg(G),41872,Motilal Oswal Mutual Fund,0.58,1.72,3.5,6.84,CRISIL Liquid Debt Index,5.28,4.64,,3.25,33,32,35,33,35,35,34,,Motilal Oswal Liquid Fund-Reg(G),Debt : Liquid,37,37,37,37,36,35,34,29,3.4,0.6,1.82,3.66,7.17,5.63,5.09,6.3,,,,,,,,
ICICI Pru Nifty Next 50 ETF,39950,ICICI Prudential Mutual Fund,7.85,23.95,38.58,65.8,NIFTY NEXT 50 - TRI,23.95,22.32,,34.36,6,22,14,10,16,15,8,,ICICI Pru Nifty Next 50 ETF,Equity : ETFs,141,150,149,141,129,78,56,23,14.66,5.7,11.67,17.27,38.95,18.53,17.89,13.05,,,,,,,,
Parag Parikh Dynamic Asset Allocation Fund-Reg(G),48512,PPFAS Mutual Fund,1.53,4.7,,,CRISIL Hybrid 50+50 - Moderate Index,,,,,,31,30,,,,,,Parag Parikh Dynamic Asset Allocation Fund-Reg(G),Hybrid : Dynamic Asset Allocation,30,32,31,29,26,20,17,10,10.01,3.33,7.65,11.65,25.46,12.64,12.58,10.79,,,,,,,,
DSP FMP 267-1246D-Reg(G),47071,DSP Mutual Fund,0.66,1.92,3.7,7.01,CRISIL Medium Duration Debt Index,,,,3.48,61,60,34,55,48,,,,DSP FMP 267-1246D-Reg(G),Debt : FTP/FMP,101,108,102,93,91,23,17,12,3.4,0.68,1.89,3.77,7.03,5.58,5.54,6.15,,,,,,,,
SBI FMP-66-1361D-Reg(G),46633,SBI Mutual Fund,0.71,1.89,3.84,7.09,CRISIL Medium Duration Debt Index,,,,3.59,40,37,56,34,34,,,,SBI FMP-66-1361D-Reg(G),Debt : FTP/FMP,101,108,102,93,91,23,17,12,3.4,0.68,1.89,3.77,7.03,5.58,5.54,6.15,,,,,,,,
Tata Nifty 50 ETF,41017,Tata Mutual Fund,5.13,7.27,10.64,26.46,NIFTY 50 - TRI,15.66,16.28,,8.86,97,87,116,95,92,46,28,,Tata Nifty 50 ETF,Equity : ETFs,141,150,149,141,129,78,56,23,14.66,5.7,11.67,17.27,38.95,18.53,17.89,13.05,,,,,,,,
HDFC Nifty G-Sec Jul 2031 Index Fund-Reg(G),46620,HDFC Mutual Fund,0.94,2.04,4.21,6.99,Nifty G-Sec July 2031 Index,,,,4.01,24,23,24,24,22,,,,HDFC Nifty G-Sec Jul 2031 Index Fund-Reg(G),Debt : Gilt,35,35,35,35,35,23,21,21,4.43,1.15,2.24,4.54,7.36,5.26,6.21,7.78,,,,,,,,
Franklin India Banking & PSU Debt Fund(G),28458,Franklin Templeton Mutual Fund,0.63,1.7,3.62,6.75,NIFTY Banking and PSU Debt Index,5.19,6.31,7.29,3.42,20,17,22,21,13,11,11,9,Franklin India Banking & PSU Debt Fund(G),Debt : Banking & PSU,27,27,27,27,26,22,16,15,3.54,0.67,1.76,3.74,6.71,5.18,6.42,7.2,,,,,,,,
UTI Innovation Fund-Reg(G),48238,UTI Mutual Fund,3.4,9.24,5.02,,NIFTY 500 - TRI,,,,7.4,56,59,58,54,,,,,UTI Innovation Fund-Reg(G),Equity : Thematic,56,62,60,54,46,31,15,8,20.14,6.08,16.84,22.74,48.39,21.91,22.44,15.57,,,,,,,,
UTI Gilt Fund-Reg(G),3560,UTI Mutual Fund,0.99,2.17,4.66,7.47,CRISIL Dynamic Gilt Index,5.32,6.13,8.24,4.6,15,21,18,14,14,11,11,8,UTI Gilt Fund-Reg(G),Debt : Gilt,35,35,35,35,35,23,21,21,4.43,1.15,2.24,4.54,7.36,5.26,6.21,7.78,,,,,,,,
Axis FTP-118-100D-Reg(G),48251,Axis Mutual Fund,0.56,1.8,,,CRISIL Ultra Short Term Debt Index,,,,1.47,100,100,88,,,,,,Axis FTP-118-100D-Reg(G),Debt : FTP/FMP,101,108,102,93,91,23,17,12,3.4,0.68,1.89,3.77,7.03,5.58,5.54,6.15,,,,,,,,
Mirae Asset Low Duration Fund-Reg Savings Plan(G),4609,Mirae Asset Mutual Fund,0.67,1.85,3.66,6.88,NIFTY Low Duration Debt Index,5.22,5.4,5.98,3.43,10,3,9,9,13,17,19,17,Mirae Asset Low Duration Fund-Reg Savings Plan(G),Debt : Low Duration,20,20,20,20,20,20,20,18,3.43,0.65,1.84,3.66,6.97,5.49,6.02,6.58,,,,,,,,
DSP NIFTY Next 50 Index Fund-Reg(G),41641,DSP Mutual Fund,7.79,23.62,38.02,64.83,NIFTY NEXT 50 - TRI,23.36,21.88,,33.85,4,26,22,9,14,7,1,,DSP NIFTY Next 50 Index Fund-Reg(G),Equity : Index Funds,105,121,114,103,95,42,23,18,17.56,6.41,14.83,20.52,45.84,18.76,16.7,12.85,,,,,,,,
360 ONE Flexicap Fund-Reg(G),47567,360 ONE Mutual Fund,8.3,21.8,25.95,,BSE 500 - TRI,,,,22.76,6,2,2,6,,,,,360 ONE Flexicap Fund-Reg(G),Equity : Flexi Cap,46,48,47,46,41,29,26,19,17.03,6.36,15.38,19.74,40.68,19.58,19.05,15.44,5.8,13.88,19.36,38.7,19.71,19.69,,32.2
Motilal Oswal S&P BSE Enhanced Value Index Fund-Reg(G),46741,Motilal Oswal Mutual Fund,3.72,17.74,33.22,93.76,BSE Enhanced Value Index - TRI,,,,28.46,23,117,51,17,1,,,,Motilal Oswal S&P BSE Enhanced Value Index Fund-Reg(G),Equity : Index Funds,105,121,114,103,95,42,23,18,17.56,6.41,14.83,20.52,45.84,18.76,16.7,12.85,,,,,,,,111.15
Kotak Consumption Fund-Reg(G),47948,Kotak Mahindra Mutual Fund,8.46,18.77,19.12,,Nifty India Consumption - TRI,,,,15.52,8,1,2,8,,,,,Kotak Consumption Fund-Reg(G),Equity : Thematic - Consumption,16,17,17,16,13,13,13,8,14.77,5.97,15.24,18.33,34.54,20.72,19.86,16.19,,,,,,,,
Motilal Oswal Nifty 200 Momentum 30 Index Fund-Reg(G),46320,Motilal Oswal Mutual Fund,8.09,22.42,32.72,70.38,Nifty200 Momentum 30 - TRI,,,,30.61,18,14,28,20,10,,,,Motilal Oswal Nifty 200 Momentum 30 Index Fund-Reg(G),Equity : Index Funds,105,121,114,103,95,42,23,18,17.56,6.41,14.83,20.52,45.84,18.76,16.7,12.85,,,,,,,,
Mahindra Manulife Low Duration Fund-Reg(G),36894,Mahindra Manulife Mutual Fund,0.61,1.81,3.55,6.88,CRISIL Low Duration Debt Index,5.11,5.42,,3.3,18,19,16,16,11,20,18,,Mahindra Manulife Low Duration Fund-Reg(G),Debt : Low Duration,20,20,20,20,20,20,20,18,3.43,0.65,1.84,3.66,6.97,5.49,6.02,6.58,,,,,,,,
SBI Magnum Comma Fund-Reg(G),2750,SBI Mutual Fund,2.46,14.66,20.52,45.71,NIFTY COMMODITIES - TRI,16.1,22.32,14.87,11.61,49,62,37,27,20,21,7,4,SBI Magnum Comma Fund-Reg(G),Equity : Thematic,56,62,60,54,46,31,15,8,20.14,6.08,16.84,22.74,48.39,21.91,22.44,15.57,,,,,,,,
ICICI Pru Nifty 10 yr Benchmark G-Sec ETF,47331,ICICI Prudential Mutual Fund,1.04,2.12,4.34,6.98,Nifty 10 yr Benchmark G-Sec,,,,4.36,2,5,5,5,2,,,,ICICI Pru Nifty 10 yr Benchmark G-Sec ETF,Debt : Gilt (10 Yr Constant Duration),6,6,6,6,6,4,4,2,4.34,1.08,2.19,4.43,6.96,4.68,6.37,8.47,1.74,2.32,4.63,7.38,4.15,5.27,,9.76
HDFC NIFTY200 Momentum 30 Index Fund-Reg(G),48466,HDFC Mutual Fund,7.91,22.28,,,Nifty200 Momentum 30 - TRI,,,,,,23,30,,,,,,HDFC NIFTY200 Momentum 30 Index Fund-Reg(G),Equity : Index Funds,105,121,114,103,95,42,23,18,17.56,6.41,14.83,20.52,45.84,18.76,16.7,12.85,,,,,,,,
Nippon India Nifty G-Sec Jun 2036 Maturity Index Fund-Reg(G),47190,Nippon India Mutual Fund,1.25,2.58,5.41,7.96,Nifty G-Sec Jun 2036 Index,,,,5.45,5,17,5,6,7,,,,Nippon India Nifty G-Sec Jun 2036 Maturity Index Fund-Reg(G),Debt : Gilt,35,35,35,35,35,23,21,21,4.43,1.15,2.24,4.54,7.36,5.26,6.21,7.78,,,,,,,,
Union Aggressive Hybrid Fund-Reg(G),44512,Union Mutual Fund,3.51,7.54,10.94,26.07,CRISIL Hybrid 35+65 - Aggressive Index,13.86,,,9.95,28,28,31,30,21,22,,,Union Aggressive Hybrid Fund-Reg(G),Hybrid : Equity Oriented,55,55,55,55,54,52,47,24,10.09,3.52,8.35,11.62,23.42,12.64,13.16,11.64,,,,,,,,
HDFC MNC Fund-Reg(G),47648,HDFC Mutual Fund,7.63,19.03,19.72,31.93,NIFTY MNC - TRI,,,,15.42,4,2,2,3,4,,,,HDFC MNC Fund-Reg(G),Equity : Thematic - MNC,5,5,5,5,5,4,4,3,14.87,6.89,16.59,18.1,31.78,15.68,17.36,14.48,,,,,,,,
Franklin India Equity Savings Fund(G),39645,Franklin Templeton Mutual Fund,1.37,3.39,5.45,11.91,NIFTY 50 Equity Savings Index,8.1,8.28,,5.04,49,52,50,49,48,46,43,,Franklin India Equity Savings Fund(G),Hybrid : Equity Oriented,55,55,55,55,54,52,47,24,10.09,3.52,8.35,11.62,23.42,12.64,13.16,11.64,,,,,,,,
UTI Dynamic Bond Fund-Reg(G),11896,UTI Mutual Fund,0.87,1.91,4.32,6.97,CRISIL Dynamic Bond Index,10.34,7.86,7.13,4.21,13,18,16,14,13,1,2,11,UTI Dynamic Bond Fund-Reg(G),Debt : Dynamic Bond,22,22,22,22,22,21,21,18,4.35,1.13,2.11,4.46,7.22,5.57,6.19,7.3,,,,,,,,
Samco Dynamic Asset Allocation Fund-Reg(G),48331,Samco Mutual Fund,5.45,7.97,,,NIFTY 50 Hybrid Composite Debt 50:50 Index,,,,7.4,29,2,13,,,,,,Samco Dynamic Asset Allocation Fund-Reg(G),Hybrid : Dynamic Asset Allocation,30,32,31,29,26,20,17,10,10.01,3.33,7.65,11.65,25.46,12.64,12.58,10.79,,,,,,,,
HDFC Nifty G-Sec Sep 2032 Index Fund-Reg(G),46872,HDFC Mutual Fund,1.07,2.23,4.48,7.19,Nifty G-Sec Sep 2032 Index,,,,4.24,21,19,17,20,18,,,,HDFC Nifty G-Sec Sep 2032 Index Fund-Reg(G),Debt : Gilt,35,35,35,35,35,23,21,21,4.43,1.15,2.24,4.54,7.36,5.26,6.21,7.78,,,,,,,,
HSBC Credit Risk Fund-Reg(G),8016,HSBC Mutual Fund,0.69,1.78,3.42,6.55,NIFTY Credit Risk Bond Index,5.59,5.04,6.37,3.22,15,14,11,15,13,12,11,6,HSBC Credit Risk Fund-Reg(G),Debt : Credit Risk,15,15,15,15,15,15,15,8,3.74,0.85,1.9,3.88,7.74,8.94,5.66,6.64,,,,,,,,
DSP BSE Liquid Rate ETF,48724,DSP Mutual Fund,0.53,,,,BSE Liquid Rate Index,,,,,,23,,,,,,,DSP BSE Liquid Rate ETF,Debt : ETFs,22,26,25,22,17,14,6,1,3.38,0.74,1.84,3.62,6.94,5.03,4.81,5.03,,,,,,,,
Tata Housing Opportunities Fund-Reg(G),46764,Tata Mutual Fund,8.18,21.82,16.23,41.01,Nifty Housing - TRI,,,,15.19,36,6,11,39,26,,,,Tata Housing Opportunities Fund-Reg(G),Equity : Thematic,56,62,60,54,46,31,15,8,20.14,6.08,16.84,22.74,48.39,21.91,22.44,15.57,,,,,,,,
Axis Global Innovation FoF-Reg(G),45539,Axis Mutual Fund,4.03,7.02,18.56,24.39,MSCI ACWI Net TRI,7.75,,,16.27,16,14,23,15,20,11,,,Axis Global Innovation FoF-Reg(G),FoFs : Overseas,57,58,58,57,56,38,26,23,9.03,0.24,5.19,10.93,16.06,3.69,9.53,5.83,,,,,,,,
Motilal Oswal Nifty Bank Index Fund-Reg(G),43789,Motilal Oswal Mutual Fund,6.85,11.05,7.34,17.47,NIFTY BANK - TRI,13.87,,,6.44,102,48,65,99,94,41,,,Motilal Oswal Nifty Bank Index Fund-Reg(G),Equity : Index Funds,105,121,114,103,95,42,23,18,17.56,6.41,14.83,20.52,45.84,18.76,16.7,12.85,,,,,,,,
Axis Value Fund-Reg(G),45838,Axis Mutual Fund,6.8,17.26,22.99,48.61,NIFTY 500 - TRI,,,,18.78,8,5,10,9,9,,,,Axis Value Fund-Reg(G),Equity : Value / Contra,22,22,22,22,22,19,17,14,18.52,6.19,15.58,22.01,48.96,23.44,21.7,16.74,,,,,,,,
Quant BFSI Fund-Reg(G),47989,Quant Mutual Fund,6.01,14.02,25.96,,Nifty Financial Services - TRI,,,,24.13,1,12,5,1,,,,,Quant BFSI Fund-Reg(G),Equity : Sectoral - Financial Services,18,20,20,18,15,12,11,8,10.51,5.93,12.27,10.84,26.91,16.61,13.38,13.91,,,,,,,,
PGIM India Large Cap Fund(G),758,PGIM India Mutual Fund,4.16,8.11,10.99,22.79,NIFTY 100 - TRI,11.67,13.34,12.08,8.17,36,32,36,35,36,32,31,26,PGIM India Large Cap Fund(G),Equity : Large Cap,36,37,37,36,36,33,31,28,14.33,5.28,11.81,17.41,35.23,17.29,16.81,13.9,,,,,,,,
Kotak Nifty SDL Plus AAA PSU Bond Jul 2028 60:40 Index Fund-Reg(G),46730,Kotak Mahindra Mutual Fund,0.74,1.78,3.85,6.76,Nifty SDL Plus AAA PSU Bond Jul 2028 60:40 Index,,,,3.65,33,42,49,29,40,,,,Kotak Nifty SDL Plus AAA PSU Bond Jul 2028 60:40 Index Fund-Reg(G),Debt : Medium to Long Duration,52,52,52,52,52,11,11,11,3.75,0.86,1.94,3.92,6.83,5.27,5.83,6.72,,,,,,,,
LIC MF Nifty Midcap 100 ETF,48473,LIC Mutual Fund,7.51,20.78,,,Nifty Midcap 100 - TRI,,,,,,31,30,,,,,,LIC MF Nifty Midcap 100 ETF,Equity : ETFs,141,150,149,141,129,78,56,23,14.66,5.7,11.67,17.27,38.95,18.53,17.89,13.05,,,,,,,,
Nippon India Nifty Pharma ETF,45584,Nippon India Mutual Fund,4.43,5.31,21.52,50.5,NIFTY PHARMA - TRI,,,,16.83,48,130,134,45,36,,,,Nippon India Nifty Pharma ETF,Equity : ETFs,141,150,149,141,129,78,56,23,14.66,5.7,11.67,17.27,38.95,18.53,17.89,13.05,,,,,,,,
Bajaj Finserv Arbitrage Fund-Reg(G),48064,Bajaj Finserv Mutual Fund,0.64,1.82,3.67,,Nifty 50 Arbitrage,,,,3.47,24,20,24,24,,,,,Bajaj Finserv Arbitrage Fund-Reg(G),Hybrid : Arbitrage,26,26,26,26,24,24,21,10,3.76,0.67,1.94,3.95,7.68,5.44,5.05,5.87,0.93,2.22,4.38,8.7,6.0,5.19,,8.62
SBI FMP-67-1467D-Reg(G),46703,SBI Mutual Fund,0.65,1.9,3.8,7.03,CRISIL Medium to Long Term Debt Index,,,,3.6,39,69,54,40,45,,,,SBI FMP-67-1467D-Reg(G),Debt : FTP/FMP,101,108,102,93,91,23,17,12,3.4,0.68,1.89,3.77,7.03,5.58,5.54,6.15,,,,,,,,
Axis CRISIL IBX 70:30 CPSE Plus SDL April 2025 Index Fund-Reg(G),45992,Axis Mutual Fund,0.67,1.87,3.72,6.94,CRISIL IBX 70:30 CPSE Plus SDL - April 2025,,,,3.5,18,26,13,15,9,,,,Axis CRISIL IBX 70:30 CPSE Plus SDL April 2025 Index Fund-Reg(G),Debt : Medium Duration,30,30,30,30,30,14,13,10,3.58,0.77,1.85,3.75,6.75,5.97,5.85,7.12,,,,,,,,
Mirae Asset S&P 500 Top 50 ETF FoF-Reg(G),45836,Mirae Asset Mutual Fund,0.55,13.91,25.59,37.16,S&P 500 Top 50 TRI,,,,24.05,2,26,2,2,2,,,,Mirae Asset S&P 500 Top 50 ETF FoF-Reg(G),FoFs : Overseas,57,58,58,57,56,38,26,23,9.03,0.24,5.19,10.93,16.06,3.69,9.53,5.83,,,,,,,,
Quantum Liquid Fund-Reg(G),19756,Quantum Mutual Fund,0.58,1.77,3.54,6.99,CRISIL Liquid Debt Index,5.46,4.84,5.89,3.29,31,33,31,31,30,31,31,28,Quantum Liquid Fund-Reg(G),Debt : Liquid,37,37,37,37,36,35,34,29,3.4,0.6,1.82,3.66,7.17,5.63,5.09,6.3,,,,,,,,
Kotak Silver ETF,46627,Kotak Mahindra Mutual Fund,2.09,19.03,19.06,20.79,Silver,,,,19.91,4,6,5,7,5,,,,Kotak Silver ETF,Gold : ETFs,25,28,28,25,22,11,11,11,15.8,-0.4,12.84,16.77,20.67,13.86,15.33,8.74,,,,,,,,
