ICICI Pru Global Stable Equity Fund(FOF)(G),16718,ICICI Prudential Mutual Fund,-2.63,-1.72,1.86,4.11,MSCI World,6.13,9.55,8.37,-0.25,48,43,54,48,45,18,14,6,ICICI Pru Global Stable Equity Fund(FOF)(G),FoFs : Overseas,57,58,58,57,56,38,26,23,9.03,0.24,5.19,10.93,16.06,3.69,9.53,5.83,,,,,,,,
TRUSTMF Short Duration Fund-Reg(G),45652,Trust Mutual Fund,0.67,1.7,3.27,6.29,CRISIL Short Duration Debt Index,,,,3.07,23,22,23,24,22,,,,TRUSTMF Short Duration Fund-Reg(G),Debt : Short Duration,26,27,26,26,26,22,21,19,3.22,0.67,1.73,3.48,6.45,5.55,6.0,6.81,,,,,,,,
Invesco India Gold ETF,8505,Invesco Mutual Fund,-2.3,9.2,14.53,20.05,Gold-India,13.87,15.37,8.58,13.14,13,24,17,21,15,3,4,10,Invesco India Gold ETF,Gold : ETFs,25,28,28,25,22,11,11,11,15.8,-0.4,12.84,16.77,20.67,13.86,15.33,8.74,,,,,,,,
Kotak FMP-326-175D(G),48420,Kotak Mahindra Mutual Fund,0.62,1.92,,,NIFTY Ultra Short Duration Debt Index,,,,3.63,35,86,31,,,,,,Kotak FMP-326-175D(G),Debt : FTP/FMP,101,108,102,93,91,23,17,12,3.4,0.68,1.89,3.77,7.03,5.58,5.54,6.15,,,,,,,,
Bandhan Regular Savings Fund-Reg(G),8465,Bandhan Mutual Fund,2.53,4.43,6.04,10.93,NIFTY AAA Short Duration Bond Index,6.1,6.62,7.48,5.42,13,4,9,13,14,17,16,14,Bandhan Regular Savings Fund-Reg(G),Hybrid : Debt Oriented (Conservative),19,19,19,19,19,19,18,18,6.05,2.0,4.42,6.8,12.95,8.83,8.59,8.26,,,,,,,,
Sundaram Global Brand Fund(G),3005,Sundaram Mutual Fund,-0.84,-1.6,5.9,12.64,MSCI AC World Index,6.76,12.62,6.83,4.98,39,33,53,40,30,17,9,10,Sundaram Global Brand Fund(G),FoFs : Overseas,57,58,58,57,56,38,26,23,9.03,0.24,5.19,10.93,16.06,3.69,9.53,5.83,,,,,,,,
Bandhan CRISIL IBX 90:10 SDL Plus Gilt - Nov 2026 Index Fund-Reg(G),46213,Bandhan Mutual Fund,0.71,1.85,3.82,6.96,CRISIL IBX 90:10 SDL Plus Gilt Index - November 2026,,,,3.67,28,43,38,36,14,,,,Bandhan CRISIL IBX 90:10 SDL Plus Gilt - Nov 2026 Index Fund-Reg(G),Debt : Medium to Long Duration,52,52,52,52,52,11,11,11,3.75,0.86,1.94,3.92,6.83,5.27,5.83,6.72,,,,,,,,
ICICI Pru Nifty Healthcare ETF,45383,ICICI Prudential Mutual Fund,4.37,6.44,21.45,45.83,Nifty Healthcare Index - TRI,14.12,,,17.11,46,132,124,47,42,66,,,ICICI Pru Nifty Healthcare ETF,Equity : ETFs,141,150,149,141,129,78,56,23,14.66,5.7,11.67,17.27,38.95,18.53,17.89,13.05,,,,,,,,
Axis Silver ETF,46369,Axis Mutual Fund,0.99,17.72,20.44,23.72,Silver,,,,18.55,10,11,9,5,1,,,,Axis Silver ETF,Gold : ETFs,25,28,28,25,22,11,11,11,15.8,-0.4,12.84,16.77,20.67,13.86,15.33,8.74,,,,,,,,
Mirae Asset Nifty Smallcap 250 Momentum Quality 100 ETF FoF-Reg(G),48497,Mirae Asset Mutual Fund,8.98,22.87,,,Nifty Smallcap250 Momentum Quality 100 - TRI,,,,,,1,4,,,,,,Mirae Asset Nifty Smallcap 250 Momentum Quality 100 ETF FoF-Reg(G),FoFs : Domestic,53,56,56,53,53,37,25,22,11.48,3.15,9.53,12.8,25.3,13.97,13.67,10.98,,,,,,,,
ICICI Pru India Equity (FOF)(G),44626,ICICI Prudential Mutual Fund,4.74,12.31,20.09,48.61,BSE 500 - TRI,24.33,,,18.78,8,13,17,7,5,2,,,ICICI Pru India Equity (FOF)(G),FoFs : Domestic,53,56,56,53,53,37,25,22,11.48,3.15,9.53,12.8,25.3,13.97,13.67,10.98,5.8,13.88,19.36,38.7,19.71,19.69,,32.2
SBI FMP-50-1843D-Reg(G),45842,SBI Mutual Fund,0.7,1.91,3.86,7.04,CRISIL Medium to Long Term Debt Index,,,,3.67,29,39,43,32,42,,,,SBI FMP-50-1843D-Reg(G),Debt : FTP/FMP,101,108,102,93,91,23,17,12,3.4,0.68,1.89,3.77,7.03,5.58,5.54,6.15,,,,,,,,
Kotak Nifty 100 Low Volatility 30 ETF,45688,Kotak Mahindra Mutual Fund,4.92,6.91,12.59,33.33,Nifty100 Low Volatility 30 - TRI,,,,9.55,79,107,118,79,68,,,,Kotak Nifty 100 Low Volatility 30 ETF,Equity : ETFs,141,150,149,141,129,78,56,23,14.66,5.7,11.67,17.27,38.95,18.53,17.89,13.05,,,,,,,,
Sundaram Arbitrage Fund(G),32098,Sundaram Mutual Fund,0.63,1.88,3.84,7.37,Nifty 50 Arbitrage - TRI,4.97,4.04,,3.58,22,22,20,21,20,21,21,,Sundaram Arbitrage Fund(G),Hybrid : Arbitrage,26,26,26,26,24,24,21,10,3.76,0.67,1.94,3.95,7.68,5.44,5.05,5.87,,,,,,,,
Nippon India ETF Nifty Infrastructure BeES,12859,Nippon India Mutual Fund,3.57,11.8,27.16,56.92,Nifty Infrastructure - TRI,26.71,21.95,10.89,21.38,33,141,64,31,31,8,11,20,Nippon India ETF Nifty Infrastructure BeES,Equity : ETFs,141,150,149,141,129,78,56,23,14.66,5.7,11.67,17.27,38.95,18.53,17.89,13.05,,,,,,,,
Union Dynamic Bond(G),16032,Union Mutual Fund,1.26,2.2,4.45,6.83,CRISIL Dynamic Bond Index,4.31,5.53,6.42,4.39,9,6,11,11,14,20,16,18,Union Dynamic Bond(G),Debt : Dynamic Bond,22,22,22,22,22,21,21,18,4.35,1.13,2.11,4.46,7.22,5.57,6.19,7.3,,,,,,,,
JM Focused Fund-Reg(G),4282,JM Financial Mutual Fund,2.59,16.2,23.75,46.95,BSE 500 - TRI,23.54,16.72,14.83,18.86,2,37,2,4,3,3,15,6,JM Focused Fund-Reg(G),Equity : Large Cap,36,37,37,36,36,33,31,28,14.33,5.28,11.81,17.41,35.23,17.29,16.81,13.9,5.8,13.88,19.36,38.7,19.71,19.69,,32.2
LIC MF Value Fund-Reg(G),39956,LIC Mutual Fund,8.06,14.91,18.44,40.66,NIFTY 500 - TRI,19.14,18.12,,17.29,16,3,13,17,21,16,15,,LIC MF Value Fund-Reg(G),Equity : Value / Contra,22,22,22,22,22,19,17,14,18.52,6.19,15.58,22.01,48.96,23.44,21.7,16.74,,,,,,,,
PGIM India Dynamic Bond Fund(G),15247,PGIM India Mutual Fund,1.29,2.49,4.88,7.46,CRISIL Dynamic Bond Index,4.93,5.66,7.6,4.82,5,5,3,5,7,16,13,7,PGIM India Dynamic Bond Fund(G),Debt : Dynamic Bond,22,22,22,22,22,21,21,18,4.35,1.13,2.11,4.46,7.22,5.57,6.19,7.3,,,,,,,,
WOC Pharma and Healthcare Fund-Reg(G),48472,WhiteOak Capital Mutual Fund,4.44,9.47,,,BSE Health Care - TRI,,,,,,4,3,,,,,,WOC Pharma and Healthcare Fund-Reg(G),Equity : Sectoral - Pharma,14,16,16,14,11,9,8,3,15.58,3.65,8.32,19.71,45.57,14.89,25.8,15.5,3.25,9.04,22.68,47.67,14.83,24.39,,35.08
ICICI Pru BSE 500 ETF FOF-Reg(G),45726,ICICI Prudential Mutual Fund,6.19,12.79,16.31,37.5,BSE 500 - TRI,,,,14.58,14,6,15,15,9,,,,ICICI Pru BSE 500 ETF FOF-Reg(G),FoFs : Domestic,53,56,56,53,53,37,25,22,11.48,3.15,9.53,12.8,25.3,13.97,13.67,10.98,5.8,13.88,19.36,38.7,19.71,19.69,,32.2
SBI FMP-43-1616D-Reg(G),45525,SBI Mutual Fund,0.66,1.83,3.79,7.05,CRISIL Medium Duration Debt Index,5.21,,,3.57,43,59,81,42,39,21,,,SBI FMP-43-1616D-Reg(G),Debt : FTP/FMP,101,108,102,93,91,23,17,12,3.4,0.68,1.89,3.77,7.03,5.58,5.54,6.15,,,,,,,,
WOC Balanced Hybrid Fund-Reg(G),48213,WhiteOak Capital Mutual Fund,3.45,7.98,10.4,,CRISIL Hybrid 50+50 - Moderate Index,,,,9.6,15,16,12,17,,,,,WOC Balanced Hybrid Fund-Reg(G),Hybrid : Dynamic Asset Allocation,30,32,31,29,26,20,17,10,10.01,3.33,7.65,11.65,25.46,12.64,12.58,10.79,,,,,,,,
SBI Magnum Childrens Benefit Fund-Savings Plan,2748,SBI Mutual Fund,3.14,6.95,8.94,19.12,NIFTY 50 Hybrid Composite Debt 15:85 Index,12.83,12.05,11.88,8.31,28,31,30,30,24,20,19,7,SBI Magnum Childrens Benefit Fund-Savings Plan,Hybrid : Solution Oriented,40,41,40,39,38,37,29,13,11.27,4.63,10.59,13.26,26.4,14.06,13.19,12.03,,,,,,,,
Edelweiss Emerging Markets Opp Eq. Offshore Fund-Reg(G),20281,Edelweiss Mutual Fund,-1.06,5.54,10.56,6.86,MSCI Emerging Market Index,-5.08,4.34,,7.38,33,37,32,30,41,32,21,,Edelweiss Emerging Markets Opp Eq. Offshore Fund-Reg(G),FoFs : Overseas,57,58,58,57,56,38,26,23,9.03,0.24,5.19,10.93,16.06,3.69,9.53,5.83,,,,,,,,
Nippon India Nifty G-Sec Oct 2028 Maturity Index Fund-Reg(G),47629,Nippon India Mutual Fund,0.85,1.95,3.66,6.83,Nifty G-Sec Oct 2028 Index,,,,3.52,48,21,22,48,30,,,,Nippon India Nifty G-Sec Oct 2028 Maturity Index Fund-Reg(G),Debt : Medium to Long Duration,52,52,52,52,52,11,11,11,3.75,0.86,1.94,3.92,6.83,5.27,5.83,6.72,,,,,,,,
SBI FMP-92-91D-Reg(G),48470,SBI Mutual Fund,0.58,1.92,,,CRISIL Liquid Debt Index,,,,,,92,29,,,,,,SBI FMP-92-91D-Reg(G),Debt : FTP/FMP,101,108,102,93,91,23,17,12,3.4,0.68,1.89,3.77,7.03,5.58,5.54,6.15,,,,,,,,
Tata Nifty G-Sec Dec 2026 Index Fund-Reg(G),47436,Tata Mutual Fund,0.74,1.84,3.56,6.59,Nifty G-sec Dec 2026 Index,,,,3.32,29,15,19,24,23,,,,Tata Nifty G-Sec Dec 2026 Index Fund-Reg(G),Debt : Medium Duration,30,30,30,30,30,14,13,10,3.58,0.77,1.85,3.75,6.75,5.97,5.85,7.12,,,,,,,,
ICICI Pru Nifty LargeMidcap 250 Index Fund-Reg(G),48643,ICICI Prudential Mutual Fund,6.75,15.03,,,NIFTY LargeMidcap 250 - TRI,,,,,,50,55,,,,,,ICICI Pru Nifty LargeMidcap 250 Index Fund-Reg(G),Equity : Index Funds,105,121,114,103,95,42,23,18,17.56,6.41,14.83,20.52,45.84,18.76,16.7,12.85,,,,,,,,
Canara Rob Dynamic Bond Fund-Reg(G),7792,Canara Robeco Mutual Fund,1.34,2.07,4.52,6.67,CRISIL Dynamic Bond Index,4.6,5.16,6.85,4.39,11,4,12,10,18,18,20,13,Canara Rob Dynamic Bond Fund-Reg(G),Debt : Dynamic Bond,22,22,22,22,22,21,21,18,4.35,1.13,2.11,4.46,7.22,5.57,6.19,7.3,,,,,,,,
Canara Rob Gilt Fund-Reg(G),538,Canara Robeco Mutual Fund,1.4,2.32,4.96,7.56,CRISIL Dynamic Gilt Index,5.1,5.7,7.69,4.84,9,7,16,9,13,15,15,12,Canara Rob Gilt Fund-Reg(G),Debt : Gilt,35,35,35,35,35,23,21,21,4.43,1.15,2.24,4.54,7.36,5.26,6.21,7.78,,,,,,,,
TRUSTMF Overnight Fund-Reg(G),45719,Trust Mutual Fund,0.55,1.65,3.3,6.73,CRISIL Liquid Overnight Index,,,,3.08,19,7,9,17,12,,,,TRUSTMF Overnight Fund-Reg(G),Debt : Overnight,35,35,35,35,32,27,16,3,3.07,0.54,1.63,3.29,6.71,5.33,4.68,5.73,,,,,,,,
LIC MF Short Duration Fund-Reg(G),34304,LIC Mutual Fund,0.66,1.75,3.53,6.29,CRISIL Short Duration Debt Index,4.33,5.24,,3.35,16,23,17,19,21,21,18,,LIC MF Short Duration Fund-Reg(G),Debt : Short Duration,26,27,26,26,26,22,21,19,3.22,0.67,1.73,3.48,6.45,5.55,6.0,6.81,,,,,,,,
Aditya Birla SL Retirement Fund-40-Reg(G),42770,Aditya Birla Sun Life Mutual Fund,5.4,10.69,11.76,28.31,CRISIL Hybrid 35+65 - Aggressive Index,11.18,11.72,,10.43,22,19,24,21,21,23,20,,Aditya Birla SL Retirement Fund-40-Reg(G),Hybrid : Solution Oriented,40,41,40,39,38,37,29,13,11.27,4.63,10.59,13.26,26.4,14.06,13.19,12.03,,,,,,,,
Union Medium Duration Fund-Reg(G),44157,Union Mutual Fund,0.72,1.71,3.62,6.38,CRISIL Medium Duration Debt Index,4.55,,,3.41,22,19,24,23,27,12,,,Union Medium Duration Fund-Reg(G),Debt : Medium Duration,30,30,30,30,30,14,13,10,3.58,0.77,1.85,3.75,6.75,5.97,5.85,7.12,,,,,,,,
Nippon India Nifty IT Index Fund-Reg(G),48568,Nippon India Mutual Fund,4.68,-5.04,,,NIFTY IT - TRI,,,,,,109,113,,,,,,Nippon India Nifty IT Index Fund-Reg(G),Equity : Index Funds,105,121,114,103,95,42,23,18,17.56,6.41,14.83,20.52,45.84,18.76,16.7,12.85,,,,,,,,
Aditya Birla SL Nifty Next 50 Index Fund-Reg(G),46360,Aditya Birla Sun Life Mutual Fund,6.55,24.3,36.03,62.59,NIFTY NEXT 50 - TRI,,,,33.64,11,55,11,15,22,,,,Aditya Birla SL Nifty Next 50 Index Fund-Reg(G),Equity : Index Funds,105,121,114,103,95,42,23,18,17.56,6.41,14.83,20.52,45.84,18.76,16.7,12.85,,,,,,,,
Nippon India Nifty Bank Index Fund-Reg(G),48148,Nippon India Mutual Fund,7.67,12.09,,,NIFTY BANK - TRI,,,,,,35,63,,,,,,Nippon India Nifty Bank Index Fund-Reg(G),Equity : Index Funds,105,121,114,103,95,42,23,18,17.56,6.41,14.83,20.52,45.84,18.76,16.7,12.85,,,,,,,,
Mirae Asset Nifty 100 ESG Sector Leaders FoF-Reg(G),45135,Mirae Asset Mutual Fund,4.84,7.72,11.62,29.25,Nifty100 ESG Sector Leaders - TRI,13.37,,,10.45,27,12,31,27,19,22,,,Mirae Asset Nifty 100 ESG Sector Leaders FoF-Reg(G),FoFs : Domestic,53,56,56,53,53,37,25,22,11.48,3.15,9.53,12.8,25.3,13.97,13.67,10.98,,,,,,,,
Aditya Birla SL FMP-UR-85D-Reg(G),48407,Aditya Birla Sun Life Mutual Fund,0.56,,,,CRISIL Liquid Debt Index,,,,1.49,97,101,,,,,,,Aditya Birla SL FMP-UR-85D-Reg(G),Debt : FTP/FMP,101,108,102,93,91,23,17,12,3.4,0.68,1.89,3.77,7.03,5.58,5.54,6.15,,,,,,,,
Axis NIFTY IT Index Fund-Reg(G),47983,Axis Mutual Fund,5.11,-1.62,1.28,,NIFTY IT - TRI,,,,-0.88,104,81,111,101,,,,,Axis NIFTY IT Index Fund-Reg(G),Equity : Index Funds,105,121,114,103,95,42,23,18,17.56,6.41,14.83,20.52,45.84,18.76,16.7,12.85,,,,,,,,
Kotak FMP-304-3119D(G),47401,Kotak Mahindra Mutual Fund,0.98,2.44,4.61,7.22,NIFTY Long Duration Debt Index,,,,4.45,1,2,1,1,11,,,,Kotak FMP-304-3119D(G),Debt : FTP/FMP,101,108,102,93,91,23,17,12,3.4,0.68,1.89,3.77,7.03,5.58,5.54,6.15,,,,,,,,
Samco ELSS Tax Saver Fund-Reg(G),46606,Samco Mutual Fund,8.23,16.46,14.33,38.38,NIFTY 500 - TRI,,,,10.82,55,3,26,50,34,,,,Samco ELSS Tax Saver Fund-Reg(G),Equity : Tax Saving (ELSS),60,60,60,60,60,55,53,27,15.84,6.16,15.48,18.81,40.06,21.41,20.92,15.37,,,,,,,,
Helios Overnight Fund-Reg(G),48295,Helios Mutual Fund,0.56,1.63,3.29,,CRISIL Liquid Overnight Index,,,,3.09,13,5,25,24,,,,,Helios Overnight Fund-Reg(G),Debt : Overnight,35,35,35,35,32,27,16,3,3.07,0.54,1.63,3.29,6.71,5.33,4.68,5.73,,,,,,,,
Navi Aggressive Hybrid Fund-Reg(G),39479,Navi Mutual Fund,5.58,8.58,10.92,24.0,CRISIL Hybrid 35+65 - Aggressive Index,14.41,12.76,,9.56,30,7,27,31,27,17,22,,Navi Aggressive Hybrid Fund-Reg(G),Hybrid : Equity Oriented,55,55,55,55,54,52,47,24,10.09,3.52,8.35,11.62,23.42,12.64,13.16,11.64,,,,,,,,
ICICI Pru Nifty 5 yr Benchmark G-SEC ETF,46440,ICICI Prudential Mutual Fund,0.8,1.92,3.64,6.7,Nifty 5 yr Benchmark G-Sec Index TRI,,,,3.45,49,35,27,49,43,,,,ICICI Pru Nifty 5 yr Benchmark G-SEC ETF,Debt : Medium to Long Duration,52,52,52,52,52,11,11,11,3.75,0.86,1.94,3.92,6.83,5.27,5.83,6.72,,,,,,,,
ICICI Pru Nifty Auto Index Fund-Reg(G),45995,ICICI Prudential Mutual Fund,8.52,23.58,43.49,70.39,NIFTY AUTO - TRI,,,,35.72,2,3,3,1,1,,,,ICICI Pru Nifty Auto Index Fund-Reg(G),Equity : Sectoral - Auto,6,7,6,6,4,1,1,1,32.18,8.14,23.12,37.61,63.12,30.65,24.36,16.45,,,,,,,,
Edelweiss US Value Equity Offshore Fund-Reg(G),21920,Edelweiss Mutual Fund,-1.99,1.8,7.57,13.94,Russell 1000 Index,9.57,12.88,10.05,6.75,36,41,44,39,28,8,8,3,Edelweiss US Value Equity Offshore Fund-Reg(G),FoFs : Overseas,57,58,58,57,56,38,26,23,9.03,0.24,5.19,10.93,16.06,3.69,9.53,5.83,,,,,,,,
ICICI Pru Strategic Metal and Energy Equity FoF-Reg(G),46205,ICICI Prudential Mutual Fund,-8.05,1.48,4.67,8.79,NYSE Arca Gold Miners Index,,,,3.66,42,56,46,44,35,,,,ICICI Pru Strategic Metal and Energy Equity FoF-Reg(G),FoFs : Overseas,57,58,58,57,56,38,26,23,9.03,0.24,5.19,10.93,16.06,3.69,9.53,5.83,,,,,,,,
Shriram Flexi Cap Fund-Reg(G),38781,Shriram Mutual Fund,5.93,13.62,19.81,45.29,NIFTY 500 - TRI,19.2,15.9,,17.17,21,31,31,22,10,12,24,,Shriram Flexi Cap Fund-Reg(G),Equity : Flexi Cap,46,48,47,46,41,29,26,19,17.03,6.36,15.38,19.74,40.68,19.58,19.05,15.44,,,,,,,,
PGIM India Emerging Markets Equity Fund(G),815,PGIM India Mutual Fund,-0.07,9.63,16.0,24.64,MSCI Emerging Market Index,-9.39,2.34,1.0,13.47,21,29,11,20,19,36,24,21,PGIM India Emerging Markets Equity Fund(G),FoFs : Overseas,57,58,58,57,56,38,26,23,9.03,0.24,5.19,10.93,16.06,3.69,9.53,5.83,,,,,,,,
UTI Gold ETF FoF-Reg(G),47003,UTI Mutual Fund,-2.45,8.98,15.0,19.18,Gold-India,,,,13.15,8,14,14,13,14,,,,UTI Gold ETF FoF-Reg(G),Gold : MFs,16,16,16,16,15,10,10,10,14.42,-0.7,11.72,16.24,20.55,13.8,15.21,8.31,,,,,,,,
Quantum Dynamic Bond Fund-Reg(G),37428,Quantum Mutual Fund,1.1,2.25,4.88,8.3,CRISIL Dynamic Bond Index,6.24,6.74,,4.91,4,13,9,4,4,4,4,,Quantum Dynamic Bond Fund-Reg(G),Debt : Dynamic Bond,22,22,22,22,22,21,21,18,4.35,1.13,2.11,4.46,7.22,5.57,6.19,7.3,,,,,,,,
PGIM India Corp Bond Fund(G),854,PGIM India Mutual Fund,0.64,1.7,3.55,6.27,CRISIL Composite Bond Index,4.99,6.12,6.54,3.39,18,16,19,18,21,13,15,11,PGIM India Corp Bond Fund(G),Debt : Corporate Bond,21,21,21,21,21,19,18,12,3.58,0.69,1.81,3.77,6.8,5.17,6.51,7.25,,,,,,,,
Bajaj Finserv Banking and PSU Fund-Reg(G),48214,Bajaj Finserv Mutual Fund,0.55,1.52,3.59,,NIFTY Banking and PSU Debt Index,,,,3.4,22,27,26,23,,,,,Bajaj Finserv Banking and PSU Fund-Reg(G),Debt : Banking & PSU,27,27,27,27,26,22,16,15,3.54,0.67,1.76,3.74,6.71,5.18,6.42,7.2,,,,,,,,
Edelweiss Gold and Silver ETF FoF-Reg(G),46800,Edelweiss Mutual Fund,0.98,14.72,17.21,19.82,Gold-India,,,,15.57,13,45,12,13,33,,,,Edelweiss Gold and Silver ETF FoF-Reg(G),FoFs : Domestic,53,56,56,53,53,37,25,22,11.48,3.15,9.53,12.8,25.3,13.97,13.67,10.98,,,,,,,,
Aditya Birla SL CRISIL IBX Gilt April 2033 Index Fund-Reg(G),48411,Aditya Birla Sun Life Mutual Fund,0.96,2.03,,,CRISIL IBX Gilt Index - April 2033,,,,4.14,20,17,19,,,,,,Aditya Birla SL CRISIL IBX Gilt April 2033 Index Fund-Reg(G),Debt : Long Duration,21,24,22,20,19,3,3,2,5.28,1.22,2.33,5.32,7.67,5.03,5.91,7.46,,,,,,,,
Edelweiss CRISIL IBX 50:50 Gilt Plus SDL June 2027 Index Fund-Reg(G),46999,Edelweiss Mutual Fund,0.91,1.98,3.79,6.83,CRISIL IBX 50:50 Gilt Plus SDL Index - June 2027,,,,3.56,47,17,20,42,29,,,,Edelweiss CRISIL IBX 50:50 Gilt Plus SDL June 2027 Index Fund-Reg(G),Debt : Medium to Long Duration,52,52,52,52,52,11,11,11,3.75,0.86,1.94,3.92,6.83,5.27,5.83,6.72,,,,,,,,
Mirae Asset Nifty AAA PSU Bond Plus SDL Apr 2026 50:50 Index Fund-Reg(G),47038,Mirae Asset Mutual Fund,0.62,1.82,3.72,6.86,Nifty AAA Bond Plus SDL Apr 2026 50:50 Index,,,,3.54,14,23,8,16,8,,,,Mirae Asset Nifty AAA PSU Bond Plus SDL Apr 2026 50:50 Index Fund-Reg(G),Debt : Banking & PSU,27,27,27,27,26,22,16,15,3.54,0.67,1.76,3.74,6.71,5.18,6.42,7.2,,,,,,,,
Quant Gilt Fund-Reg(G),47345,Quant Mutual Fund,0.78,1.8,3.7,6.13,CRISIL Dynamic Gilt Index,,,,3.52,28,31,32,28,34,,,,Quant Gilt Fund-Reg(G),Debt : Gilt,35,35,35,35,35,23,21,21,4.43,1.15,2.24,4.54,7.36,5.26,6.21,7.78,,,,,,,,
PGIM India Equity Savings Fund(G),845,PGIM India Mutual Fund,1.4,3.05,4.83,9.22,NIFTY 50 Equity Savings Index,6.83,7.37,8.35,4.25,53,51,52,52,52,50,46,21,PGIM India Equity Savings Fund(G),Hybrid : Equity Oriented,55,55,55,55,54,52,47,24,10.09,3.52,8.35,11.62,23.42,12.64,13.16,11.64,,,,,,,,
DSP Nifty SDL Plus G-Sec Sep 2027 50:50 Index Fund-Reg(G),47548,DSP Mutual Fund,0.8,1.91,3.85,6.93,Nifty SDL Plus G-Sec Sep 2027 50:50 Index,,,,3.66,32,38,29,30,19,,,,DSP Nifty SDL Plus G-Sec Sep 2027 50:50 Index Fund-Reg(G),Debt : Medium to Long Duration,52,52,52,52,52,11,11,11,3.75,0.86,1.94,3.92,6.83,5.27,5.83,6.72,,,,,,,,
Kotak Global Emerging Mkt Fund(G),2047,Kotak Mahindra Mutual Fund,-1.34,5.75,7.69,11.22,MSCI Emerging Market Index,-1.83,7.62,4.61,7.45,32,38,31,37,33,29,17,16,Kotak Global Emerging Mkt Fund(G),FoFs : Overseas,57,58,58,57,56,38,26,23,9.03,0.24,5.19,10.93,16.06,3.69,9.53,5.83,,,,,,,,
Bandhan Nifty200 Momentum 30 Index Fund-Reg(G),46608,Bandhan Mutual Fund,7.91,22.2,32.18,69.38,Nifty200 Momentum 30 - TRI,,,,30.45,20,22,33,21,11,,,,Bandhan Nifty200 Momentum 30 Index Fund-Reg(G),Equity : Index Funds,105,121,114,103,95,42,23,18,17.56,6.41,14.83,20.52,45.84,18.76,16.7,12.85,,,,,,,,
TRUSTMF Money Market Fund-Reg(G),46735,Trust Mutual Fund,0.64,1.82,3.64,7.05,CRISIL Money Market Index,,,,3.42,16,13,17,16,15,,,,TRUSTMF Money Market Fund-Reg(G),Debt : Money Market,22,22,22,22,21,17,15,13,3.5,0.64,1.84,3.72,7.17,5.7,5.72,6.67,,,,,,,,
Kotak Long Duration Fund-Reg(G),48538,Kotak Mahindra Mutual Fund,1.64,2.78,,,NIFTY Long Duration Debt Index,,,,,,6,4,,,,,,Kotak Long Duration Fund-Reg(G),Debt : Long Duration,21,24,22,20,19,3,3,2,5.28,1.22,2.33,5.32,7.67,5.03,5.91,7.46,,,,,,,,
HDFC Silver ETF FoF-Reg(G),46465,HDFC Mutual Fund,4.52,22.58,21.58,23.71,Silver,,,,20.51,1,2,1,1,1,,,,HDFC Silver ETF FoF-Reg(G),Gold : MFs,16,16,16,16,15,10,10,10,14.42,-0.7,11.72,16.24,20.55,13.8,15.21,8.31,,,,,,,,
Kotak FMP-308-1125D(G),47570,Kotak Mahindra Mutual Fund,0.65,1.94,3.76,7.22,NIFTY Medium Duration Debt Index,,,,3.57,42,64,24,46,10,,,,Kotak FMP-308-1125D(G),Debt : FTP/FMP,101,108,102,93,91,23,17,12,3.4,0.68,1.89,3.77,7.03,5.58,5.54,6.15,,,,,,,,
UTI Long Duration Fund-Reg(G),47733,UTI Mutual Fund,1.31,2.37,6.12,8.19,NIFTY Long Duration Debt Index,,,,6.53,5,8,9,5,5,,,,UTI Long Duration Fund-Reg(G),Debt : Long Duration,21,24,22,20,19,3,3,2,5.28,1.22,2.33,5.32,7.67,5.03,5.91,7.46,,,,,,,,
DSP Nifty Midcap 150 Quality 50 ETF,46157,DSP Mutual Fund,8.88,21.95,21.57,43.11,NIFTY Midcap150 Quality 50 - TRI,,,,19.05,41,4,23,44,44,,,,DSP Nifty Midcap 150 Quality 50 ETF,Equity : ETFs,141,150,149,141,129,78,56,23,14.66,5.7,11.67,17.27,38.95,18.53,17.89,13.05,,,,,,,,
Axis FTP-113-1228D-Reg(G),47799,Axis Mutual Fund,0.59,1.83,3.68,6.77,CRISIL Medium Duration Debt Index,,,,3.51,54,91,82,62,78,,,,Axis FTP-113-1228D-Reg(G),Debt : FTP/FMP,101,108,102,93,91,23,17,12,3.4,0.68,1.89,3.77,7.03,5.58,5.54,6.15,,,,,,,,
SBI Nifty 200 Quality 30 ETF,41015,SBI Mutual Fund,8.27,11.89,16.24,35.59,NIFTY200 Quality 30 - TRI,16.82,17.67,,11.75,70,10,63,67,58,28,24,,SBI Nifty 200 Quality 30 ETF,Equity : ETFs,141,150,149,141,129,78,56,23,14.66,5.7,11.67,17.27,38.95,18.53,17.89,13.05,,,,,,,,
Mirae Asset Nifty India Manufacturing ETF FoF-Reg(G),46053,Mirae Asset Mutual Fund,7.39,24.78,38.58,58.91,Nifty India Manufacturing - TRI,,,,31.11,2,3,1,1,3,,,,Mirae Asset Nifty India Manufacturing ETF FoF-Reg(G),FoFs : Domestic,53,56,56,53,53,37,25,22,11.48,3.15,9.53,12.8,25.3,13.97,13.67,10.98,,,,,,,,
Motilal Oswal Nifty 5 Year Benchmark G-Sec ETF,45196,Motilal Oswal Mutual Fund,0.77,1.88,3.58,6.7,Nifty 5 yr Benchmark G-Sec Index TRI,4.9,,,3.39,14,10,12,14,14,10,,,Motilal Oswal Nifty 5 Year Benchmark G-Sec ETF,Debt : ETFs,22,26,25,22,17,14,6,1,3.38,0.74,1.84,3.62,6.94,5.03,4.81,5.03,,,,,,,,
Navi Liquid Fund-Reg(G),8544,Navi Mutual Fund,0.57,1.72,3.42,6.87,CRISIL Liquid Debt Index,5.68,4.99,6.33,3.18,36,35,36,36,34,15,27,22,Navi Liquid Fund-Reg(G),Debt : Liquid,37,37,37,37,36,35,34,29,3.4,0.6,1.82,3.66,7.17,5.63,5.09,6.3,,,,,,,,
LIC MF Nifty Next 50 Index Fund(G),12836,LIC Mutual Fund,6.65,24.08,40.35,62.09,NIFTY NEXT 50 - TRI,22.96,21.13,15.69,33.65,10,52,14,4,26,12,4,2,LIC MF Nifty Next 50 Index Fund(G),Equity : Index Funds,105,121,114,103,95,42,23,18,17.56,6.41,14.83,20.52,45.84,18.76,16.7,12.85,,,,,,,,
Mirae Asset Nifty SDL June 2028 Index Fund-Reg(G),47763,Mirae Asset Mutual Fund,0.76,1.77,3.83,6.78,Nifty SDL June 2028 Index,,,,3.65,34,41,50,34,38,,,,Mirae Asset Nifty SDL June 2028 Index Fund-Reg(G),Debt : Medium to Long Duration,52,52,52,52,52,11,11,11,3.75,0.86,1.94,3.92,6.83,5.27,5.83,6.72,,,,,,,,
Edelweiss Europe Dynamic Equity Off-shore Fund-Reg(G),24618,Edelweiss Mutual Fund,-2.95,1.64,10.68,14.0,MSCI Europe Index (Total Return Net),6.99,11.87,6.17,8.29,29,45,45,29,27,15,10,11,Edelweiss Europe Dynamic Equity Off-shore Fund-Reg(G),FoFs : Overseas,57,58,58,57,56,38,26,23,9.03,0.24,5.19,10.93,16.06,3.69,9.53,5.83,,,,,,,,
Mirae Asset Nifty 8-13 yr G-Sec ETF,47899,Mirae Asset Mutual Fund,0.97,2.08,4.35,7.09,Nifty 8-13 yr G-Sec,,,,4.28,6,6,7,7,9,,,,Mirae Asset Nifty 8-13 yr G-Sec ETF,Debt : ETFs,22,26,25,22,17,14,6,1,3.38,0.74,1.84,3.62,6.94,5.03,4.81,5.03,0.99,2.22,4.51,7.38,5.01,6.09,,9.45
Aditya Birla SL US Treasury 1-3 year Bond ETFs FoF-Reg(G),48274,Aditya Birla Sun Life Mutual Fund,0.61,1.84,1.98,,Bloomberg US Treasury 1-3 Year Index,,,,1.47,21,18,15,21,,,,,Aditya Birla SL US Treasury 1-3 year Bond ETFs FoF-Reg(G),Debt : ETFs,22,26,25,22,17,14,6,1,3.38,0.74,1.84,3.62,6.94,5.03,4.81,5.03,,,,,,,,
Invesco India Nifty 50 ETF,12694,Invesco Mutual Fund,5.21,8.42,12.12,26.62,NIFTY 50 - TRI,15.74,15.95,13.25,8.85,99,79,95,90,88,42,41,14,Invesco India Nifty 50 ETF,Equity : ETFs,141,150,149,141,129,78,56,23,14.66,5.7,11.67,17.27,38.95,18.53,17.89,13.05,,,,,,,,
Sundaram LT Micro Cap Tax Adv Fund-Sr III-Reg(G),36026,Sundaram Mutual Fund,8.13,22.12,14.02,42.71,Nifty Smallcap 100,30.44,26.63,,12.66,43,4,4,52,25,4,10,,Sundaram LT Micro Cap Tax Adv Fund-Sr III-Reg(G),Equity : Tax Saving (ELSS),60,60,60,60,60,55,53,27,15.84,6.16,15.48,18.81,40.06,21.41,20.92,15.37,7.39,25.17,26.78,68.75,23.96,24.25,,42.62
SBI Nifty IT ETF,45110,SBI Mutual Fund,4.78,-4.9,-1.46,23.94,NIFTY IT - TRI,8.98,,,-0.57,136,116,146,139,96,76,,,SBI Nifty IT ETF,Equity : ETFs,141,150,149,141,129,78,56,23,14.66,5.7,11.67,17.27,38.95,18.53,17.89,13.05,,,,,,,,
UTI CRISIL SDL Maturity June 2027 Index Fund-Reg(G),47369,UTI Mutual Fund,0.83,1.98,4.04,7.05,CRISIL IBX SDL Index - June 2027,,,,3.78,19,28,19,14,8,,,,UTI CRISIL SDL Maturity June 2027 Index Fund-Reg(G),Debt : Medium to Long Duration,52,52,52,52,52,11,11,11,3.75,0.86,1.94,3.92,6.83,5.27,5.83,6.72,,,,,,,,
Motilal Oswal S&P BSE Enhanced Value ETF,46740,Motilal Oswal Mutual Fund,2.69,18.71,32.05,94.45,BSE Enhanced Value Index - TRI,,,,29.5,23,147,35,18,2,,,,Motilal Oswal S&P BSE Enhanced Value ETF,Equity : ETFs,141,150,149,141,129,78,56,23,14.66,5.7,11.67,17.27,38.95,18.53,17.89,13.05,,,,,,,,111.15
ICICI Pru Quant Fund(G),42805,ICICI Prudential Mutual Fund,4.88,11.9,17.38,36.46,BSE 200 - TRI,17.93,,,14.95,38,47,47,35,30,17,,,ICICI Pru Quant Fund(G),Equity : Thematic,56,62,60,54,46,31,15,8,20.14,6.08,16.84,22.74,48.39,21.91,22.44,15.57,5.4,12.35,18.25,36.32,18.83,18.88,,30.45
Mirae Asset Global Electric & Autonomous Vehicles ETFs FoF-Reg(G),46002,Mirae Asset Mutual Fund,-3.79,-1.38,-2.45,-11.19,Solactive Autonomous & Electric Vehicles Index - TRI,,,,-5.42,54,49,52,54,55,,,,Mirae Asset Global Electric & Autonomous Vehicles ETFs FoF-Reg(G),FoFs : Overseas,57,58,58,57,56,38,26,23,9.03,0.24,5.19,10.93,16.06,3.69,9.53,5.83,,,,,,,,
Mirae Asset Nifty MidSmallcap400 Momentum Quality 100 ETF FoF-Reg(G),48822,Mirae Asset Mutual Fund,,,,,Nifty MidSmallcap400 Momentum Quality 100 - TRI,,,,,,,,,,,,,Mirae Asset Nifty MidSmallcap400 Momentum Quality 100 ETF FoF-Reg(G),FoFs : Domestic,53,56,56,53,53,37,25,22,11.48,3.15,9.53,12.8,25.3,13.97,13.67,10.98,,,,,,,,
HDFC NIFTY Realty Index Fund-Reg(G),48654,HDFC Mutual Fund,15.24,,,,NIFTY REALTY - TRI,,,,,,1,,,,,,,HDFC NIFTY Realty Index Fund-Reg(G),Equity : Index Funds,105,121,114,103,95,42,23,18,17.56,6.41,14.83,20.52,45.84,18.76,16.7,12.85,,,,,,,,
Tata Nifty India Digital ETF,45944,Tata Mutual Fund,4.15,5.8,11.31,39.67,Nifty India Digital  - TRI,,,,11.58,71,138,130,92,45,,,,Tata Nifty India Digital ETF,Equity : ETFs,141,150,149,141,129,78,56,23,14.66,5.7,11.67,17.27,38.95,18.53,17.89,13.05,,,,,,,,
ICICI Pru Nifty Financial Services Ex-Bank ETF,47166,ICICI Prudential Mutual Fund,5.63,13.13,9.14,35.86,Nifty Financial Services Ex-Bank - TRI,,,,10.37,77,64,47,110,55,,,,ICICI Pru Nifty Financial Services Ex-Bank ETF,Equity : ETFs,141,150,149,141,129,78,56,23,14.66,5.7,11.67,17.27,38.95,18.53,17.89,13.05,,,,,,,,
ICICI Pru Nifty 100 ETF,22404,ICICI Prudential Mutual Fund,5.36,10.83,16.31,31.95,NIFTY 100 - TRI,16.39,16.44,13.54,12.61,63,69,74,65,74,32,27,7,ICICI Pru Nifty 100 ETF,Equity : ETFs,141,150,149,141,129,78,56,23,14.66,5.7,11.67,17.27,38.95,18.53,17.89,13.05,,,,,,,,
