Kotak Nifty SDL Jul 2026 Index Fund-Reg(G),46729,Kotak Mahindra Mutual Fund,0.68,1.86,4.03,6.84,Nifty SDL Jul 2026 Index,,,,3.46,25,47,10,49,10,,,,Kotak Nifty SDL Jul 2026 Index Fund-Reg(G),Debt : Medium to Long Duration,52,52,52,52,52,11,11,11,3.48,0.8,1.72,4.3,6.58,5.03,6.02,6.61,,,,,,,,
DSP FMP 268-1281D-Reg(G),47124,DSP Mutual Fund,0.69,1.91,4.05,6.99,CRISIL Medium Duration Debt Index,,,,3.47,32,36,17,35,26,,,,DSP FMP 268-1281D-Reg(G),Debt : FTP/FMP,101,108,102,93,91,22,17,12,3.23,0.68,1.85,4.01,6.93,5.51,5.65,6.16,,,,,,,,
SBI FMP-78-1170D-Reg(G),47638,SBI Mutual Fund,0.66,1.8,3.88,6.79,CRISIL Medium Duration Debt Index,,,,3.33,55,64,77,59,67,,,,SBI FMP-78-1170D-Reg(G),Debt : FTP/FMP,101,108,102,93,91,22,17,12,3.23,0.68,1.85,4.01,6.93,5.51,5.65,6.16,,,,,,,,
HSBC Nifty Next 50 Index Fund-Reg(G),33548,HSBC Mutual Fund,8.99,15.33,37.36,62.71,NIFTY NEXT 50 - TRI,20.74,,,30.25,9,24,16,7,19,13,,,HSBC Nifty Next 50 Index Fund-Reg(G),Equity : Index Funds,105,120,113,103,94,42,23,18,15.42,7.13,7.58,19.99,44.99,17.51,15.96,12.45,,,,,,,,
Quantum Gold Saving Fund-Reg(G),19961,Quantum Mutual Fund,-2.73,8.93,13.62,18.06,Gold-India,12.15,15.81,8.8,12.48,11,9,8,8,4,4,4,7,Quantum Gold Saving Fund-Reg(G),Gold : MFs,16,16,16,16,15,10,10,10,13.79,-1.06,11.5,14.84,18.03,12.11,15.74,8.78,,,,,,,,
ICICI Pru Global Stable Equity Fund(FOF)(G),16718,ICICI Prudential Mutual Fund,-0.98,-0.33,4.03,6.63,MSCI World,6.28,10.08,8.85,0.62,48,48,52,51,44,19,12,6,ICICI Pru Global Stable Equity Fund(FOF)(G),FoFs : Overseas,57,58,57,57,56,38,26,23,7.8,1.01,3.95,12.76,17.43,3.46,9.74,6.11,,,,,,,,
TRUSTMF Short Duration Fund-Reg(G),45652,Trust Mutual Fund,0.62,1.57,3.41,6.18,CRISIL Short Duration Debt Index,,,,2.87,23,20,23,25,22,,,,TRUSTMF Short Duration Fund-Reg(G),Debt : Short Duration,26,27,26,26,26,22,21,19,3.03,0.63,1.61,3.65,6.36,5.44,6.0,6.79,,,,,,,,
Invesco India Gold ETF,8505,Invesco Mutual Fund,-2.92,7.82,12.81,17.77,Gold-India,12.23,16.2,9.08,12.39,19,28,26,23,13,5,2,10,Invesco India Gold ETF,Gold : ETFs,25,28,28,24,22,11,11,11,15.11,0.29,13.51,16.08,18.43,12.23,16.05,9.26,,,,,,,,
Kotak FMP-326-175D(G),48420,Kotak Mahindra Mutual Fund,0.63,2.04,,,NIFTY Ultra Short Duration Debt Index,,,,3.51,26,82,4,,,,,,Kotak FMP-326-175D(G),Debt : FTP/FMP,101,108,102,93,91,22,17,12,3.23,0.68,1.85,4.01,6.93,5.51,5.65,6.16,,,,,,,,
Bandhan Regular Savings Fund-Reg(G),8465,Bandhan Mutual Fund,2.27,2.96,6.04,10.61,NIFTY AAA Short Duration Bond Index,5.76,6.51,7.28,4.62,13,5,8,12,14,18,16,15,Bandhan Regular Savings Fund-Reg(G),Hybrid : Debt Oriented (Conservative),19,19,19,19,19,19,18,18,5.39,2.02,2.8,6.6,12.56,8.49,8.4,8.11,,,,,,,,
Sundaram Global Brand Fund(G),3005,Sundaram Mutual Fund,-0.7,-0.27,7.72,16.08,MSCI AC World Index,6.71,12.88,7.06,5.02,40,44,50,44,28,17,9,9,Sundaram Global Brand Fund(G),FoFs : Overseas,57,58,57,57,56,38,26,23,7.8,1.01,3.95,12.76,17.43,3.46,9.74,6.11,,,,,,,,
Bandhan CRISIL IBX 90:10 SDL Plus Gilt - Nov 2026 Index Fund-Reg(G),46213,Bandhan Mutual Fund,0.66,1.83,4.05,6.8,CRISIL IBX 90:10 SDL Plus Gilt Index - November 2026,,,,3.45,27,50,18,47,12,,,,Bandhan CRISIL IBX 90:10 SDL Plus Gilt - Nov 2026 Index Fund-Reg(G),Debt : Medium to Long Duration,52,52,52,52,52,11,11,11,3.48,0.8,1.72,4.3,6.58,5.03,6.02,6.61,,,,,,,,
ICICI Pru Nifty Healthcare ETF,45383,ICICI Prudential Mutual Fund,5.65,3.5,20.81,49.17,Nifty Healthcare Index - TRI,12.85,,,16.26,46,83,116,49,41,67,,,ICICI Pru Nifty Healthcare ETF,Equity : ETFs,141,149,147,141,129,78,56,23,12.81,6.23,5.76,17.4,38.75,17.39,17.14,12.55,,,,,,,,
Axis Silver ETF,46369,Axis Mutual Fund,3.1,18.39,21.14,19.43,Silver,,,,18.01,10,11,11,1,6,,,,Axis Silver ETF,Gold : ETFs,25,28,28,24,22,11,11,11,15.11,0.29,13.51,16.08,18.43,12.23,16.05,9.26,,,,,,,,
Mirae Asset Nifty Smallcap 250 Momentum Quality 100 ETF FoF-Reg(G),48497,Mirae Asset Mutual Fund,8.38,10.21,,,Nifty Smallcap250 Momentum Quality 100 - TRI,,,,,,3,9,,,,,,Mirae Asset Nifty Smallcap 250 Momentum Quality 100 ETF FoF-Reg(G),FoFs : Domestic,53,56,56,53,53,37,25,22,10.32,3.71,6.68,12.94,24.73,13.27,13.22,10.79,,,,,,,,
SBI FMP-50-1843D-Reg(G),45842,SBI Mutual Fund,0.71,1.85,4.07,6.93,CRISIL Medium to Long Term Debt Index,,,,3.44,36,25,51,31,40,,,,SBI FMP-50-1843D-Reg(G),Debt : FTP/FMP,101,108,102,93,91,22,17,12,3.23,0.68,1.85,4.01,6.93,5.51,5.65,6.16,,,,,,,,
Kotak Nifty 100 Low Volatility 30 ETF,45688,Kotak Mahindra Mutual Fund,6.07,3.29,15.76,35.58,Nifty100 Low Volatility 30 - TRI,,,,9.47,75,59,119,70,61,,,,Kotak Nifty 100 Low Volatility 30 ETF,Equity : ETFs,141,149,147,141,129,78,56,23,12.81,6.23,5.76,17.4,38.75,17.39,17.14,12.55,,,,,,,,
Sundaram Arbitrage Fund(G),32098,Sundaram Mutual Fund,0.8,1.94,3.9,7.35,Nifty 50 Arbitrage - TRI,4.98,4.02,,3.43,22,21,22,21,21,21,21,,Sundaram Arbitrage Fund(G),Hybrid : Arbitrage,26,26,26,26,24,24,21,10,3.59,0.82,2.03,4.1,7.69,5.46,5.03,5.88,,,,,,,,
Nippon India ETF Nifty Infrastructure BeES,12859,Nippon India Mutual Fund,6.21,5.41,26.23,57.51,Nifty Infrastructure - TRI,25.48,21.62,10.04,20.89,30,51,59,31,24,8,6,20,Nippon India ETF Nifty Infrastructure BeES,Equity : ETFs,141,149,147,141,129,78,56,23,12.81,6.23,5.76,17.4,38.75,17.39,17.14,12.55,,,,,,,,
Union Dynamic Bond(G),16032,Union Mutual Fund,1.03,1.31,4.71,6.2,CRISIL Dynamic Bond Index,3.98,5.74,6.3,3.87,12,5,15,9,17,20,14,18,Union Dynamic Bond(G),Debt : Dynamic Bond,22,22,22,22,22,21,21,18,3.89,0.88,1.42,4.61,6.71,5.33,6.32,7.19,,,,,,,,
HSBC Conservative Hybrid Fund(G),1458,HSBC Mutual Fund,3.37,5.4,9.68,15.23,NIFTY 50 Hybrid Composite Debt 15:85 Index,8.44,8.68,7.83,8.69,1,1,1,1,4,9,9,11,HSBC Conservative Hybrid Fund(G),Hybrid : Debt Oriented (Conservative),19,19,19,19,19,19,18,18,5.39,2.02,2.8,6.6,12.56,8.49,8.4,8.11,,,,,,,,
JM Focused Fund-Reg(G),4282,JM Financial Mutual Fund,4.26,7.42,20.28,47.15,BSE 500 - TRI,22.25,15.68,13.97,16.6,4,37,8,6,3,3,18,11,JM Focused Fund-Reg(G),Equity : Large Cap,36,37,37,36,36,33,31,28,12.61,5.95,6.1,16.6,34.92,16.33,16.13,13.47,7.01,8.0,16.93,38.59,18.42,18.85,,28.67
LIC MF Value Fund-Reg(G),39956,LIC Mutual Fund,9.42,8.43,18.93,40.07,NIFTY 500 - TRI,17.58,17.11,,14.91,15,2,10,17,20,15,15,,LIC MF Value Fund-Reg(G),Equity : Value / Contra,22,22,22,22,22,18,17,14,16.31,6.99,7.58,20.83,47.9,22.25,20.71,16.25,,,,,,,,
PGIM India Dynamic Bond Fund(G),15247,PGIM India Mutual Fund,1.0,1.5,4.85,6.78,CRISIL Dynamic Bond Index,4.64,5.84,7.47,4.21,6,6,10,5,11,17,13,7,PGIM India Dynamic Bond Fund(G),Debt : Dynamic Bond,22,22,22,22,22,21,21,18,3.89,0.88,1.42,4.61,6.71,5.33,6.32,7.19,,,,,,,,
WOC Pharma and Healthcare Fund-Reg(G),48472,WhiteOak Capital Mutual Fund,4.37,5.16,,,BSE Health Care - TRI,,,,,,12,6,,,,,,WOC Pharma and Healthcare Fund-Reg(G),Equity : Sectoral - Pharma,14,16,16,13,11,9,8,3,14.83,5.1,4.45,20.13,49.88,13.89,25.16,15.75,5.22,4.53,21.02,51.95,13.48,23.54,,34.8
ICICI Pru BSE 500 ETF FOF-Reg(G),45726,ICICI Prudential Mutual Fund,6.78,7.01,16.71,36.58,BSE 500 - TRI,,,,12.57,14,4,16,14,8,,,,ICICI Pru BSE 500 ETF FOF-Reg(G),FoFs : Domestic,53,56,56,53,53,37,25,22,10.32,3.71,6.68,12.94,24.73,13.27,13.22,10.79,7.01,8.0,16.93,38.59,18.42,18.85,,28.67
SBI FMP-43-1616D-Reg(G),45525,SBI Mutual Fund,0.69,1.82,3.84,6.95,CRISIL Medium Duration Debt Index,5.18,,,3.36,49,38,71,64,36,20,,,SBI FMP-43-1616D-Reg(G),Debt : FTP/FMP,101,108,102,93,91,22,17,12,3.23,0.68,1.85,4.01,6.93,5.51,5.65,6.16,,,,,,,,
WOC Balanced Hybrid Fund-Reg(G),48213,WhiteOak Capital Mutual Fund,3.48,4.79,10.18,,CRISIL Hybrid 50+50 - Moderate Index,,,,8.07,17,16,10,15,,,,,WOC Balanced Hybrid Fund-Reg(G),Hybrid : Dynamic Asset Allocation,30,32,31,28,26,20,17,10,8.61,3.49,3.93,11.37,25.04,12.02,12.16,10.48,,,,,,,,
SBI Magnum Childrens Benefit Fund-Savings Plan,2748,SBI Mutual Fund,2.98,4.31,8.96,18.28,NIFTY 50 Hybrid Composite Debt 15:85 Index,12.28,11.88,11.65,7.19,26,31,29,26,25,21,17,7,SBI Magnum Childrens Benefit Fund-Savings Plan,Hybrid : Solution Oriented,40,41,40,39,38,37,29,13,9.61,4.89,6.11,12.19,25.66,13.3,12.67,11.76,,,,,,,,
Edelweiss Emerging Markets Opp Eq. Offshore Fund-Reg(G),20281,Edelweiss Mutual Fund,-0.9,3.48,10.4,7.07,MSCI Emerging Market Index,-6.24,4.09,,5.11,39,45,31,36,42,32,21,,Edelweiss Emerging Markets Opp Eq. Offshore Fund-Reg(G),FoFs : Overseas,57,58,57,57,56,38,26,23,7.8,1.01,3.95,12.76,17.43,3.46,9.74,6.11,,,,,,,,
Nippon India Nifty G-Sec Oct 2028 Maturity Index Fund-Reg(G),47629,Nippon India Mutual Fund,0.85,1.8,4.26,6.56,Nifty G-Sec Oct 2028 Index,,,,3.3,48,13,23,34,38,,,,Nippon India Nifty G-Sec Oct 2028 Maturity Index Fund-Reg(G),Debt : Medium to Long Duration,52,52,52,52,52,11,11,11,3.48,0.8,1.72,4.3,6.58,5.03,6.02,6.61,,,,,,,,
SBI FMP-92-91D-Reg(G),48470,SBI Mutual Fund,0.58,1.92,,,CRISIL Liquid Debt Index,,,,,,91,14,,,,,,SBI FMP-92-91D-Reg(G),Debt : FTP/FMP,101,108,102,93,91,22,17,12,3.23,0.68,1.85,4.01,6.93,5.51,5.65,6.16,,,,,,,,
Tata Nifty G-Sec Dec 2026 Index Fund-Reg(G),47436,Tata Mutual Fund,0.67,1.73,3.92,6.56,Nifty G-sec Dec 2026 Index,,,,3.09,29,21,17,17,21,,,,Tata Nifty G-Sec Dec 2026 Index Fund-Reg(G),Debt : Medium Duration,30,30,30,30,30,14,13,10,3.33,0.69,1.71,3.97,6.58,5.79,5.9,7.06,,,,,,,,
ICICI Pru Nifty LargeMidcap 250 Index Fund-Reg(G),48643,ICICI Prudential Mutual Fund,7.12,,,,NIFTY LargeMidcap 250 - TRI,,,,,,56,,,,,,,ICICI Pru Nifty LargeMidcap 250 Index Fund-Reg(G),Equity : Index Funds,105,120,113,103,94,42,23,18,15.42,7.13,7.58,19.99,44.99,17.51,15.96,12.45,,,,,,,,
Canara Rob Dynamic Bond Fund-Reg(G),7792,Canara Robeco Mutual Fund,0.98,1.18,4.6,6.0,CRISIL Dynamic Bond Index,4.34,5.36,6.72,3.84,13,8,19,13,20,18,20,13,Canara Rob Dynamic Bond Fund-Reg(G),Debt : Dynamic Bond,22,22,22,22,22,21,21,18,3.89,0.88,1.42,4.61,6.71,5.33,6.32,7.19,,,,,,,,
TRUSTMF Overnight Fund-Reg(G),45719,Trust Mutual Fund,0.56,1.65,3.31,6.75,CRISIL Liquid Overnight Index,,,,2.93,17,3,10,16,9,,,,TRUSTMF Overnight Fund-Reg(G),Debt : Overnight,35,35,35,35,32,27,16,3,2.92,0.54,1.63,3.3,6.72,5.3,4.68,5.74,,,,,,,,
LIC MF Short Duration Fund-Reg(G),34304,LIC Mutual Fund,0.68,1.7,3.75,6.2,CRISIL Short Duration Debt Index,4.2,5.29,,3.17,15,5,10,17,21,21,18,,LIC MF Short Duration Fund-Reg(G),Debt : Short Duration,26,27,26,26,26,22,21,19,3.03,0.63,1.61,3.65,6.36,5.44,6.0,6.79,,,,,,,,
Aditya Birla SL Retirement Fund-40-Reg(G),42770,Aditya Birla Sun Life Mutual Fund,5.87,6.15,11.69,27.68,CRISIL Hybrid 35+65 - Aggressive Index,10.36,10.91,,8.98,21,17,20,21,18,24,20,,Aditya Birla SL Retirement Fund-40-Reg(G),Hybrid : Solution Oriented,40,41,40,39,38,37,29,13,9.61,4.89,6.11,12.19,25.66,13.3,12.67,11.76,,,,,,,,
Union Medium Duration Fund-Reg(G),44157,Union Mutual Fund,0.7,1.48,3.92,6.19,CRISIL Medium Duration Debt Index,4.34,,,3.16,23,12,28,18,27,12,,,Union Medium Duration Fund-Reg(G),Debt : Medium Duration,30,30,30,30,30,14,13,10,3.33,0.69,1.71,3.97,6.58,5.79,5.9,7.06,,,,,,,,
Nippon India FHF-XLV-4-1111D(G),47822,Nippon India Mutual Fund,0.66,1.85,3.94,6.82,CRISIL Medium Duration Debt Index,,,,3.26,66,68,52,50,61,,,,Nippon India FHF-XLV-4-1111D(G),Debt : FTP/FMP,101,108,102,93,91,22,17,12,3.23,0.68,1.85,4.01,6.93,5.51,5.65,6.16,,,,,,,,
Nippon India Nifty IT Index Fund-Reg(G),48568,Nippon India Mutual Fund,5.46,-6.35,,,NIFTY IT - TRI,,,,,,98,112,,,,,,Nippon India Nifty IT Index Fund-Reg(G),Equity : Index Funds,105,120,113,103,94,42,23,18,15.42,7.13,7.58,19.99,44.99,17.51,15.96,12.45,,,,,,,,
Aditya Birla SL Nifty Next 50 Index Fund-Reg(G),46360,Aditya Birla Sun Life Mutual Fund,9.08,15.37,37.31,62.61,NIFTY NEXT 50 - TRI,,,,30.21,12,16,12,11,21,,,,Aditya Birla SL Nifty Next 50 Index Fund-Reg(G),Equity : Index Funds,105,120,113,103,94,42,23,18,15.42,7.13,7.58,19.99,44.99,17.51,15.96,12.45,,,,,,,,
Nippon India Nifty Bank Index Fund-Reg(G),48148,Nippon India Mutual Fund,5.01,4.34,,,NIFTY BANK - TRI,,,,,,110,68,,,,,,Nippon India Nifty Bank Index Fund-Reg(G),Equity : Index Funds,105,120,113,103,94,42,23,18,15.42,7.13,7.58,19.99,44.99,17.51,15.96,12.45,,,,,,,,
Mirae Asset Nifty 100 ESG Sector Leaders FoF-Reg(G),45135,Mirae Asset Mutual Fund,5.79,4.35,12.78,29.37,Nifty100 ESG Sector Leaders - TRI,12.57,,,9.13,26,10,31,26,19,22,,,Mirae Asset Nifty 100 ESG Sector Leaders FoF-Reg(G),FoFs : Domestic,53,56,56,53,53,37,25,22,10.32,3.71,6.68,12.94,24.73,13.27,13.22,10.79,,,,,,,,
Aditya Birla SL FMP-UR-85D-Reg(G),48407,Aditya Birla Sun Life Mutual Fund,0.56,,,,CRISIL Liquid Debt Index,,,,1.49,97,98,,,,,,,Aditya Birla SL FMP-UR-85D-Reg(G),Debt : FTP/FMP,101,108,102,93,91,22,17,12,3.23,0.68,1.85,4.01,6.93,5.51,5.65,6.16,,,,,,,,
Axis NIFTY IT Index Fund-Reg(G),47983,Axis Mutual Fund,5.45,-6.32,4.07,,NIFTY IT - TRI,,,,-2.05,104,103,111,103,,,,,Axis NIFTY IT Index Fund-Reg(G),Equity : Index Funds,105,120,113,103,94,42,23,18,15.42,7.13,7.58,19.99,44.99,17.51,15.96,12.45,,,,,,,,
Kotak FMP-304-3119D(G),47401,Kotak Mahindra Mutual Fund,1.01,1.96,5.35,6.76,NIFTY Long Duration Debt Index,,,,4.18,2,1,8,1,70,,,,Kotak FMP-304-3119D(G),Debt : FTP/FMP,101,108,102,93,91,22,17,12,3.23,0.68,1.85,4.01,6.93,5.51,5.65,6.16,,,,,,,,
Samco ELSS Tax Saver Fund-Reg(G),46606,Samco Mutual Fund,8.99,8.74,11.77,36.0,NIFTY 500 - TRI,,,,8.51,55,7,27,55,34,,,,Samco ELSS Tax Saver Fund-Reg(G),Equity : Tax Saving (ELSS),60,60,60,60,59,55,53,27,13.62,6.66,8.37,17.37,39.14,20.15,19.98,14.9,,,,,,,,
Helios Overnight Fund-Reg(G),48295,Helios Mutual Fund,0.54,1.63,3.3,,CRISIL Liquid Overnight Index,,,,2.92,24,30,25,23,,,,,Helios Overnight Fund-Reg(G),Debt : Overnight,35,35,35,35,32,27,16,3,2.92,0.54,1.63,3.3,6.72,5.3,4.68,5.74,,,,,,,,
Navi Aggressive Hybrid Fund-Reg(G),39479,Navi Mutual Fund,5.17,4.4,10.4,23.23,CRISIL Hybrid 35+65 - Aggressive Index,13.56,12.11,,7.88,30,15,28,31,26,18,25,,Navi Aggressive Hybrid Fund-Reg(G),Hybrid : Equity Oriented,55,55,55,55,54,52,47,24,8.79,3.75,4.71,11.01,22.91,12.04,12.69,11.38,,,,,,,,
ICICI Pru Nifty 5 yr Benchmark G-SEC ETF,46440,ICICI Prudential Mutual Fund,0.75,1.67,4.18,6.57,Nifty 5 yr Benchmark G-Sec Index TRI,,,,3.18,50,42,38,38,36,,,,ICICI Pru Nifty 5 yr Benchmark G-SEC ETF,Debt : Medium to Long Duration,52,52,52,52,52,11,11,11,3.48,0.8,1.72,4.3,6.58,5.03,6.02,6.61,,,,,,,,
ICICI Pru Nifty Auto Index Fund-Reg(G),45995,ICICI Prudential Mutual Fund,9.39,18.08,39.97,70.4,NIFTY AUTO - TRI,,,,34.86,1,1,1,1,1,,,,ICICI Pru Nifty Auto Index Fund-Reg(G),Equity : Sectoral - Auto,6,7,6,6,4,1,1,1,30.23,8.54,16.28,34.57,62.2,28.44,23.32,16.48,,,,,,,,
Edelweiss US Value Equity Offshore Fund-Reg(G),21920,Edelweiss Mutual Fund,-1.33,2.02,11.54,15.54,Russell 1000 Index,8.78,13.13,10.4,6.91,31,51,43,31,29,9,8,3,Edelweiss US Value Equity Offshore Fund-Reg(G),FoFs : Overseas,57,58,57,57,56,38,26,23,7.8,1.01,3.95,12.76,17.43,3.46,9.74,6.11,,,,,,,,
ICICI Pru Strategic Metal and Energy Equity FoF-Reg(G),46205,ICICI Prudential Mutual Fund,-3.64,6.55,10.98,10.26,NYSE Arca Gold Miners Index,,,,6.01,35,54,12,34,36,,,,ICICI Pru Strategic Metal and Energy Equity FoF-Reg(G),FoFs : Overseas,57,58,57,57,56,38,26,23,7.8,1.01,3.95,12.76,17.43,3.46,9.74,6.11,,,,,,,,
Shriram Flexi Cap Fund-Reg(G),38781,Shriram Mutual Fund,6.07,4.77,19.24,42.52,NIFTY 500 - TRI,17.86,14.98,,14.55,20,30,44,20,13,12,23,,Shriram Flexi Cap Fund-Reg(G),Equity : Flexi Cap,46,48,47,46,41,29,26,19,14.39,6.55,8.17,18.15,39.39,18.39,18.14,14.93,,,,,,,,
PGIM India Emerging Markets Equity Fund(G),815,PGIM India Mutual Fund,2.96,6.19,15.77,26.47,MSCI Emerging Market Index,-8.79,2.09,0.83,10.9,20,15,14,21,18,34,24,21,PGIM India Emerging Markets Equity Fund(G),FoFs : Overseas,57,58,57,57,56,38,26,23,7.8,1.01,3.95,12.76,17.43,3.46,9.74,6.11,,,,,,,,
UTI Gold ETF FoF-Reg(G),47003,UTI Mutual Fund,-2.61,8.92,13.56,17.66,Gold-India,,,,12.61,9,8,9,9,7,,,,UTI Gold ETF FoF-Reg(G),Gold : MFs,16,16,16,16,15,10,10,10,13.79,-1.06,11.5,14.84,18.03,12.11,15.74,8.78,,,,,,,,
PGIM India Corp Bond Fund(G),854,PGIM India Mutual Fund,0.61,1.57,3.64,6.15,CRISIL Composite Bond Index,4.85,6.23,6.5,3.19,18,19,21,19,19,12,15,11,PGIM India Corp Bond Fund(G),Debt : Corporate Bond,21,21,21,21,21,19,18,12,3.35,0.67,1.72,3.88,6.64,5.03,6.57,7.21,,,,,,,,
Motilal Oswal Multi Asset Fund-Reg(G),45017,Motilal Oswal Mutual Fund,1.76,1.85,5.12,14.63,CRISIL Short Term Bond Index,6.93,,,4.73,16,23,23,16,13,10,,,Motilal Oswal Multi Asset Fund-Reg(G),Hybrid : Multi Asset Allocation,17,24,23,17,13,10,7,7,10.94,3.37,5.71,13.54,28.51,15.79,17.58,12.58,,,,,,,,
Bajaj Finserv Banking and PSU Fund-Reg(G),48214,Bajaj Finserv Mutual Fund,0.66,1.52,3.76,,NIFTY Banking and PSU Debt Index,,,,3.22,22,14,26,21,,,,,Bajaj Finserv Banking and PSU Fund-Reg(G),Debt : Banking & PSU,27,27,27,27,26,22,16,15,3.33,0.66,1.7,3.86,6.58,5.04,6.5,7.18,,,,,,,,
Edelweiss Gold and Silver ETF FoF-Reg(G),46800,Edelweiss Mutual Fund,2.06,15.74,16.89,17.94,Gold-India,,,,16.07,10,40,7,13,37,,,,Edelweiss Gold and Silver ETF FoF-Reg(G),FoFs : Domestic,53,56,56,53,53,37,25,22,10.32,3.71,6.68,12.94,24.73,13.27,13.22,10.79,,,,,,,,
Aditya Birla SL CRISIL IBX Gilt April 2033 Index Fund-Reg(G),48411,Aditya Birla Sun Life Mutual Fund,0.82,1.51,,,CRISIL IBX Gilt Index - April 2033,,,,3.75,20,22,14,,,,,,Aditya Birla SL CRISIL IBX Gilt April 2033 Index Fund-Reg(G),Debt : Long Duration,21,24,21,20,19,3,3,2,4.75,1.08,1.65,5.83,7.08,4.68,6.29,7.32,,,,,,,,
Edelweiss CRISIL IBX 50:50 Gilt Plus SDL June 2027 Index Fund-Reg(G),46999,Edelweiss Mutual Fund,0.77,1.8,4.11,6.66,CRISIL IBX 50:50 Gilt Plus SDL Index - June 2027,,,,3.31,47,37,21,39,31,,,,Edelweiss CRISIL IBX 50:50 Gilt Plus SDL June 2027 Index Fund-Reg(G),Debt : Medium to Long Duration,52,52,52,52,52,11,11,11,3.48,0.8,1.72,4.3,6.58,5.03,6.02,6.61,,,,,,,,
Mirae Asset Nifty AAA PSU Bond Plus SDL Apr 2026 50:50 Index Fund-Reg(G),47038,Mirae Asset Mutual Fund,0.65,1.84,3.91,6.77,Nifty AAA Bond Plus SDL Apr 2026 50:50 Index,,,,3.37,8,17,2,7,6,,,,Mirae Asset Nifty AAA PSU Bond Plus SDL Apr 2026 50:50 Index Fund-Reg(G),Debt : Banking & PSU,27,27,27,27,26,22,16,15,3.33,0.66,1.7,3.86,6.58,5.04,6.5,7.18,,,,,,,,
Quant Gilt Fund-Reg(G),47345,Quant Mutual Fund,0.67,1.59,4.02,5.92,CRISIL Dynamic Gilt Index,,,,3.26,28,33,14,30,34,,,,Quant Gilt Fund-Reg(G),Debt : Gilt,35,35,35,35,35,23,21,21,3.96,0.94,1.55,4.82,6.89,4.96,6.43,7.62,,,,,,,,
PGIM India Equity Savings Fund(G),845,PGIM India Mutual Fund,1.43,2.44,4.79,9.17,NIFTY 50 Equity Savings Index,6.63,7.27,8.3,3.73,53,53,46,53,52,50,46,21,PGIM India Equity Savings Fund(G),Hybrid : Equity Oriented,55,55,55,55,54,52,47,24,8.79,3.75,4.71,11.01,22.91,12.04,12.69,11.38,,,,,,,,
DSP Nifty SDL Plus G-Sec Sep 2027 50:50 Index Fund-Reg(G),47548,DSP Mutual Fund,0.82,1.86,4.3,6.83,Nifty SDL Plus G-Sec Sep 2027 50:50 Index,,,,3.41,35,26,12,24,11,,,,DSP Nifty SDL Plus G-Sec Sep 2027 50:50 Index Fund-Reg(G),Debt : Medium to Long Duration,52,52,52,52,52,11,11,11,3.48,0.8,1.72,4.3,6.58,5.03,6.02,6.61,,,,,,,,
Kotak Global Emerging Mkt Fund(G),2047,Kotak Mahindra Mutual Fund,-0.94,2.63,8.64,11.88,MSCI Emerging Market Index,-2.31,7.65,4.5,5.76,36,47,35,41,34,29,17,17,Kotak Global Emerging Mkt Fund(G),FoFs : Overseas,57,58,57,57,56,38,26,23,7.8,1.01,3.95,12.76,17.43,3.46,9.74,6.11,,,,,,,,
Bandhan Nifty200 Momentum 30 Index Fund-Reg(G),46608,Bandhan Mutual Fund,8.22,11.03,32.12,66.51,Nifty200 Momentum 30 - TRI,,,,28.54,19,39,30,21,12,,,,Bandhan Nifty200 Momentum 30 Index Fund-Reg(G),Equity : Index Funds,105,120,113,103,94,42,23,18,15.42,7.13,7.58,19.99,44.99,17.51,15.96,12.45,,,,,,,,
TRUSTMF Money Market Fund-Reg(G),46735,Trust Mutual Fund,0.58,1.87,3.66,7.05,CRISIL Money Market Index,,,,3.26,16,11,16,16,15,,,,TRUSTMF Money Market Fund-Reg(G),Debt : Money Market,22,22,22,22,21,17,14,13,3.33,0.58,1.9,3.73,7.18,5.66,5.76,6.67,,,,,,,,
Kotak Long Duration Fund-Reg(G),48538,Kotak Mahindra Mutual Fund,1.39,,,,NIFTY Long Duration Debt Index,,,,,,3,,,,,,,Kotak Long Duration Fund-Reg(G),Debt : Long Duration,21,24,21,20,19,3,3,2,4.75,1.08,1.65,5.83,7.08,4.68,6.29,7.32,,,,,,,,
HDFC Silver ETF FoF-Reg(G),46465,HDFC Mutual Fund,5.67,22.93,20.35,19.87,Silver,,,,19.13,2,2,1,2,2,,,,HDFC Silver ETF FoF-Reg(G),Gold : MFs,16,16,16,16,15,10,10,10,13.79,-1.06,11.5,14.84,18.03,12.11,15.74,8.78,,,,,,,,
Kotak FMP-308-1125D(G),47570,Kotak Mahindra Mutual Fund,0.67,1.97,3.86,7.29,NIFTY Medium Duration Debt Index,,,,3.36,48,57,7,62,7,,,,Kotak FMP-308-1125D(G),Debt : FTP/FMP,101,108,102,93,91,22,17,12,3.23,0.68,1.85,4.01,6.93,5.51,5.65,6.16,,,,,,,,
UTI Long Duration Fund-Reg(G),47733,UTI Mutual Fund,1.18,1.29,7.13,7.53,NIFTY Long Duration Debt Index,,,,5.9,5,7,21,4,4,,,,UTI Long Duration Fund-Reg(G),Debt : Long Duration,21,24,21,20,19,3,3,2,4.75,1.08,1.65,5.83,7.08,4.68,6.29,7.32,,,,,,,,
DSP Nifty Midcap 150 Quality 50 ETF,46157,DSP Mutual Fund,10.79,14.41,19.87,41.28,NIFTY Midcap150 Quality 50 - TRI,,,,16.59,43,3,14,54,45,,,,DSP Nifty Midcap 150 Quality 50 ETF,Equity : ETFs,141,149,147,141,129,78,56,23,12.81,6.23,5.76,17.4,38.75,17.39,17.14,12.55,,,,,,,,
Axis FTP-113-1228D-Reg(G),47799,Axis Mutual Fund,0.63,1.84,3.86,6.75,CRISIL Medium Duration Debt Index,,,,3.35,50,81,57,63,71,,,,Axis FTP-113-1228D-Reg(G),Debt : FTP/FMP,101,108,102,93,91,22,17,12,3.23,0.68,1.85,4.01,6.93,5.51,5.65,6.16,,,,,,,,
SBI Nifty 200 Quality 30 ETF,41015,SBI Mutual Fund,8.83,7.76,17.29,36.31,NIFTY200 Quality 30 - TRI,16.43,17.09,,11.13,66,18,43,61,58,28,24,,SBI Nifty 200 Quality 30 ETF,Equity : ETFs,141,149,147,141,129,78,56,23,12.81,6.23,5.76,17.4,38.75,17.39,17.14,12.55,,,,,,,,
Mirae Asset Nifty India Manufacturing ETF FoF-Reg(G),46053,Mirae Asset Mutual Fund,9.52,16.9,34.76,59.77,Nifty India Manufacturing - TRI,,,,28.9,2,1,6,2,3,,,,Mirae Asset Nifty India Manufacturing ETF FoF-Reg(G),FoFs : Domestic,53,56,56,53,53,37,25,22,10.32,3.71,6.68,12.94,24.73,13.27,13.22,10.79,,,,,,,,
Tata Nifty500 Multicap India Manufacturing 50:30:20 Index Fund-Reg(G),48782,Tata Mutual Fund,8.41,,,,Nifty500 Multicap India Manufacturing 50:30:20 - TRI,,,,,,30,,,,,,,Tata Nifty500 Multicap India Manufacturing 50:30:20 Index Fund-Reg(G),Equity : Index Funds,105,120,113,103,94,42,23,18,15.42,7.13,7.58,19.99,44.99,17.51,15.96,12.45,,,,,,,,
Navi Liquid Fund-Reg(G),8544,Navi Mutual Fund,0.58,1.72,3.42,6.89,CRISIL Liquid Debt Index,5.65,4.99,6.34,3.04,36,34,36,36,33,15,27,22,Navi Liquid Fund-Reg(G),Debt : Liquid,37,37,37,37,36,35,34,29,3.25,0.6,1.83,3.65,7.17,5.6,5.09,6.31,,,,,,,,
LIC MF Nifty Next 50 Index Fund(G),12836,LIC Mutual Fund,9.02,15.39,37.32,62.51,NIFTY NEXT 50 - TRI,20.89,19.94,14.88,30.25,8,23,11,10,24,12,4,2,LIC MF Nifty Next 50 Index Fund(G),Equity : Index Funds,105,120,113,103,94,42,23,18,15.42,7.13,7.58,19.99,44.99,17.51,15.96,12.45,,,,,,,,
Mirae Asset Nifty SDL June 2028 Index Fund-Reg(G),47763,Mirae Asset Mutual Fund,0.75,1.69,4.34,6.57,Nifty SDL June 2028 Index,,,,3.4,39,41,34,20,35,,,,Mirae Asset Nifty SDL June 2028 Index Fund-Reg(G),Debt : Medium to Long Duration,52,52,52,52,52,11,11,11,3.48,0.8,1.72,4.3,6.58,5.03,6.02,6.61,,,,,,,,
Edelweiss Europe Dynamic Equity Off-shore Fund-Reg(G),24618,Edelweiss Mutual Fund,0.06,4.86,14.41,19.32,MSCI Europe Index (Total Return Net),7.06,12.54,6.79,10.44,22,39,21,27,27,15,10,11,Edelweiss Europe Dynamic Equity Off-shore Fund-Reg(G),FoFs : Overseas,57,58,57,57,56,38,26,23,7.8,1.01,3.95,12.76,17.43,3.46,9.74,6.11,,,,,,,,
Mirae Asset Nifty 8-13 yr G-Sec ETF,47899,Mirae Asset Mutual Fund,0.86,1.5,4.88,6.8,Nifty 8-13 yr G-Sec,,,,3.89,7,4,19,3,6,,,,Mirae Asset Nifty 8-13 yr G-Sec ETF,Debt : ETFs,22,26,25,22,17,14,6,1,3.09,0.64,1.6,3.79,6.68,4.88,4.97,5.04,1.04,1.45,5.1,7.03,4.82,6.48,,9.17
Aditya Birla SL US Treasury 1-3 year Bond ETFs FoF-Reg(G),48274,Aditya Birla Sun Life Mutual Fund,0.36,1.45,1.85,,Bloomberg US Treasury 1-3 Year Index,,,,1.14,21,25,23,21,,,,,Aditya Birla SL US Treasury 1-3 year Bond ETFs FoF-Reg(G),Debt : ETFs,22,26,25,22,17,14,6,1,3.09,0.64,1.6,3.79,6.68,4.88,4.97,5.04,,,,,,,,
Invesco India Nifty 50 ETF,12694,Invesco Mutual Fund,5.7,3.8,11.51,26.62,NIFTY 50 - TRI,14.99,15.42,12.91,7.66,98,78,100,97,89,44,39,12,Invesco India Nifty 50 ETF,Equity : ETFs,141,149,147,141,129,78,56,23,12.81,6.23,5.76,17.4,38.75,17.39,17.14,12.55,,,,,,,,
Sundaram LT Micro Cap Tax Adv Fund-Sr III-Reg(G),36026,Sundaram Mutual Fund,10.86,13.25,16.4,44.28,Nifty Smallcap 100,29.19,25.38,,11.41,38,1,4,30,15,5,10,,Sundaram LT Micro Cap Tax Adv Fund-Sr III-Reg(G),Equity : Tax Saving (ELSS),60,60,60,60,59,55,53,27,13.62,6.66,8.37,17.37,39.14,20.15,19.98,14.9,9.09,14.12,20.97,68.26,21.67,22.34,,34.71
SBI Nifty IT ETF,45110,SBI Mutual Fund,5.56,-6.2,4.46,24.2,NIFTY IT - TRI,8.84,,,-1.75,136,89,144,131,97,76,,,SBI Nifty IT ETF,Equity : ETFs,141,149,147,141,129,78,56,23,12.81,6.23,5.76,17.4,38.75,17.39,17.14,12.55,,,,,,,,
UTI CRISIL SDL Maturity June 2027 Index Fund-Reg(G),47369,UTI Mutual Fund,0.77,1.91,4.32,6.86,CRISIL IBX SDL Index - June 2027,,,,3.55,13,38,5,21,8,,,,UTI CRISIL SDL Maturity June 2027 Index Fund-Reg(G),Debt : Medium to Long Duration,52,52,52,52,52,11,11,11,3.48,0.8,1.72,4.3,6.58,5.03,6.02,6.61,,,,,,,,
Motilal Oswal S&P BSE Enhanced Value ETF,46740,Motilal Oswal Mutual Fund,4.15,5.41,36.1,94.97,BSE Enhanced Value Index - TRI,,,,28.19,21,141,60,11,2,,,,Motilal Oswal S&P BSE Enhanced Value ETF,Equity : ETFs,141,149,147,141,129,78,56,23,12.81,6.23,5.76,17.4,38.75,17.39,17.14,12.55,,,,,,,,
ICICI Pru Quant Fund(G),42805,ICICI Prudential Mutual Fund,6.45,8.74,18.0,37.43,BSE 200 - TRI,16.52,,,13.96,34,40,24,33,29,19,,,ICICI Pru Quant Fund(G),Equity : Thematic,56,61,59,54,46,31,15,8,17.5,7.06,8.84,21.61,47.18,20.65,21.5,15.05,6.57,7.12,16.34,36.38,17.67,18.16,,27.59
Mirae Asset Global Electric & Autonomous Vehicles ETFs FoF-Reg(G),46002,Mirae Asset Mutual Fund,0.49,0.06,3.06,-6.21,Solactive Autonomous & Electric Vehicles Index - TRI,,,,-4.04,54,35,48,53,54,,,,Mirae Asset Global Electric & Autonomous Vehicles ETFs FoF-Reg(G),FoFs : Overseas,57,58,57,57,56,38,26,23,7.8,1.01,3.95,12.76,17.43,3.46,9.74,6.11,,,,,,,,
