UTI Nifty Bank ETF,44435,UTI Mutual Fund,1.7,4.08,10.74,10.98,NIFTY BANK,13.63,,,-0.04,117,82,57,113,116,59,,,UTI Nifty Bank ETF,Equity : ETFs,141,149,145,141,129,77,56,23,8.76,3.47,3.58,19.87,38.0,18.62,17.5,13.17,2.4,3.91,10.59,10.16,12.41,10.34,15.52,-0.19
ICICI Pru S&P BSE Liquid Rate ETF,35122,ICICI Prudential Mutual Fund,0.52,1.58,3.23,6.57,S&P BSE Liquid Rate Index,5.07,4.16,,2.43,15,18,17,15,5,7,4,,ICICI Pru S&P BSE Liquid Rate ETF,Debt : ETFs,22,26,25,22,17,14,6,1,2.59,0.78,1.68,3.68,6.45,4.91,5.16,5.06,,,,,,,,
Edelweiss Nifty PSU Bond Plus SDL Apr 2027 50:50 Index Fund-Reg(G),45387,Edelweiss Mutual Fund,0.69,1.83,3.86,6.47,Nifty PSU Bond Plus SDL Apr 2027 50:50 Index,,,,2.89,18,36,15,42,19,,,,Edelweiss Nifty PSU Bond Plus SDL Apr 2027 50:50 Index Fund-Reg(G),Debt : Medium to Long Duration,52,52,52,52,52,11,11,11,2.86,0.82,1.72,3.97,6.27,5.0,5.94,6.78,,,,,,,,
Franklin India Equity Advantage Fund(G),933,Franklin Templeton Mutual Fund,3.41,4.81,16.84,34.08,NIFTY LargeMidcap 250 - TRI,17.19,16.56,13.82,7.0,26,25,23,24,22,25,21,18,Franklin India Equity Advantage Fund(G),Equity : Large & Mid Cap,27,29,28,26,26,26,22,18,12.01,4.61,6.87,22.16,43.09,21.86,20.48,16.81,,,,,,,,
Quant Infrastructure Fund(G),881,Quant Mutual Fund,2.71,8.01,46.65,78.05,Nifty Infrastructure - TRI,36.49,37.01,21.78,28.73,3,19,18,1,6,9,1,2,Quant Infrastructure Fund(G),Equity : Sectoral - Infrastructure,19,19,19,19,19,19,19,18,22.93,7.95,13.97,36.83,69.29,34.16,26.62,18.29,,,,,,,,
Tata Overnight Fund-Reg(G),42706,Tata Mutual Fund,0.53,1.6,3.3,6.68,CRISIL Liquid Overnight Index,5.2,4.66,,2.49,16,20,23,21,22,22,9,,Tata Overnight Fund-Reg(G),Debt : Overnight,35,35,35,35,32,27,15,3,2.5,0.53,1.6,3.29,6.69,5.22,4.67,5.75,,,,,,,,
Nippon India Nifty AAA CPSE Bond Plus SDL - Apr 2027 Maturity 60:40 Index Fund(G),46532,Nippon India Mutual Fund,0.68,1.88,3.86,6.62,Nifty AAA CPSE Bond Plus SDL Apr 2027 60:40 Index,,,,2.93,13,42,5,41,9,,,,Nippon India Nifty AAA CPSE Bond Plus SDL - Apr 2027 Maturity 60:40 Index Fund(G),Debt : Medium to Long Duration,52,52,52,52,52,11,11,11,2.86,0.82,1.72,3.97,6.27,5.0,5.94,6.78,,,,,,,,
Aditya Birla SL Banking & Financial Services Fund-Reg(G),24150,Aditya Birla Sun Life Mutual Fund,1.65,2.64,9.74,22.7,Nifty Financial Services - TRI,15.03,12.63,14.83,2.54,14,16,13,15,6,5,7,2,Aditya Birla SL Banking & Financial Services Fund-Reg(G),Equity : Sectoral - Financial Services,18,20,20,17,15,12,11,8,3.98,2.25,2.83,13.59,22.96,15.61,13.0,13.67,,,,,,,,
Motilal Oswal S&P 500 Index Fund-Reg(G),44958,Motilal Oswal Mutual Fund,4.69,6.37,17.54,30.58,S&P 500 - TRI,12.96,,,11.39,1,4,2,2,4,1,,,Motilal Oswal S&P 500 Index Fund-Reg(G),Equity : International,8,8,8,8,8,6,5,3,8.11,4.29,3.94,14.68,23.81,6.27,10.9,9.75,,,,,,,,
Sundaram Small Cap Fund(G),3052,Sundaram Mutual Fund,3.16,2.87,15.28,47.21,Nifty Smallcap 250 - TRI,26.09,24.36,19.02,7.09,22,24,24,19,11,14,18,10,Sundaram Small Cap Fund(G),Equity : Small Cap,27,27,27,26,24,22,19,12,11.01,5.34,6.31,18.41,49.53,27.68,28.27,21.6,,,,,,,,
HDFC Hybrid Debt Fund(G),1298,HDFC Mutual Fund,1.51,2.23,8.69,15.43,NIFTY 50 Hybrid Composite Debt 15:85 Index,10.9,10.71,9.67,5.1,3,6,10,4,3,2,3,5,HDFC Hybrid Debt Fund(G),Hybrid : Debt Oriented (Conservative),19,19,19,19,19,18,18,18,4.02,1.4,2.32,6.85,12.14,8.59,8.33,8.36,,,,,,,,
Nippon India Multi Asset Fund-Reg(G),26169,Nippon India Mutual Fund,3.17,7.19,19.38,33.28,S&P BSE 500 - TRI,17.22,,,11.36,3,3,2,3,3,5,,,Nippon India Multi Asset Fund-Reg(G),Hybrid : Multi Asset Allocation,17,24,20,17,12,10,7,7,9.0,2.26,5.67,15.98,29.26,16.5,17.82,12.88,4.13,4.9,20.36,38.34,19.27,19.21,12.44,23.2
DSP Dynamic Asset Allocation Fund-Reg(G),25872,DSP Mutual Fund,2.23,3.97,10.74,18.92,CRISIL Hybrid 50+50 - Moderate Index,9.14,10.06,8.86,4.66,24,14,13,22,23,20,14,8,DSP Dynamic Asset Allocation Fund-Reg(G),Hybrid : Dynamic Asset Allocation,30,32,30,28,26,20,17,10,6.52,1.97,3.28,13.25,24.81,12.51,12.24,11.02,,,,,,,,
Nippon India Retirement Fund-Wealth Creation(G),17164,Nippon India Mutual Fund,4.48,6.14,21.34,42.82,S&P BSE 500 - TRI,21.56,15.08,,10.24,5,6,8,4,3,4,10,,Nippon India Retirement Fund-Wealth Creation(G),Hybrid : Solution Oriented,40,41,40,39,38,37,29,13,6.53,2.9,4.31,13.02,25.26,13.88,12.74,12.2,4.13,4.9,20.36,38.34,19.27,19.21,12.44,23.2
HDFC Asset Allocator FoF-Reg(G),45488,HDFC Mutual Fund,1.72,4.93,13.68,25.08,NIFTY 50 Hybrid Composite Debt 65:35 Index,16.04,,,7.19,22,34,20,27,24,14,,,HDFC Asset Allocator FoF-Reg(G),FoFs : Domestic,53,56,55,53,53,37,25,22,8.18,2.34,6.15,14.05,24.59,14.07,13.32,11.05,,,,,,,,
SBI Dynamic Bond Fund-Reg(G),2805,SBI Mutual Fund,1.26,1.65,4.06,6.28,CRISIL Dynamic Bond Index,5.48,7.24,7.91,3.31,7,6,6,13,13,7,3,2,SBI Dynamic Bond Fund-Reg(G),Debt : Dynamic Bond,22,22,22,22,22,21,21,18,3.19,1.06,1.48,4.13,6.3,5.28,6.45,7.33,,,,,,,,
ICICI Pru US Bluechip Equity Fund(G),15655,ICICI Prudential Mutual Fund,5.86,4.95,16.45,22.11,S&P 500 ,11.5,17.18,14.43,5.79,6,3,4,4,5,2,1,1,ICICI Pru US Bluechip Equity Fund(G),Equity : International,8,8,8,8,8,6,5,3,8.11,4.29,3.94,14.68,23.81,6.27,10.9,9.75,5.6,5.95,17.48,27.52,8.39,13.13,11.59,31.71
HSBC Large & Mid Cap Fund-Reg(G),42701,HSBC Mutual Fund,7.22,12.28,25.95,48.29,NIFTY LargeMidcap 250 - TRI,22.28,20.61,,19.01,2,2,1,5,6,12,10,,HSBC Large & Mid Cap Fund-Reg(G),Equity : Large & Mid Cap,27,29,28,26,26,26,22,18,12.01,4.61,6.87,22.16,43.09,21.86,20.48,16.81,,,,,,,,
UTI Large & Mid Cap Fund-Reg(G),16672,UTI Mutual Fund,4.15,6.96,22.57,46.37,NIFTY LargeMidcap 250 - TRI,22.93,20.94,15.26,12.24,13,21,13,13,9,10,8,13,UTI Large & Mid Cap Fund-Reg(G),Equity : Large & Mid Cap,27,29,28,26,26,26,22,18,12.01,4.61,6.87,22.16,43.09,21.86,20.48,16.81,,,,,,,,
HSBC Multi Cap Fund-Reg(G),47272,HSBC Mutual Fund,5.34,6.06,25.88,59.15,Nifty500 Multicap 50:25:25 - TRI,,,,15.79,4,8,18,4,1,,,,HSBC Multi Cap Fund-Reg(G),Equity : Multi Cap,37,38,38,37,33,24,18,13,10.3,4.19,6.04,20.15,41.27,20.38,20.33,16.34,,,,,,,,
Edelweiss Large & Mid Cap Fund-Reg(G),1956,Edelweiss Mutual Fund,3.02,3.82,17.74,38.27,NIFTY LargeMidcap 250 - TRI,20.03,20.13,15.85,8.64,22,27,27,22,18,20,14,12,Edelweiss Large & Mid Cap Fund-Reg(G),Equity : Large & Mid Cap,27,29,28,26,26,26,22,18,12.01,4.61,6.87,22.16,43.09,21.86,20.48,16.81,,,,,,,,
HDFC Business Cycle Fund-Reg(G),46445,HDFC Mutual Fund,2.19,2.84,15.1,29.97,NIFTY 500 - TRI,,,,4.44,50,55,48,45,38,,,,HDFC Business Cycle Fund-Reg(G),Equity : Thematic,56,60,56,53,44,31,14,8,13.47,4.77,7.03,24.28,45.56,21.93,22.58,15.92,,,,,,,,
Kotak India EQ Contra Fund(G),1973,Kotak Mahindra Mutual Fund,4.43,5.85,26.94,50.35,NIFTY 500 - TRI,24.32,21.28,16.69,13.33,6,7,8,4,7,9,8,10,Kotak India EQ Contra Fund(G),Equity : Value / Contra,22,22,22,22,21,18,17,14,12.0,4.07,5.1,23.95,47.62,23.38,20.91,17.22,,,,,,,,
DSP Short Term Fund-Reg(G),729,DSP Mutual Fund,0.69,1.73,3.47,6.22,CRISIL Short Duration Debt Index,4.75,6.11,6.86,2.62,17,17,13,20,17,14,10,12,DSP Short Term Fund-Reg(G),Debt : Short Duration,26,27,26,26,26,22,21,19,2.56,0.67,1.67,3.43,6.24,5.45,5.87,6.84,,,,,,,,
Tata Multicap Fund-Reg(G),47480,Tata Mutual Fund,2.3,2.02,11.76,29.12,Nifty500 Multicap 50:25:25 - TRI,,,,4.18,36,34,36,36,31,,,,Tata Multicap Fund-Reg(G),Equity : Multi Cap,37,38,38,37,33,24,18,13,10.3,4.19,6.04,20.15,41.27,20.38,20.33,16.34,,,,,,,,
ICICI Pru Bond Fund(G),6197,ICICI Prudential Mutual Fund,1.1,1.73,3.92,6.75,CRISIL Medium to Long Term Debt Index,5.27,7.11,7.79,2.97,7,3,25,34,1,3,2,2,ICICI Pru Bond Fund(G),Debt : Medium to Long Duration,52,52,52,52,52,11,11,11,2.86,0.82,1.72,3.97,6.27,5.0,5.94,6.78,,,,,,,,
ICICI Pru Constant Maturity Gilt Fund(G),30426,ICICI Prudential Mutual Fund,1.23,1.72,4.19,5.83,Crisil 10 Yr Gilt Index,4.82,7.63,,3.13,5,4,3,5,3,2,1,,ICICI Pru Constant Maturity Gilt Fund(G),Debt : Gilt (10 Yr Constant Duration),6,6,6,6,6,4,4,2,3.2,1.23,1.69,4.3,5.86,4.39,7.09,8.48,,,,,,,,
Nippon India Corp Bond Fund(G),2646,Nippon India Mutual Fund,0.8,1.89,3.9,6.96,NIFTY Corporate Bond Index,5.88,6.66,7.34,3.06,2,4,5,3,4,2,7,7,Nippon India Corp Bond Fund(G),Debt : Corporate Bond,21,21,21,21,21,19,18,12,2.86,0.75,1.82,3.67,6.56,5.06,6.49,7.3,,,,,,,,
Kotak NASDAQ 100 FoF-Reg(G),45260,Kotak Mahindra Mutual Fund,3.6,5.6,18.56,40.28,Nasdaq-100 - TRI,16.4,,,10.53,22,46,31,16,8,2,,,Kotak NASDAQ 100 FoF-Reg(G),FoFs : Overseas,57,58,57,57,56,37,26,23,8.72,6.05,7.27,15.25,22.83,4.99,10.13,6.53,,,,,,,,
SBI Nifty 10 yr Benchmark G-Sec ETF,32455,SBI Mutual Fund,1.24,1.81,4.35,6.02,Nifty 10 yr Benchmark G-Sec,3.69,5.94,,3.26,5,3,10,7,16,14,3,,SBI Nifty 10 yr Benchmark G-Sec ETF,Debt : ETFs,22,26,25,22,17,14,6,1,2.59,0.78,1.68,3.68,6.45,4.91,5.16,5.06,0.53,1.19,3.74,5.59,3.63,5.88,,7.36
HSBC Overnight Fund-Reg(G),42784,HSBC Mutual Fund,0.53,1.61,3.31,6.7,Nifty 1D Rate Index,5.21,,,2.49,21,21,17,13,15,17,,,HSBC Overnight Fund-Reg(G),Debt : Overnight,35,35,35,35,32,27,15,3,2.5,0.53,1.6,3.29,6.69,5.22,4.67,5.75,0.56,1.65,3.36,6.84,5.38,4.82,,6.68
Nippon India ETF Nifty PSU Bank BeES,3722,Nippon India Mutual Fund,2.01,-0.48,40.03,76.37,NIFTY PSU BANK - TRI,46.87,19.3,7.59,24.21,15,80,133,12,6,2,19,21,Nippon India ETF Nifty PSU Bank BeES,Equity : ETFs,141,149,145,141,129,77,56,23,8.76,3.47,3.58,19.87,38.0,18.62,17.5,13.17,,,,,,,,
UTI MNC Fund-Reg(G),3634,UTI Mutual Fund,5.6,7.26,17.22,32.72,NIFTY MNC - TRI,16.6,14.81,15.36,10.89,1,4,3,1,3,2,2,1,UTI MNC Fund-Reg(G),Equity : Thematic - MNC,5,5,5,5,5,4,3,3,7.86,5.63,5.76,14.05,29.77,14.86,14.13,15.09,,,,,,,,
ICICI Pru Transportation and Logistics Fund-Reg(G),46979,ICICI Prudential Mutual Fund,7.73,11.4,31.27,58.58,Nifty Transportation & Logistics - TRI,,,,20.23,6,2,6,5,3,,,,ICICI Pru Transportation and Logistics Fund-Reg(G),Equity : Sectoral - Auto,6,6,6,6,4,1,1,1,22.67,7.41,12.46,33.51,60.53,29.72,22.85,17.49,,,,,,,,
UTI Balanced Advantage Fund-Reg(G),48102,UTI Mutual Fund,2.06,3.12,9.93,,NIFTY 50 Hybrid Composite Debt 50:50 Index,,,,4.03,27,16,19,26,,,,,UTI Balanced Advantage Fund-Reg(G),Hybrid : Dynamic Asset Allocation,30,32,30,28,26,20,17,10,6.52,1.97,3.28,13.25,24.81,12.51,12.24,11.02,,,,,,,,
UTI MEPUS,3617,UTI Mutual Fund,2.58,4.01,13.94,27.5,S&P BSE 100 - TRI,15.46,14.47,12.86,4.71,48,50,40,46,54,53,51,27,UTI MEPUS,Equity : Tax Saving (ELSS),60,60,60,60,59,55,53,27,9.46,3.98,5.47,19.08,38.78,21.53,20.31,15.68,3.36,3.82,17.73,30.7,17.32,17.2,12.13,17.54
HDFC Multi-Asset Fund(G),1307,HDFC Mutual Fund,1.52,4.21,13.14,22.33,NIFTY 50 - TRI,14.15,14.98,11.14,6.97,14,22,17,14,10,8,6,5,HDFC Multi-Asset Fund(G),Hybrid : Multi Asset Allocation,17,24,20,17,12,10,7,7,9.0,2.26,5.67,15.98,29.26,16.5,17.82,12.88,,,,,,,,
SBI Infrastructure Fund-Reg(G),2743,SBI Mutual Fund,4.01,8.99,28.06,65.35,Nifty Infrastructure - TRI,33.33,26.83,18.39,16.67,17,18,16,17,11,13,11,11,SBI Infrastructure Fund-Reg(G),Equity : Sectoral - Infrastructure,19,19,19,19,19,19,19,18,22.93,7.95,13.97,36.83,69.29,34.16,26.62,18.29,,,,,,,,
Kotak Nifty SDL Apr 2032 Top 12 Equal Weight Index Fund-Reg(G),46390,Kotak Mahindra Mutual Fund,0.91,1.75,4.66,6.58,Nifty SDL Apr 2032 Top 12 Equal Weight Index,,,,3.83,13,22,7,14,1,,,,Kotak Nifty SDL Apr 2032 Top 12 Equal Weight Index Fund-Reg(G),Debt : Long Duration,21,24,21,20,19,3,3,2,3.97,1.25,1.57,4.99,6.25,4.46,6.74,7.56,,,,,,,,
Aditya Birla SL Nifty Bank ETF,34434,Aditya Birla Sun Life Mutual Fund,1.7,4.07,10.71,10.94,NIFTY BANK - TRI,13.55,,,-0.06,121,88,61,118,118,61,,,Aditya Birla SL Nifty Bank ETF,Equity : ETFs,141,149,145,141,129,77,56,23,8.76,3.47,3.58,19.87,38.0,18.62,17.5,13.17,,,,,,,,
Tata Multi Asset Opp Fund-Reg(G),44648,Tata Mutual Fund,2.51,5.24,16.34,27.52,S&P BSE 200,15.85,,,8.97,9,10,15,9,8,6,,,Tata Multi Asset Opp Fund-Reg(G),Hybrid : Multi Asset Allocation,17,24,20,17,12,10,7,7,9.0,2.26,5.67,15.98,29.26,16.5,17.82,12.88,3.79,4.53,19.66,34.32,16.85,16.99,10.9,21.26
Tata Flexi Cap Fund-Reg(G),39283,Tata Mutual Fund,2.97,4.51,13.42,33.39,NIFTY 500 - TRI,15.98,15.66,,5.17,40,39,34,41,29,25,19,,Tata Flexi Cap Fund-Reg(G),Equity : Flexi Cap,46,47,47,46,41,29,26,19,10.36,4.18,5.98,20.26,39.1,19.45,18.38,15.78,,,,,,,,
ICICI Pru Nifty 100 Low Volatility 30 ETF,36395,ICICI Prudential Mutual Fund,1.46,-0.32,15.59,32.68,Nifty100 Low Volatility 30 - TRI,16.98,17.27,,4.28,84,127,127,76,67,28,23,,ICICI Pru Nifty 100 Low Volatility 30 ETF,Equity : ETFs,141,149,145,141,129,77,56,23,8.76,3.47,3.58,19.87,38.0,18.62,17.5,13.17,,,,,,,,
LIC MF Large & Midcap Fund-Reg(G),31950,LIC Mutual Fund,7.77,8.63,23.14,43.62,NIFTY LargeMidcap 250 - TRI,20.48,19.14,,12.98,11,1,7,11,14,17,18,,LIC MF Large & Midcap Fund-Reg(G),Equity : Large & Mid Cap,27,29,28,26,26,26,22,18,12.01,4.61,6.87,22.16,43.09,21.86,20.48,16.81,,,,,,,,
Axis Business Cycles Fund-Reg(G),47580,Axis Mutual Fund,4.05,7.05,20.47,38.51,NIFTY 500 - TRI,,,,10.3,34,36,25,31,26,,,,Axis Business Cycles Fund-Reg(G),Equity : Thematic,56,60,56,53,44,31,14,8,13.47,4.77,7.03,24.28,45.56,21.93,22.58,15.92,,,,,,,,
Tata Ultra Short Term Fund-Reg(G),41798,Tata Mutual Fund,0.49,1.75,3.4,6.65,CRISIL Ultra Short Term Debt Index,5.07,5.1,,2.65,15,18,19,15,17,17,14,,Tata Ultra Short Term Fund-Reg(G),Debt : Ultra Short Duration,24,24,24,24,24,24,18,13,2.72,0.51,1.83,3.48,6.83,5.32,5.39,6.4,,,,,,,,
HDFC Defence Fund-Reg(G),46585,HDFC Mutual Fund,11.98,26.2,50.68,,Nifty India Defence - TRI,,,,31.37,1,1,1,4,,,,,HDFC Defence Fund-Reg(G),Equity : Thematic,56,60,56,53,44,31,14,8,13.47,4.77,7.03,24.28,45.56,21.93,22.58,15.92,,,,,,,,
Mirae Asset Multicap Fund-Reg(G),48089,Mirae Asset Mutual Fund,3.65,4.36,19.16,,Nifty500 Multicap 50:25:25 - TRI,,,,8.05,29,28,30,24,,,,,Mirae Asset Multicap Fund-Reg(G),Equity : Multi Cap,37,38,38,37,33,24,18,13,10.3,4.19,6.04,20.15,41.27,20.38,20.33,16.34,,,,,,,,
UTI Short Duration Fund-Reg(G),3656,UTI Mutual Fund,0.63,1.74,3.82,6.83,CRISIL Short Duration Debt Index,7.0,5.19,6.49,2.95,3,23,12,3,4,3,17,14,UTI Short Duration Fund-Reg(G),Debt : Short Duration,26,27,26,26,26,22,21,19,2.56,0.67,1.67,3.43,6.24,5.45,5.87,6.84,,,,,,,,
SBI Healthcare Opp Fund-Reg(G),2813,SBI Mutual Fund,1.24,0.53,21.13,51.56,S&P BSE Health Care - TRI,16.39,25.53,15.98,13.19,3,12,5,3,5,2,4,2,SBI Healthcare Opp Fund-Reg(G),Equity : Sectoral - Pharma,14,16,16,13,11,9,8,3,11.78,1.63,0.43,19.83,51.57,14.56,24.6,15.9,3.14,0.49,21.15,56.63,14.62,22.82,15.3,33.77
Invesco India ELSS Tax Saver Fund(G),2270,Invesco Mutual Fund,2.19,3.31,17.56,39.11,S&P BSE 500 - TRI,17.24,17.68,16.23,8.2,36,53,45,34,29,49,35,8,Invesco India ELSS Tax Saver Fund(G),Equity : Tax Saving (ELSS),60,60,60,60,59,55,53,27,9.46,3.98,5.47,19.08,38.78,21.53,20.31,15.68,4.13,4.9,20.36,38.34,19.27,19.21,12.44,23.2
HDFC Long Duration Debt Fund-Reg(G),45991,HDFC Mutual Fund,1.71,1.11,6.04,6.06,NIFTY Long Duration Debt Index,,,,5.02,1,5,21,1,18,,,,HDFC Long Duration Debt Fund-Reg(G),Debt : Long Duration,21,24,21,20,19,3,3,2,3.97,1.25,1.57,4.99,6.25,4.46,6.74,7.56,,,,,,,,
UTI Low Duration Fund-Reg(G),3601,UTI Mutual Fund,0.57,1.89,3.69,7.14,NIFTY Low Duration Debt Index,7.34,4.69,6.35,2.86,5,3,8,3,3,1,19,15,UTI Low Duration Fund-Reg(G),Debt : Low Duration,20,20,20,20,20,20,20,18,2.78,0.55,1.88,3.55,6.94,5.38,5.43,6.6,,,,,,,,
DSP Corp Bond Fund-Reg(G),37709,DSP Mutual Fund,0.67,1.78,3.6,6.26,CRISIL Corporate Bond Index,4.49,6.21,,2.76,16,19,17,15,16,18,14,,DSP Corp Bond Fund-Reg(G),Debt : Corporate Bond,21,21,21,21,21,19,18,12,2.86,0.75,1.82,3.67,6.56,5.06,6.49,7.3,,,,,,,,
Bajaj Finserv Flexi Cap Fund-Reg(G),48061,Bajaj Finserv Mutual Fund,5.47,9.43,20.8,,S&P BSE 500 - TRI,,,,13.9,11,8,6,21,,,,,Bajaj Finserv Flexi Cap Fund-Reg(G),Equity : Flexi Cap,46,47,47,46,41,29,26,19,10.36,4.18,5.98,20.26,39.1,19.45,18.38,15.78,4.13,4.9,20.36,38.34,19.27,19.21,12.44,23.2
UTI Focused Fund-Reg(G),45685,UTI Mutual Fund,3.56,6.14,17.08,33.99,NIFTY 500 - TRI,,,,7.24,35,30,22,34,28,,,,UTI Focused Fund-Reg(G),Equity : Flexi Cap,46,47,47,46,41,29,26,19,10.36,4.18,5.98,20.26,39.1,19.45,18.38,15.78,,,,,,,,
ICICI Pru Housing Opp Fund-Reg(G),46546,ICICI Prudential Mutual Fund,4.16,7.26,21.53,39.19,Nifty Housing - TRI,,,,8.91,38,34,22,27,25,,,,ICICI Pru Housing Opp Fund-Reg(G),Equity : Thematic,56,60,56,53,44,31,14,8,13.47,4.77,7.03,24.28,45.56,21.93,22.58,15.92,,,,,,,,
Invesco India Focused Fund-Reg(G),45058,Invesco Mutual Fund,5.71,10.65,34.62,66.01,S&P BSE 500 - TRI,24.36,,,21.55,2,6,2,2,2,6,,,Invesco India Focused Fund-Reg(G),Equity : Flexi Cap,46,47,47,46,41,29,26,19,10.36,4.18,5.98,20.26,39.1,19.45,18.38,15.78,4.13,4.9,20.36,38.34,19.27,19.21,12.44,23.2
Quant Large & Mid Cap Fund(G),874,Quant Mutual Fund,4.36,9.78,36.47,65.64,NIFTY LargeMidcap 250 - TRI,28.38,28.29,22.66,21.06,1,15,3,1,1,1,1,1,Quant Large & Mid Cap Fund(G),Equity : Large & Mid Cap,27,29,28,26,26,26,22,18,12.01,4.61,6.87,22.16,43.09,21.86,20.48,16.81,,,,,,,,
ICICI Pru PSU Equity Fund-Reg(G),46106,ICICI Prudential Mutual Fund,4.63,5.18,50.85,81.43,S&P BSE PSU - TRI,,,,27.08,1,41,39,1,3,,,,ICICI Pru PSU Equity Fund-Reg(G),Equity : Index Funds,105,115,108,103,91,40,23,18,11.01,3.99,5.03,22.94,44.88,18.64,16.26,12.81,9.57,9.54,59.19,107.57,46.37,28.22,1.57,84.95
SBI Nifty Next 50 ETF,30248,SBI Mutual Fund,8.15,14.65,43.47,65.21,NIFTY NEXT 50 - TRI,23.55,21.42,,25.98,6,11,8,5,16,16,10,,SBI Nifty Next 50 ETF,Equity : ETFs,141,149,145,141,129,77,56,23,8.76,3.47,3.58,19.87,38.0,18.62,17.5,13.17,,,,,,,,
Kotak Dynamic Bond Fund-Reg(G),5430,Kotak Mahindra Mutual Fund,1.03,1.09,4.14,6.81,NIFTY Composite Debt Index,5.11,6.88,7.83,3.3,8,13,19,10,5,9,8,3,Kotak Dynamic Bond Fund-Reg(G),Debt : Dynamic Bond,22,22,22,22,22,21,21,18,3.19,1.06,1.48,4.13,6.3,5.28,6.45,7.33,,,,,,,,
Sundaram Multi Cap Fund(G),2370,Sundaram Mutual Fund,5.52,5.29,19.96,40.92,Nifty500 Multicap 50:25:25 - TRI,22.72,19.89,16.55,9.0,24,7,25,21,18,8,10,7,Sundaram Multi Cap Fund(G),Equity : Multi Cap,37,38,38,37,33,24,18,13,10.3,4.19,6.04,20.15,41.27,20.38,20.33,16.34,,,,,,,,
Tata Ethical Fund-Reg(G),3283,Tata Mutual Fund,5.75,5.36,17.86,31.79,Nifty500 Shariah - TRI,18.21,19.85,15.21,8.65,39,15,36,37,34,17,12,5,Tata Ethical Fund-Reg(G),Equity : Thematic,56,60,56,53,44,31,14,8,13.47,4.77,7.03,24.28,45.56,21.93,22.58,15.92,,,,,,,,
Union Liquid Fund(G),14561,Union Mutual Fund,0.55,1.83,3.68,7.25,CRISIL Liquid Debt Index,5.6,5.2,5.98,2.85,7,2,23,12,5,5,6,27,Union Liquid Fund(G),Debt : Liquid,37,37,37,37,36,35,34,29,2.78,0.54,1.81,3.62,7.14,5.51,5.08,6.32,,,,,,,,
SBI Credit Risk Fund-Reg(G),2770,SBI Mutual Fund,0.68,1.77,3.56,6.78,NIFTY Credit Risk Bond Index,6.24,6.97,7.65,2.78,10,6,6,10,8,8,5,3,SBI Credit Risk Fund-Reg(G),Debt : Credit Risk,15,15,15,15,15,15,15,8,2.87,0.67,1.77,3.66,7.38,8.86,5.12,6.66,,,,,,,,
DSP Ultra Short Fund-Reg(G),702,DSP Mutual Fund,0.49,1.78,3.39,6.83,CRISIL Ultra Short Term Debt Index,5.06,5.08,6.0,2.62,19,19,15,16,14,18,15,10,DSP Ultra Short Fund-Reg(G),Debt : Ultra Short Duration,24,24,24,24,24,24,18,13,2.72,0.51,1.83,3.48,6.83,5.32,5.39,6.4,,,,,,,,
Kotak Business Cycle Fund-Reg(G),46472,Kotak Mahindra Mutual Fund,5.89,10.03,20.4,35.12,NIFTY 500 - TRI,,,,11.87,29,14,14,32,31,,,,Kotak Business Cycle Fund-Reg(G),Equity : Thematic,56,60,56,53,44,31,14,8,13.47,4.77,7.03,24.28,45.56,21.93,22.58,15.92,,,,,,,,
HDFC NIFTY Bank ETF,33563,HDFC Mutual Fund,1.7,4.07,10.72,10.9,NIFTY BANK - TRI,13.51,,,-0.06,120,87,60,116,121,65,,,HDFC NIFTY Bank ETF,Equity : ETFs,141,149,145,141,129,77,56,23,8.76,3.47,3.58,19.87,38.0,18.62,17.5,13.17,,,,,,,,
Mahindra Manulife Mid Cap Fund-Reg(G),38444,Mahindra Mutual Fund,7.06,9.19,28.52,64.14,Nifty Midcap 150 - TRI,28.32,27.51,,17.35,6,11,12,5,4,5,3,,Mahindra Manulife Mid Cap Fund-Reg(G),Equity : Mid Cap,30,30,30,30,30,25,22,20,14.42,6.48,8.73,23.69,52.42,25.43,24.72,19.83,,,,,,,,
Baroda BNP Paribas Multi Cap Fund-Reg(G),500,Baroda BNP Paribas Mutual Fund,5.97,9.12,24.58,46.54,Nifty500 Multicap 50:25:25 - TRI,24.55,22.33,15.85,15.81,3,5,4,6,13,3,5,8,Baroda BNP Paribas Multi Cap Fund-Reg(G),Equity : Multi Cap,37,38,38,37,33,24,18,13,10.3,4.19,6.04,20.15,41.27,20.38,20.33,16.34,,,,,,,,
Kotak Debt Hybrid Fund(G),2051,Kotak Mahindra Mutual Fund,1.78,1.69,9.0,15.56,CRISIL Hybrid 85+15 - Conservative Index,10.48,11.59,10.14,4.72,5,3,15,3,2,4,1,2,Kotak Debt Hybrid Fund(G),Hybrid : Debt Oriented (Conservative),19,19,19,19,19,18,18,18,4.02,1.4,2.32,6.85,12.14,8.59,8.33,8.36,,,,,,,,
SBI CRISIL IBX Gilt Index - June 2036 Fund-Reg(G),46941,SBI Mutual Fund,1.36,1.75,4.99,6.27,CRISIL IBX Gilt Index - June 2036,,,,3.98,12,9,6,10,11,,,,SBI CRISIL IBX Gilt Index - June 2036 Fund-Reg(G),Debt : Long Duration,21,24,21,20,19,3,3,2,3.97,1.25,1.57,4.99,6.25,4.46,6.74,7.56,,,,,,,,
HSBC Infrastructure Fund-Reg(G),594,HSBC Mutual Fund,10.57,16.95,35.48,64.61,Nifty Infrastructure - TRI,34.59,24.64,18.99,21.62,12,4,7,12,12,12,14,7,HSBC Infrastructure Fund-Reg(G),Equity : Sectoral - Infrastructure,19,19,19,19,19,19,19,18,22.93,7.95,13.97,36.83,69.29,34.16,26.62,18.29,,,,,,,,
Franklin Build India Fund(G),7864,Franklin Templeton Mutual Fund,9.11,13.18,39.2,79.89,S&P BSE India Infrastructure Index - TRI,37.58,26.86,22.5,25.12,9,6,11,8,3,4,10,1,Franklin Build India Fund(G),Equity : Sectoral - Infrastructure,19,19,19,19,19,19,19,18,22.93,7.95,13.97,36.83,69.29,34.16,26.62,18.29,,,,,,,,
Bajaj Finserv Liquid Fund-Reg(G),48041,Bajaj Finserv Mutual Fund,0.54,1.83,3.66,,Nifty Liquid Fund Index,,,,2.84,11,10,22,21,,,,,Bajaj Finserv Liquid Fund-Reg(G),Debt : Liquid,37,37,37,37,36,35,34,29,2.78,0.54,1.81,3.62,7.14,5.51,5.08,6.32,,,,,,,,
DSP Banking & PSU Debt Fund-Reg(G),22142,DSP Mutual Fund,0.83,1.88,4.09,6.88,NIFTY Banking and PSU Debt Index,5.12,6.74,7.42,3.25,1,2,2,1,2,10,9,6,DSP Banking & PSU Debt Fund-Reg(G),Debt : Banking & PSU,27,27,27,27,26,22,16,15,2.85,0.71,1.79,3.67,6.51,5.09,6.66,7.22,,,,,,,,
Quant Liquid Plan(G),883,Quant Mutual Fund,0.51,1.74,3.48,6.91,CRISIL Liquid Debt Index,5.49,5.45,6.66,2.65,34,37,31,32,31,26,1,1,Quant Liquid Plan(G),Debt : Liquid,37,37,37,37,36,35,34,29,2.78,0.54,1.81,3.62,7.14,5.51,5.08,6.32,,,,,,,,
Mirae Asset Nifty 50 ETF,41174,Mirae Asset Mutual Fund,1.63,2.13,14.25,24.87,NIFTY 50 - TRI,15.92,15.77,,3.74,97,100,101,90,85,39,32,,Mirae Asset Nifty 50 ETF,Equity : ETFs,141,149,145,141,129,77,56,23,8.76,3.47,3.58,19.87,38.0,18.62,17.5,13.17,,,,,,,,
ICICI Pru Nifty Private Bank ETF,42119,ICICI Prudential Mutual Fund,1.06,3.28,5.68,8.78,Nifty Private Bank - TRI,11.09,,,-3.53,129,135,71,127,124,69,,,ICICI Pru Nifty Private Bank ETF,Equity : ETFs,141,149,145,141,129,77,56,23,8.76,3.47,3.58,19.87,38.0,18.62,17.5,13.17,,,,,,,,
HDFC Gilt Fund(G),1269,HDFC Mutual Fund,1.22,1.66,4.13,6.51,Nifty All Duration G-Sec Index,4.76,6.1,7.65,3.0,21,15,12,22,10,16,18,13,HDFC Gilt Fund(G),Debt : Gilt,35,35,35,35,35,23,21,21,3.23,1.12,1.54,4.29,6.36,4.89,6.78,7.88,,,,,,,,
SBI PSU Fund-Reg(G),9252,SBI Mutual Fund,6.77,8.7,55.04,97.26,S&P BSE PSU - TRI,39.59,26.04,13.4,28.59,3,12,16,1,1,2,4,8,SBI PSU Fund-Reg(G),Equity : Thematic,56,60,56,53,44,31,14,8,13.47,4.77,7.03,24.28,45.56,21.93,22.58,15.92,9.57,9.54,59.19,107.57,46.37,28.22,1.57,84.95
HSBC Ultra Short Duration Fund-Reg(G),44328,HSBC Mutual Fund,0.53,1.91,3.63,7.16,NIFTY Ultra Short Duration Debt Index,5.52,,,2.84,8,8,7,8,6,7,,,HSBC Ultra Short Duration Fund-Reg(G),Debt : Ultra Short Duration,24,24,24,24,24,24,18,13,2.72,0.51,1.83,3.48,6.83,5.32,5.39,6.4,,,,,,,,
Tata Treasury Advantage Fund-Reg(G),3205,Tata Mutual Fund,0.56,1.89,3.6,6.93,CRISIL Low Duration Debt Index,5.35,4.81,6.38,2.81,7,7,9,6,8,6,18,13,Tata Treasury Advantage Fund-Reg(G),Debt : Low Duration,20,20,20,20,20,20,20,18,2.78,0.55,1.88,3.55,6.94,5.38,5.43,6.6,,,,,,,,
UTI Ultra Short Duration Fund-Reg(G),3533,UTI Mutual Fund,0.52,1.84,3.52,6.92,NIFTY Ultra Short Duration Debt Index,6.2,5.12,6.46,2.76,13,10,13,13,12,2,12,8,UTI Ultra Short Duration Fund-Reg(G),Debt : Ultra Short Duration,24,24,24,24,24,24,18,13,2.72,0.51,1.83,3.48,6.83,5.32,5.39,6.4,,,,,,,,
DSP Healthcare Fund-Reg(G),36002,DSP Mutual Fund,1.85,0.23,19.51,50.59,S&P BSE Health Care - TRI,16.65,27.11,,11.07,9,6,8,8,7,1,1,,DSP Healthcare Fund-Reg(G),Equity : Sectoral - Pharma,14,16,16,13,11,9,8,3,11.78,1.63,0.43,19.83,51.57,14.56,24.6,15.9,3.14,0.49,21.15,56.63,14.62,22.82,15.3,33.77
ICICI Pru Bharat Consumption Fund(G),41946,ICICI Prudential Mutual Fund,4.14,5.37,17.86,40.53,Nifty India Consumption - TRI,23.86,18.84,,8.58,8,13,13,7,3,3,9,,ICICI Pru Bharat Consumption Fund(G),Equity : Thematic - Consumption,16,17,17,16,13,13,13,8,8.56,4.14,6.6,16.22,35.27,21.13,18.91,16.3,,,,,,,,
Tata ST Bond Fund-Reg(G),3286,Tata Mutual Fund,0.73,1.71,3.5,6.1,CRISIL Short Duration Debt Index,4.74,6.11,6.25,2.68,15,7,17,16,20,15,9,16,Tata ST Bond Fund-Reg(G),Debt : Short Duration,26,27,26,26,26,22,21,19,2.56,0.67,1.67,3.43,6.24,5.45,5.87,6.84,,,,,,,,
Bandhan Dynamic Bond Fund-Reg(G),7455,Bandhan Mutual Fund,1.68,1.08,5.52,6.91,NIFTY Composite Debt Index,4.64,6.93,7.77,4.45,1,1,20,1,3,16,7,5,Bandhan Dynamic Bond Fund-Reg(G),Debt : Dynamic Bond,22,22,22,22,22,21,21,18,3.19,1.06,1.48,4.13,6.3,5.28,6.45,7.33,,,,,,,,
SBI Retirement Benefit Fund-Aggressive Plan-Reg(G),30398,SBI Mutual Fund,5.07,6.83,16.36,30.04,S&P BSE 500 - TRI,21.37,,,6.9,16,3,5,11,15,5,,,SBI Retirement Benefit Fund-Aggressive Plan-Reg(G),Hybrid : Solution Oriented,40,41,40,39,38,37,29,13,6.53,2.9,4.31,13.02,25.26,13.88,12.74,12.2,4.13,4.9,20.36,38.34,19.27,19.21,12.44,23.2
Canara Rob Focused Equity Fund-Reg(G),45510,Canara Robeco Mutual Fund,1.45,3.38,17.69,32.1,S&P BSE 500 - TRI,18.93,,,7.95,30,36,32,31,28,15,,,Canara Rob Focused Equity Fund-Reg(G),Equity : Multi Cap,37,38,38,37,33,24,18,13,10.3,4.19,6.04,20.15,41.27,20.38,20.33,16.34,4.13,4.9,20.36,38.34,19.27,19.21,12.44,23.2
Kotak Nifty 50 ETF,8469,Kotak Mahindra Mutual Fund,1.63,2.15,14.27,24.76,NIFTY 50 - TRI,15.83,15.65,13.26,3.76,87,95,91,81,90,47,41,11,Kotak Nifty 50 ETF,Equity : ETFs,141,149,145,141,129,77,56,23,8.76,3.47,3.58,19.87,38.0,18.62,17.5,13.17,,,,,,,,
