Navi Nifty Midcap 150 Index Fund-Reg(G),45861,Navi Mutual Fund,5.31,6.16,22.89,55.4,Nifty Midcap 150 - TRI,,,,12.28,41,38,37,38,39,,,,Navi Nifty Midcap 150 Index Fund-Reg(G),Equity : Index Funds,105,115,108,103,91,40,23,18,11.01,3.99,5.03,22.94,44.88,18.64,16.26,12.81,,,,,,,,
Bank of India Credit Risk Fund-Reg(G),30390,Bank of India Mutual Fund,0.42,2.63,3.83,6.64,CRISIL Credit Risk Debt Index,39.82,-1.51,,3.2,2,15,1,3,10,1,15,,Bank of India Credit Risk Fund-Reg(G),Debt : Credit Risk,15,15,15,15,15,15,15,8,2.87,0.67,1.77,3.66,7.38,8.86,5.12,6.66,,,,,,,,
Invesco India Credit Risk Fund(G),21522,Invesco Mutual Fund,0.74,1.67,3.5,7.88,NIFTY Credit Risk Bond Index,6.09,5.41,,2.69,12,2,11,11,2,9,10,,Invesco India Credit Risk Fund(G),Debt : Credit Risk,15,15,15,15,15,15,15,8,2.87,0.67,1.77,3.66,7.38,8.86,5.12,6.66,,,,,,,,
Shriram Multi Asset Allocation Fund-Reg(G),48029,Shriram Mutual Fund,2.78,5.46,19.02,,NIFTY 50 - TRI,,,,9.6,5,7,13,5,,,,,Shriram Multi Asset Allocation Fund-Reg(G),Hybrid : Multi Asset Allocation,17,24,20,17,12,10,7,7,9.0,2.26,5.67,15.98,29.26,16.5,17.82,12.88,,,,,,,,
Mirae Asset Nifty 100 ESG Sector Leaders ETF,45134,Mirae Asset Mutual Fund,2.18,2.97,15.93,28.5,Nifty100 ESG Sector Leaders - TRI,14.2,,,5.64,75,74,77,72,77,58,,,Mirae Asset Nifty 100 ESG Sector Leaders ETF,Equity : ETFs,141,149,145,141,129,77,56,23,8.76,3.47,3.58,19.87,38.0,18.62,17.5,13.17,,,,,,,,
Baroda BNP Paribas Banking and Fin Serv Fund-Reg(G),16955,Baroda BNP Paribas Mutual Fund,2.87,3.74,15.46,24.91,Nifty Financial Services - TRI,14.05,11.67,11.99,2.8,9,6,5,5,5,10,8,7,Baroda BNP Paribas Banking and Fin Serv Fund-Reg(G),Equity : Sectoral - Financial Services,18,20,20,17,15,12,11,8,3.98,2.25,2.83,13.59,22.96,15.61,13.0,13.67,,,,,,,,
DSP World Energy Fund-Reg(G),7866,DSP Mutual Fund,7.91,6.54,10.25,3.57,MSCI World,4.84,6.93,2.41,0.04,52,14,25,45,49,19,20,20,DSP World Energy Fund-Reg(G),FoFs : Overseas,57,58,57,57,56,37,26,23,8.72,6.05,7.27,15.25,22.83,4.99,10.13,6.53,,,,,,,,
Aditya Birla SL FMP-US-100D-Reg(G),48501,Aditya Birla Sun Life Mutual Fund,0.64,1.91,,,CRISIL Ultra Short Term Debt Index,,,,,,50,15,,,,,,Aditya Birla SL FMP-US-100D-Reg(G),Debt : FTP/FMP,102,109,102,93,91,21,17,12,2.7,0.64,1.84,3.88,6.75,5.53,5.71,6.18,,,,,,,,
SBI FMP-47-1434D-Reg(G),45660,SBI Mutual Fund,0.58,1.81,3.67,6.82,CRISIL Medium Duration Debt Index,,,,2.8,54,74,70,74,31,,,,SBI FMP-47-1434D-Reg(G),Debt : FTP/FMP,102,109,102,93,91,21,17,12,2.7,0.64,1.84,3.88,6.75,5.53,5.71,6.18,,,,,,,,
ICICI Pru Debt Mgmt Fund(FOF)(G),1707,ICICI Prudential Mutual Fund,0.86,2.03,3.83,7.18,CRISIL Composite Bond Index,5.66,6.78,8.01,2.98,48,47,45,48,44,31,22,19,ICICI Pru Debt Mgmt Fund(FOF)(G),FoFs : Domestic,53,56,55,53,53,37,25,22,8.18,2.34,6.15,14.05,24.59,14.07,13.32,11.05,,,,,,,,
Kotak India Growth Fund-Sr 4(G),38109,Kotak Mahindra Mutual Fund,3.48,16.25,23.0,48.85,NIFTY 200,24.54,26.76,,4.71,35,30,1,8,8,5,2,,Kotak India Growth Fund-Sr 4(G),Equity : Multi Cap,37,38,38,37,33,24,18,13,10.3,4.19,6.04,20.15,41.27,20.38,20.33,16.34,3.76,4.48,19.67,34.55,16.92,16.67,10.37,20.75
Axis NIFTY IT ETF,45427,Axis Mutual Fund,-0.27,-12.97,4.23,21.61,NIFTY IT - TRI,11.01,,,-5.48,136,148,138,138,100,72,,,Axis NIFTY IT ETF,Equity : ETFs,141,149,145,141,129,77,56,23,8.76,3.47,3.58,19.87,38.0,18.62,17.5,13.17,,,,,,,,
Union Gilt Fund-Reg(G),46221,Union Mutual Fund,1.39,1.47,4.41,6.08,CRISIL Dynamic Gilt Index,,,,3.26,17,5,22,12,26,,,,Union Gilt Fund-Reg(G),Debt : Gilt,35,35,35,35,35,23,21,21,3.23,1.12,1.54,4.29,6.36,4.89,6.78,7.88,,,,,,,,
LIC MF Focused 30 Equity Fund-Reg(G),32627,LIC Mutual Fund,2.0,4.37,12.72,21.89,NIFTY 500 - TRI,15.24,14.71,,4.04,34,30,25,34,36,26,25,,LIC MF Focused 30 Equity Fund-Reg(G),Equity : Large Cap,36,37,37,36,36,33,31,28,8.89,2.85,5.01,19.4,34.2,17.3,16.49,14.02,,,,,,,,
Groww Nifty Total Market Index Fund-Reg(G),48247,Groww Mutual Fund,3.22,4.24,18.93,,Nifty Total Market - TRI,,,,8.19,58,56,48,55,,,,,Groww Nifty Total Market Index Fund-Reg(G),Equity : Index Funds,105,115,108,103,91,40,23,18,11.01,3.99,5.03,22.94,44.88,18.64,16.26,12.81,,,,,,,,
HDFC NIFTY Midcap 150 Index Fund-Reg(G),46619,HDFC Mutual Fund,5.31,6.26,23.01,55.34,Nifty Midcap 150 - TRI,,,,12.42,37,39,35,37,40,,,,HDFC NIFTY Midcap 150 Index Fund-Reg(G),Equity : Index Funds,105,115,108,103,91,40,23,18,11.01,3.99,5.03,22.94,44.88,18.64,16.26,12.81,,,,,,,,
Mirae Asset Nifty India Manufacturing ETF,45869,Mirae Asset Mutual Fund,8.4,15.88,35.35,59.97,Nifty India Manufacturing - TRI,,,,22.82,20,4,4,22,23,,,,Mirae Asset Nifty India Manufacturing ETF,Equity : ETFs,141,149,145,141,129,77,56,23,8.76,3.47,3.58,19.87,38.0,18.62,17.5,13.17,,,,,,,,
JM Short Duration Fund-Reg(G),46751,JM Financial Mutual Fund,0.71,1.62,3.24,5.75,CRISIL Short Duration Debt Index,,,,2.42,22,12,22,23,24,,,,JM Short Duration Fund-Reg(G),Debt : Short Duration,26,27,26,26,26,22,21,19,2.56,0.67,1.67,3.43,6.24,5.45,5.87,6.84,,,,,,,,
Aditya Birla SL CRISIL IBX SDL Jun 2032 Index Fund-Reg(G),47592,Aditya Birla Sun Life Mutual Fund,0.9,1.69,4.55,6.39,CRISIL IBX SDL Index - June 2032,,,,3.71,15,23,9,16,5,,,,Aditya Birla SL CRISIL IBX SDL Jun 2032 Index Fund-Reg(G),Debt : Long Duration,21,24,21,20,19,3,3,2,3.97,1.25,1.57,4.99,6.25,4.46,6.74,7.56,,,,,,,,
LIC MF Gold ETF,15131,LIC Mutual Fund,0.14,19.15,19.52,20.66,Gold-India,14.57,17.29,9.68,15.7,13,18,12,3,3,1,1,1,LIC MF Gold ETF,Gold : ETFs,25,28,27,23,21,11,11,11,16.52,1.63,19.7,18.4,19.94,14.01,17.02,9.28,,,,,,,,
ICICI Pru Nifty50 Value 20 ETF,33839,ICICI Prudential Mutual Fund,3.25,0.62,18.32,34.42,Nifty50 Value 20 - TRI,20.03,19.99,,7.51,65,61,117,65,62,24,17,,ICICI Pru Nifty50 Value 20 ETF,Equity : ETFs,141,149,145,141,129,77,56,23,8.76,3.47,3.58,19.87,38.0,18.62,17.5,13.17,,,,,,,,
HSBC Global Equity Climate Change FoF-Reg(G),45333,HSBC Mutual Fund,6.88,6.15,14.3,11.16,MSCI AC World Index,1.12,,,4.85,47,18,27,35,40,26,,,HSBC Global Equity Climate Change FoF-Reg(G),FoFs : Overseas,57,58,57,57,56,37,26,23,8.72,6.05,7.27,15.25,22.83,4.99,10.13,6.53,,,,,,,,
ICICI Pru Nifty Infrastructure ETF,45998,ICICI Prudential Mutual Fund,3.52,6.64,34.05,60.38,Nifty Infrastructure - TRI,,,,18.09,27,52,33,23,22,,,,ICICI Pru Nifty Infrastructure ETF,Equity : ETFs,141,149,145,141,129,77,56,23,8.76,3.47,3.58,19.87,38.0,18.62,17.5,13.17,,,,,,,,
SBI FMP-52-1848D-Reg(G),45915,SBI Mutual Fund,0.64,1.86,4.04,6.83,CRISIL Medium to Long Term Debt Index,,,,2.94,19,38,29,22,27,,,,SBI FMP-52-1848D-Reg(G),Debt : FTP/FMP,102,109,102,93,91,21,17,12,2.7,0.64,1.84,3.88,6.75,5.53,5.71,6.18,,,,,,,,
Bank of India Balanced Advantage Fund-Reg(G),21917,Bank of India Mutual Fund,1.54,2.36,15.57,24.69,NIFTY 50 Hybrid Composite Debt 50:50 Index,14.89,9.88,8.43,6.0,18,24,24,4,11,2,16,9,Bank of India Balanced Advantage Fund-Reg(G),Hybrid : Dynamic Asset Allocation,30,32,30,28,26,20,17,10,6.52,1.97,3.28,13.25,24.81,12.51,12.24,11.02,,,,,,,,
Taurus Mid Cap Fund-Reg(G),3306,Taurus Mutual Fund,6.39,6.63,21.83,51.64,Nifty Midcap 150 - TRI,23.35,24.28,19.46,12.27,21,15,25,19,15,19,13,12,Taurus Mid Cap Fund-Reg(G),Equity : Mid Cap,30,30,30,30,30,25,22,20,14.42,6.48,8.73,23.69,52.42,25.43,24.72,19.83,,,,,,,,
ICICI Pru Retirement Fund-Pure Debt Plan(G),25670,ICICI Prudential Mutual Fund,0.72,1.87,3.32,6.16,NIFTY Composite Debt Index,4.48,6.35,,2.6,39,40,37,38,37,36,27,,ICICI Pru Retirement Fund-Pure Debt Plan(G),Hybrid : Solution Oriented,40,41,40,39,38,37,29,13,6.53,2.9,4.31,13.02,25.26,13.88,12.74,12.2,,,,,,,,
Nippon India ETF Nifty 50 Value 20,31920,Nippon India Mutual Fund,3.23,0.59,18.24,34.28,Nifty50 Value 20 - TRI,19.81,20.09,,7.47,66,62,118,66,63,25,16,,Nippon India ETF Nifty 50 Value 20,Equity : ETFs,141,149,145,141,129,77,56,23,8.76,3.47,3.58,19.87,38.0,18.62,17.5,13.17,,,,,,,,
Union Retirement Fund-Reg(G),45735,Union Mutual Fund,4.14,5.31,16.36,38.86,S&P BSE 500 - TRI,,,,8.81,9,9,14,10,6,,,,Union Retirement Fund-Reg(G),Hybrid : Solution Oriented,40,41,40,39,38,37,29,13,6.53,2.9,4.31,13.02,25.26,13.88,12.74,12.2,4.13,4.9,20.36,38.34,19.27,19.21,12.44,23.2
Kotak FMP-329-90D(G),48720,Kotak Mahindra Mutual Fund,0.55,,,,Nifty Liquid Fund Index,,,,,,95,,,,,,,Kotak FMP-329-90D(G),Debt : FTP/FMP,102,109,102,93,91,21,17,12,2.7,0.64,1.84,3.88,6.75,5.53,5.71,6.18,,,,,,,,
Baroda BNP Paribas NIFTY SDL Dec 2026 Index Fund-Reg(G),47387,Baroda BNP Paribas Mutual Fund,0.7,1.87,4.0,6.52,NIFTY SDL December 2026 Index,,,,2.95,9,34,8,20,13,,,,Baroda BNP Paribas NIFTY SDL Dec 2026 Index Fund-Reg(G),Debt : Medium to Long Duration,52,52,52,52,52,11,11,11,2.86,0.82,1.72,3.97,6.27,5.0,5.94,6.78,,,,,,,,
ICICI Pru FMP-88-1226D-F(G),47232,ICICI Prudential Mutual Fund,0.58,1.85,3.83,6.54,CRISIL Medium Duration Debt Index,,,,2.76,62,70,39,50,75,,,,ICICI Pru FMP-88-1226D-F(G),Debt : FTP/FMP,102,109,102,93,91,21,17,12,2.7,0.64,1.84,3.88,6.75,5.53,5.71,6.18,,,,,,,,
Bandhan Nifty 100 Index Fund-Reg(G),46119,Bandhan Mutual Fund,2.62,4.02,18.59,30.34,NIFTY 100 - TRI,,,,7.06,64,62,55,57,61,,,,Bandhan Nifty 100 Index Fund-Reg(G),Equity : Index Funds,105,115,108,103,91,40,23,18,11.01,3.99,5.03,22.94,44.88,18.64,16.26,12.81,,,,,,,,
Canara Rob Income Fund-Reg(G),542,Canara Robeco Mutual Fund,1.09,1.38,3.74,4.7,CRISIL Medium to Long Term Debt Index,3.77,5.8,6.87,2.78,36,7,51,50,52,10,7,6,Canara Rob Income Fund-Reg(G),Debt : Medium to Long Duration,52,52,52,52,52,11,11,11,2.86,0.82,1.72,3.97,6.27,5.0,5.94,6.78,,,,,,,,
Kotak Nifty Alpha 50 ETF,45687,Kotak Mahindra Mutual Fund,7.45,10.92,33.85,80.83,Nifty Alpha 50 - TRI,,,,22.02,21,19,14,24,3,,,,Kotak Nifty Alpha 50 ETF,Equity : ETFs,141,149,145,141,129,77,56,23,8.76,3.47,3.58,19.87,38.0,18.62,17.5,13.17,,,,,,,,
Invesco India Banking and PSU Fund(G),17249,Invesco Mutual Fund,0.8,1.88,3.95,6.62,NIFTY Banking and PSU Debt Index,4.28,5.83,6.42,3.1,2,4,3,2,13,21,16,15,Invesco India Banking and PSU Fund(G),Debt : Banking & PSU,27,27,27,27,26,22,16,15,2.85,0.71,1.79,3.67,6.51,5.09,6.66,7.22,,,,,,,,
SBI FMP-46-1850D-Reg(G),45620,SBI Mutual Fund,0.64,1.85,3.97,6.69,CRISIL Medium to Long Term Debt Index,,,,2.88,31,40,37,36,46,,,,SBI FMP-46-1850D-Reg(G),Debt : FTP/FMP,102,109,102,93,91,21,17,12,2.7,0.64,1.84,3.88,6.75,5.53,5.71,6.18,,,,,,,,
Aditya Birla SL Silver ETF FOF-Reg(G),46225,Aditya Birla Sun Life Mutual Fund,3.52,21.09,16.86,18.64,Silver,,,,16.83,7,10,3,19,35,,,,Aditya Birla SL Silver ETF FOF-Reg(G),FoFs : Domestic,53,56,55,53,53,37,25,22,8.18,2.34,6.15,14.05,24.59,14.07,13.32,11.05,,,,,,,,
Groww Largecap Fund-Reg(G),15997,Groww Mutual Fund,2.99,5.41,21.3,33.42,NIFTY 100 - TRI,16.87,13.88,12.48,9.04,14,15,14,12,17,17,30,22,Groww Largecap Fund-Reg(G),Equity : Large Cap,36,37,37,36,36,33,31,28,8.89,2.85,5.01,19.4,34.2,17.3,16.49,14.02,,,,,,,,
PGIM India Gilt Fund(G),7012,PGIM India Mutual Fund,1.32,1.22,4.39,6.31,CRISIL Dynamic Gilt Index,4.62,6.25,7.44,3.4,11,12,35,14,18,19,15,14,PGIM India Gilt Fund(G),Debt : Gilt,35,35,35,35,35,23,21,21,3.23,1.12,1.54,4.29,6.36,4.89,6.78,7.88,,,,,,,,
Aditya Birla SL Long Duration Fund-Reg(G),46711,Aditya Birla Sun Life Mutual Fund,1.33,1.51,5.16,6.34,NIFTY Long Duration Debt Index,,,,4.23,6,10,15,6,8,,,,Aditya Birla SL Long Duration Fund-Reg(G),Debt : Long Duration,21,24,21,20,19,3,3,2,3.97,1.25,1.57,4.99,6.25,4.46,6.74,7.56,,,,,,,,
Nippon India Strategic Debt Fund(G),21911,Nippon India Mutual Fund,0.78,1.81,3.7,5.96,CRISIL Medium Duration Debt Index,9.21,-0.29,,2.89,7,8,9,14,27,2,13,,Nippon India Strategic Debt Fund(G),Debt : Medium Duration,30,30,30,30,30,14,13,10,2.78,0.71,1.72,3.73,6.35,5.84,5.59,7.17,,,,,,,,
Union Equity Savings Fund-Reg(G),40627,Union Mutual Fund,1.23,1.89,7.49,13.98,Crisil Equity Savings Index,7.89,8.44,,3.78,46,45,49,47,47,48,43,,Union Equity Savings Fund-Reg(G),Hybrid : Equity Oriented,56,56,56,56,55,53,48,24,6.35,2.27,3.84,11.94,22.53,12.63,12.83,11.87,,,,,,,,
Kotak FMP-310-1131D(G),47871,Kotak Mahindra Mutual Fund,0.58,1.8,3.78,6.49,NIFTY Medium Duration Debt Index,,,,2.71,71,72,75,57,79,,,,Kotak FMP-310-1131D(G),Debt : FTP/FMP,102,109,102,93,91,21,17,12,2.7,0.64,1.84,3.88,6.75,5.53,5.71,6.18,,,,,,,,
Nippon India FMP-XLVI-1(G),48149,Nippon India Mutual Fund,0.54,1.92,,,NIFTY Ultra Short Duration Debt Index,,,,1.67,94,104,12,,,,,,Nippon India FMP-XLVI-1(G),Debt : FTP/FMP,102,109,102,93,91,21,17,12,2.7,0.64,1.84,3.88,6.75,5.53,5.71,6.18,,,,,,,,
Axis S&P BSE Sensex ETF,47768,Axis Mutual Fund,1.55,2.23,12.66,21.4,S&P BSE SENSEX - TRI,,,,2.65,110,120,88,108,108,,,,Axis S&P BSE Sensex ETF,Equity : ETFs,141,149,145,141,129,77,56,23,8.76,3.47,3.58,19.87,38.0,18.62,17.5,13.17,2.33,2.42,12.91,22.02,15.26,15.69,12.12,7.39
PGIM India Arbitrage Fund-Reg(G),28514,PGIM India Mutual Fund,0.63,1.75,3.67,7.06,Nifty 50 Arbitrage,5.21,4.86,,2.86,23,2,24,22,22,19,17,,PGIM India Arbitrage Fund-Reg(G),Hybrid : Arbitrage,26,26,26,26,24,24,21,10,3.05,0.57,1.87,3.84,7.5,5.4,5.02,5.89,0.61,2.0,4.12,8.3,5.9,5.11,,8.21
Quantum Equity FoF-Reg(G),19904,Quantum Mutual Fund,4.14,6.95,19.14,34.57,S&P BSE 200 - TRI,17.78,16.63,14.62,9.73,14,3,11,9,11,11,6,3,Quantum Equity FoF-Reg(G),FoFs : Domestic,53,56,55,53,53,37,25,22,8.18,2.34,6.15,14.05,24.59,14.07,13.32,11.05,3.95,4.75,20.17,36.06,18.43,18.54,12.47,22.25
ICICI Pru Global Stable Equity Fund(FOF)(G),16718,ICICI Prudential Mutual Fund,4.48,2.28,8.18,8.99,MSCI World,6.87,10.51,9.21,2.45,49,39,50,48,45,18,13,6,ICICI Pru Global Stable Equity Fund(FOF)(G),FoFs : Overseas,57,58,57,57,56,37,26,23,8.72,6.05,7.27,15.25,22.83,4.99,10.13,6.53,,,,,,,,
Kotak Nifty SDL Jul 2026 Index Fund-Reg(G),46729,Kotak Mahindra Mutual Fund,0.66,1.85,3.93,6.68,Nifty SDL Jul 2026 Index,,,,2.88,24,49,14,33,3,,,,Kotak Nifty SDL Jul 2026 Index Fund-Reg(G),Debt : Medium to Long Duration,52,52,52,52,52,11,11,11,2.86,0.82,1.72,3.97,6.27,5.0,5.94,6.78,,,,,,,,
Bandhan All Seasons Bond Fund-Reg(G),2850,Bandhan Mutual Fund,0.73,1.74,3.63,6.37,NIFTY Medium Duration Debt Index,4.93,6.63,7.23,2.67,52,50,52,50,50,37,23,21,Bandhan All Seasons Bond Fund-Reg(G),FoFs : Domestic,53,56,55,53,53,37,25,22,8.18,2.34,6.15,14.05,24.59,14.07,13.32,11.05,,,,,,,,
DSP FMP 268-1281D-Reg(G),47124,DSP Mutual Fund,0.65,1.86,3.94,6.87,CRISIL Medium Duration Debt Index,,,,2.87,37,31,35,38,20,,,,DSP FMP 268-1281D-Reg(G),Debt : FTP/FMP,102,109,102,93,91,21,17,12,2.7,0.64,1.84,3.88,6.75,5.53,5.71,6.18,,,,,,,,
Bandhan Regular Savings Fund-Reg(G),8465,Bandhan Mutual Fund,1.42,1.73,5.71,9.48,NIFTY AAA Short Duration Bond Index,5.73,6.52,7.53,2.8,16,8,14,14,15,18,16,15,Bandhan Regular Savings Fund-Reg(G),Hybrid : Debt Oriented (Conservative),19,19,19,19,19,18,18,18,4.02,1.4,2.32,6.85,12.14,8.59,8.33,8.36,,,,,,,,
SBI FMP-78-1170D-Reg(G),47638,SBI Mutual Fund,0.61,1.84,3.8,6.7,CRISIL Medium Duration Debt Index,,,,2.79,57,56,52,54,45,,,,SBI FMP-78-1170D-Reg(G),Debt : FTP/FMP,102,109,102,93,91,21,17,12,2.7,0.64,1.84,3.88,6.75,5.53,5.71,6.18,,,,,,,,
Sundaram Global Brand Fund(G),3005,Sundaram Mutual Fund,2.36,2.71,10.92,20.98,MSCI AC World Index,8.15,13.11,7.47,6.5,41,54,48,44,27,16,9,9,Sundaram Global Brand Fund(G),FoFs : Overseas,57,58,57,57,56,37,26,23,8.72,6.05,7.27,15.25,22.83,4.99,10.13,6.53,,,,,,,,
Quantum Gold Saving Fund-Reg(G),19961,Quantum Mutual Fund,0.13,18.44,19.6,19.91,Gold-India,13.83,16.7,8.34,15.41,10,12,6,5,2,3,5,4,Quantum Gold Saving Fund-Reg(G),Gold : MFs,16,16,16,16,15,10,10,10,15.69,0.9,18.69,18.94,19.38,13.74,16.56,8.26,,,,,,,,
Invesco India Gold ETF,8505,Invesco Mutual Fund,0.8,18.75,19.39,20.41,Gold-India,14.2,17.27,9.17,16.1,11,14,14,6,5,2,2,9,Invesco India Gold ETF,Gold : ETFs,25,28,27,23,21,11,11,11,16.52,1.63,19.7,18.4,19.94,14.01,17.02,9.28,,,,,,,,
Kotak FMP-326-175D(G),48420,Kotak Mahindra Mutual Fund,0.59,2.05,,,NIFTY Ultra Short Duration Debt Index,,,,3.0,12,64,4,,,,,,Kotak FMP-326-175D(G),Debt : FTP/FMP,102,109,102,93,91,21,17,12,2.7,0.64,1.84,3.88,6.75,5.53,5.71,6.18,,,,,,,,
Sundaram Money Market Fund-Reg(G),39625,Sundaram Mutual Fund,0.53,1.93,3.7,7.2,Nifty Money Market Index,5.54,5.56,,2.88,11,8,12,11,10,10,11,,Sundaram Money Market Fund-Reg(G),Debt : Money Market,22,22,22,22,21,17,14,13,2.85,0.52,1.91,3.66,7.17,5.58,5.76,6.69,,,,,,,,
Bandhan CRISIL IBX 90:10 SDL Plus Gilt - Nov 2026 Index Fund-Reg(G),46213,Bandhan Mutual Fund,0.68,1.85,3.96,6.59,CRISIL IBX 90:10 SDL Plus Gilt Index - November 2026,,,,2.88,23,40,13,29,10,,,,Bandhan CRISIL IBX 90:10 SDL Plus Gilt - Nov 2026 Index Fund-Reg(G),Debt : Medium to Long Duration,52,52,52,52,52,11,11,11,2.86,0.82,1.72,3.97,6.27,5.0,5.94,6.78,,,,,,,,
Bandhan Equity Savings Fund-Reg(G),5300,Bandhan Mutual Fund,0.74,1.71,5.34,10.44,CRISIL Liquid Debt Index,7.36,7.76,6.65,2.87,51,53,52,52,52,50,46,24,Bandhan Equity Savings Fund-Reg(G),Hybrid : Equity Oriented,56,56,56,56,55,53,48,24,6.35,2.27,3.84,11.94,22.53,12.63,12.83,11.87,,,,,,,,
PGIM India Dynamic Bond Fund(G),15247,PGIM India Mutual Fund,1.26,1.45,4.3,6.18,CRISIL Dynamic Bond Index,4.55,6.13,7.57,3.49,4,5,13,6,14,17,12,7,PGIM India Dynamic Bond Fund(G),Debt : Dynamic Bond,22,22,22,22,22,21,21,18,3.19,1.06,1.48,4.13,6.3,5.28,6.45,7.33,,,,,,,,
LIC MF Short Duration Fund-Reg(G),34304,LIC Mutual Fund,0.75,1.66,3.5,6.07,CRISIL Short Duration Debt Index,4.2,5.4,,2.69,13,4,21,17,21,21,16,,LIC MF Short Duration Fund-Reg(G),Debt : Short Duration,26,27,26,26,26,22,21,19,2.56,0.67,1.67,3.43,6.24,5.45,5.87,6.84,,,,,,,,
WOC Pharma and Healthcare Fund-Reg(G),48472,WhiteOak Capital Mutual Fund,1.47,0.35,,,S&P BSE Health Care - TRI,,,,,,9,6,,,,,,WOC Pharma and Healthcare Fund-Reg(G),Equity : Sectoral - Pharma,14,16,16,13,11,9,8,3,11.78,1.63,0.43,19.83,51.57,14.56,24.6,15.9,3.14,0.49,21.15,56.63,14.62,22.82,15.3,33.77
SBI FMP-50-1843D-Reg(G),45842,SBI Mutual Fund,0.64,1.86,3.97,6.68,CRISIL Medium to Long Term Debt Index,,,,2.88,33,45,30,35,48,,,,SBI FMP-50-1843D-Reg(G),Debt : FTP/FMP,102,109,102,93,91,21,17,12,2.7,0.64,1.84,3.88,6.75,5.53,5.71,6.18,,,,,,,,
DSP Silver ETF,46354,DSP Mutual Fund,3.44,21.07,16.23,19.17,Silver,,,,17.42,6,7,8,20,18,,,,DSP Silver ETF,Gold : ETFs,25,28,27,23,21,11,11,11,16.52,1.63,19.7,18.4,19.94,14.01,17.02,9.28,,,,,,,,
Edelweiss Emerging Markets Opp Eq. Offshore Fund-Reg(G),20281,Edelweiss Mutual Fund,8.68,8.03,12.56,14.74,MSCI Emerging Market Index,-3.9,5.1,,8.53,36,10,17,39,39,32,21,,Edelweiss Emerging Markets Opp Eq. Offshore Fund-Reg(G),FoFs : Overseas,57,58,57,57,56,37,26,23,8.72,6.05,7.27,15.25,22.83,4.99,10.13,6.53,,,,,,,,
Union Dynamic Bond(G),16032,Union Mutual Fund,1.23,1.33,4.1,5.55,CRISIL Dynamic Bond Index,3.96,6.0,6.42,3.1,14,8,17,11,20,20,15,18,Union Dynamic Bond(G),Debt : Dynamic Bond,22,22,22,22,22,21,21,18,3.19,1.06,1.48,4.13,6.3,5.28,6.45,7.33,,,,,,,,
Mirae Asset Nifty 100 ESG Sector Leaders FoF-Reg(G),45135,Mirae Asset Mutual Fund,2.45,3.1,16.01,27.75,Nifty100 ESG Sector Leaders - TRI,13.64,,,5.49,37,25,33,22,20,22,,,Mirae Asset Nifty 100 ESG Sector Leaders FoF-Reg(G),FoFs : Domestic,53,56,55,53,53,37,25,22,8.18,2.34,6.15,14.05,24.59,14.07,13.32,11.05,,,,,,,,
Bajaj Finserv Banking and PSU Fund-Reg(G),48214,Bajaj Finserv Mutual Fund,0.81,1.7,3.78,,NIFTY Banking and PSU Debt Index,,,,2.81,16,3,25,5,,,,,Bajaj Finserv Banking and PSU Fund-Reg(G),Debt : Banking & PSU,27,27,27,27,26,22,16,15,2.85,0.71,1.79,3.67,6.51,5.09,6.66,7.22,,,,,,,,
SBI FMP-92-91D-Reg(G),48470,SBI Mutual Fund,0.58,1.92,,,CRISIL Liquid Debt Index,,,,,,69,10,,,,,,SBI FMP-92-91D-Reg(G),Debt : FTP/FMP,102,109,102,93,91,21,17,12,2.7,0.64,1.84,3.88,6.75,5.53,5.71,6.18,,,,,,,,
ICICI Pru India Equity (FOF)(G),44626,ICICI Prudential Mutual Fund,3.2,4.76,24.23,47.91,S&P BSE 500 - TRI,24.31,,,12.99,10,14,22,5,5,2,,,ICICI Pru India Equity (FOF)(G),FoFs : Domestic,53,56,55,53,53,37,25,22,8.18,2.34,6.15,14.05,24.59,14.07,13.32,11.05,4.13,4.9,20.36,38.34,19.27,19.21,12.44,23.2
SBI FMP-43-1616D-Reg(G),45525,SBI Mutual Fund,0.64,1.82,3.8,6.9,CRISIL Medium Duration Debt Index,5.36,,,2.84,44,48,60,55,17,13,,,SBI FMP-43-1616D-Reg(G),Debt : FTP/FMP,102,109,102,93,91,21,17,12,2.7,0.64,1.84,3.88,6.75,5.53,5.71,6.18,,,,,,,,
Tata Nifty G-Sec Dec 2026 Index Fund-Reg(G),47436,Tata Mutual Fund,0.68,1.66,3.7,6.23,Nifty G-sec Dec 2026 Index,,,,2.55,28,18,21,13,23,,,,Tata Nifty G-Sec Dec 2026 Index Fund-Reg(G),Debt : Medium Duration,30,30,30,30,30,14,13,10,2.78,0.71,1.72,3.73,6.35,5.84,5.59,7.17,,,,,,,,
LIC MF Long Term Value Fund-Reg(G),39956,LIC Mutual Fund,3.98,3.36,18.78,35.28,NIFTY 500 - TRI,17.62,16.98,,8.54,20,12,17,21,21,17,15,,LIC MF Long Term Value Fund-Reg(G),Equity : Value / Contra,22,22,22,22,21,18,17,14,12.0,4.07,5.1,23.95,47.62,23.38,20.91,17.22,,,,,,,,
HSBC Nifty Next 50 Index Fund-Reg(G),33548,HSBC Mutual Fund,8.04,14.37,42.84,63.81,NIFTY NEXT 50 - TRI,22.49,,,25.53,8,18,7,10,19,12,,,HSBC Nifty Next 50 Index Fund-Reg(G),Equity : Index Funds,105,115,108,103,91,40,23,18,11.01,3.99,5.03,22.94,44.88,18.64,16.26,12.81,,,,,,,,
SBI Magnum Childrens Benefit Fund-Savings Plan,2748,SBI Mutual Fund,1.74,2.55,8.06,17.92,NIFTY 50 Hybrid Composite Debt 15:85 Index,12.67,11.79,12.2,5.01,25,32,32,32,25,21,18,7,SBI Magnum Childrens Benefit Fund-Savings Plan,Hybrid : Solution Oriented,40,41,40,39,38,37,29,13,6.53,2.9,4.31,13.02,25.26,13.88,12.74,12.2,,,,,,,,
Nippon India Nifty G-Sec Oct 2028 Maturity Index Fund-Reg(G),47629,Nippon India Mutual Fund,0.87,1.67,3.89,6.25,Nifty G-Sec Oct 2028 Index,,,,2.62,49,17,38,39,38,,,,Nippon India Nifty G-Sec Oct 2028 Maturity Index Fund-Reg(G),Debt : Medium to Long Duration,52,52,52,52,52,11,11,11,2.86,0.82,1.72,3.97,6.27,5.0,5.94,6.78,,,,,,,,
Canara Rob Dynamic Bond Fund-Reg(G),7792,Canara Robeco Mutual Fund,0.98,1.07,3.99,5.15,CRISIL Dynamic Bond Index,4.2,5.66,6.86,3.03,15,16,21,14,21,19,19,15,Canara Rob Dynamic Bond Fund-Reg(G),Debt : Dynamic Bond,22,22,22,22,22,21,21,18,3.19,1.06,1.48,4.13,6.3,5.28,6.45,7.33,,,,,,,,
Tata Gold ETF,48435,Tata Mutual Fund,1.25,18.34,,,Gold-India,,,,,,12,18,,,,,,Tata Gold ETF,Gold : ETFs,25,28,27,23,21,11,11,11,16.52,1.63,19.7,18.4,19.94,14.01,17.02,9.28,,,,,,,,
HSBC Conservative Hybrid Fund(G),1458,HSBC Mutual Fund,2.88,5.35,9.39,14.83,NIFTY 50 Hybrid Composite Debt 15:85 Index,8.57,8.95,8.16,6.88,1,1,1,1,4,9,8,11,HSBC Conservative Hybrid Fund(G),Hybrid : Debt Oriented (Conservative),19,19,19,19,19,18,18,18,4.02,1.4,2.32,6.85,12.14,8.59,8.33,8.36,,,,,,,,
Kotak Nifty 100 Low Volatility 30 ETF,45688,Kotak Mahindra Mutual Fund,1.47,-0.22,15.76,33.11,Nifty100 Low Volatility 30 - TRI,,,,4.41,79,125,124,73,64,,,,Kotak Nifty 100 Low Volatility 30 ETF,Equity : ETFs,141,149,145,141,129,77,56,23,8.76,3.47,3.58,19.87,38.0,18.62,17.5,13.17,,,,,,,,
ICICI Pru S&P BSE 500 ETF FOF-Reg(G),45726,ICICI Prudential Mutual Fund,3.04,4.38,19.3,35.66,S&P BSE 500 - TRI,,,,8.21,18,15,26,8,8,,,,ICICI Pru S&P BSE 500 ETF FOF-Reg(G),FoFs : Domestic,53,56,55,53,53,37,25,22,8.18,2.34,6.15,14.05,24.59,14.07,13.32,11.05,4.13,4.9,20.36,38.34,19.27,19.21,12.44,23.2
WOC Balanced Hybrid Fund-Reg(G),48213,WhiteOak Capital Mutual Fund,2.38,4.08,11.3,,CRISIL Hybrid 50+50 - Moderate Index,,,,6.12,15,11,9,18,,,,,WOC Balanced Hybrid Fund-Reg(G),Hybrid : Dynamic Asset Allocation,30,32,30,28,26,20,17,10,6.52,1.97,3.28,13.25,24.81,12.51,12.24,11.02,,,,,,,,
Canara Rob Gilt Fund-Reg(G),538,Canara Robeco Mutual Fund,1.14,1.32,4.47,5.98,CRISIL Dynamic Gilt Index,4.68,6.39,7.79,3.42,10,19,29,9,28,18,14,12,Canara Rob Gilt Fund-Reg(G),Debt : Gilt,35,35,35,35,35,23,21,21,3.23,1.12,1.54,4.29,6.36,4.89,6.78,7.88,,,,,,,,
ICICI Pru Nifty Healthcare ETF,45383,ICICI Prudential Mutual Fund,1.19,-0.15,20.0,52.03,Nifty Healthcare Index - TRI,,,,13.18,37,130,120,53,39,,,,ICICI Pru Nifty Healthcare ETF,Equity : ETFs,141,149,145,141,129,77,56,23,8.76,3.47,3.58,19.87,38.0,18.62,17.5,13.17,,,,,,,,
Union Medium Duration Fund-Reg(G),44157,Union Mutual Fund,0.81,1.63,3.68,5.99,CRISIL Medium Duration Debt Index,4.41,,,2.69,21,5,22,16,25,12,,,Union Medium Duration Fund-Reg(G),Debt : Medium Duration,30,30,30,30,30,14,13,10,2.78,0.71,1.72,3.73,6.35,5.84,5.59,7.17,,,,,,,,
Aditya Birla SL Retirement Fund-40-Reg(G),42770,Aditya Birla Sun Life Mutual Fund,2.54,3.26,12.46,26.09,CRISIL Hybrid 35+65 - Aggressive Index,10.78,10.78,,5.23,24,23,22,20,19,24,20,,Aditya Birla SL Retirement Fund-40-Reg(G),Hybrid : Solution Oriented,40,41,40,39,38,37,29,13,6.53,2.9,4.31,13.02,25.26,13.88,12.74,12.2,,,,,,,,
Nippon India ETF Nifty Infrastructure BeES,12859,Nippon India Mutual Fund,3.46,6.45,33.58,59.32,Nifty Infrastructure - TRI,27.52,23.34,11.75,17.8,30,54,40,26,24,8,6,20,Nippon India ETF Nifty Infrastructure BeES,Equity : ETFs,141,149,145,141,129,77,56,23,8.76,3.47,3.58,19.87,38.0,18.62,17.5,13.17,,,,,,,,
Nippon India FHF-XLV-4-1111D(G),47822,Nippon India Mutual Fund,0.59,1.83,3.84,6.58,CRISIL Medium Duration Debt Index,,,,2.75,65,65,56,48,69,,,,Nippon India FHF-XLV-4-1111D(G),Debt : FTP/FMP,102,109,102,93,91,21,17,12,2.7,0.64,1.84,3.88,6.75,5.53,5.71,6.18,,,,,,,,
Sundaram Arbitrage Fund(G),32098,Sundaram Mutual Fund,0.64,1.81,3.72,7.28,Nifty 50 Arbitrage - TRI,4.92,3.97,,2.94,21,1,20,21,19,21,21,,Sundaram Arbitrage Fund(G),Hybrid : Arbitrage,26,26,26,26,24,24,21,10,3.05,0.57,1.87,3.84,7.5,5.4,5.02,5.89,,,,,,,,
PGIM India Emerging Markets Equity Fund(G),815,PGIM India Mutual Fund,12.07,8.48,20.1,32.55,MSCI Emerging Market Index,-5.41,2.07,1.52,13.55,9,5,16,10,17,33,24,21,PGIM India Emerging Markets Equity Fund(G),FoFs : Overseas,57,58,57,57,56,37,26,23,8.72,6.05,7.27,15.25,22.83,4.99,10.13,6.53,,,,,,,,
Axis NIFTY IT Index Fund-Reg(G),47983,Axis Mutual Fund,-0.33,-13.04,3.88,,NIFTY IT - TRI,,,,-5.7,103,114,106,103,,,,,Axis NIFTY IT Index Fund-Reg(G),Equity : Index Funds,105,115,108,103,91,40,23,18,11.01,3.99,5.03,22.94,44.88,18.64,16.26,12.81,,,,,,,,
Mirae Asset Nifty Bank ETF,47993,Mirae Asset Mutual Fund,1.71,4.12,10.78,,NIFTY BANK - TRI,,,,0.0,116,81,54,112,,,,,Mirae Asset Nifty Bank ETF,Equity : ETFs,141,149,145,141,129,77,56,23,8.76,3.47,3.58,19.87,38.0,18.62,17.5,13.17,,,,,,,,
