Kotak FMP-323-90D(G),48318,Kotak Mahindra Mutual Fund,0.61,,,,Nifty Liquid Fund Index,,,,0.68,102,84,,,,,,,Kotak FMP-323-90D(G),Debt : FTP/FMP,102,109,102,93,91,21,17,12,2.95,0.76,1.84,4.05,6.79,5.52,5.64,6.17,,,,,,,,
Mahindra Manulife Overnight Fund-Reg(G),42560,Mahindra Mutual Fund,0.53,1.6,3.29,6.69,CRISIL Liquid Overnight Index,5.26,,,2.68,19,23,19,23,22,11,,,Mahindra Manulife Overnight Fund-Reg(G),Debt : Overnight,35,35,35,35,32,27,16,3,2.67,0.53,1.6,3.29,6.71,5.25,4.67,5.75,,,,,,,,
Edelweiss CRISIL IBX 50:50 Gilt Plus SDL Short Duration Index Fund-Reg(G),47430,Edelweiss Mutual Fund,0.9,1.75,4.02,6.47,CRISIL IBX 50:50 Gilt Plus SDL Short Duration Index,,,,2.95,16,2,11,8,15,,,,Edelweiss CRISIL IBX 50:50 Gilt Plus SDL Short Duration Index Fund-Reg(G),Debt : Short Duration,26,27,26,26,26,22,21,19,2.82,0.8,1.67,3.75,6.35,5.48,5.78,6.83,,,,,,,,
Canara Rob Corp Bond Fund-Reg(G),23504,Canara Robeco Mutual Fund,0.74,1.75,3.77,6.13,CRISIL Corporate Bond Index,4.54,5.87,6.78,2.97,18,20,17,19,20,17,16,10,Canara Rob Corp Bond Fund-Reg(G),Debt : Corporate Bond,21,21,21,21,21,19,18,12,3.14,0.89,1.83,4.02,6.66,5.08,6.37,7.28,,,,,,,,
Baroda BNP Paribas Corp Bond Fund(G),6932,Baroda BNP Paribas Mutual Fund,0.91,1.72,4.18,6.34,CRISIL Corporate Bond Index,4.5,4.37,6.1,3.26,6,11,19,5,16,19,18,12,Baroda BNP Paribas Corp Bond Fund(G),Debt : Corporate Bond,21,21,21,21,21,19,18,12,3.14,0.89,1.83,4.02,6.66,5.08,6.37,7.28,,,,,,,,
Axis Greater China Equity FoF-Reg(G),44318,Axis Mutual Fund,4.75,9.63,5.06,3.52,MSCI Golden Dragon Index (Total Return Net),-9.25,,,6.41,35,28,10,48,49,34,,,Axis Greater China Equity FoF-Reg(G),FoFs : Overseas,57,58,57,57,56,37,26,23,7.56,4.26,5.6,12.89,21.36,4.16,10.3,6.28,,,,,,,,
SBI FMP-74-1243D-Reg(G),47381,SBI Mutual Fund,0.78,1.85,4.08,6.82,CRISIL Medium Duration Debt Index,,,,3.17,32,44,45,39,27,,,,SBI FMP-74-1243D-Reg(G),Debt : FTP/FMP,102,109,102,93,91,21,17,12,2.95,0.76,1.84,4.05,6.79,5.52,5.64,6.17,,,,,,,,
Nippon India ETF Nifty 5 yr Benchmark G-Sec,45428,Nippon India Mutual Fund,1.24,1.85,4.49,6.86,Nifty 5 yr Benchmark G-Sec Index TRI,4.96,,,3.0,13,7,10,9,7,8,,,Nippon India ETF Nifty 5 yr Benchmark G-Sec,Debt : ETFs,22,26,25,22,17,14,6,1,2.84,0.95,1.71,3.93,6.7,4.94,5.08,5.05,,,,,,,,
Bank of India Ultra Short Duration Fund-Reg(G),5842,Bank of India Mutual Fund,0.51,1.65,3.26,6.3,CRISIL Ultra Short Term Debt Index,5.07,5.13,6.75,2.69,21,22,21,22,22,19,11,4,Bank of India Ultra Short Duration Fund-Reg(G),Debt : Ultra Short Duration,24,24,24,24,24,24,18,13,2.93,0.55,1.78,3.56,6.84,5.35,5.37,6.39,,,,,,,,
Mirae Asset Money Market Fund-Reg(G),45753,Mirae Asset Mutual Fund,0.56,1.87,3.77,7.16,Nifty Money Market Index,,,,3.04,13,13,13,12,12,,,,Mirae Asset Money Market Fund-Reg(G),Debt : Money Market,22,22,22,22,21,17,14,13,3.06,0.56,1.86,3.73,7.17,5.62,5.74,6.68,,,,,,,,
SBI FMP-80-366D-Reg(G),47805,SBI Mutual Fund,0.55,1.82,3.54,,NIFTY Low Duration Debt Index,,,,1.58,95,101,60,88,,,,,SBI FMP-80-366D-Reg(G),Debt : FTP/FMP,102,109,102,93,91,21,17,12,2.95,0.76,1.84,4.05,6.79,5.52,5.64,6.17,,,,,,,,
Franklin India G-Sec Fund(G),3373,Franklin Templeton Mutual Fund,0.89,1.6,3.37,5.29,Nifty All Duration G-Sec Index,4.18,5.03,6.69,2.52,35,33,35,35,35,23,21,21,Franklin India G-Sec Fund(G),Debt : Gilt,35,35,35,35,35,23,21,21,3.74,1.56,1.85,5.06,6.88,5.03,6.66,7.82,,,,,,,,
Kotak FMP-328-90D(G),48490,Kotak Mahindra Mutual Fund,0.56,1.95,,,Nifty Liquid Fund Index,,,,,,100,13,,,,,,Kotak FMP-328-90D(G),Debt : FTP/FMP,102,109,102,93,91,21,17,12,2.95,0.76,1.84,4.05,6.79,5.52,5.64,6.17,,,,,,,,
JM Large Cap Fund-Reg(G),1858,JM Financial Mutual Fund,4.24,6.71,30.08,47.37,S&P BSE 100 - TRI,21.53,17.88,13.44,15.08,5,4,14,2,4,4,4,18,JM Large Cap Fund-Reg(G),Equity : Large Cap,36,37,37,36,36,33,31,28,10.57,3.01,5.93,21.43,34.86,16.85,15.73,13.93,3.15,5.1,19.66,30.28,17.43,16.55,12.13,21.43
Canara Rob Overnight Fund-Reg(G),43350,Canara Robeco Mutual Fund,0.53,1.6,3.29,6.71,CRISIL Liquid Overnight Index,5.29,,,2.67,22,30,24,25,16,4,,,Canara Rob Overnight Fund-Reg(G),Debt : Overnight,35,35,35,35,32,27,16,3,2.67,0.53,1.6,3.29,6.71,5.25,4.67,5.75,,,,,,,,
Edelweiss NIFTY Large Mid Cap 250 Index Fund-Reg(G),45864,Edelweiss Mutual Fund,3.86,6.88,22.74,43.02,NIFTY LargeMidcap 250 - TRI,,,,11.93,44,46,40,40,45,,,,Edelweiss NIFTY Large Mid Cap 250 Index Fund-Reg(G),Equity : Index Funds,105,120,111,103,92,41,23,18,12.93,3.88,6.66,25.41,45.37,18.37,15.67,12.85,,,,,,,,
HDFC FMP-Sr 47-2638D-Feb 2023-Reg(G),47642,HDFC Mutual Fund,1.28,1.89,4.82,6.59,NIFTY Long Duration Debt Index,,,,3.32,11,2,24,3,75,,,,HDFC FMP-Sr 47-2638D-Feb 2023-Reg(G),Debt : FTP/FMP,102,109,102,93,91,21,17,12,2.95,0.76,1.84,4.05,6.79,5.52,5.64,6.17,,,,,,,,
Bank of India Bluechip Fund-Reg(G),45571,Bank of India Mutual Fund,2.48,6.14,25.24,45.38,NIFTY 100 - TRI,,,,12.52,9,28,18,9,6,,,,Bank of India Bluechip Fund-Reg(G),Equity : Large Cap,36,37,37,36,36,33,31,28,10.57,3.01,5.93,21.43,34.86,16.85,15.73,13.93,,,,,,,,
Tata Equity Savings Fund-Reg(G),3273,Tata Mutual Fund,2.01,3.36,9.9,15.68,NIFTY 50 Equity Savings Index,9.4,8.75,7.79,5.84,34,24,34,37,41,39,38,22,Tata Equity Savings Fund-Reg(G),Hybrid : Equity Oriented,55,55,55,55,54,52,47,24,7.23,1.99,4.17,13.01,22.85,12.34,12.28,11.7,,,,,,,,
JM ELSS Tax Saver Fund(G),4198,JM Financial Mutual Fund,4.21,9.9,27.44,48.28,S&P BSE 500 - TRI,22.58,20.73,17.31,17.67,5,10,7,7,8,17,19,6,JM ELSS Tax Saver Fund(G),Equity : Tax Saving (ELSS),60,60,60,60,59,55,53,27,10.45,3.01,6.17,20.43,38.79,20.57,19.23,15.4,3.44,6.04,22.13,37.74,19.26,18.43,12.44,26.5
Baroda BNP Paribas Dynamic Bond Fund(G),116,Baroda BNP Paribas Mutual Fund,1.64,1.85,4.63,6.39,CRISIL Dynamic Bond Index,5.01,5.68,6.95,3.44,17,9,10,16,15,12,17,12,Baroda BNP Paribas Dynamic Bond Fund(G),Debt : Dynamic Bond,22,22,22,22,22,21,21,18,3.66,1.47,1.74,4.81,6.75,5.38,6.33,7.31,,,,,,,,
Edelweiss MSCI India Domestic & World Healthcare 45 Index Fund-Reg(G),45117,Edelweiss Mutual Fund,1.89,-1.14,17.0,38.79,MSCI India Domestic & World Healthcare 45 Index,12.34,,,11.08,51,99,107,68,46,40,,,Edelweiss MSCI India Domestic & World Healthcare 45 Index Fund-Reg(G),Equity : Index Funds,105,120,111,103,92,41,23,18,12.93,3.88,6.66,25.41,45.37,18.37,15.67,12.85,,,,,,,,
Nippon India Nifty Auto ETF,45713,Nippon India Mutual Fund,7.96,14.79,40.0,69.77,NIFTY AUTO - TRI,,,,27.83,16,13,15,21,13,,,,Nippon India Nifty Auto ETF,Equity : ETFs,141,149,147,141,129,78,56,23,10.65,3.56,5.32,22.16,38.46,18.09,16.87,13.06,,,,,,,,
JM Arbitrage Fund(G),1843,JM Financial Mutual Fund,0.58,1.61,3.52,7.07,Nifty 50 Arbitrage,5.2,4.35,5.34,3.06,19,9,21,21,19,19,19,10,JM Arbitrage Fund(G),Hybrid : Arbitrage,26,26,26,26,24,24,21,10,3.07,0.58,1.68,3.67,7.32,5.37,4.98,5.85,0.6,1.82,3.98,8.03,5.86,5.06,,7.77
ICICI Pru Nifty FMCG ETF,45651,ICICI Prudential Mutual Fund,1.88,1.87,5.69,10.74,NIFTY FMCG - TRI,,,,-2.45,132,122,120,140,123,,,,ICICI Pru Nifty FMCG ETF,Equity : ETFs,141,149,147,141,129,78,56,23,10.65,3.56,5.32,22.16,38.46,18.09,16.87,13.06,,,,,,,,
Navi Nifty Midcap 150 Index Fund-Reg(G),45861,Navi Mutual Fund,4.39,8.22,24.53,55.86,Nifty Midcap 150 - TRI,,,,13.56,38,44,38,38,38,,,,Navi Nifty Midcap 150 Index Fund-Reg(G),Equity : Index Funds,105,120,111,103,92,41,23,18,12.93,3.88,6.66,25.41,45.37,18.37,15.67,12.85,,,,,,,,
Bank of India Credit Risk Fund-Reg(G),30390,Bank of India Mutual Fund,0.23,1.22,3.67,6.37,CRISIL Credit Risk Debt Index,39.69,-1.6,,3.09,10,15,15,13,14,1,15,,Bank of India Credit Risk Fund-Reg(G),Debt : Credit Risk,15,15,15,15,15,15,15,8,3.17,0.8,1.78,3.97,7.53,8.87,5.08,6.66,,,,,,,,
Invesco India Credit Risk Fund(G),21522,Invesco Mutual Fund,0.89,1.69,3.83,8.06,NIFTY Credit Risk Bond Index,6.13,5.41,,2.98,11,3,12,10,2,9,10,,Invesco India Credit Risk Fund(G),Debt : Credit Risk,15,15,15,15,15,15,15,8,3.17,0.8,1.78,3.97,7.53,8.87,5.08,6.66,,,,,,,,
Shriram Multi Asset Allocation Fund-Reg(G),48029,Shriram Mutual Fund,1.83,6.04,20.46,,NIFTY 50 - TRI,,,,10.53,7,16,14,3,,,,,Shriram Multi Asset Allocation Fund-Reg(G),Hybrid : Multi Asset Allocation,17,24,20,17,13,10,7,7,9.79,2.04,5.93,16.63,28.86,16.24,17.4,12.81,,,,,,,,
Mirae Asset Nifty 100 ESG Sector Leaders ETF,45134,Mirae Asset Mutual Fund,2.94,3.87,18.3,28.5,Nifty100 ESG Sector Leaders - TRI,13.88,,,7.62,76,65,87,71,77,58,,,Mirae Asset Nifty 100 ESG Sector Leaders ETF,Equity : ETFs,141,149,147,141,129,78,56,23,10.65,3.56,5.32,22.16,38.46,18.09,16.87,13.06,,,,,,,,
DSP World Energy Fund-Reg(G),7866,DSP Mutual Fund,7.48,7.87,11.63,5.53,MSCI World,5.6,8.11,2.27,0.54,49,3,15,37,47,19,18,20,DSP World Energy Fund-Reg(G),FoFs : Overseas,57,58,57,57,56,37,26,23,7.56,4.26,5.6,12.89,21.36,4.16,10.3,6.28,,,,,,,,
Aditya Birla SL FMP-US-100D-Reg(G),48501,Aditya Birla Sun Life Mutual Fund,0.64,1.91,,,CRISIL Ultra Short Term Debt Index,,,,,,81,20,,,,,,Aditya Birla SL FMP-US-100D-Reg(G),Debt : FTP/FMP,102,109,102,93,91,21,17,12,2.95,0.76,1.84,4.05,6.79,5.52,5.64,6.17,,,,,,,,
SBI FMP-47-1434D-Reg(G),45660,SBI Mutual Fund,0.67,1.82,3.85,6.82,CRISIL Medium Duration Debt Index,,,,3.1,44,75,58,72,24,,,,SBI FMP-47-1434D-Reg(G),Debt : FTP/FMP,102,109,102,93,91,21,17,12,2.95,0.76,1.84,4.05,6.79,5.52,5.64,6.17,,,,,,,,
ICICI Pru Debt Mgmt Fund(FOF)(G),1707,ICICI Prudential Mutual Fund,1.08,2.17,4.33,7.47,CRISIL Composite Bond Index,5.73,6.77,7.97,3.4,48,43,44,47,44,30,22,19,ICICI Pru Debt Mgmt Fund(FOF)(G),FoFs : Domestic,53,56,55,53,53,37,25,22,9.76,3.0,7.35,15.55,25.55,13.75,12.89,11.0,,,,,,,,
Kotak India Growth Fund-Sr 4(G),38109,Kotak Mahindra Mutual Fund,3.48,16.25,23.0,48.85,NIFTY 200,24.54,26.76,,4.71,36,13,1,13,9,4,2,,Kotak India Growth Fund-Sr 4(G),Equity : Multi Cap,37,38,38,37,33,24,18,13,11.39,3.24,7.0,21.55,41.57,19.59,19.38,15.99,3.3,5.77,21.63,34.0,17.04,16.0,10.37,24.54
Axis NIFTY IT ETF,45427,Axis Mutual Fund,1.28,-9.97,6.58,17.87,NIFTY IT - TRI,9.6,,,-4.08,136,138,140,137,111,74,,,Axis NIFTY IT ETF,Equity : ETFs,141,149,147,141,129,78,56,23,10.65,3.56,5.32,22.16,38.46,18.09,16.87,13.06,,,,,,,,
Union Gilt Fund-Reg(G),46221,Union Mutual Fund,2.08,2.01,5.41,6.87,CRISIL Dynamic Gilt Index,,,,3.94,14,4,6,10,15,,,,Union Gilt Fund-Reg(G),Debt : Gilt,35,35,35,35,35,23,21,21,3.74,1.56,1.85,5.06,6.88,5.03,6.66,7.82,,,,,,,,
LIC MF Focused 30 Equity Fund-Reg(G),32627,LIC Mutual Fund,2.27,5.46,14.37,22.76,NIFTY 500 - TRI,14.54,14.05,,5.32,35,30,22,34,35,26,23,,LIC MF Focused 30 Equity Fund-Reg(G),Equity : Large Cap,36,37,37,36,36,33,31,28,10.57,3.01,5.93,21.43,34.86,16.85,15.73,13.93,,,,,,,,
Groww Nifty Total Market Index Fund-Reg(G),48247,Groww Mutual Fund,3.1,5.62,20.92,,Nifty Total Market - TRI,,,,9.73,54,56,50,54,,,,,Groww Nifty Total Market Index Fund-Reg(G),Equity : Index Funds,105,120,111,103,92,41,23,18,12.93,3.88,6.66,25.41,45.37,18.37,15.67,12.85,,,,,,,,
HDFC NIFTY Midcap 150 Index Fund-Reg(G),46619,HDFC Mutual Fund,4.39,8.32,24.66,55.79,Nifty Midcap 150 - TRI,,,,13.7,37,43,36,37,39,,,,HDFC NIFTY Midcap 150 Index Fund-Reg(G),Equity : Index Funds,105,120,111,103,92,41,23,18,12.93,3.88,6.66,25.41,45.37,18.37,15.67,12.85,,,,,,,,
Mirae Asset Nifty India Manufacturing ETF,45869,Mirae Asset Mutual Fund,8.24,17.38,38.1,61.87,Nifty India Manufacturing - TRI,,,,26.32,20,9,1,23,23,,,,Mirae Asset Nifty India Manufacturing ETF,Equity : ETFs,141,149,147,141,129,78,56,23,10.65,3.56,5.32,22.16,38.46,18.09,16.87,13.06,,,,,,,,
JM Short Duration Fund-Reg(G),46751,JM Financial Mutual Fund,0.83,1.64,3.58,5.87,CRISIL Short Duration Debt Index,,,,2.66,22,18,22,22,24,,,,JM Short Duration Fund-Reg(G),Debt : Short Duration,26,27,26,26,26,22,21,19,2.82,0.8,1.67,3.75,6.35,5.48,5.78,6.83,,,,,,,,
Aditya Birla SL CRISIL IBX SDL Jun 2032 Index Fund-Reg(G),47592,Aditya Birla Sun Life Mutual Fund,1.14,1.88,5.25,6.66,CRISIL IBX SDL Index - June 2032,,,,4.16,15,24,17,16,16,,,,Aditya Birla SL CRISIL IBX SDL Jun 2032 Index Fund-Reg(G),Debt : Long Duration,21,24,21,20,19,3,3,2,4.53,1.79,1.94,5.95,6.86,4.64,6.52,7.5,,,,,,,,
LIC MF Gold ETF,15131,LIC Mutual Fund,-0.94,15.52,16.94,19.44,Gold-India,13.3,17.12,9.52,13.76,17,27,13,12,9,1,1,1,LIC MF Gold ETF,Gold : ETFs,25,28,28,24,21,11,11,11,18.68,4.12,20.7,19.36,22.11,12.84,16.89,9.14,,,,,,,,
ICICI Pru Nifty50 Value 20 ETF,33839,ICICI Prudential Mutual Fund,2.16,1.76,19.64,32.9,Nifty50 Value 20 - TRI,19.47,19.95,,8.58,70,114,123,62,62,24,14,,ICICI Pru Nifty50 Value 20 ETF,Equity : ETFs,141,149,147,141,129,78,56,23,10.65,3.56,5.32,22.16,38.46,18.09,16.87,13.06,,,,,,,,
HSBC Global Equity Climate Change FoF-Reg(G),45333,HSBC Mutual Fund,7.27,6.59,14.56,13.46,MSCI AC World Index,0.93,,,5.46,39,6,18,27,37,26,,,HSBC Global Equity Climate Change FoF-Reg(G),FoFs : Overseas,57,58,57,57,56,37,26,23,7.56,4.26,5.6,12.89,21.36,4.16,10.3,6.28,,,,,,,,
ICICI Pru Nifty Infrastructure ETF,45998,ICICI Prudential Mutual Fund,3.68,7.73,37.3,62.61,Nifty Infrastructure - TRI,,,,20.15,27,49,34,25,22,,,,ICICI Pru Nifty Infrastructure ETF,Equity : ETFs,141,149,147,141,129,78,56,23,10.65,3.56,5.32,22.16,38.46,18.09,16.87,13.06,,,,,,,,
Bank of India Balanced Advantage Fund-Reg(G),21917,Bank of India Mutual Fund,2.14,3.57,17.41,25.45,NIFTY 50 Hybrid Composite Debt 50:50 Index,15.22,10.01,8.49,7.49,12,14,19,4,11,2,14,9,Bank of India Balanced Advantage Fund-Reg(G),Hybrid : Dynamic Asset Allocation,30,32,31,28,26,20,17,10,7.49,1.97,3.93,14.42,25.3,12.37,11.95,10.87,,,,,,,,
Taurus Mid Cap Fund-Reg(G),3306,Taurus Mutual Fund,3.3,8.46,23.02,50.4,Nifty Midcap 150 - TRI,22.98,23.0,18.83,12.64,22,28,22,20,17,18,13,11,Taurus Mid Cap Fund-Reg(G),Equity : Mid Cap,30,30,30,30,30,25,22,20,15.69,5.54,10.35,25.28,52.8,24.7,23.71,19.24,,,,,,,,
ICICI Pru Retirement Fund-Pure Debt Plan(G),25670,ICICI Prudential Mutual Fund,0.81,1.93,3.75,6.41,NIFTY Composite Debt Index,4.53,6.21,,2.92,39,41,38,38,37,36,27,,ICICI Pru Retirement Fund-Pure Debt Plan(G),Hybrid : Solution Oriented,40,41,40,39,38,37,29,13,7.54,2.49,4.87,14.16,25.65,13.41,12.27,12.01,,,,,,,,
Nippon India ETF Nifty 50 Value 20,31920,Nippon India Mutual Fund,2.15,1.73,19.55,32.76,Nifty50 Value 20 - TRI,19.27,20.03,,8.54,71,115,124,65,63,25,13,,Nippon India ETF Nifty 50 Value 20,Equity : ETFs,141,149,147,141,129,78,56,23,10.65,3.56,5.32,22.16,38.46,18.09,16.87,13.06,,,,,,,,
Union Retirement Fund-Reg(G),45735,Union Mutual Fund,2.95,5.85,18.57,38.7,S&P BSE 500 - TRI,,,,9.74,9,13,13,9,5,,,,Union Retirement Fund-Reg(G),Hybrid : Solution Oriented,40,41,40,39,38,37,29,13,7.54,2.49,4.87,14.16,25.65,13.41,12.27,12.01,3.44,6.04,22.13,37.74,19.26,18.43,12.44,26.5
Kotak FMP-329-90D(G),48720,Kotak Mahindra Mutual Fund,0.59,,,,Nifty Liquid Fund Index,,,,,,87,,,,,,,Kotak FMP-329-90D(G),Debt : FTP/FMP,102,109,102,93,91,21,17,12,2.95,0.76,1.84,4.05,6.79,5.52,5.64,6.17,,,,,,,,
Baroda BNP Paribas NIFTY SDL Dec 2026 Index Fund-Reg(G),47387,Baroda BNP Paribas Mutual Fund,0.94,1.91,4.21,6.53,NIFTY SDL December 2026 Index,,,,3.26,16,35,3,40,25,,,,Baroda BNP Paribas NIFTY SDL Dec 2026 Index Fund-Reg(G),Debt : Medium to Long Duration,52,52,52,52,52,11,11,11,3.21,1.09,1.8,4.4,6.46,5.11,5.8,6.76,,,,,,,,
ICICI Pru FMP-88-1226D-F(G),47232,ICICI Prudential Mutual Fund,0.76,1.87,3.99,6.63,CRISIL Medium Duration Debt Index,,,,3.05,57,55,31,51,69,,,,ICICI Pru FMP-88-1226D-F(G),Debt : FTP/FMP,102,109,102,93,91,21,17,12,2.95,0.76,1.84,4.05,6.79,5.52,5.64,6.17,,,,,,,,
Bandhan Nifty 100 Index Fund-Reg(G),46119,Bandhan Mutual Fund,3.29,5.5,21.01,30.82,NIFTY 100 - TRI,,,,9.06,59,49,53,51,60,,,,Bandhan Nifty 100 Index Fund-Reg(G),Equity : Index Funds,105,120,111,103,92,41,23,18,12.93,3.88,6.66,25.41,45.37,18.37,15.67,12.85,,,,,,,,
Canara Rob Income Fund-Reg(G),542,Canara Robeco Mutual Fund,1.52,1.68,4.53,5.35,CRISIL Medium to Long Term Debt Index,3.91,5.65,6.86,3.3,10,3,51,15,52,10,7,6,Canara Rob Income Fund-Reg(G),Debt : Medium to Long Duration,52,52,52,52,52,11,11,11,3.21,1.09,1.8,4.4,6.46,5.11,5.8,6.76,,,,,,,,
Kotak Nifty Alpha 50 ETF,45687,Kotak Mahindra Mutual Fund,6.86,13.78,39.55,85.03,Nifty Alpha 50 - TRI,,,,24.91,22,23,18,22,6,,,,Kotak Nifty Alpha 50 ETF,Equity : ETFs,141,149,147,141,129,78,56,23,10.65,3.56,5.32,22.16,38.46,18.09,16.87,13.06,,,,,,,,
Invesco India Banking and PSU Fund(G),17249,Invesco Mutual Fund,0.99,1.77,4.34,6.77,NIFTY Banking and PSU Debt Index,4.26,5.71,6.42,3.4,2,4,16,2,7,22,16,15,Invesco India Banking and PSU Fund(G),Debt : Banking & PSU,27,27,27,27,26,22,16,15,3.12,0.85,1.78,3.99,6.57,5.09,6.52,7.21,,,,,,,,
SBI FMP-46-1850D-Reg(G),45620,SBI Mutual Fund,0.83,1.88,4.08,6.68,CRISIL Medium to Long Term Debt Index,,,,3.17,30,31,26,38,60,,,,SBI FMP-46-1850D-Reg(G),Debt : FTP/FMP,102,109,102,93,91,21,17,12,2.95,0.76,1.84,4.05,6.79,5.52,5.64,6.17,,,,,,,,
Aditya Birla SL Silver ETF FOF-Reg(G),46225,Aditya Birla Sun Life Mutual Fund,11.06,28.78,23.41,26.41,Silver,,,,22.61,6,4,4,8,25,,,,Aditya Birla SL Silver ETF FOF-Reg(G),FoFs : Domestic,53,56,55,53,53,37,25,22,9.76,3.0,7.35,15.55,25.55,13.75,12.89,11.0,,,,,,,,
Groww Largecap Fund-Reg(G),15997,Groww Mutual Fund,4.48,7.01,25.05,35.62,NIFTY 100 - TRI,17.04,13.38,12.73,11.66,12,2,9,10,14,13,30,21,Groww Largecap Fund-Reg(G),Equity : Large Cap,36,37,37,36,36,33,31,28,10.57,3.01,5.93,21.43,34.86,16.85,15.73,13.93,,,,,,,,
PGIM India Gilt Fund(G),7012,PGIM India Mutual Fund,1.94,1.79,5.33,7.15,CRISIL Dynamic Gilt Index,4.79,6.15,7.41,4.02,9,9,22,11,10,19,15,14,PGIM India Gilt Fund(G),Debt : Gilt,35,35,35,35,35,23,21,21,3.74,1.56,1.85,5.06,6.88,5.03,6.66,7.82,,,,,,,,
Nippon India Strategic Debt Fund(G),21911,Nippon India Mutual Fund,0.93,1.91,4.06,6.22,CRISIL Medium Duration Debt Index,9.25,-0.37,,3.21,7,14,3,15,25,2,13,,Nippon India Strategic Debt Fund(G),Debt : Medium Duration,30,30,30,30,30,14,13,10,3.08,0.89,1.76,4.07,6.49,5.86,5.49,7.14,,,,,,,,
Union Equity Savings Fund-Reg(G),40627,Union Mutual Fund,1.16,1.81,7.89,13.74,Crisil Equity Savings Index,7.73,8.23,,4.05,46,42,51,46,46,47,41,,Union Equity Savings Fund-Reg(G),Hybrid : Equity Oriented,55,55,55,55,54,52,47,24,7.23,1.99,4.17,13.01,22.85,12.34,12.28,11.7,,,,,,,,
Kotak FMP-310-1131D(G),47871,Kotak Mahindra Mutual Fund,0.76,1.82,3.93,6.57,NIFTY Medium Duration Debt Index,,,,3.0,68,56,63,59,76,,,,Kotak FMP-310-1131D(G),Debt : FTP/FMP,102,109,102,93,91,21,17,12,2.95,0.76,1.84,4.05,6.79,5.52,5.64,6.17,,,,,,,,
Nippon India FMP-XLVI-1(G),48149,Nippon India Mutual Fund,0.54,1.92,,,NIFTY Ultra Short Duration Debt Index,,,,1.67,94,104,17,,,,,,Nippon India FMP-XLVI-1(G),Debt : FTP/FMP,102,109,102,93,91,21,17,12,2.95,0.76,1.84,4.05,6.79,5.52,5.64,6.17,,,,,,,,
Axis S&P BSE Sensex ETF,47768,Axis Mutual Fund,2.53,3.38,14.66,22.03,S&P BSE SENSEX - TRI,,,,4.44,109,104,115,106,100,,,,Axis S&P BSE Sensex ETF,Equity : ETFs,141,149,147,141,129,78,56,23,10.65,3.56,5.32,22.16,38.46,18.09,16.87,13.06,2.56,3.45,14.79,22.25,15.29,15.07,12.12,11.87
PGIM India Arbitrage Fund-Reg(G),28514,PGIM India Mutual Fund,0.65,1.6,3.51,6.92,Nifty 50 Arbitrage,5.19,4.81,,2.88,23,2,22,22,22,20,17,,PGIM India Arbitrage Fund-Reg(G),Hybrid : Arbitrage,26,26,26,26,24,24,21,10,3.07,0.58,1.68,3.67,7.32,5.37,4.98,5.85,0.6,1.82,3.98,8.03,5.86,5.06,,7.77
Quantum Equity FoF-Reg(G),19904,Quantum Mutual Fund,4.09,8.09,21.18,35.48,S&P BSE 200 - TRI,17.24,15.86,14.3,11.9,13,10,12,14,11,11,6,3,Quantum Equity FoF-Reg(G),FoFs : Domestic,53,56,55,53,53,37,25,22,9.76,3.0,7.35,15.55,25.55,13.75,12.89,11.0,3.64,6.05,22.2,35.56,18.56,17.86,12.47,26.12
ICICI Pru Global Stable Equity Fund(FOF)(G),16718,ICICI Prudential Mutual Fund,0.66,-0.9,4.93,7.3,MSCI World,6.13,10.15,8.87,0.54,50,54,54,49,45,18,13,6,ICICI Pru Global Stable Equity Fund(FOF)(G),FoFs : Overseas,57,58,57,57,56,37,26,23,7.56,4.26,5.6,12.89,21.36,4.16,10.3,6.28,,,,,,,,
Kotak Nifty SDL Jul 2026 Index Fund-Reg(G),46729,Kotak Mahindra Mutual Fund,0.85,1.84,4.11,6.65,Nifty SDL Jul 2026 Index,,,,3.16,32,46,14,48,10,,,,Kotak Nifty SDL Jul 2026 Index Fund-Reg(G),Debt : Medium to Long Duration,52,52,52,52,52,11,11,11,3.21,1.09,1.8,4.4,6.46,5.11,5.8,6.76,,,,,,,,
Bandhan All Seasons Bond Fund-Reg(G),2850,Bandhan Mutual Fund,0.87,1.77,4.0,6.5,NIFTY Medium Duration Debt Index,4.97,6.48,7.23,2.96,52,48,48,50,49,37,23,20,Bandhan All Seasons Bond Fund-Reg(G),FoFs : Domestic,53,56,55,53,53,37,25,22,9.76,3.0,7.35,15.55,25.55,13.75,12.89,11.0,,,,,,,,
DSP FMP 268-1281D-Reg(G),47124,DSP Mutual Fund,0.8,1.81,4.09,6.81,CRISIL Medium Duration Debt Index,,,,3.13,38,40,68,37,31,,,,DSP FMP 268-1281D-Reg(G),Debt : FTP/FMP,102,109,102,93,91,21,17,12,2.95,0.76,1.84,4.05,6.79,5.52,5.64,6.17,,,,,,,,
Bandhan Regular Savings Fund-Reg(G),8465,Bandhan Mutual Fund,1.54,2.22,6.41,9.73,NIFTY AAA Short Duration Bond Index,5.69,6.31,7.44,3.21,17,9,13,14,15,18,16,15,Bandhan Regular Savings Fund-Reg(G),Hybrid : Debt Oriented (Conservative),19,19,19,19,19,19,18,18,4.55,1.46,2.56,7.47,12.42,8.57,8.09,8.28,,,,,,,,
SBI FMP-78-1170D-Reg(G),47638,SBI Mutual Fund,0.73,1.78,3.93,6.65,CRISIL Medium Duration Debt Index,,,,3.02,64,67,83,63,67,,,,SBI FMP-78-1170D-Reg(G),Debt : FTP/FMP,102,109,102,93,91,21,17,12,2.95,0.76,1.84,4.05,6.79,5.52,5.64,6.17,,,,,,,,
Sundaram Global Brand Fund(G),3005,Sundaram Mutual Fund,-0.02,-0.15,7.96,19.01,MSCI AC World Index,7.62,13.39,7.27,4.95,42,56,52,45,29,14,9,8,Sundaram Global Brand Fund(G),FoFs : Overseas,57,58,57,57,56,37,26,23,7.56,4.26,5.6,12.89,21.36,4.16,10.3,6.28,,,,,,,,
Quantum Gold Saving Fund-Reg(G),19961,Quantum Mutual Fund,-0.61,15.63,16.95,18.85,Gold-India,12.77,16.48,8.85,13.83,9,12,11,12,6,4,4,3,Quantum Gold Saving Fund-Reg(G),Gold : MFs,16,16,16,16,15,10,10,10,16.11,1.94,18.32,18.28,20.19,12.72,16.39,8.68,,,,,,,,
Invesco India Gold ETF,8505,Invesco Mutual Fund,-1.15,15.19,16.86,19.23,Gold-India,12.95,17.11,9.01,14.2,11,28,23,14,13,2,2,9,Invesco India Gold ETF,Gold : ETFs,25,28,28,24,21,11,11,11,18.68,4.12,20.7,19.36,22.11,12.84,16.89,9.14,,,,,,,,
Kotak FMP-326-175D(G),48420,Kotak Mahindra Mutual Fund,0.62,1.98,,,NIFTY Ultra Short Duration Debt Index,,,,3.23,22,82,8,,,,,,Kotak FMP-326-175D(G),Debt : FTP/FMP,102,109,102,93,91,21,17,12,2.95,0.76,1.84,4.05,6.79,5.52,5.64,6.17,,,,,,,,
Bandhan CRISIL IBX 90:10 SDL Plus Gilt - Nov 2026 Index Fund-Reg(G),46213,Bandhan Mutual Fund,0.9,1.87,4.17,6.6,CRISIL IBX 90:10 SDL Plus Gilt Index - November 2026,,,,3.18,27,40,6,42,15,,,,Bandhan CRISIL IBX 90:10 SDL Plus Gilt - Nov 2026 Index Fund-Reg(G),Debt : Medium to Long Duration,52,52,52,52,52,11,11,11,3.21,1.09,1.8,4.4,6.46,5.11,5.8,6.76,,,,,,,,
Bandhan Equity Savings Fund-Reg(G),5300,Bandhan Mutual Fund,1.0,1.93,5.72,10.38,CRISIL Liquid Debt Index,7.17,7.13,6.67,3.33,51,49,50,51,51,48,45,24,Bandhan Equity Savings Fund-Reg(G),Hybrid : Equity Oriented,55,55,55,55,54,52,47,24,7.23,1.99,4.17,13.01,22.85,12.34,12.28,11.7,,,,,,,,
PGIM India Dynamic Bond Fund(G),15247,PGIM India Mutual Fund,1.77,1.97,5.18,6.91,CRISIL Dynamic Bond Index,4.71,6.02,7.57,4.04,4,5,2,4,11,17,12,7,PGIM India Dynamic Bond Fund(G),Debt : Dynamic Bond,22,22,22,22,22,21,21,18,3.66,1.47,1.74,4.81,6.75,5.38,6.33,7.31,,,,,,,,
LIC MF Short Duration Fund-Reg(G),34304,LIC Mutual Fund,0.87,1.73,3.88,6.19,CRISIL Short Duration Debt Index,4.24,5.32,,2.96,15,8,14,16,21,21,16,,LIC MF Short Duration Fund-Reg(G),Debt : Short Duration,26,27,26,26,26,22,21,19,2.82,0.8,1.67,3.75,6.35,5.48,5.78,6.83,,,,,,,,
WOC Pharma and Healthcare Fund-Reg(G),48472,WhiteOak Capital Mutual Fund,0.11,-1.17,,,S&P BSE Health Care - TRI,,,,,,12,11,,,,,,WOC Pharma and Healthcare Fund-Reg(G),Equity : Sectoral - Pharma,14,16,16,13,11,9,8,3,12.07,0.52,-0.13,18.67,49.78,13.77,24.23,16.07,0.06,-0.58,19.46,51.67,13.57,22.4,15.3,30.14
SBI FMP-50-1843D-Reg(G),45842,SBI Mutual Fund,0.84,1.9,4.1,6.71,CRISIL Medium to Long Term Debt Index,,,,3.18,28,26,22,34,55,,,,SBI FMP-50-1843D-Reg(G),Debt : FTP/FMP,102,109,102,93,91,21,17,12,2.95,0.76,1.84,4.05,6.79,5.52,5.64,6.17,,,,,,,,
DSP Silver ETF,46354,DSP Mutual Fund,11.31,29.2,23.45,27.5,Silver,,,,26.21,5,5,7,5,4,,,,DSP Silver ETF,Gold : ETFs,25,28,28,24,21,11,11,11,18.68,4.12,20.7,19.36,22.11,12.84,16.89,9.14,,,,,,,,
Edelweiss Emerging Markets Opp Eq. Offshore Fund-Reg(G),20281,Edelweiss Mutual Fund,4.3,6.11,10.23,11.64,MSCI Emerging Market Index,-5.14,5.1,,6.41,36,33,19,41,41,32,21,,Edelweiss Emerging Markets Opp Eq. Offshore Fund-Reg(G),FoFs : Overseas,57,58,57,57,56,37,26,23,7.56,4.26,5.6,12.89,21.36,4.16,10.3,6.28,,,,,,,,
Union Dynamic Bond(G),16032,Union Mutual Fund,1.78,1.73,4.99,6.23,CRISIL Dynamic Bond Index,4.08,5.85,6.42,3.67,11,4,14,6,17,20,15,18,Union Dynamic Bond(G),Debt : Dynamic Bond,22,22,22,22,22,21,21,18,3.66,1.47,1.74,4.81,6.75,5.38,6.33,7.31,,,,,,,,
Mirae Asset Nifty 100 ESG Sector Leaders FoF-Reg(G),45135,Mirae Asset Mutual Fund,2.85,3.91,18.31,28.24,Nifty100 ESG Sector Leaders - TRI,13.26,,,7.46,27,19,31,18,20,22,,,Mirae Asset Nifty 100 ESG Sector Leaders FoF-Reg(G),FoFs : Domestic,53,56,55,53,53,37,25,22,9.76,3.0,7.35,15.55,25.55,13.75,12.89,11.0,,,,,,,,
Bajaj Finserv Banking and PSU Fund-Reg(G),48214,Bajaj Finserv Mutual Fund,0.96,1.72,3.93,,NIFTY Banking and PSU Debt Index,,,,3.08,16,6,24,18,,,,,Bajaj Finserv Banking and PSU Fund-Reg(G),Debt : Banking & PSU,27,27,27,27,26,22,16,15,3.12,0.85,1.78,3.99,6.57,5.09,6.52,7.21,,,,,,,,
SBI FMP-92-91D-Reg(G),48470,SBI Mutual Fund,0.58,1.92,,,CRISIL Liquid Debt Index,,,,,,92,16,,,,,,SBI FMP-92-91D-Reg(G),Debt : FTP/FMP,102,109,102,93,91,21,17,12,2.95,0.76,1.84,4.05,6.79,5.52,5.64,6.17,,,,,,,,
ICICI Pru India Equity (FOF)(G),44626,ICICI Prudential Mutual Fund,3.14,5.83,25.81,48.4,S&P BSE 500 - TRI,23.98,,,14.97,10,14,19,5,5,2,,,ICICI Pru India Equity (FOF)(G),FoFs : Domestic,53,56,55,53,53,37,25,22,9.76,3.0,7.35,15.55,25.55,13.75,12.89,11.0,3.44,6.04,22.13,37.74,19.26,18.43,12.44,26.5
SBI FMP-43-1616D-Reg(G),45525,SBI Mutual Fund,0.69,1.79,3.87,6.81,CRISIL Medium Duration Debt Index,5.29,,,3.07,53,71,82,69,30,15,,,SBI FMP-43-1616D-Reg(G),Debt : FTP/FMP,102,109,102,93,91,21,17,12,2.95,0.76,1.84,4.05,6.79,5.52,5.64,6.17,,,,,,,,
