Mahindra Manulife ELSS Tax Saver Fund-Reg(G),36058,Mahindra Mutual Fund,1.43,4.39,18.55,33.61,NIFTY 500 - TRI,19.44,17.72,,5.89,37,32,32,39,41,31,29,,Mahindra Manulife ELSS Tax Saver Fund-Reg(G),Equity : Tax Saving (ELSS),60,60,60,60,59,55,53,27,6.86,1.5,4.74,20.49,38.85,21.38,19.49,16.27,,,,,,,,
ICICI Pru Long Term Bond Fund(G),1617,ICICI Prudential Mutual Fund,0.47,1.73,5.4,6.3,CRISIL Long Duration Debt Index,4.18,6.54,7.88,3.6,8,10,7,7,17,2,2,1,ICICI Pru Long Term Bond Fund(G),Debt : Long Duration,21,24,21,20,19,3,3,2,3.48,0.43,1.48,5.28,6.51,4.34,6.8,7.54,,,,,,,,
Motilal Oswal Nifty Microcap 250 Index Fund-Reg(G),41176,Motilal Oswal Mutual Fund,0.63,-0.9,22.77,,Nifty Microcap 250 - TRI,,,,8.1,45,65,106,48,,,,,Motilal Oswal Nifty Microcap 250 Index Fund-Reg(G),Equity : Index Funds,106,116,109,103,91,40,23,18,8.37,1.17,4.67,24.73,43.76,18.72,15.56,13.54,,,,,,,,
Axis Childrens Gift Fund-No Lock in-Reg(G),34004,Axis Mutual Fund,0.14,2.75,9.42,15.6,NIFTY 50 Hybrid Composite Debt 65:35 Index,9.37,11.71,,1.63,39,37,26,27,30,26,15,,Axis Childrens Gift Fund-No Lock in-Reg(G),Hybrid : Solution Oriented,40,40,40,39,38,37,29,13,4.96,0.94,3.5,13.69,25.33,13.65,12.29,12.53,,,,,,,,
Axis Childrens Gift Fund-Compulsory Lock in-Reg(G),34008,Axis Mutual Fund,0.14,2.75,9.42,15.6,NIFTY 50 Hybrid Composite Debt 65:35 Index,9.37,11.71,,1.63,40,36,25,28,29,27,14,,Axis Childrens Gift Fund-Compulsory Lock in-Reg(G),Hybrid : Solution Oriented,40,40,40,39,38,37,29,13,4.96,0.94,3.5,13.69,25.33,13.65,12.29,12.53,,,,,,,,
DSP Multicap Fund-Reg(G),48040,DSP Mutual Fund,2.92,5.87,,,Nifty500 Multicap 50:25:25 - TRI,,,,,,3,12,,,,,,DSP Multicap Fund-Reg(G),Equity : Multi Cap,37,38,38,37,33,22,16,13,7.75,1.43,5.08,21.89,41.65,20.4,20.0,16.93,,,,,,,,
DSP Value Fund-Reg(G),44293,DSP Mutual Fund,0.1,3.97,23.75,34.96,NIFTY 500 - TRI,17.04,,,8.02,17,20,15,15,20,18,,,DSP Value Fund-Reg(G),Equity : Value / Contra,22,22,22,22,21,18,17,14,9.32,1.31,4.22,26.07,47.39,23.39,19.95,17.89,,,,,,,,
HSBC Medium Duration Fund-Reg(G),31014,HSBC Mutual Fund,0.57,1.67,4.04,6.7,NIFTY Medium Duration Debt Index,5.11,6.48,,2.78,3,4,11,6,7,9,6,,HSBC Medium Duration Fund-Reg(G),Debt : Medium Duration,30,30,30,30,30,14,13,10,2.53,0.48,1.59,3.86,6.41,5.8,5.59,7.21,,,,,,,,
HDFC Pharma and Healthcare Fund-Reg(G),48220,HDFC Mutual Fund,1.84,2.92,25.99,,S&P BSE Health Care - TRI,,,,12.0,5,1,10,8,,,,,HDFC Pharma and Healthcare Fund-Reg(G),Equity : Sectoral - Pharma,14,16,16,13,11,9,8,3,11.1,0.36,3.22,26.18,52.13,14.92,23.36,15.35,-1.32,0.93,23.8,52.62,14.13,20.94,15.3,31.36
DSP World Gold FoF-Reg(G),755,DSP Mutual Fund,1.76,22.63,13.69,-3.37,FTSE Gold Mines,-1.09,12.01,4.76,6.54,25,9,1,34,53,26,9,16,DSP World Gold FoF-Reg(G),FoFs : Overseas,57,58,57,57,56,35,26,22,5.02,0.18,5.8,15.33,20.99,2.48,9.06,6.26,,,,,,,,
Mirae Asset Nifty SDL Jun 2027 Index Fund-Reg(G),46134,Mirae Asset Mutual Fund,0.55,1.78,4.28,6.73,Nifty SDL Jun 2027 Index,,,,2.71,7,12,4,13,7,,,,Mirae Asset Nifty SDL Jun 2027 Index Fund-Reg(G),Debt : Medium to Long Duration,52,52,52,52,52,11,11,11,2.55,0.48,1.53,4.16,6.38,4.93,5.95,6.78,,,,,,,,
Bajaj Finserv Large and Mid Cap Fund-Reg(G),48063,Bajaj Finserv Mutual Fund,1.37,,,,NIFTY LargeMidcap 250 - TRI,,,,,,18,,,,,,,Bajaj Finserv Large and Mid Cap Fund-Reg(G),Equity : Large & Mid Cap,27,29,27,26,26,26,22,18,8.88,1.67,5.86,23.6,42.67,21.46,19.46,17.36,,,,,,,,
Baroda BNP Paribas Arbitrage Fund-Reg(G),35820,Baroda BNP Paribas Mutual Fund,0.4,1.78,3.71,7.6,Nifty 50 Arbitrage,5.36,5.17,,2.86,7,19,17,15,8,15,11,,Baroda BNP Paribas Arbitrage Fund-Reg(G),Hybrid : Arbitrage,26,26,26,26,24,24,21,10,2.78,0.41,1.77,3.63,7.38,5.32,5.02,5.87,0.35,1.69,3.77,8.15,5.8,5.08,,7.7
Nippon India Hybrid Bond Fund(G),2649,Nippon India Mutual Fund,0.44,1.96,5.14,8.97,CRISIL Hybrid 85+15 - Conservative Index,8.19,4.15,6.6,2.73,14,14,12,17,17,9,18,18,Nippon India Hybrid Bond Fund(G),Hybrid : Debt Oriented (Conservative),19,19,19,19,19,18,18,18,3.33,0.55,2.08,7.2,12.1,8.52,8.18,8.49,,,,,,,,
WOC Multi Cap Fund-Reg(G),48199,WhiteOak Capital Mutual Fund,1.11,4.36,22.09,,Nifty500 Multicap 50:25:25 - TRI,,,,7.36,22,27,26,18,,,,,WOC Multi Cap Fund-Reg(G),Equity : Multi Cap,37,38,38,37,33,22,16,13,7.75,1.43,5.08,21.89,41.65,20.4,20.0,16.93,,,,,,,,
HDFC Income Fund(G),1281,HDFC Mutual Fund,0.34,1.54,4.84,5.97,CRISIL Medium to Long Term Debt Index,4.02,5.62,6.59,3.19,1,48,23,1,44,8,8,7,HDFC Income Fund(G),Debt : Medium to Long Duration,52,52,52,52,52,11,11,11,2.55,0.48,1.53,4.16,6.38,4.93,5.95,6.78,,,,,,,,
Sundaram Equity Savings Fund(G),2393,Sundaram Mutual Fund,0.91,4.0,10.44,20.17,NIFTY 50 Equity Savings Index,12.67,12.09,9.65,4.62,29,16,23,35,31,27,24,20,Sundaram Equity Savings Fund(G),Hybrid : Equity Oriented,56,56,56,56,55,53,48,24,5.04,0.76,3.47,12.75,22.61,12.6,12.43,12.22,,,,,,,,
Sundaram Overnight Fund-Reg(G),42000,Sundaram Mutual Fund,0.52,1.59,3.29,6.68,Nifty 1D Rate Index,5.16,4.66,,2.29,25,31,28,26,23,23,6,,Sundaram Overnight Fund-Reg(G),Debt : Overnight,35,35,35,35,32,27,14,3,2.29,0.53,1.6,3.3,6.7,5.18,4.67,5.76,0.55,1.63,3.37,6.87,5.35,4.82,,6.68
Motilal Oswal Large Cap Fund-Reg(G),48488,Motilal Oswal Mutual Fund,2.08,5.96,,,NIFTY 100 - TRI,,,,,,2,9,,,,,,Motilal Oswal Large Cap Fund-Reg(G),Equity : Large Cap,36,37,37,36,36,33,31,28,7.12,0.5,5.02,20.96,34.49,17.39,15.88,14.73,,,,,,,,
Nippon India Consumption Fund(G),2644,Nippon India Mutual Fund,3.28,7.86,20.2,39.65,Nifty India Consumption - TRI,25.69,22.97,16.27,10.01,4,2,4,5,3,2,1,6,Nippon India Consumption Fund(G),Equity : Thematic - Consumption,16,17,17,15,13,13,13,8,6.51,2.08,6.18,17.54,35.26,20.83,18.23,16.6,,,,,,,,
DSP Global Innovation FoF-Reg(G),45728,DSP Mutual Fund,-0.7,5.19,24.24,43.5,MSCI ACWI Net TRI,,,,9.32,8,36,23,8,5,,,,DSP Global Innovation FoF-Reg(G),FoFs : Overseas,57,58,57,57,56,35,26,22,5.02,0.18,5.8,15.33,20.99,2.48,9.06,6.26,,,,,,,,
LIC MF S&P BSE Sensex ETF,33579,LIC Mutual Fund,-0.49,2.44,13.9,22.44,S&P BSE SENSEX - TRI,15.93,15.08,,1.9,110,120,106,107,100,53,49,,LIC MF S&P BSE Sensex ETF,Equity : ETFs,141,149,145,141,129,75,56,23,7.09,0.64,4.21,21.92,38.26,18.91,16.79,13.97,-0.97,2.02,13.42,21.98,15.69,15.28,12.12,5.43
Tata Gilt Securities Fund-Reg(G),3230,Tata Mutual Fund,0.42,1.25,4.77,5.96,CRISIL Dynamic Gilt Index,4.82,6.22,7.24,2.99,10,31,24,15,30,13,16,18,Tata Gilt Securities Fund-Reg(G),Debt : Gilt,35,35,35,35,35,23,21,21,2.79,0.48,1.34,4.57,6.42,4.8,6.79,7.85,,,,,,,,
LIC MF Nifty 50 ETF,33580,LIC Mutual Fund,-0.32,2.43,15.77,25.32,NIFTY 50 - TRI,16.26,15.29,,2.79,97,110,109,94,92,44,36,,LIC MF Nifty 50 ETF,Equity : ETFs,141,149,145,141,129,75,56,23,7.09,0.64,4.21,21.92,38.26,18.91,16.79,13.97,,,,,,,,
Sundaram Corp Bond Fund(G),2955,Sundaram Mutual Fund,0.46,1.63,3.71,6.47,NIFTY Corporate Bond Index,4.93,6.99,7.87,2.52,14,11,15,13,11,8,6,2,Sundaram Corp Bond Fund(G),Debt : Corporate Bond,21,21,21,21,21,19,18,12,2.58,0.45,1.68,3.73,6.6,5.0,6.51,7.31,,,,,,,,
Bandhan Financial Services Fund-Reg(G),47389,Bandhan Mutual Fund,1.16,1.78,20.29,,Nifty Financial Services - TRI,,,,7.05,4,10,20,3,,,,,Bandhan Financial Services Fund-Reg(G),Equity : Sectoral - Financial Services,18,20,20,17,15,12,11,8,4.05,1.01,4.51,16.09,27.69,16.82,13.2,15.21,,,,,,,,
Samco Active Momentum Fund-Reg(G),47753,Samco Mutual Fund,-0.39,-5.32,20.06,,NIFTY 500 - TRI,,,,3.86,48,55,56,33,,,,,Samco Active Momentum Fund-Reg(G),Equity : Thematic,56,60,56,53,44,31,14,8,10.29,1.48,5.39,25.63,44.4,21.66,21.48,16.51,,,,,,,,
SBI Nifty Next 50 Index Fund-Reg(G),45529,SBI Mutual Fund,3.51,14.92,43.31,61.62,NIFTY NEXT 50 - TRI,,,,19.7,8,19,4,7,21,,,,SBI Nifty Next 50 Index Fund-Reg(G),Equity : Index Funds,106,116,109,103,91,40,23,18,8.37,1.17,4.67,24.73,43.76,18.72,15.56,13.54,,,,,,,,
Invesco India Financial Services Fund(G),5348,Invesco Mutual Fund,2.22,7.04,19.47,38.44,Nifty Financial Services - TRI,19.34,15.43,16.92,7.24,3,1,2,4,1,3,2,1,Invesco India Financial Services Fund(G),Equity : Sectoral - Financial Services,18,20,20,17,15,12,11,8,4.05,1.01,4.51,16.09,27.69,16.82,13.2,15.21,,,,,,,,
Bank of India Flexi Cap Fund-Reg(G),44987,Bank of India Mutual Fund,1.97,8.78,35.69,59.02,S&P BSE 500 - TRI,26.77,,,14.67,4,10,5,3,3,4,,,Bank of India Flexi Cap Fund-Reg(G),Equity : Flexi Cap,46,47,47,45,41,29,26,19,7.74,1.28,5.38,21.82,39.09,19.32,17.67,16.4,-0.39,2.72,20.16,35.79,19.15,18.32,12.44,17.47
Motilal Oswal Nifty 500 Index Fund-Reg(G),43809,Motilal Oswal Mutual Fund,0.53,3.89,21.09,36.32,NIFTY 500 - TRI,18.48,,,5.89,58,68,48,54,51,18,,,Motilal Oswal Nifty 500 Index Fund-Reg(G),Equity : Index Funds,106,116,109,103,91,40,23,18,8.37,1.17,4.67,24.73,43.76,18.72,15.56,13.54,,,,,,,,
HDFC Nifty G-Sec Jun 2027 Index Fund-Reg(G),46618,HDFC Mutual Fund,0.49,1.4,3.9,6.31,Nifty G-Sec Jun 2027 Index,,,,2.31,27,14,17,29,22,,,,HDFC Nifty G-Sec Jun 2027 Index Fund-Reg(G),Debt : Gilt,35,35,35,35,35,23,21,21,2.79,0.48,1.34,4.57,6.42,4.8,6.79,7.85,,,,,,,,
Mahindra Manulife Business Cycle Fund-Reg(G),48179,Mahindra Mutual Fund,2.5,6.53,35.69,,NIFTY 500 - TRI,,,,14.75,14,15,20,10,,,,,Mahindra Manulife Business Cycle Fund-Reg(G),Equity : Thematic,56,60,56,53,44,31,14,8,10.29,1.48,5.39,25.63,44.4,21.66,21.48,16.51,,,,,,,,
Franklin India Corp Debt Fund-A(G),3381,Franklin Templeton Mutual Fund,0.5,1.65,3.46,6.38,NIFTY Corporate Bond Index,4.84,6.33,7.57,2.4,19,3,12,20,14,12,13,6,Franklin India Corp Debt Fund-A(G),Debt : Corporate Bond,21,21,21,21,21,19,18,12,2.58,0.45,1.68,3.73,6.6,5.0,6.51,7.31,,,,,,,,
Edelweiss Multi Asset Allocation Fund-Reg(G),47994,Edelweiss Mutual Fund,0.64,1.79,3.7,,CRISIL Short Term Bond Index,,,,2.63,16,18,19,17,,,,,Edelweiss Multi Asset Allocation Fund-Reg(G),Hybrid : Multi Asset Allocation,17,24,20,17,12,10,7,7,7.33,0.96,4.96,16.48,28.55,16.6,17.35,13.07,,,,,,,,
Aditya Birla SL Gold ETF,13056,Aditya Birla Sun Life Mutual Fund,2.5,14.48,16.93,15.76,Gold-India,13.94,17.17,8.47,13.15,5,12,12,3,3,3,1,10,Aditya Birla SL Gold ETF,Gold : ETFs,25,28,27,22,21,11,11,11,12.13,2.11,14.59,14.32,11.14,13.79,16.93,8.64,,,,,,,,
Edelweiss Focused Fund-Reg(G),46055,Edelweiss Mutual Fund,0.63,6.51,22.34,36.25,NIFTY 500 - TRI,,,,6.23,32,36,16,19,26,,,,Edelweiss Focused Fund-Reg(G),Equity : Flexi Cap,46,47,47,45,41,29,26,19,7.74,1.28,5.38,21.82,39.09,19.32,17.67,16.4,,,,,,,,
HDFC NIFTY G-Sec Jun 2036 Index Fund-Reg(G),47714,HDFC Mutual Fund,0.45,1.39,5.4,6.61,Nifty G-Sec Jun 2036 Index,,,,3.53,11,13,13,6,6,,,,HDFC NIFTY G-Sec Jun 2036 Index Fund-Reg(G),Debt : Long Duration,21,24,21,20,19,3,3,2,3.48,0.43,1.48,5.28,6.51,4.34,6.8,7.54,,,,,,,,
360 ONE Liquid Fund-Reg(G),15687,360 ONE Mutual Fund,0.57,1.8,3.59,7.15,CRISIL Liquid Debt Index,5.39,4.83,5.99,2.52,30,8,29,29,28,29,31,26,360 ONE Liquid Fund-Reg(G),Debt : Liquid,37,37,37,37,36,35,34,29,2.56,0.57,1.82,3.62,7.16,5.47,5.09,6.33,,,,,,,,
Samco Flexi Cap Fund-Reg(G),46217,Samco Mutual Fund,-1.6,-2.75,10.0,26.74,NIFTY 500 - TRI,,,,0.09,45,47,47,44,39,,,,Samco Flexi Cap Fund-Reg(G),Equity : Flexi Cap,46,47,47,45,41,29,26,19,7.74,1.28,5.38,21.82,39.09,19.32,17.67,16.4,,,,,,,,
Invesco India Balanced Advantage Fund(G),2171,Invesco Mutual Fund,0.66,3.84,15.16,25.51,NIFTY 50 Hybrid Composite Debt 50:50 Index,12.44,11.03,11.47,4.86,16,15,8,10,9,10,10,6,Invesco India Balanced Advantage Fund(G),Hybrid : Dynamic Asset Allocation,30,32,30,28,26,20,17,10,5.2,0.54,3.04,14.26,24.92,12.48,11.93,11.5,,,,,,,,
360 ONE Dynamic Bond Fund-Reg(G),17578,360 ONE Mutual Fund,0.16,1.48,4.72,6.83,CRISIL Dynamic Bond Index,5.94,6.44,7.29,3.18,3,21,9,4,4,4,11,9,360 ONE Dynamic Bond Fund-Reg(G),Debt : Dynamic Bond,22,22,22,22,22,21,21,18,2.77,0.4,1.32,4.3,6.33,5.19,6.44,7.32,,,,,,,,
Union Large & Midcap Fund-Reg(G),44300,Union Mutual Fund,1.56,4.83,18.37,36.34,NIFTY LargeMidcap 250 - TRI,20.38,,,5.75,24,14,17,23,20,15,,,Union Large & Midcap Fund-Reg(G),Equity : Large & Mid Cap,27,29,27,26,26,26,22,18,8.88,1.67,5.86,23.6,42.67,21.46,19.46,17.36,,,,,,,,
Mahindra Manulife Balanced Advantage Fund-Reg(G),45993,Mahindra Mutual Fund,0.33,1.69,16.98,30.42,NIFTY 50 Hybrid Composite Debt 50:50 Index,,,,5.86,7,21,28,4,3,,,,Mahindra Manulife Balanced Advantage Fund-Reg(G),Hybrid : Dynamic Asset Allocation,30,32,30,28,26,20,17,10,5.2,0.54,3.04,14.26,24.92,12.48,11.93,11.5,,,,,,,,
Axis NIFTY 50 ETF,33980,Axis Mutual Fund,-0.32,2.45,15.81,25.57,NIFTY 50 - TRI,16.34,15.3,,2.82,90,108,100,88,78,36,33,,Axis NIFTY 50 ETF,Equity : ETFs,141,149,145,141,129,75,56,23,7.09,0.64,4.21,21.92,38.26,18.91,16.79,13.97,,,,,,,,
Aditya Birla SL Special Opp Fund-Reg(G),45096,Aditya Birla Sun Life Mutual Fund,2.17,4.22,21.95,44.35,S&P BSE 500 - TRI,18.27,,,9.33,28,20,37,29,18,16,,,Aditya Birla SL Special Opp Fund-Reg(G),Equity : Thematic,56,60,56,53,44,31,14,8,10.29,1.48,5.39,25.63,44.4,21.66,21.48,16.51,-0.39,2.72,20.16,35.79,19.15,18.32,12.44,17.47
Aditya Birla SL Pharma & Healthcare Fund-Reg(G),37591,Aditya Birla Sun Life Mutual Fund,0.45,2.7,26.65,56.18,S&P BSE Health Care - TRI,14.31,,,12.92,4,8,13,7,2,7,,,Aditya Birla SL Pharma & Healthcare Fund-Reg(G),Equity : Sectoral - Pharma,14,16,16,13,11,9,8,3,11.1,0.36,3.22,26.18,52.13,14.92,23.36,15.35,-1.32,0.93,23.8,52.62,14.13,20.94,15.3,31.36
Bandhan Hybrid Equity Fund-Reg(G),34066,Bandhan Mutual Fund,0.0,2.62,13.99,25.36,S&P BSE 200 - TRI,14.56,13.86,,5.03,24,52,36,24,22,17,13,,Bandhan Hybrid Equity Fund-Reg(G),Hybrid : Equity Oriented,56,56,56,56,55,53,48,24,5.04,0.76,3.47,12.75,22.61,12.6,12.43,12.22,-0.5,3.14,20.05,33.79,18.39,17.75,12.47,17.2
Mirae Asset S&P 500 Top 50 ETF,45835,Mirae Asset Mutual Fund,0.61,5.56,20.71,35.38,S&P 500 Top 50 TRI,,,,10.64,40,77,54,63,58,,,,Mirae Asset S&P 500 Top 50 ETF,Equity : ETFs,141,149,145,141,129,75,56,23,7.09,0.64,4.21,21.92,38.26,18.91,16.79,13.97,,,,,,,,
Mirae Asset Equity Allocator FoF-Reg(G),45064,Mirae Asset Mutual Fund,0.64,4.53,21.02,35.37,NIFTY 200 - TRI,18.73,,,7.01,19,33,20,9,9,8,,,Mirae Asset Equity Allocator FoF-Reg(G),FoFs : Domestic,53,56,55,53,53,37,25,22,6.61,1.05,5.21,14.51,23.13,14.17,12.92,11.36,,,,,,,,
HDFC Dynamic Debt Fund(G),1274,HDFC Mutual Fund,0.38,1.63,4.38,6.59,NIFTY Composite Debt Index,6.17,6.68,6.92,2.82,10,14,5,10,8,3,9,13,HDFC Dynamic Debt Fund(G),Debt : Dynamic Bond,22,22,22,22,22,21,21,18,2.77,0.4,1.32,4.3,6.33,5.19,6.44,7.32,,,,,,,,
Aditya Birla SL ESG Integration Strategy Fund-Reg(G),44736,Aditya Birla Sun Life Mutual Fund,-0.87,1.43,12.5,25.63,NIFTY100 ESG - TRI,12.52,,,1.78,53,57,53,51,43,28,,,Aditya Birla SL ESG Integration Strategy Fund-Reg(G),Equity : Thematic,56,60,56,53,44,31,14,8,10.29,1.48,5.39,25.63,44.4,21.66,21.48,16.51,,,,,,,,
Tata NIFTY 50 Index Fund-Reg(G),3247,Tata Mutual Fund,-0.35,2.32,15.48,24.77,NIFTY 50 - TRI,15.68,14.6,13.2,2.62,85,83,73,79,75,27,15,9,Tata NIFTY 50 Index Fund-Reg(G),Equity : Index Funds,106,116,109,103,91,40,23,18,8.37,1.17,4.67,24.73,43.76,18.72,15.56,13.54,,,,,,,,
Baroda BNP Paribas Overnight Fund-Reg(G),43376,Baroda BNP Paribas Mutual Fund,0.53,1.61,3.3,6.72,CRISIL Liquid Overnight Index,5.21,4.71,,2.3,13,14,14,18,13,8,3,,Baroda BNP Paribas Overnight Fund-Reg(G),Debt : Overnight,35,35,35,35,32,27,14,3,2.29,0.53,1.6,3.3,6.7,5.18,4.67,5.76,,,,,,,,
Aditya Birla SL CRISIL IBX Gilt Apr 2029 Index Fund-Reg(G),46950,Aditya Birla Sun Life Mutual Fund,0.45,1.5,4.4,6.42,CRISIL IBX Gilt Index - April 2029,,,,2.5,25,25,10,22,14,,,,Aditya Birla SL CRISIL IBX Gilt Apr 2029 Index Fund-Reg(G),Debt : Gilt,35,35,35,35,35,23,21,21,2.79,0.48,1.34,4.57,6.42,4.8,6.79,7.85,,,,,,,,
LIC MF Nifty 100 ETF,33578,LIC Mutual Fund,0.22,4.54,20.15,30.69,NIFTY 100 - TRI,16.92,15.65,,5.5,69,82,61,65,71,28,26,,LIC MF Nifty 100 ETF,Equity : ETFs,141,149,145,141,129,75,56,23,7.09,0.64,4.21,21.92,38.26,18.91,16.79,13.97,,,,,,,,
JM Value Fund(G),1849,JM Financial Mutual Fund,4.24,5.41,30.43,64.52,S&P BSE 500 - TRI,29.64,24.03,20.35,12.81,2,1,5,3,2,2,2,2,JM Value Fund(G),Equity : Value / Contra,22,22,22,22,21,18,17,14,9.32,1.31,4.22,26.07,47.39,23.39,19.95,17.89,-0.39,2.72,20.16,35.79,19.15,18.32,12.44,17.47
Bank of India Mid & Small Cap Equity & Debt Fund-Reg(G),32972,Bank of India Mutual Fund,1.33,4.19,22.25,46.98,Nifty MidSmallcap 400 - TRI,23.06,22.28,,9.46,4,9,21,3,2,3,2,,Bank of India Mid & Small Cap Equity & Debt Fund-Reg(G),Hybrid : Equity Oriented,56,56,56,56,55,53,48,24,5.04,0.76,3.47,12.75,22.61,12.6,12.43,12.22,,,,,,,,
360 ONE Balanced Hybrid Fund-Reg(G),48144,360 ONE Mutual Fund,1.83,4.39,12.92,,NIFTY 50 Hybrid Composite Debt 50:50 Index,,,,6.11,15,5,18,28,,,,,360 ONE Balanced Hybrid Fund-Reg(G),Hybrid : Equity Oriented,56,56,56,56,55,53,48,24,5.04,0.76,3.47,12.75,22.61,12.6,12.43,12.22,,,,,,,,
Invesco India Ultra Short Duration Fund(G),13460,Invesco Mutual Fund,0.57,2.11,3.76,7.17,NIFTY Ultra Short Duration Debt Index,5.17,5.3,6.8,2.84,1,8,1,2,9,13,9,4,Invesco India Ultra Short Duration Fund(G),Debt : Ultra Short Duration,24,24,24,24,24,24,18,13,2.55,0.55,1.82,3.48,6.9,5.28,5.42,6.41,,,,,,,,
Nippon India US Equity Opp Fund(G),19246,Nippon India Mutual Fund,-2.11,4.4,19.07,33.9,S&P 500 - TRI,7.82,14.53,,7.38,3,7,3,3,3,3,2,,Nippon India US Equity Opp Fund(G),Equity : International,8,8,8,8,8,6,5,3,5.35,-1.26,3.69,16.26,23.75,4.98,9.87,9.26,,,,,,,,
PGIM India ELSS Tax Saver Fund-Reg(G),26780,PGIM India Mutual Fund,0.39,4.19,12.75,22.89,NIFTY 500 - TRI,17.0,16.51,,2.02,52,50,34,58,59,50,39,,PGIM India ELSS Tax Saver Fund-Reg(G),Equity : Tax Saving (ELSS),60,60,60,60,59,55,53,27,6.86,1.5,4.74,20.49,38.85,21.38,19.49,16.27,,,,,,,,
Nippon India Index Fund-S&P BSE Sensex Plan(G),12865,Nippon India Mutual Fund,-0.51,2.37,13.65,21.86,S&P BSE SENSEX - TRI,15.32,14.38,12.83,1.76,96,104,63,93,84,34,18,16,Nippon India Index Fund-S&P BSE Sensex Plan(G),Equity : Index Funds,106,116,109,103,91,40,23,18,8.37,1.17,4.67,24.73,43.76,18.72,15.56,13.54,-0.97,2.02,13.42,21.98,15.69,15.28,12.12,5.43
SBI FMP-91-90D-Reg(G),48431,SBI Mutual Fund,0.57,,,,CRISIL Liquid Debt Index,,,,1.84,93,56,,,,,,,SBI FMP-91-90D-Reg(G),Debt : FTP/FMP,103,110,102,94,92,21,16,12,2.44,0.55,1.74,3.98,6.78,5.49,5.6,6.18,,,,,,,,
Quant PSU Fund-Reg(G),48341,Quant Mutual Fund,3.67,,,,S&P BSE PSU - TRI,,,,,,5,,,,,,,Quant PSU Fund-Reg(G),Equity : Thematic,56,60,56,53,44,31,14,8,10.29,1.48,5.39,25.63,44.4,21.66,21.48,16.51,1.7,5.8,55.26,94.31,46.09,26.18,1.57,69.74
Quant Manufacturing Fund-Reg(G),48120,Quant Mutual Fund,1.91,4.09,37.57,,Nifty India Manufacturing - TRI,,,,17.49,9,22,40,7,,,,,Quant Manufacturing Fund-Reg(G),Equity : Thematic,56,60,56,53,44,31,14,8,10.29,1.48,5.39,25.63,44.4,21.66,21.48,16.51,,,,,,,,
Franklin India NSE Nifty 50 Index Fund(G),942,Franklin Templeton Mutual Fund,-0.38,2.3,15.39,24.54,NIFTY 50,15.47,14.31,12.98,2.65,83,98,78,83,78,32,19,13,Franklin India NSE Nifty 50 Index Fund(G),Equity : Index Funds,106,116,109,103,91,40,23,18,8.37,1.17,4.67,24.73,43.76,18.72,15.56,13.54,-0.94,1.7,14.92,23.43,14.57,14.15,10.36,7.41
ICICI Pru Retirement Fund-Pure Equity Plan(G),25667,ICICI Prudential Mutual Fund,2.36,7.6,33.49,56.11,NIFTY 500 - TRI,29.96,21.79,,14.25,1,2,2,1,1,2,2,,ICICI Pru Retirement Fund-Pure Equity Plan(G),Hybrid : Solution Oriented,40,40,40,39,38,37,29,13,4.96,0.94,3.5,13.69,25.33,13.65,12.29,12.53,,,,,,,,
UTI Innovation Fund-Reg(G),48238,UTI Mutual Fund,-2.87,-1.26,4.75,,NIFTY 500 - TRI,,,,-0.2,56,60,55,53,,,,,UTI Innovation Fund-Reg(G),Equity : Thematic,56,60,56,53,44,31,14,8,10.29,1.48,5.39,25.63,44.4,21.66,21.48,16.51,,,,,,,,
Nippon India Nifty 50 Value 20 Index Fund-Reg(G),45289,Nippon India Mutual Fund,1.32,1.3,21.49,34.0,Nifty50 Value 20 - TRI,19.49,,,6.73,52,51,100,53,55,17,,,Nippon India Nifty 50 Value 20 Index Fund-Reg(G),Equity : Index Funds,106,116,109,103,91,40,23,18,8.37,1.17,4.67,24.73,43.76,18.72,15.56,13.54,,,,,,,,
Nippon India Nifty Pharma ETF,45584,Nippon India Mutual Fund,0.22,4.03,27.56,53.1,NIFTY PHARMA - TRI,,,,12.11,35,83,74,34,37,,,,Nippon India Nifty Pharma ETF,Equity : ETFs,141,149,145,141,129,75,56,23,7.09,0.64,4.21,21.92,38.26,18.91,16.79,13.97,,,,,,,,
Mirae Asset Nifty Midcap 150 ETF,46105,Mirae Asset Mutual Fund,1.89,4.19,26.11,56.81,Nifty Midcap 150 - TRI,,,,10.34,41,36,67,41,26,,,,Mirae Asset Nifty Midcap 150 ETF,Equity : ETFs,141,149,145,141,129,75,56,23,7.09,0.64,4.21,21.92,38.26,18.91,16.79,13.97,,,,,,,,
UTI Gilt Fund-Reg(G),3560,UTI Mutual Fund,0.59,1.57,4.85,6.79,CRISIL Dynamic Gilt Index,4.93,6.87,8.39,3.05,8,3,5,9,8,7,10,5,UTI Gilt Fund-Reg(G),Debt : Gilt,35,35,35,35,35,23,21,21,2.79,0.48,1.34,4.57,6.42,4.8,6.79,7.85,,,,,,,,
DSP FMP 267-1246D-Reg(G),47071,DSP Mutual Fund,0.58,1.78,4.05,6.74,CRISIL Medium Duration Debt Index,,,,2.43,71,46,37,38,39,,,,DSP FMP 267-1246D-Reg(G),Debt : FTP/FMP,103,110,102,94,92,21,16,12,2.44,0.55,1.74,3.98,6.78,5.49,5.6,6.18,,,,,,,,
Franklin India Banking & PSU Debt Fund(G),28458,Franklin Templeton Mutual Fund,0.43,1.66,3.6,6.65,NIFTY Banking and PSU Debt Index,5.03,6.6,7.36,2.55,16,14,13,21,9,10,11,8,Franklin India Banking & PSU Debt Fund(G),Debt : Banking & PSU,27,27,27,26,26,22,16,15,2.59,0.42,1.65,3.71,6.49,5.03,6.7,7.23,,,,,,,,
SBI FMP-66-1361D-Reg(G),46633,SBI Mutual Fund,0.59,1.68,4.04,6.78,CRISIL Medium Duration Debt Index,,,,2.62,39,32,83,43,31,,,,SBI FMP-66-1361D-Reg(G),Debt : FTP/FMP,103,110,102,94,92,21,16,12,2.44,0.55,1.74,3.98,6.78,5.49,5.6,6.18,,,,,,,,
HDFC Non-Cyclical Consumer Fund-Reg(G),46357,HDFC Mutual Fund,3.23,7.1,16.99,,Nifty India Consumption - TRI,,,,7.57,7,3,6,9,,,,,HDFC Non-Cyclical Consumer Fund-Reg(G),Equity : Thematic - Consumption,16,17,17,15,13,13,13,8,6.51,2.08,6.18,17.54,35.26,20.83,18.23,16.6,,,,,,,,
Axis FTP-118-100D-Reg(G),48251,Axis Mutual Fund,0.56,1.8,,,CRISIL Ultra Short Term Debt Index,,,,1.47,100,60,25,,,,,,Axis FTP-118-100D-Reg(G),Debt : FTP/FMP,103,110,102,94,92,21,16,12,2.44,0.55,1.74,3.98,6.78,5.49,5.6,6.18,,,,,,,,
HDFC Nifty G-Sec Jul 2031 Index Fund-Reg(G),46620,HDFC Mutual Fund,0.5,1.45,4.82,6.65,Nifty G-Sec July 2031 Index,,,,2.67,19,11,13,13,11,,,,HDFC Nifty G-Sec Jul 2031 Index Fund-Reg(G),Debt : Gilt,35,35,35,35,35,23,21,21,2.79,0.48,1.34,4.57,6.42,4.8,6.79,7.85,,,,,,,,
Kotak Quant Fund-Reg(G),48083,Kotak Mahindra Mutual Fund,1.51,3.57,35.25,,NIFTY 200 - TRI,,,,11.16,23,27,42,11,,,,,Kotak Quant Fund-Reg(G),Equity : Thematic,56,60,56,53,44,31,14,8,10.29,1.48,5.39,25.63,44.4,21.66,21.48,16.51,,,,,,,,
Tata Nifty 50 ETF,41017,Tata Mutual Fund,-0.32,2.44,15.78,25.41,NIFTY 50 - TRI,16.27,15.36,,2.8,96,106,108,92,91,43,28,,Tata Nifty 50 ETF,Equity : ETFs,141,149,145,141,129,75,56,23,7.09,0.64,4.21,21.92,38.26,18.91,16.79,13.97,,,,,,,,
UTI India Consumer Fund-Reg(G),3581,UTI Mutual Fund,2.81,9.36,18.88,34.05,Nifty India Consumption - TRI,17.75,16.0,12.86,8.72,6,5,1,6,9,12,10,8,UTI India Consumer Fund-Reg(G),Equity : Thematic - Consumption,16,17,17,15,13,13,13,8,6.51,2.08,6.18,17.54,35.26,20.83,18.23,16.6,,,,,,,,
Quantum Liquid Fund-Reg(G),19756,Quantum Mutual Fund,0.55,1.75,3.51,6.98,CRISIL Liquid Debt Index,5.3,4.84,5.91,2.47,31,34,31,31,30,31,30,28,Quantum Liquid Fund-Reg(G),Debt : Liquid,37,37,37,37,36,35,34,29,2.56,0.57,1.82,3.62,7.16,5.47,5.09,6.33,,,,,,,,
SBI Nifty Smallcap 250 Index Fund-Reg(G),46937,SBI Mutual Fund,2.34,1.81,25.58,63.54,Nifty Smallcap 250 - TRI,,,,8.93,40,35,92,37,14,,,,SBI Nifty Smallcap 250 Index Fund-Reg(G),Equity : Index Funds,106,116,109,103,91,40,23,18,8.37,1.17,4.67,24.73,43.76,18.72,15.56,13.54,,,,,,,,
Kotak Nifty 50 Index Fund-Reg(G),45556,Kotak Mahindra Mutual Fund,-0.35,2.28,15.43,24.71,NIFTY 50 - TRI,,,,2.58,88,85,79,81,76,,,,Kotak Nifty 50 Index Fund-Reg(G),Equity : Index Funds,106,116,109,103,91,40,23,18,8.37,1.17,4.67,24.73,43.76,18.72,15.56,13.54,,,,,,,,
Union Innovation & Opp Fund-Reg(G),45727,Union Mutual Fund,2.28,7.96,18.6,,NIFTY 500 - TRI,,,,9.32,29,17,9,36,,,,,Union Innovation & Opp Fund-Reg(G),Equity : Thematic,56,60,56,53,44,31,14,8,10.29,1.48,5.39,25.63,44.4,21.66,21.48,16.51,,,,,,,,
Canara Rob Infrastructure Fund-Reg(G),547,Canara Robeco Mutual Fund,4.74,11.54,37.44,59.27,S&P BSE India Infrastructure Index - TRI,34.06,25.7,19.29,16.64,10,4,3,7,11,10,9,11,Canara Rob Infrastructure Fund-Reg(G),Equity : Sectoral - Infrastructure,19,19,19,19,19,19,19,18,16.42,3.11,9.17,35.6,63.99,33.5,24.92,19.07,,,,,,,,
Mirae Asset Low Duration Fund-Reg Savings Plan(G),4609,Mirae Asset Mutual Fund,0.55,1.84,3.56,6.84,NIFTY Low Duration Debt Index,5.03,5.19,5.99,2.55,14,11,10,11,16,17,15,17,Mirae Asset Low Duration Fund-Reg Savings Plan(G),Debt : Low Duration,20,20,20,20,20,20,20,18,2.59,0.55,1.85,3.57,7.0,5.35,5.42,6.61,,,,,,,,
Baroda BNP Paribas Conservative Hybrid Fund-Reg(G),210,Baroda BNP Paribas Mutual Fund,0.57,2.41,7.68,12.62,CRISIL Hybrid 85+15 - Conservative Index,7.38,7.68,8.14,3.45,8,12,5,8,11,14,12,12,Baroda BNP Paribas Conservative Hybrid Fund-Reg(G),Hybrid : Debt Oriented (Conservative),19,19,19,19,19,18,18,18,3.33,0.55,2.08,7.2,12.1,8.52,8.18,8.49,,,,,,,,
Bajaj Finserv Arbitrage Fund-Reg(G),48064,Bajaj Finserv Mutual Fund,0.34,1.6,3.36,,Nifty 50 Arbitrage,,,,2.55,24,24,24,24,,,,,Bajaj Finserv Arbitrage Fund-Reg(G),Hybrid : Arbitrage,26,26,26,26,24,24,21,10,2.78,0.41,1.77,3.63,7.38,5.32,5.02,5.87,0.35,1.69,3.77,8.15,5.8,5.08,,7.7
Union Aggressive Hybrid Fund-Reg(G),44512,Union Mutual Fund,0.56,3.58,15.31,28.19,CRISIL Hybrid 35+65 - Aggressive Index,14.86,,,5.04,23,29,27,18,14,14,,,Union Aggressive Hybrid Fund-Reg(G),Hybrid : Equity Oriented,56,56,56,56,55,53,48,24,5.04,0.76,3.47,12.75,22.61,12.6,12.43,12.22,,,,,,,,
Baroda BNP Paribas Focused Fund-Reg(G),32452,Baroda BNP Paribas Mutual Fund,1.61,9.37,24.2,38.37,NIFTY 500 - TRI,18.98,16.93,,8.96,17,17,4,15,19,12,14,,Baroda BNP Paribas Focused Fund-Reg(G),Equity : Flexi Cap,46,47,47,45,41,29,26,19,7.74,1.28,5.38,21.82,39.09,19.32,17.67,16.4,,,,,,,,
Motilal Oswal Nifty Smallcap 250 Index Fund-Reg(G),43811,Motilal Oswal Mutual Fund,2.34,1.86,25.67,63.63,Nifty Smallcap 250 - TRI,27.32,,,8.99,39,34,90,35,13,1,,,Motilal Oswal Nifty Smallcap 250 Index Fund-Reg(G),Equity : Index Funds,106,116,109,103,91,40,23,18,8.37,1.17,4.67,24.73,43.76,18.72,15.56,13.54,,,,,,,,
