Tata Nifty SDL Plus AAA PSU Bond Dec 2027 60:40 Index Fund-Reg(G),46351,Tata Mutual Fund,0.71,1.83,3.96,6.42,Nifty SDL Plus AAA PSU Bond Dec 2027 60: 40 Index - TRI,,,,2.93,14,33,16,28,26,,,,Tata Nifty SDL Plus AAA PSU Bond Dec 2027 60:40 Index Fund-Reg(G),Debt : Medium to Long Duration,52,52,52,52,52,11,11,11,2.86,0.82,1.72,3.97,6.27,5.0,5.94,6.78,,,,,,,,
Aditya Birla SL Nifty 50 Index Fund-Reg(G),407,Aditya Birla Sun Life Mutual Fund,1.59,2.01,13.99,24.26,NIFTY 50 - TRI,15.26,15.05,12.27,3.57,81,88,80,77,72,28,14,11,Aditya Birla SL Nifty 50 Index Fund-Reg(G),Equity : Index Funds,105,115,108,103,91,40,23,18,11.01,3.99,5.03,22.94,44.88,18.64,16.26,12.81,,,,,,,,
Edelweiss CRISIL PSU Plus SDL 50:50 Oct 2025 Index Fund-Reg(G),46448,Edelweiss Mutual Fund,0.59,1.86,3.63,6.71,CRISIL IBX 50:50 PSU + SDL Index - October 2025,,,,2.8,14,28,6,21,7,,,,Edelweiss CRISIL PSU Plus SDL 50:50 Oct 2025 Index Fund-Reg(G),Debt : Medium Duration,30,30,30,30,30,14,13,10,2.78,0.71,1.72,3.73,6.35,5.84,5.59,7.17,,,,,,,,
Zerodha Nifty 1D Rate Liquid ETF,48471,Zerodha Mutual Fund,0.51,1.58,,,Nifty 1D Rate Index,,,,,,20,18,,,,,,Zerodha Nifty 1D Rate Liquid ETF,Debt : ETFs,22,26,25,22,17,14,6,1,2.59,0.78,1.68,3.68,6.45,4.91,5.16,5.06,0.56,1.65,3.36,6.84,5.38,4.82,,6.68
Motilal Oswal Large Cap Fund-Reg(G),48488,Motilal Oswal Mutual Fund,3.99,6.68,,,NIFTY 100 - TRI,,,,,,5,4,,,,,,Motilal Oswal Large Cap Fund-Reg(G),Equity : Large Cap,36,37,37,36,36,33,31,28,8.89,2.85,5.01,19.4,34.2,17.3,16.49,14.02,,,,,,,,
Axis Retirement Savings Fund-Aggressive Plan-Reg(G),43841,Axis Mutual Fund,2.23,5.63,16.43,30.2,CRISIL Hybrid 25+75 - Aggressive Index,11.87,,,9.56,7,25,12,9,13,22,,,Axis Retirement Savings Fund-Aggressive Plan-Reg(G),Hybrid : Solution Oriented,40,41,40,39,38,37,29,13,6.53,2.9,4.31,13.02,25.26,13.88,12.74,12.2,,,,,,,,
Kotak Credit Risk Fund(G),8472,Kotak Mahindra Mutual Fund,0.58,1.54,3.96,7.25,CRISIL Credit Risk Debt Index,4.58,5.71,7.02,3.17,3,12,14,2,6,14,9,4,Kotak Credit Risk Fund(G),Debt : Credit Risk,15,15,15,15,15,15,15,8,2.87,0.67,1.77,3.66,7.38,8.86,5.12,6.66,,,,,,,,
Canara Rob Savings Fund-Reg(G),535,Canara Robeco Mutual Fund,0.55,1.89,3.58,7.03,CRISIL Low Duration Debt Index,5.27,5.64,6.74,2.77,9,9,7,7,7,12,11,11,Canara Rob Savings Fund-Reg(G),Debt : Low Duration,20,20,20,20,20,20,20,18,2.78,0.55,1.88,3.55,6.94,5.38,5.43,6.6,,,,,,,,
HSBC Business Cycles Fund-Reg(G),29553,HSBC Mutual Fund,8.8,13.06,31.23,50.05,NIFTY 500 - TRI,26.22,21.18,,21.44,11,5,4,12,13,9,10,,HSBC Business Cycles Fund-Reg(G),Equity : Thematic,56,60,56,53,44,31,14,8,13.47,4.77,7.03,24.28,45.56,21.93,22.58,15.92,,,,,,,,
HDFC Pharma and Healthcare Fund-Reg(G),48220,HDFC Mutual Fund,2.68,1.33,20.42,,S&P BSE Health Care - TRI,,,,11.97,8,1,3,4,,,,,HDFC Pharma and Healthcare Fund-Reg(G),Equity : Sectoral - Pharma,14,16,16,13,11,9,8,3,11.78,1.63,0.43,19.83,51.57,14.56,24.6,15.9,3.14,0.49,21.15,56.63,14.62,22.82,15.3,33.77
Mahindra Manulife Business Cycle Fund-Reg(G),48179,Mahindra Mutual Fund,4.86,7.9,33.83,,NIFTY 500 - TRI,,,,18.46,14,21,18,9,,,,,Mahindra Manulife Business Cycle Fund-Reg(G),Equity : Thematic,56,60,56,53,44,31,14,8,13.47,4.77,7.03,24.28,45.56,21.93,22.58,15.92,,,,,,,,
SBI Nifty Next 50 Index Fund-Reg(G),45529,SBI Mutual Fund,8.09,14.44,42.95,64.06,NIFTY NEXT 50 - TRI,,,,25.62,6,7,6,7,16,,,,SBI Nifty Next 50 Index Fund-Reg(G),Equity : Index Funds,105,115,108,103,91,40,23,18,11.01,3.99,5.03,22.94,44.88,18.64,16.26,12.81,,,,,,,,
Baroda BNP Paribas Arbitrage Fund-Reg(G),35820,Baroda BNP Paribas Mutual Fund,0.58,1.9,3.87,7.75,Nifty 50 Arbitrage,5.46,5.17,,3.12,10,12,12,16,5,15,11,,Baroda BNP Paribas Arbitrage Fund-Reg(G),Hybrid : Arbitrage,26,26,26,26,24,24,21,10,3.05,0.57,1.87,3.84,7.5,5.4,5.02,5.89,0.61,2.0,4.12,8.3,5.9,5.11,,8.21
ITI Mid Cap Fund-Reg(G),45314,ITI Mutual Fund,7.8,10.6,34.64,69.12,Nifty Midcap 150 - TRI,25.1,,,21.93,3,7,8,2,3,12,,,ITI Mid Cap Fund-Reg(G),Equity : Mid Cap,30,30,30,30,30,25,22,20,14.42,6.48,8.73,23.69,52.42,25.43,24.72,19.83,,,,,,,,
ICICI Pru Long Term Bond Fund(G),1617,ICICI Prudential Mutual Fund,1.09,1.82,5.0,6.11,CRISIL Long Duration Debt Index,4.21,6.51,7.91,4.01,10,14,2,9,17,2,2,1,ICICI Pru Long Term Bond Fund(G),Debt : Long Duration,21,24,21,20,19,3,3,2,3.97,1.25,1.57,4.99,6.25,4.46,6.74,7.56,,,,,,,,
Sundaram Equity Savings Fund(G),2393,Sundaram Mutual Fund,1.96,3.88,9.27,19.12,NIFTY 50 Equity Savings Index,12.47,12.24,9.56,5.64,29,32,25,36,32,28,25,19,Sundaram Equity Savings Fund(G),Hybrid : Equity Oriented,56,56,56,56,55,53,48,24,6.35,2.27,3.84,11.94,22.53,12.63,12.83,11.87,,,,,,,,
DSP Value Fund-Reg(G),44293,DSP Mutual Fund,3.4,2.85,19.86,36.72,NIFTY 500 - TRI,17.31,,,9.71,17,16,18,17,20,18,,,DSP Value Fund-Reg(G),Equity : Value / Contra,22,22,22,22,21,18,17,14,12.0,4.07,5.1,23.95,47.62,23.38,20.91,17.22,,,,,,,,
Invesco India Financial Services Fund(G),5348,Invesco Mutual Fund,3.84,4.89,15.85,34.11,Nifty Financial Services - TRI,18.03,15.16,15.51,8.17,3,1,2,4,1,3,2,1,Invesco India Financial Services Fund(G),Equity : Sectoral - Financial Services,18,20,20,17,15,12,11,8,3.98,2.25,2.83,13.59,22.96,15.61,13.0,13.67,,,,,,,,
Axis Childrens Gift Fund-No Lock in-Reg(G),34004,Axis Mutual Fund,1.95,3.2,8.95,15.65,NIFTY 50 Hybrid Composite Debt 65:35 Index,9.41,11.87,,2.88,38,27,24,28,29,27,17,,Axis Childrens Gift Fund-No Lock in-Reg(G),Hybrid : Solution Oriented,40,41,40,39,38,37,29,13,6.53,2.9,4.31,13.02,25.26,13.88,12.74,12.2,,,,,,,,
Axis Childrens Gift Fund-Compulsory Lock in-Reg(G),34008,Axis Mutual Fund,1.95,3.2,8.95,15.65,NIFTY 50 Hybrid Composite Debt 65:35 Index,9.41,11.87,,2.88,37,28,25,27,28,26,16,,Axis Childrens Gift Fund-Compulsory Lock in-Reg(G),Hybrid : Solution Oriented,40,41,40,39,38,37,29,13,6.53,2.9,4.31,13.02,25.26,13.88,12.74,12.2,,,,,,,,
Bandhan Financial Services Fund-Reg(G),47389,Bandhan Mutual Fund,2.33,1.28,16.45,,Nifty Financial Services - TRI,,,,6.17,4,10,18,3,,,,,Bandhan Financial Services Fund-Reg(G),Equity : Sectoral - Financial Services,18,20,20,17,15,12,11,8,3.98,2.25,2.83,13.59,22.96,15.61,13.0,13.67,,,,,,,,
HSBC Medium Duration Fund-Reg(G),31014,HSBC Mutual Fund,0.86,1.78,3.97,6.65,NIFTY Medium Duration Debt Index,5.19,6.46,,3.1,3,1,13,5,10,9,6,,HSBC Medium Duration Fund-Reg(G),Debt : Medium Duration,30,30,30,30,30,14,13,10,2.78,0.71,1.72,3.73,6.35,5.84,5.59,7.17,,,,,,,,
Edelweiss Multi Asset Allocation Fund-Reg(G),47994,Edelweiss Mutual Fund,0.31,1.64,3.64,,CRISIL Short Term Bond Index,,,,2.61,17,23,19,17,,,,,Edelweiss Multi Asset Allocation Fund-Reg(G),Hybrid : Multi Asset Allocation,17,24,20,17,12,10,7,7,9.0,2.26,5.67,15.98,29.26,16.5,17.82,12.88,,,,,,,,
Mirae Asset Nifty SDL Jun 2027 Index Fund-Reg(G),46134,Mirae Asset Mutual Fund,0.68,1.88,4.09,6.66,Nifty SDL Jun 2027 Index,,,,2.94,11,39,4,7,6,,,,Mirae Asset Nifty SDL Jun 2027 Index Fund-Reg(G),Debt : Medium to Long Duration,52,52,52,52,52,11,11,11,2.86,0.82,1.72,3.97,6.27,5.0,5.94,6.78,,,,,,,,
Aditya Birla SL Gold ETF,13056,Aditya Birla Sun Life Mutual Fund,-0.04,18.22,19.09,19.75,Gold-India,13.94,17.09,9.02,15.44,20,26,23,11,12,8,4,11,Aditya Birla SL Gold ETF,Gold : ETFs,25,28,27,23,21,11,11,11,16.52,1.63,19.7,18.4,19.94,14.01,17.02,9.28,,,,,,,,
Nippon India Hybrid Bond Fund(G),2649,Nippon India Mutual Fund,0.72,1.98,4.92,8.95,CRISIL Hybrid 85+15 - Conservative Index,8.08,4.18,6.48,3.02,15,18,12,17,17,11,18,18,Nippon India Hybrid Bond Fund(G),Hybrid : Debt Oriented (Conservative),19,19,19,19,19,18,18,18,4.02,1.4,2.32,6.85,12.14,8.59,8.33,8.36,,,,,,,,
HDFC Income Fund(G),1281,HDFC Mutual Fund,1.11,1.71,4.6,5.88,CRISIL Medium to Long Term Debt Index,4.13,5.62,6.61,3.6,1,2,32,1,44,8,8,7,HDFC Income Fund(G),Debt : Medium to Long Duration,52,52,52,52,52,11,11,11,2.86,0.82,1.72,3.97,6.27,5.0,5.94,6.78,,,,,,,,
Sundaram Overnight Fund-Reg(G),42000,Sundaram Mutual Fund,0.52,1.59,3.29,6.68,Nifty 1D Rate Index,5.2,4.66,,2.47,29,31,30,26,24,24,6,,Sundaram Overnight Fund-Reg(G),Debt : Overnight,35,35,35,35,32,27,15,3,2.5,0.53,1.6,3.29,6.69,5.22,4.67,5.75,0.56,1.65,3.36,6.84,5.38,4.82,,6.68
Nippon India Consumption Fund(G),2644,Nippon India Mutual Fund,6.21,9.32,20.47,40.88,Nifty India Consumption - TRI,26.1,23.77,16.05,12.24,4,1,3,2,2,1,1,6,Nippon India Consumption Fund(G),Equity : Thematic - Consumption,16,17,17,16,13,13,13,8,8.56,4.14,6.6,16.22,35.27,21.13,18.91,16.3,,,,,,,,
LIC MF S&P BSE Sensex ETF,33579,LIC Mutual Fund,1.56,2.26,12.72,21.46,S&P BSE SENSEX - TRI,15.54,15.54,,2.67,109,118,86,107,107,55,49,,LIC MF S&P BSE Sensex ETF,Equity : ETFs,141,149,145,141,129,77,56,23,8.76,3.47,3.58,19.87,38.0,18.62,17.5,13.17,2.33,2.42,12.91,22.02,15.26,15.69,12.12,7.39
Tata Gilt Securities Fund-Reg(G),3230,Tata Mutual Fund,0.91,1.46,4.31,5.96,CRISIL Dynamic Gilt Index,4.9,6.17,7.26,3.33,16,26,23,16,29,13,16,18,Tata Gilt Securities Fund-Reg(G),Debt : Gilt,35,35,35,35,35,23,21,21,3.23,1.12,1.54,4.29,6.36,4.89,6.78,7.88,,,,,,,,
LIC MF Nifty 50 ETF,33580,LIC Mutual Fund,1.63,2.11,14.22,24.66,NIFTY 50 - TRI,15.86,15.74,,3.73,100,106,105,97,92,46,37,,LIC MF Nifty 50 ETF,Equity : ETFs,141,149,145,141,129,77,56,23,8.76,3.47,3.58,19.87,38.0,18.62,17.5,13.17,,,,,,,,
Samco Active Momentum Fund-Reg(G),47753,Samco Mutual Fund,3.39,-1.43,18.43,,NIFTY 500 - TRI,,,,7.72,44,44,56,36,,,,,Samco Active Momentum Fund-Reg(G),Equity : Thematic,56,60,56,53,44,31,14,8,13.47,4.77,7.03,24.28,45.56,21.93,22.58,15.92,,,,,,,,
Sundaram Corp Bond Fund(G),2955,Sundaram Mutual Fund,0.76,1.78,3.63,6.5,NIFTY Corporate Bond Index,5.0,6.94,7.87,2.79,15,7,14,14,11,8,6,2,Sundaram Corp Bond Fund(G),Debt : Corporate Bond,21,21,21,21,21,19,18,12,2.86,0.75,1.82,3.67,6.56,5.06,6.49,7.3,,,,,,,,
DSP Global Innovation FoF-Reg(G),45728,DSP Mutual Fund,7.1,6.79,22.84,45.92,MSCI ACWI Net TRI,,,,13.95,8,16,22,5,4,,,,DSP Global Innovation FoF-Reg(G),FoFs : Overseas,57,58,57,57,56,37,26,23,8.72,6.05,7.27,15.25,22.83,4.99,10.13,6.53,,,,,,,,
Edelweiss Focused Fund-Reg(G),46055,Edelweiss Mutual Fund,3.94,6.28,21.63,36.67,NIFTY 500 - TRI,,,,9.23,26,26,21,18,21,,,,Edelweiss Focused Fund-Reg(G),Equity : Flexi Cap,46,47,47,46,41,29,26,19,10.36,4.18,5.98,20.26,39.1,19.45,18.38,15.78,,,,,,,,
HDFC Nifty G-Sec Jun 2027 Index Fund-Reg(G),46618,HDFC Mutual Fund,0.82,1.66,3.76,6.22,Nifty G-Sec Jun 2027 Index,,,,2.61,29,28,11,29,21,,,,HDFC Nifty G-Sec Jun 2027 Index Fund-Reg(G),Debt : Gilt,35,35,35,35,35,23,21,21,3.23,1.12,1.54,4.29,6.36,4.89,6.78,7.88,,,,,,,,
Union Large & Midcap Fund-Reg(G),44300,Union Mutual Fund,4.65,5.99,16.32,36.29,NIFTY LargeMidcap 250 - TRI,21.07,,,9.24,20,13,18,25,20,16,,,Union Large & Midcap Fund-Reg(G),Equity : Large & Mid Cap,27,29,28,26,26,26,22,18,12.01,4.61,6.87,22.16,43.09,21.86,20.48,16.81,,,,,,,,
Mahindra Manulife Balanced Advantage Fund-Reg(G),45993,Mahindra Mutual Fund,1.16,0.3,14.18,28.88,NIFTY 50 Hybrid Composite Debt 50:50 Index,,,,6.67,12,29,30,9,3,,,,Mahindra Manulife Balanced Advantage Fund-Reg(G),Hybrid : Dynamic Asset Allocation,30,32,30,28,26,20,17,10,6.52,1.97,3.28,13.25,24.81,12.51,12.24,11.02,,,,,,,,
Aditya Birla SL Special Opp Fund-Reg(G),45096,Aditya Birla Sun Life Mutual Fund,4.18,4.74,20.54,43.66,S&P BSE 500 - TRI,18.55,,,10.36,33,32,41,30,21,16,,,Aditya Birla SL Special Opp Fund-Reg(G),Equity : Thematic,56,60,56,53,44,31,14,8,13.47,4.77,7.03,24.28,45.56,21.93,22.58,15.92,4.13,4.9,20.36,38.34,19.27,19.21,12.44,23.2
Invesco India Balanced Advantage Fund(G),2171,Invesco Mutual Fund,2.64,4.4,14.14,25.82,NIFTY 50 Hybrid Composite Debt 50:50 Index,12.63,11.33,10.99,6.86,8,5,3,10,8,10,10,6,Invesco India Balanced Advantage Fund(G),Hybrid : Dynamic Asset Allocation,30,32,30,28,26,20,17,10,6.52,1.97,3.28,13.25,24.81,12.51,12.24,11.02,,,,,,,,
Franklin India Corp Debt Fund-A(G),3381,Franklin Templeton Mutual Fund,0.67,1.8,3.38,6.35,NIFTY Corporate Bond Index,4.9,6.3,7.55,2.65,20,18,12,20,14,13,13,6,Franklin India Corp Debt Fund-A(G),Debt : Corporate Bond,21,21,21,21,21,19,18,12,2.86,0.75,1.82,3.67,6.56,5.06,6.49,7.3,,,,,,,,
ICICI Pru Retirement Fund-Pure Equity Plan(G),25667,ICICI Prudential Mutual Fund,5.39,8.66,31.98,57.41,NIFTY 500 - TRI,30.69,22.83,,16.76,1,2,2,1,1,2,1,,ICICI Pru Retirement Fund-Pure Equity Plan(G),Hybrid : Solution Oriented,40,41,40,39,38,37,29,13,6.53,2.9,4.31,13.02,25.26,13.88,12.74,12.2,,,,,,,,
Bank of India Mid & Small Cap Equity & Debt Fund-Reg(G),32972,Bank of India Mutual Fund,3.86,7.34,18.66,49.32,Nifty MidSmallcap 400 - TRI,23.89,23.52,,12.88,3,6,3,4,2,3,2,,Bank of India Mid & Small Cap Equity & Debt Fund-Reg(G),Hybrid : Equity Oriented,56,56,56,56,55,53,48,24,6.35,2.27,3.84,11.94,22.53,12.63,12.83,11.87,,,,,,,,
HDFC NIFTY G-Sec Jun 2036 Index Fund-Reg(G),47714,HDFC Mutual Fund,1.39,1.81,5.1,6.45,Nifty G-Sec Jun 2036 Index,,,,4.09,8,7,4,7,3,,,,HDFC NIFTY G-Sec Jun 2036 Index Fund-Reg(G),Debt : Long Duration,21,24,21,20,19,3,3,2,3.97,1.25,1.57,4.99,6.25,4.46,6.74,7.56,,,,,,,,
360 ONE Liquid Fund-Reg(G),15687,360 ONE Mutual Fund,0.53,1.8,3.58,7.09,CRISIL Liquid Debt Index,5.43,4.84,5.98,2.72,30,31,29,30,29,29,30,26,360 ONE Liquid Fund-Reg(G),Debt : Liquid,37,37,37,37,36,35,34,29,2.78,0.54,1.81,3.62,7.14,5.51,5.08,6.32,,,,,,,,
Samco Flexi Cap Fund-Reg(G),46217,Samco Mutual Fund,2.7,-1.42,7.08,25.53,NIFTY 500 - TRI,,,,1.11,45,42,47,46,39,,,,Samco Flexi Cap Fund-Reg(G),Equity : Flexi Cap,46,47,47,46,41,29,26,19,10.36,4.18,5.98,20.26,39.1,19.45,18.38,15.78,,,,,,,,
SBI Nifty Smallcap 250 Index Fund-Reg(G),46937,SBI Mutual Fund,3.95,4.34,21.18,61.57,Nifty Smallcap 250 - TRI,,,,12.13,44,48,46,43,28,,,,SBI Nifty Smallcap 250 Index Fund-Reg(G),Equity : Index Funds,105,115,108,103,91,40,23,18,11.01,3.99,5.03,22.94,44.88,18.64,16.26,12.81,,,,,,,,
360 ONE Dynamic Bond Fund-Reg(G),17578,360 ONE Mutual Fund,0.83,1.44,4.47,6.64,CRISIL Dynamic Bond Index,5.84,6.48,7.3,3.45,5,18,14,4,6,4,10,9,360 ONE Dynamic Bond Fund-Reg(G),Debt : Dynamic Bond,22,22,22,22,22,21,21,18,3.19,1.06,1.48,4.13,6.3,5.28,6.45,7.33,,,,,,,,
Bandhan Innovation Fund-Reg(G),48656,Bandhan Mutual Fund,,,,,NIFTY 500 - TRI,,,,,,,,,,,,,Bandhan Innovation Fund-Reg(G),Equity : Thematic,56,60,56,53,44,31,14,8,13.47,4.77,7.03,24.28,45.56,21.93,22.58,15.92,,,,,,,,
Mirae Asset Equity Allocator FoF-Reg(G),45064,Mirae Asset Mutual Fund,3.02,4.74,19.36,34.81,NIFTY 200 - TRI,18.77,,,8.08,19,16,23,7,10,8,,,Mirae Asset Equity Allocator FoF-Reg(G),FoFs : Domestic,53,56,55,53,53,37,25,22,8.18,2.34,6.15,14.05,24.59,14.07,13.32,11.05,,,,,,,,
Axis NIFTY 50 ETF,33980,Axis Mutual Fund,1.63,2.12,14.25,24.91,NIFTY 50 - TRI,15.93,15.74,,3.76,89,108,103,92,78,38,34,,Axis NIFTY 50 ETF,Equity : ETFs,141,149,145,141,129,77,56,23,8.76,3.47,3.58,19.87,38.0,18.62,17.5,13.17,,,,,,,,
Tata NIFTY 50 Index Fund-Reg(G),3247,Tata Mutual Fund,1.59,2.0,13.94,24.12,NIFTY 50 - TRI,15.29,15.05,12.44,3.54,85,92,83,81,76,27,15,9,Tata NIFTY 50 Index Fund-Reg(G),Equity : Index Funds,105,115,108,103,91,40,23,18,11.01,3.99,5.03,22.94,44.88,18.64,16.26,12.81,,,,,,,,
Aditya Birla SL Pharma & Healthcare Fund-Reg(G),37591,Aditya Birla Sun Life Mutual Fund,2.46,0.0,20.19,55.25,S&P BSE Health Care - TRI,13.97,,,12.71,5,3,12,6,2,7,,,Aditya Birla SL Pharma & Healthcare Fund-Reg(G),Equity : Sectoral - Pharma,14,16,16,13,11,9,8,3,11.78,1.63,0.43,19.83,51.57,14.56,24.6,15.9,3.14,0.49,21.15,56.63,14.62,22.82,15.3,33.77
Bandhan Hybrid Equity Fund-Reg(G),34066,Bandhan Mutual Fund,2.08,3.22,12.81,24.48,S&P BSE 200 - TRI,14.53,14.38,,5.8,26,28,32,25,23,17,14,,Bandhan Hybrid Equity Fund-Reg(G),Hybrid : Equity Oriented,56,56,56,56,55,53,48,24,6.35,2.27,3.84,11.94,22.53,12.63,12.83,11.87,3.95,4.75,20.17,36.06,18.43,18.54,12.47,22.25
Motilal Oswal Nifty Smallcap 250 Index Fund-Reg(G),43811,Motilal Oswal Mutual Fund,3.95,4.38,21.25,61.67,Nifty Smallcap 250 - TRI,26.7,,,12.19,43,47,45,42,26,4,,,Motilal Oswal Nifty Smallcap 250 Index Fund-Reg(G),Equity : Index Funds,105,115,108,103,91,40,23,18,11.01,3.99,5.03,22.94,44.88,18.64,16.26,12.81,,,,,,,,
Kotak Quant Fund-Reg(G),48083,Kotak Mahindra Mutual Fund,4.29,3.68,31.08,,NIFTY 200 - TRI,,,,15.96,17,30,46,13,,,,,Kotak Quant Fund-Reg(G),Equity : Thematic,56,60,56,53,44,31,14,8,13.47,4.77,7.03,24.28,45.56,21.93,22.58,15.92,,,,,,,,
PGIM India ELSS Tax Saver Fund-Reg(G),26780,PGIM India Mutual Fund,1.96,4.27,11.34,21.74,NIFTY 500 - TRI,16.07,17.06,,3.54,57,54,36,58,59,50,39,,PGIM India ELSS Tax Saver Fund-Reg(G),Equity : Tax Saving (ELSS),60,60,60,60,59,55,53,27,9.46,3.98,5.47,19.08,38.78,21.53,20.31,15.68,,,,,,,,
Mirae Asset Nifty Midcap 150 ETF,46105,Mirae Asset Mutual Fund,5.42,6.52,23.69,57.52,Nifty Midcap 150 - TRI,,,,12.85,40,30,35,35,29,,,,Mirae Asset Nifty Midcap 150 ETF,Equity : ETFs,141,149,145,141,129,77,56,23,8.76,3.47,3.58,19.87,38.0,18.62,17.5,13.17,,,,,,,,
HDFC Dynamic Debt Fund(G),1274,HDFC Mutual Fund,1.05,1.67,4.19,6.61,NIFTY Composite Debt Index,6.23,6.69,6.92,3.15,13,12,5,9,8,3,9,13,HDFC Dynamic Debt Fund(G),Debt : Dynamic Bond,22,22,22,22,22,21,21,18,3.19,1.06,1.48,4.13,6.3,5.28,6.45,7.33,,,,,,,,
Aditya Birla SL ESG Integration Strategy Fund-Reg(G),44736,Aditya Birla Sun Life Mutual Fund,4.5,4.28,13.97,27.09,NIFTY100 ESG - TRI,13.96,,,5.14,49,29,42,46,42,27,,,Aditya Birla SL ESG Integration Strategy Fund-Reg(G),Equity : Thematic,56,60,56,53,44,31,14,8,13.47,4.77,7.03,24.28,45.56,21.93,22.58,15.92,,,,,,,,
Baroda BNP Paribas Overnight Fund-Reg(G),43376,Baroda BNP Paribas Mutual Fund,0.53,1.6,3.3,6.71,CRISIL Liquid Overnight Index,5.25,4.72,,2.48,22,14,18,17,11,8,3,,Baroda BNP Paribas Overnight Fund-Reg(G),Debt : Overnight,35,35,35,35,32,27,15,3,2.5,0.53,1.6,3.29,6.69,5.22,4.67,5.75,,,,,,,,
Aditya Birla SL CRISIL IBX Gilt Apr 2029 Index Fund-Reg(G),46950,Aditya Birla Sun Life Mutual Fund,1.03,1.72,4.1,6.32,CRISIL IBX Gilt Index - April 2029,,,,2.78,27,25,5,23,17,,,,Aditya Birla SL CRISIL IBX Gilt Apr 2029 Index Fund-Reg(G),Debt : Gilt,35,35,35,35,35,23,21,21,3.23,1.12,1.54,4.29,6.36,4.89,6.78,7.88,,,,,,,,
LIC MF Nifty 100 ETF,33578,LIC Mutual Fund,2.64,4.13,18.77,30.63,NIFTY 100 - TRI,16.69,16.27,,7.19,67,68,52,60,71,29,26,,LIC MF Nifty 100 ETF,Equity : ETFs,141,149,145,141,129,77,56,23,8.76,3.47,3.58,19.87,38.0,18.62,17.5,13.17,,,,,,,,
JM Value Fund(G),1849,JM Financial Mutual Fund,8.6,7.69,28.96,66.46,S&P BSE 500 - TRI,30.17,25.21,19.61,17.97,2,1,2,2,2,1,2,2,JM Value Fund(G),Equity : Value / Contra,22,22,22,22,21,18,17,14,12.0,4.07,5.1,23.95,47.62,23.38,20.91,17.22,4.13,4.9,20.36,38.34,19.27,19.21,12.44,23.2
360 ONE Balanced Hybrid Fund-Reg(G),48144,360 ONE Mutual Fund,3.91,5.91,13.1,,NIFTY 50 Hybrid Composite Debt 50:50 Index,,,,7.73,16,5,8,22,,,,,360 ONE Balanced Hybrid Fund-Reg(G),Hybrid : Equity Oriented,56,56,56,56,55,53,48,24,6.35,2.27,3.84,11.94,22.53,12.63,12.83,11.87,,,,,,,,
Invesco India Ultra Short Duration Fund(G),13460,Invesco Mutual Fund,0.52,1.98,3.76,7.1,NIFTY Ultra Short Duration Debt Index,5.21,5.28,6.76,3.01,1,11,2,2,9,13,9,5,Invesco India Ultra Short Duration Fund(G),Debt : Ultra Short Duration,24,24,24,24,24,24,18,13,2.72,0.51,1.83,3.48,6.83,5.32,5.39,6.4,,,,,,,,
HDFC Non-Cyclical Consumer Fund-Reg(G),46357,HDFC Mutual Fund,2.68,4.54,15.45,,Nifty India Consumption - TRI,,,,8.43,9,16,15,9,,,,,HDFC Non-Cyclical Consumer Fund-Reg(G),Equity : Thematic - Consumption,16,17,17,16,13,13,13,8,8.56,4.14,6.6,16.22,35.27,21.13,18.91,16.3,,,,,,,,
Nippon India US Equity Opp Fund(G),19246,Nippon India Mutual Fund,2.89,4.35,17.82,32.04,S&P 500 - TRI,9.38,15.13,,11.04,2,7,6,1,3,3,2,,Nippon India US Equity Opp Fund(G),Equity : International,8,8,8,8,8,6,5,3,8.11,4.29,3.94,14.68,23.81,6.27,10.9,9.75,,,,,,,,
Franklin India NSE Nifty 50 Index Fund(G),942,Franklin Templeton Mutual Fund,1.56,1.97,13.84,23.88,NIFTY 50,15.08,14.75,12.24,3.55,82,98,88,85,79,32,19,13,Franklin India NSE Nifty 50 Index Fund(G),Equity : Index Funds,105,115,108,103,91,40,23,18,11.01,3.99,5.03,22.94,44.88,18.64,16.26,12.81,2.3,2.09,14.04,24.12,14.19,14.53,10.36,9.25
Nippon India Index Fund-S&P BSE Sensex Plan(G),12865,Nippon India Mutual Fund,1.53,2.19,12.48,20.9,S&P BSE SENSEX - TRI,14.93,14.84,12.11,2.52,95,103,70,93,85,34,18,16,Nippon India Index Fund-S&P BSE Sensex Plan(G),Equity : Index Funds,105,115,108,103,91,40,23,18,11.01,3.99,5.03,22.94,44.88,18.64,16.26,12.81,2.33,2.42,12.91,22.02,15.26,15.69,12.12,7.39
SBI FMP-91-90D-Reg(G),48431,SBI Mutual Fund,0.57,,,,CRISIL Liquid Debt Index,,,,1.84,93,84,,,,,,,SBI FMP-91-90D-Reg(G),Debt : FTP/FMP,102,109,102,93,91,21,17,12,2.7,0.64,1.84,3.88,6.75,5.53,5.71,6.18,,,,,,,,
Mirae Asset S&P 500 Top 50 ETF,45835,Mirae Asset Mutual Fund,5.22,7.01,19.01,35.45,S&P 500 Top 50 TRI,,,,14.73,35,36,31,58,59,,,,Mirae Asset S&P 500 Top 50 ETF,Equity : ETFs,141,149,145,141,129,77,56,23,8.76,3.47,3.58,19.87,38.0,18.62,17.5,13.17,,,,,,,,
Quant PSU Fund-Reg(G),48341,Quant Mutual Fund,8.81,,,,S&P BSE PSU - TRI,,,,,,4,,,,,,,Quant PSU Fund-Reg(G),Equity : Thematic,56,60,56,53,44,31,14,8,13.47,4.77,7.03,24.28,45.56,21.93,22.58,15.92,9.57,9.54,59.19,107.57,46.37,28.22,1.57,84.95
Quant Manufacturing Fund-Reg(G),48120,Quant Mutual Fund,4.58,7.88,35.54,,Nifty India Manufacturing - TRI,,,,21.79,10,27,19,7,,,,,Quant Manufacturing Fund-Reg(G),Equity : Thematic,56,60,56,53,44,31,14,8,13.47,4.77,7.03,24.28,45.56,21.93,22.58,15.92,,,,,,,,
UTI Innovation Fund-Reg(G),48238,UTI Mutual Fund,1.34,0.72,3.5,,NIFTY 500 - TRI,,,,2.16,55,59,54,53,,,,,UTI Innovation Fund-Reg(G),Equity : Thematic,56,60,56,53,44,31,14,8,13.47,4.77,7.03,24.28,45.56,21.93,22.58,15.92,,,,,,,,
Union Innovation & Opp Fund-Reg(G),45727,Union Mutual Fund,4.78,8.04,15.98,,NIFTY 500 - TRI,,,,12.56,27,22,17,43,,,,,Union Innovation & Opp Fund-Reg(G),Equity : Thematic,56,60,56,53,44,31,14,8,13.47,4.77,7.03,24.28,45.56,21.93,22.58,15.92,,,,,,,,
Nippon India Nifty 50 Value 20 Index Fund-Reg(G),45289,Nippon India Mutual Fund,3.18,0.47,18.01,33.69,Nifty50 Value 20 - TRI,19.16,,,7.29,61,58,102,60,58,17,,,Nippon India Nifty 50 Value 20 Index Fund-Reg(G),Equity : Index Funds,105,115,108,103,91,40,23,18,11.01,3.99,5.03,22.94,44.88,18.64,16.26,12.81,,,,,,,,
Nippon India Nifty Pharma ETF,45584,Nippon India Mutual Fund,1.53,0.54,20.25,53.88,NIFTY PHARMA - TRI,,,,12.91,39,123,119,51,37,,,,Nippon India Nifty Pharma ETF,Equity : ETFs,141,149,145,141,129,77,56,23,8.76,3.47,3.58,19.87,38.0,18.62,17.5,13.17,,,,,,,,
UTI Gilt Fund-Reg(G),3560,UTI Mutual Fund,1.29,1.69,4.59,6.71,CRISIL Dynamic Gilt Index,5.07,6.87,8.37,3.57,8,13,8,8,8,7,10,6,UTI Gilt Fund-Reg(G),Debt : Gilt,35,35,35,35,35,23,21,21,3.23,1.12,1.54,4.29,6.36,4.89,6.78,7.88,,,,,,,,
Kotak Nifty 50 Index Fund-Reg(G),45556,Kotak Mahindra Mutual Fund,1.59,1.95,13.87,24.05,NIFTY 50 - TRI,,,,3.49,88,90,89,83,77,,,,Kotak Nifty 50 Index Fund-Reg(G),Equity : Index Funds,105,115,108,103,91,40,23,18,11.01,3.99,5.03,22.94,44.88,18.64,16.26,12.81,,,,,,,,
DSP FMP 267-1246D-Reg(G),47071,DSP Mutual Fund,0.59,1.84,3.87,6.65,CRISIL Medium Duration Debt Index,,,,2.76,63,61,44,43,55,,,,DSP FMP 267-1246D-Reg(G),Debt : FTP/FMP,102,109,102,93,91,21,17,12,2.7,0.64,1.84,3.88,6.75,5.53,5.71,6.18,,,,,,,,
Tata Nifty 50 ETF,41017,Tata Mutual Fund,1.63,2.11,14.22,24.76,NIFTY 50 - TRI,15.86,15.81,,3.73,99,104,106,95,91,45,28,,Tata Nifty 50 ETF,Equity : ETFs,141,149,145,141,129,77,56,23,8.76,3.47,3.58,19.87,38.0,18.62,17.5,13.17,,,,,,,,
Franklin India Banking & PSU Debt Fund(G),28458,Franklin Templeton Mutual Fund,0.6,1.78,3.54,6.67,NIFTY Banking and PSU Debt Index,5.07,6.54,7.35,2.8,20,24,18,22,8,13,11,7,Franklin India Banking & PSU Debt Fund(G),Debt : Banking & PSU,27,27,27,27,26,22,16,15,2.85,0.71,1.79,3.67,6.51,5.09,6.66,7.22,,,,,,,,
SBI FMP-66-1361D-Reg(G),46633,SBI Mutual Fund,0.62,1.83,3.94,6.84,CRISIL Medium Duration Debt Index,,,,2.84,42,53,57,39,25,,,,SBI FMP-66-1361D-Reg(G),Debt : FTP/FMP,102,109,102,93,91,21,17,12,2.7,0.64,1.84,3.88,6.75,5.53,5.71,6.18,,,,,,,,
Baroda BNP Paribas Focused Fund-Reg(G),32452,Baroda BNP Paribas Mutual Fund,4.81,9.08,22.12,38.13,NIFTY 500 - TRI,19.11,17.54,,12.19,13,15,7,15,19,12,14,,Baroda BNP Paribas Focused Fund-Reg(G),Equity : Flexi Cap,46,47,47,46,41,29,26,19,10.36,4.18,5.98,20.26,39.1,19.45,18.38,15.78,,,,,,,,
Axis FTP-118-100D-Reg(G),48251,Axis Mutual Fund,0.56,1.8,,,CRISIL Ultra Short Term Debt Index,,,,1.47,100,89,73,,,,,,Axis FTP-118-100D-Reg(G),Debt : FTP/FMP,102,109,102,93,91,21,17,12,2.7,0.64,1.84,3.88,6.75,5.53,5.71,6.18,,,,,,,,
HDFC Nifty G-Sec Jul 2031 Index Fund-Reg(G),46620,HDFC Mutual Fund,1.07,1.63,4.28,6.27,Nifty G-Sec July 2031 Index,,,,2.99,22,22,17,18,19,,,,HDFC Nifty G-Sec Jul 2031 Index Fund-Reg(G),Debt : Gilt,35,35,35,35,35,23,21,21,3.23,1.12,1.54,4.29,6.36,4.89,6.78,7.88,,,,,,,,
Bandhan Nifty100 Low Volatility 30 Index Fund-Reg(G),46607,Bandhan Mutual Fund,1.38,-0.55,14.92,30.47,Nifty100 Low Volatility 30 - TRI,,,,3.9,73,111,105,69,60,,,,Bandhan Nifty100 Low Volatility 30 Index Fund-Reg(G),Equity : Index Funds,105,115,108,103,91,40,23,18,11.01,3.99,5.03,22.94,44.88,18.64,16.26,12.81,,,,,,,,
UTI India Consumer Fund-Reg(G),3581,UTI Mutual Fund,5.04,9.38,18.09,34.04,Nifty India Consumption - TRI,18.41,16.73,12.45,11.19,5,2,2,6,10,12,10,8,UTI India Consumer Fund-Reg(G),Equity : Thematic - Consumption,16,17,17,16,13,13,13,8,8.56,4.14,6.6,16.22,35.27,21.13,18.91,16.3,,,,,,,,
DSP Banking & Financial Services Fund-Reg(G),48350,DSP Mutual Fund,3.22,3.6,,,Nifty Financial Services - TRI,,,,2.56,12,2,6,,,,,,DSP Banking & Financial Services Fund-Reg(G),Equity : Sectoral - Financial Services,18,20,20,17,15,12,11,8,3.98,2.25,2.83,13.59,22.96,15.61,13.0,13.67,,,,,,,,
Quantum Liquid Fund-Reg(G),19756,Quantum Mutual Fund,0.53,1.74,3.5,6.97,CRISIL Liquid Debt Index,5.34,4.83,5.91,2.68,32,30,33,31,30,31,31,28,Quantum Liquid Fund-Reg(G),Debt : Liquid,37,37,37,37,36,35,34,29,2.78,0.54,1.81,3.62,7.14,5.51,5.08,6.32,,,,,,,,
HDFC NIFTY Next 50 Index Fund-Reg(G),45985,HDFC Mutual Fund,8.03,14.49,43.03,63.98,NIFTY NEXT 50 - TRI,,,,25.69,3,20,4,5,17,,,,HDFC NIFTY Next 50 Index Fund-Reg(G),Equity : Index Funds,105,115,108,103,91,40,23,18,11.01,3.99,5.03,22.94,44.88,18.64,16.26,12.81,,,,,,,,
