Nippon India Nifty AAA CPSE Bond Plus SDL - Apr 2027 Maturity 60:40 Index Fund(G),46532,Nippon India Mutual Fund,0.5,1.82,3.96,6.59,Nifty AAA CPSE Bond Plus SDL Apr 2027 60:40 Index,,,,2.7,8,24,2,47,17,,,,Nippon India Nifty AAA CPSE Bond Plus SDL - Apr 2027 Maturity 60:40 Index Fund(G),Debt : Medium to Long Duration,52,52,52,52,52,11,11,11,2.55,0.48,1.53,4.16,6.38,4.93,5.95,6.78,,,,,,,,
Parag Parikh ELSS Tax Saver Fund-Reg(G),42577,PPFAS Mutual Fund,1.21,2.25,17.11,31.77,NIFTY 500 - TRI,21.24,,,6.56,33,35,47,43,46,24,,,Parag Parikh ELSS Tax Saver Fund-Reg(G),Equity : Tax Saving (ELSS),60,60,60,60,59,55,53,27,6.86,1.5,4.74,20.49,38.85,21.38,19.49,16.27,,,,,,,,
Invesco India Multicap Fund(G),4256,Invesco Mutual Fund,2.2,4.52,21.69,43.48,Nifty500 Multicap 50:25:25 - TRI,21.39,19.9,17.92,7.33,23,9,25,22,14,10,8,4,Invesco India Multicap Fund(G),Equity : Multi Cap,37,38,38,37,33,22,16,13,7.75,1.43,5.08,21.89,41.65,20.4,20.0,16.93,,,,,,,,
Mahindra Manulife Multi Cap Fund-Reg(G),36401,Mahindra Mutual Fund,1.29,1.12,24.79,50.76,Nifty500 Multicap 50:25:25 - TRI,24.44,23.85,,8.89,14,24,35,8,5,5,3,,Mahindra Manulife Multi Cap Fund-Reg(G),Equity : Multi Cap,37,38,38,37,33,22,16,13,7.75,1.43,5.08,21.89,41.65,20.4,20.0,16.93,,,,,,,,
Aditya Birla SL Multi Asset Allocation Fund-Reg(G),47416,Aditya Birla Sun Life Mutual Fund,0.92,5.01,14.58,23.38,S&P BSE 200,,,,6.11,13,15,12,12,9,,,,Aditya Birla SL Multi Asset Allocation Fund-Reg(G),Hybrid : Multi Asset Allocation,17,24,20,17,12,10,7,7,7.33,0.96,4.96,16.48,28.55,16.6,17.35,13.07,-0.52,2.98,19.64,32.04,16.86,16.24,10.9,16.56
HDFC Hybrid Debt Fund(G),1298,HDFC Mutual Fund,0.59,2.07,9.24,15.28,NIFTY 50 Hybrid Composite Debt 15:85 Index,11.09,10.55,9.92,4.55,3,10,11,3,3,2,3,3,HDFC Hybrid Debt Fund(G),Hybrid : Debt Oriented (Conservative),19,19,19,19,19,18,18,18,3.33,0.55,2.08,7.2,12.1,8.52,8.18,8.49,,,,,,,,
Franklin India Equity Advantage Fund(G),933,Franklin Templeton Mutual Fund,0.75,3.43,17.56,33.92,NIFTY LargeMidcap 250 - TRI,17.12,15.52,14.45,3.96,26,28,24,25,23,24,20,18,Franklin India Equity Advantage Fund(G),Equity : Large & Mid Cap,27,29,27,26,26,26,22,18,8.88,1.67,5.86,23.6,42.67,21.46,19.46,17.36,,,,,,,,
Edelweiss Small Cap Fund-Reg(G),40559,Edelweiss Mutual Fund,1.9,2.67,18.07,46.24,Nifty Smallcap 250 - TRI,27.55,28.83,,5.05,19,17,17,15,13,10,4,,Edelweiss Small Cap Fund-Reg(G),Equity : Small Cap,27,27,27,26,24,22,19,11,7.26,2.43,3.26,19.87,49.73,27.36,26.88,21.75,,,,,,,,
Nippon India Multi Asset Fund-Reg(G),26169,Nippon India Mutual Fund,1.28,6.63,20.37,32.64,S&P BSE 500 - TRI,16.86,,,10.06,3,4,3,4,4,5,,,Nippon India Multi Asset Fund-Reg(G),Hybrid : Multi Asset Allocation,17,24,20,17,12,10,7,7,7.33,0.96,4.96,16.48,28.55,16.6,17.35,13.07,-0.39,2.72,20.16,35.79,19.15,18.32,12.44,17.47
Nippon India Retirement Fund-Wealth Creation(G),17164,Nippon India Mutual Fund,1.05,5.67,21.33,42.6,S&P BSE 500 - TRI,21.15,13.97,,7.16,8,12,8,4,3,4,10,,Nippon India Retirement Fund-Wealth Creation(G),Hybrid : Solution Oriented,40,40,40,39,38,37,29,13,4.96,0.94,3.5,13.69,25.33,13.65,12.29,12.53,-0.39,2.72,20.16,35.79,19.15,18.32,12.44,17.47
DSP Dynamic Asset Allocation Fund-Reg(G),25872,DSP Mutual Fund,1.73,3.09,11.48,19.5,CRISIL Hybrid 50+50 - Moderate Index,9.05,9.9,8.9,3.41,25,1,18,22,22,20,15,9,DSP Dynamic Asset Allocation Fund-Reg(G),Hybrid : Dynamic Asset Allocation,30,32,30,28,26,20,17,10,5.2,0.54,3.04,14.26,24.92,12.48,11.93,11.5,,,,,,,,
HDFC Asset Allocator FoF-Reg(G),45488,HDFC Mutual Fund,0.89,4.35,14.54,24.94,NIFTY 50 Hybrid Composite Debt 65:35 Index,16.34,,,6.31,22,25,21,24,25,14,,,HDFC Asset Allocator FoF-Reg(G),FoFs : Domestic,53,56,55,53,53,37,25,22,6.61,1.05,5.21,14.51,23.13,14.17,12.92,11.36,,,,,,,,
SBI Dynamic Bond Fund-Reg(G),2805,SBI Mutual Fund,0.46,1.34,4.2,6.37,CRISIL Dynamic Bond Index,5.35,7.25,7.88,2.76,11,9,12,13,13,7,2,2,SBI Dynamic Bond Fund-Reg(G),Debt : Dynamic Bond,22,22,22,22,22,21,21,18,2.77,0.4,1.32,4.3,6.33,5.19,6.44,7.32,,,,,,,,
HSBC Large & Mid Cap Fund-Reg(G),42701,HSBC Mutual Fund,4.0,10.43,26.71,46.99,NIFTY LargeMidcap 250 - TRI,21.5,19.17,,13.64,2,1,2,7,8,13,13,,HSBC Large & Mid Cap Fund-Reg(G),Equity : Large & Mid Cap,27,29,27,26,26,26,22,18,8.88,1.67,5.86,23.6,42.67,21.46,19.46,17.36,,,,,,,,
Kotak NASDAQ 100 FoF-Reg(G),45260,Kotak Mahindra Mutual Fund,-2.11,2.19,18.24,38.45,Nasdaq-100 - TRI,12.84,,,5.65,32,52,48,22,13,2,,,Kotak NASDAQ 100 FoF-Reg(G),FoFs : Overseas,57,58,57,57,56,35,26,22,5.02,0.18,5.8,15.33,20.99,2.48,9.06,6.26,,,,,,,,
Aditya Birla SL Banking & Financial Services Fund-Reg(G),24150,Aditya Birla Sun Life Mutual Fund,1.38,5.37,12.36,28.54,Nifty Financial Services - TRI,16.33,12.89,16.43,4.56,5,4,7,14,6,5,7,2,Aditya Birla SL Banking & Financial Services Fund-Reg(G),Equity : Sectoral - Financial Services,18,20,20,17,15,12,11,8,4.05,1.01,4.51,16.09,27.69,16.82,13.2,15.21,,,,,,,,
UTI Large & Mid Cap Fund-Reg(G),16672,UTI Mutual Fund,2.34,6.73,24.42,47.26,NIFTY LargeMidcap 250 - TRI,23.16,19.98,15.82,9.51,11,7,9,12,7,8,8,13,UTI Large & Mid Cap Fund-Reg(G),Equity : Large & Mid Cap,27,29,27,26,26,26,22,18,8.88,1.67,5.86,23.6,42.67,21.46,19.46,17.36,,,,,,,,
HSBC Multi Cap Fund-Reg(G),47272,HSBC Mutual Fund,1.95,6.14,29.89,59.32,Nifty500 Multicap 50:25:25 - TRI,,,,11.65,4,12,9,2,1,,,,HSBC Multi Cap Fund-Reg(G),Equity : Multi Cap,37,38,38,37,33,22,16,13,7.75,1.43,5.08,21.89,41.65,20.4,20.0,16.93,,,,,,,,
Sundaram Small Cap Fund(G),3052,Sundaram Mutual Fund,1.51,2.25,18.0,48.68,Nifty Smallcap 250 - TRI,26.46,23.45,19.7,4.82,20,20,18,16,10,14,18,9,Sundaram Small Cap Fund(G),Equity : Small Cap,27,27,27,26,24,22,19,11,7.26,2.43,3.26,19.87,49.73,27.36,26.88,21.75,,,,,,,,
DSP Short Term Fund-Reg(G),729,DSP Mutual Fund,0.45,1.57,3.54,6.29,CRISIL Short Duration Debt Index,4.69,6.15,6.89,2.35,18,20,17,19,17,15,9,12,DSP Short Term Fund-Reg(G),Debt : Short Duration,26,27,26,26,26,22,21,19,2.33,0.46,1.56,3.52,6.32,5.42,5.88,6.87,,,,,,,,
Franklin India Opportunities Fund(G),946,Franklin Templeton Mutual Fund,5.59,11.38,38.56,72.86,NIFTY 500 - TRI,29.17,23.99,19.38,19.0,7,2,3,6,4,8,4,2,Franklin India Opportunities Fund(G),Equity : Thematic,56,60,56,53,44,31,14,8,10.29,1.48,5.39,25.63,44.4,21.66,21.48,16.51,,,,,,,,
HDFC Business Cycle Fund-Reg(G),46445,HDFC Mutual Fund,-0.01,1.89,16.52,31.35,NIFTY 500 - TRI,,,,3.81,49,50,50,45,35,,,,HDFC Business Cycle Fund-Reg(G),Equity : Thematic,56,60,56,53,44,31,14,8,10.29,1.48,5.39,25.63,44.4,21.66,21.48,16.51,,,,,,,,
ICICI Pru Bond Fund(G),6197,ICICI Prudential Mutual Fund,0.54,1.62,4.23,6.86,CRISIL Medium to Long Term Debt Index,5.21,7.16,7.8,2.68,13,16,20,17,2,2,2,2,ICICI Pru Bond Fund(G),Debt : Medium to Long Duration,52,52,52,52,52,11,11,11,2.55,0.48,1.53,4.16,6.38,4.93,5.95,6.78,,,,,,,,
ICICI Pru Constant Maturity Gilt Fund(G),30426,ICICI Prudential Mutual Fund,0.62,1.57,4.75,6.09,Crisil 10 Yr Gilt Index,4.81,7.68,,2.83,2,2,1,4,3,1,1,,ICICI Pru Constant Maturity Gilt Fund(G),Debt : Gilt (10 Yr Constant Duration),6,6,6,6,6,4,4,2,2.79,0.56,1.5,4.79,6.06,4.34,7.12,8.48,,,,,,,,
Nippon India Corp Bond Fund(G),2646,Nippon India Mutual Fund,0.46,1.74,3.99,7.0,NIFTY Corporate Bond Index,5.84,6.64,7.35,2.76,2,9,5,2,4,2,7,7,Nippon India Corp Bond Fund(G),Debt : Corporate Bond,21,21,21,21,21,19,18,12,2.58,0.45,1.68,3.73,6.6,5.0,6.51,7.31,,,,,,,,
SBI Nifty 10 yr Benchmark G-Sec ETF,32455,SBI Mutual Fund,0.59,1.56,4.82,6.16,Nifty 10 yr Benchmark G-Sec,3.62,5.95,,2.73,9,6,16,4,16,13,3,,SBI Nifty 10 yr Benchmark G-Sec ETF,Debt : ETFs,22,26,25,22,17,13,6,1,2.3,0.45,1.48,3.82,6.57,4.84,5.17,5.07,0.08,0.95,4.28,5.7,3.68,5.88,,7.12
HSBC Overnight Fund-Reg(G),42784,HSBC Mutual Fund,0.53,1.61,3.31,6.74,Nifty 1D Rate Index,5.18,,,2.31,11,19,13,13,10,14,,,HSBC Overnight Fund-Reg(G),Debt : Overnight,35,35,35,35,32,27,14,3,2.29,0.53,1.6,3.3,6.7,5.18,4.67,5.76,0.55,1.63,3.37,6.87,5.35,4.82,,6.68
Nippon India ETF Nifty PSU Bank BeES,3722,Nippon India Mutual Fund,-0.77,10.49,44.69,74.82,NIFTY PSU BANK - TRI,51.44,18.98,9.54,23.8,5,130,26,5,6,2,19,21,Nippon India ETF Nifty PSU Bank BeES,Equity : ETFs,141,149,145,141,129,75,56,23,7.09,0.64,4.21,21.92,38.26,18.91,16.79,13.97,,,,,,,,
Edelweiss Large & Mid Cap Fund-Reg(G),1956,Edelweiss Mutual Fund,0.16,3.47,19.67,38.46,NIFTY LargeMidcap 250 - TRI,19.81,19.49,16.63,5.63,25,29,23,20,18,19,11,12,Edelweiss Large & Mid Cap Fund-Reg(G),Equity : Large & Mid Cap,27,29,27,26,26,26,22,18,8.88,1.67,5.86,23.6,42.67,21.46,19.46,17.36,,,,,,,,
UTI MNC Fund-Reg(G),3634,UTI Mutual Fund,0.9,4.58,14.71,30.48,NIFTY MNC - TRI,15.57,13.87,15.33,7.01,1,4,1,3,3,2,2,1,UTI MNC Fund-Reg(G),Equity : Thematic - MNC,5,5,5,5,5,4,3,3,4.3,1.33,2.63,12.26,27.97,14.05,13.13,15.21,,,,,,,,
Tata Multicap Fund-Reg(G),47480,Tata Mutual Fund,0.1,0.87,12.35,30.18,Nifty500 Multicap 50:25:25 - TRI,,,,2.16,36,34,36,36,31,,,,Tata Multicap Fund-Reg(G),Equity : Multi Cap,37,38,38,37,33,22,16,13,7.75,1.43,5.08,21.89,41.65,20.4,20.0,16.93,,,,,,,,
UTI Balanced Advantage Fund-Reg(G),48102,UTI Mutual Fund,0.7,2.31,10.66,,NIFTY 50 Hybrid Composite Debt 50:50 Index,,,,2.9,27,13,26,26,,,,,UTI Balanced Advantage Fund-Reg(G),Hybrid : Dynamic Asset Allocation,30,32,30,28,26,20,17,10,5.2,0.54,3.04,14.26,24.92,12.48,11.93,11.5,,,,,,,,
UTI MEPUS,3617,UTI Mutual Fund,0.51,3.35,15.13,28.01,S&P BSE 100 - TRI,15.42,13.83,13.62,3.37,45,49,43,47,54,51,51,27,UTI MEPUS,Equity : Tax Saving (ELSS),60,60,60,60,59,55,53,27,6.86,1.5,4.74,20.49,38.85,21.38,19.49,16.27,-0.49,2.9,17.81,29.39,17.47,16.59,12.13,13.85
Kotak Nifty SDL Apr 2032 Top 12 Equal Weight Index Fund-Reg(G),46390,Kotak Mahindra Mutual Fund,0.48,2.09,5.0,7.08,Nifty SDL Apr 2032 Top 12 Equal Weight Index,,,,3.46,13,8,1,12,1,,,,Kotak Nifty SDL Apr 2032 Top 12 Equal Weight Index Fund-Reg(G),Debt : Long Duration,21,24,21,20,19,3,3,2,3.48,0.43,1.48,5.28,6.51,4.34,6.8,7.54,,,,,,,,
LIC MF Large & Midcap Fund-Reg(G),31950,LIC Mutual Fund,3.31,5.66,22.64,41.96,NIFTY LargeMidcap 250 - TRI,19.31,18.2,,8.34,14,2,13,15,14,20,18,,LIC MF Large & Midcap Fund-Reg(G),Equity : Large & Mid Cap,27,29,27,26,26,26,22,18,8.88,1.67,5.86,23.6,42.67,21.46,19.46,17.36,,,,,,,,
ICICI Pru Nifty 100 Low Volatility 30 ETF,36395,ICICI Prudential Mutual Fund,-1.2,0.93,18.66,33.15,Nifty100 Low Volatility 30 - TRI,17.65,16.71,,3.9,78,134,127,74,67,27,23,,ICICI Pru Nifty 100 Low Volatility 30 ETF,Equity : ETFs,141,149,145,141,129,75,56,23,7.09,0.64,4.21,21.92,38.26,18.91,16.79,13.97,,,,,,,,
ICICI Pru Transportation and Logistics Fund-Reg(G),46979,ICICI Prudential Mutual Fund,3.1,8.31,29.57,57.79,Nifty Transportation & Logistics - TRI,,,,15.28,6,6,5,5,3,,,,ICICI Pru Transportation and Logistics Fund-Reg(G),Equity : Sectoral - Auto,6,6,6,5,4,1,1,1,18.15,3.79,10.27,33.68,60.29,28.9,21.22,17.66,,,,,,,,
Axis Business Cycles Fund-Reg(G),47580,Axis Mutual Fund,1.04,5.1,21.01,39.07,NIFTY 500 - TRI,,,,7.41,36,36,30,31,25,,,,Axis Business Cycles Fund-Reg(G),Equity : Thematic,56,60,56,53,44,31,14,8,10.29,1.48,5.39,25.63,44.4,21.66,21.48,16.51,,,,,,,,
Tata Ultra Short Term Fund-Reg(G),41798,Tata Mutual Fund,0.53,1.75,3.4,6.72,CRISIL Ultra Short Term Debt Index,5.03,5.11,,2.48,15,18,19,16,17,17,13,,Tata Ultra Short Term Fund-Reg(G),Debt : Ultra Short Duration,24,24,24,24,24,24,18,13,2.55,0.55,1.82,3.48,6.9,5.28,5.42,6.41,,,,,,,,
UTI Short Duration Fund-Reg(G),3656,UTI Mutual Fund,0.41,1.74,3.92,7.01,CRISIL Short Duration Debt Index,6.96,5.13,6.54,2.72,3,25,5,3,4,3,18,14,UTI Short Duration Fund-Reg(G),Debt : Short Duration,26,27,26,26,26,22,21,19,2.33,0.46,1.56,3.52,6.32,5.42,5.88,6.87,,,,,,,,
Kotak India EQ Contra Fund(G),1973,Kotak Mahindra Mutual Fund,2.01,4.62,29.29,49.39,NIFTY 500 - TRI,23.96,20.55,17.24,10.09,6,6,11,4,7,9,8,10,Kotak India EQ Contra Fund(G),Equity : Value / Contra,22,22,22,22,21,18,17,14,9.32,1.31,4.22,26.07,47.39,23.39,19.95,17.89,,,,,,,,
HDFC Multi-Asset Fund(G),1307,HDFC Mutual Fund,0.42,3.96,13.77,22.02,NIFTY 50 - TRI,14.32,14.45,11.21,6.18,12,23,16,13,10,8,6,5,HDFC Multi-Asset Fund(G),Hybrid : Multi Asset Allocation,17,24,20,17,12,10,7,7,7.33,0.96,4.96,16.48,28.55,16.6,17.35,13.07,,,,,,,,
Tata Flexi Cap Fund-Reg(G),39283,Tata Mutual Fund,0.84,3.61,16.43,34.8,NIFTY 500 - TRI,16.06,15.26,,3.7,40,31,34,38,28,23,19,,Tata Flexi Cap Fund-Reg(G),Equity : Flexi Cap,46,47,47,45,41,29,26,19,7.74,1.28,5.38,21.82,39.09,19.32,17.67,16.4,,,,,,,,
HDFC Long Duration Debt Fund-Reg(G),45991,HDFC Mutual Fund,0.41,0.87,6.22,6.31,NIFTY Long Duration Debt Index,,,,4.43,1,17,19,1,16,,,,HDFC Long Duration Debt Fund-Reg(G),Debt : Long Duration,21,24,21,20,19,3,3,2,3.48,0.43,1.48,5.28,6.51,4.34,6.8,7.54,,,,,,,,
Aditya Birla SL Nifty Bank ETF,34434,Aditya Birla Sun Life Mutual Fund,0.82,6.96,11.98,15.4,NIFTY BANK - TRI,14.74,,,1.18,118,63,40,118,117,59,,,Aditya Birla SL Nifty Bank ETF,Equity : ETFs,141,149,145,141,129,75,56,23,7.09,0.64,4.21,21.92,38.26,18.91,16.79,13.97,,,,,,,,
UTI Low Duration Fund-Reg(G),3601,UTI Mutual Fund,0.56,1.87,3.7,7.22,NIFTY Low Duration Debt Index,7.3,4.64,6.36,2.67,5,4,7,3,3,1,19,15,UTI Low Duration Fund-Reg(G),Debt : Low Duration,20,20,20,20,20,20,20,18,2.59,0.55,1.85,3.57,7.0,5.35,5.42,6.61,,,,,,,,
SBI Healthcare Opp Fund-Reg(G),2813,SBI Mutual Fund,0.78,4.41,27.36,54.5,S&P BSE Health Care - TRI,17.03,23.99,15.36,12.97,3,3,4,4,4,1,4,2,SBI Healthcare Opp Fund-Reg(G),Equity : Sectoral - Pharma,14,16,16,13,11,9,8,3,11.1,0.36,3.22,26.18,52.13,14.92,23.36,15.35,-1.32,0.93,23.8,52.62,14.13,20.94,15.3,31.36
DSP Corp Bond Fund-Reg(G),37709,DSP Mutual Fund,0.45,1.67,3.65,6.32,CRISIL Corporate Bond Index,4.42,6.26,,2.51,16,15,9,15,17,18,14,,DSP Corp Bond Fund-Reg(G),Debt : Corporate Bond,21,21,21,21,21,19,18,12,2.58,0.45,1.68,3.73,6.6,5.0,6.51,7.31,,,,,,,,
Tata Multi Asset Opp Fund-Reg(G),44648,Tata Mutual Fund,0.63,5.19,16.19,26.77,S&P BSE 200,15.77,,,7.81,5,19,11,9,8,6,,,Tata Multi Asset Opp Fund-Reg(G),Hybrid : Multi Asset Allocation,17,24,20,17,12,10,7,7,7.33,0.96,4.96,16.48,28.55,16.6,17.35,13.07,-0.52,2.98,19.64,32.04,16.86,16.24,10.9,16.56
UTI Focused Fund-Reg(G),45685,UTI Mutual Fund,1.95,7.09,19.8,37.15,NIFTY 500 - TRI,,,,6.53,28,11,11,26,22,,,,UTI Focused Fund-Reg(G),Equity : Flexi Cap,46,47,47,45,41,29,26,19,7.74,1.28,5.38,21.82,39.09,19.32,17.67,16.4,,,,,,,,
Quant Large & Mid Cap Fund(G),874,Quant Mutual Fund,2.2,8.57,40.22,62.54,NIFTY LargeMidcap 250 - TRI,28.68,26.81,22.93,17.33,1,8,4,1,1,1,1,1,Quant Large & Mid Cap Fund(G),Equity : Large & Mid Cap,27,29,27,26,26,26,22,18,8.88,1.67,5.86,23.6,42.67,21.46,19.46,17.36,,,,,,,,
Invesco India ELSS Tax Saver Fund(G),2270,Invesco Mutual Fund,0.84,3.79,20.13,40.79,S&P BSE 500 - TRI,17.4,17.09,16.85,6.05,36,41,39,29,28,45,34,8,Invesco India ELSS Tax Saver Fund(G),Equity : Tax Saving (ELSS),60,60,60,60,59,55,53,27,6.86,1.5,4.74,20.49,38.85,21.38,19.49,16.27,-0.39,2.72,20.16,35.79,19.15,18.32,12.44,17.47
Kotak Dynamic Bond Fund-Reg(G),5430,Kotak Mahindra Mutual Fund,0.06,0.94,4.51,6.74,NIFTY Composite Debt Index,5.06,6.91,7.83,2.89,8,22,19,5,5,9,8,3,Kotak Dynamic Bond Fund-Reg(G),Debt : Dynamic Bond,22,22,22,22,22,21,21,18,2.77,0.4,1.32,4.3,6.33,5.19,6.44,7.32,,,,,,,,
Mirae Asset Multicap Fund-Reg(G),48089,Mirae Asset Mutual Fund,0.65,2.05,19.55,,Nifty500 Multicap 50:25:25 - TRI,,,,5.47,30,31,34,29,,,,,Mirae Asset Multicap Fund-Reg(G),Equity : Multi Cap,37,38,38,37,33,22,16,13,7.75,1.43,5.08,21.89,41.65,20.4,20.0,16.93,,,,,,,,
ICICI Pru Housing Opp Fund-Reg(G),46546,ICICI Prudential Mutual Fund,1.45,6.29,22.55,38.06,Nifty Housing - TRI,,,,7.93,34,31,23,26,28,,,,ICICI Pru Housing Opp Fund-Reg(G),Equity : Thematic,56,60,56,53,44,31,14,8,10.29,1.48,5.39,25.63,44.4,21.66,21.48,16.51,,,,,,,,
Union Liquid Fund(G),14561,Union Mutual Fund,0.58,1.85,3.68,7.28,CRISIL Liquid Debt Index,5.56,5.2,5.98,2.6,14,7,21,12,7,5,6,27,Union Liquid Fund(G),Debt : Liquid,37,37,37,37,36,35,34,29,2.56,0.57,1.82,3.62,7.16,5.47,5.09,6.33,,,,,,,,
SBI Credit Risk Fund-Reg(G),2770,SBI Mutual Fund,0.51,1.77,3.74,6.81,NIFTY Credit Risk Bond Index,6.2,6.99,7.66,2.52,10,7,5,9,8,8,5,3,SBI Credit Risk Fund-Reg(G),Debt : Credit Risk,15,15,15,15,15,15,15,8,2.63,0.44,1.71,3.73,7.38,8.84,5.03,6.69,,,,,,,,
DSP Ultra Short Fund-Reg(G),702,DSP Mutual Fund,0.53,1.77,3.4,6.9,CRISIL Ultra Short Term Debt Index,5.03,5.11,6.01,2.45,19,21,16,17,14,18,15,9,DSP Ultra Short Fund-Reg(G),Debt : Ultra Short Duration,24,24,24,24,24,24,18,13,2.55,0.55,1.82,3.48,6.9,5.28,5.42,6.41,,,,,,,,
Bajaj Finserv Flexi Cap Fund-Reg(G),48061,Bajaj Finserv Mutual Fund,3.18,7.35,21.3,,S&P BSE 500 - TRI,,,,10.42,9,4,10,23,,,,,Bajaj Finserv Flexi Cap Fund-Reg(G),Equity : Flexi Cap,46,47,47,45,41,29,26,19,7.74,1.28,5.38,21.82,39.09,19.32,17.67,16.4,-0.39,2.72,20.16,35.79,19.15,18.32,12.44,17.47
SBI Infrastructure Fund-Reg(G),2743,SBI Mutual Fund,2.08,7.8,31.3,63.58,Nifty Infrastructure - TRI,33.55,25.81,19.9,12.85,16,16,14,15,10,12,7,6,SBI Infrastructure Fund-Reg(G),Equity : Sectoral - Infrastructure,19,19,19,19,19,19,19,18,16.42,3.11,9.17,35.6,63.99,33.5,24.92,19.07,,,,,,,,
Kotak Debt Hybrid Fund(G),2051,Kotak Mahindra Mutual Fund,0.59,1.18,9.67,15.58,CRISIL Hybrid 85+15 - Conservative Index,10.43,11.43,10.28,3.68,6,11,17,1,2,3,1,2,Kotak Debt Hybrid Fund(G),Hybrid : Debt Oriented (Conservative),19,19,19,19,19,18,18,18,3.33,0.55,2.08,7.2,12.1,8.52,8.18,8.49,,,,,,,,
SBI CRISIL IBX Gilt Index - June 2036 Fund-Reg(G),46941,SBI Mutual Fund,0.44,1.35,5.31,6.44,CRISIL IBX Gilt Index - June 2036,,,,3.37,15,15,14,9,15,,,,SBI CRISIL IBX Gilt Index - June 2036 Fund-Reg(G),Debt : Long Duration,21,24,21,20,19,3,3,2,3.48,0.43,1.48,5.28,6.51,4.34,6.8,7.54,,,,,,,,
HSBC Infrastructure Fund-Reg(G),594,HSBC Mutual Fund,4.34,9.25,31.76,56.77,Nifty Infrastructure - TRI,33.27,22.5,19.66,13.23,15,5,9,14,14,13,14,8,HSBC Infrastructure Fund-Reg(G),Equity : Sectoral - Infrastructure,19,19,19,19,19,19,19,18,16.42,3.11,9.17,35.6,63.99,33.5,24.92,19.07,,,,,,,,
ICICI Pru PSU Equity Fund-Reg(G),46106,ICICI Prudential Mutual Fund,3.2,7.18,53.14,80.83,S&P BSE PSU - TRI,,,,25.08,1,28,27,1,2,,,,ICICI Pru PSU Equity Fund-Reg(G),Equity : Index Funds,106,116,109,103,91,40,23,18,8.37,1.17,4.67,24.73,43.76,18.72,15.56,13.54,1.7,5.8,55.26,94.31,46.09,26.18,1.57,69.74
Bajaj Finserv Liquid Fund-Reg(G),48041,Bajaj Finserv Mutual Fund,0.57,1.84,3.66,,Nifty Liquid Fund Index,,,,2.59,21,25,23,22,,,,,Bajaj Finserv Liquid Fund-Reg(G),Debt : Liquid,37,37,37,37,36,35,34,29,2.56,0.57,1.82,3.62,7.16,5.47,5.09,6.33,,,,,,,,
DSP Banking & PSU Debt Fund-Reg(G),22142,DSP Mutual Fund,0.29,1.59,4.05,6.71,NIFTY Banking and PSU Debt Index,4.99,6.76,7.42,2.83,1,26,22,2,5,13,9,6,DSP Banking & PSU Debt Fund-Reg(G),Debt : Banking & PSU,27,27,27,26,26,22,16,15,2.59,0.42,1.65,3.71,6.49,5.03,6.7,7.23,,,,,,,,
Quant Liquid Plan(G),883,Quant Mutual Fund,0.55,1.74,3.49,6.96,CRISIL Liquid Debt Index,5.46,5.45,6.67,2.46,32,33,32,32,31,26,1,1,Quant Liquid Plan(G),Debt : Liquid,37,37,37,37,36,35,34,29,2.56,0.57,1.82,3.62,7.16,5.47,5.09,6.33,,,,,,,,
Sundaram Multi Cap Fund(G),2370,Sundaram Mutual Fund,2.39,3.37,20.59,39.94,Nifty500 Multicap 50:25:25 - TRI,22.22,18.84,17.19,5.75,28,8,30,24,18,8,10,7,Sundaram Multi Cap Fund(G),Equity : Multi Cap,37,38,38,37,33,22,16,13,7.75,1.43,5.08,21.89,41.65,20.4,20.0,16.93,,,,,,,,
Kotak Business Cycle Fund-Reg(G),46472,Kotak Mahindra Mutual Fund,1.46,7.3,18.34,33.59,NIFTY 500 - TRI,,,,7.29,37,30,14,40,32,,,,Kotak Business Cycle Fund-Reg(G),Equity : Thematic,56,60,56,53,44,31,14,8,10.29,1.48,5.39,25.63,44.4,21.66,21.48,16.51,,,,,,,,
Tata Ethical Fund-Reg(G),3283,Tata Mutual Fund,1.73,2.58,18.35,31.45,Nifty500 Shariah - TRI,17.3,19.16,15.17,5.74,42,24,46,39,34,19,12,5,Tata Ethical Fund-Reg(G),Equity : Thematic,56,60,56,53,44,31,14,8,10.29,1.48,5.39,25.63,44.4,21.66,21.48,16.51,,,,,,,,
HDFC Gilt Fund(G),1269,HDFC Mutual Fund,0.57,1.45,4.34,6.51,Nifty All Duration G-Sec Index,4.67,6.1,7.62,2.65,22,4,12,23,13,15,18,13,HDFC Gilt Fund(G),Debt : Gilt,35,35,35,35,35,23,21,21,2.79,0.48,1.34,4.57,6.42,4.8,6.79,7.85,,,,,,,,
DSP Healthcare Fund-Reg(G),36002,DSP Mutual Fund,-0.46,3.21,24.71,51.76,S&P BSE Health Care - TRI,16.22,26.16,,10.63,9,15,8,10,6,4,1,,DSP Healthcare Fund-Reg(G),Equity : Sectoral - Pharma,14,16,16,13,11,9,8,3,11.1,0.36,3.22,26.18,52.13,14.92,23.36,15.35,-1.32,0.93,23.8,52.62,14.13,20.94,15.3,31.36
HSBC Ultra Short Duration Fund-Reg(G),44328,HSBC Mutual Fund,0.57,1.9,3.63,7.23,NIFTY Ultra Short Duration Debt Index,5.48,,,2.65,8,9,8,8,6,7,,,HSBC Ultra Short Duration Fund-Reg(G),Debt : Ultra Short Duration,24,24,24,24,24,24,18,13,2.55,0.55,1.82,3.48,6.9,5.28,5.42,6.41,,,,,,,,
Tata Treasury Advantage Fund-Reg(G),3205,Tata Mutual Fund,0.55,1.82,3.59,6.98,CRISIL Low Duration Debt Index,5.3,4.81,6.39,2.62,7,12,11,8,9,6,18,13,Tata Treasury Advantage Fund-Reg(G),Debt : Low Duration,20,20,20,20,20,20,20,18,2.59,0.55,1.85,3.57,7.0,5.35,5.42,6.61,,,,,,,,
Invesco India Focused Fund-Reg(G),45058,Invesco Mutual Fund,3.61,14.22,39.17,66.02,S&P BSE 500 - TRI,24.42,,,18.07,1,2,1,1,1,6,,,Invesco India Focused Fund-Reg(G),Equity : Flexi Cap,46,47,47,45,41,29,26,19,7.74,1.28,5.38,21.82,39.09,19.32,17.67,16.4,-0.39,2.72,20.16,35.79,19.15,18.32,12.44,17.47
UTI Ultra Short Duration Fund-Reg(G),3533,UTI Mutual Fund,0.55,1.83,3.52,6.99,NIFTY Ultra Short Duration Debt Index,6.15,5.11,6.47,2.58,13,12,13,11,12,2,14,8,UTI Ultra Short Duration Fund-Reg(G),Debt : Ultra Short Duration,24,24,24,24,24,24,18,13,2.55,0.55,1.82,3.48,6.9,5.28,5.42,6.41,,,,,,,,
Tata ST Bond Fund-Reg(G),3286,Tata Mutual Fund,0.47,1.55,3.56,6.15,CRISIL Short Duration Debt Index,4.68,6.13,6.27,2.41,14,16,18,18,20,16,10,16,Tata ST Bond Fund-Reg(G),Debt : Short Duration,26,27,26,26,26,22,21,19,2.33,0.46,1.56,3.52,6.32,5.42,5.88,6.87,,,,,,,,
HDFC NIFTY Bank ETF,33563,HDFC Mutual Fund,0.82,6.96,11.99,15.35,NIFTY BANK - TRI,14.7,,,1.18,117,65,41,116,120,63,,,HDFC NIFTY Bank ETF,Equity : ETFs,141,149,145,141,129,75,56,23,7.09,0.64,4.21,21.92,38.26,18.91,16.79,13.97,,,,,,,,
Bandhan Dynamic Bond Fund-Reg(G),7455,Bandhan Mutual Fund,0.41,0.74,5.79,6.7,NIFTY Composite Debt Index,4.5,6.92,7.73,3.9,1,13,21,1,7,16,7,5,Bandhan Dynamic Bond Fund-Reg(G),Debt : Dynamic Bond,22,22,22,22,22,21,21,18,2.77,0.4,1.32,4.3,6.33,5.19,6.44,7.32,,,,,,,,
Canara Rob Focused Equity Fund-Reg(G),45510,Canara Robeco Mutual Fund,-0.42,5.48,19.8,33.23,S&P BSE 500 - TRI,,,,6.61,26,35,16,26,27,,,,Canara Rob Focused Equity Fund-Reg(G),Equity : Multi Cap,37,38,38,37,33,22,16,13,7.75,1.43,5.08,21.89,41.65,20.4,20.0,16.93,-0.39,2.72,20.16,35.79,19.15,18.32,12.44,17.47
SBI Nifty Next 50 ETF,30248,SBI Mutual Fund,3.57,15.14,43.83,62.75,NIFTY NEXT 50 - TRI,22.82,19.75,,20.01,13,19,6,10,18,17,12,,SBI Nifty Next 50 ETF,Equity : ETFs,141,149,145,141,129,75,56,23,7.09,0.64,4.21,21.92,38.26,18.91,16.79,13.97,,,,,,,,
Mirae Asset Nifty 50 ETF,41174,Mirae Asset Mutual Fund,-0.32,2.45,15.81,25.53,NIFTY 50 - TRI,16.32,15.32,,3.44,86,105,104,85,85,37,32,,Mirae Asset Nifty 50 ETF,Equity : ETFs,141,149,145,141,129,75,56,23,7.09,0.64,4.21,21.92,38.26,18.91,16.79,13.97,,,,,,,,
DSP Nifty SDL Plus G-Sec Jun 2028 30:70 Index Fund-Reg(G),45863,DSP Mutual Fund,0.46,1.47,4.12,6.53,Nifty SDL Plus G-Sec Jun 2028 70:30 Index,,,,2.37,42,27,28,31,25,,,,DSP Nifty SDL Plus G-Sec Jun 2028 30:70 Index Fund-Reg(G),Debt : Medium to Long Duration,52,52,52,52,52,11,11,11,2.55,0.48,1.53,4.16,6.38,4.93,5.95,6.78,,,,,,,,
Edelweiss US Technology Equity FOF-Reg(G),44630,Edelweiss Mutual Fund,-2.53,1.84,27.68,52.35,Russell 1000 Equal Weighted Technology Index,8.83,,,6.68,21,53,51,3,2,8,,,Edelweiss US Technology Equity FOF-Reg(G),FoFs : Overseas,57,58,57,57,56,35,26,22,5.02,0.18,5.8,15.33,20.99,2.48,9.06,6.26,,,,,,,,
Baroda BNP Paribas Multi Cap Fund-Reg(G),500,Baroda BNP Paribas Mutual Fund,2.88,7.88,28.71,47.02,Nifty500 Multicap 50:25:25 - TRI,24.34,21.58,16.46,12.06,3,4,4,4,12,6,6,8,Baroda BNP Paribas Multi Cap Fund-Reg(G),Equity : Multi Cap,37,38,38,37,33,22,16,13,7.75,1.43,5.08,21.89,41.65,20.4,20.0,16.93,,,,,,,,
ICICI Pru Bharat Consumption Fund(G),41946,ICICI Prudential Mutual Fund,0.98,4.56,18.4,39.73,Nifty India Consumption - TRI,23.41,18.27,,6.52,9,16,14,7,2,3,8,,ICICI Pru Bharat Consumption Fund(G),Equity : Thematic - Consumption,16,17,17,15,13,13,13,8,6.51,2.08,6.18,17.54,35.26,20.83,18.23,16.6,,,,,,,,
Kotak Nifty 50 ETF,8469,Kotak Mahindra Mutual Fund,-0.32,2.47,15.83,25.42,NIFTY 50 - TRI,16.23,15.2,14.03,2.83,89,98,88,79,90,45,40,12,Kotak Nifty 50 ETF,Equity : ETFs,141,149,145,141,129,75,56,23,7.09,0.64,4.21,21.92,38.26,18.91,16.79,13.97,,,,,,,,
Kotak Pioneer Fund-Reg(G),43927,Kotak Mahindra Mutual Fund,-0.02,6.97,22.91,43.61,NIFTY 500 - TRI,18.36,,,10.47,25,51,18,25,20,15,,,Kotak Pioneer Fund-Reg(G),Equity : Thematic,56,60,56,53,44,31,14,8,10.29,1.48,5.39,25.63,44.4,21.66,21.48,16.51,,,,,,,,
HDFC Defence Fund-Reg(G),46585,HDFC Mutual Fund,5.86,17.03,52.13,,Nifty India Defence - TRI,,,,21.14,4,1,1,3,,,,,HDFC Defence Fund-Reg(G),Equity : Thematic,56,60,56,53,44,31,14,8,10.29,1.48,5.39,25.63,44.4,21.66,21.48,16.51,,,,,,,,
Aditya Birla SL Nifty 50 ETF,12811,Aditya Birla Sun Life Mutual Fund,-0.32,2.45,15.81,25.54,NIFTY 50 - TRI,16.35,15.33,14.04,3.44,84,103,97,87,81,34,30,11,Aditya Birla SL Nifty 50 ETF,Equity : ETFs,141,149,145,141,129,75,56,23,7.09,0.64,4.21,21.92,38.26,18.91,16.79,13.97,,,,,,,,
Nippon India ETF Nifty IT,44506,Nippon India Mutual Fund,-5.77,-13.19,7.44,21.65,NIFTY IT - TRI,9.88,,,-5.42,136,144,141,133,106,72,,,Nippon India ETF Nifty IT,Equity : ETFs,141,149,145,141,129,75,56,23,7.09,0.64,4.21,21.92,38.26,18.91,16.79,13.97,,,,,,,,
Mirae Asset Healthcare Fund-Reg(G),39122,Mirae Asset Mutual Fund,0.54,3.12,23.93,49.65,S&P BSE Health Care - TRI,14.62,24.4,,11.05,7,6,9,11,9,6,3,,Mirae Asset Healthcare Fund-Reg(G),Equity : Sectoral - Pharma,14,16,16,13,11,9,8,3,11.1,0.36,3.22,26.18,52.13,14.92,23.36,15.35,-1.32,0.93,23.8,52.62,14.13,20.94,15.3,31.36
