Bank of India Bluechip Fund-Reg(G),45571,Bank of India Mutual Fund,-0.26,5.17,26.24,44.0,NIFTY 100 - TRI,,,,8.2,11,32,14,6,6,,,,Bank of India Bluechip Fund-Reg(G),Equity : Large Cap,36,37,37,36,36,33,31,28,7.12,0.5,5.02,20.96,34.49,17.39,15.88,14.73,,,,,,,,
Union Gilt Fund-Reg(G),46221,Union Mutual Fund,0.49,1.19,4.57,6.02,CRISIL Dynamic Gilt Index,,,,2.62,24,16,27,17,29,,,,Union Gilt Fund-Reg(G),Debt : Gilt,35,35,35,35,35,23,21,21,2.79,0.48,1.34,4.57,6.42,4.8,6.79,7.85,,,,,,,,
LIC MF Focused 30 Equity Fund-Reg(G),32627,LIC Mutual Fund,-0.84,3.86,12.91,21.46,NIFTY 500 - TRI,15.17,13.96,,3.5,33,35,31,36,36,26,28,,LIC MF Focused 30 Equity Fund-Reg(G),Equity : Large Cap,36,37,37,36,36,33,31,28,7.12,0.5,5.02,20.96,34.49,17.39,15.88,14.73,,,,,,,,
ICICI Pru Nifty FMCG ETF,45651,ICICI Prudential Mutual Fund,1.35,0.58,5.5,14.5,NIFTY FMCG - TRI,,,,-3.64,132,47,131,139,123,,,,ICICI Pru Nifty FMCG ETF,Equity : ETFs,141,149,145,141,129,75,56,23,7.09,0.64,4.21,21.92,38.26,18.91,16.79,13.97,,,,,,,,
Groww Nifty Total Market Index Fund-Reg(G),48247,Groww Mutual Fund,0.62,3.77,20.71,,Nifty Total Market - TRI,,,,5.87,59,66,50,57,,,,,Groww Nifty Total Market Index Fund-Reg(G),Equity : Index Funds,106,116,109,103,91,40,23,18,8.37,1.17,4.67,24.73,43.76,18.72,15.56,13.54,,,,,,,,
Aditya Birla SL Nifty Smallcap 50 Index Fund-Reg(G),44737,Aditya Birla Sun Life Mutual Fund,3.06,1.17,26.08,71.64,Nifty Smallcap 50 - TRI,20.74,,,8.01,46,30,102,30,4,14,,,Aditya Birla SL Nifty Smallcap 50 Index Fund-Reg(G),Equity : Index Funds,106,116,109,103,91,40,23,18,8.37,1.17,4.67,24.73,43.76,18.72,15.56,13.54,,,,,,,,
JM Short Duration Fund-Reg(G),46751,JM Financial Mutual Fund,0.45,1.44,3.26,5.78,CRISIL Short Duration Debt Index,,,,2.17,22,18,23,24,24,,,,JM Short Duration Fund-Reg(G),Debt : Short Duration,26,27,26,26,26,22,21,19,2.33,0.46,1.56,3.52,6.32,5.42,5.88,6.87,,,,,,,,
Aditya Birla SL CRISIL IBX SDL Jun 2032 Index Fund-Reg(G),47592,Aditya Birla Sun Life Mutual Fund,0.47,1.99,4.93,6.82,CRISIL IBX SDL Index - June 2032,,,,3.46,14,9,4,16,4,,,,Aditya Birla SL CRISIL IBX SDL Jun 2032 Index Fund-Reg(G),Debt : Long Duration,21,24,21,20,19,3,3,2,3.48,0.43,1.48,5.28,6.51,4.34,6.8,7.54,,,,,,,,
LIC MF Gold ETF,15131,LIC Mutual Fund,1.32,14.07,15.96,15.41,Gold-India,14.17,17.11,9.0,12.8,12,23,19,9,7,1,3,1,LIC MF Gold ETF,Gold : ETFs,25,28,27,22,21,11,11,11,12.13,2.11,14.59,14.32,11.14,13.79,16.93,8.64,,,,,,,,
HDFC NIFTY 100 Equal Weight Index Fund-Reg(G),45997,HDFC Mutual Fund,1.02,7.74,30.45,47.26,Nifty100 Equal Weight - TRI,,,,12.29,27,56,25,27,41,,,,HDFC NIFTY 100 Equal Weight Index Fund-Reg(G),Equity : Index Funds,106,116,109,103,91,40,23,18,8.37,1.17,4.67,24.73,43.76,18.72,15.56,13.54,,,,,,,,
HSBC Global Equity Climate Change FoF-Reg(G),45333,HSBC Mutual Fund,-0.6,3.95,14.11,7.2,MSCI AC World Index,-1.06,,,0.52,46,35,34,32,41,25,,,HSBC Global Equity Climate Change FoF-Reg(G),FoFs : Overseas,57,58,57,57,56,35,26,22,5.02,0.18,5.8,15.33,20.99,2.48,9.06,6.26,,,,,,,,
Shriram Multi Asset Allocation Fund-Reg(G),48029,Shriram Mutual Fund,1.08,3.85,21.19,,NIFTY 50 - TRI,,,,6.74,9,8,17,3,,,,,Shriram Multi Asset Allocation Fund-Reg(G),Hybrid : Multi Asset Allocation,17,24,20,17,12,10,7,7,7.33,0.96,4.96,16.48,28.55,16.6,17.35,13.07,,,,,,,,
SBI FMP-52-1848D-Reg(G),45915,SBI Mutual Fund,0.57,1.79,4.17,6.77,CRISIL Medium to Long Term Debt Index,,,,2.7,20,55,32,24,32,,,,SBI FMP-52-1848D-Reg(G),Debt : FTP/FMP,103,110,102,94,92,21,16,12,2.44,0.55,1.74,3.98,6.78,5.49,5.6,6.18,,,,,,,,
ICICI Pru Retirement Fund-Pure Debt Plan(G),25670,ICICI Prudential Mutual Fund,0.63,1.94,3.46,6.24,NIFTY Composite Debt Index,4.51,6.4,,2.45,35,26,34,38,37,36,27,,ICICI Pru Retirement Fund-Pure Debt Plan(G),Hybrid : Solution Oriented,40,40,40,39,38,37,29,13,4.96,0.94,3.5,13.69,25.33,13.65,12.29,12.53,,,,,,,,
Mirae Asset Nifty Smallcap 250 Momentum Quality 100 ETF,48496,Mirae Asset Mutual Fund,1.81,,,,Nifty Smallcap250 Momentum Quality 100 - TRI,,,,,,41,,,,,,,Mirae Asset Nifty Smallcap 250 Momentum Quality 100 ETF,Equity : ETFs,141,149,145,141,129,75,56,23,7.09,0.64,4.21,21.92,38.26,18.91,16.79,13.97,,,,,,,,
Baroda BNP Paribas Banking and Fin Serv Fund-Reg(G),16955,Baroda BNP Paribas Mutual Fund,1.36,4.29,18.45,28.86,Nifty Financial Services - TRI,14.94,11.88,13.52,2.02,15,5,12,5,5,11,8,7,Baroda BNP Paribas Banking and Fin Serv Fund-Reg(G),Equity : Sectoral - Financial Services,18,20,20,17,15,12,11,8,4.05,1.01,4.51,16.09,27.69,16.82,13.2,15.21,,,,,,,,
Nippon India ETF Nifty 50 Value 20,31920,Nippon India Mutual Fund,1.37,1.42,21.73,34.58,Nifty50 Value 20 - TRI,20.14,19.2,,6.9,61,45,122,58,62,24,16,,Nippon India ETF Nifty 50 Value 20,Equity : ETFs,141,149,145,141,129,75,56,23,7.09,0.64,4.21,21.92,38.26,18.91,16.79,13.97,,,,,,,,
Kotak FMP-329-90D(G),48720,Kotak Mahindra Mutual Fund,0.61,,,,Nifty Liquid Fund Index,,,,,,20,,,,,,,Kotak FMP-329-90D(G),Debt : FTP/FMP,103,110,102,94,92,21,16,12,2.44,0.55,1.74,3.98,6.78,5.49,5.6,6.18,,,,,,,,
Baroda BNP Paribas NIFTY SDL Dec 2026 Index Fund-Reg(G),47387,Baroda BNP Paribas Mutual Fund,0.59,1.78,4.12,6.47,NIFTY SDL December 2026 Index,,,,2.72,5,4,5,28,32,,,,Baroda BNP Paribas NIFTY SDL Dec 2026 Index Fund-Reg(G),Debt : Medium to Long Duration,52,52,52,52,52,11,11,11,2.55,0.48,1.53,4.16,6.38,4.93,5.95,6.78,,,,,,,,
ICICI Pru Nifty Infrastructure ETF,45998,ICICI Prudential Mutual Fund,0.96,5.73,35.14,56.81,Nifty Infrastructure - TRI,,,,15.66,23,55,51,23,27,,,,ICICI Pru Nifty Infrastructure ETF,Equity : ETFs,141,149,145,141,129,75,56,23,7.09,0.64,4.21,21.92,38.26,18.91,16.79,13.97,,,,,,,,
ICICI Pru FMP-88-1226D-F(G),47232,ICICI Prudential Mutual Fund,0.56,1.79,4.01,6.62,CRISIL Medium Duration Debt Index,,,,2.55,56,59,33,48,70,,,,ICICI Pru FMP-88-1226D-F(G),Debt : FTP/FMP,103,110,102,94,92,21,16,12,2.44,0.55,1.74,3.98,6.78,5.49,5.6,6.18,,,,,,,,
SBI Nifty IT ETF,45110,SBI Mutual Fund,-5.78,-13.2,7.44,21.62,NIFTY IT - TRI,9.88,,,-5.42,135,148,143,134,107,73,,,SBI Nifty IT ETF,Equity : ETFs,141,149,145,141,129,75,56,23,7.09,0.64,4.21,21.92,38.26,18.91,16.79,13.97,,,,,,,,
Canara Rob Income Fund-Reg(G),542,Canara Robeco Mutual Fund,0.44,1.14,3.98,4.82,CRISIL Medium to Long Term Debt Index,3.7,5.82,6.87,2.33,48,32,51,46,52,10,7,6,Canara Rob Income Fund-Reg(G),Debt : Medium to Long Duration,52,52,52,52,52,11,11,11,2.55,0.48,1.53,4.16,6.38,4.93,5.95,6.78,,,,,,,,
ICICI Pru Global Stable Equity Fund(FOF)(G),16718,ICICI Prudential Mutual Fund,-1.55,-0.41,6.93,6.5,MSCI World,6.25,10.04,8.68,-0.54,48,46,54,47,43,14,12,6,ICICI Pru Global Stable Equity Fund(FOF)(G),FoFs : Overseas,57,58,57,57,56,35,26,22,5.02,0.18,5.8,15.33,20.99,2.48,9.06,6.26,,,,,,,,
Invesco India Banking and PSU Fund(G),17249,Invesco Mutual Fund,0.38,1.69,4.09,6.63,NIFTY Banking and PSU Debt Index,4.22,5.87,6.43,2.83,2,20,8,1,11,22,16,15,Invesco India Banking and PSU Fund(G),Debt : Banking & PSU,27,27,27,26,26,22,16,15,2.59,0.42,1.65,3.71,6.49,5.03,6.7,7.23,,,,,,,,
Bank of India Balanced Advantage Fund-Reg(G),21917,Bank of India Mutual Fund,-0.36,2.81,16.69,24.35,NIFTY 50 Hybrid Composite Debt 50:50 Index,14.76,9.43,8.74,5.2,13,29,22,5,13,2,16,10,Bank of India Balanced Advantage Fund-Reg(G),Hybrid : Dynamic Asset Allocation,30,32,30,28,26,20,17,10,5.2,0.54,3.04,14.26,24.92,12.48,11.93,11.5,,,,,,,,
SBI FMP-46-1850D-Reg(G),45620,SBI Mutual Fund,0.59,1.75,4.08,6.63,CRISIL Medium to Long Term Debt Index,,,,2.64,33,34,50,36,68,,,,SBI FMP-46-1850D-Reg(G),Debt : FTP/FMP,103,110,102,94,92,21,16,12,2.44,0.55,1.74,3.98,6.78,5.49,5.6,6.18,,,,,,,,
Navi Nifty Midcap 150 Index Fund-Reg(G),45861,Navi Mutual Fund,1.79,3.84,25.28,54.71,Nifty Midcap 150 - TRI,,,,7.79,50,48,49,44,37,,,,Navi Nifty Midcap 150 Index Fund-Reg(G),Equity : Index Funds,106,116,109,103,91,40,23,18,8.37,1.17,4.67,24.73,43.76,18.72,15.56,13.54,,,,,,,,
Groww Largecap Fund-Reg(G),15997,Groww Mutual Fund,-0.18,5.4,21.62,33.07,NIFTY 100 - TRI,16.42,13.34,12.99,6.5,19,30,11,16,21,21,30,26,Groww Largecap Fund-Reg(G),Equity : Large Cap,36,37,37,36,36,33,31,28,7.12,0.5,5.02,20.96,34.49,17.39,15.88,14.73,,,,,,,,
Sundaram Global Brand Fund(G),3005,Sundaram Mutual Fund,-2.07,2.6,13.82,20.0,MSCI AC World Index,7.01,11.71,7.25,4.91,35,51,43,33,28,13,11,8,Sundaram Global Brand Fund(G),FoFs : Overseas,57,58,57,57,56,35,26,22,5.02,0.18,5.8,15.33,20.99,2.48,9.06,6.26,,,,,,,,
Union Retirement Fund-Reg(G),45735,Union Mutual Fund,1.38,4.27,19.57,39.72,S&P BSE 500 - TRI,,,,6.03,11,9,11,7,6,,,,Union Retirement Fund-Reg(G),Hybrid : Solution Oriented,40,40,40,39,38,37,29,13,4.96,0.94,3.5,13.69,25.33,13.65,12.29,12.53,-0.39,2.72,20.16,35.79,19.15,18.32,12.44,17.47
ICICI Pru Nifty50 Value 20 ETF,33839,ICICI Prudential Mutual Fund,1.38,1.45,21.81,34.72,Nifty50 Value 20 - TRI,20.36,19.14,,7.47,56,44,121,57,61,23,17,,ICICI Pru Nifty50 Value 20 ETF,Equity : ETFs,141,149,145,141,129,75,56,23,7.09,0.64,4.21,21.92,38.26,18.91,16.79,13.97,,,,,,,,
PGIM India Gilt Fund(G),7012,PGIM India Mutual Fund,0.46,0.95,4.57,6.36,CRISIL Dynamic Gilt Index,4.51,6.3,7.44,2.76,17,21,33,18,20,19,15,14,PGIM India Gilt Fund(G),Debt : Gilt,35,35,35,35,35,23,21,21,2.79,0.48,1.34,4.57,6.42,4.8,6.79,7.85,,,,,,,,
Aditya Birla SL Nifty IT ETF,45697,Aditya Birla Sun Life Mutual Fund,-5.78,-13.32,7.31,21.49,NIFTY IT - TRI,,,,-6.4,141,149,145,138,110,,,,Aditya Birla SL Nifty IT ETF,Equity : ETFs,141,149,145,141,129,75,56,23,7.09,0.64,4.21,21.92,38.26,18.91,16.79,13.97,,,,,,,,
Mirae Asset Nifty India Manufacturing ETF,45869,Mirae Asset Mutual Fund,4.11,12.69,34.91,54.95,Nifty India Manufacturing - TRI,,,,17.91,20,9,12,24,35,,,,Mirae Asset Nifty India Manufacturing ETF,Equity : ETFs,141,149,145,141,129,75,56,23,7.09,0.64,4.21,21.92,38.26,18.91,16.79,13.97,,,,,,,,
Bandhan All Seasons Bond Fund-Reg(G),2850,Bandhan Mutual Fund,0.44,1.6,3.73,6.42,NIFTY Medium Duration Debt Index,4.87,6.7,7.26,2.41,50,43,47,50,46,37,23,20,Bandhan All Seasons Bond Fund-Reg(G),FoFs : Domestic,53,56,55,53,53,37,25,22,6.61,1.05,5.21,14.51,23.13,14.17,12.92,11.36,,,,,,,,
Aditya Birla SL Long Duration Fund-Reg(G),46711,Aditya Birla Sun Life Mutual Fund,0.39,1.26,5.36,6.47,NIFTY Long Duration Debt Index,,,,3.74,6,20,15,8,13,,,,Aditya Birla SL Long Duration Fund-Reg(G),Debt : Long Duration,21,24,21,20,19,3,3,2,3.48,0.43,1.48,5.28,6.51,4.34,6.8,7.54,,,,,,,,
Nippon India Strategic Debt Fund(G),21911,Nippon India Mutual Fund,0.55,1.65,3.87,5.99,CRISIL Medium Duration Debt Index,9.2,-0.29,,2.6,11,6,13,12,28,2,13,,Nippon India Strategic Debt Fund(G),Debt : Medium Duration,30,30,30,30,30,14,13,10,2.53,0.48,1.59,3.86,6.41,5.8,5.59,7.21,,,,,,,,
Kotak FMP-310-1131D(G),47871,Kotak Mahindra Mutual Fund,0.56,1.74,3.96,6.57,NIFTY Medium Duration Debt Index,,,,2.39,80,62,59,56,75,,,,Kotak FMP-310-1131D(G),Debt : FTP/FMP,103,110,102,94,92,21,16,12,2.44,0.55,1.74,3.98,6.78,5.49,5.6,6.18,,,,,,,,
Nippon India FMP-XLVI-1(G),48149,Nippon India Mutual Fund,0.54,1.92,,,NIFTY Ultra Short Duration Debt Index,,,,1.67,94,82,6,,,,,,Nippon India FMP-XLVI-1(G),Debt : FTP/FMP,103,110,102,94,92,21,16,12,2.44,0.55,1.74,3.98,6.78,5.49,5.6,6.18,,,,,,,,
Axis S&P BSE Sensex ETF,47768,Axis Mutual Fund,-0.49,2.42,13.85,22.37,S&P BSE SENSEX - TRI,,,,1.88,111,122,112,108,101,,,,Axis S&P BSE Sensex ETF,Equity : ETFs,141,149,145,141,129,75,56,23,7.09,0.64,4.21,21.92,38.26,18.91,16.79,13.97,-0.97,2.02,13.42,21.98,15.69,15.28,12.12,5.43
Kotak Nifty SDL Jul 2026 Index Fund-Reg(G),46729,Kotak Mahindra Mutual Fund,0.62,1.72,4.04,6.65,Nifty SDL Jul 2026 Index,,,,2.67,15,3,13,41,12,,,,Kotak Nifty SDL Jul 2026 Index Fund-Reg(G),Debt : Medium to Long Duration,52,52,52,52,52,11,11,11,2.55,0.48,1.53,4.16,6.38,4.93,5.95,6.78,,,,,,,,
Bandhan Nifty 100 Index Fund-Reg(G),46119,Bandhan Mutual Fund,0.19,4.43,19.96,30.39,NIFTY 100 - TRI,,,,6.24,56,70,38,62,60,,,,Bandhan Nifty 100 Index Fund-Reg(G),Equity : Index Funds,106,116,109,103,91,40,23,18,8.37,1.17,4.67,24.73,43.76,18.72,15.56,13.54,,,,,,,,
DSP FMP 268-1281D-Reg(G),47124,DSP Mutual Fund,0.65,1.69,4.02,6.86,CRISIL Medium Duration Debt Index,,,,2.67,25,5,79,47,20,,,,DSP FMP 268-1281D-Reg(G),Debt : FTP/FMP,103,110,102,94,92,21,16,12,2.44,0.55,1.74,3.98,6.78,5.49,5.6,6.18,,,,,,,,
Union Equity Savings Fund-Reg(G),40627,Union Mutual Fund,0.26,1.9,8.04,14.13,Crisil Equity Savings Index,7.86,8.34,,2.98,46,45,47,46,47,48,43,,Union Equity Savings Fund-Reg(G),Hybrid : Equity Oriented,56,56,56,56,55,53,48,24,5.04,0.76,3.47,12.75,22.61,12.6,12.43,12.22,,,,,,,,
Bandhan Regular Savings Fund-Reg(G),8465,Bandhan Mutual Fund,0.64,2.09,6.38,9.93,NIFTY AAA Short Duration Bond Index,5.73,6.43,7.67,2.55,16,8,10,13,14,17,16,15,Bandhan Regular Savings Fund-Reg(G),Hybrid : Debt Oriented (Conservative),19,19,19,19,19,18,18,18,3.33,0.55,2.08,7.2,12.1,8.52,8.18,8.49,,,,,,,,
SBI FMP-78-1170D-Reg(G),47638,SBI Mutual Fund,0.55,1.7,3.9,6.64,CRISIL Medium Duration Debt Index,,,,2.56,55,72,78,62,66,,,,SBI FMP-78-1170D-Reg(G),Debt : FTP/FMP,103,110,102,94,92,21,16,12,2.44,0.55,1.74,3.98,6.78,5.49,5.6,6.18,,,,,,,,
Taurus Mid Cap Fund-Reg(G),3306,Taurus Mutual Fund,2.11,3.6,21.99,52.7,Nifty Midcap 150 - TRI,23.0,22.76,20.05,7.29,24,19,28,22,13,19,13,10,Taurus Mid Cap Fund-Reg(G),Equity : Mid Cap,30,30,30,30,30,25,22,20,9.74,2.57,6.49,24.79,51.08,24.51,23.44,20.13,,,,,,,,
PGIM India Arbitrage Fund-Reg(G),28514,PGIM India Mutual Fund,0.45,1.69,3.46,6.99,Nifty 50 Arbitrage,5.14,4.85,,2.6,23,2,23,22,22,19,17,,PGIM India Arbitrage Fund-Reg(G),Hybrid : Arbitrage,26,26,26,26,24,24,21,10,2.78,0.41,1.77,3.63,7.38,5.32,5.02,5.87,0.35,1.69,3.77,8.15,5.8,5.08,,7.7
Edelweiss Emerging Markets Opp Eq. Offshore Fund-Reg(G),20281,Edelweiss Mutual Fund,1.6,6.3,10.43,11.38,MSCI Emerging Market Index,-5.83,3.43,,4.66,37,10,18,45,38,30,22,,Edelweiss Emerging Markets Opp Eq. Offshore Fund-Reg(G),FoFs : Overseas,57,58,57,57,56,35,26,22,5.02,0.18,5.8,15.33,20.99,2.48,9.06,6.26,,,,,,,,
Kotak FMP-326-175D(G),48420,Kotak Mahindra Mutual Fund,0.64,2.04,,,NIFTY Ultra Short Duration Debt Index,,,,2.79,8,7,2,,,,,,Kotak FMP-326-175D(G),Debt : FTP/FMP,103,110,102,94,92,21,16,12,2.44,0.55,1.74,3.98,6.78,5.49,5.6,6.18,,,,,,,,
DSP Nifty Private Bank ETF,47907,DSP Mutual Fund,0.69,4.65,7.53,,Nifty Private Bank - TRI,,,,-3.39,129,70,56,127,,,,,DSP Nifty Private Bank ETF,Equity : ETFs,141,149,145,141,129,75,56,23,7.09,0.64,4.21,21.92,38.26,18.91,16.79,13.97,,,,,,,,
Kotak Nifty 200 Momentum 30 Index Fund-Reg(G),47977,Kotak Mahindra Mutual Fund,3.68,10.66,41.14,,Nifty200 Momentum 30 - TRI,,,,16.57,22,9,19,21,,,,,Kotak Nifty 200 Momentum 30 Index Fund-Reg(G),Equity : Index Funds,106,116,109,103,91,40,23,18,8.37,1.17,4.67,24.73,43.76,18.72,15.56,13.54,,,,,,,,
Sundaram Money Market Fund-Reg(G),39625,Sundaram Mutual Fund,0.54,1.89,3.68,7.25,Nifty Money Market Index,5.51,5.59,,2.68,12,16,15,13,12,10,10,,Sundaram Money Market Fund-Reg(G),Debt : Money Market,22,22,22,22,21,17,14,13,2.67,0.55,1.92,3.66,7.26,5.54,5.78,6.7,,,,,,,,
Bandhan CRISIL IBX 90:10 SDL Plus Gilt - Nov 2026 Index Fund-Reg(G),46213,Bandhan Mutual Fund,0.57,1.75,4.07,6.55,CRISIL IBX 90:10 SDL Plus Gilt Index - November 2026,,,,2.64,19,7,10,38,23,,,,Bandhan CRISIL IBX 90:10 SDL Plus Gilt - Nov 2026 Index Fund-Reg(G),Debt : Medium to Long Duration,52,52,52,52,52,11,11,11,2.55,0.48,1.53,4.16,6.38,4.93,5.95,6.78,,,,,,,,
Quantum Equity FoF-Reg(G),19904,Quantum Mutual Fund,1.23,5.9,19.93,34.3,S&P BSE 200 - TRI,17.36,15.78,15.37,7.97,14,21,14,10,12,11,7,3,Quantum Equity FoF-Reg(G),FoFs : Domestic,53,56,55,53,53,37,25,22,6.61,1.05,5.21,14.51,23.13,14.17,12.92,11.36,-0.5,3.14,20.05,33.79,18.39,17.75,12.47,17.2
PGIM India Dynamic Bond Fund(G),15247,PGIM India Mutual Fund,0.64,1.2,4.45,6.25,CRISIL Dynamic Bond Index,4.44,6.15,7.54,2.91,6,1,15,8,14,17,13,7,PGIM India Dynamic Bond Fund(G),Debt : Dynamic Bond,22,22,22,22,22,21,21,18,2.77,0.4,1.32,4.3,6.33,5.19,6.44,7.32,,,,,,,,
LIC MF Short Duration Fund-Reg(G),34304,LIC Mutual Fund,0.43,1.53,3.53,6.07,CRISIL Short Duration Debt Index,4.12,5.44,,2.41,15,23,20,20,21,21,16,,LIC MF Short Duration Fund-Reg(G),Debt : Short Duration,26,27,26,26,26,22,21,19,2.33,0.46,1.56,3.52,6.32,5.42,5.88,6.87,,,,,,,,
Edelweiss NIFTY Large Mid Cap 250 Index Fund-Reg(G),45864,Edelweiss Mutual Fund,1.02,4.12,22.56,42.21,NIFTY LargeMidcap 250 - TRI,,,,6.56,53,57,39,49,44,,,,Edelweiss NIFTY Large Mid Cap 250 Index Fund-Reg(G),Equity : Index Funds,106,116,109,103,91,40,23,18,8.37,1.17,4.67,24.73,43.76,18.72,15.56,13.54,,,,,,,,
SBI FMP-50-1843D-Reg(G),45842,SBI Mutual Fund,0.58,1.79,4.15,6.65,CRISIL Medium to Long Term Debt Index,,,,2.62,38,42,28,28,63,,,,SBI FMP-50-1843D-Reg(G),Debt : FTP/FMP,103,110,102,94,92,21,16,12,2.44,0.55,1.74,3.98,6.78,5.49,5.6,6.18,,,,,,,,
Mirae Asset Nifty 100 ESG Sector Leaders FoF-Reg(G),45135,Mirae Asset Mutual Fund,-0.54,3.22,17.07,27.76,Nifty100 ESG Sector Leaders - TRI,13.6,,,4.7,37,55,34,19,19,21,,,Mirae Asset Nifty 100 ESG Sector Leaders FoF-Reg(G),FoFs : Domestic,53,56,55,53,53,37,25,22,6.61,1.05,5.21,14.51,23.13,14.17,12.92,11.36,,,,,,,,
HDFC NIFTY Midcap 150 Index Fund-Reg(G),46619,HDFC Mutual Fund,1.8,3.95,25.38,54.62,Nifty Midcap 150 - TRI,,,,9.96,37,47,45,43,38,,,,HDFC NIFTY Midcap 150 Index Fund-Reg(G),Equity : Index Funds,106,116,109,103,91,40,23,18,8.37,1.17,4.67,24.73,43.76,18.72,15.56,13.54,,,,,,,,
Kotak Nifty IT ETF,45377,Kotak Mahindra Mutual Fund,-5.76,-13.16,7.51,21.77,NIFTY IT - TRI,10.02,,,-5.4,133,141,138,130,104,69,,,Kotak Nifty IT ETF,Equity : ETFs,141,149,145,141,129,75,56,23,7.09,0.64,4.21,21.92,38.26,18.91,16.79,13.97,,,,,,,,
Union Dynamic Bond(G),16032,Union Mutual Fund,0.36,1.06,4.31,5.55,CRISIL Dynamic Bond Index,3.84,6.02,6.42,2.56,16,15,18,11,20,20,15,18,Union Dynamic Bond(G),Debt : Dynamic Bond,22,22,22,22,22,21,21,18,2.77,0.4,1.32,4.3,6.33,5.19,6.44,7.32,,,,,,,,
Bajaj Finserv Banking and PSU Fund-Reg(G),48214,Bajaj Finserv Mutual Fund,0.32,1.49,,,NIFTY Banking and PSU Debt Index,,,,2.54,17,24,25,,,,,,Bajaj Finserv Banking and PSU Fund-Reg(G),Debt : Banking & PSU,27,27,27,26,26,22,16,15,2.59,0.42,1.65,3.71,6.49,5.03,6.7,7.23,,,,,,,,
SBI FMP-92-91D-Reg(G),48470,SBI Mutual Fund,0.58,1.92,,,CRISIL Liquid Debt Index,,,,,,38,5,,,,,,SBI FMP-92-91D-Reg(G),Debt : FTP/FMP,103,110,102,94,92,21,16,12,2.44,0.55,1.74,3.98,6.78,5.49,5.6,6.18,,,,,,,,
SBI FMP-43-1616D-Reg(G),45525,SBI Mutual Fund,0.5,1.75,3.77,6.8,CRISIL Medium Duration Debt Index,5.33,,,2.6,50,97,48,73,27,13,,,SBI FMP-43-1616D-Reg(G),Debt : FTP/FMP,103,110,102,94,92,21,16,12,2.44,0.55,1.74,3.98,6.78,5.49,5.6,6.18,,,,,,,,
Tata Nifty G-Sec Dec 2026 Index Fund-Reg(G),47436,Tata Mutual Fund,0.48,1.5,3.87,6.31,Nifty G-sec Dec 2026 Index,,,,2.3,28,20,23,14,23,,,,Tata Nifty G-Sec Dec 2026 Index Fund-Reg(G),Debt : Medium Duration,30,30,30,30,30,14,13,10,2.53,0.48,1.59,3.86,6.41,5.8,5.59,7.21,,,,,,,,
LIC MF Long Term Value Fund-Reg(G),39956,LIC Mutual Fund,-0.48,2.0,18.66,34.61,NIFTY 500 - TRI,17.4,16.19,,5.34,20,22,21,22,21,17,15,,LIC MF Long Term Value Fund-Reg(G),Equity : Value / Contra,22,22,22,22,21,18,17,14,9.32,1.31,4.22,26.07,47.39,23.39,19.95,17.89,,,,,,,,
HSBC Nifty Next 50 Index Fund-Reg(G),33548,HSBC Mutual Fund,3.48,14.87,43.22,61.41,NIFTY NEXT 50 - TRI,21.77,,,19.63,11,24,9,9,23,12,,,HSBC Nifty Next 50 Index Fund-Reg(G),Equity : Index Funds,106,116,109,103,91,40,23,18,8.37,1.17,4.67,24.73,43.76,18.72,15.56,13.54,,,,,,,,
SBI Magnum Childrens Benefit Fund-Savings Plan,2748,SBI Mutual Fund,0.59,2.18,8.18,17.49,NIFTY 50 Hybrid Composite Debt 15:85 Index,12.55,11.48,12.57,3.88,23,27,31,31,27,21,16,7,SBI Magnum Childrens Benefit Fund-Savings Plan,Hybrid : Solution Oriented,40,40,40,39,38,37,29,13,4.96,0.94,3.5,13.69,25.33,13.65,12.29,12.53,,,,,,,,
Nippon India Nifty G-Sec Oct 2028 Maturity Index Fund-Reg(G),47629,Nippon India Mutual Fund,0.48,1.42,4.06,6.29,Nifty G-Sec Oct 2028 Index,,,,2.3,49,25,34,39,39,,,,Nippon India Nifty G-Sec Oct 2028 Maturity Index Fund-Reg(G),Debt : Medium to Long Duration,52,52,52,52,52,11,11,11,2.55,0.48,1.53,4.16,6.38,4.93,5.95,6.78,,,,,,,,
Canara Rob Dynamic Bond Fund-Reg(G),7792,Canara Robeco Mutual Fund,0.27,0.87,4.3,5.26,CRISIL Dynamic Bond Index,4.13,5.68,6.86,2.59,14,19,20,12,22,19,19,15,Canara Rob Dynamic Bond Fund-Reg(G),Debt : Dynamic Bond,22,22,22,22,22,21,21,18,2.77,0.4,1.32,4.3,6.33,5.19,6.44,7.32,,,,,,,,
HSBC Conservative Hybrid Fund(G),1458,HSBC Mutual Fund,1.08,3.86,9.24,13.99,NIFTY 50 Hybrid Composite Debt 15:85 Index,8.15,8.54,8.23,4.92,2,1,1,4,6,10,8,11,HSBC Conservative Hybrid Fund(G),Hybrid : Debt Oriented (Conservative),19,19,19,19,19,18,18,18,3.33,0.55,2.08,7.2,12.1,8.52,8.18,8.49,,,,,,,,
WOC Pharma and Healthcare Fund-Reg(G),48472,WhiteOak Capital Mutual Fund,1.7,2.49,,,S&P BSE Health Care - TRI,,,,,,2,14,,,,,,WOC Pharma and Healthcare Fund-Reg(G),Equity : Sectoral - Pharma,14,16,16,13,11,9,8,3,11.1,0.36,3.22,26.18,52.13,14.92,23.36,15.35,-1.32,0.93,23.8,52.62,14.13,20.94,15.3,31.36
Aditya Birla SL Silver ETF FOF-Reg(G),46225,Aditya Birla Sun Life Mutual Fund,2.56,14.92,12.19,5.18,Silver,,,,8.76,12,6,5,32,51,,,,Aditya Birla SL Silver ETF FOF-Reg(G),FoFs : Domestic,53,56,55,53,53,37,25,22,6.61,1.05,5.21,14.51,23.13,14.17,12.92,11.36,,,,,,,,
Aditya Birla SL Retirement Fund-40-Reg(G),42770,Aditya Birla Sun Life Mutual Fund,1.11,2.76,13.43,26.83,CRISIL Hybrid 35+65 - Aggressive Index,10.65,10.2,,4.44,18,11,24,20,19,24,20,,Aditya Birla SL Retirement Fund-40-Reg(G),Hybrid : Solution Oriented,40,40,40,39,38,37,29,13,4.96,0.94,3.5,13.69,25.33,13.65,12.29,12.53,,,,,,,,
Canara Rob Gilt Fund-Reg(G),538,Canara Robeco Mutual Fund,0.43,1.11,4.83,6.09,CRISIL Dynamic Gilt Index,4.61,6.42,7.75,2.97,11,29,29,11,28,17,14,12,Canara Rob Gilt Fund-Reg(G),Debt : Gilt,35,35,35,35,35,23,21,21,2.79,0.48,1.34,4.57,6.42,4.8,6.79,7.85,,,,,,,,
PGIM India Emerging Markets Equity Fund(G),815,PGIM India Mutual Fund,0.65,7.34,18.7,28.47,MSCI Emerging Market Index,-8.3,0.82,0.72,8.18,11,20,14,20,19,31,24,21,PGIM India Emerging Markets Equity Fund(G),FoFs : Overseas,57,58,57,57,56,35,26,22,5.02,0.18,5.8,15.33,20.99,2.48,9.06,6.26,,,,,,,,
Union Medium Duration Fund-Reg(G),44157,Union Mutual Fund,0.36,1.43,3.8,5.99,CRISIL Medium Duration Debt Index,4.37,,,2.38,22,28,25,17,27,12,,,Union Medium Duration Fund-Reg(G),Debt : Medium Duration,30,30,30,30,30,14,13,10,2.53,0.48,1.59,3.86,6.41,5.8,5.59,7.21,,,,,,,,
ICICI Pru Nifty Healthcare ETF,45383,ICICI Prudential Mutual Fund,-0.14,3.69,26.67,51.34,Nifty Healthcare Index - TRI,,,,14.07,27,90,77,38,39,,,,ICICI Pru Nifty Healthcare ETF,Equity : ETFs,141,149,145,141,129,75,56,23,7.09,0.64,4.21,21.92,38.26,18.91,16.79,13.97,,,,,,,,
Nippon India ETF Nifty Infrastructure BeES,12859,Nippon India Mutual Fund,0.9,5.56,34.66,55.78,Nifty Infrastructure - TRI,27.3,22.15,12.89,13.73,32,56,53,25,31,6,6,19,Nippon India ETF Nifty Infrastructure BeES,Equity : ETFs,141,149,145,141,129,75,56,23,7.09,0.64,4.21,21.92,38.26,18.91,16.79,13.97,,,,,,,,
Bandhan Equity Savings Fund-Reg(G),5300,Bandhan Mutual Fund,0.23,1.69,5.46,10.81,CRISIL Liquid Debt Index,7.34,7.54,6.64,2.59,51,49,52,52,51,50,46,24,Bandhan Equity Savings Fund-Reg(G),Hybrid : Equity Oriented,56,56,56,56,55,53,48,24,5.04,0.76,3.47,12.75,22.61,12.6,12.43,12.22,,,,,,,,
Nippon India FHF-XLV-4-1111D(G),47822,Nippon India Mutual Fund,0.57,1.77,4.02,6.67,CRISIL Medium Duration Debt Index,,,,2.43,72,52,45,46,56,,,,Nippon India FHF-XLV-4-1111D(G),Debt : FTP/FMP,103,110,102,94,92,21,16,12,2.44,0.55,1.74,3.98,6.78,5.49,5.6,6.18,,,,,,,,
Axis NIFTY IT Index Fund-Reg(G),47983,Axis Mutual Fund,-5.82,-13.24,7.06,,NIFTY IT - TRI,,,,-5.61,104,115,107,102,,,,,Axis NIFTY IT Index Fund-Reg(G),Equity : Index Funds,106,116,109,103,91,40,23,18,8.37,1.17,4.67,24.73,43.76,18.72,15.56,13.54,,,,,,,,
ICICI Pru India Equity (FOF)(G),44626,ICICI Prudential Mutual Fund,1.58,6.29,27.96,48.32,S&P BSE 500 - TRI,25.79,,,12.03,5,15,11,5,5,2,,,ICICI Pru India Equity (FOF)(G),FoFs : Domestic,53,56,55,53,53,37,25,22,6.61,1.05,5.21,14.51,23.13,14.17,12.92,11.36,-0.39,2.72,20.16,35.79,19.15,18.32,12.44,17.47
Invesco India Gold ETF,8505,Invesco Mutual Fund,1.99,14.01,15.84,15.15,Gold-India,13.81,17.1,8.5,13.21,3,20,22,12,11,6,4,9,Invesco India Gold ETF,Gold : ETFs,25,28,27,22,21,11,11,11,12.13,2.11,14.59,14.32,11.14,13.79,16.93,8.64,,,,,,,,
Aditya Birla SL FMP-UR-85D-Reg(G),48407,Aditya Birla Sun Life Mutual Fund,0.56,,,,CRISIL Liquid Debt Index,,,,1.49,97,61,,,,,,,Aditya Birla SL FMP-UR-85D-Reg(G),Debt : FTP/FMP,103,110,102,94,92,21,16,12,2.44,0.55,1.74,3.98,6.78,5.49,5.6,6.18,,,,,,,,
Edelweiss Gold and Silver ETF FoF-Reg(G),46800,Edelweiss Mutual Fund,3.02,14.9,14.09,9.54,Gold-India,,,,10.33,10,4,6,25,37,,,,Edelweiss Gold and Silver ETF FoF-Reg(G),FoFs : Domestic,53,56,55,53,53,37,25,22,6.61,1.05,5.21,14.51,23.13,14.17,12.92,11.36,,,,,,,,
Nippon India Nifty Bank Index Fund-Reg(G),48148,Nippon India Mutual Fund,0.75,,,,NIFTY BANK - TRI,,,,,,63,,,,,,,Nippon India Nifty Bank Index Fund-Reg(G),Equity : Index Funds,106,116,109,103,91,40,23,18,8.37,1.17,4.67,24.73,43.76,18.72,15.56,13.54,,,,,,,,
Mirae Asset Nifty AAA PSU Bond Plus SDL Apr 2026 50:50 Index Fund-Reg(G),47038,Mirae Asset Mutual Fund,0.54,1.75,3.81,6.65,Nifty AAA Bond Plus SDL Apr 2026 50:50 Index,,,,2.62,8,4,2,5,8,,,,Mirae Asset Nifty AAA PSU Bond Plus SDL Apr 2026 50:50 Index Fund-Reg(G),Debt : Banking & PSU,27,27,27,26,26,22,16,15,2.59,0.42,1.65,3.71,6.49,5.03,6.7,7.23,,,,,,,,
Kotak Nifty Alpha 50 ETF,45687,Kotak Mahindra Mutual Fund,1.36,6.88,37.74,77.19,Nifty Alpha 50 - TRI,,,,15.59,24,46,46,22,3,,,,Kotak Nifty Alpha 50 ETF,Equity : ETFs,141,149,145,141,129,75,56,23,7.09,0.64,4.21,21.92,38.26,18.91,16.79,13.97,,,,,,,,
ICICI Pru S&P BSE 500 ETF FOF-Reg(G),45726,ICICI Prudential Mutual Fund,0.81,3.8,21.41,35.61,S&P BSE 500 - TRI,,,,7.25,18,28,27,8,8,,,,ICICI Pru S&P BSE 500 ETF FOF-Reg(G),FoFs : Domestic,53,56,55,53,53,37,25,22,6.61,1.05,5.21,14.51,23.13,14.17,12.92,11.36,-0.39,2.72,20.16,35.79,19.15,18.32,12.44,17.47
