MF Code,incept_date,schemecode,sdx_returns,sharpex_returns,sotinox_returns,betax_returns,alphax_returns,treynorx_returns,sdy_returns,sharpey_returns,sotinoy_returns,betay_returns,alphay_returns,treynory_returns,rank_sd,rank_sharpe,rank_sotino,rank_beta,rank_alpha,rank_treynor,index_name,s_name,avg_std_dev,avg_sharpe,avg_sotino,avg_beta,avg_alpha,avg_treyno,no_of_funds_total
Motilal Oswal Liquid Fund-Reg(G),2018-12-19,41872,0.15,18.27,22.85,0.0,2.72,3038.16,0.01,1.15,1.44,0.0,0.01,12.06,33,36,8,34,7,26,CRISIL Liquid Debt Index,Motilal Oswal Liquid Fund-Reg(G),0.09,27.49,17.29,0.0,2.24,3051.29,36
Union Innovation & Opp Fund-Reg(G),2023-09-06,45727,,,,,,,,,,,,,,,,,,,NIFTY 500 - TRI,Union Innovation & Opp Fund-Reg(G),14.76,2.4,3.6,0.94,19.76,37.65,46
Parag Parikh Dynamic Asset Allocation Fund-Reg(G),2024-02-27,48512,,,,,,,,,,,,,,,,,,,CRISIL Hybrid 50+50 - Moderate Index,Parag Parikh Dynamic Asset Allocation Fund-Reg(G),8.44,2.29,3.38,0.76,18.16,54.02,26
DSP FMP 267-1246D-Reg(G),2022-11-14,47071,0.92,4.27,8.89,0.09,3.7,44.48,0.06,0.27,0.56,0.09,0.01,0.18,75,48,44,73,38,38,CRISIL Medium Duration Debt Index,DSP FMP 267-1246D-Reg(G),0.74,5.48,11.16,0.06,3.02,-168.93,92
SBI FMP-66-1361D-Reg(G),2022-07-19,46633,0.54,3.21,6.63,0.04,1.66,46.14,0.03,0.2,0.42,0.04,0.01,0.18,25,61,61,26,69,31,CRISIL Medium Duration Debt Index,SBI FMP-66-1361D-Reg(G),0.74,5.48,11.16,0.06,3.02,-168.93,92
Kotak Nifty 50 Index Fund-Reg(G),2021-06-21,45556,12.68,1.54,2.37,0.99,2.77,19.81,0.8,0.1,0.15,0.99,0.01,0.08,30,78,78,39,80,80,NIFTY 50 - TRI,Kotak Nifty 50 Index Fund-Reg(G),15.44,2.13,3.18,1.0,16.85,34.18,94
Tata Nifty 50 ETF,2019-01-01,41017,12.69,1.58,2.43,0.99,4.26,20.19,0.8,0.1,0.15,0.99,0.02,0.08,43,90,92,78,102,101,NIFTY 50 - TRI,Tata Nifty 50 ETF,15.49,1.89,3.02,1.11,15.21,59.48,129
HDFC Nifty G-Sec Jul 2031 Index Fund-Reg(G),2022-11-10,46620,2.28,1.66,2.75,0.26,3.05,14.31,0.14,0.1,0.17,0.26,0.01,0.06,17,26,29,18,27,27,Nifty G-Sec July 2031 Index,HDFC Nifty G-Sec Jul 2031 Index Fund-Reg(G),2.08,2.16,3.88,0.23,3.39,19.08,35
Franklin India Banking & PSU Debt Fund(G),2014-04-25,28458,0.56,7.01,13.52,0.05,3.78,80.49,0.04,0.44,0.85,0.05,0.02,0.32,2,2,3,5,5,5,NIFTY Banking and PSU Debt Index,Franklin India Banking & PSU Debt Fund(G),0.78,5.1,9.4,0.08,3.57,75.15,26
Baroda BNP Paribas Focused Fund-Reg(G),2017-10-06,32452,16.77,1.91,2.64,1.1,13.41,29.13,1.06,0.12,0.17,1.1,0.05,0.12,39,35,37,40,19,27,NIFTY 500 - TRI,Baroda BNP Paribas Focused Fund-Reg(G),13.47,2.22,3.28,0.93,14.46,32.44,41
UTI Innovation Fund-Reg(G),2023-10-13,48238,,,,,,,,,,,,,,,,,,,NIFTY 500 - TRI,UTI Innovation Fund-Reg(G),14.76,2.4,3.6,0.94,19.76,37.65,46
UTI Gilt Fund-Reg(G),2002-01-21,3560,2.34,1.86,3.03,0.26,3.6,16.78,0.15,0.12,0.19,0.26,0.01,0.07,19,16,19,16,10,16,CRISIL Dynamic Gilt Index,UTI Gilt Fund-Reg(G),2.08,2.16,3.88,0.23,3.39,19.08,35
Axis FTP-118-100D-Reg(G),2023-12-05,48251,,,,,,,,,,,,,,,,,,,CRISIL Ultra Short Term Debt Index,Axis FTP-118-100D-Reg(G),0.74,5.48,11.16,0.06,3.02,-168.93,92
Mirae Asset Low Duration Fund-Reg Savings Plan(G),2008-03-05,4609,0.33,12.43,25.02,0.01,4.06,292.75,0.02,0.78,1.58,0.01,0.02,1.16,5,11,8,10,15,11,NIFTY Low Duration Debt Index,Mirae Asset Low Duration Fund-Reg Savings Plan(G),0.34,12.49,24.8,0.01,4.19,338.61,20
360 ONE Flexicap Fund-Reg(G),2023-06-30,47567,,,,,,,,,,,,,,,,,,,BSE 500 - TRI,360 ONE Flexicap Fund-Reg(G),13.47,2.22,3.28,0.93,14.46,32.44,41
DSP Banking & Financial Services Fund-Reg(G),2023-12-08,48350,,,,,,,,,,,,,,,,,,,Nifty Financial Services - TRI,DSP Banking & Financial Services Fund-Reg(G),15.44,1.21,1.78,1.07,0.5,17.41,15
UTI India Consumer Fund-Reg(G),2007-07-30,3581,10.95,2.52,4.67,0.62,16.98,44.1,0.69,0.16,0.29,0.62,0.07,0.18,9,8,3,9,10,9,Nifty India Consumption - TRI,UTI India Consumer Fund-Reg(G),11.14,2.53,4.46,0.62,17.49,45.32,13
Mahindra Manulife Low Duration Fund-Reg(G),2017-02-15,36894,0.33,12.19,24.04,0.02,4.06,272.46,0.02,0.77,1.51,0.02,0.02,1.08,9,14,17,13,14,14,CRISIL Low Duration Debt Index,Mahindra Manulife Low Duration Fund-Reg(G),0.34,12.49,24.8,0.01,4.19,338.61,20
SBI Magnum Comma Fund-Reg(G),2005-08-08,2750,20.17,1.8,2.48,1.16,16.66,31.27,1.27,0.11,0.16,1.16,0.07,0.12,41,44,46,41,23,33,NIFTY COMMODITIES - TRI,SBI Magnum Comma Fund-Reg(G),14.76,2.4,3.6,0.94,19.76,37.65,46
Union Aggressive Hybrid Fund-Reg(G),2020-12-18,44512,10.0,2.03,2.89,0.39,19.18,51.63,0.63,0.13,0.18,0.39,0.08,0.2,45,43,43,36,20,35,CRISIL Hybrid 35+65 - Aggressive Index,Union Aggressive Hybrid Fund-Reg(G),7.34,2.39,3.65,0.32,17.16,61.83,52
Tata Resources & Energy Fund-Reg(G),2015-12-28,33731,19.74,1.79,2.48,1.21,14.84,29.21,1.24,0.11,0.16,1.21,0.06,0.12,3,3,3,3,3,3,NIFTY COMMODITIES - TRI,Tata Resources & Energy Fund-Reg(G),18.88,2.42,3.44,1.17,26.0,41.04,3
ICICI Pru Nifty 10 yr Benchmark G-Sec ETF,2022-12-13,47331,2.72,1.39,2.37,0.34,3.0,11.24,0.17,0.09,0.15,0.34,0.01,0.04,4,2,2,6,2,2,Nifty 10 yr Benchmark G-Sec,ICICI Pru Nifty 10 yr Benchmark G-Sec ETF,2.69,1.38,2.34,0.33,2.81,11.34,6
HDFC NIFTY200 Momentum 30 Index Fund-Reg(G),2024-02-28,48466,,,,,,,,,,,,,,,,,,,Nifty200 Momentum 30 - TRI,HDFC NIFTY200 Momentum 30 Index Fund-Reg(G),15.44,2.13,3.18,1.0,16.85,34.18,94
Nippon India Nifty G-Sec Jun 2036 Maturity Index Fund-Reg(G),2022-12-19,47190,3.13,1.43,2.36,0.37,3.43,12.02,0.2,0.09,0.15,0.37,0.01,0.05,34,35,35,35,15,35,Nifty G-Sec Jun 2036 Index,Nippon India Nifty G-Sec Jun 2036 Maturity Index Fund-Reg(G),2.08,2.16,3.88,0.23,3.39,19.08,35
HDFC MNC Fund-Reg(G),2023-03-09,47648,11.13,2.11,3.37,0.63,12.93,37.62,0.7,0.13,0.21,0.63,0.05,0.15,5,4,4,5,4,4,NIFTY MNC - TRI,HDFC MNC Fund-Reg(G),10.15,2.37,3.83,0.54,14.92,43.88,5
Samco Dynamic Asset Allocation Fund-Reg(G),2023-12-28,48331,,,,,,,,,,,,,,,,,,,NIFTY 50 Hybrid Composite Debt 50:50 Index,Samco Dynamic Asset Allocation Fund-Reg(G),8.44,2.29,3.38,0.76,18.16,54.02,26
UTI Dynamic Bond Fund-Reg(G),2010-06-23,11896,1.95,2.02,3.26,0.21,3.35,18.6,0.12,0.13,0.21,0.21,0.01,0.07,12,14,16,15,13,16,CRISIL Dynamic Bond Index,UTI Dynamic Bond Fund-Reg(G),1.83,2.72,4.9,0.19,3.39,93.57,22
HDFC Nifty G-Sec Sep 2032 Index Fund-Reg(G),2022-12-09,46872,2.38,1.66,2.85,0.3,3.1,12.95,0.15,0.1,0.18,0.3,0.01,0.05,20,27,25,32,26,32,Nifty G-Sec Sep 2032 Index,HDFC Nifty G-Sec Sep 2032 Index Fund-Reg(G),2.08,2.16,3.88,0.23,3.39,19.08,35
HSBC Credit Risk Fund-Reg(G),2009-10-08,8016,0.58,6.39,11.25,0.05,3.6,81.19,0.04,0.4,0.71,0.05,0.01,0.32,3,5,8,6,13,6,NIFTY Credit Risk Bond Index,HSBC Credit Risk Fund-Reg(G),1.4,5.04,12.0,0.06,4.61,-95.37,15
DSP BSE Liquid Rate ETF,2024-03-27,48724,,,,,,,,,,,,,,,,,,,BSE Liquid Rate Index,DSP BSE Liquid Rate ETF,1.28,6.28,10.19,0.21,3.31,549.36,17
PGIM India Large Cap Fund(G),2003-01-30,758,11.65,1.44,2.22,0.89,1.74,18.87,0.73,0.09,0.14,0.89,0.01,0.07,5,36,35,10,36,36,NIFTY 100 - TRI,PGIM India Large Cap Fund(G),13.06,2.05,3.1,0.94,10.9,28.43,36
Motilal Oswal Nifty Bank Index Fund-Reg(G),2019-09-06,43789,16.28,0.6,0.9,1.15,-9.68,8.47,1.03,0.04,0.06,1.15,-0.04,0.03,58,93,93,90,93,93,NIFTY BANK - TRI,Motilal Oswal Nifty Bank Index Fund-Reg(G),15.44,2.13,3.18,1.0,16.85,34.18,94
Tata Housing Opportunities Fund-Reg(G),2022-09-02,46764,14.8,2.0,2.94,0.96,13.33,30.84,0.93,0.13,0.18,0.96,0.05,0.12,32,35,37,32,32,35,Nifty Housing - TRI,Tata Housing Opportunities Fund-Reg(G),14.76,2.4,3.6,0.94,19.76,37.65,46
Axis Global Innovation FoF-Reg(G),2021-05-28,45539,13.91,1.49,2.62,0.52,19.2,39.79,0.88,0.09,0.16,0.52,0.08,0.16,23,25,24,39,21,26,MSCI ACWI Net TRI,Axis Global Innovation FoF-Reg(G),15.33,1.08,1.92,0.45,14.29,59.55,56
Quant BFSI Fund-Reg(G),2023-06-20,47989,,,,,,,,,,,,,,,,,,,Nifty Financial Services - TRI,Quant BFSI Fund-Reg(G),15.44,1.21,1.78,1.07,0.5,17.41,15
Kotak Nifty SDL Plus AAA PSU Bond Jul 2028 60:40 Index Fund-Reg(G),2022-10-13,46730,1.09,3.39,6.72,0.1,3.43,38.05,0.07,0.21,0.42,0.1,0.01,0.15,19,22,21,19,29,20,Nifty SDL Plus AAA PSU Bond Jul 2028 60:40 Index,Kotak Nifty SDL Plus AAA PSU Bond Jul 2028 60:40 Index Fund-Reg(G),1.34,3.16,6.09,0.14,3.33,48.2,52
ICICI Pru Nifty Next 50 ETF,2018-08-23,39950,18.26,2.62,3.76,1.12,30.44,42.56,1.15,0.16,0.24,1.12,0.12,0.17,105,30,40,107,21,40,NIFTY NEXT 50 - TRI,ICICI Pru Nifty Next 50 ETF,15.49,1.89,3.02,1.11,15.21,59.48,129
LIC MF Nifty Midcap 100 ETF,2024-02-19,48473,,,,,,,,,,,,,,,,,,,Nifty Midcap 100 - TRI,LIC MF Nifty Midcap 100 ETF,15.49,1.89,3.02,1.11,15.21,59.48,129
Nippon India Nifty Pharma ETF,2021-07-06,45584,14.17,2.76,5.3,0.45,32.16,87.07,0.89,0.17,0.33,0.45,0.13,0.35,65,7,4,11,15,4,NIFTY PHARMA - TRI,Nippon India Nifty Pharma ETF,15.49,1.89,3.02,1.11,15.21,59.48,129
Invesco India ESG Integration Strategy Fund-Reg(G),2021-03-20,45348,12.66,2.01,3.11,0.88,10.61,29.01,0.8,0.13,0.2,0.88,0.04,0.12,20,33,31,20,37,38,NIFTY100 ESG - TRI,Invesco India ESG Integration Strategy Fund-Reg(G),14.76,2.4,3.6,0.94,19.76,37.65,46
Kotak Consumption Fund-Reg(G),2023-11-16,47948,,,,,,,,,,,,,,,,,,,Nifty India Consumption - TRI,Kotak Consumption Fund-Reg(G),11.14,2.53,4.46,0.62,17.49,45.32,13
SBI FMP-67-1467D-Reg(G),2022-07-29,46703,0.57,2.97,5.93,0.06,1.59,27.9,0.04,0.19,0.37,0.06,0.01,0.11,30,66,67,50,79,66,CRISIL Medium to Long Term Debt Index,SBI FMP-67-1467D-Reg(G),0.74,5.48,11.16,0.06,3.02,-168.93,92
Axis CRISIL IBX 70:30 CPSE Plus SDL April 2025 Index Fund-Reg(G),2022-01-28,45992,0.42,9.81,22.1,0.02,4.08,198.17,0.03,0.62,1.39,0.02,0.02,0.79,2,2,2,1,3,1,CRISIL IBX 70:30 CPSE Plus SDL - April 2025,Axis CRISIL IBX 70:30 CPSE Plus SDL April 2025 Index Fund-Reg(G),0.95,4.48,8.93,0.1,3.47,56.88,30
Quantum Liquid Fund-Reg(G),2006-04-07,19756,0.05,34.51,13.97,0.0,1.89,7262.84,0.0,2.17,0.88,0.0,0.01,28.82,2,5,35,26,35,17,CRISIL Liquid Debt Index,Quantum Liquid Fund-Reg(G),0.09,27.49,17.29,0.0,2.24,3051.29,36
ICICI Pru Silver ETF FOF(G),2022-02-01,46215,20.09,1.13,2.07,1.06,19.71,21.45,1.27,0.07,0.13,1.06,0.08,0.09,51,48,49,53,24,50,Silver,ICICI Pru Silver ETF FOF(G),8.66,2.51,4.1,0.43,18.46,61.56,53
Navi Nifty Bank Index Fund-Reg(G),2022-02-04,45873,16.34,0.59,0.89,1.15,-9.8,8.39,1.03,0.04,0.06,1.15,-0.04,0.03,59,94,94,91,94,94,NIFTY BANK - TRI,Navi Nifty Bank Index Fund-Reg(G),15.44,2.13,3.18,1.0,16.85,34.18,94
Axis Value Fund-Reg(G),2021-09-22,45838,13.79,2.6,3.73,0.91,20.44,39.31,0.87,0.16,0.23,0.91,0.08,0.16,10,10,10,7,8,8,NIFTY 500 - TRI,Axis Value Fund-Reg(G),14.58,2.51,3.69,0.98,20.01,37.53,22
Mirae Asset S&P 500 Top 50 ETF FoF-Reg(G),2021-09-22,45836,17.98,1.87,3.32,0.24,33.06,143.21,1.13,0.12,0.21,0.24,0.13,0.57,44,9,10,16,2,4,S&P 500 Top 50 TRI,Mirae Asset S&P 500 Top 50 ETF FoF-Reg(G),15.33,1.08,1.92,0.45,14.29,59.55,56
Franklin India Equity Savings Fund(G),2018-08-27,39645,2.44,3.57,5.7,0.1,8.44,86.84,0.15,0.23,0.36,0.1,0.03,0.34,5,3,2,4,47,7,NIFTY 50 Equity Savings Index,Franklin India Equity Savings Fund(G),7.34,2.39,3.65,0.32,17.16,61.83,52
Aditya Birla SL Equity Savings Fund-Reg(G),2014-11-28,30757,2.68,3.19,5.49,0.1,8.27,81.75,0.17,0.2,0.35,0.1,0.03,0.32,7,7,5,6,48,8,NIFTY 50 Equity Savings Index - TRI,Aditya Birla SL Equity Savings Fund-Reg(G),7.34,2.39,3.65,0.32,17.16,61.83,52
LIC MF Overnight Fund-Reg(G),2019-07-18,43784,0.01,164.78,12.66,0.0,1.69,523.03,0.0,10.38,0.8,0.0,0.01,2.08,12,16,27,10,26,28,Nifty 1D Rate Index,LIC MF Overnight Fund-Reg(G),0.04,129.76,16.27,0.0,1.88,13522.41,32
Bajaj Finserv Arbitrage Fund-Reg(G),2023-09-15,48064,,,,,,,,,,,,,,,,,,,Nifty 50 Arbitrage,Bajaj Finserv Arbitrage Fund-Reg(G),0.97,4.98,10.55,0.0,4.8,533.01,24
DSP NIFTY 50 Index Fund-Reg(G),2019-02-21,41642,12.66,1.56,2.41,0.99,3.07,20.03,0.8,0.1,0.15,0.99,0.01,0.08,22,68,66,43,71,69,NIFTY 50 - TRI,DSP NIFTY 50 Index Fund-Reg(G),15.44,2.13,3.18,1.0,16.85,34.18,94
DSP NIFTY Next 50 Index Fund-Reg(G),2019-02-21,41641,18.19,2.62,3.76,1.11,28.83,42.84,1.15,0.16,0.24,1.11,0.11,0.17,66,18,16,75,15,32,NIFTY NEXT 50 - TRI,DSP NIFTY Next 50 Index Fund-Reg(G),15.44,2.13,3.18,1.0,16.85,34.18,94
Baroda BNP Paribas Business Cycle Fund-Reg(G),2021-09-15,45686,13.32,2.52,3.68,0.92,17.94,36.31,0.84,0.16,0.23,0.92,0.07,0.14,23,19,18,24,20,23,BSE 500 - TRI,Baroda BNP Paribas Business Cycle Fund-Reg(G),14.76,2.4,3.6,0.94,19.76,37.65,46
LIC MF Aggressive Hybrid Fund(G),1991-01-01,2085,9.92,2.07,3.01,0.44,19.28,46.57,0.62,0.13,0.19,0.44,0.08,0.18,41,40,40,47,19,41,CRISIL Hybrid 35+65 - Aggressive Index,LIC MF Aggressive Hybrid Fund(G),7.34,2.39,3.65,0.32,17.16,61.83,52
Nippon India ETF Hang Seng BeES,2010-03-09,8564,22.03,0.05,0.09,0.39,0.0,2.67,1.39,0.0,0.01,0.39,0.0,0.01,121,129,129,8,115,129,Hang Seng,Nippon India ETF Hang Seng BeES,15.49,1.89,3.02,1.11,15.21,59.48,129
TRUSTMF Flexi Cap Fund-Reg(G),2024-04-26,48451,,,,,,,,,,,,,,,,,,,NIFTY 500 - TRI,TRUSTMF Flexi Cap Fund-Reg(G),13.47,2.22,3.28,0.93,14.46,32.44,41
HDFC BSE Sensex ETF,2015-12-09,34084,12.61,1.38,2.16,0.99,2.12,17.59,0.79,0.09,0.14,0.99,0.01,0.07,26,97,96,84,107,107,BSE SENSEX - TRI,HDFC BSE Sensex ETF,15.49,1.89,3.02,1.11,15.21,59.48,129
Franklin India Pension Plan(G),1997-03-31,3396,5.41,2.6,3.76,0.26,13.33,53.98,0.34,0.16,0.24,0.26,0.05,0.21,13,8,11,10,25,16,CRISIL Composite Bond Index,Franklin India Pension Plan(G),8.7,2.35,3.59,0.92,18.51,55.33,38
Sundaram Low Duration Fund(G),2004-09-14,2343,0.3,12.9,26.13,0.01,3.86,494.22,0.02,0.81,1.65,0.01,0.02,1.96,1,5,5,1,19,3,NIFTY Low Duration Debt Index,Sundaram Low Duration Fund(G),0.34,12.49,24.8,0.01,4.19,338.61,20
Bandhan Transportation and Logistics Fund-Reg(G),2022-10-25,46986,13.13,3.35,5.41,0.72,31.9,61.41,0.83,0.21,0.34,0.72,0.13,0.24,1,1,3,1,3,2,Nifty Transportation & Logistics - TRI,Bandhan Transportation and Logistics Fund-Reg(G),14.06,3.27,5.6,0.78,32.94,59.91,4
Invesco India Gilt Fund(G),2008-02-09,4378,2.8,1.89,3.44,0.29,4.49,18.04,0.18,0.12,0.22,0.29,0.02,0.07,32,15,15,28,2,13,Nifty All Duration G-Sec Index,Invesco India Gilt Fund(G),2.08,2.16,3.88,0.23,3.39,19.08,35
Bank of India Multi Cap Fund-Reg(G),2023-03-03,46115,16.41,2.31,3.16,1.03,20.51,36.79,1.03,0.15,0.2,1.03,0.08,0.15,31,20,22,31,11,17,Nifty500 Multicap 50:25:25 - TRI,Bank of India Multi Cap Fund-Reg(G),13.58,2.34,3.45,0.9,16.33,35.19,33
Bandhan Bond Fund - Income Plan-Reg(G),2000-07-14,1090,2.42,1.23,2.11,0.29,2.17,10.33,0.15,0.08,0.13,0.29,0.01,0.04,9,17,16,7,19,17,NIFTY Medium to Long Duration Debt Index,Bandhan Bond Fund - Income Plan-Reg(G),2.75,1.58,2.79,0.54,3.3,15.92,19
Motilal Oswal Nifty 200 Momentum 30 Index Fund-Reg(G),2022-02-10,46320,19.3,2.62,3.77,1.13,31.5,44.91,1.22,0.16,0.24,1.13,0.12,0.18,86,20,14,86,10,22,Nifty200 Momentum 30 - TRI,Motilal Oswal Nifty 200 Momentum 30 Index Fund-Reg(G),15.44,2.13,3.18,1.0,16.85,34.18,94
LIC MF ULIS,1989-06-19,2154,9.52,1.66,2.55,0.44,14.59,36.06,0.6,0.1,0.16,0.44,0.06,0.14,19,36,35,23,22,31,CRISIL Hybrid 35+65 - Aggressive Index,LIC MF ULIS,8.7,2.35,3.59,0.92,18.51,55.33,38
Mahindra Manulife Equity Savings Fund-Reg(G),2017-02-01,36671,5.59,2.47,3.58,0.22,13.2,61.64,0.35,0.16,0.23,0.22,0.05,0.24,22,25,27,19,34,20,NIFTY 50 Equity Savings Index - TRI,Mahindra Manulife Equity Savings Fund-Reg(G),7.34,2.39,3.65,0.32,17.16,61.83,52
Axis Gold Fund-Reg(G),2011-10-20,15330,10.18,1.68,3.17,0.18,16.63,92.79,0.64,0.11,0.2,0.18,0.07,0.37,1,1,1,6,9,7,Gold-India,Axis Gold Fund-Reg(G),12.82,1.47,2.71,0.39,17.13,106.45,15
WOC Large Cap Fund-Reg(G),2022-12-01,47079,13.18,2.02,2.96,0.97,10.31,27.57,0.83,0.13,0.19,0.97,0.04,0.11,22,17,22,22,16,14,BSE 100 - TRI,WOC Large Cap Fund-Reg(G),13.06,2.05,3.1,0.94,10.9,28.43,36
Bandhan CRISIL IBX Gilt April 2026 Index Fund-Reg(G),2022-10-20,46815,0.74,5.0,10.36,0.08,3.5,47.83,0.05,0.32,0.65,0.08,0.01,0.19,1,1,1,1,12,1,CRISIL IBX Gilt Index - April 2026,Bandhan CRISIL IBX Gilt April 2026 Index Fund-Reg(G),2.08,2.16,3.88,0.23,3.39,19.08,35
Aditya Birla SL BSE Sensex ETF,2016-07-18,35815,12.66,1.38,2.15,1.0,1.71,17.61,0.8,0.09,0.14,1.0,0.01,0.07,40,98,99,86,113,106,BSE SENSEX - TRI,Aditya Birla SL BSE Sensex ETF,15.49,1.89,3.02,1.11,15.21,59.48,129
Mahindra Manulife Large Cap Fund-Reg(G),2019-03-15,38073,12.89,1.96,2.93,0.97,8.74,25.88,0.81,0.12,0.18,0.97,0.03,0.1,19,22,24,23,22,23,NIFTY 100 - TRI,Mahindra Manulife Large Cap Fund-Reg(G),13.06,2.05,3.1,0.94,10.9,28.43,36
Motilal Oswal Nifty 50 Index Fund-Reg(G),2019-12-23,44366,12.68,1.55,2.38,0.99,2.92,19.86,0.8,0.1,0.15,0.99,0.01,0.08,28,73,73,47,75,76,NIFTY 50 - TRI,Motilal Oswal Nifty 50 Index Fund-Reg(G),15.44,2.13,3.18,1.0,16.85,34.18,94
Edelweiss Money Market Fund-Reg(G),2008-06-27,5437,0.29,13.59,28.88,0.0,3.93,1606.12,0.02,0.86,1.82,0.0,0.02,6.37,1,1,1,1,4,1,CRISIL Money Market Index,Edelweiss Money Market Fund-Reg(G),1.83,2.72,4.9,0.19,3.39,93.57,22
WOC Multi Asset Allocation Fund-Reg(G),2023-05-19,47946,4.98,3.03,4.93,0.27,14.36,56.75,0.31,0.19,0.31,0.27,0.06,0.23,1,3,3,3,11,8,CRISIL Composite Bond Index,WOC Multi Asset Allocation Fund-Reg(G),8.55,2.64,4.07,1.19,21.57,68.48,13
Axis Credit Risk Fund-Reg(G),2014-07-15,23018,0.58,7.2,14.16,0.05,4.06,79.18,0.04,0.45,0.89,0.05,0.02,0.31,4,3,4,10,7,7,CRISIL Credit Risk Debt Index,Axis Credit Risk Fund-Reg(G),1.4,5.04,12.0,0.06,4.61,-95.37,15
Nippon India Nifty AAA PSU Bond Plus SDL - Sep 2026 Maturity 50:50 Index Fund-Reg(G),2022-10-27,47034,0.67,5.73,11.3,0.05,3.7,77.79,0.04,0.36,0.71,0.05,0.01,0.31,8,7,6,6,12,6,Nifty AAA PSU Bond Plus SDL Sep 2026 50:50 Index,Nippon India Nifty AAA PSU Bond Plus SDL - Sep 2026 Maturity 50:50 Index Fund-Reg(G),0.78,5.1,9.4,0.08,3.57,75.15,26
Edelweiss Technology Fund-Reg(G),2024-03-05,43844,,,,,,,,,,,,,,,,,,,BSE TECk Index - TRI,Edelweiss Technology Fund-Reg(G),14.86,1.67,3.19,0.68,12.68,35.35,5
Invesco India Short Duration Fund(G),2007-03-24,2262,0.94,4.14,8.63,0.1,3.63,40.24,0.06,0.26,0.54,0.1,0.01,0.16,24,21,15,22,8,21,Nifty Short Duration Debt Index,Invesco India Short Duration Fund(G),0.76,4.87,8.65,0.08,3.36,287.4,26
Union Business Cycle Fund-Reg(G),2024-03-05,48599,,,,,,,,,,,,,,,,,,,NIFTY 500 - TRI,Union Business Cycle Fund-Reg(G),14.76,2.4,3.6,0.94,19.76,37.65,46
Axis Nifty 50 Index Fund-Reg(G),2021-12-03,45701,12.63,1.56,2.4,0.99,3.02,19.98,0.8,0.1,0.15,0.99,0.01,0.08,12,71,71,36,73,73,NIFTY 50 - TRI,Axis Nifty 50 Index Fund-Reg(G),15.44,2.13,3.18,1.0,16.85,34.18,94
Nippon India Equity Savings Fund(G),2015-05-30,30963,3.24,2.65,4.04,0.16,8.16,54.86,0.2,0.17,0.25,0.16,0.03,0.22,8,20,16,10,49,31,NIFTY 50 Equity Savings Index,Nippon India Equity Savings Fund(G),7.34,2.39,3.65,0.32,17.16,61.83,52
SBI Nifty Midcap 150 Index Fund-Reg(G),2022-10-03,45376,16.14,2.62,3.7,0.96,26.13,44.15,1.02,0.17,0.23,0.96,0.1,0.18,55,16,34,23,37,27,Nifty Midcap 150 - TRI,SBI Nifty Midcap 150 Index Fund-Reg(G),15.44,2.13,3.18,1.0,16.85,34.18,94
SBI FMP-42-1857D-Reg(G),2021-03-30,45447,0.5,3.43,7.12,0.04,1.66,44.88,0.03,0.22,0.45,0.04,0.01,0.18,24,60,58,29,67,35,CRISIL Medium to Long Term Debt Index,SBI FMP-42-1857D-Reg(G),0.74,5.48,11.16,0.06,3.02,-168.93,92
Invesco India Aggressive Hybrid Fund-Reg(G),2018-06-30,39893,10.02,2.68,3.94,0.49,25.45,54.38,0.63,0.17,0.25,0.49,0.1,0.22,46,19,18,51,5,32,CRISIL Hybrid 35+65 - Aggressive Index,Invesco India Aggressive Hybrid Fund-Reg(G),7.34,2.39,3.65,0.32,17.16,61.83,52
HDFC FMP-Sr 46-1861D-Mar 2022-Reg(G),2022-03-09,46453,0.94,4.31,8.51,0.1,3.78,40.57,0.06,0.27,0.54,0.1,0.02,0.16,79,45,52,78,32,47,NIFTY Medium to Long Duration Debt Index,HDFC FMP-Sr 46-1861D-Mar 2022-Reg(G),0.74,5.48,11.16,0.06,3.02,-168.93,92
ICICI Pru Nifty Alpha Low - Volatility 30 ETF FOF(G),2021-09-20,45389,11.34,3.33,5.8,0.27,36.94,138.45,0.71,0.21,0.37,0.27,0.15,0.55,39,7,7,23,4,1,NIFTY Alpha Low-Volatility 30 - TRI,ICICI Pru Nifty Alpha Low - Volatility 30 ETF FOF(G),8.66,2.51,4.1,0.43,18.46,61.56,53
ICICI Pru Retirement Fund-Hybrid Aggressive Plan(G),2019-02-27,25669,13.68,2.74,3.94,0.45,36.24,82.96,0.86,0.17,0.25,0.45,0.14,0.33,35,6,9,26,2,4,CRISIL Hybrid 35+65 - Aggressive Index,ICICI Pru Retirement Fund-Hybrid Aggressive Plan(G),8.7,2.35,3.59,0.92,18.51,55.33,38
Bajaj Finserv Overnight Fund-Reg(G),2023-07-05,48051,,,,,,,,,,,,,,,,,,,CRISIL Liquid Overnight Index,Bajaj Finserv Overnight Fund-Reg(G),0.04,129.76,16.27,0.0,1.88,13522.41,32
Kotak FMP-292-1735D(G),2021-08-13,45679,0.73,5.34,12.46,0.04,3.83,105.24,0.05,0.34,0.78,0.04,0.02,0.42,53,26,23,25,26,13,CRISIL Composite Bond Index,Kotak FMP-292-1735D(G),0.74,5.48,11.16,0.06,3.02,-168.93,92
Kotak FMP-292-1735D(IDCW),2021-08-13,45790,0.73,5.34,12.46,0.04,3.83,105.26,0.05,0.34,0.78,0.04,0.02,0.42,52,27,24,24,27,12,NIFTY Medium to Long Duration Debt Index,Kotak FMP-292-1735D(IDCW),0.74,5.48,11.16,0.06,3.02,-168.93,92
Canara Rob Ultra Short Term Fund-Reg(G),2008-07-11,5902,0.28,13.74,28.06,0.0,3.83,1300.35,0.02,0.87,1.77,0.0,0.02,5.16,5,17,20,20,19,21,CRISIL Ultra Short Term Debt Index,Canara Rob Ultra Short Term Fund-Reg(G),0.29,14.1,29.55,0.0,4.13,2248.3,24
HSBC Low Duration Fund-Reg(G),2010-12-04,13350,0.35,13.12,25.02,0.01,4.54,508.38,0.02,0.83,1.58,0.01,0.02,2.02,16,3,9,3,2,2,NIFTY Low Duration Debt Index,HSBC Low Duration Fund-Reg(G),0.34,12.49,24.8,0.01,4.19,338.61,20
ICICI Pru FMP-85-10Y-I(G),2019-03-15,43023,1.64,2.72,5.01,0.11,4.16,39.84,0.1,0.17,0.32,0.11,0.02,0.16,90,73,75,84,12,48,CRISIL Composite Bond Index,ICICI Pru FMP-85-10Y-I(G),0.74,5.48,11.16,0.06,3.02,-168.93,92
Kotak Silver ETF,2022-12-12,46627,21.76,1.06,1.89,1.1,20.44,21.04,1.37,0.07,0.12,1.1,0.08,0.08,18,14,14,19,3,17,Silver,Kotak Silver ETF,15.23,1.4,2.51,0.52,18.21,56.68,21
Nippon India Nifty G-Sec Sep 2027 Maturity Index Fund-Reg(G),2022-12-06,47186,1.28,2.88,5.22,0.16,3.25,23.76,0.08,0.18,0.33,0.16,0.01,0.09,8,7,6,8,21,7,Nifty G-Sec Sep 2027 Index,Nippon India Nifty G-Sec Sep 2027 Maturity Index Fund-Reg(G),2.08,2.16,3.88,0.23,3.39,19.08,35
Union Corporate Bond Fund-Reg(G),2018-05-25,39478,0.84,4.38,7.38,0.09,3.43,42.64,0.05,0.28,0.46,0.09,0.01,0.17,14,17,17,15,14,17,CRISIL Corporate Bond Index,Union Corporate Bond Fund-Reg(G),0.8,4.96,8.69,0.08,3.64,53.65,21
Aditya Birla SL CRISIL IBX AAA Mar 2024 Index Fund-Reg(G),2023-02-03,47555,0.33,14.62,30.7,0.0,4.76,6721.04,0.02,0.92,1.93,0.0,0.02,26.67,1,1,1,1,1,1,CRISIL IBX AAA Index - March 2024,Aditya Birla SL CRISIL IBX AAA Mar 2024 Index Fund-Reg(G),0.76,4.87,8.65,0.08,3.36,287.4,26
Mirae Asset Nifty 1D Rate Liquid ETF,2023-07-27,48119,,,,,,,,,,,,,,,,,,,Nifty 1D Rate Index,Mirae Asset Nifty 1D Rate Liquid ETF,1.28,6.28,10.19,0.21,3.31,549.36,17
Motilal Oswal Nifty Midcap 100 ETF,2011-02-03,13595,17.43,2.49,3.5,1.05,27.19,41.43,1.1,0.16,0.22,1.05,0.11,0.16,96,46,53,94,34,48,Nifty Midcap 100 - TRI,Motilal Oswal Nifty Midcap 100 ETF,15.49,1.89,3.02,1.11,15.21,59.48,129
Nippon India Nifty Next 50 Junior BeES FoF-Reg(G),2019-03-08,40664,14.75,3.21,5.24,0.41,46.17,114.43,0.93,0.2,0.33,0.41,0.18,0.45,47,9,11,38,2,4,NIFTY NEXT 50,Nippon India Nifty Next 50 Junior BeES FoF-Reg(G),8.66,2.51,4.1,0.43,18.46,61.56,53
ICICI Pru Nifty IT ETF,2020-08-17,44401,18.37,0.89,1.73,0.73,5.14,22.5,1.16,0.06,0.11,0.73,0.02,0.09,113,107,106,36,82,83,NIFTY IT - TRI,ICICI Pru Nifty IT ETF,15.49,1.89,3.02,1.11,15.21,59.48,129
Union Focused Fund-Reg(G),2019-08-05,22068,14.04,1.63,2.31,0.99,6.1,23.08,0.88,0.1,0.15,0.99,0.02,0.09,22,31,31,27,31,32,BSE 500 - TRI,Union Focused Fund-Reg(G),13.58,2.34,3.45,0.9,16.33,35.19,33
Nippon India Taiwan Equity Fund-Reg(G),2021-12-11,45690,26.84,0.96,1.62,0.34,19.81,77.19,1.69,0.06,0.1,0.34,0.08,0.31,8,4,4,7,3,5,Taiwan Capitalization Weighted Stock Index,Nippon India Taiwan Equity Fund-Reg(G),15.4,1.09,1.9,0.24,12.18,86.05,8
Motilal Oswal S&P BSE Enhanced Value Index Fund-Reg(G),2022-08-22,46741,24.76,2.66,3.79,1.44,41.35,45.56,1.56,0.17,0.24,1.44,0.16,0.18,94,11,10,94,1,18,BSE Enhanced Value Index - TRI,Motilal Oswal S&P BSE Enhanced Value Index Fund-Reg(G),15.44,2.13,3.18,1.0,16.85,34.18,94
ICICI Pru Nifty Midcap 150 Index Fund-Reg(G),2021-12-22,46108,16.1,2.61,3.68,0.96,25.88,44.0,1.01,0.16,0.23,0.96,0.1,0.17,51,22,36,19,38,28,Nifty Midcap 150 - TRI,ICICI Pru Nifty Midcap 150 Index Fund-Reg(G),15.44,2.13,3.18,1.0,16.85,34.18,94
ICICI Pru Nifty Bank Index Fund-Reg(G),2022-03-02,45994,16.26,0.61,0.91,1.14,-9.5,8.62,1.02,0.04,0.06,1.14,-0.04,0.03,57,92,92,89,92,92,NIFTY BANK - TRI,ICICI Pru Nifty Bank Index Fund-Reg(G),15.44,2.13,3.18,1.0,16.85,34.18,94
PGIM India Liquid Fund(G),2007-09-04,818,0.07,28.78,15.01,0.0,2.04,-28258.57,0.0,1.81,0.95,0.0,0.01,-112.14,18,18,21,5,25,33,CRISIL Liquid Debt Index,PGIM India Liquid Fund(G),0.09,27.49,17.29,0.0,2.24,3051.29,36
Bandhan CRISIL IBX Gilt April 2032 Index Fund-Reg(G),2023-02-15,47601,2.23,1.74,3.02,0.29,3.07,13.41,0.14,0.11,0.19,0.29,0.01,0.05,7,8,8,8,16,9,CRISIL IBX Gilt Index - April 2032,Bandhan CRISIL IBX Gilt April 2032 Index Fund-Reg(G),2.75,1.58,2.79,0.54,3.3,15.92,19
UTI Credit Risk Fund-Reg(G),2012-11-19,14960,0.58,6.58,11.98,0.05,3.68,78.09,0.04,0.41,0.75,0.05,0.01,0.31,2,4,7,8,11,8,CRISIL Credit Risk Debt Index,UTI Credit Risk Fund-Reg(G),1.4,5.04,12.0,0.06,4.61,-95.37,15
Edelweiss Equity Savings Fund-Reg(G),2014-10-13,30730,3.44,3.61,5.65,0.19,11.89,66.45,0.22,0.23,0.36,0.19,0.05,0.26,9,1,3,12,40,14,NIFTY 50 Equity Savings Index,Edelweiss Equity Savings Fund-Reg(G),7.34,2.39,3.65,0.32,17.16,61.83,52
Aditya Birla SL CRISIL IBX 50:50 Gilt Plus SDL Apr 2028 Index Fund-Reg(G),2022-10-13,46897,1.13,3.39,6.51,0.14,3.45,27.72,0.07,0.21,0.41,0.14,0.01,0.11,21,21,23,30,24,31,CRISIL IBX 50:50 Gilt Plus SDL Index - April 2028,Aditya Birla SL CRISIL IBX 50:50 Gilt Plus SDL Apr 2028 Index Fund-Reg(G),1.34,3.16,6.09,0.14,3.33,48.2,52
Canara Rob Short Duration Fund-Reg(G),2011-04-25,12382,0.67,5.17,9.72,0.07,3.28,51.11,0.04,0.33,0.61,0.07,0.01,0.2,3,8,8,3,18,7,CRISIL Short Duration Debt Index,Canara Rob Short Duration Fund-Reg(G),0.76,4.87,8.65,0.08,3.36,287.4,26
SBI FMP-81-1157D-Reg(G),2023-03-31,47876,0.45,3.92,7.88,0.04,1.71,49.42,0.03,0.25,0.5,0.04,0.01,0.2,21,56,55,22,64,27,CRISIL Medium Duration Debt Index,SBI FMP-81-1157D-Reg(G),0.74,5.48,11.16,0.06,3.02,-168.93,92
