MF Code,incept_date,schemecode,sdx_returns,sharpex_returns,sotinox_returns,betax_returns,alphax_returns,treynorx_returns,sdy_returns,sharpey_returns,sotinoy_returns,betay_returns,alphay_returns,treynory_returns,rank_sd,rank_sharpe,rank_sotino,rank_beta,rank_alpha,rank_treynor,index_name,s_name,avg_std_dev,avg_sharpe,avg_sotino,avg_beta,avg_alpha,avg_treyno,no_of_funds_total
Nippon India Retirement Fund-Income Generation(G),2015-02-11,17166,4.31,1.85,2.93,0.44,6.78,18.24,0.27,0.12,0.18,0.44,0.03,0.07,7,33,31,24,36,38,CRISIL Hybrid 85+15 - Conservative Index,Nippon India Retirement Fund-Income Generation(G),8.7,2.35,3.59,0.92,18.51,55.33,38
Nippon India FHF-XLIII-5-2315D(G),2022-03-03,46433,1.35,3.05,5.96,0.11,3.81,38.03,0.08,0.19,0.38,0.11,0.02,0.15,86,64,65,80,29,52,CRISIL Medium to Long Term Debt Index,Nippon India FHF-XLIII-5-2315D(G),0.74,5.48,11.16,0.06,3.02,-168.93,92
LIC MF Ultra Short Duration Fund-Reg(G),2019-11-27,44073,0.28,13.0,27.82,0.0,3.68,1426.72,0.02,0.82,1.75,0.0,0.01,5.66,6,23,22,19,21,20,CRISIL Ultra Short Term Debt Index,LIC MF Ultra Short Duration Fund-Reg(G),0.29,14.1,29.55,0.0,4.13,2248.3,24
Bandhan Retirement Fund-Reg(G),2023-10-18,48226,,,,,,,,,,,,,,,,,,,CRISIL Hybrid 50+50 - Moderate Index,Bandhan Retirement Fund-Reg(G),8.7,2.35,3.59,0.92,18.51,55.33,38
HSBC Dynamic Bond Fund-Reg(G),2006-08-30,925,1.87,2.22,3.68,0.2,3.6,20.92,0.12,0.14,0.23,0.2,0.01,0.08,10,9,11,9,10,10,CRISIL Dynamic Bond Index,HSBC Dynamic Bond Fund-Reg(G),1.83,2.72,4.9,0.19,3.39,93.57,22
DSP World Mining Fund-Reg(G),2009-12-29,8359,22.95,0.21,0.36,0.66,2.82,7.18,1.45,0.01,0.02,0.66,0.01,0.03,54,46,46,45,46,45,MSCI ACWI Metals & Mining 30% Buffer 10/40 (1994) Net TRI,DSP World Mining Fund-Reg(G),15.33,1.08,1.92,0.45,14.29,59.55,56
Bajaj Finserv Nifty Bank ETF,2024-01-19,48462,,,,,,,,,,,,,,,,,,,NIFTY BANK - TRI,Bajaj Finserv Nifty Bank ETF,15.49,1.89,3.02,1.11,15.21,59.48,129
HDFC NIFTY G- Sec Apr 2029 Index Fund-Reg(G),2023-03-10,47712,1.72,2.23,3.89,0.2,3.28,18.85,0.11,0.14,0.24,0.2,0.01,0.07,38,39,38,42,35,39,NIFTY G- Sec Apr 2029 Index,HDFC NIFTY G- Sec Apr 2029 Index Fund-Reg(G),1.34,3.16,6.09,0.14,3.33,48.2,52
Nippon India ETF Nifty 5 yr Benchmark G-Sec,2021-04-07,45428,1.64,2.44,4.22,0.2,3.53,20.11,0.1,0.15,0.27,0.2,0.01,0.08,12,11,10,12,6,11,Nifty 5 yr Benchmark G-Sec Index TRI,Nippon India ETF Nifty 5 yr Benchmark G-Sec,1.28,6.28,10.19,0.21,3.31,549.36,17
Aditya Birla SL Nifty Smallcap 50 Index Fund-Reg(G),2021-04-05,44737,20.1,2.5,3.58,1.07,32.1,46.97,1.27,0.16,0.23,1.07,0.13,0.19,91,39,42,70,8,7,Nifty Smallcap 50 - TRI,Aditya Birla SL Nifty Smallcap 50 Index Fund-Reg(G),15.44,2.13,3.18,1.0,16.85,34.18,94
HDFC Retirement Savings Fund-Hybrid-Debt Plan-Reg(G),2016-02-25,24807,3.46,2.51,3.74,0.23,8.06,38.51,0.22,0.16,0.24,0.23,0.03,0.15,5,14,12,8,34,30,NIFTY 50 Hybrid Composite Debt 15:85 Index,HDFC Retirement Savings Fund-Hybrid-Debt Plan-Reg(G),8.7,2.35,3.59,0.92,18.51,55.33,38
HDFC FMP-Sr 46-1158D-July 2022-Reg(G),2022-07-26,46672,0.56,7.16,14.9,0.04,3.88,94.07,0.04,0.45,0.94,0.04,0.02,0.37,28,19,18,36,22,17,CRISIL Medium Duration Debt Index,HDFC FMP-Sr 46-1158D-July 2022-Reg(G),0.74,5.48,11.16,0.06,3.02,-168.93,92
SBI FMP-76-1221D-Reg(G),2023-01-24,47541,0.58,2.76,5.15,0.07,1.49,21.67,0.04,0.17,0.32,0.07,0.01,0.09,31,72,72,53,89,70,CRISIL Medium Duration Debt Index,SBI FMP-76-1221D-Reg(G),0.74,5.48,11.16,0.06,3.02,-168.93,92
Nippon India Nifty Auto ETF,2022-01-24,45713,15.4,3.33,6.23,0.81,38.83,63.45,0.97,0.21,0.39,0.81,0.15,0.25,69,1,1,40,6,13,NIFTY AUTO - TRI,Nippon India Nifty Auto ETF,15.49,1.89,3.02,1.11,15.21,59.48,129
ITI Ultra Short Duration Fund-Reg(G),2021-05-05,45498,0.27,13.92,27.37,0.01,3.75,673.24,0.02,0.88,1.72,0.01,0.01,2.67,3,15,24,24,20,24,CRISIL Ultra Short Term Debt Index,ITI Ultra Short Duration Fund-Reg(G),0.29,14.1,29.55,0.0,4.13,2248.3,24
JM Overnight Fund-Reg(G),2019-12-03,44156,0.01,193.97,13.3,0.0,1.69,32419.67,0.0,12.22,0.84,0.0,0.01,128.65,11,9,10,12,27,4,CRISIL Liquid Overnight Index,JM Overnight Fund-Reg(G),0.04,129.76,16.27,0.0,1.88,13522.41,32
Mirae Asset Dynamic Bond Fund-Reg(G),2017-03-24,36556,0.72,4.08,7.3,0.07,2.75,45.08,0.05,0.26,0.46,0.07,0.01,0.18,2,2,2,2,19,2,CRISIL Dynamic Bond Index,Mirae Asset Dynamic Bond Fund-Reg(G),1.83,2.72,4.9,0.19,3.39,93.57,22
JM Arbitrage Fund(G),2006-07-18,1843,1.05,4.39,9.12,0.0,4.61,-1261.97,0.07,0.28,0.57,0.0,0.02,-5.01,24,22,22,2,19,19,Nifty 50 Arbitrage,JM Arbitrage Fund(G),0.97,4.98,10.55,0.0,4.8,533.01,24
Baroda BNP Paribas Corp Bond Fund(G),2008-11-08,6932,0.97,3.64,6.18,0.09,3.28,39.34,0.06,0.23,0.39,0.09,0.01,0.16,19,20,20,17,16,19,CRISIL Corporate Bond Index,Baroda BNP Paribas Corp Bond Fund(G),0.8,4.96,8.69,0.08,3.64,53.65,21
Baroda BNP Paribas Credit Risk Fund-Reg(G),2015-01-23,25569,0.6,7.94,15.63,0.04,4.61,120.48,0.04,0.5,0.98,0.04,0.02,0.48,5,2,3,5,6,3,CRISIL Credit Risk Debt Index,Baroda BNP Paribas Credit Risk Fund-Reg(G),1.4,5.04,12.0,0.06,4.61,-95.37,15
Edelweiss Government Securities Fund-Reg(G),2014-02-13,21922,2.77,1.75,3.18,0.32,3.96,15.3,0.17,0.11,0.2,0.32,0.02,0.06,31,19,17,33,6,19,CRISIL Dynamic Gilt Index,Edelweiss Government Securities Fund-Reg(G),2.08,2.16,3.88,0.23,3.39,19.08,35
HDFC NIFTY Midcap 150 Index Fund-Reg(G),2023-04-21,46619,16.08,2.6,3.67,0.96,25.63,43.72,1.01,0.16,0.23,0.96,0.1,0.17,50,26,38,18,40,30,Nifty Midcap 150 - TRI,HDFC NIFTY Midcap 150 Index Fund-Reg(G),15.44,2.13,3.18,1.0,16.85,34.18,94
SBI FMP-74-1243D-Reg(G),2023-01-03,47381,0.57,3.13,6.49,0.04,1.71,50.55,0.04,0.2,0.41,0.04,0.01,0.2,29,63,63,21,66,26,CRISIL Medium Duration Debt Index,SBI FMP-74-1243D-Reg(G),0.74,5.48,11.16,0.06,3.02,-168.93,92
Axis Greater China Equity FoF-Reg(G),2021-02-10,44318,19.17,0.03,0.06,-0.09,0.91,-6.83,1.21,0.0,0.0,-0.09,0.0,-0.03,46,50,50,2,48,50,MSCI Golden Dragon Index (Total Return Net),Axis Greater China Equity FoF-Reg(G),15.33,1.08,1.92,0.45,14.29,59.55,56
JM ELSS Tax Saver Fund(G),2008-03-31,4198,16.03,2.23,3.13,1.03,18.35,34.75,1.01,0.14,0.2,1.03,0.07,0.14,56,27,33,55,18,26,BSE 500 - TRI,JM ELSS Tax Saver Fund(G),13.37,2.23,3.3,0.89,14.7,33.87,59
Edelweiss CRISIL IBX 50:50 Gilt Plus SDL Short Duration Index Fund-Reg(G),2023-02-15,47430,0.82,4.6,8.67,0.09,3.53,43.34,0.05,0.29,0.55,0.09,0.01,0.17,19,16,13,18,12,16,CRISIL IBX 50:50 Gilt Plus SDL Short Duration Index,Edelweiss CRISIL IBX 50:50 Gilt Plus SDL Short Duration Index Fund-Reg(G),0.76,4.87,8.65,0.08,3.36,287.4,26
Nippon India ETF Nifty 50 Value 20,2015-06-18,31920,13.71,1.92,3.14,0.95,11.59,27.64,0.86,0.12,0.2,0.95,0.05,0.11,58,68,63,48,71,71,Nifty50 Value 20 - TRI,Nippon India ETF Nifty 50 Value 20,15.49,1.89,3.02,1.11,15.21,59.48,129
Mirae Asset Money Market Fund-Reg(G),2021-08-11,45753,0.31,14.15,30.49,0.0,4.44,2235.01,0.02,0.89,1.92,0.0,0.02,8.87,9,13,11,8,11,7,Nifty Money Market Index,Mirae Asset Money Market Fund-Reg(G),0.31,14.37,30.12,0.0,4.45,1666.6,21
SBI FMP-80-366D-Reg(G),2023-03-21,47805,0.18,12.77,17.39,0.0,2.32,867.18,0.01,0.8,1.1,0.0,0.01,3.44,1,11,15,13,58,4,NIFTY Low Duration Debt Index,SBI FMP-80-366D-Reg(G),0.74,5.48,11.16,0.06,3.02,-168.93,92
Kotak FMP-328-90D(G),2024-02-16,48490,,,,,,,,,,,,,,,,,,,Nifty Liquid Fund Index,Kotak FMP-328-90D(G),0.74,5.48,11.16,0.06,3.02,-168.93,92
Bank of India Ultra Short Duration Fund-Reg(G),2008-07-16,5842,0.27,13.29,27.72,0.0,3.6,2380.39,0.02,0.84,1.75,0.0,0.01,9.45,4,20,23,8,22,11,CRISIL Ultra Short Term Debt Index,Bank of India Ultra Short Duration Fund-Reg(G),0.29,14.1,29.55,0.0,4.13,2248.3,24
HDFC FMP-Sr 47-2638D-Feb 2023-Reg(G),2023-02-23,47642,2.24,1.59,2.65,0.25,2.87,14.49,0.14,0.1,0.17,0.25,0.01,0.06,91,88,88,91,56,81,NIFTY Long Duration Debt Index,HDFC FMP-Sr 47-2638D-Feb 2023-Reg(G),0.74,5.48,11.16,0.06,3.02,-168.93,92
Canara Rob Corp Bond Fund-Reg(G),2014-02-07,23504,0.67,5.01,9.27,0.07,3.18,45.49,0.04,0.32,0.58,0.07,0.01,0.18,3,7,6,7,19,12,CRISIL Corporate Bond Index,Canara Rob Corp Bond Fund-Reg(G),0.8,4.96,8.69,0.08,3.64,53.65,21
Franklin India G-Sec Fund(G),2001-12-07,3373,1.16,2.19,3.8,0.15,2.12,16.81,0.07,0.14,0.24,0.15,0.01,0.07,4,11,12,7,35,15,Nifty All Duration G-Sec Index,Franklin India G-Sec Fund(G),2.08,2.16,3.88,0.23,3.39,19.08,35
Edelweiss NIFTY Large Mid Cap 250 Index Fund-Reg(G),2021-12-01,45864,14.13,2.35,3.37,0.98,16.56,33.74,0.89,0.15,0.21,0.98,0.07,0.13,45,49,47,33,49,53,NIFTY LargeMidcap 250 - TRI,Edelweiss NIFTY Large Mid Cap 250 Index Fund-Reg(G),15.44,2.13,3.18,1.0,16.85,34.18,94
Bank of India Bluechip Fund-Reg(G),2021-06-29,45571,14.86,2.26,3.14,1.06,15.65,31.63,0.94,0.14,0.2,1.06,0.06,0.13,31,10,14,34,6,8,NIFTY 100 - TRI,Bank of India Bluechip Fund-Reg(G),13.06,2.05,3.1,0.94,10.9,28.43,36
Baroda BNP Paribas Dynamic Bond Fund(G),2004-09-23,116,1.93,1.88,3.14,0.22,3.02,16.86,0.12,0.12,0.2,0.22,0.01,0.07,11,17,17,17,17,18,CRISIL Dynamic Bond Index,Baroda BNP Paribas Dynamic Bond Fund(G),1.83,2.72,4.9,0.19,3.39,93.57,22
Tata Equity Savings Fund-Reg(G),2000-04-27,3273,4.64,2.5,3.65,0.21,11.04,55.09,0.29,0.16,0.23,0.21,0.04,0.22,13,23,24,17,41,30,NIFTY 50 Equity Savings Index,Tata Equity Savings Fund-Reg(G),7.34,2.39,3.65,0.32,17.16,61.83,52
Edelweiss MSCI India Domestic & World Healthcare 45 Index Fund-Reg(G),2020-10-26,45117,10.42,3.03,5.82,0.32,26.84,98.41,0.66,0.19,0.37,0.32,0.11,0.39,1,2,1,1,33,1,MSCI India Domestic & World Healthcare 45 Index,Edelweiss MSCI India Domestic & World Healthcare 45 Index Fund-Reg(G),15.44,2.13,3.18,1.0,16.85,34.18,94
Invesco India Credit Risk Fund(G),2014-09-04,21522,1.69,3.12,13.69,0.07,5.09,73.53,0.11,0.2,0.86,0.07,0.02,0.29,13,13,5,13,2,10,NIFTY Credit Risk Bond Index,Invesco India Credit Risk Fund(G),1.4,5.04,12.0,0.06,4.61,-95.37,15
Aditya Birla SL CRISIL IBX SDL Jun 2032 Index Fund-Reg(G),2023-02-14,47592,2.02,1.92,3.72,0.15,3.43,25.12,0.13,0.12,0.23,0.15,0.01,0.1,4,4,3,5,9,5,CRISIL IBX SDL Index - June 2032,Aditya Birla SL CRISIL IBX SDL Jun 2032 Index Fund-Reg(G),2.75,1.58,2.79,0.54,3.3,15.92,19
ICICI Pru Nifty FMCG ETF,2021-08-05,45651,12.52,0.91,1.63,0.46,4.28,24.75,0.79,0.06,0.1,0.46,0.02,0.1,18,105,112,14,101,74,NIFTY FMCG - TRI,ICICI Pru Nifty FMCG ETF,15.49,1.89,3.02,1.11,15.21,59.48,129
Navi Nifty Midcap 150 Index Fund-Reg(G),2022-03-11,45861,16.11,2.6,3.67,0.96,25.68,43.75,1.01,0.16,0.23,0.96,0.1,0.17,52,27,37,20,39,29,Nifty Midcap 150 - TRI,Navi Nifty Midcap 150 Index Fund-Reg(G),15.44,2.13,3.18,1.0,16.85,34.18,94
Shriram Multi Asset Allocation Fund-Reg(G),2023-09-08,48029,,,,,,,,,,,,,,,,,,,NIFTY 50 - TRI,Shriram Multi Asset Allocation Fund-Reg(G),8.55,2.64,4.07,1.19,21.57,68.48,13
JM Short Duration Fund-Reg(G),2022-08-29,46751,0.7,4.49,8.66,0.07,2.92,43.22,0.04,0.28,0.55,0.07,0.01,0.17,5,20,14,8,23,17,CRISIL Short Duration Debt Index,JM Short Duration Fund-Reg(G),0.76,4.87,8.65,0.08,3.36,287.4,26
Mirae Asset Nifty 100 ESG Sector Leaders ETF,2020-11-18,45134,12.61,1.77,2.77,0.97,7.43,23.13,0.79,0.11,0.17,0.97,0.03,0.09,28,74,72,57,78,81,Nifty100 ESG Sector Leaders - TRI,Mirae Asset Nifty 100 ESG Sector Leaders ETF,15.49,1.89,3.02,1.11,15.21,59.48,129
Union Gilt Fund-Reg(G),2022-08-08,46221,2.49,1.62,2.75,0.29,3.23,13.81,0.16,0.1,0.17,0.29,0.01,0.05,29,30,31,27,24,30,CRISIL Dynamic Gilt Index,Union Gilt Fund-Reg(G),2.08,2.16,3.88,0.23,3.39,19.08,35
Baroda BNP Paribas Banking and Fin Serv Fund-Reg(G),2012-06-22,16955,16.51,1.21,1.72,1.16,0.43,17.29,1.04,0.08,0.11,1.16,0.0,0.07,15,7,8,15,6,6,Nifty Financial Services - TRI,Baroda BNP Paribas Banking and Fin Serv Fund-Reg(G),15.44,1.21,1.78,1.07,0.5,17.41,15
SBI FMP-47-1434D-Reg(G),2021-07-23,45660,0.4,4.49,9.07,0.03,1.76,56.15,0.03,0.28,0.57,0.03,0.01,0.22,18,36,40,19,61,22,CRISIL Medium Duration Debt Index,SBI FMP-47-1434D-Reg(G),0.74,5.48,11.16,0.06,3.02,-168.93,92
DSP World Energy Fund-Reg(G),2009-08-14,7866,16.77,0.09,0.16,0.87,-1.03,1.74,1.06,0.01,0.01,0.87,0.0,0.01,41,48,49,52,49,47,MSCI World,DSP World Energy Fund-Reg(G),15.33,1.08,1.92,0.45,14.29,59.55,56
Aditya Birla SL FMP-US-100D-Reg(G),2024-01-10,48501,,,,,,,,,,,,,,,,,,,CRISIL Ultra Short Term Debt Index,Aditya Birla SL FMP-US-100D-Reg(G),0.74,5.48,11.16,0.06,3.02,-168.93,92
ICICI Pru Debt Mgmt Fund(FOF)(G),2003-12-18,1707,1.04,4.44,7.88,0.12,4.31,39.99,0.07,0.28,0.5,0.12,0.02,0.16,3,3,3,9,44,44,CRISIL Composite Bond Index,ICICI Pru Debt Mgmt Fund(FOF)(G),8.66,2.51,4.1,0.43,18.46,61.56,53
Kotak India Growth Fund-Sr 4(G),2018-02-15,38109,10.98,3.55,5.75,0.88,21.9,44.4,0.69,0.22,0.36,0.88,0.09,0.18,3,1,1,13,8,3,NIFTY 200,Kotak India Growth Fund-Sr 4(G),13.58,2.34,3.45,0.9,16.33,35.19,33
Axis NIFTY IT ETF,2021-03-25,45427,18.33,0.89,1.72,0.73,5.07,22.43,1.15,0.06,0.11,0.73,0.02,0.09,109,110,109,30,85,86,NIFTY IT - TRI,Axis NIFTY IT ETF,15.49,1.89,3.02,1.11,15.21,59.48,129
Groww Nifty Total Market Index Fund-Reg(G),2023-10-23,48247,,,,,,,,,,,,,,,,,,,Nifty Total Market - TRI,Groww Nifty Total Market Index Fund-Reg(G),15.44,2.13,3.18,1.0,16.85,34.18,94
LIC MF Focused Fund-Reg(G),2017-11-17,32627,11.65,1.67,2.66,0.77,6.33,25.1,0.73,0.11,0.17,0.77,0.03,0.1,4,32,28,1,32,27,NIFTY 500 - TRI,LIC MF Focused Fund-Reg(G),13.06,2.05,3.1,0.94,10.9,28.43,36
HDFC BSE 500 Index Fund-Reg(G),2023-04-21,47913,13.46,2.07,3.01,0.99,11.09,28.07,0.85,0.13,0.19,0.99,0.04,0.11,40,60,61,56,59,60,BSE 500 - TRI,HDFC BSE 500 Index Fund-Reg(G),15.44,2.13,3.18,1.0,16.85,34.18,94
LIC MF Gold ETF,2011-11-09,15131,11.27,1.62,2.9,0.22,17.72,83.46,0.71,0.1,0.18,0.22,0.07,0.33,12,10,9,5,9,4,Gold-India,LIC MF Gold ETF,15.23,1.4,2.51,0.52,18.21,56.68,21
Mirae Asset Nifty India Manufacturing ETF,2022-01-27,45869,14.21,3.14,4.84,0.91,30.67,49.32,0.9,0.2,0.3,0.91,0.12,0.2,66,3,15,44,17,16,Nifty India Manufacturing - TRI,Mirae Asset Nifty India Manufacturing ETF,15.49,1.89,3.02,1.11,15.21,59.48,129
Bandhan All Seasons Bond Fund-Reg(G),2004-09-13,2850,0.83,4.53,8.57,0.09,3.53,40.45,0.05,0.29,0.54,0.09,0.01,0.16,2,2,2,7,48,43,NIFTY Medium Duration Debt Index,Bandhan All Seasons Bond Fund-Reg(G),8.66,2.51,4.1,0.43,18.46,61.56,53
Bank of India Credit Risk Fund-Reg(G),2015-02-27,30390,1.16,3.18,12.51,0.0,3.68,-1768.36,0.07,0.2,0.79,0.0,0.01,-7.02,11,12,6,2,12,15,CRISIL Credit Risk Debt Index,Bank of India Credit Risk Fund-Reg(G),1.4,5.04,12.0,0.06,4.61,-95.37,15
ICICI Pru Nifty50 Value 20 ETF,2016-06-17,33839,13.73,1.92,3.15,0.95,11.69,27.75,0.86,0.12,0.2,0.95,0.05,0.11,59,67,62,50,70,70,Nifty50 Value 20 - TRI,ICICI Pru Nifty50 Value 20 ETF,15.49,1.89,3.02,1.11,15.21,59.48,129
SBI FMP-52-1848D-Reg(G),2021-09-28,45915,0.59,2.97,5.8,0.05,1.66,37.88,0.04,0.19,0.37,0.05,0.01,0.15,33,67,68,41,70,53,CRISIL Medium to Long Term Debt Index,SBI FMP-52-1848D-Reg(G),0.74,5.48,11.16,0.06,3.02,-168.93,92
Bandhan Nifty 100 Index Fund-Reg(G),2022-02-24,46119,13.21,1.84,2.75,1.01,7.16,23.99,0.83,0.12,0.17,1.01,0.03,0.1,39,62,62,63,63,63,NIFTY 100 - TRI,Bandhan Nifty 100 Index Fund-Reg(G),15.44,2.13,3.18,1.0,16.85,34.18,94
ICICI Pru Nifty Infrastructure ETF,2022-08-17,45998,18.26,2.42,3.39,1.24,25.05,35.61,1.15,0.15,0.21,1.24,0.1,0.14,106,48,56,125,45,63,Nifty Infrastructure - TRI,ICICI Pru Nifty Infrastructure ETF,15.49,1.89,3.02,1.11,15.21,59.48,129
Bank of India Balanced Advantage Fund-Reg(G),2014-03-14,21917,11.08,1.76,2.53,0.44,18.27,43.92,0.7,0.11,0.16,0.44,0.07,0.17,24,24,23,25,9,21,NIFTY 50 Hybrid Composite Debt 50:50 Index,Bank of India Balanced Advantage Fund-Reg(G),8.44,2.29,3.38,0.76,18.16,54.02,26
Taurus Mid Cap Fund-Reg(G),1994-09-05,3306,19.05,1.84,2.5,1.07,17.04,32.91,1.2,0.12,0.16,1.07,0.07,0.13,30,30,30,29,28,29,Nifty Midcap 150 - TRI,Taurus Mid Cap Fund-Reg(G),15.17,2.59,3.79,0.89,24.29,44.05,30
Kotak FMP-329-90D(G),2024-03-21,48720,,,,,,,,,,,,,,,,,,,Nifty Liquid Fund Index,Kotak FMP-329-90D(G),0.74,5.48,11.16,0.06,3.02,-168.93,92
ICICI Pru FMP-88-1226D-F(G),2022-12-08,47232,0.92,4.24,8.83,0.09,3.65,44.63,0.06,0.27,0.56,0.09,0.01,0.18,71,50,45,67,43,36,CRISIL Medium Duration Debt Index,ICICI Pru FMP-88-1226D-F(G),0.74,5.48,11.16,0.06,3.02,-168.93,92
Union Retirement Fund-Reg(G),2022-09-22,45735,13.38,2.19,3.08,0.49,27.9,59.82,0.84,0.14,0.19,0.49,0.11,0.24,34,25,29,29,7,10,BSE 500 - TRI,Union Retirement Fund-Reg(G),8.7,2.35,3.59,0.92,18.51,55.33,38
ICICI Pru Retirement Fund-Pure Debt Plan(G),2019-02-27,25670,0.94,3.85,6.79,0.09,3.35,38.56,0.06,0.24,0.43,0.09,0.01,0.15,2,1,1,2,37,29,NIFTY Composite Debt Index,ICICI Pru Retirement Fund-Pure Debt Plan(G),8.7,2.35,3.59,0.92,18.51,55.33,38
Aditya Birla SL Long Duration Fund-Reg(G),2022-08-08,46711,2.75,1.54,2.68,0.31,3.38,13.68,0.17,0.1,0.17,0.31,0.01,0.05,12,10,9,10,11,7,NIFTY Long Duration Debt Index,Aditya Birla SL Long Duration Fund-Reg(G),2.75,1.58,2.79,0.54,3.3,15.92,19
Invesco India Banking and PSU Fund(G),2012-12-29,17249,1.08,3.68,6.45,0.11,3.65,35.66,0.07,0.23,0.41,0.11,0.01,0.14,25,24,22,25,14,25,NIFTY Banking and PSU Debt Index,Invesco India Banking and PSU Fund(G),0.78,5.1,9.4,0.08,3.57,75.15,26
SBI FMP-46-1850D-Reg(G),2021-07-07,45620,0.55,3.0,6.07,0.04,1.56,36.64,0.03,0.19,0.38,0.04,0.01,0.15,26,65,64,40,83,55,CRISIL Medium to Long Term Debt Index,SBI FMP-46-1850D-Reg(G),0.74,5.48,11.16,0.06,3.02,-168.93,92
Canara Rob Income Fund-Reg(G),2002-09-19,542,2.17,1.2,2.04,0.26,1.89,10.11,0.14,0.08,0.13,0.26,0.01,0.04,49,52,52,50,52,52,CRISIL Medium to Long Term Debt Index,Canara Rob Income Fund-Reg(G),1.34,3.16,6.09,0.14,3.33,48.2,52
HSBC Global Equity Climate Change FoF-Reg(G),2021-03-22,45333,15.04,0.59,1.08,0.62,7.38,14.29,0.95,0.04,0.07,0.62,0.03,0.06,27,39,38,43,39,39,MSCI AC World Index,HSBC Global Equity Climate Change FoF-Reg(G),15.33,1.08,1.92,0.45,14.29,59.55,56
Kotak Nifty Alpha 50 ETF,2021-12-22,45687,21.96,2.68,3.78,1.24,39.64,47.58,1.38,0.17,0.24,1.24,0.16,0.19,120,12,32,123,4,17,Nifty Alpha 50 - TRI,Kotak Nifty Alpha 50 ETF,15.49,1.89,3.02,1.11,15.21,59.48,129
Aditya Birla SL Silver ETF FOF-Reg(G),2022-02-03,46225,19.73,1.11,2.1,0.99,19.15,22.15,1.24,0.07,0.13,0.99,0.08,0.09,49,49,48,51,28,49,Silver,Aditya Birla SL Silver ETF FOF-Reg(G),8.66,2.51,4.1,0.43,18.46,61.56,53
Baroda BNP Paribas NIFTY SDL Dec 2026 Index Fund-Reg(G),2023-01-25,47387,0.9,4.18,8.64,0.05,3.6,77.62,0.06,0.26,0.54,0.05,0.01,0.31,9,10,9,4,14,5,NIFTY SDL December 2026 Index,Baroda BNP Paribas NIFTY SDL Dec 2026 Index Fund-Reg(G),1.34,3.16,6.09,0.14,3.33,48.2,52
Groww Largecap Fund-Reg(G),2012-02-10,15997,13.39,2.03,3.04,1.01,10.18,27.01,0.84,0.13,0.19,1.01,0.04,0.11,23,16,18,29,17,17,NIFTY 100 - TRI,Groww Largecap Fund-Reg(G),13.06,2.05,3.1,0.94,10.9,28.43,36
Kotak FMP-310-1131D(G),2023-03-27,47871,0.92,4.18,8.67,0.09,3.6,43.6,0.06,0.26,0.55,0.09,0.01,0.17,72,52,48,70,45,43,NIFTY Medium Duration Debt Index,Kotak FMP-310-1131D(G),0.74,5.48,11.16,0.06,3.02,-168.93,92
Union Equity Savings Fund-Reg(G),2018-08-09,40627,4.56,2.14,3.1,0.2,9.2,47.8,0.29,0.14,0.2,0.2,0.04,0.19,12,37,39,16,46,38,Crisil Equity Savings Index,Union Equity Savings Fund-Reg(G),7.34,2.39,3.65,0.32,17.16,61.83,52
Nippon India FMP-XLVI-1(G),2023-12-20,48149,,,,,,,,,,,,,,,,,,,NIFTY Ultra Short Duration Debt Index,Nippon India FMP-XLVI-1(G),0.74,5.48,11.16,0.06,3.02,-168.93,92
Bandhan Equity Savings Fund-Reg(G),2008-06-09,5300,2.61,2.78,4.57,0.11,6.96,64.99,0.16,0.18,0.29,0.11,0.03,0.26,6,14,10,7,51,15,CRISIL Liquid Debt Index,Bandhan Equity Savings Fund-Reg(G),7.34,2.39,3.65,0.32,17.16,61.83,52
Axis BSE Sensex ETF,2023-03-24,47768,12.59,1.37,2.15,0.99,1.99,17.46,0.79,0.09,0.14,0.99,0.01,0.07,21,102,100,73,110,111,BSE SENSEX - TRI,Axis BSE Sensex ETF,15.49,1.89,3.02,1.11,15.21,59.48,129
PGIM India Gilt Fund(G),2008-10-27,7012,2.47,1.71,3.11,0.28,3.45,15.09,0.16,0.11,0.2,0.28,0.01,0.06,28,20,18,22,14,20,CRISIL Dynamic Gilt Index,PGIM India Gilt Fund(G),2.08,2.16,3.88,0.23,3.39,19.08,35
Nippon India Strategic Debt Fund(G),2014-06-26,21911,0.97,3.55,6.37,0.11,3.15,30.87,0.06,0.22,0.4,0.11,0.01,0.12,16,21,21,17,25,22,CRISIL Medium Duration Debt Index,Nippon India Strategic Debt Fund(G),0.95,4.48,8.93,0.1,3.47,56.88,30
PGIM India Arbitrage Fund-Reg(G),2014-08-27,28514,0.94,4.69,9.7,0.0,4.41,2267.45,0.06,0.3,0.61,0.0,0.02,9.0,6,21,21,10,22,3,Nifty 50 Arbitrage,PGIM India Arbitrage Fund-Reg(G),0.97,4.98,10.55,0.0,4.8,533.01,24
Kotak Nifty SDL Jul 2026 Index Fund-Reg(G),2022-12-22,46729,0.74,5.28,12.41,0.04,3.81,108.61,0.05,0.33,0.78,0.04,0.02,0.43,4,4,3,3,4,3,Nifty SDL Jul 2026 Index,Kotak Nifty SDL Jul 2026 Index Fund-Reg(G),1.34,3.16,6.09,0.14,3.33,48.2,52
Quantum Equity FoF-Reg(G),2009-07-20,19904,12.46,2.2,3.2,0.53,25.91,51.74,0.78,0.14,0.2,0.53,0.1,0.21,42,38,38,44,11,34,BSE 200 - TRI,Quantum Equity FoF-Reg(G),8.66,2.51,4.1,0.43,18.46,61.56,53
ICICI Pru Global Stable Equity Fund(FOF)(G),2013-09-13,16718,9.75,0.56,0.95,0.52,3.96,10.41,0.61,0.04,0.06,0.52,0.02,0.04,3,41,40,40,45,42,MSCI World,ICICI Pru Global Stable Equity Fund(FOF)(G),15.33,1.08,1.92,0.45,14.29,59.55,56
DSP FMP 268-1281D-Reg(G),2022-11-24,47124,0.73,5.52,13.09,0.03,3.98,136.38,0.05,0.35,0.82,0.03,0.02,0.54,51,23,21,18,17,7,CRISIL Medium Duration Debt Index,DSP FMP 268-1281D-Reg(G),0.74,5.48,11.16,0.06,3.02,-168.93,92
SBI FMP-78-1170D-Reg(G),2023-02-21,47638,0.46,3.58,7.11,0.04,1.56,38.08,0.03,0.23,0.45,0.04,0.01,0.15,22,58,59,38,82,51,CRISIL Medium Duration Debt Index,SBI FMP-78-1170D-Reg(G),0.74,5.48,11.16,0.06,3.02,-168.93,92
HSBC Nifty Next 50 Index Fund-Reg(G),2020-04-15,33548,18.21,2.6,3.72,1.11,28.4,42.41,1.15,0.16,0.23,1.11,0.11,0.17,72,30,28,81,21,40,NIFTY NEXT 50 - TRI,HSBC Nifty Next 50 Index Fund-Reg(G),15.44,2.13,3.18,1.0,16.85,34.18,94
TRUSTMF Short Duration Fund-Reg(G),2021-08-06,45652,0.73,4.61,8.31,0.07,3.18,45.41,0.05,0.29,0.52,0.07,0.01,0.18,9,15,20,9,22,11,CRISIL Short Duration Debt Index,TRUSTMF Short Duration Fund-Reg(G),0.76,4.87,8.65,0.08,3.36,287.4,26
Kotak FMP-326-175D(G),2023-12-26,48420,,,,,,,,,,,,,,,,,,,NIFTY Ultra Short Duration Debt Index,Kotak FMP-326-175D(G),0.74,5.48,11.16,0.06,3.02,-168.93,92
Bandhan Regular Savings Fund-Reg(G),2010-02-25,8465,3.49,2.04,3.67,0.18,6.63,39.84,0.22,0.13,0.23,0.18,0.03,0.16,12,16,14,7,14,15,NIFTY AAA Short Duration Bond Index,Bandhan Regular Savings Fund-Reg(G),3.4,2.69,4.2,0.2,8.49,50.23,19
Sundaram Global Brand Fund(G),2007-08-22,3005,10.97,1.23,2.08,0.14,13.08,94.53,0.69,0.08,0.13,0.14,0.05,0.38,7,29,30,7,28,16,MSCI AC World Index,Sundaram Global Brand Fund(G),15.33,1.08,1.92,0.45,14.29,59.55,56
Bandhan CRISIL IBX 90:10 SDL Plus Gilt - Nov 2026 Index Fund-Reg(G),2022-11-17,46213,0.8,4.81,10.45,0.05,3.7,75.1,0.05,0.3,0.66,0.05,0.01,0.3,8,7,4,6,9,6,CRISIL IBX 90:10 SDL Plus Gilt Index - November 2026,Bandhan CRISIL IBX 90:10 SDL Plus Gilt - Nov 2026 Index Fund-Reg(G),1.34,3.16,6.09,0.14,3.33,48.2,52
Quantum Gold Saving Fund-Reg(G),2011-05-19,19961,10.51,1.64,3.09,0.22,16.63,78.17,0.66,0.1,0.19,0.22,0.07,0.31,3,3,3,10,10,10,Gold-India,Quantum Gold Saving Fund-Reg(G),12.82,1.47,2.71,0.39,17.13,106.45,15
Invesco India Gold ETF,2010-03-19,8505,11.08,1.61,2.91,0.22,17.36,81.09,0.7,0.1,0.18,0.22,0.07,0.32,9,11,8,6,11,5,Gold-India,Invesco India Gold ETF,15.23,1.4,2.51,0.52,18.21,56.68,21
SBI FMP-50-1843D-Reg(G),2021-09-07,45842,0.6,2.81,5.48,0.06,1.59,27.9,0.04,0.18,0.35,0.06,0.01,0.11,34,70,70,49,78,67,CRISIL Medium to Long Term Debt Index,SBI FMP-50-1843D-Reg(G),0.74,5.48,11.16,0.06,3.02,-168.93,92
Nippon India ETF Nifty Infrastructure BeES,2010-10-04,12859,18.2,2.39,3.35,1.24,24.42,35.18,1.15,0.15,0.21,1.24,0.1,0.14,99,51,57,124,46,64,Nifty Infrastructure - TRI,Nippon India ETF Nifty Infrastructure BeES,15.49,1.89,3.02,1.11,15.21,59.48,129
WOC Pharma and Healthcare Fund-Reg(G),2024-02-06,48472,,,,,,,,,,,,,,,,,,,BSE Health Care - TRI,WOC Pharma and Healthcare Fund-Reg(G),12.14,3.07,5.63,0.44,30.0,87.79,11
Union Dynamic Bond(G),2012-02-13,16032,2.33,1.46,2.44,0.28,2.6,12.1,0.15,0.09,0.15,0.28,0.01,0.05,19,20,21,21,20,22,CRISIL Dynamic Bond Index,Union Dynamic Bond(G),1.83,2.72,4.9,0.19,3.39,93.57,22
DSP Silver ETF,2022-08-19,46354,20.97,1.05,1.84,1.11,19.38,19.83,1.32,0.07,0.12,1.11,0.08,0.08,14,16,17,20,7,21,Silver,DSP Silver ETF,15.23,1.4,2.51,0.52,18.21,56.68,21
Edelweiss Emerging Markets Opp Eq. Offshore Fund-Reg(G),2014-07-07,20281,13.57,0.48,0.85,0.49,4.94,13.26,0.85,0.03,0.05,0.49,0.02,0.05,19,44,44,35,43,40,MSCI Emerging Market Index,Edelweiss Emerging Markets Opp Eq. Offshore Fund-Reg(G),15.33,1.08,1.92,0.45,14.29,59.55,56
HSBC Conservative Hybrid Fund(G),2004-02-24,1458,4.21,2.71,4.04,0.28,10.63,40.85,0.27,0.17,0.25,0.28,0.04,0.16,17,11,10,18,4,14,NIFTY 50 Hybrid Composite Debt 15:85 Index,HSBC Conservative Hybrid Fund(G),3.4,2.69,4.2,0.2,8.49,50.23,19
JM Focused Fund-Reg(G),2008-03-05,4282,15.54,2.4,3.43,1.0,20.41,37.4,0.98,0.15,0.22,1.0,0.08,0.15,34,5,8,27,4,4,BSE 500 - TRI,JM Focused Fund-Reg(G),13.06,2.05,3.1,0.94,10.9,28.43,36
LIC MF Value Fund-Reg(G),2018-08-20,39956,13.58,2.14,3.16,0.97,12.78,30.11,0.86,0.14,0.2,0.97,0.05,0.12,8,20,19,8,21,21,NIFTY 500 - TRI,LIC MF Value Fund-Reg(G),14.58,2.51,3.69,0.98,20.01,37.53,22
PGIM India Dynamic Bond Fund(G),2012-01-12,15247,1.99,2.02,3.73,0.21,3.4,18.82,0.13,0.13,0.23,0.21,0.01,0.07,16,15,10,16,12,14,CRISIL Dynamic Bond Index,PGIM India Dynamic Bond Fund(G),1.83,2.72,4.9,0.19,3.39,93.57,22
SBI FMP-43-1616D-Reg(G),2021-04-29,45525,0.4,4.47,8.62,0.04,1.74,46.29,0.03,0.28,0.54,0.04,0.01,0.18,19,40,50,30,62,30,CRISIL Medium Duration Debt Index,SBI FMP-43-1616D-Reg(G),0.74,5.48,11.16,0.06,3.02,-168.93,92
Mirae Asset Nifty 100 ESG Sector Leaders FoF-Reg(G),2020-11-18,45135,12.59,1.74,2.77,0.57,20.36,38.4,0.79,0.11,0.17,0.57,0.08,0.15,43,43,44,47,23,46,Nifty100 ESG Sector Leaders - TRI,Mirae Asset Nifty 100 ESG Sector Leaders FoF-Reg(G),8.66,2.51,4.1,0.43,18.46,61.56,53
SBI Magnum Childrens Benefit Fund-Savings Plan,2002-01-28,2748,3.81,3.67,6.51,0.09,13.73,158.48,0.24,0.23,0.41,0.09,0.05,0.63,6,2,2,1,24,1,NIFTY 50 Hybrid Composite Debt 15:85 Index,SBI Magnum Childrens Benefit Fund-Savings Plan,8.7,2.35,3.59,0.92,18.51,55.33,38
