MF Code,incept_date,schemecode,sdx_returns,sharpex_returns,sotinox_returns,betax_returns,alphax_returns,treynorx_returns,sdy_returns,sharpey_returns,sotinoy_returns,betay_returns,alphay_returns,treynory_returns,rank_sd,rank_sharpe,rank_sotino,rank_beta,rank_alpha,rank_treynor,index_name,s_name,avg_std_dev,avg_sharpe,avg_sotino,avg_beta,avg_alpha,avg_treyno,no_of_funds_total
WOC Multi Asset Allocation Fund-Reg(G),2023-05-19,47946,5.4,3.08,4.86,0.91,13.96,18.3,0.34,0.19,0.31,0.91,0.06,0.07,2,2,2,4,12,4,CRISIL Short Term Bond Index,WOC Multi Asset Allocation Fund-Reg(G),8.87,2.36,3.6,1.29,17.0,4.58,15
Nippon India Index Fund-BSE Sensex Plan(G),2010-09-28,12865,13.36,1.37,2.14,0.99,0.2,18.45,0.84,0.09,0.13,0.99,0.0,0.07,17,92,93,55,95,94,BSE SENSEX - TRI,Nippon India Index Fund-BSE Sensex Plan(G),16.43,1.97,3.0,0.99,14.45,32.95,101
Invesco India Manufacturing Fund-Reg(G),2024-08-14,47579,,,,,,,,,,,,,,,,,,,Nifty India Manufacturing - TRI,Invesco India Manufacturing Fund-Reg(G),15.66,2.27,3.42,0.91,17.47,37.03,52
ICICI Pru Silver ETF FOF(G),2022-02-01,46215,21.22,0.86,1.49,2.0,12.37,9.12,1.34,0.05,0.09,2.0,0.05,0.04,51,50,50,47,33,48,Silver,ICICI Pru Silver ETF FOF(G),9.16,2.38,3.86,1.09,15.55,21.19,53
LIC MF Nifty Midcap 100 ETF,2024-02-19,48473,,,,,,,,,,,,,,,,,,,Nifty Midcap 100 - TRI,LIC MF Nifty Midcap 100 ETF,16.29,1.83,2.98,1.08,13.44,15.21,136
Franklin India NSE Nifty 50 Index Fund(G),2000-08-04,942,13.36,1.57,2.42,0.99,2.92,21.19,0.84,0.1,0.15,0.99,0.01,0.08,16,80,83,30,86,84,NIFTY 50,Franklin India NSE Nifty 50 Index Fund(G),16.43,1.97,3.0,0.99,14.45,32.95,101
UTI India Consumer Fund-Reg(G),2007-07-30,3581,11.68,2.97,5.45,0.64,22.98,54.0,0.74,0.19,0.34,0.64,0.09,0.21,10,8,5,10,7,8,Nifty India Consumption - TRI,UTI India Consumer Fund-Reg(G),11.72,2.86,5.03,0.63,21.96,54.07,15
ICICI Pru Nifty Alpha Low - Volatility 30 ETF FOF(G),2021-09-20,45389,11.88,3.42,5.87,1.05,37.57,38.61,0.75,0.22,0.37,1.05,0.15,0.15,38,5,5,22,2,4,NIFTY Alpha Low-Volatility 30 - TRI,ICICI Pru Nifty Alpha Low - Volatility 30 ETF FOF(G),9.16,2.38,3.86,1.09,15.55,21.19,53
TRUSTMF Flexi Cap Fund-Reg(G),2024-04-26,48451,,,,,,,,,,,,,,,,,,,NIFTY 500 - TRI,TRUSTMF Flexi Cap Fund-Reg(G),14.39,2.16,3.2,0.94,13.96,33.2,45
Edelweiss Money Market Fund-Reg(G),2008-06-27,5437,0.3,9.42,19.79,0.01,2.75,201.75,0.02,0.59,1.25,0.01,0.01,0.8,1,1,1,1,5,1,CRISIL Money Market Index,Edelweiss Money Market Fund-Reg(G),1.8,3.11,5.49,0.87,2.35,15.07,22
Baroda BNP Paribas Focused Fund-Reg(G),2017-10-06,32452,17.78,1.58,2.2,1.1,7.99,25.5,1.12,0.1,0.14,1.1,0.03,0.1,43,43,44,44,38,42,NIFTY 500 - TRI,Baroda BNP Paribas Focused Fund-Reg(G),14.39,2.16,3.2,0.94,13.96,33.2,45
Axis Value Fund-Reg(G),2021-09-22,45838,14.49,2.59,3.72,0.94,20.46,39.84,0.91,0.16,0.23,0.94,0.08,0.16,9,4,5,7,6,5,NIFTY 500 - TRI,Axis Value Fund-Reg(G),15.31,2.33,3.44,0.98,17.49,36.33,22
Sundaram Corp Bond Fund(G),2004-12-30,2955,0.81,4.82,8.58,0.34,2.9,11.42,0.05,0.3,0.54,0.34,0.01,0.05,14,13,12,11,10,12,NIFTY Corporate Bond Index,Sundaram Corp Bond Fund(G),0.76,4.97,8.52,0.32,2.81,12.33,21
Old Bridge Focused Equity Fund-Reg(G),2024-01-24,48527,,,,,,,,,,,,,,,,,,,BSE 500 - TRI,Old Bridge Focused Equity Fund-Reg(G),14.39,2.16,3.2,0.94,13.96,33.2,45
Aditya Birla SL ESG Integration Strategy Fund-Reg(G),2020-12-24,44736,12.76,2.22,3.73,0.86,12.68,32.96,0.8,0.14,0.23,0.86,0.05,0.13,17,27,14,19,37,36,NIFTY100 ESG - TRI,Aditya Birla SL ESG Integration Strategy Fund-Reg(G),15.66,2.27,3.42,0.91,17.47,37.03,52
Bank of India Multi Cap Fund-Reg(G),2023-03-03,46115,17.24,2.11,2.93,1.05,17.24,34.7,1.09,0.13,0.18,1.05,0.07,0.14,32,22,27,31,12,18,Nifty500 Multicap 50:25:25 - TRI,Bank of India Multi Cap Fund-Reg(G),14.46,2.19,3.24,0.87,14.86,34.59,34
Aditya Birla SL CRISIL IBX Gilt Apr 2029 Index Fund-Reg(G),2022-10-19,46950,1.52,3.24,5.52,0.67,2.97,7.33,0.1,0.2,0.35,0.67,0.01,0.03,11,9,10,10,4,9,CRISIL IBX Gilt Index - April 2029,Aditya Birla SL CRISIL IBX Gilt Apr 2029 Index Fund-Reg(G),1.96,2.91,5.21,0.95,2.37,6.34,35
Nippon India US Equity Opp Fund(G),2015-07-23,19246,14.38,1.38,2.28,0.2,16.51,101.33,0.91,0.09,0.14,0.2,0.07,0.4,4,2,2,4,3,3,S&P 500 - TRI,Nippon India US Equity Opp Fund(G),16.93,1.1,1.84,0.31,11.87,73.71,8
SBI Magnum Comma Fund-Reg(G),2005-08-08,2750,21.3,1.5,2.09,1.21,10.03,26.31,1.34,0.09,0.13,1.21,0.04,0.1,47,51,51,47,45,49,NIFTY COMMODITIES - TRI,SBI Magnum Comma Fund-Reg(G),15.66,2.27,3.42,0.91,17.47,37.03,52
Samco Flexi Cap Fund-Reg(G),2022-02-04,46217,15.66,0.76,1.13,0.86,-3.73,13.89,0.99,0.05,0.07,0.86,-0.01,0.06,35,45,45,11,45,45,NIFTY 500 - TRI,Samco Flexi Cap Fund-Reg(G),14.39,2.16,3.2,0.94,13.96,33.2,45
Franklin India Equity Savings Fund(G),2018-08-27,39645,2.44,2.97,4.7,0.4,6.1,18.24,0.15,0.19,0.3,0.4,0.02,0.07,5,5,5,6,48,10,NIFTY 50 Equity Savings Index,Franklin India Equity Savings Fund(G),7.75,2.24,3.41,1.24,14.36,14.98,52
Kotak Silver ETF,2022-12-12,46627,22.89,0.85,1.44,1.97,14.57,9.88,1.44,0.05,0.09,1.97,0.06,0.04,18,14,14,17,16,17,Silver,Kotak Silver ETF,17.25,1.19,1.89,0.82,16.24,28.48,22
Sundaram Overnight Fund-Reg(G),2019-03-20,42000,0.01,36.87,2.33,0.0,0.3,-1057.82,0.0,2.32,0.15,0.0,0.0,-4.2,9,12,27,14,30,17,Nifty 1D Rate Index,Sundaram Overnight Fund-Reg(G),0.04,26.72,4.08,0.0,0.48,-1478.06,34
Quant BFSI Fund-Reg(G),2023-06-20,47989,19.54,1.96,2.86,1.09,18.45,35.18,1.23,0.12,0.18,1.09,0.07,0.14,17,1,2,13,1,1,Nifty Financial Services - TRI,Quant BFSI Fund-Reg(G),16.24,1.28,1.87,1.04,1.71,19.93,17
Union Aggressive Hybrid Fund-Reg(G),2020-12-18,44512,10.69,1.9,2.74,1.71,15.42,11.89,0.67,0.12,0.17,1.71,0.06,0.05,43,45,47,40,24,42,CRISIL Hybrid 35+65 - Aggressive Index,Union Aggressive Hybrid Fund-Reg(G),7.75,2.24,3.41,1.24,14.36,14.98,52
DSP FMP 267-1246D-Reg(G),2022-11-14,47071,0.78,4.86,9.77,0.29,2.97,13.33,0.05,0.31,0.62,0.29,0.01,0.05,72,43,38,78,36,45,CRISIL Medium Duration Debt Index,DSP FMP 267-1246D-Reg(G),0.67,4.58,9.19,0.19,2.25,-152.64,91
HDFC Nifty G-Sec Jul 2031 Index Fund-Reg(G),2022-11-10,46620,2.07,2.54,4.03,0.94,2.49,5.59,0.13,0.16,0.25,0.94,0.01,0.02,16,18,26,13,16,13,Nifty G-Sec July 2031 Index,HDFC Nifty G-Sec Jul 2031 Index Fund-Reg(G),1.96,2.91,5.21,0.95,2.37,6.34,35
UTI Gilt Fund-Reg(G),2002-01-21,3560,2.26,2.42,3.92,1.11,2.22,4.94,0.14,0.15,0.25,1.11,0.01,0.02,21,25,29,20,24,19,CRISIL Dynamic Gilt Index,UTI Gilt Fund-Reg(G),1.96,2.91,5.21,0.95,2.37,6.34,35
Samco Dynamic Asset Allocation Fund-Reg(G),2023-12-28,48331,,,,,,,,,,,,,,,,,,,NIFTY 50 Hybrid Composite Debt 50:50 Index,Samco Dynamic Asset Allocation Fund-Reg(G),8.7,2.16,3.2,1.49,14.18,13.05,27
ICICI Pru Retirement Fund-Hybrid Aggressive Plan(G),2019-02-27,25669,14.55,2.17,3.11,2.14,25.38,14.74,0.92,0.14,0.2,2.14,0.1,0.06,35,18,22,33,4,11,CRISIL Hybrid 35+65 - Aggressive Index,ICICI Pru Retirement Fund-Hybrid Aggressive Plan(G),9.19,2.31,3.56,1.6,15.6,13.51,38
Tata Housing Opportunities Fund-Reg(G),2022-09-02,46764,15.79,1.86,2.76,0.97,11.74,30.34,0.99,0.12,0.17,0.97,0.05,0.12,33,46,45,33,41,42,Nifty Housing - TRI,Tata Housing Opportunities Fund-Reg(G),15.66,2.27,3.42,0.91,17.47,37.03,52
Edelweiss Nifty Midcap150 Momentum 50 Index Fund-Reg(G),2022-11-30,47175,19.9,2.34,3.35,1.07,27.14,43.65,1.25,0.15,0.21,1.07,0.11,0.17,89,24,25,71,16,6,Nifty Midcap150 Momentum 50 - TRI,Edelweiss Nifty Midcap150 Momentum 50 Index Fund-Reg(G),16.43,1.97,3.0,0.99,14.45,32.95,101
DSP NIFTY 50 Index Fund-Reg(G),2019-02-21,41642,13.4,1.58,2.44,0.99,3.12,21.39,0.84,0.1,0.15,0.99,0.01,0.08,24,73,76,39,78,77,NIFTY 50 - TRI,DSP NIFTY 50 Index Fund-Reg(G),16.43,1.97,3.0,0.99,14.45,32.95,101
SBI Nifty Midcap 150 Index Fund-Reg(G),2022-10-03,45376,16.86,2.13,3.07,0.98,18.35,36.87,1.06,0.13,0.19,0.98,0.07,0.15,52,40,48,25,44,46,Nifty Midcap 150 - TRI,SBI Nifty Midcap 150 Index Fund-Reg(G),16.43,1.97,3.0,0.99,14.45,32.95,101
Baroda BNP Paribas Business Cycle Fund-Reg(G),2021-09-15,45686,14.17,2.47,3.6,0.93,18.09,37.72,0.89,0.16,0.23,0.93,0.07,0.15,24,15,16,27,23,24,BSE 500 - TRI,Baroda BNP Paribas Business Cycle Fund-Reg(G),15.66,2.27,3.42,0.91,17.47,37.03,52
PGIM India Large Cap Fund(G),2003-01-30,758,12.42,1.65,2.56,0.9,4.16,22.88,0.78,0.1,0.16,0.9,0.02,0.09,5,33,32,10,33,33,NIFTY 100 - TRI,PGIM India Large Cap Fund(G),13.81,1.99,3.03,0.94,10.16,29.09,36
Mirae Asset Overnight Fund-Reg(G),2019-10-15,44008,0.03,13.59,2.78,0.0,0.38,-2037.62,0.0,0.86,0.18,0.0,0.0,-8.09,27,24,9,21,11,27,Nifty 1D Rate Index,Mirae Asset Overnight Fund-Reg(G),0.04,26.72,4.08,0.0,0.48,-1478.06,34
Navi Nifty Next 50 Index Fund-Reg(G),2022-01-19,45860,19.21,2.53,3.68,1.12,28.02,43.14,1.21,0.16,0.23,1.12,0.11,0.17,82,19,21,91,9,19,NIFTY NEXT 50 - TRI,Navi Nifty Next 50 Index Fund-Reg(G),16.43,1.97,3.0,0.99,14.45,32.95,101
Aditya Birla SL Equity Savings Fund-Reg(G),2014-11-28,30757,2.55,2.54,4.21,0.42,5.29,15.57,0.16,0.16,0.27,0.42,0.02,0.06,6,15,11,7,50,18,NIFTY 50 Equity Savings Index - TRI,Aditya Birla SL Equity Savings Fund-Reg(G),7.75,2.24,3.41,1.24,14.36,14.98,52
Motilal Oswal Nifty Bank Index Fund-Reg(G),2019-09-06,43789,16.86,0.57,0.86,1.1,-10.46,8.74,1.06,0.04,0.05,1.1,-0.04,0.03,53,101,101,77,100,100,NIFTY BANK - TRI,Motilal Oswal Nifty Bank Index Fund-Reg(G),16.43,1.97,3.0,0.99,14.45,32.95,101
WOC Large Cap Fund-Reg(G),2022-12-01,47079,14.05,2.1,3.13,0.98,11.62,30.11,0.88,0.13,0.2,0.98,0.05,0.12,23,11,12,23,12,12,BSE 100 - TRI,WOC Large Cap Fund-Reg(G),13.81,1.99,3.03,0.94,10.16,29.09,36
HDFC Nifty G-Sec Sep 2032 Index Fund-Reg(G),2022-12-09,46872,2.11,2.53,4.25,1.06,2.27,5.07,0.13,0.16,0.27,1.06,0.01,0.02,18,19,22,19,23,18,Nifty G-Sec Sep 2032 Index,HDFC Nifty G-Sec Sep 2032 Index Fund-Reg(G),1.96,2.91,5.21,0.95,2.37,6.34,35
Franklin India Banking & PSU Debt Fund(G),2014-04-25,28458,0.55,6.51,12.15,0.2,2.97,17.67,0.03,0.41,0.77,0.2,0.01,0.07,3,2,4,9,7,7,NIFTY Banking and PSU Debt Index,Franklin India Banking & PSU Debt Fund(G),0.74,5.03,9.03,0.28,2.77,15.63,26
Motilal Oswal Manufacturing Fund-Reg(G),2024-08-08,48962,,,,,,,,,,,,,,,,,,,Nifty India Manufacturing - TRI,Motilal Oswal Manufacturing Fund-Reg(G),15.66,2.27,3.42,0.91,17.47,37.03,52
JM Aggressive Hybrid Fund(G),1995-04-01,1847,12.9,2.87,4.31,1.84,31.65,20.08,0.81,0.18,0.27,1.84,0.13,0.08,51,6,8,46,1,5,CRISIL Hybrid 35+65 - Aggressive Index,JM Aggressive Hybrid Fund(G),7.75,2.24,3.41,1.24,14.36,14.98,52
Mahindra Manulife Large Cap Fund-Reg(G),2019-03-15,38073,13.6,1.83,2.72,0.98,7.03,25.43,0.86,0.12,0.17,0.98,0.03,0.1,18,29,27,22,30,30,NIFTY 100 - TRI,Mahindra Manulife Large Cap Fund-Reg(G),13.81,1.99,3.03,0.94,10.16,29.09,36
Kotak Nifty SDL Plus AAA PSU Bond Jul 2028 60:40 Index Fund-Reg(G),2022-10-13,46730,1.06,3.8,7.89,0.36,2.97,11.14,0.07,0.24,0.5,0.36,0.01,0.04,23,26,25,22,31,23,Nifty SDL Plus AAA PSU Bond Jul 2028 60:40 Index,Kotak Nifty SDL Plus AAA PSU Bond Jul 2028 60:40 Index Fund-Reg(G),1.24,3.76,7.28,0.49,2.77,11.01,52
HDFC BSE Sensex ETF,2015-12-09,34084,13.31,1.4,2.19,0.99,2.04,18.8,0.84,0.09,0.14,0.99,0.01,0.07,29,98,104,72,112,106,BSE SENSEX - TRI,HDFC BSE Sensex ETF,16.29,1.83,2.98,1.08,13.44,15.21,136
HSBC Credit Risk Fund-Reg(G),2009-10-08,8016,0.58,5.08,8.85,0.24,2.24,12.25,0.04,0.32,0.56,0.24,0.01,0.05,3,6,9,10,12,11,NIFTY Credit Risk Bond Index,HSBC Credit Risk Fund-Reg(G),1.43,4.48,10.86,0.23,3.84,0.74,15
Edelweiss Overnight Fund-Reg(G),2019-07-24,42955,0.01,32.14,2.35,0.0,0.33,-768.88,0.0,2.02,0.15,0.0,0.0,-3.05,16,16,25,9,20,7,CRISIL Liquid Overnight Index,Edelweiss Overnight Fund-Reg(G),0.04,26.72,4.08,0.0,0.48,-1478.06,34
Motilal Oswal Nifty 50 Index Fund-Reg(G),2019-12-23,44366,13.41,1.57,2.43,0.99,3.02,21.27,0.84,0.1,0.15,0.99,0.01,0.08,28,77,80,48,81,83,NIFTY 50 - TRI,Motilal Oswal Nifty 50 Index Fund-Reg(G),16.43,1.97,3.0,0.99,14.45,32.95,101
Franklin India Ultra Short Duration Fund-Reg(G),2024-08-29,49073,,,,,,,,,,,,,,,,,,,NIFTY Ultra Short Duration Debt Index,Franklin India Ultra Short Duration Fund-Reg(G),0.3,9.78,20.72,0.01,2.9,255.56,24
Union Business Cycle Fund-Reg(G),2024-03-05,48599,,,,,,,,,,,,,,,,,,,NIFTY 500 - TRI,Union Business Cycle Fund-Reg(G),15.66,2.27,3.42,0.91,17.47,37.03,52
DSP Gold ETF,2023-04-28,47938,11.95,1.51,2.38,0.57,16.66,31.5,0.75,0.1,0.15,0.57,0.07,0.12,1,4,3,10,12,11,Gold-India,DSP Gold ETF,17.25,1.19,1.89,0.82,16.24,28.48,22
LIC MF Aggressive Hybrid Fund(G),1991-01-01,2085,10.74,2.17,3.21,1.74,18.27,13.38,0.68,0.14,0.2,1.74,0.07,0.05,44,32,35,42,14,31,CRISIL Hybrid 35+65 - Aggressive Index,LIC MF Aggressive Hybrid Fund(G),7.75,2.24,3.41,1.24,14.36,14.98,52
ICICI Pru Nifty Midcap 150 Index Fund-Reg(G),2021-12-22,46108,16.89,2.14,3.07,0.97,18.37,37.12,1.06,0.13,0.19,0.97,0.07,0.15,56,38,46,20,43,44,Nifty Midcap 150 - TRI,ICICI Pru Nifty Midcap 150 Index Fund-Reg(G),16.43,1.97,3.0,0.99,14.45,32.95,101
SBI FMP-67-1467D-Reg(G),2022-07-29,46703,0.5,2.26,3.87,0.16,0.78,7.08,0.03,0.14,0.24,0.16,0.0,0.03,27,69,72,37,76,72,CRISIL Medium to Long Term Debt Index,SBI FMP-67-1467D-Reg(G),0.67,4.58,9.19,0.19,2.25,-152.64,91
Mahindra Manulife Low Duration Fund-Reg(G),2017-02-15,36894,0.33,8.72,16.35,0.06,2.75,50.35,0.02,0.55,1.03,0.06,0.01,0.2,5,16,18,11,16,15,CRISIL Low Duration Debt Index,Mahindra Manulife Low Duration Fund-Reg(G),0.34,9.08,17.79,0.06,2.96,56.98,20
Canara Rob Ultra Short Term Fund-Reg(G),2008-07-11,5902,0.29,9.17,18.98,0.02,2.57,132.02,0.02,0.58,1.2,0.02,0.01,0.52,6,17,20,22,20,23,CRISIL Ultra Short Term Debt Index,Canara Rob Ultra Short Term Fund-Reg(G),0.3,9.78,20.72,0.01,2.9,255.56,24
Invesco India ESG Integration Strategy Fund-Reg(G),2021-03-20,45348,13.6,2.1,3.23,0.9,12.15,31.8,0.86,0.13,0.2,0.9,0.05,0.13,21,32,30,23,40,38,NIFTY100 ESG - TRI,Invesco India ESG Integration Strategy Fund-Reg(G),15.66,2.27,3.42,0.91,17.47,37.03,52
Mahindra Manulife Equity Savings Fund-Reg(G),2017-02-01,36671,5.71,1.93,2.77,0.86,8.52,12.78,0.36,0.12,0.17,0.86,0.03,0.05,21,43,46,18,42,35,NIFTY 50 Equity Savings Index - TRI,Mahindra Manulife Equity Savings Fund-Reg(G),7.75,2.24,3.41,1.24,14.36,14.98,52
PGIM India Large and Mid Cap Fund(G),2024-02-12,48543,,,,,,,,,,,,,,,,,,,NIFTY LargeMidcap 250 - TRI,PGIM India Large and Mid Cap Fund(G),14.92,2.24,3.29,0.89,16.03,35.36,26
Kotak Technology Fund-Reg(G),2024-03-04,48587,,,,,,,,,,,,,,,,,,,BSE TECk Index - TRI,Kotak Technology Fund-Reg(G),15.94,1.99,3.84,0.77,17.35,40.53,7
Motilal Oswal Nifty Midcap 100 ETF,2011-02-03,13595,18.2,2.1,3.0,1.06,20.46,36.09,1.15,0.13,0.19,1.06,0.08,0.14,101,58,61,91,44,54,Nifty Midcap 100 - TRI,Motilal Oswal Nifty Midcap 100 ETF,16.29,1.83,2.98,1.08,13.44,15.21,136
Quantum Liquid Fund-Reg(G),2006-04-07,19756,0.05,9.91,3.95,0.0,0.53,2590.01,0.0,0.62,0.25,0.0,0.0,10.28,2,26,36,34,36,4,CRISIL Liquid Debt Index,Quantum Liquid Fund-Reg(G),0.09,10.4,6.88,0.0,0.89,-1539.37,37
Axis Nifty 50 Index Fund-Reg(G),2021-12-03,45701,13.34,1.58,2.43,0.99,3.1,21.29,0.84,0.1,0.15,0.99,0.01,0.08,10,75,78,32,79,81,NIFTY 50 - TRI,Axis Nifty 50 Index Fund-Reg(G),16.43,1.97,3.0,0.99,14.45,32.95,101
Aditya Birla SL BSE Sensex ETF,2016-07-18,35815,13.38,1.4,2.18,1.0,1.61,18.8,0.84,0.09,0.14,1.0,0.01,0.07,42,99,107,82,118,107,BSE SENSEX - TRI,Aditya Birla SL BSE Sensex ETF,16.29,1.83,2.98,1.08,13.44,15.21,136
DSP Nifty Bank ETF,2023-01-03,46468,16.88,0.61,0.91,1.11,-8.27,9.3,1.06,0.04,0.06,1.11,-0.03,0.04,83,129,128,110,129,126,NIFTY BANK - TRI,DSP Nifty Bank ETF,16.29,1.83,2.98,1.08,13.44,15.21,136
LIC MF ULIS,1989-06-19,2154,10.06,1.73,2.69,1.21,13.89,14.39,0.63,0.11,0.17,1.21,0.06,0.06,19,37,34,12,23,13,CRISIL Hybrid 35+65 - Aggressive Index,LIC MF ULIS,9.19,2.31,3.56,1.6,15.6,13.51,38
Franklin India Pension Plan(G),1997-03-31,3396,5.65,2.4,3.51,0.95,10.81,14.24,0.36,0.15,0.22,0.95,0.04,0.06,13,13,15,8,28,15,CRISIL Short Term Debt Hybrid 60+40 Index,Franklin India Pension Plan(G),9.19,2.31,3.56,1.6,15.6,13.51,38
ICICI Pru Nifty 10 yr Benchmark G-Sec ETF,2022-12-13,47331,2.41,2.29,3.81,1.17,2.62,4.71,0.15,0.14,0.24,1.17,0.01,0.02,5,3,3,3,1,2,Nifty 10 yr Benchmark G-Sec,ICICI Pru Nifty 10 yr Benchmark G-Sec ETF,2.38,2.29,3.81,1.18,2.1,4.62,6
Nippon India ETF Hang Seng BeES,2010-03-09,8564,21.28,-0.06,-0.11,2.28,-7.69,-0.58,1.34,0.0,-0.01,2.28,-0.03,0.0,126,135,135,133,120,133,Hang Seng,Nippon India ETF Hang Seng BeES,16.29,1.83,2.98,1.08,13.44,15.21,136
Invesco India Aggressive Hybrid Fund-Reg(G),2018-06-30,39893,10.95,2.77,4.21,1.94,24.72,15.65,0.69,0.17,0.27,1.94,0.1,0.06,46,8,10,47,3,17,CRISIL Hybrid 35+65 - Aggressive Index,Invesco India Aggressive Hybrid Fund-Reg(G),7.75,2.24,3.41,1.24,14.36,14.98,52
WOC Special Opp Fund-Reg(G),2024-06-04,48833,,,,,,,,,,,,,,,,,,,BSE 500 - TRI,WOC Special Opp Fund-Reg(G),15.66,2.27,3.42,0.91,17.47,37.03,52
UTI Nifty 500 Value 50 Index Fund-Reg(G),2023-05-10,47577,25.17,2.07,2.92,1.43,25.91,36.31,1.59,0.13,0.18,1.43,0.1,0.14,100,53,53,100,21,49,NIFTY500 Value 50 - TRI,UTI Nifty 500 Value 50 Index Fund-Reg(G),16.43,1.97,3.0,0.99,14.45,32.95,101
UTI BSE Low Volatility Index Fund-Reg(G),2022-03-03,46409,10.84,2.66,4.68,0.65,16.88,44.02,0.68,0.17,0.3,0.65,0.07,0.17,3,4,4,2,48,5,BSE Low Volatility Index - TRI,UTI BSE Low Volatility Index Fund-Reg(G),16.43,1.97,3.0,0.99,14.45,32.95,101
Navi Nifty Bank Index Fund-Reg(G),2022-02-04,45873,16.91,0.57,0.86,1.11,-10.48,8.74,1.07,0.04,0.05,1.11,-0.04,0.03,58,100,100,79,101,101,NIFTY BANK - TRI,Navi Nifty Bank Index Fund-Reg(G),16.43,1.97,3.0,0.99,14.45,32.95,101
Invesco India Overnight Fund-Reg(G),2020-01-08,44317,0.01,24.8,2.73,0.0,0.38,-833.82,0.0,1.56,0.17,0.0,0.0,-3.31,19,20,11,13,10,11,Nifty 1D Rate Index,Invesco India Overnight Fund-Reg(G),0.04,26.72,4.08,0.0,0.48,-1478.06,34
Axis Gilt Fund-Reg(G),2012-01-23,15652,2.37,2.86,5.25,1.27,3.07,5.32,0.15,0.18,0.33,1.27,0.01,0.02,24,12,11,28,2,15,CRISIL Dynamic Gilt Index,Axis Gilt Fund-Reg(G),1.96,2.91,5.21,0.95,2.37,6.34,35
UTI Equity Savings Fund-Reg(G),2018-08-30,35818,3.95,2.75,4.65,0.72,8.74,14.97,0.25,0.17,0.29,0.72,0.03,0.06,11,9,7,14,41,21,Crisil Equity Savings Index,UTI Equity Savings Fund-Reg(G),7.75,2.24,3.41,1.24,14.36,14.98,52
Bank of India Mfg & Infra Fund-Reg(G),2010-03-05,8484,17.48,2.44,3.42,1.03,23.89,41.38,1.1,0.15,0.22,1.03,0.09,0.16,4,8,6,4,11,8,BSE India Infrastructure Index - TRI,Bank of India Mfg & Infra Fund-Reg(G),19.03,2.32,3.25,1.1,23.93,40.16,19
ITI Focused Equity Fund-Reg(G),2023-06-19,45722,16.62,2.11,2.98,1.03,16.3,34.1,1.05,0.13,0.19,1.03,0.06,0.14,39,22,29,35,16,19,NIFTY 500 - TRI,ITI Focused Equity Fund-Reg(G),14.39,2.16,3.2,0.94,13.96,33.2,45
360 ONE Quant Fund-Reg(G),2021-11-29,46015,18.31,2.48,3.54,1.09,25.53,41.73,1.15,0.16,0.22,1.09,0.1,0.17,42,14,19,42,7,13,BSE 200 - TRI,360 ONE Quant Fund-Reg(G),15.66,2.27,3.42,0.91,17.47,37.03,52
Nippon India Nifty Next 50 Junior BeES FoF-Reg(G),2019-03-08,40664,15.53,3.11,5.13,1.76,43.27,27.42,0.98,0.2,0.32,1.76,0.17,0.11,47,7,8,38,1,7,NIFTY NEXT 50,Nippon India Nifty Next 50 Junior BeES FoF-Reg(G),9.16,2.38,3.86,1.09,15.55,21.19,53
Mirae Asset Nifty 1D Rate Liquid ETF,2023-07-27,48119,0.05,4.11,1.5,0.0,0.2,-129.07,0.0,0.26,0.09,0.0,0.0,-0.51,1,9,18,2,18,17,Nifty 1D Rate Index,Mirae Asset Nifty 1D Rate Liquid ETF,1.05,4.54,6.56,0.42,2.57,-405.22,19
Bandhan CRISIL IBX Gilt April 2026 Index Fund-Reg(G),2022-10-20,46815,0.6,5.83,11.83,0.23,2.87,15.57,0.04,0.37,0.75,0.23,0.01,0.06,1,1,1,1,6,1,CRISIL IBX Gilt Index - April 2026,Bandhan CRISIL IBX Gilt April 2026 Index Fund-Reg(G),1.96,2.91,5.21,0.95,2.37,6.34,35
ICICI Pru Nifty IT ETF,2020-08-17,44401,19.16,1.38,2.78,0.79,13.28,33.54,1.21,0.09,0.18,0.79,0.05,0.13,109,104,72,33,71,59,NIFTY IT - TRI,ICICI Pru Nifty IT ETF,16.29,1.83,2.98,1.08,13.44,15.21,136
ICICI Pru Nifty Bank Index Fund-Reg(G),2022-03-02,45994,16.84,0.59,0.88,1.1,-10.21,8.97,1.06,0.04,0.06,1.1,-0.04,0.04,51,99,99,76,99,99,NIFTY BANK - TRI,ICICI Pru Nifty Bank Index Fund-Reg(G),16.43,1.97,3.0,0.99,14.45,32.95,101
Quant Commodities Fund-Reg(G),2023-12-27,48343,,,,,,,,,,,,,,,,,,,NIFTY COMMODITIES - TRI,Quant Commodities Fund-Reg(G),15.66,2.27,3.42,0.91,17.47,37.03,52
Bandhan Bond Fund - Income Plan-Reg(G),2000-07-14,1090,2.26,1.89,3.17,1.17,0.91,3.65,0.14,0.12,0.2,1.17,0.0,0.01,10,19,19,10,19,19,NIFTY Medium to Long Duration Debt Index,Bandhan Bond Fund - Income Plan-Reg(G),2.51,2.38,4.14,1.2,2.45,5.25,19
HDFC NIFTY Smallcap 250 ETF,2023-02-15,46874,19.19,2.1,2.94,0.99,23.71,40.62,1.21,0.13,0.19,0.99,0.09,0.16,111,57,63,57,38,40,Nifty Smallcap 250 - TRI,HDFC NIFTY Smallcap 250 ETF,16.29,1.83,2.98,1.08,13.44,15.21,136
ICICI Pru Nifty IT Index Fund-Reg(G),2022-08-18,46707,19.28,1.35,2.68,0.78,11.67,33.14,1.21,0.08,0.17,0.78,0.05,0.13,85,95,69,7,61,54,NIFTY IT - TRI,ICICI Pru Nifty IT Index Fund-Reg(G),16.43,1.97,3.0,0.99,14.45,32.95,101
HSBC Low Duration Fund-Reg(G),2010-12-04,13350,0.34,9.44,17.83,0.05,3.1,65.6,0.02,0.59,1.12,0.05,0.01,0.26,11,5,11,5,5,4,NIFTY Low Duration Debt Index,HSBC Low Duration Fund-Reg(G),0.34,9.08,17.79,0.06,2.96,56.98,20
Quant Teck Fund-Reg(G),2023-09-11,48195,17.41,1.82,3.03,0.91,15.17,34.98,1.1,0.11,0.19,0.91,0.06,0.14,7,6,7,7,5,6,BSE TECk Index - TRI,Quant Teck Fund-Reg(G),15.94,1.99,3.84,0.77,17.35,40.53,7
UTI Dynamic Bond Fund-Reg(G),2010-06-23,11896,1.9,2.43,3.91,0.92,1.94,5.04,0.12,0.15,0.25,0.92,0.01,0.02,11,16,19,10,18,15,CRISIL Dynamic Bond Index,UTI Dynamic Bond Fund-Reg(G),1.8,3.11,5.49,0.87,2.35,15.07,22
SBI FMP-42-1857D-Reg(G),2021-03-30,45447,0.46,2.24,3.89,0.12,0.76,8.34,0.03,0.14,0.25,0.12,0.0,0.03,22,70,70,24,77,64,CRISIL Medium to Long Term Debt Index,SBI FMP-42-1857D-Reg(G),0.67,4.58,9.19,0.19,2.25,-152.64,91
PGIM India Liquid Fund(G),2007-09-04,818,0.07,9.8,5.22,0.0,0.71,-957.35,0.0,0.62,0.33,0.0,0.0,-3.8,20,30,29,16,27,17,CRISIL Liquid Debt Index,PGIM India Liquid Fund(G),0.09,10.4,6.88,0.0,0.89,-1539.37,37
Nippon India Nifty AAA PSU Bond Plus SDL - Sep 2026 Maturity 50:50 Index Fund-Reg(G),2022-10-27,47034,0.61,5.76,11.94,0.19,2.97,18.57,0.04,0.36,0.75,0.19,0.01,0.07,7,7,5,7,6,6,Nifty AAA PSU Bond Plus SDL Sep 2026 50:50 Index,Nippon India Nifty AAA PSU Bond Plus SDL - Sep 2026 Maturity 50:50 Index Fund-Reg(G),0.74,5.03,9.03,0.28,2.77,15.63,26
HDFC FMP-Sr 46-1861D-Mar 2022-Reg(G),2022-03-09,46453,0.85,4.85,9.54,0.31,3.2,13.31,0.05,0.31,0.6,0.31,0.01,0.05,79,44,45,81,24,47,NIFTY Medium to Long Duration Debt Index,HDFC FMP-Sr 46-1861D-Mar 2022-Reg(G),0.67,4.58,9.19,0.19,2.25,-152.64,91
ICICI Pru Nifty 200 Momentum 30 Index Fund-Reg(G),2022-08-05,46683,20.74,2.2,3.24,1.16,24.52,39.31,1.31,0.14,0.2,1.16,0.1,0.16,93,32,33,94,29,37,Nifty200 Momentum 30 - TRI,ICICI Pru Nifty 200 Momentum 30 Index Fund-Reg(G),16.43,1.97,3.0,0.99,14.45,32.95,101
Axis Credit Risk Fund-Reg(G),2014-07-15,23018,0.56,6.66,12.19,0.21,3.15,17.74,0.04,0.42,0.77,0.21,0.01,0.07,2,3,5,8,10,7,CRISIL Credit Risk Debt Index,Axis Credit Risk Fund-Reg(G),1.43,4.48,10.86,0.23,3.84,0.74,15
Kotak FMP-292-1735D(G),2021-08-13,45679,0.7,5.34,12.7,0.18,3.23,20.99,0.04,0.34,0.8,0.18,0.01,0.08,56,26,20,46,22,18,CRISIL Composite Bond Index,Kotak FMP-292-1735D(G),0.67,4.58,9.19,0.19,2.25,-152.64,91
Kotak FMP-292-1735D(IDCW),2021-08-13,45790,0.7,5.34,12.7,0.18,3.23,20.99,0.04,0.34,0.8,0.18,0.01,0.08,55,27,21,45,23,17,NIFTY Medium to Long Duration Debt Index,Kotak FMP-292-1735D(IDCW),0.67,4.58,9.19,0.19,2.25,-152.64,91
ICICI Pru FMP-85-10Y-I(G),2019-03-15,43023,1.56,3.17,5.79,0.29,4.11,17.14,0.1,0.2,0.36,0.29,0.02,0.07,89,53,53,80,3,27,CRISIL Composite Bond Index,ICICI Pru FMP-85-10Y-I(G),0.67,4.58,9.19,0.19,2.25,-152.64,91
Quant Healthcare Fund-Reg(G),2023-07-17,48035,16.89,2.72,4.32,0.74,32.58,62.52,1.06,0.17,0.27,0.74,0.13,0.25,12,11,12,12,7,12,BSE Health Care - TRI,Quant Healthcare Fund-Reg(G),12.79,3.25,5.93,0.46,32.72,89.59,12
Union Focused Fund-Reg(G),2019-08-05,22068,14.81,1.37,1.97,0.99,2.32,20.59,0.93,0.09,0.12,0.99,0.01,0.08,22,34,34,25,34,34,BSE 500 - TRI,Union Focused Fund-Reg(G),14.46,2.19,3.24,0.87,14.86,34.59,34
Axis Nifty Smallcap 50 Index Fund-Reg(G),2022-03-10,45856,20.55,2.22,3.24,1.08,25.93,42.13,1.29,0.14,0.2,1.08,0.1,0.17,90,29,35,73,20,25,Nifty Smallcap 50 - TRI,Axis Nifty Smallcap 50 Index Fund-Reg(G),16.43,1.97,3.0,0.99,14.45,32.95,101
Aditya Birla SL CRISIL IBX 50:50 Gilt Plus SDL Apr 2028 Index Fund-Reg(G),2022-10-13,46897,1.02,4.22,8.19,0.42,3.07,10.31,0.06,0.27,0.52,0.42,0.01,0.04,20,19,21,28,18,28,CRISIL IBX 50:50 Gilt Plus SDL Index - April 2028,Aditya Birla SL CRISIL IBX 50:50 Gilt Plus SDL Apr 2028 Index Fund-Reg(G),1.24,3.76,7.28,0.49,2.77,11.01,52
Nippon India Nifty G-Sec Sep 2027 Maturity Index Fund-Reg(G),2022-12-06,47186,1.04,3.92,7.06,0.42,2.85,9.63,0.07,0.25,0.44,0.42,0.01,0.04,6,6,6,6,7,6,Nifty G-Sec Sep 2027 Index,Nippon India Nifty G-Sec Sep 2027 Maturity Index Fund-Reg(G),1.96,2.91,5.21,0.95,2.37,6.34,35
ICICI Pru Nifty Midcap 150 ETF,2020-01-24,44494,16.99,2.17,3.12,0.98,20.44,37.55,1.07,0.14,0.2,0.98,0.08,0.15,93,49,56,51,46,49,Nifty Midcap 150 - TRI,ICICI Pru Nifty Midcap 150 ETF,16.29,1.83,2.98,1.08,13.44,15.21,136
Aditya Birla SL Retirement Fund-30-Reg(G),2019-03-11,32078,13.59,1.91,2.73,2.22,19.56,11.69,0.86,0.12,0.17,2.22,0.08,0.05,31,30,32,34,14,24,NIFTY 500 - TRI,Aditya Birla SL Retirement Fund-30-Reg(G),9.19,2.31,3.56,1.6,15.6,13.51,38
Aditya Birla SL Silver ETF,2022-01-31,46194,22.33,0.85,1.42,2.01,13.99,9.37,1.41,0.05,0.09,2.01,0.06,0.04,15,15,16,19,20,19,Silver,Aditya Birla SL Silver ETF,17.25,1.19,1.89,0.82,16.24,28.48,22
Axis Nifty Midcap 50 Index Fund-Reg(G),2022-03-28,46459,18.47,1.91,2.84,1.07,15.93,33.04,1.16,0.12,0.18,1.07,0.06,0.13,63,62,60,72,51,56,Nifty Midcap 50 - TRI,Axis Nifty Midcap 50 Index Fund-Reg(G),16.43,1.97,3.0,0.99,14.45,32.95,101
Edelweiss ELSS Tax saver Fund-Reg(G),2008-12-30,7545,14.38,2.06,3.03,1.0,11.29,29.48,0.91,0.13,0.19,1.0,0.04,0.12,32,30,30,50,41,42,NIFTY 500 - TRI,Edelweiss ELSS Tax saver Fund-Reg(G),14.34,2.1,3.13,0.91,13.54,33.36,59
Bandhan CRISIL IBX Gilt April 2032 Index Fund-Reg(G),2023-02-15,47601,2.0,2.57,4.26,1.02,2.19,5.04,0.13,0.16,0.27,1.02,0.01,0.02,5,6,8,7,18,10,CRISIL IBX Gilt Index - April 2032,Bandhan CRISIL IBX Gilt April 2032 Index Fund-Reg(G),2.51,2.38,4.14,1.2,2.45,5.25,19
