MF Code,incept_date,schemecode,sdx_returns,sharpex_returns,sotinox_returns,betax_returns,alphax_returns,treynorx_returns,sdy_returns,sharpey_returns,sotinoy_returns,betay_returns,alphay_returns,treynory_returns,rank_sd,rank_sharpe,rank_sotino,rank_beta,rank_alpha,rank_treynor,index_name,s_name,avg_std_dev,avg_sharpe,avg_sotino,avg_beta,avg_alpha,avg_treyno,no_of_funds_total
Baroda BNP Paribas Credit Risk Fund-Reg(G),2015-01-23,25569,0.57,8.19,17.7,0.03,4.56,138.42,0.04,0.52,1.12,0.03,0.02,0.55,5,2,4,5,4,3,CRISIL Credit Risk Debt Index,Baroda BNP Paribas Credit Risk Fund-Reg(G),1.34,5.39,14.31,0.05,4.51,-29.91,15
HDFC FMP-Sr 46-1158D-July 2022-Reg(G),2022-07-26,46672,0.58,6.89,14.81,0.04,3.86,95.58,0.04,0.43,0.93,0.04,0.02,0.38,28,20,20,36,27,16,CRISIL Medium Duration Debt Index,HDFC FMP-Sr 46-1158D-July 2022-Reg(G),0.76,5.46,11.21,0.05,3.05,820.15,93
SBI FMP-76-1221D-Reg(G),2023-01-24,47541,0.61,2.68,5.17,0.08,1.51,21.62,0.04,0.17,0.33,0.08,0.01,0.09,34,73,76,54,89,70,CRISIL Medium Duration Debt Index,SBI FMP-76-1221D-Reg(G),0.76,5.46,11.21,0.05,3.05,820.15,93
LIC MF Dividend Yield Fund-Reg(G),2018-12-21,41332,11.78,3.55,5.66,0.87,26.76,48.16,0.74,0.22,0.36,0.87,0.11,0.19,8,2,3,6,2,2,NIFTY 500 - TRI,LIC MF Dividend Yield Fund-Reg(G),10.99,3.31,5.45,0.85,21.62,42.98,9
DSP World Mining Fund-Reg(G),2009-12-29,8359,23.35,0.07,0.12,0.55,-0.13,2.9,1.47,0.0,0.01,0.55,0.0,0.01,54,46,46,44,46,45,MSCI ACWI Metals & Mining 30% Buffer 10/40 (1994) Net TRI,DSP World Mining Fund-Reg(G),15.56,1.08,1.95,0.42,15.13,69.84,56
HDFC NIFTY 100 Index Fund-Reg(G),2022-02-23,45996,9.97,2.48,4.21,0.95,8.27,26.11,0.63,0.16,0.27,0.95,0.03,0.1,20,59,59,61,61,61,NIFTY 100 - TRI,HDFC NIFTY 100 Index Fund-Reg(G),12.11,2.8,4.55,0.87,19.56,41.14,91
Axis NIFTY IT ETF,2021-03-25,45427,17.87,0.93,1.78,0.98,1.03,16.96,1.13,0.06,0.11,0.98,0.0,0.07,115,111,110,93,111,111,NIFTY IT - TRI,Axis NIFTY IT ETF,12.82,2.39,4.07,0.86,16.67,42.97,129
Kotak FMP-323-90D(G),2023-11-03,48318,,,,,,,,,,,,,,,,,,,Nifty Liquid Fund Index,Kotak FMP-323-90D(G),0.76,5.46,11.21,0.05,3.05,820.15,93
HDFC Silver ETF,2022-09-02,46223,24.52,0.28,0.46,0.92,4.61,7.36,1.54,0.02,0.03,0.92,0.02,0.03,21,19,19,14,14,14,Silver,HDFC Silver ETF,14.34,0.96,1.74,0.5,9.65,30.86,21
Mahindra Manulife Overnight Fund-Reg(G),2019-07-23,42560,0.01,193.11,12.95,0.0,1.69,11584.09,0.0,12.16,0.82,0.0,0.01,45.97,10,6,16,17,23,16,CRISIL Liquid Overnight Index,Mahindra Manulife Overnight Fund-Reg(G),0.04,125.84,16.27,0.0,1.88,9698.26,32
Edelweiss CRISIL IBX 50:50 Gilt Plus SDL Short Duration Index Fund-Reg(G),2023-02-15,47430,0.82,4.51,8.92,0.08,3.45,44.15,0.05,0.28,0.56,0.08,0.01,0.18,20,20,21,20,15,21,CRISIL IBX 50:50 Gilt Plus SDL Short Duration Index,Edelweiss CRISIL IBX 50:50 Gilt Plus SDL Short Duration Index Fund-Reg(G),0.73,5.19,10.43,0.07,3.41,311.55,26
Canara Rob Corp Bond Fund-Reg(G),2014-02-07,23504,0.63,5.43,10.54,0.07,3.25,52.42,0.04,0.34,0.66,0.07,0.01,0.21,4,9,8,7,20,12,CRISIL Corporate Bond Index,Canara Rob Corp Bond Fund-Reg(G),0.74,5.45,10.35,0.07,3.7,71.42,21
Baroda BNP Paribas Corp Bond Fund(G),2008-11-08,6932,0.94,4.08,7.48,0.08,3.6,46.22,0.06,0.26,0.47,0.08,0.01,0.18,20,20,20,19,11,19,CRISIL Corporate Bond Index,Baroda BNP Paribas Corp Bond Fund(G),0.74,5.45,10.35,0.07,3.7,71.42,21
SBI FMP-74-1243D-Reg(G),2023-01-03,47381,0.58,3.1,6.49,0.04,1.74,50.7,0.04,0.2,0.41,0.04,0.01,0.2,30,64,64,25,70,25,CRISIL Medium Duration Debt Index,SBI FMP-74-1243D-Reg(G),0.76,5.46,11.21,0.05,3.05,820.15,93
Bank of India Ultra Short Duration Fund-Reg(G),2008-07-16,5842,0.27,13.38,27.83,0.0,3.65,-3848.57,0.02,0.84,1.75,0.0,0.01,-15.27,4,20,22,11,21,14,CRISIL Ultra Short Term Debt Index,Bank of India Ultra Short Duration Fund-Reg(G),0.29,14.2,29.59,0.0,4.16,-4812.46,24
Mirae Asset Money Market Fund-Reg(G),2021-08-11,45753,0.31,14.56,30.81,0.0,4.49,-3609.19,0.02,0.92,1.94,0.0,0.02,-14.32,7,11,9,3,13,8,Nifty Money Market Index,Mirae Asset Money Market Fund-Reg(G),0.31,14.36,30.17,0.0,4.51,-3587.18,21
SBI FMP-80-366D-Reg(G),2023-03-21,47805,0.18,12.77,17.39,0.0,2.32,867.18,0.01,0.8,1.1,0.0,0.01,3.44,1,11,15,15,58,3,NIFTY Low Duration Debt Index,SBI FMP-80-366D-Reg(G),0.76,5.46,11.21,0.05,3.05,820.15,93
Franklin India G-Sec Fund(G),2001-12-07,3373,1.09,2.24,4.1,0.14,2.04,17.77,0.07,0.14,0.26,0.14,0.01,0.07,3,10,10,4,35,13,Nifty All Duration G-Sec Index,Franklin India G-Sec Fund(G),1.98,2.12,3.98,0.22,3.19,19.24,35
Kotak FMP-328-90D(G),2024-02-16,48490,,,,,,,,,,,,,,,,,,,Nifty Liquid Fund Index,Kotak FMP-328-90D(G),0.76,5.46,11.21,0.05,3.05,820.15,93
360 ONE Quant Fund-Reg(G),2021-11-29,46015,12.44,3.83,6.15,0.8,33.69,59.55,0.78,0.24,0.39,0.8,0.13,0.24,35,7,8,22,6,8,S&P BSE 200 - TRI,360 ONE Quant Fund-Reg(G),11.31,3.14,5.18,0.82,21.14,43.21,44
Edelweiss Government Securities Fund-Reg(G),2014-02-13,21922,2.65,1.58,2.96,0.29,3.35,14.21,0.17,0.1,0.19,0.29,0.01,0.06,33,30,26,31,12,27,CRISIL Dynamic Gilt Index,Edelweiss Government Securities Fund-Reg(G),1.98,2.12,3.98,0.22,3.19,19.24,35
Edelweiss MSCI India Domestic & World Healthcare 45 Index Fund-Reg(G),2020-10-26,45117,9.92,3.26,6.24,0.39,25.91,83.61,0.63,0.21,0.39,0.39,0.1,0.33,6,41,3,1,41,1,MSCI India Domestic & World Healthcare 45 Index,Edelweiss MSCI India Domestic & World Healthcare 45 Index Fund-Reg(G),12.11,2.8,4.55,0.87,19.56,41.14,91
Canara Rob Overnight Fund-Reg(G),2019-07-24,43350,0.01,180.51,12.86,0.0,1.71,19371.11,0.0,11.37,0.81,0.0,0.01,76.87,8,11,22,14,16,9,CRISIL Liquid Overnight Index,Canara Rob Overnight Fund-Reg(G),0.04,125.84,16.27,0.0,1.88,9698.26,32
HDFC FMP-Sr 47-2638D-Feb 2023-Reg(G),2023-02-23,47642,2.23,1.79,3.07,0.24,3.33,16.61,0.14,0.11,0.19,0.24,0.01,0.07,92,89,89,92,55,81,NIFTY Long Duration Debt Index,HDFC FMP-Sr 47-2638D-Feb 2023-Reg(G),0.76,5.46,11.21,0.05,3.05,820.15,93
Baroda BNP Paribas Dynamic Bond Fund(G),2004-09-23,116,1.71,2.0,3.63,0.19,2.9,18.24,0.11,0.13,0.23,0.19,0.01,0.07,11,17,15,15,17,17,CRISIL Dynamic Bond Index,Baroda BNP Paribas Dynamic Bond Fund(G),1.69,2.77,5.2,0.17,3.2,-709.63,22
Bajaj Finserv Nifty Bank ETF,2024-01-19,48462,,,,,,,,,,,,,,,,,,,NIFTY BANK - TRI,Bajaj Finserv Nifty Bank ETF,12.82,2.39,4.07,0.86,16.67,42.97,129
Helios Balanced Advantage Fund-Reg(G),2024-03-27,48678,,,,,,,,,,,,,,,,,,,CRISIL Hybrid 50+50 - Moderate Index,Helios Balanced Advantage Fund-Reg(G),6.46,3.21,5.37,0.2,19.79,114.89,26
WOC Banking & Financial Services Fund-Reg(G),2024-02-06,48332,,,,,,,,,,,,,,,,,,,Nifty Financial Services - TRI,WOC Banking & Financial Services Fund-Reg(G),11.83,1.94,3.24,0.94,6.26,24.02,15
Nippon India ETF Nifty 5 yr Benchmark G-Sec,2021-04-07,45428,1.6,2.39,4.25,0.19,3.38,20.31,0.1,0.15,0.27,0.19,0.01,0.08,12,12,12,12,9,11,Nifty 5 yr Benchmark G-Sec Index TRI,Nippon India ETF Nifty 5 yr Benchmark G-Sec,1.27,6.3,10.34,0.23,3.44,31.99,17
Invesco India Credit Risk Fund(G),2014-09-04,21522,1.67,3.05,15.47,0.06,4.91,81.8,0.11,0.19,0.97,0.06,0.02,0.32,13,12,6,13,2,10,NIFTY Credit Risk Bond Index,Invesco India Credit Risk Fund(G),1.34,5.39,14.31,0.05,4.51,-29.91,15
Tata Equity Savings Fund-Reg(G),2000-04-27,3273,3.39,3.56,6.25,0.09,11.82,130.54,0.21,0.22,0.39,0.09,0.05,0.52,11,17,15,13,44,17,NIFTY 50 Equity Savings Index,Tata Equity Savings Fund-Reg(G),5.71,3.2,5.42,0.16,18.49,134.87,53
Bank of India Credit Risk Fund-Reg(G),2015-02-27,30390,1.13,3.54,20.23,0.0,4.01,-1239.03,0.07,0.22,1.27,0.0,0.02,-4.92,11,11,2,2,8,15,CRISIL Credit Risk Debt Index,Bank of India Credit Risk Fund-Reg(G),1.34,5.39,14.31,0.05,4.51,-29.91,15
DSP World Energy Fund-Reg(G),2009-08-14,7866,16.82,-0.22,-0.38,0.79,-6.12,-4.59,1.06,-0.01,-0.02,0.79,-0.02,-0.02,39,52,52,52,52,49,MSCI World,DSP World Energy Fund-Reg(G),15.56,1.08,1.95,0.42,15.13,69.84,56
HDFC NIFTY Smallcap 250 Index Fund-Reg(G),2023-04-21,47916,15.1,3.29,4.62,0.81,35.63,61.36,0.95,0.21,0.29,0.81,0.14,0.24,81,39,52,21,17,10,Nifty Smallcap 250 - TRI,HDFC NIFTY Smallcap 250 Index Fund-Reg(G),12.11,2.8,4.55,0.87,19.56,41.14,91
Nippon India Nifty Auto ETF,2022-01-24,45713,13.54,3.86,7.12,0.82,39.16,63.71,0.85,0.24,0.45,0.82,0.16,0.25,100,2,1,42,10,13,NIFTY AUTO - TRI,Nippon India Nifty Auto ETF,12.82,2.39,4.07,0.86,16.67,42.97,129
Axis Nifty Next 50 Index Fund-Reg(G),2022-01-28,45702,13.33,3.68,5.9,0.84,34.45,58.39,0.84,0.23,0.37,0.84,0.14,0.23,59,10,12,28,25,22,NIFTY NEXT 50 - TRI,Axis Nifty Next 50 Index Fund-Reg(G),12.11,2.8,4.55,0.87,19.56,41.14,91
Mirae Asset Nifty 100 ESG Sector Leaders ETF,2020-11-18,45134,9.94,2.29,3.98,0.94,7.89,24.34,0.63,0.14,0.25,0.94,0.03,0.1,15,72,72,69,78,78,Nifty100 ESG Sector Leaders - TRI,Mirae Asset Nifty 100 ESG Sector Leaders ETF,12.82,2.39,4.07,0.86,16.67,42.97,129
ICICI Pru Debt Mgmt Fund(FOF)(G),2003-12-18,1707,0.94,4.96,10.29,0.1,4.36,45.54,0.06,0.31,0.65,0.1,0.02,0.18,3,2,2,13,40,43,CRISIL Composite Bond Index,ICICI Pru Debt Mgmt Fund(FOF)(G),7.31,3.02,5.28,0.24,18.18,116.32,53
HSBC Global Equity Climate Change FoF-Reg(G),2021-03-22,45333,15.17,0.37,0.68,0.62,3.83,9.17,0.96,0.02,0.04,0.62,0.02,0.04,27,42,42,48,42,41,MSCI AC World Index,HSBC Global Equity Climate Change FoF-Reg(G),15.56,1.08,1.95,0.42,15.13,69.84,56
Aditya Birla SL FMP-US-100D-Reg(G),2024-01-10,48501,,,,,,,,,,,,,,,,,,,CRISIL Ultra Short Term Debt Index,Aditya Birla SL FMP-US-100D-Reg(G),0.76,5.46,11.21,0.05,3.05,820.15,93
SBI FMP-47-1434D-Reg(G),2021-07-23,45660,0.44,4.14,8.67,0.04,1.76,51.76,0.03,0.26,0.55,0.04,0.01,0.21,19,51,52,23,68,21,CRISIL Medium Duration Debt Index,SBI FMP-47-1434D-Reg(G),0.76,5.46,11.21,0.05,3.05,820.15,93
Kotak India Growth Fund-Sr 4(G),2018-02-15,38109,10.98,3.55,5.75,0.88,21.9,44.4,0.69,0.22,0.36,0.88,0.09,0.18,24,8,6,31,14,15,NIFTY 200,Kotak India Growth Fund-Sr 4(G),10.61,3.18,5.09,0.8,19.86,42.4,33
Bank of India Bluechip Fund-Reg(G),2021-06-29,45571,10.53,3.4,5.54,0.91,20.03,39.49,0.66,0.21,0.35,0.91,0.08,0.16,29,3,4,23,5,5,NIFTY 100 - TRI,Bank of India Bluechip Fund-Reg(G),10.13,2.76,4.64,0.88,12.66,31.65,36
Union Gilt Fund-Reg(G),2022-08-08,46221,2.29,1.49,2.66,0.26,2.67,12.93,0.14,0.09,0.17,0.26,0.01,0.05,23,32,31,27,33,32,CRISIL Dynamic Gilt Index,Union Gilt Fund-Reg(G),1.98,2.12,3.98,0.22,3.19,19.24,35
Axis Greater China Equity FoF-Reg(G),2021-02-10,44318,19.18,-0.19,-0.33,-0.11,-3.18,31.1,1.21,-0.01,-0.02,-0.11,-0.01,0.12,47,51,51,1,49,33,MSCI Golden Dragon Index (Total Return Net),Axis Greater China Equity FoF-Reg(G),15.56,1.08,1.95,0.42,15.13,69.84,56
LIC MF Focused 30 Equity Fund-Reg(G),2017-11-17,32627,9.85,1.76,2.74,0.81,3.25,21.39,0.62,0.11,0.17,0.81,0.01,0.08,20,36,36,4,36,35,NIFTY 500 - TRI,LIC MF Focused 30 Equity Fund-Reg(G),10.13,2.76,4.64,0.88,12.66,31.65,36
ICICI Pru Nifty FMCG ETF,2021-08-05,45651,11.09,1.06,1.78,0.61,2.09,19.38,0.7,0.07,0.11,0.61,0.01,0.08,54,105,108,16,98,96,NIFTY FMCG - TRI,ICICI Pru Nifty FMCG ETF,12.82,2.39,4.07,0.86,16.67,42.97,129
Aditya Birla SL Nifty Smallcap 50 Index Fund-Reg(G),2021-04-05,44737,17.03,3.2,4.71,0.93,38.35,58.69,1.07,0.2,0.3,0.93,0.15,0.23,89,45,45,58,7,18,Nifty Smallcap 50 - TRI,Aditya Birla SL Nifty Smallcap 50 Index Fund-Reg(G),12.11,2.8,4.55,0.87,19.56,41.14,91
JM Short Duration Fund-Reg(G),2022-08-29,46751,0.66,4.62,9.67,0.07,2.87,46.92,0.04,0.29,0.61,0.07,0.01,0.19,5,19,15,10,23,18,CRISIL Short Duration Debt Index,JM Short Duration Fund-Reg(G),0.73,5.19,10.43,0.07,3.41,311.55,26
Aditya Birla SL CRISIL IBX SDL Jun 2032 Index Fund-Reg(G),2023-02-14,47592,1.97,2.17,4.42,0.15,3.86,29.11,0.12,0.14,0.28,0.15,0.02,0.12,4,4,2,4,5,5,CRISIL IBX SDL Index - June 2032,Aditya Birla SL CRISIL IBX SDL Jun 2032 Index Fund-Reg(G),2.69,1.66,3.08,0.51,3.38,17.25,19
LIC MF Gold ETF,2011-11-09,15131,11.04,1.34,2.4,0.32,14.01,46.29,0.7,0.08,0.15,0.32,0.06,0.18,12,10,10,9,1,6,Gold-India,LIC MF Gold ETF,14.34,0.96,1.74,0.5,9.65,30.86,21
JM ELSS Tax Saver Fund(G),2008-03-31,4198,11.9,3.38,5.27,0.85,25.43,47.25,0.75,0.21,0.33,0.85,0.1,0.19,51,13,20,43,9,17,S&P BSE 500 - TRI,JM ELSS Tax Saver Fund(G),10.45,3.01,4.87,0.79,17.76,40.88,59
HDFC NIFTY 100 Equal Weight Index Fund-Reg(G),2022-02-23,45997,11.19,3.43,5.56,0.85,23.54,44.98,0.71,0.22,0.35,0.85,0.09,0.18,44,25,28,41,43,44,Nifty100 Equal Weight - TRI,HDFC NIFTY 100 Equal Weight Index Fund-Reg(G),12.11,2.8,4.55,0.87,19.56,41.14,91
JM Arbitrage Fund(G),2006-07-18,1843,0.98,4.32,8.52,0.0,4.23,990.89,0.06,0.27,0.54,0.0,0.02,3.93,24,22,22,3,20,3,Nifty 50 Arbitrage,JM Arbitrage Fund(G),0.89,5.08,10.13,0.01,4.49,1079.57,24
Shriram Multi Asset Allocation Fund-Reg(G),2023-09-08,48029,,,,,,,,,,,,,,,,,,,NIFTY 50 - TRI,Shriram Multi Asset Allocation Fund-Reg(G),7.09,3.34,5.74,0.29,23.06,138.51,12
SBI FMP-52-1848D-Reg(G),2021-09-28,45915,0.64,2.93,6.09,0.05,1.79,37.37,0.04,0.18,0.38,0.05,0.01,0.15,36,68,67,44,62,54,CRISIL Medium to Long Term Debt Index,SBI FMP-52-1848D-Reg(G),0.76,5.46,11.21,0.05,3.05,820.15,93
ICICI Pru Retirement Fund-Pure Debt Plan(G),2019-02-27,25670,0.87,4.18,8.43,0.08,3.43,44.23,0.05,0.26,0.53,0.08,0.01,0.18,1,3,2,4,37,35,NIFTY Composite Debt Index,ICICI Pru Retirement Fund-Pure Debt Plan(G),6.78,3.1,5.26,0.23,20.02,126.67,38
Mirae Asset Nifty Smallcap 250 Momentum Quality 100 ETF,2024-02-23,48496,,,,,,,,,,,,,,,,,,,Nifty Smallcap250 Momentum Quality 100 - TRI,Mirae Asset Nifty Smallcap 250 Momentum Quality 100 ETF,12.82,2.39,4.07,0.86,16.67,42.97,129
Baroda BNP Paribas Banking and Fin Serv Fund-Reg(G),2012-06-22,16955,12.06,1.99,3.34,0.99,6.83,24.29,0.76,0.13,0.21,0.99,0.03,0.1,11,5,5,13,6,6,Nifty Financial Services - TRI,Baroda BNP Paribas Banking and Fin Serv Fund-Reg(G),11.83,1.94,3.24,0.94,6.26,24.02,15
Kotak FMP-329-90D(G),2024-03-21,48720,,,,,,,,,,,,,,,,,,,Nifty Liquid Fund Index,Kotak FMP-329-90D(G),0.76,5.46,11.21,0.05,3.05,820.15,93
Baroda BNP Paribas NIFTY SDL Dec 2026 Index Fund-Reg(G),2023-01-25,47387,0.94,4.17,8.96,0.05,3.78,80.24,0.06,0.26,0.56,0.05,0.02,0.32,10,11,10,5,13,4,NIFTY SDL December 2026 Index,Baroda BNP Paribas NIFTY SDL Dec 2026 Index Fund-Reg(G),1.33,3.18,6.37,0.13,3.38,27.81,52
ICICI Pru Nifty Infrastructure ETF,2022-08-17,45998,12.66,3.54,6.18,0.98,29.18,45.59,0.8,0.22,0.39,0.98,0.12,0.18,69,19,6,100,40,46,Nifty Infrastructure - TRI,ICICI Pru Nifty Infrastructure ETF,12.82,2.39,4.07,0.86,16.67,42.97,129
ICICI Pru FMP-88-1226D-F(G),2022-12-08,47232,0.95,4.14,8.95,0.09,3.7,45.01,0.06,0.26,0.56,0.09,0.01,0.18,73,49,44,64,41,34,CRISIL Medium Duration Debt Index,ICICI Pru FMP-88-1226D-F(G),0.76,5.46,11.21,0.05,3.05,820.15,93
Invesco India Banking and PSU Fund(G),2012-12-29,17249,1.02,3.77,7.08,0.1,3.55,39.03,0.06,0.24,0.45,0.1,0.01,0.15,25,24,24,25,15,24,NIFTY Banking and PSU Debt Index,Invesco India Banking and PSU Fund(G),0.74,5.39,10.55,0.07,3.62,3.81,26
SBI Nifty IT ETF,2020-10-19,45110,17.9,0.93,1.78,0.98,1.01,16.96,1.13,0.06,0.11,0.98,0.0,0.07,118,110,109,97,112,110,NIFTY IT - TRI,SBI Nifty IT ETF,12.82,2.39,4.07,0.86,16.67,42.97,129
Canara Rob Income Fund-Reg(G),2002-09-19,542,2.11,1.08,1.88,0.24,1.59,9.32,0.13,0.07,0.12,0.24,0.01,0.04,51,52,52,51,52,51,CRISIL Medium to Long Term Debt Index,Canara Rob Income Fund-Reg(G),1.33,3.18,6.37,0.13,3.38,27.81,52
ICICI Pru Global Stable Equity Fund(FOF)(G),2013-09-13,16718,9.93,0.3,0.53,0.48,1.54,6.3,0.63,0.02,0.03,0.48,0.01,0.02,3,43,43,38,44,44,MSCI World,ICICI Pru Global Stable Equity Fund(FOF)(G),15.56,1.08,1.95,0.42,15.13,69.84,56
Bank of India Balanced Advantage Fund-Reg(G),2014-03-14,21917,8.23,2.44,4.1,0.18,19.58,110.85,0.52,0.15,0.26,0.18,0.08,0.44,24,25,25,13,13,13,NIFTY 50 Hybrid Composite Debt 50:50 Index,Bank of India Balanced Advantage Fund-Reg(G),6.46,3.21,5.37,0.2,19.79,114.89,26
SBI FMP-46-1850D-Reg(G),2021-07-07,45620,0.58,2.97,6.34,0.05,1.66,36.72,0.04,0.19,0.4,0.05,0.01,0.15,29,66,65,42,78,55,CRISIL Medium to Long Term Debt Index,SBI FMP-46-1850D-Reg(G),0.76,5.46,11.21,0.05,3.05,820.15,93
Navi Nifty Midcap 150 Index Fund-Reg(G),2022-03-11,45861,12.89,3.36,4.97,0.8,29.38,53.95,0.81,0.21,0.31,0.8,0.12,0.21,53,32,36,15,36,38,Nifty Midcap 150 - TRI,Navi Nifty Midcap 150 Index Fund-Reg(G),12.11,2.8,4.55,0.87,19.56,41.14,91
Sundaram Global Brand Fund(G),2007-08-22,3005,11.24,1.48,2.56,0.14,16.25,123.15,0.71,0.09,0.16,0.14,0.06,0.49,8,25,27,8,27,16,MSCI AC World Index,Sundaram Global Brand Fund(G),15.56,1.08,1.95,0.42,15.13,69.84,56
Union Retirement Fund-Reg(G),2022-09-22,45735,9.88,3.29,5.17,0.2,31.98,162.01,0.62,0.21,0.33,0.2,0.13,0.64,32,16,20,18,6,7,S&P BSE 500 - TRI,Union Retirement Fund-Reg(G),6.78,3.1,5.26,0.23,20.02,126.67,38
ICICI Pru Nifty50 Value 20 ETF,2016-06-17,33839,11.44,2.45,4.61,0.92,13.38,30.44,0.72,0.15,0.29,0.92,0.05,0.12,57,69,59,66,68,70,Nifty50 Value 20 - TRI,ICICI Pru Nifty50 Value 20 ETF,12.82,2.39,4.07,0.86,16.67,42.97,129
PGIM India Gilt Fund(G),2008-10-27,7012,2.31,1.68,3.32,0.26,3.15,15.04,0.15,0.11,0.21,0.26,0.01,0.06,26,24,19,24,23,23,CRISIL Dynamic Gilt Index,PGIM India Gilt Fund(G),1.98,2.12,3.98,0.22,3.19,19.24,35
Aditya Birla SL Nifty IT ETF,2021-10-29,45697,17.95,0.92,1.77,0.99,0.38,16.76,1.13,0.06,0.11,0.99,0.0,0.07,121,113,112,101,114,113,NIFTY IT - TRI,Aditya Birla SL Nifty IT ETF,12.82,2.39,4.07,0.86,16.67,42.97,129
Nippon India Strategic Debt Fund(G),2014-06-26,21911,0.95,3.55,6.71,0.11,3.07,31.73,0.06,0.22,0.42,0.11,0.01,0.13,15,21,23,18,26,23,CRISIL Medium Duration Debt Index,Nippon India Strategic Debt Fund(G),0.94,4.47,9.21,0.09,3.5,59.55,30
Mirae Asset Nifty India Manufacturing ETF,2022-01-27,45869,11.22,3.78,6.3,0.8,29.66,52.95,0.71,0.24,0.4,0.8,0.12,0.21,55,4,5,36,38,34,Nifty India Manufacturing - TRI,Mirae Asset Nifty India Manufacturing ETF,12.82,2.39,4.07,0.86,16.67,42.97,129
Bandhan All Seasons Bond Fund-Reg(G),2004-09-13,2850,0.79,4.65,9.13,0.09,3.45,43.24,0.05,0.29,0.58,0.09,0.01,0.17,2,5,3,9,46,44,NIFTY Medium Duration Debt Index,Bandhan All Seasons Bond Fund-Reg(G),7.31,3.02,5.28,0.24,18.18,116.32,53
Aditya Birla SL Long Duration Fund-Reg(G),2022-08-08,46711,2.62,1.54,2.83,0.29,3.23,13.91,0.17,0.1,0.18,0.29,0.01,0.06,12,11,11,9,14,10,NIFTY Long Duration Debt Index,Aditya Birla SL Long Duration Fund-Reg(G),2.69,1.66,3.08,0.51,3.38,17.25,19
Kotak FMP-310-1131D(G),2023-03-27,47871,0.95,4.08,8.81,0.09,3.63,43.97,0.06,0.26,0.56,0.09,0.01,0.17,74,53,48,70,45,41,NIFTY Medium Duration Debt Index,Kotak FMP-310-1131D(G),0.76,5.46,11.21,0.05,3.05,820.15,93
Nippon India FMP-XLVI-1(G),2023-12-20,48149,,,,,,,,,,,,,,,,,,,NIFTY Ultra Short Duration Debt Index,Nippon India FMP-XLVI-1(G),0.76,5.46,11.21,0.05,3.05,820.15,93
JM Large Cap Fund-Reg(G),1995-04-01,1858,11.71,3.14,5.26,0.98,19.83,37.65,0.74,0.2,0.33,0.98,0.08,0.15,33,9,8,36,6,6,S&P BSE 100 - TRI,JM Large Cap Fund-Reg(G),10.13,2.76,4.64,0.88,12.66,31.65,36
Nippon India ETF Nifty 50 Value 20,2015-06-18,31920,11.43,2.44,4.61,0.92,13.28,30.37,0.72,0.15,0.29,0.92,0.05,0.12,56,70,60,63,69,71,Nifty50 Value 20 - TRI,Nippon India ETF Nifty 50 Value 20,12.82,2.39,4.07,0.86,16.67,42.97,129
Groww Largecap Fund-Reg(G),2012-02-10,15997,10.05,2.7,4.7,0.93,11.01,29.28,0.63,0.17,0.3,0.93,0.04,0.12,23,21,19,30,22,22,NIFTY 100 - TRI,Groww Largecap Fund-Reg(G),10.13,2.76,4.64,0.88,12.66,31.65,36
Axis S&P BSE Sensex ETF,2023-03-24,47768,10.07,1.75,3.05,0.99,1.89,17.82,0.63,0.11,0.19,0.99,0.01,0.07,35,100,99,103,103,104,S&P BSE SENSEX - TRI,Axis S&P BSE Sensex ETF,12.82,2.39,4.07,0.86,16.67,42.97,129
Kotak Nifty SDL Jul 2026 Index Fund-Reg(G),2022-12-22,46729,0.76,5.28,12.91,0.04,3.93,113.05,0.05,0.33,0.81,0.04,0.02,0.45,5,4,2,3,3,2,Nifty SDL Jul 2026 Index,Kotak Nifty SDL Jul 2026 Index Fund-Reg(G),1.33,3.18,6.37,0.13,3.38,27.81,52
Bandhan Nifty 100 Index Fund-Reg(G),2022-02-24,46119,9.98,2.5,4.24,0.95,8.44,26.28,0.63,0.16,0.27,0.95,0.03,0.1,25,57,58,62,60,60,NIFTY 100 - TRI,Bandhan Nifty 100 Index Fund-Reg(G),12.11,2.8,4.55,0.87,19.56,41.14,91
Union Equity Savings Fund-Reg(G),2018-08-09,40627,3.54,3.09,5.22,0.1,10.66,111.06,0.22,0.19,0.33,0.1,0.04,0.44,12,35,31,15,47,29,Crisil Equity Savings Index,Union Equity Savings Fund-Reg(G),5.71,3.2,5.42,0.16,18.49,134.87,53
Bandhan Regular Savings Fund-Reg(G),2010-02-25,8465,3.28,2.21,3.82,0.17,6.78,43.34,0.21,0.14,0.24,0.17,0.03,0.17,18,18,18,14,14,16,NIFTY AAA Short Duration Bond Index,Bandhan Regular Savings Fund-Reg(G),2.62,3.61,6.61,0.13,8.96,83.67,19
SBI FMP-78-1170D-Reg(G),2023-02-21,47638,0.47,3.6,7.26,0.04,1.61,39.09,0.03,0.23,0.46,0.04,0.01,0.16,23,59,58,38,81,49,CRISIL Medium Duration Debt Index,SBI FMP-78-1170D-Reg(G),0.76,5.46,11.21,0.05,3.05,820.15,93
DSP FMP 268-1281D-Reg(G),2022-11-24,47124,0.75,5.53,12.87,0.03,4.03,143.99,0.05,0.35,0.81,0.03,0.02,0.57,50,23,22,17,16,6,CRISIL Medium Duration Debt Index,DSP FMP 268-1281D-Reg(G),0.76,5.46,11.21,0.05,3.05,820.15,93
Taurus Mid Cap Fund-Reg(G),1994-09-05,3306,15.37,2.78,4.02,0.88,27.57,48.86,0.97,0.18,0.25,0.88,0.11,0.19,30,29,29,29,16,26,Nifty Midcap 150 - TRI,Taurus Mid Cap Fund-Reg(G),11.88,3.42,5.33,0.73,28.12,56.06,30
PGIM India Arbitrage Fund-Reg(G),2014-08-27,28514,0.87,4.68,9.21,0.01,4.08,645.37,0.06,0.3,0.58,0.01,0.02,2.56,9,20,21,8,22,8,Nifty 50 Arbitrage,PGIM India Arbitrage Fund-Reg(G),0.89,5.08,10.13,0.01,4.49,1079.57,24
Navi Liquid Fund-Reg(G),2010-02-19,8544,0.15,18.66,23.14,0.0,2.77,2282.97,0.01,1.18,1.46,0.0,0.01,9.06,31,33,6,34,6,21,CRISIL Liquid Debt Index,Navi Liquid Fund-Reg(G),0.09,27.28,17.31,0.0,2.25,856.14,36
Edelweiss Emerging Markets Opp Eq. Offshore Fund-Reg(G),2014-07-07,20281,13.52,0.53,0.96,0.37,6.05,19.45,0.85,0.03,0.06,0.37,0.02,0.08,19,40,40,31,40,38,MSCI Emerging Market Index,Edelweiss Emerging Markets Opp Eq. Offshore Fund-Reg(G),15.56,1.08,1.95,0.42,15.13,69.84,56
Kotak FMP-326-175D(G),2023-12-26,48420,,,,,,,,,,,,,,,,,,,NIFTY Ultra Short Duration Debt Index,Kotak FMP-326-175D(G),0.76,5.46,11.21,0.05,3.05,820.15,93
DSP Nifty Private Bank ETF,2023-07-27,47907,,,,,,,,,,,,,,,,,,,Nifty Private Bank - TRI,DSP Nifty Private Bank ETF,12.82,2.39,4.07,0.86,16.67,42.97,129
Kotak Nifty 200 Momentum 30 Index Fund-Reg(G),2023-06-15,47977,,,,,,,,,,,,,,,,,,,Nifty200 Momentum 30 - TRI,Kotak Nifty 200 Momentum 30 Index Fund-Reg(G),12.11,2.8,4.55,0.87,19.56,41.14,91
Sundaram Money Market Fund-Reg(G),2018-09-26,39625,0.32,13.93,30.03,0.0,4.51,14006.76,0.02,0.88,1.89,0.0,0.02,55.58,13,15,12,18,10,4,Nifty Money Market Index,Sundaram Money Market Fund-Reg(G),0.31,14.36,30.17,0.0,4.51,-3587.18,21
Bandhan CRISIL IBX 90:10 SDL Plus Gilt - Nov 2026 Index Fund-Reg(G),2022-11-17,46213,0.84,4.73,10.6,0.05,3.83,76.26,0.05,0.3,0.67,0.05,0.02,0.3,8,7,5,6,9,5,CRISIL IBX 90:10 SDL Plus Gilt Index - November 2026,Bandhan CRISIL IBX 90:10 SDL Plus Gilt - Nov 2026 Index Fund-Reg(G),1.33,3.18,6.37,0.13,3.38,27.81,52
Quantum Equity FoF-Reg(G),2009-07-20,19904,9.32,3.04,4.92,0.26,27.62,108.03,0.59,0.19,0.31,0.26,0.11,0.43,37,34,39,43,11,25,S&P BSE 200 - TRI,Quantum Equity FoF-Reg(G),7.31,3.02,5.28,0.24,18.18,116.32,53
Groww Nifty Total Market Index Fund-Reg(G),2023-10-23,48247,,,,,,,,,,,,,,,,,,,Nifty Total Market - TRI,Groww Nifty Total Market Index Fund-Reg(G),12.11,2.8,4.55,0.87,19.56,41.14,91
PGIM India Dynamic Bond Fund(G),2012-01-12,15247,1.85,2.0,4.17,0.19,3.15,19.15,0.12,0.13,0.26,0.19,0.01,0.08,16,18,9,17,14,16,CRISIL Dynamic Bond Index,PGIM India Dynamic Bond Fund(G),1.69,2.77,5.2,0.17,3.2,-709.63,22
LIC MF Short Duration Fund-Reg(G),2019-02-01,34304,0.67,5.0,9.88,0.06,3.18,56.07,0.04,0.32,0.62,0.06,0.01,0.22,7,12,12,5,21,10,CRISIL Short Duration Debt Index,LIC MF Short Duration Fund-Reg(G),0.73,5.19,10.43,0.07,3.41,311.55,26
Edelweiss NIFTY Large Mid Cap 250 Index Fund-Reg(G),2021-12-01,45864,10.79,3.17,4.92,0.87,19.0,39.14,0.68,0.2,0.31,0.87,0.08,0.16,42,46,39,46,46,50,NIFTY LargeMidcap 250 - TRI,Edelweiss NIFTY Large Mid Cap 250 Index Fund-Reg(G),12.11,2.8,4.55,0.87,19.56,41.14,91
SBI FMP-50-1843D-Reg(G),2021-09-07,45842,0.64,2.76,5.64,0.06,1.66,27.57,0.04,0.17,0.36,0.06,0.01,0.11,37,71,72,51,79,67,CRISIL Medium to Long Term Debt Index,SBI FMP-50-1843D-Reg(G),0.76,5.46,11.21,0.05,3.05,820.15,93
Mirae Asset Nifty 100 ESG Sector Leaders FoF-Reg(G),2020-11-18,45135,10.22,2.2,3.9,0.3,21.62,75.6,0.64,0.14,0.25,0.3,0.09,0.3,43,41,42,46,22,37,Nifty100 ESG Sector Leaders - TRI,Mirae Asset Nifty 100 ESG Sector Leaders FoF-Reg(G),7.31,3.02,5.28,0.24,18.18,116.32,53
HDFC NIFTY Midcap 150 Index Fund-Reg(G),2023-04-21,46619,12.86,3.37,4.97,0.8,29.33,53.98,0.81,0.21,0.31,0.8,0.12,0.21,52,31,35,14,37,37,Nifty Midcap 150 - TRI,HDFC NIFTY Midcap 150 Index Fund-Reg(G),12.11,2.8,4.55,0.87,19.56,41.14,91
Kotak Nifty IT ETF,2021-03-02,45377,17.92,0.94,1.8,0.98,1.16,17.19,1.13,0.06,0.11,0.98,0.0,0.07,120,107,105,94,108,107,NIFTY IT - TRI,Kotak Nifty IT ETF,12.82,2.39,4.07,0.86,16.67,42.97,129
Union Dynamic Bond(G),2012-02-13,16032,2.19,1.41,2.5,0.26,2.34,11.89,0.14,0.09,0.16,0.26,0.01,0.05,19,20,20,21,20,20,CRISIL Dynamic Bond Index,Union Dynamic Bond(G),1.69,2.77,5.2,0.17,3.2,-709.63,22
Bajaj Finserv Banking and PSU Fund-Reg(G),2023-11-13,48214,,,,,,,,,,,,,,,,,,,NIFTY Banking and PSU Debt Index,Bajaj Finserv Banking and PSU Fund-Reg(G),0.74,5.39,10.55,0.07,3.62,3.81,26
SBI FMP-92-91D-Reg(G),2024-02-06,48470,,,,,,,,,,,,,,,,,,,CRISIL Liquid Debt Index,SBI FMP-92-91D-Reg(G),0.76,5.46,11.21,0.05,3.05,820.15,93
SBI FMP-43-1616D-Reg(G),2021-04-29,45525,0.45,4.14,8.27,0.04,1.76,44.65,0.03,0.26,0.52,0.04,0.01,0.18,20,52,55,35,66,38,CRISIL Medium Duration Debt Index,SBI FMP-43-1616D-Reg(G),0.76,5.46,11.21,0.05,3.05,820.15,93
LIC MF Long Term Value Fund-Reg(G),2018-08-20,39956,10.51,2.69,4.33,0.9,12.57,31.3,0.66,0.17,0.27,0.9,0.05,0.12,9,21,21,17,21,21,NIFTY 500 - TRI,LIC MF Long Term Value Fund-Reg(G),11.18,3.4,5.51,0.86,22.98,44.18,21
SBI Magnum Childrens Benefit Fund-Savings Plan,2002-01-28,2748,3.34,4.4,8.63,0.05,14.57,280.17,0.21,0.28,0.54,0.05,0.06,1.11,7,1,1,2,25,2,NIFTY 50 Hybrid Composite Debt 15:85 Index,SBI Magnum Childrens Benefit Fund-Savings Plan,6.78,3.1,5.26,0.23,20.02,126.67,38
