MF Code,incept_date,schemecode,sdx_returns,sharpex_returns,sotinox_returns,betax_returns,alphax_returns,treynorx_returns,sdy_returns,sharpey_returns,sotinoy_returns,betay_returns,alphay_returns,treynory_returns,rank_sd,rank_sharpe,rank_sotino,rank_beta,rank_alpha,rank_treynor,index_name,s_name,avg_std_dev,avg_sharpe,avg_sotino,avg_beta,avg_alpha,avg_treyno,no_of_funds_total
Canara Rob Focused Equity Fund-Reg(G),2021-05-17,45510,12.43,2.33,3.48,0.9,10.58,32.05,0.78,0.15,0.22,0.9,0.04,0.13,8,25,23,17,28,27,BSE 500 - TRI,Canara Rob Focused Equity Fund-Reg(G),13.72,2.58,3.79,0.85,17.12,39.52,32
Aditya Birla SL Nifty 50 ETF,2011-07-21,12811,12.75,1.83,2.82,0.99,4.21,23.54,0.8,0.12,0.18,0.99,0.02,0.09,43,79,86,76,99,88,NIFTY 50 - TRI,Aditya Birla SL Nifty 50 ETF,15.55,2.06,3.31,1.06,15.12,54.16,129
DSP Nifty SDL Plus G-Sec Jun 2028 30:70 Index Fund-Reg(G),2022-03-21,45863,1.12,4.07,7.78,0.14,4.01,33.57,0.07,0.26,0.49,0.14,0.02,0.13,23,23,25,31,32,32,Nifty SDL Plus G-Sec Jun 2028 70:30 Index,DSP Nifty SDL Plus G-Sec Jun 2028 30:70 Index Fund-Reg(G),1.32,3.83,7.37,0.13,3.93,51.13,52
Kotak Nifty 50 ETF,2010-02-02,8469,12.72,1.82,2.83,0.99,4.54,23.51,0.8,0.11,0.18,0.99,0.02,0.09,39,84,85,67,95,91,NIFTY 50 - TRI,Kotak Nifty 50 ETF,15.55,2.06,3.31,1.06,15.12,54.16,129
HSBC Arbitrage Fund-Reg(G),2014-06-30,29550,1.01,4.83,9.75,-0.01,4.89,-837.93,0.06,0.3,0.61,-0.01,0.02,-3.33,19,15,17,6,11,19,Nifty 50 Arbitrage,HSBC Arbitrage Fund-Reg(G),0.97,4.91,10.36,-0.01,4.77,111.27,24
Tata Infrastructure Fund-Reg(G),2004-12-31,3254,18.49,3.03,4.22,1.06,34.55,52.92,1.16,0.19,0.27,1.06,0.14,0.21,11,11,11,7,9,9,BSE India Infrastructure Index - TRI,Tata Infrastructure Fund-Reg(G),18.32,3.04,4.24,1.08,33.57,51.73,19
UTI Ultra Short Duration Fund-Reg(G),2003-08-29,3533,0.29,14.93,30.88,0.0,4.36,3289.08,0.02,0.94,1.94,0.0,0.02,13.05,9,7,8,7,12,6,NIFTY Ultra Short Duration Debt Index,UTI Ultra Short Duration Fund-Reg(G),0.3,14.31,30.07,0.0,4.25,2431.75,24
Canara Rob Mid Cap Fund-Reg(G),2022-12-02,46001,14.39,2.84,4.25,0.84,23.76,48.46,0.91,0.18,0.27,0.84,0.09,0.19,9,21,16,12,21,20,BSE 150 MidCap - TRI,Canara Rob Mid Cap Fund-Reg(G),15.24,2.84,4.19,0.88,25.58,49.48,30
Bandhan Balanced Advantage Fund-Reg(G),2014-10-10,30671,6.18,2.51,3.66,0.32,14.24,47.73,0.39,0.16,0.23,0.32,0.06,0.19,3,15,17,9,25,24,NIFTY 50 Hybrid Composite Debt 50:50 Index,Bandhan Balanced Advantage Fund-Reg(G),8.46,2.53,3.74,0.72,19.65,59.09,26
Mahindra Manulife Large & Mid Cap Fund-Reg(G),2019-12-30,43915,17.67,2.09,2.83,1.1,14.62,33.64,1.11,0.13,0.18,1.1,0.06,0.13,25,25,26,26,18,22,NIFTY LargeMidcap 250 - TRI,Mahindra Manulife Large & Mid Cap Fund-Reg(G),14.12,2.62,3.82,0.92,18.12,40.01,26
Templeton India Equity Income Fund(G),2006-05-18,3367,14.99,2.62,3.84,0.93,20.34,42.18,0.94,0.16,0.24,0.93,0.08,0.17,6,6,4,4,5,5,NIFTY 500 - TRI,Templeton India Equity Income Fund(G),14.44,2.74,4.01,0.96,19.89,41.15,9
Tata ST Bond Fund-Reg(G),2002-08-08,3286,0.75,5.2,9.84,0.08,3.55,46.62,0.05,0.33,0.62,0.08,0.01,0.18,13,17,12,15,18,19,CRISIL Short Duration Debt Index,Tata ST Bond Fund-Reg(G),0.74,5.33,8.45,0.08,3.63,290.88,26
Mirae Asset Healthcare Fund-Reg(G),2018-07-02,39122,12.49,2.69,4.99,0.43,24.82,77.64,0.79,0.17,0.31,0.43,0.1,0.31,8,8,8,7,8,9,BSE Health Care - TRI,Mirae Asset Healthcare Fund-Reg(G),12.11,2.85,5.24,0.44,25.98,82.78,11
Axis Balanced Advantage Fund-Reg(G),2017-08-01,37918,8.56,2.73,4.14,0.39,21.87,59.52,0.54,0.17,0.26,0.39,0.09,0.24,17,9,8,17,4,11,NIFTY 50 Hybrid Composite Debt 50:50 Index,Axis Balanced Advantage Fund-Reg(G),8.46,2.53,3.74,0.72,19.65,59.09,26
SBI Consumption Opp Fund-Reg(G),2013-01-01,19166,10.7,2.7,4.59,0.54,17.84,53.02,0.67,0.17,0.29,0.54,0.07,0.21,3,5,8,3,5,4,Nifty India Consumption - TRI,SBI Consumption Opp Fund-Reg(G),11.17,2.56,4.53,0.61,16.16,46.59,13
Sundaram Multi Asset Allocation Fund-Reg(G),2024-01-25,48460,,,,,,,,,,,,,,,,,,,NIFTY 500 - TRI,Sundaram Multi Asset Allocation Fund-Reg(G),8.05,2.9,4.54,1.12,21.84,78.7,14
Parag Parikh Liquid Fund-Reg(G),2018-05-11,38735,0.1,22.67,19.48,0.0,2.22,2626.92,0.01,1.43,1.23,0.0,0.01,10.42,27,27,10,36,12,19,CRISIL Liquid Debt Index,Parag Parikh Liquid Fund-Reg(G),0.09,27.58,17.5,0.0,2.27,-3784.64,36
Tata Treasury Advantage Fund-Reg(G),2005-09-06,3205,0.34,12.84,24.97,0.01,4.33,311.75,0.02,0.81,1.57,0.01,0.02,1.24,11,13,12,12,8,11,CRISIL Low Duration Debt Index,Tata Treasury Advantage Fund-Reg(G),0.34,12.92,25.34,0.01,4.34,355.12,20
Tata Large Cap Fund-Reg(G),1998-05-07,3281,13.9,2.15,3.13,1.02,9.05,29.16,0.88,0.14,0.2,1.02,0.04,0.12,28,24,28,33,21,26,NIFTY 100 - TRI,Tata Large Cap Fund-Reg(G),13.08,2.27,3.44,0.94,10.72,31.77,36
BHARAT Bond ETF FOF - April 2033 -Reg(G),2022-12-14,47284,6.32,0.79,1.31,0.09,4.61,52.44,0.4,0.05,0.08,0.09,0.02,0.21,21,53,53,7,45,43,NIFTY BHARAT Bond Index - April 2033,BHARAT Bond ETF FOF - April 2033 -Reg(G),8.66,2.8,4.6,0.43,20.15,68.23,53
Edelweiss US Technology Equity FOF-Reg(G),2020-03-05,44630,22.93,1.4,2.46,0.7,29.36,45.69,1.44,0.09,0.16,0.7,0.12,0.18,54,26,27,48,9,25,Russell 1000 Equal Weighted Technology Index,Edelweiss US Technology Equity FOF-Reg(G),15.29,1.1,1.96,0.46,13.91,62.07,56
Bajaj Finserv Money Market Fund-Reg(G),2023-07-24,48065,,,,,,,,,,,,,,,,,,,Nifty Money Market Index,Bajaj Finserv Money Market Fund-Reg(G),0.31,14.66,30.75,0.0,4.58,1805.67,21
SBI CRISIL IBX Gilt Index - Apr 2029 Fund-Reg(G),2022-10-04,46971,1.71,2.71,4.76,0.2,3.88,23.66,0.11,0.17,0.3,0.2,0.02,0.09,40,39,39,41,38,39,CRISIL IBX Gilt Index - April 2029,SBI CRISIL IBX Gilt Index - Apr 2029 Fund-Reg(G),1.32,3.83,7.37,0.13,3.93,51.13,52
Mirae Asset NYSE FANG+ ETF,2021-05-07,45379,22.74,2.07,3.61,0.03,47.0,1840.1,1.43,0.13,0.23,0.03,0.19,7.3,123,69,57,1,3,1,NYSE FANG+ TRI,Mirae Asset NYSE FANG+ ETF,15.55,2.06,3.31,1.06,15.12,54.16,129
Axis CRISIL IBX SDL May 2027 Index Fund-Reg(G),2022-02-23,45999,0.98,4.74,9.18,0.07,4.36,64.89,0.06,0.3,0.58,0.07,0.02,0.26,15,12,12,13,2,12,CRISIL IBX SDL Index - May 2027,Axis CRISIL IBX SDL May 2027 Index Fund-Reg(G),1.32,3.83,7.37,0.13,3.93,51.13,52
Quant Absolute Fund(G),2001-03-20,865,13.75,2.29,3.44,0.34,30.19,93.37,0.87,0.14,0.22,0.34,0.12,0.37,54,43,41,28,3,6,CRISIL Hybrid 25+75 - Aggressive Index,Quant Absolute Fund(G),7.37,2.65,4.06,0.33,19.06,68.13,52
Bandhan Multi Cap Fund-Reg(G),2021-12-02,45867,12.73,2.72,3.99,0.84,17.72,41.33,0.8,0.17,0.25,0.84,0.07,0.16,9,13,14,8,17,16,Nifty500 Multicap 50:25:25 - TRI,Bandhan Multi Cap Fund-Reg(G),13.72,2.58,3.79,0.85,17.12,39.52,32
HSBC Overnight Fund-Reg(G),2019-05-22,42784,0.05,36.42,21.69,0.0,1.86,-10083.35,0.0,2.29,1.37,0.0,0.01,-40.01,24,24,9,2,9,30,Nifty 1D Rate Index,HSBC Overnight Fund-Reg(G),0.04,131.62,16.18,0.0,1.88,22730.38,32
Kotak Manufacture in India Fund-Reg(G),2022-02-22,46107,14.22,3.04,4.45,0.9,24.87,48.06,0.9,0.19,0.28,0.9,0.1,0.19,27,9,11,23,11,10,Nifty India Manufacturing - TRI,Kotak Manufacture in India Fund-Reg(G),14.82,2.63,3.96,0.86,20.13,41.75,46
Mirae Asset Arbitrage Fund-Reg(G),2020-06-19,44983,1.03,4.78,10.17,-0.01,4.94,-928.59,0.06,0.3,0.64,-0.01,0.02,-3.68,22,16,16,7,8,20,Nifty 50 Arbitrage,Mirae Asset Arbitrage Fund-Reg(G),0.97,4.91,10.36,-0.01,4.77,111.27,24
Franklin India Liquid Fund-Super Inst(G),2005-09-02,3406,0.07,31.48,15.18,0.0,2.09,-14278.14,0.0,1.98,0.96,0.0,0.01,-56.66,7,7,27,10,26,24,Nifty Liquid Fund Index,Franklin India Liquid Fund-Super Inst(G),0.09,27.58,17.5,0.0,2.27,-3784.64,36
Sundaram Flexi Cap Fund-Reg(G),2022-09-06,46622,12.18,2.0,3.02,0.9,6.07,27.09,0.77,0.13,0.19,0.9,0.02,0.11,10,40,39,20,40,41,NIFTY 500 - TRI,Sundaram Flexi Cap Fund-Reg(G),13.58,2.51,3.72,0.92,15.65,37.24,43
Tata Ultra Short Term Fund-Reg(G),2019-01-22,41798,0.29,14.32,29.42,0.0,4.08,3221.44,0.02,0.9,1.85,0.0,0.02,12.78,6,13,17,6,17,7,CRISIL Ultra Short Term Debt Index,Tata Ultra Short Term Fund-Reg(G),0.3,14.31,30.07,0.0,4.25,2431.75,24
HDFC Infrastructure Fund(G),2008-03-10,4253,18.37,3.21,4.46,1.06,37.57,55.89,1.16,0.2,0.28,1.06,0.15,0.22,9,6,5,6,5,6,BSE India Infrastructure Index - TRI,HDFC Infrastructure Fund(G),18.32,3.04,4.24,1.08,33.57,51.73,19
Union Flexi Cap Fund-Reg(G),2011-06-10,14559,13.1,2.29,3.22,0.92,11.31,32.61,0.82,0.14,0.2,0.92,0.04,0.13,22,32,33,23,33,31,BSE 500 - TRI,Union Flexi Cap Fund-Reg(G),13.58,2.51,3.72,0.92,15.65,37.24,43
Tata Banking & Financial Services Fund-Reg(G),2015-12-28,33726,14.88,1.46,2.14,0.99,1.46,21.8,0.94,0.09,0.13,0.99,0.01,0.09,3,9,9,2,8,8,Nifty Financial Services - TRI,Tata Banking & Financial Services Fund-Reg(G),15.68,1.58,2.32,1.08,3.45,23.68,16
HDFC Gold Fund(G),2011-11-01,15381,10.27,1.88,3.48,0.16,18.67,121.84,0.65,0.12,0.22,0.16,0.07,0.48,2,3,2,5,13,5,Gold-India,HDFC Gold Fund(G),12.82,1.68,3.05,0.39,19.36,132.08,15
Bandhan G-Sec-Invest-Reg(G),2008-12-05,7483,3.39,2.09,3.64,0.36,5.64,19.4,0.21,0.13,0.23,0.36,0.02,0.08,35,30,25,34,1,18,CRISIL Dynamic Gilt Index,Bandhan G-Sec-Invest-Reg(G),2.05,2.67,4.83,0.24,4.05,23.5,35
ITI Small Cap Fund-Reg(G),2020-02-17,44399,17.97,3.01,4.12,0.97,34.5,55.97,1.13,0.19,0.26,0.97,0.14,0.22,22,3,9,22,2,5,Nifty Smallcap 250 - TRI,ITI Small Cap Fund-Reg(G),15.1,2.75,3.95,0.76,25.74,52.93,24
Parag Parikh Conservative Hybrid Fund-Reg(G),2021-05-26,45338,3.48,4.23,6.96,0.12,14.24,124.46,0.22,0.27,0.44,0.12,0.06,0.49,12,1,1,3,1,1,CRISIL Hybrid 85+15 - Conservative Index,Parag Parikh Conservative Hybrid Fund-Reg(G),3.41,3.07,4.82,0.2,9.6,56.87,19
LIC MF Nifty 8-13 yr G-Sec ETF,2014-12-24,31581,2.54,1.9,3.2,0.33,3.68,14.69,0.16,0.12,0.2,0.33,0.01,0.06,15,16,16,15,13,15,Nifty 8-13 yr G-Sec,LIC MF Nifty 8-13 yr G-Sec ETF,1.26,6.73,11.19,0.21,3.76,2392.71,17
SBI Magnum Childrens Benefit Fund-Investment Plan-Reg(G),2020-09-29,34199,10.46,3.44,5.84,0.24,35.03,152.28,0.66,0.22,0.37,0.24,0.14,0.6,23,3,3,9,4,2,CRISIL Hybrid 35+65 - Aggressive Index,SBI Magnum Childrens Benefit Fund-Investment Plan-Reg(G),8.74,2.68,4.13,0.77,20.82,62.02,38
Tata Retirement Sav Fund - Mod Plan(G),2011-11-04,15379,11.59,2.43,3.45,0.49,26.23,57.88,0.73,0.15,0.22,0.49,0.1,0.23,27,29,32,27,9,17,CRISIL Hybrid 25+75 - Aggressive Index,Tata Retirement Sav Fund - Mod Plan(G),8.74,2.68,4.13,0.77,20.82,62.02,38
Kotak Infra & Eco Reform Fund(G),2008-02-25,4228,16.36,3.14,4.39,0.96,31.73,53.5,1.03,0.2,0.28,0.96,0.13,0.21,2,7,8,2,12,8,Nifty Infrastructure - TRI,Kotak Infra & Eco Reform Fund(G),18.32,3.04,4.24,1.08,33.57,51.73,19
Templeton India Value Fund(G),2003-09-05,3379,14.16,2.79,4.07,0.96,19.96,41.05,0.89,0.18,0.26,0.96,0.08,0.16,11,11,10,9,11,11,NIFTY 500 - TRI,Templeton India Value Fund(G),14.61,2.78,4.09,0.97,20.86,42.01,22
Kotak Bond Fund-Reg(G),1999-11-25,1968,2.13,2.23,3.81,0.26,3.73,18.27,0.13,0.14,0.24,0.26,0.01,0.07,48,44,45,51,42,45,CRISIL Medium to Long Term Debt Index,Kotak Bond Fund-Reg(G),1.32,3.83,7.37,0.13,3.93,51.13,52
Baroda BNP Paribas Large Cap Fund-Reg(G),2004-09-23,23,13.16,2.65,3.87,0.97,15.17,36.01,0.83,0.17,0.24,0.97,0.06,0.14,20,3,6,24,7,6,NIFTY 100 - TRI,Baroda BNP Paribas Large Cap Fund-Reg(G),13.08,2.27,3.44,0.94,10.72,31.77,36
Tata India Consumer Fund-Reg(G),2015-12-28,33728,11.31,2.71,4.9,0.57,19.03,53.4,0.71,0.17,0.31,0.57,0.08,0.21,10,4,3,5,4,3,Nifty India Consumption - TRI,Tata India Consumer Fund-Reg(G),11.17,2.56,4.53,0.61,16.16,46.59,13
Axis Strategic Bond Fund-Reg(G),2012-03-28,8136,1.14,4.28,7.68,0.14,4.33,35.81,0.07,0.27,0.48,0.14,0.02,0.14,22,20,18,24,7,21,NIFTY Medium Duration Debt Index,Axis Strategic Bond Fund-Reg(G),0.93,5.23,10.38,0.09,3.95,66.93,30
Baroda BNP Paribas Mid Cap Fund-Reg(G),2006-05-02,172,14.44,3.01,4.36,0.84,26.43,51.99,0.91,0.19,0.27,0.84,0.1,0.21,10,9,12,9,15,11,Nifty Midcap 150 - TRI,Baroda BNP Paribas Mid Cap Fund-Reg(G),15.24,2.84,4.19,0.88,25.58,49.48,30
SBI Long Duration Fund-Reg(G),2022-12-21,46864,3.84,2.0,3.33,0.46,5.87,16.63,0.24,0.13,0.21,0.46,0.02,0.07,18,13,13,19,3,14,CRISIL Long Duration Debt Index,SBI Long Duration Fund-Reg(G),2.7,2.12,3.76,0.53,4.44,21.14,19
Navi Nifty 50 Index Fund-Reg(G),2021-07-15,45614,12.73,1.81,2.79,0.99,2.95,23.31,0.8,0.11,0.18,0.99,0.01,0.09,22,71,71,47,72,71,NIFTY 50 - TRI,Navi Nifty 50 Index Fund-Reg(G),15.54,2.34,3.5,0.98,17.03,37.92,95
Quant Momentum Fund-Reg(G),2023-11-20,48334,,,,,,,,,,,,,,,,,,,NIFTY 500 - TRI,Quant Momentum Fund-Reg(G),14.82,2.63,3.96,0.86,20.13,41.75,46
Franklin India Balanced Advantage Fund-Reg(G),2022-09-06,46625,6.45,3.33,4.94,0.27,20.39,79.91,0.41,0.21,0.31,0.27,0.08,0.32,6,1,2,3,7,2,NIFTY 50 Hybrid Composite Debt 50:50 Index,Franklin India Balanced Advantage Fund-Reg(G),8.46,2.53,3.74,0.72,19.65,59.09,26
Aditya Birla SL Income Fund(G),1995-10-21,405,2.19,1.94,3.26,0.24,3.3,17.36,0.14,0.12,0.21,0.24,0.01,0.07,51,50,49,47,47,49,CRISIL Medium to Long Term Debt Index,Aditya Birla SL Income Fund(G),1.32,3.83,7.37,0.13,3.93,51.13,52
HSBC CRISIL IBX 50:50 Gilt Plus SDL Apr 2028 Index Fund-Reg(G),2022-03-31,46506,1.11,4.05,7.85,0.13,4.01,35.18,0.07,0.26,0.49,0.13,0.02,0.14,22,24,24,29,31,29,CRISIL IBX 50:50 Gilt Plus SDL Index - April 2028,HSBC CRISIL IBX 50:50 Gilt Plus SDL Apr 2028 Index Fund-Reg(G),1.32,3.83,7.37,0.13,3.93,51.13,52
Nippon India Gold Savings Fund(G),2011-03-07,14108,10.91,1.78,3.23,0.22,18.55,88.78,0.69,0.11,0.2,0.22,0.07,0.35,7,8,7,9,14,9,Gold-India,Nippon India Gold Savings Fund(G),12.82,1.68,3.05,0.39,19.36,132.08,15
Edelweiss Multi Cap Fund-Reg(G),2023-10-25,48147,,,,,,,,,,,,,,,,,,,Nifty500 Multicap 50:25:25 - TRI,Edelweiss Multi Cap Fund-Reg(G),13.72,2.58,3.79,0.85,17.12,39.52,32
Mirae Asset Flexi Cap Fund-Reg(G),2023-02-24,47596,13.06,2.15,3.13,0.94,9.05,29.94,0.82,0.14,0.2,0.94,0.04,0.12,21,37,36,28,37,38,NIFTY 500 - TRI,Mirae Asset Flexi Cap Fund-Reg(G),13.58,2.51,3.72,0.92,15.65,37.24,43
SBI Gold-Reg(G),2011-09-12,14666,10.72,1.87,3.34,0.09,19.71,216.64,0.68,0.12,0.21,0.09,0.08,0.86,5,4,5,3,3,3,Gold-London Bullion Market association (LBMA),SBI Gold-Reg(G),12.82,1.68,3.05,0.39,19.36,132.08,15
WOC Mid Cap Fund-Reg(G),2022-09-07,46769,14.34,2.92,4.3,0.84,24.87,49.97,0.9,0.18,0.27,0.84,0.1,0.2,8,17,15,10,19,16,BSE 150 MidCap - TRI,WOC Mid Cap Fund-Reg(G),15.24,2.84,4.19,0.88,25.58,49.48,30
JM Liquid Fund(G),1997-12-31,1909,0.05,37.64,15.31,0.0,2.07,-8874.68,0.0,2.37,0.96,0.0,0.01,-35.22,3,2,21,4,30,21,CRISIL Liquid Debt Index,JM Liquid Fund(G),0.09,27.58,17.5,0.0,2.27,-3784.64,36
Tata Retirement Sav Fund - Prog Plan(G),2011-11-04,15380,13.4,2.5,3.55,0.53,31.4,63.4,0.84,0.16,0.22,0.53,0.12,0.25,33,24,29,35,6,15,NIFTY 500 - TRI,Tata Retirement Sav Fund - Prog Plan(G),8.74,2.68,4.13,0.77,20.82,62.02,38
Nippon India Gilt Securities Fund(G),2008-08-22,6291,2.42,2.07,3.62,0.28,3.91,17.72,0.15,0.13,0.23,0.28,0.02,0.07,24,31,26,23,22,30,Nifty All Duration G-Sec Index,Nippon India Gilt Securities Fund(G),2.05,2.67,4.83,0.24,4.05,23.5,35
Kotak Gold Fund(G),2011-03-25,14148,10.76,1.86,3.32,0.15,19.38,130.71,0.68,0.12,0.21,0.15,0.08,0.52,6,5,6,4,7,4,Gold-India,Kotak Gold Fund(G),12.82,1.68,3.05,0.39,19.36,132.08,15
Aditya Birla SL Medium Term Plan-Reg(G),2009-03-25,7683,1.37,3.41,6.6,0.14,4.13,33.57,0.09,0.22,0.42,0.14,0.02,0.13,28,28,26,25,12,23,CRISIL Medium Duration Debt Index,Aditya Birla SL Medium Term Plan-Reg(G),0.93,5.23,10.38,0.09,3.95,66.93,30
Edelweiss Flexi Cap Fund-Reg(G),2015-02-03,31778,14.33,2.65,3.85,1.02,17.26,37.27,0.9,0.17,0.24,1.02,0.07,0.15,32,15,17,37,15,20,NIFTY 500 - TRI,Edelweiss Flexi Cap Fund-Reg(G),13.58,2.51,3.72,0.92,15.65,37.24,43
HSBC Money Market Fund-Reg(G),2005-08-10,621,0.32,14.33,29.98,0.0,4.51,1693.11,0.02,0.9,1.89,0.0,0.02,6.72,9,16,17,16,13,16,Nifty Money Market Index,HSBC Money Market Fund-Reg(G),0.31,14.66,30.75,0.0,4.58,1805.67,21
Axis Nifty AAA Bond Plus SDL Apr 2026 50:50 ETF,2021-05-11,45337,0.56,8.15,16.78,0.04,4.44,127.18,0.04,0.51,1.06,0.04,0.02,0.5,6,6,6,7,5,6,Nifty AAA Bond Plus SDL Apr 2026 50:50 Index,Axis Nifty AAA Bond Plus SDL Apr 2026 50:50 ETF,1.26,6.73,11.19,0.21,3.76,2392.71,17
Motilal Oswal Focused Fund-Reg(G),2013-05-13,21769,13.99,1.83,2.71,0.81,9.17,31.65,0.88,0.12,0.17,0.81,0.04,0.13,30,35,35,3,20,15,NIFTY 500 - TRI,Motilal Oswal Focused Fund-Reg(G),13.08,2.27,3.44,0.94,10.72,31.77,36
Quant Value Fund-Reg(G),2021-11-30,46064,21.27,2.68,3.83,1.19,32.79,47.83,1.34,0.17,0.24,1.19,0.13,0.19,22,15,16,22,1,3,NIFTY 500 - TRI,Quant Value Fund-Reg(G),14.61,2.78,4.09,0.97,20.86,42.01,22
Franklin India Equity Hybrid Fund(G),1999-12-10,999,9.59,2.77,3.99,0.4,25.05,66.48,0.6,0.17,0.25,0.4,0.1,0.26,35,26,28,38,12,20,CRISIL Hybrid 35+65 - Aggressive Index,Franklin India Equity Hybrid Fund(G),7.37,2.65,4.06,0.33,19.06,68.13,52
HSBC Large Cap Fund(G),2002-12-10,1348,13.83,2.05,2.97,1.02,7.59,27.77,0.87,0.13,0.19,1.02,0.03,0.11,27,27,29,32,27,29,NIFTY 100 - TRI,HSBC Large Cap Fund(G),13.08,2.27,3.44,0.94,10.72,31.77,36
ICICI Pru Nifty SDL Sep 2027 Index Fund-Reg(G),2022-03-24,46528,1.13,4.1,8.13,0.08,4.33,59.8,0.07,0.26,0.51,0.08,0.02,0.24,24,22,21,16,4,15,Nifty SDL Sep 2027 Index,ICICI Pru Nifty SDL Sep 2027 Index Fund-Reg(G),1.32,3.83,7.37,0.13,3.93,51.13,52
SBI Magnum Income Fund-Reg(G),1998-11-25,2776,1.44,3.03,5.25,0.17,3.7,26.13,0.09,0.19,0.33,0.17,0.01,0.1,35,36,36,37,43,37,CRISIL Medium to Long Term Debt Index,SBI Magnum Income Fund-Reg(G),1.32,3.83,7.37,0.13,3.93,51.13,52
Nippon India ETF Nifty 8-13 yr G-Sec Long Term Gilt,2016-07-05,35459,2.54,1.91,3.23,0.33,3.73,14.82,0.16,0.12,0.2,0.33,0.01,0.06,16,15,15,16,11,14,Nifty 8-13 yr G-Sec,Nippon India ETF Nifty 8-13 yr G-Sec Long Term Gilt,1.26,6.73,11.19,0.21,3.76,2392.71,17
Motilal Oswal Small Cap Fund-Reg(G),2023-12-26,48388,,,,,,,,,,,,,,,,,,,Nifty Smallcap 250 - TRI,Motilal Oswal Small Cap Fund-Reg(G),15.1,2.75,3.95,0.76,25.74,52.93,24
Baroda BNP Paribas Value Fund-Reg(G),2023-06-07,47940,16.43,2.19,3.05,1.07,14.24,33.59,1.03,0.14,0.19,1.07,0.06,0.13,18,22,22,18,22,22,NIFTY 500 - TRI,Baroda BNP Paribas Value Fund-Reg(G),14.61,2.78,4.09,0.97,20.86,42.01,22
Aditya Birla SL Dynamic Bond Fund-Reg(G),2004-09-27,302,1.96,2.4,4.11,0.21,3.88,22.08,0.12,0.15,0.26,0.21,0.02,0.09,13,13,13,13,12,16,NIFTY Composite Debt Index,Aditya Birla SL Dynamic Bond Fund-Reg(G),1.82,3.18,5.68,0.19,3.97,114.52,22
Aditya Birla SL Business Cycle Fund-Reg(G),2021-12-03,45733,12.66,2.27,3.48,0.93,9.88,30.97,0.8,0.14,0.22,0.93,0.04,0.12,19,34,35,27,41,44,BSE 500 - TRI,Aditya Birla SL Business Cycle Fund-Reg(G),14.82,2.63,3.96,0.86,20.13,41.75,46
DSP Multi Asset Allocation Fund-Reg(G),2023-09-27,48206,,,,,,,,,,,,,,,,,,,NIFTY 500 - TRI,DSP Multi Asset Allocation Fund-Reg(G),8.05,2.9,4.54,1.12,21.84,78.7,14
HSBC Multi Asset Allocation Fund-Reg(G),2024-02-28,48468,,,,,,,,,,,,,,,,,,,BSE 200 - TRI,HSBC Multi Asset Allocation Fund-Reg(G),8.05,2.9,4.54,1.12,21.84,78.7,14
Sundaram Ultra Short Duration Fund(G),2007-12-28,4186,0.27,13.69,28.5,0.0,3.63,3014.32,0.02,0.86,1.8,0.0,0.01,11.96,2,19,20,4,23,8,NIFTY Ultra Short Duration Debt Index,Sundaram Ultra Short Duration Fund(G),0.3,14.31,30.07,0.0,4.25,2431.75,24
Invesco India Flexi Cap Fund-Reg(G),2022-02-14,45945,12.83,3.16,4.71,0.88,22.6,45.94,0.81,0.2,0.3,0.88,0.09,0.18,18,3,4,14,8,7,BSE 500 - TRI,Invesco India Flexi Cap Fund-Reg(G),13.58,2.51,3.72,0.92,15.65,37.24,43
Aditya Birla SL G-Sec Fund(G),1999-10-11,399,2.54,2.16,3.79,0.29,4.38,19.23,0.16,0.14,0.24,0.29,0.02,0.08,30,22,20,24,7,20,Nifty All Duration G-Sec Index,Aditya Birla SL G-Sec Fund(G),2.05,2.67,4.83,0.24,4.05,23.5,35
Tata Focused Equity Fund-Reg(G),2019-12-05,44148,14.16,2.42,3.47,1.0,14.04,34.37,0.89,0.15,0.22,1.0,0.06,0.14,22,21,24,28,22,24,NIFTY 500 - TRI,Tata Focused Equity Fund-Reg(G),13.72,2.58,3.79,0.85,17.12,39.52,32
Mirae Asset Banking and Financial Services Fund-Reg(G),2020-12-11,45174,15.52,1.56,2.34,1.07,2.47,22.63,0.98,0.1,0.15,1.07,0.01,0.09,6,6,7,8,6,6,Nifty Financial Services - TRI,Mirae Asset Banking and Financial Services Fund-Reg(G),15.68,1.58,2.32,1.08,3.45,23.68,16
ICICI Pru MNC Fund(G),2019-06-17,41965,9.44,3.0,4.83,0.54,17.29,52.09,0.59,0.19,0.3,0.54,0.07,0.21,2,1,1,2,3,2,NIFTY MNC - TRI,ICICI Pru MNC Fund(G),10.2,2.53,4.11,0.53,15.11,47.95,5
Axis Dynamic Bond Fund-Reg(G),2011-04-27,12380,1.17,3.66,5.64,0.12,3.81,36.62,0.07,0.23,0.36,0.12,0.02,0.15,3,4,5,3,14,3,NIFTY Composite Debt Index,Axis Dynamic Bond Fund-Reg(G),1.82,3.18,5.68,0.19,3.97,114.52,22
Edelweiss Aggressive Hybrid Fund-Reg(G),2009-08-11,7922,10.46,2.69,3.85,0.44,26.38,63.63,0.66,0.17,0.24,0.44,0.1,0.25,13,11,11,13,3,10,CRISIL Hybrid 35+65 - Aggressive Index,Edelweiss Aggressive Hybrid Fund-Reg(G),8.05,2.9,4.54,1.12,21.84,78.7,14
Kotak Medium Term Fund(G),2014-03-21,22514,1.37,3.85,7.1,0.11,4.86,49.44,0.09,0.24,0.45,0.11,0.02,0.2,29,23,23,16,1,12,CRISIL Medium Duration Debt Index,Kotak Medium Term Fund(G),0.93,5.23,10.38,0.09,3.95,66.93,30
Bank of India Liquid Fund-Reg(G),2008-07-16,5836,0.07,32.67,15.15,0.0,2.14,6056.57,0.0,2.06,0.95,0.0,0.01,24.03,6,6,29,33,13,15,CRISIL Liquid Debt Index,Bank of India Liquid Fund-Reg(G),0.09,27.58,17.5,0.0,2.27,-3784.64,36
Nippon India ETF Nifty CPSE Bond Plus SDL Sep 2024 50:50,2020-11-17,45171,0.32,14.21,30.23,0.01,4.46,871.34,0.02,0.9,1.9,0.01,0.02,3.46,4,3,1,4,4,3,Nifty CPSE Bond Plus SDL Sep 2024 50:50 Index,Nippon India ETF Nifty CPSE Bond Plus SDL Sep 2024 50:50,1.26,6.73,11.19,0.21,3.76,2392.71,17
Nippon India Index Fund-Nifty 50 Plan(G),2010-09-28,12860,12.72,1.79,2.77,0.99,2.75,23.11,0.8,0.11,0.17,0.99,0.01,0.09,16,77,77,45,79,79,NIFTY 50 - TRI,Nippon India Index Fund-Nifty 50 Plan(G),15.54,2.34,3.5,0.98,17.03,37.92,95
DSP Overnight Fund-Reg(G),2019-01-09,41945,0.14,18.86,24.84,0.0,2.67,31727.51,0.01,1.19,1.56,0.0,0.01,125.9,31,30,6,24,2,14,CRISIL Liquid Overnight Index,DSP Overnight Fund-Reg(G),0.04,131.62,16.18,0.0,1.88,22730.38,32
SBI Magnum Constant Maturity Fund-Reg(G),2000-12-25,2756,2.57,1.79,3.05,0.32,3.35,14.52,0.16,0.11,0.19,0.32,0.01,0.06,1,2,2,3,3,2,Nifty 10 yr Benchmark G-Sec,SBI Magnum Constant Maturity Fund-Reg(G),2.64,1.76,3.0,0.32,3.41,14.5,6
Mirae Asset Ultra Short Duration Fund-Reg(G),2020-10-07,45100,0.31,15.5,31.6,0.0,4.76,2491.42,0.02,0.98,1.99,0.0,0.02,9.89,20,1,4,13,2,11,NIFTY Ultra Short Duration Debt Index,Mirae Asset Ultra Short Duration Fund-Reg(G),0.3,14.31,30.07,0.0,4.25,2431.75,24
UTI Conservative Hybrid Fund-Reg(G),2003-12-16,3631,3.62,3.34,5.16,0.21,11.24,56.25,0.23,0.21,0.33,0.21,0.04,0.22,15,7,7,12,6,9,NIFTY 50 Hybrid Composite Debt 15:85 Index,UTI Conservative Hybrid Fund-Reg(G),3.41,3.07,4.82,0.2,9.6,56.87,19
HSBC Focused Fund-Reg(G),2020-07-22,44739,13.54,2.22,3.3,0.93,11.09,32.21,0.85,0.14,0.21,0.93,0.04,0.13,15,27,26,20,27,26,NIFTY 500 - TRI,HSBC Focused Fund-Reg(G),13.72,2.58,3.79,0.85,17.12,39.52,32
Union Balanced Advantage Fund-Reg(G),2017-12-29,38378,8.02,2.12,2.96,0.35,15.67,48.41,0.51,0.13,0.19,0.35,0.06,0.19,14,22,22,12,24,23,NIFTY 50 Hybrid Composite Debt 50:50 Index,Union Balanced Advantage Fund-Reg(G),8.46,2.53,3.74,0.72,19.65,59.09,26
Motilal Oswal Nifty Midcap 150 Index Fund-Reg(G),2019-09-06,43810,16.16,2.76,3.92,0.94,25.6,47.6,1.02,0.17,0.25,0.94,0.1,0.19,55,19,35,22,36,23,Nifty Midcap 150 - TRI,Motilal Oswal Nifty Midcap 150 Index Fund-Reg(G),15.54,2.34,3.5,0.98,17.03,37.92,95
Mirae Asset Balanced Advantage Fund-Reg(G),2022-08-11,46224,6.97,2.55,3.75,0.29,16.68,61.08,0.44,0.16,0.24,0.29,0.07,0.24,9,13,14,6,19,9,NIFTY 50 Hybrid Composite Debt 50:50 Index,Mirae Asset Balanced Advantage Fund-Reg(G),8.46,2.53,3.74,0.72,19.65,59.09,26
Aditya Birla SL CRISIL IBX 60:40 SDL + AAA PSU - Apr 2027 Index Fund-Reg(G),2022-03-29,46227,0.72,6.04,11.37,0.07,4.06,59.14,0.05,0.38,0.72,0.07,0.02,0.23,4,5,7,15,25,16,CRISIL IBX 60:40 SDL + AAA PSU Index - April 2027,Aditya Birla SL CRISIL IBX 60:40 SDL + AAA PSU - Apr 2027 Index Fund-Reg(G),1.32,3.83,7.37,0.13,3.93,51.13,52
Kotak Nifty PSU Bank ETF,2007-11-08,3723,30.37,1.98,2.98,1.55,30.87,38.86,1.91,0.12,0.19,1.55,0.12,0.15,128,74,76,127,14,58,NIFTY PSU BANK - TRI,Kotak Nifty PSU Bank ETF,15.55,2.06,3.31,1.06,15.12,54.16,129
Sundaram Diversified Equity(G),2005-05-02,3072,11.81,2.01,3.06,0.88,5.85,26.96,0.74,0.13,0.19,0.88,0.02,0.11,11,55,54,29,55,55,NIFTY 500 - TRI,Sundaram Diversified Equity(G),13.44,2.5,3.72,0.88,15.68,38.5,60
Axis Equity Hybrid Fund-Reg(G),2018-08-09,40568,9.28,2.0,2.98,0.38,17.09,48.89,0.58,0.13,0.19,0.38,0.07,0.19,31,50,50,32,29,49,CRISIL Hybrid 35+65 - Aggressive Index,Axis Equity Hybrid Fund-Reg(G),7.37,2.65,4.06,0.33,19.06,68.13,52
Nippon India Innovation Fund-Reg(G),2023-08-28,48169,,,,,,,,,,,,,,,,,,,NIFTY 500 - TRI,Nippon India Innovation Fund-Reg(G),14.82,2.63,3.96,0.86,20.13,41.75,46
ICICI Pru Thematic Advantage Fund(FOF)(G),2003-12-18,1706,9.24,2.99,4.85,0.32,26.31,86.86,0.58,0.19,0.31,0.32,0.1,0.34,31,21,20,29,16,9,NIFTY 200 - TRI,ICICI Pru Thematic Advantage Fund(FOF)(G),8.66,2.8,4.6,0.43,20.15,68.23,53
Mirae Asset NYSE FANG+ETF FoF-Reg(G),2021-05-10,45496,19.32,2.4,4.21,0.96,42.69,48.23,1.22,0.15,0.26,0.96,0.17,0.19,48,1,3,54,1,23,NYSE FANG+ TRI,Mirae Asset NYSE FANG+ETF FoF-Reg(G),15.29,1.1,1.96,0.46,13.91,62.07,56
Bandhan Bond Fund - Medium Term Plan-Reg(G),2003-07-08,1084,1.44,2.62,4.69,0.18,3.05,20.79,0.09,0.16,0.3,0.18,0.01,0.08,30,29,29,30,29,29,NIFTY Medium Duration Debt Index,Bandhan Bond Fund - Medium Term Plan-Reg(G),0.93,5.23,10.38,0.09,3.95,66.93,30
LIC MF Large Cap Fund-Reg(G),1998-03-31,2127,12.94,1.97,2.89,0.98,5.52,25.96,0.81,0.12,0.18,0.98,0.02,0.1,19,31,30,26,33,33,NIFTY 100 - TRI,LIC MF Large Cap Fund-Reg(G),13.08,2.27,3.44,0.94,10.72,31.77,36
ICICI Pru BSE Sensex Index Fund(G),2017-09-21,36396,12.73,1.63,2.56,0.99,0.6,20.94,0.8,0.1,0.16,0.99,0.0,0.08,20,84,84,55,86,86,BSE SENSEX - TRI,ICICI Pru BSE Sensex Index Fund(G),15.54,2.34,3.5,0.98,17.03,37.92,95
ICICI Pru FMCG Fund(G),1999-03-31,1517,11.02,0.76,1.37,0.38,0.58,21.85,0.69,0.05,0.09,0.38,0.0,0.09,9,13,13,1,13,13,NIFTY FMCG - TRI,ICICI Pru FMCG Fund(G),11.17,2.56,4.53,0.61,16.16,46.59,13
Bandhan Focused Equity Fund-Reg(G),2006-03-16,2896,13.24,2.31,3.62,0.86,13.13,35.48,0.83,0.15,0.23,0.86,0.05,0.14,14,26,20,11,23,23,BSE 500 - TRI,Bandhan Focused Equity Fund-Reg(G),13.72,2.58,3.79,0.85,17.12,39.52,32
