MF Code,incept_date,schemecode,sdx_returns,sharpex_returns,sotinox_returns,betax_returns,alphax_returns,treynorx_returns,sdy_returns,sharpey_returns,sotinoy_returns,betay_returns,alphay_returns,treynory_returns,rank_sd,rank_sharpe,rank_sotino,rank_beta,rank_alpha,rank_treynor,index_name,s_name,avg_std_dev,avg_sharpe,avg_sotino,avg_beta,avg_alpha,avg_treyno,no_of_funds_total
SBI CRISIL IBX Gilt Index - Apr 2029 Fund-Reg(G),2022-10-04,46971,1.78,2.09,3.76,0.2,3.15,18.6,0.11,0.13,0.24,0.2,0.01,0.07,43,42,42,41,39,41,CRISIL IBX Gilt Index - April 2029,SBI CRISIL IBX Gilt Index - Apr 2029 Fund-Reg(G),1.33,3.18,6.37,0.13,3.38,27.81,52
Parag Parikh Liquid Fund-Reg(G),2018-05-11,38735,0.11,21.16,19.96,0.0,2.34,1700.37,0.01,1.33,1.26,0.0,0.01,6.75,27,27,9,36,12,23,CRISIL Liquid Debt Index,Parag Parikh Liquid Fund-Reg(G),0.09,27.28,17.31,0.0,2.25,856.14,36
Bajaj Finserv Money Market Fund-Reg(G),2023-07-24,48065,,,,,,,,,,,,,,,,,,,Nifty Money Market Index,Bajaj Finserv Money Market Fund-Reg(G),0.31,14.36,30.17,0.0,4.51,-3587.18,21
Axis CRISIL IBX SDL May 2027 Index Fund-Reg(G),2022-02-23,45999,1.04,3.96,8.2,0.08,3.91,53.7,0.07,0.25,0.52,0.08,0.02,0.21,15,12,12,16,4,12,CRISIL IBX SDL Index - May 2027,Axis CRISIL IBX SDL May 2027 Index Fund-Reg(G),1.33,3.18,6.37,0.13,3.38,27.81,52
BHARAT Bond ETF FOF - April 2033 -Reg(G),2022-12-14,47284,6.22,0.75,1.24,0.1,4.38,46.34,0.39,0.05,0.08,0.1,0.02,0.18,26,48,48,12,39,42,NIFTY BHARAT Bond Index - April 2033,BHARAT Bond ETF FOF - April 2033 -Reg(G),7.31,3.02,5.28,0.24,18.18,116.32,53
Quant Large & Mid Cap Fund(G),2006-12-11,874,14.45,3.33,5.28,0.92,32.1,52.11,0.91,0.21,0.33,0.92,0.13,0.21,26,10,11,25,1,4,NIFTY LargeMidcap 250 - TRI,Quant Large & Mid Cap Fund(G),10.75,3.21,5.07,0.81,20.32,42.54,26
JM Liquid Fund(G),1997-12-31,1909,0.05,37.27,15.09,0.0,2.04,-8615.7,0.0,2.35,0.95,0.0,0.01,-34.19,2,3,19,6,28,26,CRISIL Liquid Debt Index,JM Liquid Fund(G),0.09,27.28,17.31,0.0,2.25,856.14,36
Sundaram Flexi Cap Fund-Reg(G),2022-09-06,46622,9.75,2.51,4.09,0.88,9.22,27.9,0.61,0.16,0.26,0.88,0.04,0.11,16,37,37,30,37,38,NIFTY 500 - TRI,Sundaram Flexi Cap Fund-Reg(G),10.38,3.05,4.98,0.81,17.28,38.32,41
Axis Balanced Advantage Fund-Reg(G),2017-08-01,37918,6.7,3.08,5.29,0.22,20.03,94.9,0.42,0.19,0.33,0.22,0.08,0.38,18,16,14,20,12,19,NIFTY 50 Hybrid Composite Debt 50:50 Index,Axis Balanced Advantage Fund-Reg(G),6.46,3.21,5.37,0.2,19.79,114.89,26
ICICI Pru Commodities Fund(G),2019-10-15,41999,16.67,2.22,3.54,1.04,18.85,35.48,1.05,0.14,0.22,1.04,0.07,0.14,41,42,43,41,24,32,NIFTY COMMODITIES - TRI,ICICI Pru Commodities Fund(G),11.31,3.14,5.18,0.82,21.14,43.21,44
Mirae Asset NYSE FANG+ ETF,2021-05-07,45379,23.83,2.21,3.85,-0.06,52.89,-936.71,1.5,0.14,0.24,-0.06,0.21,-3.72,125,75,73,1,2,129,NYSE FANG+ TRI,Mirae Asset NYSE FANG+ ETF,12.82,2.39,4.07,0.86,16.67,42.97,129
Sundaram Ultra Short Duration Fund(G),2007-12-28,4186,0.26,13.48,28.0,0.0,3.53,-3171.45,0.02,0.85,1.76,0.0,0.01,-12.59,2,19,20,8,23,10,NIFTY Ultra Short Duration Debt Index,Sundaram Ultra Short Duration Fund(G),0.29,14.2,29.59,0.0,4.16,-4812.46,24
Templeton India Equity Income Fund(G),2006-05-18,3367,11.46,3.09,5.19,0.79,21.67,44.88,0.72,0.19,0.33,0.79,0.09,0.18,7,8,5,2,4,4,NIFTY 500 - TRI,Templeton India Equity Income Fund(G),10.99,3.31,5.45,0.85,21.62,42.98,9
Sundaram Multi Asset Allocation Fund-Reg(G),2024-01-25,48460,,,,,,,,,,,,,,,,,,,NIFTY 500 - TRI,Sundaram Multi Asset Allocation Fund-Reg(G),7.09,3.34,5.74,0.29,23.06,138.51,12
Tata Business Cycle Fund-Reg(G),2021-08-04,45373,11.02,3.64,5.72,0.86,25.23,46.77,0.69,0.23,0.36,0.86,0.1,0.19,30,10,11,31,11,14,NIFTY 500 - TRI,Tata Business Cycle Fund-Reg(G),11.31,3.14,5.18,0.82,21.14,43.21,44
UTI-Nifty Next 50 ETF,2017-08-04,37338,13.47,3.68,5.88,0.86,35.91,57.76,0.85,0.23,0.37,0.86,0.14,0.23,93,7,17,50,17,25,NIFTY NEXT 50,UTI-Nifty Next 50 ETF,12.82,2.39,4.07,0.86,16.67,42.97,129
SBI Consumption Opp Fund-Reg(G),2013-01-01,19166,9.29,3.08,4.96,0.58,18.6,49.69,0.59,0.19,0.31,0.58,0.07,0.2,5,9,12,4,8,4,Nifty India Consumption - TRI,SBI Consumption Opp Fund-Reg(G),9.46,3.12,5.16,0.63,18.35,46.35,13
Tata Large Cap Fund-Reg(G),1998-05-07,3281,10.38,2.64,4.28,0.94,11.14,29.28,0.65,0.17,0.27,0.94,0.04,0.12,28,24,26,34,21,23,NIFTY 100 - TRI,Tata Large Cap Fund-Reg(G),10.13,2.76,4.64,0.88,12.66,31.65,36
Quant Liquid Plan(G),2005-09-29,883,0.15,19.01,22.87,0.0,2.77,3190.24,0.01,1.2,1.44,0.0,0.01,12.66,30,31,7,32,5,19,CRISIL Liquid Debt Index,Quant Liquid Plan(G),0.09,27.28,17.31,0.0,2.25,856.14,36
Franklin India Liquid Fund-Super Inst(G),2005-09-02,3406,0.07,31.73,14.98,0.0,2.07,-9915.07,0.0,2.0,0.94,0.0,0.01,-39.35,7,7,24,5,15,27,Nifty Liquid Fund Index,Franklin India Liquid Fund-Super Inst(G),0.09,27.28,17.31,0.0,2.25,856.14,36
Canara Rob Mid Cap Fund-Reg(G),2022-12-02,46001,10.42,3.42,5.5,0.64,24.47,55.41,0.66,0.22,0.35,0.64,0.1,0.22,5,17,11,4,23,17,S&P BSE 150 MidCap - TRI,Canara Rob Mid Cap Fund-Reg(G),11.88,3.42,5.33,0.73,28.12,56.06,30
Canara Rob Multi Cap Fund-Reg(G),2023-07-28,46370,,,,,,,,,,,,,,,,,,,Nifty500 Multicap 50:25:25 - TRI,Canara Rob Multi Cap Fund-Reg(G),10.61,3.18,5.09,0.8,19.86,42.4,33
HSBC Arbitrage Fund-Reg(G),2014-06-30,29550,0.94,4.88,9.54,0.01,4.56,724.78,0.06,0.31,0.6,0.01,0.02,2.88,19,19,20,7,16,7,Nifty 50 Arbitrage,HSBC Arbitrage Fund-Reg(G),0.89,5.08,10.13,0.01,4.49,1079.57,24
LIC MF Nifty 8-13 yr G-Sec ETF,2014-12-24,31581,2.57,1.58,2.8,0.32,3.28,12.47,0.16,0.1,0.18,0.32,0.01,0.05,15,16,16,15,12,15,Nifty 8-13 yr G-Sec,LIC MF Nifty 8-13 yr G-Sec ETF,1.27,6.3,10.34,0.23,3.44,31.99,17
Union Flexi Cap Fund-Reg(G),2011-06-10,14559,9.53,3.18,5.0,0.8,16.46,38.03,0.6,0.2,0.32,0.8,0.07,0.15,8,16,19,16,21,18,S&P BSE 500 - TRI,Union Flexi Cap Fund-Reg(G),10.38,3.05,4.98,0.81,17.28,38.32,41
Mahindra Manulife Large & Mid Cap Fund-Reg(G),2019-12-30,43915,13.25,3.05,4.62,0.93,24.34,43.65,0.83,0.19,0.29,0.93,0.1,0.17,25,15,21,26,6,11,NIFTY LargeMidcap 250 - TRI,Mahindra Manulife Large & Mid Cap Fund-Reg(G),10.75,3.21,5.07,0.81,20.32,42.54,26
Tata Ultra Short Term Fund-Reg(G),2019-01-22,41798,0.28,14.14,28.84,0.0,4.01,-3345.4,0.02,0.89,1.82,0.0,0.02,-13.28,8,13,17,5,17,12,CRISIL Ultra Short Term Debt Index,Tata Ultra Short Term Fund-Reg(G),0.29,14.2,29.59,0.0,4.16,-4812.46,24
Bandhan Multi Cap Fund-Reg(G),2021-12-02,45867,10.22,3.27,4.97,0.79,19.76,42.54,0.64,0.21,0.31,0.79,0.08,0.17,14,14,20,14,18,19,Nifty500 Multicap 50:25:25 - TRI,Bandhan Multi Cap Fund-Reg(G),10.61,3.18,5.09,0.8,19.86,42.4,33
Axis Strategic Bond Fund-Reg(G),2012-03-28,8136,1.1,3.88,7.4,0.13,3.93,33.26,0.07,0.24,0.47,0.13,0.02,0.13,22,17,18,25,7,20,NIFTY Medium Duration Debt Index,Axis Strategic Bond Fund-Reg(G),0.94,4.47,9.21,0.09,3.5,59.55,30
Nippon India ETF Nifty IT,2020-06-30,44506,17.89,0.93,1.79,0.98,1.06,17.01,1.13,0.06,0.11,0.98,0.0,0.07,116,109,107,95,110,109,NIFTY IT - TRI,Nippon India ETF Nifty IT,12.82,2.39,4.07,0.86,16.67,42.97,129
Tata Banking & Financial Services Fund-Reg(G),2015-12-28,33726,12.24,1.74,2.72,0.96,4.59,22.13,0.77,0.11,0.17,0.96,0.02,0.09,14,10,11,7,10,10,Nifty Financial Services - TRI,Tata Banking & Financial Services Fund-Reg(G),11.83,1.94,3.24,0.94,6.26,24.02,15
Parag Parikh Conservative Hybrid Fund-Reg(G),2021-05-26,45338,2.85,4.58,9.45,0.07,12.83,186.63,0.18,0.29,0.6,0.07,0.05,0.74,15,3,2,3,1,1,CRISIL Hybrid 85+15 - Conservative Index,Parag Parikh Conservative Hybrid Fund-Reg(G),2.62,3.61,6.61,0.13,8.96,83.67,19
ICICI Pru Silver ETF,2022-01-24,46214,20.03,0.34,0.56,1.11,4.26,6.2,1.26,0.02,0.04,1.11,0.02,0.02,19,15,15,19,15,17,Silver,ICICI Pru Silver ETF,14.34,0.96,1.74,0.5,9.65,30.86,21
Tata Retirement Sav Fund - Mod Plan(G),2011-11-04,15379,8.6,2.89,4.4,0.25,24.19,99.59,0.54,0.18,0.28,0.25,0.1,0.4,24,25,30,28,15,19,CRISIL Hybrid 25+75 - Aggressive Index,Tata Retirement Sav Fund - Mod Plan(G),6.78,3.1,5.26,0.23,20.02,126.67,38
Quant Quantamental Fund-Reg(G),2021-04-30,45480,15.72,3.22,4.98,1.0,33.24,50.68,0.99,0.2,0.31,1.0,0.13,0.2,40,18,21,40,7,11,NIFTY 200 - TRI,Quant Quantamental Fund-Reg(G),11.31,3.14,5.18,0.82,21.14,43.21,44
Tata India Consumer Fund-Reg(G),2015-12-28,33728,9.68,3.34,5.58,0.56,22.6,57.78,0.61,0.21,0.35,0.56,0.09,0.23,10,4,3,3,2,2,Nifty India Consumption - TRI,Tata India Consumer Fund-Reg(G),9.46,3.12,5.16,0.63,18.35,46.35,13
Tata Infrastructure Fund-Reg(G),2004-12-31,3254,13.47,3.86,6.03,0.83,37.67,63.03,0.85,0.24,0.38,0.83,0.15,0.25,12,9,7,9,7,8,S&P BSE India Infrastructure Index - TRI,Tata Infrastructure Fund-Reg(G),13.29,3.8,5.95,0.84,35.56,60.18,19
HSBC CRISIL IBX 50:50 Gilt Plus SDL Apr 2028 Index Fund-Reg(G),2022-03-31,46506,1.13,3.29,6.58,0.13,3.38,28.98,0.07,0.21,0.41,0.13,0.01,0.12,21,24,24,29,33,28,CRISIL IBX 50:50 Gilt Plus SDL Index - April 2028,HSBC CRISIL IBX 50:50 Gilt Plus SDL Apr 2028 Index Fund-Reg(G),1.33,3.18,6.37,0.13,3.38,27.81,52
SBI PSU Fund-Reg(G),2010-07-07,9252,20.46,3.32,5.17,1.1,48.89,61.84,1.29,0.21,0.33,1.1,0.19,0.25,44,16,17,43,1,4,S&P BSE PSU - TRI,SBI PSU Fund-Reg(G),11.31,3.14,5.18,0.82,21.14,43.21,44
Quant Absolute Fund(G),2001-03-20,865,11.45,2.61,4.12,0.08,29.71,353.28,0.72,0.16,0.26,0.08,0.12,1.4,55,47,47,11,4,2,CRISIL Hybrid 25+75 - Aggressive Index,Quant Absolute Fund(G),5.71,3.2,5.42,0.16,18.49,134.87,53
Baroda BNP Paribas Large Cap Fund-Reg(G),2004-09-23,23,9.83,3.19,5.35,0.89,15.85,35.15,0.62,0.2,0.34,0.89,0.06,0.14,17,6,6,17,10,11,NIFTY 100 - TRI,Baroda BNP Paribas Large Cap Fund-Reg(G),10.13,2.76,4.64,0.88,12.66,31.65,36
Axis Nifty AAA Bond Plus SDL Apr 2026 50:50 ETF,2021-05-11,45337,0.58,7.25,15.24,0.04,4.11,115.92,0.04,0.46,0.96,0.04,0.02,0.46,6,6,5,7,5,6,Nifty AAA Bond Plus SDL Apr 2026 50:50 Index,Axis Nifty AAA Bond Plus SDL Apr 2026 50:50 ETF,1.27,6.3,10.34,0.23,3.44,31.99,17
Aditya Birla SL Medium Term Plan-Reg(G),2009-03-25,7683,1.14,3.31,6.27,0.12,3.45,30.67,0.07,0.21,0.39,0.12,0.01,0.12,24,23,24,24,21,24,CRISIL Medium Duration Debt Index,Aditya Birla SL Medium Term Plan-Reg(G),0.94,4.47,9.21,0.09,3.5,59.55,30
Kotak Bond Fund-Reg(G),1999-11-25,1968,2.01,1.8,3.21,0.24,2.95,15.15,0.13,0.11,0.2,0.24,0.01,0.06,48,45,45,50,43,45,CRISIL Medium to Long Term Debt Index,Kotak Bond Fund-Reg(G),1.33,3.18,6.37,0.13,3.38,27.81,52
Quant Multi Asset Fund(G),2001-03-20,869,11.46,3.17,5.02,0.17,35.83,214.86,0.72,0.2,0.32,0.17,0.14,0.85,12,8,9,5,1,2,S&P BSE 200 - TRI,Quant Multi Asset Fund(G),7.09,3.34,5.74,0.29,23.06,138.51,12
Templeton India Value Fund(G),2003-09-05,3379,10.82,3.33,5.38,0.86,21.04,41.88,0.68,0.21,0.34,0.86,0.08,0.17,13,13,14,9,12,14,NIFTY 500 - TRI,Templeton India Value Fund(G),11.18,3.4,5.51,0.86,22.98,44.18,21
Kotak Manufacture in India Fund-Reg(G),2022-02-22,46107,10.71,3.59,5.95,0.76,25.17,50.58,0.67,0.23,0.37,0.76,0.1,0.2,26,12,10,15,12,12,Nifty India Manufacturing - TRI,Kotak Manufacture in India Fund-Reg(G),11.31,3.14,5.18,0.82,21.14,43.21,44
HDFC Gold Fund(G),2011-11-01,15381,9.69,1.44,2.73,0.21,13.38,67.66,0.61,0.09,0.17,0.21,0.05,0.27,1,2,2,4,9,4,Gold-India,HDFC Gold Fund(G),12.11,1.13,2.1,0.45,11.29,58.46,15
Motilal Oswal Focused Fund-Reg(G),2013-05-13,21769,11.53,2.0,3.2,0.74,10.23,31.2,0.73,0.13,0.2,0.74,0.04,0.12,32,34,35,1,24,15,NIFTY 500 - TRI,Motilal Oswal Focused Fund-Reg(G),10.13,2.76,4.64,0.88,12.66,31.65,36
Aditya Birla SL G-Sec Fund(G),1999-10-11,399,2.38,1.73,3.13,0.26,3.4,16.08,0.15,0.11,0.2,0.26,0.01,0.06,28,21,20,22,10,18,Nifty All Duration G-Sec Index,Aditya Birla SL G-Sec Fund(G),1.98,2.12,3.98,0.22,3.19,19.24,35
Baroda BNP Paribas Mid Cap Fund-Reg(G),2006-05-02,172,11.41,3.45,5.28,0.7,27.24,56.37,0.72,0.22,0.33,0.7,0.11,0.22,13,15,19,13,17,15,Nifty Midcap 150 - TRI,Baroda BNP Paribas Mid Cap Fund-Reg(G),11.88,3.42,5.33,0.73,28.12,56.06,30
JM Flexicap Fund-Reg(G),2008-09-23,6075,12.4,3.95,6.05,0.89,33.52,54.94,0.78,0.25,0.38,0.89,0.13,0.22,38,2,4,34,2,2,S&P BSE 500 - TRI,JM Flexicap Fund-Reg(G),10.38,3.05,4.98,0.81,17.28,38.32,41
ITI Small Cap Fund-Reg(G),2020-02-17,44399,14.16,3.62,5.21,0.77,37.8,66.18,0.89,0.23,0.33,0.77,0.15,0.26,22,6,7,22,3,6,Nifty Smallcap 250 - TRI,ITI Small Cap Fund-Reg(G),12.26,3.28,4.8,0.66,28.85,60.88,24
HSBC Large Cap Fund(G),2002-12-10,1348,10.09,2.8,4.75,0.92,12.2,30.64,0.64,0.18,0.3,0.92,0.05,0.12,26,18,17,28,17,19,NIFTY 100 - TRI,HSBC Large Cap Fund(G),10.13,2.76,4.64,0.88,12.66,31.65,36
Aditya Birla SL Income Fund(G),1995-10-21,405,2.09,1.51,2.61,0.22,2.52,14.06,0.13,0.1,0.16,0.22,0.01,0.06,49,50,50,45,48,47,CRISIL Medium to Long Term Debt Index,Aditya Birla SL Income Fund(G),1.33,3.18,6.37,0.13,3.38,27.81,52
ICICI Pru Nifty SDL Sep 2027 Index Fund-Reg(G),2022-03-24,46528,1.17,3.48,7.11,0.08,3.86,51.81,0.07,0.22,0.45,0.08,0.02,0.21,25,20,17,17,8,15,Nifty SDL Sep 2027 Index,ICICI Pru Nifty SDL Sep 2027 Index Fund-Reg(G),1.33,3.18,6.37,0.13,3.38,27.81,52
Tata Retirement Sav Fund - Prog Plan(G),2011-11-04,15380,10.02,2.97,4.5,0.26,29.08,113.53,0.63,0.19,0.28,0.26,0.12,0.45,34,23,27,30,8,15,NIFTY 500 - TRI,Tata Retirement Sav Fund - Prog Plan(G),6.78,3.1,5.26,0.23,20.02,126.67,38
SBI Magnum Income Fund-Reg(G),1998-11-25,2776,1.36,2.71,5.19,0.15,3.25,23.99,0.09,0.17,0.33,0.15,0.01,0.1,32,31,31,34,36,33,CRISIL Medium to Long Term Debt Index,SBI Magnum Income Fund-Reg(G),1.33,3.18,6.37,0.13,3.38,27.81,52
Franklin India Balanced Advantage Fund-Reg(G),2022-09-06,46625,5.31,3.99,6.5,0.14,20.79,153.32,0.33,0.25,0.41,0.14,0.08,0.61,9,3,4,6,7,4,NIFTY 50 Hybrid Composite Debt 50:50 Index,Franklin India Balanced Advantage Fund-Reg(G),6.46,3.21,5.37,0.2,19.79,114.89,26
Kotak Medium Term Fund(G),2014-03-21,22514,1.3,3.24,6.72,0.1,3.93,43.27,0.08,0.2,0.42,0.1,0.02,0.17,29,24,22,15,8,14,CRISIL Medium Duration Debt Index,Kotak Medium Term Fund(G),0.94,4.47,9.21,0.09,3.5,59.55,30
SBI Magnum Childrens Benefit Fund-Investment Plan-Reg(G),2020-09-29,34199,8.31,3.91,6.98,0.04,32.38,876.0,0.52,0.25,0.44,0.04,0.13,3.48,23,4,4,1,5,1,CRISIL Hybrid 35+65 - Aggressive Index,SBI Magnum Childrens Benefit Fund-Investment Plan-Reg(G),6.78,3.1,5.26,0.23,20.02,126.67,38
Baroda BNP Paribas Value Fund-Reg(G),2023-06-07,47940,,,,,,,,,,,,,,,,,,,NIFTY 500 - TRI,Baroda BNP Paribas Value Fund-Reg(G),11.18,3.4,5.51,0.86,22.98,44.18,21
Franklin India Equity Hybrid Fund(G),1999-12-10,999,7.26,3.55,5.79,0.18,25.28,140.84,0.46,0.22,0.36,0.18,0.1,0.56,36,18,22,36,10,13,CRISIL Hybrid 35+65 - Aggressive Index,Franklin India Equity Hybrid Fund(G),5.71,3.2,5.42,0.16,18.49,134.87,53
Axis Dynamic Bond Fund-Reg(G),2011-04-27,12380,1.09,3.3,5.53,0.1,3.3,34.65,0.07,0.21,0.35,0.1,0.01,0.14,3,4,4,3,9,3,NIFTY Composite Debt Index,Axis Dynamic Bond Fund-Reg(G),1.69,2.77,5.2,0.17,3.2,-709.63,22
Nippon India Gold Savings Fund(G),2011-03-07,14108,10.39,1.37,2.59,0.28,13.43,51.08,0.65,0.09,0.16,0.28,0.05,0.2,8,8,6,9,8,9,Gold-India,Nippon India Gold Savings Fund(G),12.11,1.13,2.1,0.45,11.29,58.46,15
Tata Overnight Fund-Reg(G),2019-03-27,42706,0.01,158.26,13.04,0.0,1.69,-25067.83,0.0,9.97,0.82,0.0,0.01,-99.48,16,17,14,9,22,31,CRISIL Liquid Overnight Index,Tata Overnight Fund-Reg(G),0.04,125.84,16.27,0.0,1.88,9698.26,32
Mirae Asset Flexi Cap Fund-Reg(G),2023-02-24,47596,9.93,2.66,4.32,0.87,11.34,30.47,0.63,0.17,0.27,0.87,0.04,0.12,20,33,32,28,34,35,NIFTY 500 - TRI,Mirae Asset Flexi Cap Fund-Reg(G),10.38,3.05,4.98,0.81,17.28,38.32,41
Aditya Birla SL Dynamic Bond Fund-Reg(G),2004-09-27,302,1.73,2.12,3.85,0.18,3.15,20.39,0.11,0.13,0.24,0.18,0.01,0.08,12,10,11,10,13,13,NIFTY Composite Debt Index,Aditya Birla SL Dynamic Bond Fund-Reg(G),1.69,2.77,5.2,0.17,3.2,-709.63,22
Edelweiss Flexi Cap Fund-Reg(G),2015-02-03,31778,10.26,3.24,5.44,0.89,17.77,37.42,0.65,0.2,0.34,0.89,0.07,0.15,28,15,13,33,17,21,NIFTY 500 - TRI,Edelweiss Flexi Cap Fund-Reg(G),10.38,3.05,4.98,0.81,17.28,38.32,41
SBI Long Duration Fund-Reg(G),2022-12-21,46864,3.85,1.16,2.0,0.46,3.18,9.8,0.24,0.07,0.13,0.46,0.01,0.04,18,17,17,18,15,17,CRISIL Long Duration Debt Index,SBI Long Duration Fund-Reg(G),2.69,1.66,3.08,0.51,3.38,17.25,19
Navi Nifty 50 Index Fund-Reg(G),2021-07-15,45614,9.97,2.03,3.51,0.97,3.4,20.89,0.63,0.13,0.22,0.97,0.01,0.08,16,67,68,74,68,67,NIFTY 50 - TRI,Navi Nifty 50 Index Fund-Reg(G),12.11,2.8,4.55,0.87,19.56,41.14,91
UTI Multi Asset Allocation Fund-Reg(G),2008-12-17,7143,7.05,4.46,7.62,0.21,30.84,149.84,0.44,0.28,0.48,0.21,0.12,0.59,7,1,2,9,2,5,CRISIL Composite Bond Index,UTI Multi Asset Allocation Fund-Reg(G),7.09,3.34,5.74,0.29,23.06,138.51,12
Kotak Gold Fund(G),2011-03-25,14148,10.29,1.38,2.53,0.22,13.56,63.71,0.65,0.09,0.16,0.22,0.05,0.25,6,7,8,6,5,6,Gold-India,Kotak Gold Fund(G),12.11,1.13,2.1,0.45,11.29,58.46,15
HDFC Infrastructure Fund(G),2008-03-10,4253,14.13,4.18,6.41,0.85,44.33,69.55,0.89,0.26,0.4,0.85,0.18,0.28,16,3,4,12,1,3,S&P BSE India Infrastructure Index - TRI,HDFC Infrastructure Fund(G),13.29,3.8,5.95,0.84,35.56,60.18,19
Nippon India ETF Nifty 8-13 yr G-Sec Long Term Gilt,2016-07-05,35459,2.57,1.59,2.82,0.32,3.3,12.57,0.16,0.1,0.18,0.32,0.01,0.05,16,15,15,16,11,14,Nifty 8-13 yr G-Sec,Nippon India ETF Nifty 8-13 yr G-Sec Long Term Gilt,1.27,6.3,10.34,0.23,3.44,31.99,17
WOC Mid Cap Fund-Reg(G),2022-09-07,46769,11.32,3.77,5.88,0.69,30.64,61.54,0.71,0.24,0.37,0.69,0.12,0.24,10,3,4,11,10,5,S&P BSE 150 MidCap - TRI,WOC Mid Cap Fund-Reg(G),11.88,3.42,5.33,0.73,28.12,56.06,30
Nippon India Silver ETF,2022-02-04,46199,19.77,0.33,0.54,1.12,3.91,5.82,1.25,0.02,0.03,1.12,0.02,0.02,17,17,16,20,18,18,Silver,Nippon India Silver ETF,14.34,0.96,1.74,0.5,9.65,30.86,21
Edelweiss Multi Cap Fund-Reg(G),2023-10-25,48147,,,,,,,,,,,,,,,,,,,Nifty500 Multicap 50:25:25 - TRI,Edelweiss Multi Cap Fund-Reg(G),10.61,3.18,5.09,0.8,19.86,42.4,33
Aditya Birla SL Business Cycle Fund-Reg(G),2021-12-03,45733,10.04,2.43,4.06,0.9,8.67,26.99,0.63,0.15,0.26,0.9,0.03,0.11,20,40,38,35,41,42,S&P BSE 500 - TRI,Aditya Birla SL Business Cycle Fund-Reg(G),11.31,3.14,5.18,0.82,21.14,43.21,44
Tata Focused Equity Fund-Reg(G),2019-12-05,44148,10.57,2.86,4.6,0.89,14.69,33.84,0.67,0.18,0.29,0.89,0.06,0.13,18,27,26,32,26,28,NIFTY 500 - TRI,Tata Focused Equity Fund-Reg(G),10.61,3.18,5.09,0.8,19.86,42.4,33
Nippon India ETF Nifty CPSE Bond Plus SDL Sep 2024 50:50,2020-11-17,45171,0.34,13.03,29.09,0.01,4.36,812.5,0.02,0.82,1.83,0.01,0.02,3.22,4,3,1,4,2,3,Nifty CPSE Bond Plus SDL Sep 2024 50:50 Index,Nippon India ETF Nifty CPSE Bond Plus SDL Sep 2024 50:50,1.27,6.3,10.34,0.23,3.44,31.99,17
SBI Magnum Constant Maturity Fund-Reg(G),2000-12-25,2756,2.6,1.42,2.54,0.31,2.8,11.74,0.16,0.09,0.16,0.31,0.01,0.05,1,3,3,3,4,3,Nifty 10 yr Benchmark G-Sec,SBI Magnum Constant Maturity Fund-Reg(G),2.67,1.41,2.53,0.32,2.89,11.87,6
Union Balanced Advantage Fund-Reg(G),2017-12-29,38378,5.69,2.62,4.25,0.15,14.49,97.02,0.36,0.17,0.27,0.15,0.06,0.38,13,23,24,9,24,18,NIFTY 50 Hybrid Composite Debt 50:50 Index,Union Balanced Advantage Fund-Reg(G),6.46,3.21,5.37,0.2,19.79,114.89,26
Kotak Infra & Eco Reform Fund(G),2008-02-25,4228,11.59,3.79,6.01,0.72,31.35,61.14,0.73,0.24,0.38,0.72,0.12,0.24,3,11,8,1,14,9,Nifty Infrastructure - TRI,Kotak Infra & Eco Reform Fund(G),13.29,3.8,5.95,0.84,35.56,60.18,19
SBI Gold-Reg(G),2011-09-12,14666,9.99,1.5,2.91,0.17,14.57,90.57,0.63,0.09,0.18,0.17,0.06,0.36,3,1,1,3,1,3,Gold-London Bullion Market association (LBMA),SBI Gold-Reg(G),12.11,1.13,2.1,0.45,11.29,58.46,15
Sundaram Diversified Equity(G),2005-05-02,3072,9.53,2.37,3.86,0.88,7.38,25.83,0.6,0.15,0.24,0.88,0.03,0.1,14,54,54,50,54,54,NIFTY 500 - TRI,Sundaram Diversified Equity(G),10.45,3.01,4.87,0.79,17.76,40.88,59
Mirae Asset Banking and Financial Services Fund-Reg(G),2020-12-11,45174,12.12,1.89,3.12,0.99,5.7,23.16,0.76,0.12,0.2,0.99,0.02,0.09,12,8,8,14,7,7,Nifty Financial Services - TRI,Mirae Asset Banking and Financial Services Fund-Reg(G),11.83,1.94,3.24,0.94,6.26,24.02,15
ICICI Pru MNC Fund(G),2019-06-17,41965,8.25,3.25,5.24,0.56,16.46,47.85,0.52,0.2,0.33,0.56,0.07,0.19,1,1,1,5,2,2,NIFTY MNC - TRI,ICICI Pru MNC Fund(G),8.86,2.66,4.33,0.53,14.2,44.32,5
Axis Equity Hybrid Fund-Reg(G),2018-08-09,40568,7.38,2.17,3.44,0.17,15.47,91.35,0.46,0.14,0.22,0.17,0.06,0.36,38,51,52,30,33,43,CRISIL Hybrid 35+65 - Aggressive Index,Axis Equity Hybrid Fund-Reg(G),5.71,3.2,5.42,0.16,18.49,134.87,53
Bandhan Bond Fund - Medium Term Plan-Reg(G),2003-07-08,1084,1.5,1.99,3.65,0.18,2.47,16.41,0.09,0.13,0.23,0.18,0.01,0.07,30,29,29,30,29,29,NIFTY Medium Duration Debt Index,Bandhan Bond Fund - Medium Term Plan-Reg(G),0.94,4.47,9.21,0.09,3.5,59.55,30
UTI Conservative Hybrid Fund-Reg(G),2003-12-16,3631,2.75,3.72,6.62,0.14,9.83,73.23,0.17,0.23,0.42,0.14,0.04,0.29,13,9,9,12,9,12,NIFTY 50 Hybrid Composite Debt 15:85 Index,UTI Conservative Hybrid Fund-Reg(G),2.62,3.61,6.61,0.13,8.96,83.67,19
Baroda BNP Paribas Gilt Fund-Reg(G),2002-03-21,497,2.13,1.85,3.4,0.26,3.2,15.27,0.13,0.12,0.21,0.26,0.01,0.06,16,15,16,23,16,22,CRISIL Dynamic Gilt Index,Baroda BNP Paribas Gilt Fund-Reg(G),1.98,2.12,3.98,0.22,3.19,19.24,35
HSBC Focused Fund-Reg(G),2020-07-22,44739,10.53,3.02,5.0,0.88,16.56,36.26,0.66,0.19,0.31,0.88,0.07,0.14,17,22,19,30,24,25,NIFTY 500 - TRI,HSBC Focused Fund-Reg(G),10.61,3.18,5.09,0.8,19.86,42.4,33
Aditya Birla SL CRISIL IBX 60:40 SDL + AAA PSU - Apr 2027 Index Fund-Reg(G),2022-03-29,46227,0.75,5.17,10.51,0.07,3.68,52.47,0.05,0.33,0.66,0.07,0.01,0.21,3,5,6,13,17,14,CRISIL IBX 60:40 SDL + AAA PSU Index - April 2027,Aditya Birla SL CRISIL IBX 60:40 SDL + AAA PSU - Apr 2027 Index Fund-Reg(G),1.33,3.18,6.37,0.13,3.38,27.81,52
Nippon India Gilt Securities Fund(G),2008-08-22,6291,2.3,1.61,3.03,0.26,2.95,14.11,0.14,0.1,0.19,0.26,0.01,0.06,24,27,24,25,25,28,Nifty All Duration G-Sec Index,Nippon India Gilt Securities Fund(G),1.98,2.12,3.98,0.22,3.19,19.24,35
Mirae Asset Balanced Advantage Fund-Reg(G),2022-08-11,46224,5.33,3.22,5.42,0.14,16.78,125.55,0.34,0.2,0.34,0.14,0.07,0.5,10,13,12,4,17,10,NIFTY 50 Hybrid Composite Debt 50:50 Index,Mirae Asset Balanced Advantage Fund-Reg(G),6.46,3.21,5.37,0.2,19.79,114.89,26
ICICI Pru Thematic Advantage Fund(FOF)(G),2003-12-18,1706,7.17,3.9,6.7,0.15,27.49,185.37,0.45,0.25,0.42,0.15,0.11,0.74,31,12,11,21,12,6,NIFTY 200 - TRI,ICICI Pru Thematic Advantage Fund(FOF)(G),7.31,3.02,5.28,0.24,18.18,116.32,53
Sundaram Balanced Advantage Fund(G),2010-12-16,13366,5.77,2.81,4.89,0.16,15.78,100.4,0.36,0.18,0.31,0.16,0.06,0.4,14,22,20,10,22,15,NIFTY 50 Hybrid Composite Debt 50:50 Index,Sundaram Balanced Advantage Fund(G),6.46,3.21,5.37,0.2,19.79,114.89,26
Motilal Oswal Small Cap Fund-Reg(G),2023-12-26,48388,,,,,,,,,,,,,,,,,,,Nifty Smallcap 250 - TRI,Motilal Oswal Small Cap Fund-Reg(G),12.26,3.28,4.8,0.66,28.85,60.88,24
DSP Multi Asset Allocation Fund-Reg(G),2023-09-27,48206,,,,,,,,,,,,,,,,,,,NIFTY 500 - TRI,DSP Multi Asset Allocation Fund-Reg(G),7.09,3.34,5.74,0.29,23.06,138.51,12
Nippon India Index Fund-Nifty 50 Plan(G),2010-09-28,12860,9.96,2.01,3.48,0.97,3.2,20.69,0.63,0.13,0.22,0.97,0.01,0.08,12,75,76,72,74,77,NIFTY 50 - TRI,Nippon India Index Fund-Nifty 50 Plan(G),12.11,2.8,4.55,0.87,19.56,41.14,91
Franklin India Money Market Fund(G),2002-02-11,3361,0.32,14.73,31.26,0.0,4.71,-4431.22,0.02,0.93,1.97,0.0,0.02,-17.58,9,8,3,5,9,10,Nifty Money Market Index,Franklin India Money Market Fund(G),0.31,14.36,30.17,0.0,4.51,-3587.18,21
Bandhan Focused Equity Fund-Reg(G),2006-03-16,2896,10.91,2.73,4.41,0.83,15.3,35.73,0.69,0.17,0.28,0.83,0.06,0.14,23,28,29,22,25,26,S&P BSE 500 - TRI,Bandhan Focused Equity Fund-Reg(G),10.61,3.18,5.09,0.8,19.86,42.4,33
Invesco India Flexi Cap Fund-Reg(G),2022-02-14,45945,9.62,3.92,6.47,0.79,23.99,47.68,0.61,0.25,0.41,0.79,0.1,0.19,12,3,2,11,7,6,S&P BSE 500 - TRI,Invesco India Flexi Cap Fund-Reg(G),10.38,3.05,4.98,0.81,17.28,38.32,41
UTI Floater Fund-Reg(G),2018-10-30,39630,0.32,13.06,27.39,0.01,4.13,445.64,0.02,0.82,1.73,0.01,0.02,1.77,1,1,1,2,11,2,NIFTY Low Duration Debt Index,UTI Floater Fund-Reg(G),0.61,8.98,18.65,0.03,4.69,627.65,13
Mirae Asset Ultra Short Duration Fund-Reg(G),2020-10-07,45100,0.3,15.44,30.84,0.0,4.66,-7359.46,0.02,0.97,1.94,0.0,0.02,-29.2,18,2,6,14,2,19,NIFTY Ultra Short Duration Debt Index,Mirae Asset Ultra Short Duration Fund-Reg(G),0.29,14.2,29.59,0.0,4.16,-4812.46,24
ICICI Pru FMCG Fund(G),1999-03-31,1517,9.36,1.06,1.73,0.52,0.35,19.13,0.59,0.07,0.11,0.52,0.0,0.08,7,13,13,1,13,13,NIFTY FMCG - TRI,ICICI Pru FMCG Fund(G),9.46,3.12,5.16,0.63,18.35,46.35,13
Mirae Asset Arbitrage Fund-Reg(G),2020-06-19,44983,0.94,4.97,9.96,0.01,4.66,786.44,0.06,0.31,0.63,0.01,0.02,3.12,21,17,15,4,9,4,Nifty 50 Arbitrage,Mirae Asset Arbitrage Fund-Reg(G),0.89,5.08,10.13,0.01,4.49,1079.57,24
ICICI Pru S&P BSE Sensex Index Fund(G),2017-09-21,36396,10.12,1.75,3.01,0.99,0.45,17.84,0.64,0.11,0.19,0.99,0.0,0.07,30,81,81,85,82,82,S&P BSE SENSEX - TRI,ICICI Pru S&P BSE Sensex Index Fund(G),12.11,2.8,4.55,0.87,19.56,41.14,91
PGIM India Global Equity Opp Fund(G),2010-05-13,8812,16.85,1.59,2.8,0.14,26.33,186.45,1.06,0.1,0.18,0.14,0.1,0.74,40,20,21,10,16,6,MSCI AC World Index,PGIM India Global Equity Opp Fund(G),15.56,1.08,1.95,0.42,15.13,69.84,56
Mirae Asset NYSE FANG+ETF FoF-Reg(G),2021-05-10,45496,20.94,3.36,6.22,0.86,67.76,81.57,1.32,0.21,0.39,0.86,0.27,0.32,50,1,1,53,1,20,NYSE FANG+ TRI,Mirae Asset NYSE FANG+ETF FoF-Reg(G),15.56,1.08,1.95,0.42,15.13,69.84,56
Edelweiss Aggressive Hybrid Fund-Reg(G),2009-08-11,7922,7.38,3.64,6.13,0.21,26.21,124.82,0.46,0.23,0.39,0.21,0.1,0.5,9,5,5,11,4,7,CRISIL Hybrid 35+65 - Aggressive Index,Edelweiss Aggressive Hybrid Fund-Reg(G),7.09,3.34,5.74,0.29,23.06,138.51,12
Kotak Nifty PSU Bank ETF,2007-11-08,3723,24.29,2.47,4.44,1.23,40.45,48.86,1.53,0.16,0.28,1.23,0.16,0.19,128,64,62,127,7,40,NIFTY PSU BANK - TRI,Kotak Nifty PSU Bank ETF,12.82,2.39,4.07,0.86,16.67,42.97,129
LIC MF Large Cap Fund-Reg(G),1998-03-31,2127,9.52,2.19,3.69,0.9,5.12,23.06,0.6,0.14,0.23,0.9,0.02,0.09,10,32,32,22,33,33,NIFTY 100 - TRI,LIC MF Large Cap Fund-Reg(G),10.13,2.76,4.64,0.88,12.66,31.65,36
HSBC Multi Asset Allocation Fund-Reg(G),2024-02-28,48468,,,,,,,,,,,,,,,,,,,S&P BSE 200 - TRI,HSBC Multi Asset Allocation Fund-Reg(G),7.09,3.34,5.74,0.29,23.06,138.51,12
