MF Code,incept_date,schemecode,sdx_returns,sharpex_returns,sotinox_returns,betax_returns,alphax_returns,treynorx_returns,sdy_returns,sharpey_returns,sotinoy_returns,betay_returns,alphay_returns,treynory_returns,rank_sd,rank_sharpe,rank_sotino,rank_beta,rank_alpha,rank_treynor,index_name,s_name,avg_std_dev,avg_sharpe,avg_sotino,avg_beta,avg_alpha,avg_treyno,no_of_funds_total
UTI Infrastructure Fund-Reg(G),2004-04-19,3582,17.05,2.55,3.5,1.13,24.44,38.61,1.07,0.16,0.22,1.13,0.1,0.15,5,16,16,14,18,18,Nifty Infrastructure - TRI,UTI Infrastructure Fund-Reg(G),18.14,2.78,3.85,1.08,31.94,46.67,19
DSP Focus Fund-Reg(G),2010-06-10,8463,14.17,2.21,3.25,0.94,15.42,33.36,0.89,0.14,0.2,0.94,0.06,0.13,25,22,21,20,20,21,NIFTY 500 - TRI,DSP Focus Fund-Reg(G),13.58,2.34,3.45,0.9,16.33,35.19,33
DSP Nifty SDL Plus G-Sec Jun 2028 30:70 Index Fund-Reg(G),2022-03-21,45863,1.14,3.32,6.3,0.14,3.4,27.22,0.07,0.21,0.4,0.14,0.01,0.11,24,23,26,31,31,32,Nifty SDL Plus G-Sec Jun 2028 70:30 Index,DSP Nifty SDL Plus G-Sec Jun 2028 30:70 Index Fund-Reg(G),1.34,3.16,6.09,0.14,3.33,48.2,52
HSBC Arbitrage Fund-Reg(G),2014-06-30,29550,1.0,4.84,9.92,0.0,4.86,-4758.62,0.06,0.3,0.62,0.0,0.02,-18.88,19,17,18,7,16,24,Nifty 50 Arbitrage,HSBC Arbitrage Fund-Reg(G),0.97,4.98,10.55,0.0,4.8,533.01,24
Aditya Birla SL Nifty 50 ETF,2011-07-21,12811,12.7,1.58,2.44,0.99,4.36,20.29,0.8,0.1,0.15,0.99,0.02,0.08,44,80,88,76,99,89,NIFTY 50 - TRI,Aditya Birla SL Nifty 50 ETF,15.49,1.89,3.02,1.11,15.21,59.48,129
Mirae Asset Healthcare Fund-Reg(G),2018-07-02,39122,12.49,2.94,5.39,0.44,29.26,83.61,0.79,0.18,0.34,0.44,0.12,0.33,8,8,8,7,8,9,BSE Health Care - TRI,Mirae Asset Healthcare Fund-Reg(G),12.14,3.07,5.63,0.44,30.0,87.79,11
Canara Rob Mid Cap Fund-Reg(G),2022-12-02,46001,14.17,2.48,3.67,0.85,20.74,41.33,0.89,0.16,0.23,0.85,0.08,0.16,7,24,24,10,23,25,BSE 150 MidCap - TRI,Canara Rob Mid Cap Fund-Reg(G),15.17,2.59,3.79,0.89,24.29,44.05,30
Bandhan Balanced Advantage Fund-Reg(G),2014-10-10,30671,6.23,2.27,3.31,0.33,13.23,43.34,0.39,0.14,0.21,0.33,0.05,0.17,3,13,15,9,24,23,NIFTY 50 Hybrid Composite Debt 50:50 Index,Bandhan Balanced Advantage Fund-Reg(G),8.44,2.29,3.38,0.76,18.16,54.02,26
Mahindra Manulife Large & Mid Cap Fund-Reg(G),2019-12-30,43915,17.68,1.98,2.69,1.11,16.2,31.45,1.11,0.12,0.17,1.11,0.06,0.12,25,22,22,26,15,21,NIFTY LargeMidcap 250 - TRI,Mahindra Manulife Large & Mid Cap Fund-Reg(G),14.07,2.36,3.43,0.93,17.47,35.58,26
Tata ST Bond Fund-Reg(G),2002-08-08,3286,0.76,4.54,8.7,0.08,3.23,40.87,0.05,0.29,0.55,0.08,0.01,0.16,14,18,12,16,20,19,CRISIL Short Duration Debt Index,Tata ST Bond Fund-Reg(G),0.76,4.87,8.65,0.08,3.36,287.4,26
Tata Business Cycle Fund-Reg(G),2021-08-04,45373,14.43,2.69,3.79,0.98,22.2,39.51,0.91,0.17,0.24,0.98,0.09,0.16,30,11,15,34,15,18,NIFTY 500 - TRI,Tata Business Cycle Fund-Reg(G),14.76,2.4,3.6,0.94,19.76,37.65,46
Bandhan G-Sec-Invest-Reg(G),2008-12-05,7483,3.38,1.58,2.75,0.36,4.33,14.72,0.21,0.1,0.17,0.36,0.02,0.06,35,31,30,34,3,22,CRISIL Dynamic Gilt Index,Bandhan G-Sec-Invest-Reg(G),2.08,2.16,3.88,0.23,3.39,19.08,35
ICICI Pru Silver ETF,2022-01-24,46214,21.98,1.05,1.86,1.11,20.44,20.82,1.38,0.07,0.12,1.11,0.08,0.08,19,15,15,21,4,20,Silver,ICICI Pru Silver ETF,15.23,1.4,2.51,0.52,18.21,56.68,21
SBI Consumption Opp Fund-Reg(G),2013-01-01,19166,10.67,2.53,4.28,0.55,17.59,48.66,0.67,0.16,0.27,0.55,0.07,0.19,3,7,9,3,6,3,Nifty India Consumption - TRI,SBI Consumption Opp Fund-Reg(G),11.14,2.53,4.46,0.62,17.49,45.32,13
UTI-Nifty Next 50 ETF,2017-08-04,37338,18.25,2.62,3.76,1.12,30.47,42.59,1.15,0.16,0.24,1.12,0.12,0.17,101,28,39,104,19,39,NIFTY NEXT 50,UTI-Nifty Next 50 ETF,15.49,1.89,3.02,1.11,15.21,59.48,129
Parag Parikh Liquid Fund-Reg(G),2018-05-11,38735,0.1,21.97,19.71,0.0,2.24,2069.83,0.01,1.38,1.24,0.0,0.01,8.21,27,27,10,36,12,27,CRISIL Liquid Debt Index,Parag Parikh Liquid Fund-Reg(G),0.09,27.49,17.29,0.0,2.24,3051.29,36
Templeton India Equity Income Fund(G),2006-05-18,3367,14.94,2.44,3.57,0.94,20.56,38.81,0.94,0.15,0.22,0.94,0.08,0.15,7,4,4,4,5,4,NIFTY 500 - TRI,Templeton India Equity Income Fund(G),14.39,2.5,3.64,0.97,19.37,37.06,9
Sundaram Multi Asset Allocation Fund-Reg(G),2024-01-25,48460,,,,,,,,,,,,,,,,,,,NIFTY 500 - TRI,Sundaram Multi Asset Allocation Fund-Reg(G),8.55,2.64,4.07,1.19,21.57,68.48,13
Edelweiss US Technology Equity FOF-Reg(G),2020-03-05,44630,22.89,1.19,2.09,0.69,25.3,39.46,1.44,0.07,0.13,0.69,0.1,0.16,53,31,29,49,13,27,Russell 1000 Equal Weighted Technology Index,Edelweiss US Technology Equity FOF-Reg(G),15.33,1.08,1.92,0.45,14.29,59.55,56
SBI CRISIL IBX Gilt Index - Apr 2029 Fund-Reg(G),2022-10-04,46971,1.77,2.14,3.73,0.2,3.23,18.7,0.11,0.14,0.24,0.2,0.01,0.07,41,40,40,40,39,41,CRISIL IBX Gilt Index - April 2029,SBI CRISIL IBX Gilt Index - Apr 2029 Fund-Reg(G),1.34,3.16,6.09,0.14,3.33,48.2,52
Bajaj Finserv Money Market Fund-Reg(G),2023-07-24,48065,,,,,,,,,,,,,,,,,,,Nifty Money Market Index,Bajaj Finserv Money Market Fund-Reg(G),0.31,14.37,30.12,0.0,4.45,1666.6,21
BHARAT Bond ETF FOF - April 2033 -Reg(G),2022-12-14,47284,6.31,0.57,0.94,0.09,3.33,38.83,0.4,0.04,0.06,0.09,0.01,0.15,21,53,53,6,50,45,NIFTY BHARAT Bond Index - April 2033,BHARAT Bond ETF FOF - April 2033 -Reg(G),8.66,2.51,4.1,0.43,18.46,61.56,53
Franklin India Liquid Fund-Super Inst(G),2005-09-02,3406,0.07,31.62,14.91,0.0,2.07,-22664.15,0.0,1.99,0.94,0.0,0.01,-89.94,7,7,26,3,15,31,Nifty Liquid Fund Index,Franklin India Liquid Fund-Super Inst(G),0.09,27.49,17.29,0.0,2.24,3051.29,36
Axis Balanced Advantage Fund-Reg(G),2017-08-01,37918,8.56,2.36,3.55,0.4,19.05,50.25,0.54,0.15,0.22,0.4,0.08,0.2,17,10,9,17,7,13,NIFTY 50 Hybrid Composite Debt 50:50 Index,Axis Balanced Advantage Fund-Reg(G),8.44,2.29,3.38,0.76,18.16,54.02,26
Sundaram Flexi Cap Fund-Reg(G),2022-09-06,46622,12.19,1.76,2.66,0.91,6.15,23.69,0.77,0.11,0.17,0.91,0.02,0.09,11,37,36,20,37,37,NIFTY 500 - TRI,Sundaram Flexi Cap Fund-Reg(G),13.47,2.22,3.28,0.93,14.46,32.44,41
Axis CRISIL IBX SDL May 2027 Index Fund-Reg(G),2022-02-23,45999,1.0,4.08,7.9,0.08,3.86,54.0,0.06,0.26,0.5,0.08,0.02,0.21,14,12,12,13,2,12,CRISIL IBX SDL Index - May 2027,Axis CRISIL IBX SDL May 2027 Index Fund-Reg(G),1.34,3.16,6.09,0.14,3.33,48.2,52
Quant Absolute Fund(G),2001-03-20,865,13.75,2.35,3.53,0.34,31.35,95.26,0.87,0.15,0.22,0.34,0.12,0.38,54,32,28,29,3,5,CRISIL Hybrid 25+75 - Aggressive Index,Quant Absolute Fund(G),7.34,2.39,3.65,0.32,17.16,61.83,52
Bandhan Multi Cap Fund-Reg(G),2021-12-02,45867,12.69,2.42,3.52,0.85,16.41,36.34,0.8,0.15,0.22,0.85,0.07,0.14,10,14,15,8,18,19,Nifty500 Multicap 50:25:25 - TRI,Bandhan Multi Cap Fund-Reg(G),13.58,2.34,3.45,0.9,16.33,35.19,33
Tata Large Cap Fund-Reg(G),1998-05-07,3281,13.9,1.94,2.82,1.03,9.55,26.16,0.88,0.12,0.18,1.03,0.04,0.1,29,24,27,33,19,22,NIFTY 100 - TRI,Tata Large Cap Fund-Reg(G),13.06,2.05,3.1,0.94,10.9,28.43,36
Tata Banking & Financial Services Fund-Reg(G),2015-12-28,33726,14.87,1.13,1.65,1.02,-0.43,16.51,0.94,0.07,0.1,1.02,0.0,0.07,3,11,11,2,8,8,Nifty Financial Services - TRI,Tata Banking & Financial Services Fund-Reg(G),15.44,1.21,1.78,1.07,0.5,17.41,15
Tata Infrastructure Fund-Reg(G),2004-12-31,3254,18.34,2.74,3.79,1.07,32.21,47.02,1.16,0.17,0.24,1.07,0.13,0.19,11,10,11,7,10,9,BSE India Infrastructure Index - TRI,Tata Infrastructure Fund-Reg(G),18.14,2.78,3.85,1.08,31.94,46.67,19
HDFC Infrastructure Fund(G),2008-03-10,4253,18.22,3.02,4.14,1.06,37.09,52.01,1.15,0.19,0.26,1.06,0.15,0.21,9,4,3,6,5,4,BSE India Infrastructure Index - TRI,HDFC Infrastructure Fund(G),18.14,2.78,3.85,1.08,31.94,46.67,19
Union Flexi Cap Fund-Reg(G),2011-06-10,14559,13.08,2.05,2.88,0.93,11.14,28.9,0.82,0.13,0.18,0.93,0.04,0.11,22,26,30,23,30,29,BSE 500 - TRI,Union Flexi Cap Fund-Reg(G),13.47,2.22,3.28,0.93,14.46,32.44,41
HDFC Gold Fund(G),2011-11-01,15381,10.22,1.62,3.04,0.16,16.08,100.3,0.64,0.1,0.19,0.16,0.06,0.4,2,4,4,5,15,5,Gold-India,HDFC Gold Fund(G),12.82,1.47,2.71,0.39,17.13,106.45,15
UTI Multi Asset Allocation Fund-Reg(G),2008-12-17,7143,8.35,3.58,5.62,0.33,28.98,91.07,0.53,0.23,0.35,0.33,0.12,0.36,6,1,2,6,2,3,CRISIL Composite Bond Index,UTI Multi Asset Allocation Fund-Reg(G),8.55,2.64,4.07,1.19,21.57,68.48,13
SBI Magnum Childrens Benefit Fund-Investment Plan-Reg(G),2020-09-29,34199,9.95,2.94,4.77,0.2,28.65,146.41,0.63,0.18,0.3,0.2,0.11,0.58,22,4,3,7,5,2,CRISIL Hybrid 35+65 - Aggressive Index,SBI Magnum Childrens Benefit Fund-Investment Plan-Reg(G),8.7,2.35,3.59,0.92,18.51,55.33,38
Mirae Asset NYSE FANG+ ETF,2021-05-07,45379,23.19,1.67,2.85,0.01,38.78,2757.54,1.46,0.11,0.18,0.01,0.15,10.94,123,76,70,1,7,1,NYSE FANG+ TRI,Mirae Asset NYSE FANG+ ETF,15.49,1.89,3.02,1.11,15.21,59.48,129
LIC MF Nifty 8-13 yr G-Sec ETF,2014-12-24,31581,2.59,1.5,2.52,0.33,3.1,11.67,0.16,0.09,0.16,0.33,0.01,0.05,15,16,16,15,13,15,Nifty 8-13 yr G-Sec,LIC MF Nifty 8-13 yr G-Sec ETF,1.28,6.28,10.19,0.21,3.31,549.36,17
Sundaram Ultra Short Duration Fund(G),2007-12-28,4186,0.26,13.42,27.89,0.0,3.5,2639.7,0.02,0.85,1.76,0.0,0.01,10.48,2,19,21,6,23,9,NIFTY Ultra Short Duration Debt Index,Sundaram Ultra Short Duration Fund(G),0.29,14.1,29.55,0.0,4.13,2248.3,24
Parag Parikh Conservative Hybrid Fund-Reg(G),2021-05-26,45338,3.47,3.88,6.43,0.12,13.13,115.64,0.22,0.24,0.41,0.12,0.05,0.46,11,1,1,3,1,1,CRISIL Hybrid 85+15 - Conservative Index,Parag Parikh Conservative Hybrid Fund-Reg(G),3.4,2.69,4.2,0.2,8.49,50.23,19
Tata Retirement Sav Fund - Mod Plan(G),2011-11-04,15379,11.56,1.99,2.81,0.48,21.62,47.91,0.73,0.13,0.18,0.48,0.09,0.19,28,32,33,27,16,20,CRISIL Hybrid 25+75 - Aggressive Index,Tata Retirement Sav Fund - Mod Plan(G),8.7,2.35,3.59,0.92,18.51,55.33,38
JM Liquid Fund(G),1997-12-31,1909,0.05,38.0,15.03,0.0,2.02,-11143.67,0.0,2.39,0.95,0.0,0.01,-44.22,3,2,17,1,32,29,CRISIL Liquid Debt Index,JM Liquid Fund(G),0.09,27.49,17.29,0.0,2.24,3051.29,36
Tata India Consumer Fund-Reg(G),2015-12-28,33728,11.36,2.47,4.44,0.58,18.19,48.16,0.72,0.16,0.28,0.58,0.07,0.19,10,10,7,5,5,4,Nifty India Consumption - TRI,Tata India Consumer Fund-Reg(G),11.14,2.53,4.46,0.62,17.49,45.32,13
ITI Small Cap Fund-Reg(G),2020-02-17,44399,17.82,2.68,3.64,0.97,31.5,49.54,1.12,0.17,0.23,0.97,0.12,0.2,22,3,6,22,3,4,Nifty Smallcap 250 - TRI,ITI Small Cap Fund-Reg(G),14.89,2.41,3.41,0.79,22.76,45.66,24
Kotak Manufacture in India Fund-Reg(G),2022-02-22,46107,14.13,2.78,4.05,0.91,23.84,43.24,0.89,0.18,0.26,0.91,0.09,0.17,27,8,11,23,13,14,Nifty India Manufacturing - TRI,Kotak Manufacture in India Fund-Reg(G),14.76,2.4,3.6,0.94,19.76,37.65,46
Axis Strategic Bond Fund-Reg(G),2012-03-28,8136,1.15,3.74,6.76,0.14,3.91,31.22,0.07,0.24,0.43,0.14,0.02,0.12,22,18,18,25,5,21,NIFTY Medium Duration Debt Index,Axis Strategic Bond Fund-Reg(G),0.95,4.48,8.93,0.1,3.47,56.88,30
Baroda BNP Paribas Large Cap Fund-Reg(G),2004-09-23,23,13.15,2.37,3.46,0.98,14.57,31.83,0.83,0.15,0.22,0.98,0.06,0.13,20,6,7,24,8,6,NIFTY 100 - TRI,Baroda BNP Paribas Large Cap Fund-Reg(G),13.06,2.05,3.1,0.94,10.9,28.43,36
Templeton India Value Fund(G),2003-09-05,3379,14.17,2.49,3.63,0.97,18.72,36.16,0.89,0.16,0.23,0.97,0.07,0.14,11,13,14,10,12,11,NIFTY 500 - TRI,Templeton India Value Fund(G),14.58,2.51,3.69,0.98,20.01,37.53,22
Quant Momentum Fund-Reg(G),2023-11-20,48334,,,,,,,,,,,,,,,,,,,NIFTY 500 - TRI,Quant Momentum Fund-Reg(G),14.76,2.4,3.6,0.94,19.76,37.65,46
Kotak Bond Fund-Reg(G),1999-11-25,1968,2.14,1.83,3.13,0.26,3.18,15.04,0.13,0.12,0.2,0.26,0.01,0.06,48,44,44,51,41,45,CRISIL Medium to Long Term Debt Index,Kotak Bond Fund-Reg(G),1.34,3.16,6.09,0.14,3.33,48.2,52
HSBC CRISIL IBX 50:50 Gilt Plus SDL Apr 2028 Index Fund-Reg(G),2022-03-31,46506,1.14,3.31,6.45,0.13,3.4,28.4,0.07,0.21,0.41,0.13,0.01,0.11,22,24,24,29,30,29,CRISIL IBX 50:50 Gilt Plus SDL Index - April 2028,HSBC CRISIL IBX 50:50 Gilt Plus SDL Apr 2028 Index Fund-Reg(G),1.34,3.16,6.09,0.14,3.33,48.2,52
Baroda BNP Paribas Mid Cap Fund-Reg(G),2006-05-02,172,14.43,2.73,3.95,0.85,24.87,46.04,0.91,0.17,0.25,0.85,0.1,0.18,12,11,12,12,15,10,Nifty Midcap 150 - TRI,Baroda BNP Paribas Mid Cap Fund-Reg(G),15.17,2.59,3.79,0.89,24.29,44.05,30
Nippon India Gold Savings Fund(G),2011-03-07,14108,10.79,1.59,2.97,0.21,16.53,79.91,0.68,0.1,0.19,0.21,0.07,0.32,7,5,5,9,12,9,Gold-India,Nippon India Gold Savings Fund(G),12.82,1.47,2.71,0.39,17.13,106.45,15
Axis Nifty AAA Bond Plus SDL Apr 2026 50:50 ETF,2021-05-11,45337,0.57,7.2,14.81,0.04,4.03,108.74,0.04,0.45,0.93,0.04,0.02,0.43,6,6,6,7,4,6,Nifty AAA Bond Plus SDL Apr 2026 50:50 Index,Axis Nifty AAA Bond Plus SDL Apr 2026 50:50 ETF,1.28,6.28,10.19,0.21,3.31,549.36,17
SBI Gold-Reg(G),2011-09-12,14666,10.65,1.59,2.9,0.1,16.61,170.28,0.67,0.1,0.18,0.1,0.07,0.68,5,7,6,3,11,3,Gold-London Bullion Market association (LBMA),SBI Gold-Reg(G),12.82,1.47,2.71,0.39,17.13,106.45,15
Mirae Asset Arbitrage Fund-Reg(G),2020-06-19,44983,1.02,4.85,10.32,0.0,4.96,-3617.33,0.06,0.31,0.65,0.0,0.02,-14.35,22,16,16,5,9,22,Nifty 50 Arbitrage,Mirae Asset Arbitrage Fund-Reg(G),0.97,4.98,10.55,0.0,4.8,533.01,24
Nippon India Gilt Securities Fund(G),2008-08-22,6291,2.43,1.65,2.9,0.28,3.23,14.16,0.15,0.1,0.18,0.28,0.01,0.06,24,28,24,25,23,28,Nifty All Duration G-Sec Index,Nippon India Gilt Securities Fund(G),2.08,2.16,3.88,0.23,3.39,19.08,35
Motilal Oswal Focused Fund-Reg(G),2013-05-13,21769,13.82,1.48,2.17,0.81,6.73,25.17,0.87,0.09,0.14,0.81,0.03,0.1,28,35,36,2,29,26,NIFTY 500 - TRI,Motilal Oswal Focused Fund-Reg(G),13.06,2.05,3.1,0.94,10.9,28.43,36
Aditya Birla SL Medium Term Plan-Reg(G),2009-03-25,7683,1.23,2.99,5.26,0.14,3.3,26.79,0.08,0.19,0.33,0.14,0.01,0.11,28,25,27,24,22,24,CRISIL Medium Duration Debt Index,Aditya Birla SL Medium Term Plan-Reg(G),0.95,4.48,8.93,0.1,3.47,56.88,30
Aditya Birla SL Income Fund(G),1995-10-21,405,2.2,1.56,2.63,0.24,2.75,14.09,0.14,0.1,0.17,0.24,0.01,0.06,50,49,49,46,47,47,CRISIL Medium to Long Term Debt Index,Aditya Birla SL Income Fund(G),1.34,3.16,6.09,0.14,3.33,48.2,52
SBI Long Duration Fund-Reg(G),2022-12-21,46864,3.93,1.24,2.05,0.47,3.58,10.41,0.25,0.08,0.13,0.47,0.01,0.04,18,16,17,19,3,16,CRISIL Long Duration Debt Index,SBI Long Duration Fund-Reg(G),2.75,1.58,2.79,0.54,3.3,15.92,19
Navi Nifty 50 Index Fund-Reg(G),2021-07-15,45614,12.68,1.56,2.4,0.99,3.07,20.01,0.8,0.1,0.15,0.99,0.01,0.08,25,69,69,45,69,72,NIFTY 50 - TRI,Navi Nifty 50 Index Fund-Reg(G),15.44,2.13,3.18,1.0,16.85,34.18,94
Franklin India Balanced Advantage Fund-Reg(G),2022-09-06,46625,6.49,3.13,4.67,0.27,19.56,76.31,0.41,0.2,0.29,0.27,0.08,0.3,6,2,2,3,6,2,NIFTY 50 Hybrid Composite Debt 50:50 Index,Franklin India Balanced Advantage Fund-Reg(G),8.44,2.29,3.38,0.76,18.16,54.02,26
Tata Retirement Sav Fund - Prog Plan(G),2011-11-04,15380,13.36,2.08,2.94,0.52,26.31,53.2,0.84,0.13,0.18,0.52,0.1,0.21,33,29,30,35,8,17,NIFTY 500 - TRI,Tata Retirement Sav Fund - Prog Plan(G),8.7,2.35,3.59,0.92,18.51,55.33,38
Kotak Gold Fund(G),2011-03-25,14148,10.7,1.58,2.89,0.16,16.46,103.45,0.67,0.1,0.18,0.16,0.07,0.41,6,8,7,4,13,4,Gold-India,Kotak Gold Fund(G),12.82,1.47,2.71,0.39,17.13,106.45,15
Mirae Asset Flexi Cap Fund-Reg(G),2023-02-24,47596,13.01,1.93,2.8,0.95,9.17,26.61,0.82,0.12,0.18,0.95,0.04,0.11,20,33,32,27,35,35,NIFTY 500 - TRI,Mirae Asset Flexi Cap Fund-Reg(G),13.47,2.22,3.28,0.93,14.46,32.44,41
WOC Mid Cap Fund-Reg(G),2022-09-07,46769,14.34,2.63,3.84,0.85,23.26,44.18,0.9,0.17,0.24,0.85,0.09,0.18,10,17,17,11,19,18,BSE 150 MidCap - TRI,WOC Mid Cap Fund-Reg(G),15.17,2.59,3.79,0.89,24.29,44.05,30
Quant Value Fund-Reg(G),2021-11-30,46064,21.19,2.61,3.72,1.2,34.9,45.91,1.34,0.16,0.23,1.2,0.14,0.18,22,9,11,22,1,2,NIFTY 500 - TRI,Quant Value Fund-Reg(G),14.58,2.51,3.69,0.98,20.01,37.53,22
Kotak Infra & Eco Reform Fund(G),2008-02-25,4228,16.16,2.73,3.79,0.96,27.82,45.94,1.02,0.17,0.24,0.96,0.11,0.18,2,11,12,3,14,12,Nifty Infrastructure - TRI,Kotak Infra & Eco Reform Fund(G),18.14,2.78,3.85,1.08,31.94,46.67,19
Edelweiss Multi Cap Fund-Reg(G),2023-10-25,48147,,,,,,,,,,,,,,,,,,,Nifty500 Multicap 50:25:25 - TRI,Edelweiss Multi Cap Fund-Reg(G),13.58,2.34,3.45,0.9,16.33,35.19,33
Edelweiss Flexi Cap Fund-Reg(G),2015-02-03,31778,14.19,2.28,3.29,1.02,15.07,31.68,0.89,0.14,0.21,1.02,0.06,0.13,31,16,16,34,17,19,NIFTY 500 - TRI,Edelweiss Flexi Cap Fund-Reg(G),13.47,2.22,3.28,0.93,14.46,32.44,41
Franklin India Equity Hybrid Fund(G),1999-12-10,999,9.61,2.55,3.67,0.4,23.36,61.87,0.61,0.16,0.23,0.4,0.09,0.25,36,22,22,37,10,19,CRISIL Hybrid 35+65 - Aggressive Index,Franklin India Equity Hybrid Fund(G),7.34,2.39,3.65,0.32,17.16,61.83,52
HSBC Large Cap Fund(G),2002-12-10,1348,13.8,1.78,2.57,1.03,7.08,23.76,0.87,0.11,0.16,1.03,0.03,0.09,27,30,30,32,27,32,NIFTY 100 - TRI,HSBC Large Cap Fund(G),13.06,2.05,3.1,0.94,10.9,28.43,36
Aditya Birla SL G-Sec Fund(G),1999-10-11,399,2.55,1.85,3.25,0.28,3.93,16.63,0.16,0.12,0.2,0.28,0.02,0.07,30,17,16,26,7,17,Nifty All Duration G-Sec Index,Aditya Birla SL G-Sec Fund(G),2.08,2.16,3.88,0.23,3.39,19.08,35
ICICI Pru Nifty SDL Sep 2027 Index Fund-Reg(G),2022-03-24,46528,1.15,3.5,6.92,0.08,3.78,49.27,0.07,0.22,0.44,0.08,0.02,0.2,25,19,20,16,6,16,Nifty SDL Sep 2027 Index,ICICI Pru Nifty SDL Sep 2027 Index Fund-Reg(G),1.34,3.16,6.09,0.14,3.33,48.2,52
Baroda BNP Paribas Value Fund-Reg(G),2023-06-07,47940,16.38,1.88,2.6,1.07,12.02,28.8,1.03,0.12,0.16,1.07,0.05,0.11,18,22,22,18,22,22,NIFTY 500 - TRI,Baroda BNP Paribas Value Fund-Reg(G),14.58,2.51,3.69,0.98,20.01,37.53,22
SBI Magnum Income Fund-Reg(G),1998-11-25,2776,1.44,2.5,4.31,0.17,3.12,21.62,0.09,0.16,0.27,0.17,0.01,0.09,34,36,36,36,42,36,CRISIL Medium to Long Term Debt Index,SBI Magnum Income Fund-Reg(G),1.34,3.16,6.09,0.14,3.33,48.2,52
Nippon India ETF Nifty 8-13 yr G-Sec Long Term Gilt,2016-07-05,35459,2.6,1.52,2.55,0.33,3.15,11.77,0.16,0.1,0.16,0.33,0.01,0.05,16,15,15,16,12,14,Nifty 8-13 yr G-Sec,Nippon India ETF Nifty 8-13 yr G-Sec Long Term Gilt,1.28,6.28,10.19,0.21,3.31,549.36,17
Kotak Medium Term Fund(G),2014-03-21,22514,1.38,3.28,6.11,0.11,4.21,41.71,0.09,0.21,0.38,0.11,0.02,0.17,29,23,22,16,1,12,CRISIL Medium Duration Debt Index,Kotak Medium Term Fund(G),0.95,4.48,8.93,0.1,3.47,56.88,30
Bandhan Overnight Fund-Reg(G),2019-01-18,41901,0.01,207.48,12.78,0.0,1.71,31044.21,0.0,13.07,0.81,0.0,0.01,123.19,5,5,23,13,22,6,Nifty 1D Rate Index,Bandhan Overnight Fund-Reg(G),0.04,129.76,16.27,0.0,1.88,13522.41,32
Axis Dynamic Bond Fund-Reg(G),2011-04-27,12380,1.18,2.85,4.39,0.12,3.02,28.9,0.07,0.18,0.28,0.12,0.01,0.11,3,4,5,3,16,5,NIFTY Composite Debt Index,Axis Dynamic Bond Fund-Reg(G),1.83,2.72,4.9,0.19,3.39,93.57,22
Mirae Asset Banking and Financial Services Fund-Reg(G),2020-12-11,45174,15.43,1.21,1.8,1.08,0.48,17.36,0.97,0.08,0.11,1.08,0.0,0.07,6,6,6,6,5,5,Nifty Financial Services - TRI,Mirae Asset Banking and Financial Services Fund-Reg(G),15.44,1.21,1.78,1.07,0.5,17.41,15
Aditya Birla SL Business Cycle Fund-Reg(G),2021-12-03,45733,12.58,1.91,2.9,0.93,8.29,25.83,0.79,0.12,0.18,0.93,0.03,0.1,19,39,38,25,43,44,BSE 500 - TRI,Aditya Birla SL Business Cycle Fund-Reg(G),14.76,2.4,3.6,0.94,19.76,37.65,46
Motilal Oswal Small Cap Fund-Reg(G),2023-12-26,48388,,,,,,,,,,,,,,,,,,,Nifty Smallcap 250 - TRI,Motilal Oswal Small Cap Fund-Reg(G),14.89,2.41,3.41,0.79,22.76,45.66,24
Aditya Birla SL Dynamic Bond Fund-Reg(G),2004-09-27,302,1.96,2.12,3.6,0.21,3.55,19.68,0.12,0.13,0.23,0.21,0.01,0.08,14,12,13,13,11,12,NIFTY Composite Debt Index,Aditya Birla SL Dynamic Bond Fund-Reg(G),1.83,2.72,4.9,0.19,3.39,93.57,22
Tata Focused Equity Fund-Reg(G),2019-12-05,44148,14.08,1.95,2.79,1.0,10.53,27.42,0.89,0.12,0.18,1.0,0.04,0.11,23,28,27,28,27,29,NIFTY 500 - TRI,Tata Focused Equity Fund-Reg(G),13.58,2.34,3.45,0.9,16.33,35.19,33
Kotak Nifty PSU Bank ETF,2007-11-08,3723,30.48,1.98,2.98,1.6,35.31,37.52,1.92,0.12,0.19,1.6,0.14,0.15,128,63,67,127,9,54,NIFTY PSU BANK - TRI,Kotak Nifty PSU Bank ETF,15.49,1.89,3.02,1.11,15.21,59.48,129
HSBC Multi Asset Allocation Fund-Reg(G),2024-02-28,48468,,,,,,,,,,,,,,,,,,,BSE 200 - TRI,HSBC Multi Asset Allocation Fund-Reg(G),8.55,2.64,4.07,1.19,21.57,68.48,13
Bank of India Liquid Fund-Reg(G),2008-07-16,5836,0.07,32.76,15.03,0.0,2.12,5194.68,0.0,2.06,0.95,0.0,0.01,20.61,6,6,18,28,13,19,CRISIL Liquid Debt Index,Bank of India Liquid Fund-Reg(G),0.09,27.49,17.29,0.0,2.24,3051.29,36
Nippon India ETF Nifty CPSE Bond Plus SDL Sep 2024 50:50,2020-11-17,45171,0.32,13.71,29.29,0.01,4.36,736.75,0.02,0.86,1.84,0.01,0.02,2.92,4,3,1,4,2,3,Nifty CPSE Bond Plus SDL Sep 2024 50:50 Index,Nippon India ETF Nifty CPSE Bond Plus SDL Sep 2024 50:50,1.28,6.28,10.19,0.21,3.31,549.36,17
Nippon India Index Fund-Nifty 50 Plan(G),2010-09-28,12860,12.66,1.54,2.38,0.99,2.85,19.81,0.8,0.1,0.15,0.99,0.01,0.08,21,77,77,42,79,79,NIFTY 50 - TRI,Nippon India Index Fund-Nifty 50 Plan(G),15.44,2.13,3.18,1.0,16.85,34.18,94
DSP Overnight Fund-Reg(G),2019-01-09,41945,0.14,19.06,24.73,0.0,2.65,5286.36,0.01,1.2,1.56,0.0,0.01,20.98,31,30,5,29,2,25,CRISIL Liquid Overnight Index,DSP Overnight Fund-Reg(G),0.04,129.76,16.27,0.0,1.88,13522.41,32
Franklin India Money Market Fund(G),2002-02-11,3361,0.32,14.79,31.25,0.0,4.66,2602.86,0.02,0.93,1.97,0.0,0.02,10.33,10,6,2,5,9,3,Nifty Money Market Index,Franklin India Money Market Fund(G),0.31,14.37,30.12,0.0,4.45,1666.6,21
Baroda BNP Paribas Gilt Fund-Reg(G),2002-03-21,497,2.17,1.71,2.97,0.27,2.95,13.86,0.14,0.11,0.19,0.27,0.01,0.06,16,21,23,20,28,29,CRISIL Dynamic Gilt Index,Baroda BNP Paribas Gilt Fund-Reg(G),2.08,2.16,3.88,0.23,3.39,19.08,35
Mirae Asset Ultra Short Duration Fund-Reg(G),2020-10-07,45100,0.3,15.28,30.84,0.0,4.64,2278.61,0.02,0.96,1.94,0.0,0.02,9.04,19,2,5,14,2,12,NIFTY Ultra Short Duration Debt Index,Mirae Asset Ultra Short Duration Fund-Reg(G),0.29,14.1,29.55,0.0,4.13,2248.3,24
ICICI Pru MNC Fund(G),2019-06-17,41965,9.38,2.96,4.76,0.55,18.42,50.3,0.59,0.19,0.3,0.55,0.07,0.2,2,1,1,2,2,2,NIFTY MNC - TRI,ICICI Pru MNC Fund(G),10.15,2.37,3.83,0.54,14.92,43.88,5
SBI Magnum Constant Maturity Fund-Reg(G),2000-12-25,2756,2.63,1.37,2.33,0.32,2.7,11.14,0.17,0.09,0.15,0.32,0.01,0.04,1,3,3,3,4,5,Nifty 10 yr Benchmark G-Sec,SBI Magnum Constant Maturity Fund-Reg(G),2.69,1.38,2.34,0.33,2.81,11.34,6
Invesco India Flexi Cap Fund-Reg(G),2022-02-14,45945,12.71,2.83,4.18,0.89,20.94,40.5,0.8,0.18,0.26,0.89,0.08,0.16,16,3,4,15,7,8,BSE 500 - TRI,Invesco India Flexi Cap Fund-Reg(G),13.47,2.22,3.28,0.93,14.46,32.44,41
DSP Multi Asset Allocation Fund-Reg(G),2023-09-27,48206,,,,,,,,,,,,,,,,,,,NIFTY 500 - TRI,DSP Multi Asset Allocation Fund-Reg(G),8.55,2.64,4.07,1.19,21.57,68.48,13
Sundaram Diversified Equity(G),2005-05-02,3072,11.86,1.8,2.74,0.89,6.2,23.89,0.75,0.11,0.17,0.89,0.02,0.09,12,54,52,30,54,54,NIFTY 500 - TRI,Sundaram Diversified Equity(G),13.37,2.23,3.3,0.89,14.7,33.87,59
Union Balanced Advantage Fund-Reg(G),2017-12-29,38378,7.96,1.76,2.44,0.35,13.05,40.12,0.5,0.11,0.15,0.35,0.05,0.16,14,23,24,12,25,25,NIFTY 50 Hybrid Composite Debt 50:50 Index,Union Balanced Advantage Fund-Reg(G),8.44,2.29,3.38,0.76,18.16,54.02,26
HSBC Focused Fund-Reg(G),2020-07-22,44739,13.51,2.01,2.99,0.95,11.14,28.68,0.85,0.13,0.19,0.95,0.04,0.11,18,26,26,23,25,25,NIFTY 500 - TRI,HSBC Focused Fund-Reg(G),13.58,2.34,3.45,0.9,16.33,35.19,33
Axis Equity Hybrid Fund-Reg(G),2018-08-09,40568,9.25,1.66,2.45,0.37,14.31,41.33,0.58,0.1,0.15,0.37,0.06,0.16,30,49,49,32,32,48,CRISIL Hybrid 35+65 - Aggressive Index,Axis Equity Hybrid Fund-Reg(G),7.34,2.39,3.65,0.32,17.16,61.83,52
UTI Conservative Hybrid Fund-Reg(G),2003-12-16,3631,3.63,2.84,4.42,0.21,9.7,48.41,0.23,0.18,0.28,0.21,0.04,0.19,15,8,8,12,8,9,NIFTY 50 Hybrid Composite Debt 15:85 Index,UTI Conservative Hybrid Fund-Reg(G),3.4,2.69,4.2,0.2,8.49,50.23,19
Aditya Birla SL CRISIL IBX 60:40 SDL + AAA PSU - Apr 2027 Index Fund-Reg(G),2022-03-29,46227,0.74,5.12,9.77,0.08,3.58,49.82,0.05,0.32,0.62,0.08,0.01,0.2,3,5,6,15,16,15,CRISIL IBX 60:40 SDL + AAA PSU Index - April 2027,Aditya Birla SL CRISIL IBX 60:40 SDL + AAA PSU - Apr 2027 Index Fund-Reg(G),1.34,3.16,6.09,0.14,3.33,48.2,52
Mirae Asset NYSE FANG+ETF FoF-Reg(G),2021-05-10,45496,19.76,2.35,4.09,1.02,43.67,45.39,1.24,0.15,0.26,1.02,0.17,0.18,49,1,1,55,1,23,NYSE FANG+ TRI,Mirae Asset NYSE FANG+ETF FoF-Reg(G),15.33,1.08,1.92,0.45,14.29,59.55,56
Mirae Asset Balanced Advantage Fund-Reg(G),2022-08-11,46224,6.97,2.27,3.33,0.29,15.02,54.89,0.44,0.14,0.21,0.29,0.06,0.22,9,14,13,6,19,8,NIFTY 50 Hybrid Composite Debt 50:50 Index,Mirae Asset Balanced Advantage Fund-Reg(G),8.44,2.29,3.38,0.76,18.16,54.02,26
Edelweiss Aggressive Hybrid Fund-Reg(G),2009-08-11,7922,10.37,2.42,3.44,0.44,23.84,56.47,0.65,0.15,0.22,0.44,0.09,0.22,12,10,10,12,5,9,CRISIL Hybrid 35+65 - Aggressive Index,Edelweiss Aggressive Hybrid Fund-Reg(G),8.55,2.64,4.07,1.19,21.57,68.48,13
Nippon India Innovation Fund-Reg(G),2023-08-28,48169,,,,,,,,,,,,,,,,,,,NIFTY 500 - TRI,Nippon India Innovation Fund-Reg(G),14.76,2.4,3.6,0.94,19.76,37.65,46
ICICI Pru Thematic Advantage Fund(FOF)(G),2003-12-18,1706,9.21,2.66,4.29,0.32,23.51,76.2,0.58,0.17,0.27,0.32,0.09,0.3,31,23,21,29,16,12,NIFTY 200 - TRI,ICICI Pru Thematic Advantage Fund(FOF)(G),8.66,2.51,4.1,0.43,18.46,61.56,53
Bandhan Bond Fund - Medium Term Plan-Reg(G),2003-07-08,1084,1.49,2.03,3.58,0.19,2.49,16.23,0.09,0.13,0.23,0.19,0.01,0.06,30,29,29,30,29,29,NIFTY Medium Duration Debt Index,Bandhan Bond Fund - Medium Term Plan-Reg(G),0.95,4.48,8.93,0.1,3.47,56.88,30
Sundaram Balanced Advantage Fund(G),2010-12-16,13366,7.72,1.97,2.97,0.33,14.29,45.96,0.49,0.12,0.19,0.33,0.06,0.18,13,21,20,10,22,18,NIFTY 50 Hybrid Composite Debt 50:50 Index,Sundaram Balanced Advantage Fund(G),8.44,2.29,3.38,0.76,18.16,54.02,26
Motilal Oswal Nifty Midcap 150 Index Fund-Reg(G),2019-09-06,43810,16.13,2.63,3.71,0.96,26.21,44.25,1.02,0.17,0.23,0.96,0.1,0.18,54,14,33,22,35,26,Nifty Midcap 150 - TRI,Motilal Oswal Nifty Midcap 150 Index Fund-Reg(G),15.44,2.13,3.18,1.0,16.85,34.18,94
Bandhan Focused Equity Fund-Reg(G),2006-03-16,2896,13.13,1.94,3.01,0.87,10.74,29.31,0.83,0.12,0.19,0.87,0.04,0.12,15,29,25,11,26,24,BSE 500 - TRI,Bandhan Focused Equity Fund-Reg(G),13.58,2.34,3.45,0.9,16.33,35.19,33
