MF Code,incept_date,schemecode,sdx_returns,sharpex_returns,sotinox_returns,betax_returns,alphax_returns,treynorx_returns,sdy_returns,sharpey_returns,sotinoy_returns,betay_returns,alphay_returns,treynory_returns,rank_sd,rank_sharpe,rank_sotino,rank_beta,rank_alpha,rank_treynor,index_name,s_name,avg_std_dev,avg_sharpe,avg_sotino,avg_beta,avg_alpha,avg_treyno,no_of_funds_total
HDFC NIFTY 100 Index Fund-Reg(G),2022-02-23,45996,13.22,2.06,3.08,1.01,6.78,27.04,0.83,0.13,0.19,1.01,0.03,0.11,39,64,64,64,65,65,NIFTY 100 - TRI,HDFC NIFTY 100 Index Fund-Reg(G),15.54,2.34,3.5,0.98,17.03,37.92,95
UTI FTIF-XXXV-II(1223D)(G),2022-12-09,47273,0.88,4.81,10.03,0.09,3.91,49.54,0.06,0.3,0.63,0.09,0.02,0.2,68,53,50,70,53,46,CRISIL Medium Duration Debt Index,UTI FTIF-XXXV-II(1223D)(G),0.73,6.07,12.23,0.06,3.38,-73.89,91
Bandhan CRISIL IBX 90:10 SDL Plus Gilt - Sep 2027 Index Fund-Reg(G),2022-11-24,46212,1.12,4.08,8.14,0.09,4.18,48.56,0.07,0.26,0.51,0.09,0.02,0.19,3,3,3,2,11,2,CRISIL IBX 90:10 SDL Plus Gilt Index - September 2027,Bandhan CRISIL IBX 90:10 SDL Plus Gilt - Sep 2027 Index Fund-Reg(G),2.05,2.67,4.83,0.24,4.05,23.5,35
LIC MF Medium to Long Duration Fund-Reg(G),1999-09-15,2087,1.81,2.14,3.88,0.19,3.15,20.87,0.11,0.13,0.24,0.19,0.01,0.08,42,46,44,38,48,43,CRISIL Medium to Long Term Debt Index,LIC MF Medium to Long Duration Fund-Reg(G),1.32,3.83,7.37,0.13,3.93,51.13,52
ICICI Pru Passive Strategy Fund(FOF)(G),2003-12-18,1698,10.36,2.8,4.58,0.46,27.22,63.38,0.65,0.18,0.29,0.46,0.11,0.25,32,29,26,42,14,30,NIFTY 200 - TRI,ICICI Pru Passive Strategy Fund(FOF)(G),8.66,2.8,4.6,0.43,20.15,68.23,53
Axis NASDAQ 100 FoF-Reg(G),2022-11-01,47017,15.63,1.86,3.37,0.28,28.12,104.1,0.98,0.12,0.21,0.28,0.11,0.41,31,13,12,18,11,12,Nasdaq-100 - TRI,Axis NASDAQ 100 FoF-Reg(G),15.29,1.1,1.96,0.46,13.91,62.07,56
DSP World Mining Fund-Reg(G),2009-12-29,8359,22.87,0.19,0.33,0.64,1.79,6.8,1.44,0.01,0.02,0.64,0.01,0.03,53,46,46,44,45,45,MSCI ACWI Metals & Mining 30% Buffer 10/40 (1994) Net TRI,DSP World Mining Fund-Reg(G),15.29,1.1,1.96,0.46,13.91,62.07,56
Bajaj Finserv Nifty Bank ETF,2024-01-19,48462,,,,,,,,,,,,,,,,,,,NIFTY BANK - TRI,Bajaj Finserv Nifty Bank ETF,15.55,2.06,3.31,1.06,15.12,54.16,129
UTI Gilt Fund with 10 year Constant Duration-Reg(G),2022-08-01,40967,2.65,1.68,2.86,0.32,3.2,14.01,0.17,0.11,0.18,0.32,0.01,0.06,3,6,6,2,6,6,Crisil 10 Yr Gilt Index,UTI Gilt Fund with 10 year Constant Duration-Reg(G),2.64,1.76,3.0,0.32,3.41,14.5,6
Nippon India Retirement Fund-Income Generation(G),2015-02-11,17166,4.3,2.49,3.94,0.44,8.97,24.47,0.27,0.16,0.25,0.44,0.04,0.1,7,27,19,25,34,38,CRISIL Hybrid 85+15 - Conservative Index,Nippon India Retirement Fund-Income Generation(G),8.74,2.68,4.13,0.77,20.82,62.02,38
Aditya Birla SL Nifty Smallcap 50 Index Fund-Reg(G),2021-04-05,44737,20.19,2.82,4.07,1.06,35.33,53.68,1.27,0.18,0.26,1.06,0.14,0.21,92,9,12,70,7,6,Nifty Smallcap 50 - TRI,Aditya Birla SL Nifty Smallcap 50 Index Fund-Reg(G),15.54,2.34,3.5,0.98,17.03,37.92,95
JM ELSS Tax Saver Fund(G),2008-03-31,4198,16.01,2.57,3.62,1.01,20.66,40.8,1.01,0.16,0.23,1.01,0.08,0.16,57,22,29,55,16,22,BSE 500 - TRI,JM ELSS Tax Saver Fund(G),13.44,2.5,3.72,0.88,15.68,38.5,60
Nippon India FHF-XLIII-5-2315D(G),2022-03-03,46433,1.34,3.65,7.18,0.1,4.49,46.95,0.08,0.23,0.45,0.1,0.02,0.19,85,67,62,80,11,48,CRISIL Medium to Long Term Debt Index,Nippon India FHF-XLIII-5-2315D(G),0.73,6.07,12.23,0.06,3.38,-73.89,91
Bandhan Retirement Fund-Reg(G),2023-10-18,48226,,,,,,,,,,,,,,,,,,,CRISIL Hybrid 50+50 - Moderate Index,Bandhan Retirement Fund-Reg(G),8.74,2.68,4.13,0.77,20.82,62.02,38
HDFC NIFTY G- Sec Apr 2029 Index Fund-Reg(G),2023-03-10,47712,1.67,2.85,5.04,0.2,3.98,24.17,0.1,0.18,0.32,0.2,0.02,0.1,38,37,37,40,34,38,NIFTY G- Sec Apr 2029 Index,HDFC NIFTY G- Sec Apr 2029 Index Fund-Reg(G),1.32,3.83,7.37,0.13,3.93,51.13,52
HSBC Dynamic Bond Fund-Reg(G),2006-08-30,925,1.87,2.63,4.38,0.2,4.13,24.65,0.12,0.17,0.28,0.2,0.02,0.1,10,8,11,10,9,9,CRISIL Dynamic Bond Index,HSBC Dynamic Bond Fund-Reg(G),1.82,3.18,5.68,0.19,3.97,114.52,22
HDFC Retirement Savings Fund-Hybrid-Debt Plan-Reg(G),2016-02-25,24807,3.48,2.94,4.41,0.23,9.35,45.16,0.22,0.19,0.28,0.23,0.04,0.18,5,8,9,7,33,29,NIFTY 50 Hybrid Composite Debt 15:85 Index,HDFC Retirement Savings Fund-Hybrid-Debt Plan-Reg(G),8.74,2.68,4.13,0.77,20.82,62.02,38
Nippon India ETF Nifty 5 yr Benchmark G-Sec,2021-04-07,45428,1.61,2.95,5.11,0.2,4.06,24.07,0.1,0.19,0.32,0.2,0.02,0.1,12,12,10,12,8,11,Nifty 5 yr Benchmark G-Sec Index TRI,Nippon India ETF Nifty 5 yr Benchmark G-Sec,1.26,6.73,11.19,0.21,3.76,2392.71,17
ITI Pharma & Healthcare Fund-Reg(G),2021-11-08,45724,12.13,2.64,4.6,0.44,22.98,72.25,0.76,0.17,0.29,0.44,0.09,0.29,7,9,11,9,11,11,Nifty Healthcare Index - TRI,ITI Pharma & Healthcare Fund-Reg(G),12.11,2.85,5.24,0.44,25.98,82.78,11
Edelweiss Government Securities Fund-Reg(G),2014-02-13,21922,2.75,2.11,3.82,0.31,4.56,18.42,0.17,0.13,0.24,0.31,0.02,0.07,31,27,19,33,5,25,CRISIL Dynamic Gilt Index,Edelweiss Government Securities Fund-Reg(G),2.05,2.67,4.83,0.24,4.05,23.5,35
HDFC FMP-Sr 46-1158D-July 2022-Reg(G),2022-07-26,46672,0.53,8.33,17.9,0.04,4.28,112.54,0.03,0.52,1.13,0.04,0.02,0.45,26,17,15,31,26,16,CRISIL Medium Duration Debt Index,HDFC FMP-Sr 46-1158D-July 2022-Reg(G),0.73,6.07,12.23,0.06,3.38,-73.89,91
SBI FMP-76-1221D-Reg(G),2023-01-24,47541,0.57,3.38,6.05,0.07,1.71,26.61,0.04,0.21,0.38,0.07,0.01,0.11,31,72,73,53,88,70,CRISIL Medium Duration Debt Index,SBI FMP-76-1221D-Reg(G),0.73,6.07,12.23,0.06,3.38,-73.89,91
Nippon India Nifty Auto ETF,2022-01-24,45713,15.53,3.27,6.14,0.8,35.78,63.66,0.98,0.21,0.39,0.8,0.14,0.25,70,1,1,40,7,13,NIFTY AUTO - TRI,Nippon India Nifty Auto ETF,15.55,2.06,3.31,1.06,15.12,54.16,129
Kotak Nifty Alpha 50 ETF,2021-12-22,45687,21.98,2.76,3.89,1.2,37.77,50.27,1.38,0.17,0.25,1.2,0.15,0.2,120,25,50,123,5,17,Nifty Alpha 50 - TRI,Kotak Nifty Alpha 50 ETF,15.55,2.06,3.31,1.06,15.12,54.16,129
ICICI Pru Nifty FMCG ETF,2021-08-05,45651,12.49,0.71,1.25,0.45,0.35,19.63,0.79,0.04,0.08,0.45,0.0,0.08,18,126,126,14,113,113,NIFTY FMCG - TRI,ICICI Pru Nifty FMCG ETF,15.55,2.06,3.31,1.06,15.12,54.16,129
Mirae Asset Dynamic Bond Fund-Reg(G),2017-03-24,36556,0.7,4.99,8.83,0.06,3.25,55.99,0.04,0.31,0.56,0.06,0.01,0.22,2,2,2,2,21,2,CRISIL Dynamic Bond Index,Mirae Asset Dynamic Bond Fund-Reg(G),1.82,3.18,5.68,0.19,3.97,114.52,22
Mirae Asset Nifty India Manufacturing ETF,2022-01-27,45869,14.3,3.25,5.02,0.89,29.66,52.11,0.9,0.2,0.32,0.89,0.12,0.21,66,3,5,44,25,16,Nifty India Manufacturing - TRI,Mirae Asset Nifty India Manufacturing ETF,15.55,2.06,3.31,1.06,15.12,54.16,129
JM Arbitrage Fund(G),2006-07-18,1843,1.05,4.34,9.04,-0.01,4.61,-629.27,0.07,0.27,0.57,-0.01,0.02,-2.5,24,22,22,3,19,16,Nifty 50 Arbitrage,JM Arbitrage Fund(G),0.97,4.91,10.36,-0.01,4.77,111.27,24
Edelweiss NIFTY Large Mid Cap 250 Index Fund-Reg(G),2021-12-01,45864,14.13,2.54,3.64,0.97,16.13,36.97,0.89,0.16,0.23,0.97,0.06,0.15,45,51,54,32,52,54,NIFTY LargeMidcap 250 - TRI,Edelweiss NIFTY Large Mid Cap 250 Index Fund-Reg(G),15.54,2.34,3.5,0.98,17.03,37.92,95
DSP Silver ETF,2022-08-19,46354,20.78,1.22,2.15,1.12,21.6,22.76,1.31,0.08,0.14,1.12,0.09,0.09,14,17,17,20,8,22,Silver,DSP Silver ETF,15.54,1.53,2.69,0.58,20.1,60.06,22
Navi Nifty Midcap 150 Index Fund-Reg(G),2022-03-11,45861,16.13,2.73,3.87,0.94,25.07,47.1,1.02,0.17,0.24,0.94,0.1,0.19,53,36,44,19,40,30,Nifty Midcap 150 - TRI,Navi Nifty Midcap 150 Index Fund-Reg(G),15.54,2.34,3.5,0.98,17.03,37.92,95
Baroda BNP Paribas Dynamic Bond Fund(G),2004-09-23,116,1.94,2.26,3.77,0.22,3.5,20.06,0.12,0.14,0.24,0.22,0.01,0.08,11,18,18,17,18,18,CRISIL Dynamic Bond Index,Baroda BNP Paribas Dynamic Bond Fund(G),1.82,3.18,5.68,0.19,3.97,114.52,22
Baroda BNP Paribas Corp Bond Fund(G),2008-11-08,6932,0.94,4.44,7.41,0.09,3.83,47.28,0.06,0.28,0.47,0.09,0.02,0.19,19,20,20,16,14,18,CRISIL Corporate Bond Index,Baroda BNP Paribas Corp Bond Fund(G),0.79,5.58,9.71,0.08,3.99,59.13,21
SBI FMP-74-1243D-Reg(G),2023-01-03,47381,0.55,3.84,7.08,0.03,2.04,62.29,0.03,0.24,0.45,0.03,0.01,0.25,29,62,64,20,58,26,CRISIL Medium Duration Debt Index,SBI FMP-74-1243D-Reg(G),0.73,6.07,12.23,0.06,3.38,-73.89,91
Tata Equity Savings Fund-Reg(G),2000-04-27,3273,4.65,2.86,4.17,0.21,12.45,62.57,0.29,0.18,0.26,0.21,0.05,0.25,13,21,23,17,42,28,NIFTY 50 Equity Savings Index,Tata Equity Savings Fund-Reg(G),7.37,2.65,4.06,0.33,19.06,68.13,52
Edelweiss CRISIL IBX 50:50 Gilt Plus SDL Short Duration Index Fund-Reg(G),2023-02-15,47430,0.8,5.42,10.21,0.08,4.01,51.99,0.05,0.34,0.64,0.08,0.02,0.21,19,11,9,16,7,11,CRISIL IBX 50:50 Gilt Plus SDL Short Duration Index,Edelweiss CRISIL IBX 50:50 Gilt Plus SDL Short Duration Index Fund-Reg(G),0.74,5.33,8.45,0.08,3.63,290.88,26
HDFC NIFTY Midcap 150 Index Fund-Reg(G),2023-04-21,46619,16.11,2.74,3.88,0.94,25.1,47.15,1.01,0.17,0.24,0.94,0.1,0.19,50,34,43,18,39,29,Nifty Midcap 150 - TRI,HDFC NIFTY Midcap 150 Index Fund-Reg(G),15.54,2.34,3.5,0.98,17.03,37.92,95
Nippon India ETF Nifty 50 Value 20,2015-06-18,31920,13.65,2.14,3.51,0.94,11.52,31.05,0.86,0.14,0.22,0.94,0.05,0.12,58,65,63,47,70,78,Nifty50 Value 20 - TRI,Nippon India ETF Nifty 50 Value 20,15.55,2.06,3.31,1.06,15.12,54.16,129
Groww Nifty Total Market Index Fund-Reg(G),2023-10-23,48247,,,,,,,,,,,,,,,,,,,Nifty Total Market - TRI,Groww Nifty Total Market Index Fund-Reg(G),15.54,2.34,3.5,0.98,17.03,37.92,95
Mirae Asset Money Market Fund-Reg(G),2021-08-11,45753,0.32,14.47,30.94,0.0,4.61,2499.41,0.02,0.91,1.95,0.0,0.02,9.92,11,14,11,6,11,7,Nifty Money Market Index,Mirae Asset Money Market Fund-Reg(G),0.31,14.66,30.75,0.0,4.58,1805.67,21
SBI FMP-80-366D-Reg(G),2023-03-21,47805,0.18,12.77,17.39,0.0,2.32,867.18,0.01,0.8,1.1,0.0,0.01,3.44,1,13,17,13,57,4,NIFTY Low Duration Debt Index,SBI FMP-80-366D-Reg(G),0.73,6.07,12.23,0.06,3.38,-73.89,91
Bank of India Bluechip Fund-Reg(G),2021-06-29,45571,14.96,2.49,3.47,1.06,15.72,35.2,0.94,0.16,0.22,1.06,0.06,0.14,31,9,17,34,6,9,NIFTY 100 - TRI,Bank of India Bluechip Fund-Reg(G),13.08,2.27,3.44,0.94,10.72,31.77,36
HDFC FMP-Sr 47-2638D-Feb 2023-Reg(G),2023-02-23,47642,2.19,2.34,3.9,0.24,4.18,21.37,0.14,0.15,0.25,0.24,0.02,0.08,90,87,87,90,34,78,NIFTY Long Duration Debt Index,HDFC FMP-Sr 47-2638D-Feb 2023-Reg(G),0.73,6.07,12.23,0.06,3.38,-73.89,91
Kotak FMP-328-90D(G),2024-02-16,48490,,,,,,,,,,,,,,,,,,,Nifty Liquid Fund Index,Kotak FMP-328-90D(G),0.73,6.07,12.23,0.06,3.38,-73.89,91
Bank of India Ultra Short Duration Fund-Reg(G),2008-07-16,5842,0.27,13.51,28.42,0.0,3.7,2898.3,0.02,0.85,1.79,0.0,0.01,11.5,3,20,23,8,22,9,CRISIL Ultra Short Term Debt Index,Bank of India Ultra Short Duration Fund-Reg(G),0.3,14.31,30.07,0.0,4.25,2431.75,24
Shriram Multi Asset Allocation Fund-Reg(G),2023-09-08,48029,,,,,,,,,,,,,,,,,,,NIFTY 50 - TRI,Shriram Multi Asset Allocation Fund-Reg(G),8.05,2.9,4.54,1.12,21.84,78.7,14
Baroda BNP Paribas Credit Risk Fund-Reg(G),2015-01-23,25569,0.56,8.61,16.03,0.04,4.64,123.51,0.04,0.54,1.01,0.04,0.02,0.49,2,2,3,5,7,3,CRISIL Credit Risk Debt Index,Baroda BNP Paribas Credit Risk Fund-Reg(G),1.43,5.33,12.66,0.06,4.95,-102.1,15
Canara Rob Corp Bond Fund-Reg(G),2014-02-07,23504,0.67,5.77,10.56,0.07,3.55,52.34,0.04,0.36,0.67,0.07,0.01,0.21,3,6,5,7,20,10,CRISIL Corporate Bond Index,Canara Rob Corp Bond Fund-Reg(G),0.79,5.58,9.71,0.08,3.99,59.13,21
Aditya Birla SL CRISIL IBX SDL Jun 2032 Index Fund-Reg(G),2023-02-14,47592,2.0,2.35,4.6,0.15,4.11,30.72,0.13,0.15,0.29,0.15,0.02,0.12,4,5,3,5,14,5,CRISIL IBX SDL Index - June 2032,Aditya Birla SL CRISIL IBX SDL Jun 2032 Index Fund-Reg(G),2.7,2.12,3.76,0.53,4.44,21.14,19
DSP World Energy Fund-Reg(G),2009-08-14,7866,17.24,-0.19,-0.34,0.91,-7.01,-3.65,1.09,-0.01,-0.02,0.91,-0.03,-0.01,42,52,52,52,52,50,MSCI World,DSP World Energy Fund-Reg(G),15.29,1.1,1.96,0.46,13.91,62.07,56
LIC MF Focused Fund-Reg(G),2017-11-17,32627,11.79,1.95,3.14,0.77,7.26,29.69,0.74,0.12,0.2,0.77,0.03,0.12,8,32,27,1,28,22,NIFTY 500 - TRI,LIC MF Focused Fund-Reg(G),13.08,2.27,3.44,0.94,10.72,31.77,36
Franklin India G-Sec Fund(G),2001-12-07,3373,1.13,2.79,4.98,0.15,2.57,21.27,0.07,0.18,0.31,0.15,0.01,0.08,4,10,10,7,35,14,Nifty All Duration G-Sec Index,Franklin India G-Sec Fund(G),2.05,2.67,4.83,0.24,4.05,23.5,35
Invesco India Credit Risk Fund(G),2014-09-04,21522,1.69,3.32,14.59,0.07,5.34,78.88,0.11,0.21,0.92,0.07,0.02,0.31,13,12,5,12,3,10,NIFTY Credit Risk Bond Index,Invesco India Credit Risk Fund(G),1.43,5.33,12.66,0.06,4.95,-102.1,15
Union Gilt Fund-Reg(G),2022-08-08,46221,2.47,2.09,3.54,0.29,4.01,17.77,0.16,0.13,0.22,0.29,0.02,0.07,28,29,30,27,17,29,CRISIL Dynamic Gilt Index,Union Gilt Fund-Reg(G),2.05,2.67,4.83,0.24,4.05,23.5,35
Aditya Birla SL Silver ETF FOF-Reg(G),2022-02-03,46225,19.51,1.28,2.41,1.0,21.02,24.87,1.23,0.08,0.15,1.0,0.08,0.1,49,48,48,51,28,49,Silver,Aditya Birla SL Silver ETF FOF-Reg(G),8.66,2.8,4.6,0.43,20.15,68.23,53
Edelweiss MSCI India Domestic & World Healthcare 45 Index Fund-Reg(G),2020-10-26,45117,10.35,2.77,5.3,0.31,22.86,91.6,0.65,0.17,0.33,0.31,0.09,0.36,1,15,1,1,44,1,MSCI India Domestic & World Healthcare 45 Index,Edelweiss MSCI India Domestic & World Healthcare 45 Index Fund-Reg(G),15.54,2.34,3.5,0.98,17.03,37.92,95
Mirae Asset Nifty Bank ETF,2023-07-20,47993,,,,,,,,,,,,,,,,,,,NIFTY BANK - TRI,Mirae Asset Nifty Bank ETF,15.55,2.06,3.31,1.06,15.12,54.16,129
Baroda BNP Paribas Banking and Fin Serv Fund-Reg(G),2012-06-22,16955,16.59,1.45,2.07,1.14,0.86,21.07,1.04,0.09,0.13,1.14,0.0,0.08,15,10,12,16,10,10,Nifty Financial Services - TRI,Baroda BNP Paribas Banking and Fin Serv Fund-Reg(G),15.68,1.58,2.32,1.08,3.45,23.68,16
SBI FMP-47-1434D-Reg(G),2021-07-23,45660,0.39,5.35,8.97,0.03,1.99,68.57,0.02,0.34,0.56,0.03,0.01,0.27,17,37,55,18,61,22,CRISIL Medium Duration Debt Index,SBI FMP-47-1434D-Reg(G),0.73,6.07,12.23,0.06,3.38,-73.89,91
ICICI Pru Nifty Infrastructure ETF,2022-08-17,45998,18.44,2.54,3.57,1.23,23.56,37.9,1.16,0.16,0.22,1.23,0.09,0.15,108,47,58,125,44,62,Nifty Infrastructure - TRI,ICICI Pru Nifty Infrastructure ETF,15.55,2.06,3.31,1.06,15.12,54.16,129
Aditya Birla SL FMP-US-100D-Reg(G),2024-01-10,48501,,,,,,,,,,,,,,,,,,,CRISIL Ultra Short Term Debt Index,Aditya Birla SL FMP-US-100D-Reg(G),0.73,6.07,12.23,0.06,3.38,-73.89,91
ICICI Pru Debt Mgmt Fund(FOF)(G),2003-12-18,1707,1.03,4.76,8.46,0.12,4.46,42.71,0.07,0.3,0.53,0.12,0.02,0.17,3,3,3,9,47,46,CRISIL Composite Bond Index,ICICI Pru Debt Mgmt Fund(FOF)(G),8.66,2.8,4.6,0.43,20.15,68.23,53
JM Focused Fund-Reg(G),2008-03-05,4282,15.4,2.58,3.68,0.97,20.19,41.23,0.97,0.16,0.23,0.97,0.08,0.16,34,5,10,23,3,3,BSE 500 - TRI,JM Focused Fund-Reg(G),13.08,2.27,3.44,0.94,10.72,31.77,36
HDFC BSE 500 Index Fund-Reg(G),2023-04-21,47913,13.48,2.31,3.37,0.98,11.16,31.68,0.85,0.15,0.21,0.98,0.04,0.13,42,56,62,40,56,62,BSE 500 - TRI,HDFC BSE 500 Index Fund-Reg(G),15.54,2.34,3.5,0.98,17.03,37.92,95
Mirae Asset Nifty 100 ESG Sector Leaders ETF,2020-11-18,45134,12.67,2.07,3.25,0.97,8.04,27.14,0.8,0.13,0.2,0.97,0.03,0.11,25,70,67,59,85,83,Nifty100 ESG Sector Leaders - TRI,Mirae Asset Nifty 100 ESG Sector Leaders ETF,15.55,2.06,3.31,1.06,15.12,54.16,129
LIC MF Gold ETF,2011-11-09,15131,11.38,1.74,3.07,0.22,19.13,91.3,0.72,0.11,0.19,0.22,0.08,0.36,12,9,7,4,10,4,Gold-India,LIC MF Gold ETF,15.54,1.53,2.69,0.58,20.1,60.06,22
Bandhan All Seasons Bond Fund-Reg(G),2004-09-13,2850,0.82,5.16,9.72,0.09,3.88,45.79,0.05,0.33,0.61,0.09,0.02,0.18,2,2,2,6,52,44,NIFTY Medium Duration Debt Index,Bandhan All Seasons Bond Fund-Reg(G),8.66,2.8,4.6,0.43,20.15,68.23,53
JM Short Duration Fund-Reg(G),2022-08-29,46751,0.69,5.13,9.76,0.07,3.23,48.94,0.04,0.32,0.61,0.07,0.01,0.19,5,18,14,8,24,15,CRISIL Short Duration Debt Index,JM Short Duration Fund-Reg(G),0.74,5.33,8.45,0.08,3.63,290.88,26
Bank of India Credit Risk Fund-Reg(G),2015-02-27,30390,1.17,3.06,10.17,0.0,3.6,-2103.17,0.07,0.19,0.64,0.0,0.01,-8.35,11,13,10,2,14,15,CRISIL Credit Risk Debt Index,Bank of India Credit Risk Fund-Reg(G),1.43,5.33,12.66,0.06,4.95,-102.1,15
ICICI Pru Nifty50 Value 20 ETF,2016-06-17,33839,13.67,2.15,3.53,0.94,11.62,31.15,0.86,0.14,0.22,0.94,0.05,0.12,59,64,61,48,69,77,Nifty50 Value 20 - TRI,ICICI Pru Nifty50 Value 20 ETF,15.55,2.06,3.31,1.06,15.12,54.16,129
SBI FMP-52-1848D-Reg(G),2021-09-28,45915,0.56,3.76,6.91,0.05,1.99,45.74,0.04,0.24,0.44,0.05,0.01,0.18,30,63,65,40,63,53,CRISIL Medium to Long Term Debt Index,SBI FMP-52-1848D-Reg(G),0.73,6.07,12.23,0.06,3.38,-73.89,91
Bandhan Nifty 100 Index Fund-Reg(G),2022-02-24,46119,13.21,2.07,3.1,1.01,6.93,27.12,0.83,0.13,0.2,1.01,0.03,0.11,37,63,63,65,64,64,NIFTY 100 - TRI,Bandhan Nifty 100 Index Fund-Reg(G),15.54,2.34,3.5,0.98,17.03,37.92,95
Union Retirement Fund-Reg(G),2022-09-22,45735,13.41,2.46,3.48,0.5,31.07,66.1,0.84,0.16,0.22,0.5,0.12,0.26,34,28,30,29,7,11,BSE 500 - TRI,Union Retirement Fund-Reg(G),8.74,2.68,4.13,0.77,20.82,62.02,38
Axis NIFTY IT ETF,2021-03-25,45427,18.56,1.32,2.58,0.74,10.51,32.99,1.17,0.08,0.16,0.74,0.04,0.13,110,108,100,31,74,68,NIFTY IT - TRI,Axis NIFTY IT ETF,15.55,2.06,3.31,1.06,15.12,54.16,129
Tata Gold ETF,2024-01-12,48435,,,,,,,,,,,,,,,,,,,Gold-India,Tata Gold ETF,15.54,1.53,2.69,0.58,20.1,60.06,22
Bank of India Balanced Advantage Fund-Reg(G),2014-03-14,21917,11.1,1.94,2.79,0.44,19.83,48.56,0.7,0.12,0.18,0.44,0.08,0.19,24,24,23,24,8,22,NIFTY 50 Hybrid Composite Debt 50:50 Index,Bank of India Balanced Advantage Fund-Reg(G),8.46,2.53,3.74,0.72,19.65,59.09,26
Taurus Mid Cap Fund-Reg(G),1994-09-05,3306,19.09,1.96,2.68,1.04,16.43,36.16,1.2,0.12,0.17,1.04,0.07,0.14,30,30,30,29,28,30,Nifty Midcap 150 - TRI,Taurus Mid Cap Fund-Reg(G),15.24,2.84,4.19,0.88,25.58,49.48,30
Union Equity Savings Fund-Reg(G),2018-08-09,40627,4.55,2.43,3.52,0.2,10.28,54.41,0.29,0.15,0.22,0.2,0.04,0.22,12,37,38,16,46,40,Crisil Equity Savings Index,Union Equity Savings Fund-Reg(G),7.37,2.65,4.06,0.33,19.06,68.13,52
ICICI Pru FMP-88-1226D-F(G),2022-12-08,47232,0.88,4.99,10.46,0.08,4.08,52.29,0.06,0.31,0.66,0.08,0.02,0.21,70,49,41,66,43,39,CRISIL Medium Duration Debt Index,ICICI Pru FMP-88-1226D-F(G),0.73,6.07,12.23,0.06,3.38,-73.89,91
Kotak FMP-329-90D(G),2024-03-21,48720,,,,,,,,,,,,,,,,,,,Nifty Liquid Fund Index,Kotak FMP-329-90D(G),0.73,6.07,12.23,0.06,3.38,-73.89,91
SBI FMP-46-1850D-Reg(G),2021-07-07,45620,0.53,3.76,7.12,0.04,1.89,44.98,0.03,0.24,0.45,0.04,0.01,0.18,25,64,63,39,76,54,CRISIL Medium to Long Term Debt Index,SBI FMP-46-1850D-Reg(G),0.73,6.07,12.23,0.06,3.38,-73.89,91
Invesco India Banking and PSU Fund(G),2012-12-29,17249,1.07,4.24,7.31,0.11,4.08,41.0,0.07,0.27,0.46,0.11,0.02,0.16,25,24,24,24,11,24,NIFTY Banking and PSU Debt Index,Invesco India Banking and PSU Fund(G),0.77,5.78,10.56,0.08,3.96,79.72,26
HSBC Global Equity Climate Change FoF-Reg(G),2021-03-22,45333,15.15,0.34,0.64,0.63,3.07,8.32,0.95,0.02,0.04,0.63,0.01,0.03,28,44,44,43,44,44,MSCI AC World Index,HSBC Global Equity Climate Change FoF-Reg(G),15.29,1.1,1.96,0.46,13.91,62.07,56
PGIM India Arbitrage Fund-Reg(G),2014-08-27,28514,0.93,4.7,9.62,0.0,4.38,-1932.06,0.06,0.3,0.61,0.0,0.02,-7.67,5,19,21,10,21,23,Nifty 50 Arbitrage,PGIM India Arbitrage Fund-Reg(G),0.97,4.91,10.36,-0.01,4.77,111.27,24
HSBC Conservative Hybrid Fund(G),2004-02-24,1458,4.3,3.19,4.86,0.28,12.6,48.36,0.27,0.2,0.31,0.28,0.05,0.19,17,9,9,18,3,14,NIFTY 50 Hybrid Composite Debt 15:85 Index,HSBC Conservative Hybrid Fund(G),3.41,3.07,4.82,0.2,9.6,56.87,19
ICICI Pru Retirement Fund-Pure Debt Plan(G),2019-02-27,25670,0.92,4.29,7.6,0.09,3.58,43.22,0.06,0.27,0.48,0.09,0.01,0.17,2,1,1,1,37,31,NIFTY Composite Debt Index,ICICI Pru Retirement Fund-Pure Debt Plan(G),8.74,2.68,4.13,0.77,20.82,62.02,38
Groww Largecap Fund-Reg(G),2012-02-10,15997,13.46,2.33,3.49,1.0,10.91,31.17,0.85,0.15,0.22,1.0,0.04,0.12,25,15,15,29,15,17,NIFTY 100 - TRI,Groww Largecap Fund-Reg(G),13.08,2.27,3.44,0.94,10.72,31.77,36
Kotak FMP-310-1131D(G),2023-03-27,47871,0.88,4.93,10.28,0.09,4.03,51.16,0.06,0.31,0.65,0.09,0.02,0.2,71,51,47,69,45,44,NIFTY Medium Duration Debt Index,Kotak FMP-310-1131D(G),0.73,6.07,12.23,0.06,3.38,-73.89,91
Mirae Asset Nifty MidSmallcap400 Momentum Quality 100 ETF,2024-05-22,48681,,,,,,,,,,,,,,,,,,,Nifty MidSmallcap400 Momentum Quality 100 - TRI,Mirae Asset Nifty MidSmallcap400 Momentum Quality 100 ETF,15.55,2.06,3.31,1.06,15.12,54.16,129
Aditya Birla SL Long Duration Fund-Reg(G),2022-08-08,46711,2.73,2.0,3.48,0.31,4.26,17.74,0.17,0.13,0.22,0.31,0.02,0.07,12,12,12,11,12,8,NIFTY Long Duration Debt Index,Aditya Birla SL Long Duration Fund-Reg(G),2.7,2.12,3.76,0.53,4.44,21.14,19
Nippon India FMP-XLVI-1(G),2023-12-20,48149,,,,,,,,,,,,,,,,,,,NIFTY Ultra Short Duration Debt Index,Nippon India FMP-XLVI-1(G),0.73,6.07,12.23,0.06,3.38,-73.89,91
LIC MF Value Fund-Reg(G),2018-08-20,39956,13.69,2.6,3.87,0.96,16.03,36.97,0.86,0.16,0.24,0.96,0.06,0.15,9,17,15,10,20,20,NIFTY 500 - TRI,LIC MF Value Fund-Reg(G),14.61,2.78,4.09,0.97,20.86,42.01,22
Quantum Equity FoF-Reg(G),2009-07-20,19904,12.48,2.46,3.59,0.54,28.63,57.36,0.79,0.15,0.23,0.54,0.11,0.23,42,40,42,44,11,35,BSE 200 - TRI,Quantum Equity FoF-Reg(G),8.66,2.8,4.6,0.43,20.15,68.23,53
Axis Nifty Bank Index Fund-Reg(G),2024-05-24,48680,,,,,,,,,,,,,,,,,,,NIFTY BANK - TRI,Axis Nifty Bank Index Fund-Reg(G),15.54,2.34,3.5,0.98,17.03,37.92,95
Bandhan Equity Savings Fund-Reg(G),2008-06-09,5300,2.63,2.96,4.9,0.11,7.36,71.01,0.17,0.19,0.31,0.11,0.03,0.28,7,17,10,7,51,15,CRISIL Liquid Debt Index,Bandhan Equity Savings Fund-Reg(G),7.37,2.65,4.06,0.33,19.06,68.13,52
Baroda BNP Paribas NIFTY SDL Dec 2026 Index Fund-Reg(G),2023-01-25,47387,0.85,5.1,10.72,0.05,4.16,88.78,0.05,0.32,0.68,0.05,0.02,0.35,9,9,8,5,16,5,NIFTY SDL December 2026 Index,Baroda BNP Paribas NIFTY SDL Dec 2026 Index Fund-Reg(G),1.32,3.83,7.37,0.13,3.93,51.13,52
Kotak Nifty SDL Jul 2026 Index Fund-Reg(G),2022-12-22,46729,0.71,6.29,14.45,0.04,4.33,127.41,0.04,0.4,0.91,0.04,0.02,0.51,3,4,2,3,3,3,Nifty SDL Jul 2026 Index,Kotak Nifty SDL Jul 2026 Index Fund-Reg(G),1.32,3.83,7.37,0.13,3.93,51.13,52
Nippon India Strategic Debt Fund(G),2014-06-26,21911,0.96,4.31,7.67,0.11,3.68,37.8,0.06,0.27,0.48,0.11,0.01,0.15,16,18,19,17,25,19,CRISIL Medium Duration Debt Index,Nippon India Strategic Debt Fund(G),0.93,5.23,10.38,0.09,3.95,66.93,30
Axis BSE Sensex ETF,2023-03-24,47768,12.68,1.63,2.57,0.99,2.04,20.89,0.8,0.1,0.16,0.99,0.01,0.08,26,100,106,79,108,109,BSE SENSEX - TRI,Axis BSE Sensex ETF,15.55,2.06,3.31,1.06,15.12,54.16,129
SBI FMP-78-1170D-Reg(G),2023-02-21,47638,0.45,4.37,8.18,0.04,1.86,46.42,0.03,0.28,0.52,0.04,0.01,0.18,21,57,58,35,78,50,CRISIL Medium Duration Debt Index,SBI FMP-78-1170D-Reg(G),0.73,6.07,12.23,0.06,3.38,-73.89,91
DSP FMP 268-1281D-Reg(G),2022-11-24,47124,0.72,6.34,14.6,0.03,4.46,160.47,0.05,0.4,0.92,0.03,0.02,0.64,52,23,20,17,12,6,CRISIL Medium Duration Debt Index,DSP FMP 268-1281D-Reg(G),0.73,6.07,12.23,0.06,3.38,-73.89,91
Bandhan Regular Savings Fund-Reg(G),2010-02-25,8465,3.46,2.59,4.68,0.18,8.27,50.4,0.22,0.16,0.3,0.18,0.03,0.2,11,15,11,7,14,13,NIFTY AAA Short Duration Bond Index,Bandhan Regular Savings Fund-Reg(G),3.41,3.07,4.82,0.2,9.6,56.87,19
HSBC Nifty Next 50 Index Fund-Reg(G),2020-04-15,33548,18.27,2.76,3.98,1.09,28.22,46.17,1.15,0.17,0.25,1.09,0.11,0.18,70,24,25,81,27,39,NIFTY NEXT 50 - TRI,HSBC Nifty Next 50 Index Fund-Reg(G),15.54,2.34,3.5,0.98,17.03,37.92,95
Quantum Gold Saving Fund-Reg(G),2011-05-19,19961,10.61,1.83,3.35,0.22,18.55,87.04,0.67,0.12,0.21,0.22,0.07,0.35,4,6,4,10,15,10,Gold-India,Quantum Gold Saving Fund-Reg(G),12.82,1.68,3.05,0.39,19.36,132.08,15
ICICI Pru Global Stable Equity Fund(FOF)(G),2013-09-13,16718,9.9,0.34,0.57,0.53,1.34,6.3,0.62,0.02,0.04,0.53,0.01,0.02,3,45,45,38,46,46,MSCI World,ICICI Pru Global Stable Equity Fund(FOF)(G),15.29,1.1,1.96,0.46,13.91,62.07,56
Tata Nifty G-Sec Dec 2026 Index Fund-Reg(G),2023-01-16,47436,0.9,4.71,9.5,0.09,3.91,46.57,0.06,0.3,0.6,0.09,0.02,0.18,13,13,11,13,21,14,Nifty G-sec Dec 2026 Index,Tata Nifty G-Sec Dec 2026 Index Fund-Reg(G),0.93,5.23,10.38,0.09,3.95,66.93,30
Canara Rob Income Fund-Reg(G),2002-09-19,542,2.13,1.85,3.14,0.25,2.95,15.57,0.13,0.12,0.2,0.25,0.01,0.06,49,51,51,49,51,51,CRISIL Medium to Long Term Debt Index,Canara Rob Income Fund-Reg(G),1.32,3.83,7.37,0.13,3.93,51.13,52
Invesco India Gold ETF,2010-03-19,8505,11.22,1.72,3.03,0.22,18.55,87.42,0.71,0.11,0.19,0.22,0.07,0.35,10,10,9,6,14,6,Gold-India,Invesco India Gold ETF,15.54,1.53,2.69,0.58,20.1,60.06,22
Bandhan CRISIL IBX 90:10 SDL Plus Gilt - Nov 2026 Index Fund-Reg(G),2022-11-17,46213,0.76,5.84,12.66,0.05,4.23,86.51,0.05,0.37,0.8,0.05,0.02,0.34,7,6,4,6,8,6,CRISIL IBX 90:10 SDL Plus Gilt Index - November 2026,Bandhan CRISIL IBX 90:10 SDL Plus Gilt - Nov 2026 Index Fund-Reg(G),1.32,3.83,7.37,0.13,3.93,51.13,52
Kotak FMP-326-175D(G),2023-12-26,48420,,,,,,,,,,,,,,,,,,,NIFTY Ultra Short Duration Debt Index,Kotak FMP-326-175D(G),0.73,6.07,12.23,0.06,3.38,-73.89,91
Sundaram Global Brand Fund(G),2007-08-22,3005,10.79,1.22,2.03,0.17,12.42,77.11,0.68,0.08,0.13,0.17,0.05,0.31,6,29,30,6,30,17,MSCI AC World Index,Sundaram Global Brand Fund(G),15.29,1.1,1.96,0.46,13.91,62.07,56
TRUSTMF Short Duration Fund-Reg(G),2021-08-06,45652,0.71,5.29,9.45,0.07,3.5,51.63,0.04,0.33,0.6,0.07,0.01,0.2,9,14,18,9,22,12,CRISIL Short Duration Debt Index,TRUSTMF Short Duration Fund-Reg(G),0.74,5.33,8.45,0.08,3.63,290.88,26
ICICI Pru Nifty Healthcare ETF,2021-05-18,45383,14.04,2.43,4.55,0.44,25.8,77.57,0.88,0.15,0.29,0.44,0.1,0.31,64,51,16,10,37,10,Nifty Healthcare Index - TRI,ICICI Pru Nifty Healthcare ETF,15.55,2.06,3.31,1.06,15.12,54.16,129
SBI FMP-50-1843D-Reg(G),2021-09-07,45842,0.57,3.55,6.45,0.06,1.86,34.42,0.04,0.22,0.41,0.06,0.01,0.14,33,70,70,49,81,66,CRISIL Medium to Long Term Debt Index,SBI FMP-50-1843D-Reg(G),0.73,6.07,12.23,0.06,3.38,-73.89,91
Axis Silver ETF,2022-09-21,46369,25.44,1.05,1.77,1.09,22.96,24.49,1.6,0.07,0.11,1.09,0.09,0.1,21,22,22,18,2,16,Silver,Axis Silver ETF,15.54,1.53,2.69,0.58,20.1,60.06,22
