MF Code,incept_date,schemecode,sdx_returns,sharpex_returns,sotinox_returns,betax_returns,alphax_returns,treynorx_returns,sdy_returns,sharpey_returns,sotinoy_returns,betay_returns,alphay_returns,treynory_returns,rank_sd,rank_sharpe,rank_sotino,rank_beta,rank_alpha,rank_treynor,index_name,s_name,avg_std_dev,avg_sharpe,avg_sotino,avg_beta,avg_alpha,avg_treyno,no_of_funds_total
Aditya Birla SL Multi Asset Allocation Fund-Reg(G),2023-01-31,47416,6.87,2.92,4.9,0.19,19.56,103.72,0.43,0.18,0.31,0.19,0.08,0.41,7,11,11,8,9,9,S&P BSE 200,Aditya Birla SL Multi Asset Allocation Fund-Reg(G),6.99,3.42,5.88,0.28,23.32,137.37,13
UTI Transportation & Logistics Fund-Reg(G),2004-04-16,3435,12.65,3.73,6.47,0.77,32.99,61.21,0.8,0.24,0.41,0.77,0.13,0.24,3,4,4,3,4,4,Nifty Transportation & Logistics - TRI,UTI Transportation & Logistics Fund-Reg(G),12.49,3.89,6.69,0.73,34.83,65.68,4
Kotak Focused Equity Fund-Reg(G),2019-07-16,43968,10.07,2.89,4.82,0.88,12.8,33.11,0.63,0.18,0.3,0.88,0.05,0.13,8,25,19,28,26,27,NIFTY 500 - TRI,Kotak Focused Equity Fund-Reg(G),10.94,3.11,4.94,0.81,18.99,41.77,33
ICICI Pru Nifty Bank ETF,2019-07-10,32451,12.91,0.75,1.26,1.06,-8.27,9.17,0.81,0.05,0.08,1.06,-0.03,0.04,72,117,117,119,119,120,NIFTY BANK - TRI,ICICI Pru Nifty Bank ETF,13.05,2.43,4.12,0.85,16.78,54.35,129
UTI Nifty Bank ETF,2020-09-03,44435,12.91,0.76,1.26,1.06,-8.24,9.2,0.81,0.05,0.08,1.06,-0.03,0.04,73,116,116,120,117,117,NIFTY BANK,UTI Nifty Bank ETF,13.05,2.43,4.12,0.85,16.78,54.35,129
ICICI Pru S&P BSE Liquid Rate ETF,2018-09-25,35122,0.13,18.7,24.12,0.0,2.55,7850.76,0.01,1.18,1.52,0.0,0.01,31.15,3,2,2,2,15,1,S&P BSE Liquid Rate Index,ICICI Pru S&P BSE Liquid Rate ETF,1.24,6.31,10.26,0.23,3.36,841.85,17
Edelweiss Nifty PSU Bond Plus SDL Apr 2027 50:50 Index Fund-Reg(G),2021-10-14,45387,0.75,5.01,9.66,0.06,3.58,61.41,0.05,0.32,0.61,0.06,0.01,0.24,5,6,8,9,16,9,Nifty PSU Bond Plus SDL Apr 2027 50:50 Index,Edelweiss Nifty PSU Bond Plus SDL Apr 2027 50:50 Index Fund-Reg(G),1.31,3.18,6.27,0.13,3.32,30.82,52
Franklin India Equity Advantage Fund(G),2005-03-02,933,10.57,2.72,4.23,0.87,12.8,33.24,0.67,0.17,0.27,0.87,0.05,0.13,10,24,24,20,25,25,NIFTY LargeMidcap 250 - TRI,Franklin India Equity Advantage Fund(G),11.1,3.22,5.06,0.82,20.51,43.16,26
Quant Infrastructure Fund(G),2007-08-26,881,18.7,3.29,5.22,1.11,41.03,55.36,1.18,0.21,0.33,1.11,0.16,0.22,19,18,18,19,7,16,Nifty Infrastructure - TRI,Quant Infrastructure Fund(G),14.0,3.92,6.17,0.88,38.4,62.59,19
Tata Overnight Fund-Reg(G),2019-03-27,42706,0.01,159.76,12.96,0.0,1.69,-25067.83,0.0,10.06,0.82,0.0,0.01,-99.48,15,15,14,9,23,30,CRISIL Liquid Overnight Index,Tata Overnight Fund-Reg(G),0.04,127.22,16.16,0.0,1.88,13338.93,32
Nippon India Nifty AAA CPSE Bond Plus SDL - Apr 2027 Maturity 60:40 Index Fund(G),2022-03-29,46532,0.7,5.56,10.5,0.05,3.73,73.58,0.04,0.35,0.66,0.05,0.01,0.29,2,2,4,7,6,6,Nifty AAA CPSE Bond Plus SDL Apr 2027 60:40 Index,Nippon India Nifty AAA CPSE Bond Plus SDL - Apr 2027 Maturity 60:40 Index Fund(G),1.31,3.18,6.27,0.13,3.32,30.82,52
Aditya Birla SL Banking & Financial Services Fund-Reg(G),2013-12-14,24150,12.31,1.62,2.62,0.98,1.86,20.36,0.78,0.1,0.17,0.98,0.01,0.08,14,7,10,11,6,6,Nifty Financial Services - TRI,Aditya Birla SL Banking & Financial Services Fund-Reg(G),11.88,1.66,2.76,0.94,2.02,20.65,15
Motilal Oswal S&P 500 Index Fund-Reg(G),2020-04-28,44958,11.64,1.86,3.3,0.24,17.29,90.47,0.73,0.12,0.21,0.24,0.07,0.36,2,2,2,2,4,3,S&P 500 - TRI,Motilal Oswal S&P 500 Index Fund-Reg(G),15.5,1.17,2.06,0.37,11.29,57.37,8
Sundaram Small Cap Fund(G),2005-02-15,3052,11.91,3.14,4.62,0.69,24.54,53.8,0.75,0.2,0.29,0.69,0.1,0.21,7,10,8,15,12,16,Nifty Smallcap 250 - TRI,Sundaram Small Cap Fund(G),12.73,3.06,4.49,0.69,26.44,56.67,24
HDFC Hybrid Debt Fund(G),2003-12-26,1298,2.84,4.43,8.0,0.14,12.17,92.76,0.18,0.28,0.5,0.14,0.05,0.37,14,4,4,11,3,8,NIFTY 50 Hybrid Composite Debt 15:85 Index,HDFC Hybrid Debt Fund(G),2.68,3.55,6.44,0.13,9.04,83.65,19
DSP Dynamic Asset Allocation Fund-Reg(G),2014-02-06,25872,4.11,3.78,6.33,0.1,15.27,157.55,0.26,0.24,0.4,0.1,0.06,0.63,1,5,5,1,23,4,CRISIL Hybrid 50+50 - Moderate Index,DSP Dynamic Asset Allocation Fund-Reg(G),6.63,3.2,5.31,0.18,20.36,115.89,26
Nippon India Retirement Fund-Wealth Creation(G),2015-02-11,17164,10.61,3.37,5.44,0.25,35.03,142.76,0.67,0.21,0.34,0.25,0.14,0.57,35,12,14,27,4,9,S&P BSE 500 - TRI,Nippon India Retirement Fund-Wealth Creation(G),6.98,3.08,5.19,0.22,20.51,117.64,38
HDFC Asset Allocator FoF-Reg(G),2021-05-05,45488,5.3,3.95,6.79,0.2,20.39,102.34,0.33,0.25,0.43,0.2,0.08,0.41,21,12,11,34,27,26,NIFTY 50 Hybrid Composite Debt 65:35 Index,HDFC Asset Allocator FoF-Reg(G),7.57,3.08,5.37,0.27,19.97,112.01,53
SBI Dynamic Bond Fund-Reg(G),2004-01-13,2805,1.83,2.14,3.94,0.18,3.43,21.34,0.12,0.14,0.25,0.18,0.01,0.08,14,16,14,13,14,14,CRISIL Dynamic Bond Index,SBI Dynamic Bond Fund-Reg(G),1.71,2.86,5.38,0.17,3.45,198.99,22
ICICI Pru US Bluechip Equity Fund(G),2012-07-06,15655,13.77,1.23,2.15,0.32,11.82,52.37,0.87,0.08,0.14,0.32,0.05,0.21,4,4,4,4,5,5,S&P 500 ,ICICI Pru US Bluechip Equity Fund(G),15.5,1.17,2.06,0.37,11.29,57.37,8
HSBC Large & Mid Cap Fund-Reg(G),2019-03-28,42701,12.75,3.11,4.77,0.83,24.32,47.73,0.8,0.2,0.3,0.83,0.1,0.19,24,15,17,11,5,6,NIFTY LargeMidcap 250 - TRI,HSBC Large & Mid Cap Fund-Reg(G),11.1,3.22,5.06,0.82,20.51,43.16,26
UTI Large & Mid Cap Fund-Reg(G),2009-05-20,16672,10.64,3.64,5.69,0.86,22.76,44.76,0.67,0.23,0.36,0.86,0.09,0.18,11,4,4,18,10,12,NIFTY LargeMidcap 250 - TRI,UTI Large & Mid Cap Fund-Reg(G),11.1,3.22,5.06,0.82,20.51,43.16,26
HSBC Multi Cap Fund-Reg(G),2023-01-30,47272,12.21,3.8,5.87,0.82,31.32,56.8,0.77,0.24,0.37,0.82,0.12,0.23,28,4,5,16,1,1,Nifty500 Multicap 50:25:25 - TRI,HSBC Multi Cap Fund-Reg(G),10.94,3.11,4.94,0.81,18.99,41.77,33
Edelweiss Large & Mid Cap Fund-Reg(G),2007-06-14,1956,10.91,2.99,4.71,0.84,17.04,38.66,0.69,0.19,0.3,0.84,0.07,0.15,13,19,19,12,18,19,NIFTY LargeMidcap 250 - TRI,Edelweiss Large & Mid Cap Fund-Reg(G),11.1,3.22,5.06,0.82,20.51,43.16,26
HDFC Business Cycle Fund-Reg(G),2022-11-30,46445,9.66,2.64,4.48,0.84,10.08,30.44,0.61,0.17,0.28,0.84,0.04,0.12,14,33,33,24,39,38,NIFTY 500 - TRI,HDFC Business Cycle Fund-Reg(G),11.64,3.2,5.24,0.83,21.91,44.27,44
Kotak India EQ Contra Fund(G),2005-07-27,1973,11.48,3.62,5.81,0.9,24.87,46.22,0.72,0.23,0.37,0.9,0.1,0.18,14,7,6,12,7,8,NIFTY 500 - TRI,Kotak India EQ Contra Fund(G),11.51,3.42,5.51,0.88,23.32,45.03,21
DSP Short Term Fund-Reg(G),2002-09-09,729,0.7,5.06,9.88,0.07,3.35,48.86,0.04,0.32,0.62,0.07,0.01,0.19,11,11,12,12,17,14,CRISIL Short Duration Debt Index,DSP Short Term Fund-Reg(G),0.72,5.12,10.05,0.07,3.39,287.7,26
Tata Multicap Fund-Reg(G),2023-02-02,47480,10.36,2.44,3.65,0.77,11.09,32.86,0.65,0.15,0.23,0.77,0.04,0.13,12,30,31,6,30,28,Nifty500 Multicap 50:25:25 - TRI,Tata Multicap Fund-Reg(G),10.94,3.11,4.94,0.81,18.99,41.77,33
ICICI Pru Bond Fund(G),2008-08-18,6197,1.77,2.47,4.55,0.2,3.83,21.97,0.11,0.16,0.29,0.2,0.02,0.09,43,36,36,44,4,36,CRISIL Medium to Long Term Debt Index,ICICI Pru Bond Fund(G),1.31,3.18,6.27,0.13,3.32,30.82,52
ICICI Pru Constant Maturity Gilt Fund(G),2014-09-12,30426,2.63,1.4,2.46,0.3,2.85,12.12,0.17,0.09,0.16,0.3,0.01,0.05,4,4,5,3,3,2,Crisil 10 Yr Gilt Index,ICICI Pru Constant Maturity Gilt Fund(G),2.6,1.42,2.49,0.3,2.88,12.09,6
Nippon India Corp Bond Fund(G),2000-09-14,2646,0.76,5.6,10.94,0.06,4.06,65.8,0.05,0.35,0.69,0.06,0.02,0.26,12,5,6,6,4,5,NIFTY Corporate Bond Index,Nippon India Corp Bond Fund(G),0.74,5.41,10.34,0.07,3.7,65.9,21
Kotak NASDAQ 100 FoF-Reg(G),2021-02-02,45260,17.14,1.95,3.59,0.2,32.84,165.24,1.08,0.12,0.23,0.2,0.13,0.66,41,9,7,11,7,5,Nasdaq-100 - TRI,Kotak NASDAQ 100 FoF-Reg(G),15.56,1.15,2.06,0.46,15.97,64.47,56
SBI Nifty 10 yr Benchmark G-Sec ETF,2016-06-10,32455,2.65,1.44,2.52,0.32,3.1,12.05,0.17,0.09,0.16,0.32,0.01,0.05,17,17,17,17,14,16,Nifty 10 yr Benchmark G-Sec,SBI Nifty 10 yr Benchmark G-Sec ETF,1.24,6.31,10.26,0.23,3.36,841.85,17
HSBC Overnight Fund-Reg(G),2019-05-22,42784,0.06,31.22,23.79,0.0,1.94,-29586.61,0.0,1.97,1.5,0.0,0.01,-117.41,24,24,8,3,9,32,Nifty 1D Rate Index,HSBC Overnight Fund-Reg(G),0.04,127.22,16.16,0.0,1.88,13338.93,32
Nippon India ETF Nifty PSU Bank BeES,2007-10-25,3722,24.56,2.57,4.59,1.23,42.39,51.43,1.55,0.16,0.29,1.23,0.17,0.2,126,64,62,128,8,42,NIFTY PSU BANK - TRI,Nippon India ETF Nifty PSU Bank BeES,13.05,2.43,4.12,0.85,16.78,54.35,129
UTI MNC Fund-Reg(G),1998-10-14,3634,9.36,3.06,4.98,0.58,17.84,49.09,0.59,0.19,0.31,0.58,0.07,0.19,3,3,3,5,3,3,NIFTY MNC - TRI,UTI MNC Fund-Reg(G),9.15,2.83,4.59,0.56,15.67,45.92,5
ICICI Pru Transportation and Logistics Fund-Reg(G),2022-10-28,46979,11.64,3.99,6.72,0.69,33.82,67.56,0.73,0.25,0.42,0.69,0.13,0.27,2,2,2,2,3,2,Nifty Transportation & Logistics - TRI,ICICI Pru Transportation and Logistics Fund-Reg(G),12.49,3.89,6.69,0.73,34.83,65.68,4
UTI Balanced Advantage Fund-Reg(G),2023-08-10,48102,,,,,,,,,,,,,,,,,,,NIFTY 50 Hybrid Composite Debt 50:50 Index,UTI Balanced Advantage Fund-Reg(G),6.63,3.2,5.31,0.18,20.36,115.89,26
UTI MEPUS,2003-03-28,3617,9.2,2.6,4.41,0.85,8.14,28.0,0.58,0.16,0.28,0.85,0.03,0.11,4,49,41,38,53,53,S&P BSE 100 - TRI,UTI MEPUS,10.76,2.99,4.81,0.81,17.33,40.7,59
HDFC Multi-Asset Fund(G),2005-08-17,1307,5.3,3.59,6.32,0.18,18.55,108.69,0.33,0.23,0.4,0.18,0.07,0.43,2,7,5,5,10,8,NIFTY 50 - TRI,HDFC Multi-Asset Fund(G),6.99,3.42,5.88,0.28,23.32,137.37,13
SBI Infrastructure Fund-Reg(G),2007-07-06,2743,11.64,4.32,7.02,0.81,35.41,62.37,0.73,0.27,0.44,0.81,0.14,0.25,1,2,1,3,12,10,Nifty Infrastructure - TRI,SBI Infrastructure Fund-Reg(G),14.0,3.92,6.17,0.88,38.4,62.59,19
Kotak Nifty SDL Apr 2032 Top 12 Equal Weight Index Fund-Reg(G),2022-02-11,46390,2.07,1.91,3.81,0.13,3.58,30.11,0.13,0.12,0.24,0.13,0.01,0.12,6,5,3,1,2,1,Nifty SDL Apr 2032 Top 12 Equal Weight Index,Kotak Nifty SDL Apr 2032 Top 12 Equal Weight Index Fund-Reg(G),2.65,1.57,2.85,0.5,3.18,16.47,19
Tata Multi Asset Opp Fund-Reg(G),2020-03-04,44648,6.39,3.56,6.05,0.14,22.38,162.26,0.4,0.22,0.38,0.14,0.09,0.64,5,8,7,2,8,4,S&P BSE 200,Tata Multi Asset Opp Fund-Reg(G),6.99,3.42,5.88,0.28,23.32,137.37,13
Tata Flexi Cap Fund-Reg(G),2018-09-06,39283,9.93,2.87,4.41,0.79,13.99,36.26,0.63,0.18,0.28,0.79,0.06,0.14,15,27,30,6,27,23,NIFTY 500 - TRI,Tata Flexi Cap Fund-Reg(G),10.67,3.04,4.92,0.83,17.02,38.61,41
ICICI Pru Nifty 100 Low Volatility 30 ETF,2017-07-04,36395,9.52,2.94,4.92,0.76,15.04,36.72,0.6,0.19,0.31,0.76,0.06,0.15,6,54,50,31,63,61,Nifty100 Low Volatility 30 - TRI,ICICI Pru Nifty 100 Low Volatility 30 ETF,13.05,2.43,4.12,0.85,16.78,54.35,129
LIC MF Large & Midcap Fund-Reg(G),2015-02-25,31950,11.21,3.26,5.21,0.83,21.27,44.13,0.71,0.21,0.33,0.83,0.08,0.18,19,12,12,10,14,13,NIFTY LargeMidcap 250 - TRI,LIC MF Large & Midcap Fund-Reg(G),11.1,3.22,5.06,0.82,20.51,43.16,26
Axis Business Cycles Fund-Reg(G),2023-02-22,47580,11.21,2.92,4.7,0.84,17.19,38.86,0.71,0.18,0.3,0.84,0.07,0.15,29,26,27,26,27,27,NIFTY 500 - TRI,Axis Business Cycles Fund-Reg(G),11.64,3.2,5.24,0.83,21.91,44.27,44
Tata Ultra Short Term Fund-Reg(G),2019-01-22,41798,0.28,13.93,28.84,0.0,3.93,-10637.42,0.02,0.88,1.82,0.0,0.02,-42.21,9,15,17,3,17,18,CRISIL Ultra Short Term Debt Index,Tata Ultra Short Term Fund-Reg(G),0.29,14.07,29.51,0.0,4.11,661.59,24
HDFC Defence Fund-Reg(G),2023-06-02,46585,,,,,,,,,,,,,,,,,,,Nifty India Defence - TRI,HDFC Defence Fund-Reg(G),11.64,3.2,5.24,0.83,21.91,44.27,44
Mirae Asset Multicap Fund-Reg(G),2023-08-21,48089,,,,,,,,,,,,,,,,,,,Nifty500 Multicap 50:25:25 - TRI,Mirae Asset Multicap Fund-Reg(G),10.94,3.11,4.94,0.81,18.99,41.77,33
UTI Short Duration Fund-Reg(G),2007-09-18,3656,0.73,5.78,11.67,0.08,4.01,55.36,0.05,0.36,0.74,0.08,0.02,0.22,14,6,5,14,4,9,CRISIL Short Duration Debt Index,UTI Short Duration Fund-Reg(G),0.72,5.12,10.05,0.07,3.39,287.7,26
SBI Healthcare Opp Fund-Reg(G),1999-07-14,2813,10.97,3.62,6.32,0.39,32.43,101.2,0.69,0.23,0.4,0.39,0.13,0.4,3,7,7,1,9,4,S&P BSE Health Care - TRI,SBI Healthcare Opp Fund-Reg(G),11.49,3.67,6.64,0.47,33.72,92.93,11
Invesco India ELSS Tax Saver Fund(G),2006-12-29,2270,9.99,3.29,5.19,0.8,18.04,40.95,0.63,0.21,0.33,0.8,0.07,0.16,21,16,20,24,30,28,S&P BSE 500 - TRI,Invesco India ELSS Tax Saver Fund(G),10.76,2.99,4.81,0.81,17.33,40.7,59
HDFC Long Duration Debt Fund-Reg(G),2023-01-20,45991,3.9,1.08,1.83,0.44,3.02,9.63,0.25,0.07,0.12,0.44,0.01,0.04,19,19,18,19,16,19,NIFTY Long Duration Debt Index,HDFC Long Duration Debt Fund-Reg(G),2.65,1.57,2.85,0.5,3.18,16.47,19
UTI Low Duration Fund-Reg(G),2007-04-23,3601,0.33,13.42,25.22,0.01,4.38,480.14,0.02,0.85,1.59,0.01,0.02,1.91,9,1,12,8,3,8,NIFTY Low Duration Debt Index,UTI Low Duration Fund-Reg(G),0.33,12.7,25.44,0.01,4.18,449.9,20
DSP Corp Bond Fund-Reg(G),2018-09-10,37709,0.69,5.11,9.13,0.07,3.33,52.21,0.04,0.32,0.58,0.07,0.01,0.21,7,14,16,9,16,11,CRISIL Corporate Bond Index,DSP Corp Bond Fund-Reg(G),0.74,5.41,10.34,0.07,3.7,65.9,21
Bajaj Finserv Flexi Cap Fund-Reg(G),2023-08-14,48061,,,,,,,,,,,,,,,,,,,S&P BSE 500 - TRI,Bajaj Finserv Flexi Cap Fund-Reg(G),10.67,3.04,4.92,0.83,17.02,38.61,41
UTI Focused Fund-Reg(G),2021-08-25,45685,9.67,3.01,5.05,0.82,14.06,35.68,0.61,0.19,0.32,0.82,0.06,0.14,8,21,15,18,26,25,NIFTY 500 - TRI,UTI Focused Fund-Reg(G),10.67,3.04,4.92,0.83,17.02,38.61,41
ICICI Pru Housing Opp Fund-Reg(G),2022-04-18,46546,10.91,3.04,5.05,0.87,17.16,38.18,0.69,0.19,0.32,0.87,0.07,0.15,25,21,20,31,28,30,Nifty Housing - TRI,ICICI Pru Housing Opp Fund-Reg(G),11.64,3.2,5.24,0.83,21.91,44.27,44
Invesco India Focused Fund-Reg(G),2020-09-29,45058,11.05,4.48,7.69,0.76,35.41,64.84,0.7,0.28,0.48,0.76,0.14,0.26,30,1,1,4,1,1,S&P BSE 500 - TRI,Invesco India Focused Fund-Reg(G),10.67,3.04,4.92,0.83,17.02,38.61,41
Quant Large & Mid Cap Fund(G),2006-12-11,874,14.81,3.59,5.68,0.93,36.01,57.15,0.93,0.23,0.36,0.93,0.14,0.23,26,6,6,25,1,2,NIFTY LargeMidcap 250 - TRI,Quant Large & Mid Cap Fund(G),11.1,3.22,5.06,0.82,20.51,43.16,26
ICICI Pru PSU Equity Fund-Reg(G),2022-09-12,46106,16.59,3.86,6.52,0.96,46.42,66.88,1.05,0.24,0.41,0.96,0.18,0.27,85,3,3,61,3,4,S&P BSE PSU - TRI,ICICI Pru PSU Equity Fund-Reg(G),12.53,2.87,4.64,0.89,20.19,42.06,91
SBI Nifty Next 50 ETF,2015-03-20,30248,14.04,3.67,5.87,0.89,36.51,58.01,0.88,0.23,0.37,0.89,0.14,0.23,97,9,20,52,15,24,NIFTY NEXT 50 - TRI,SBI Nifty Next 50 ETF,13.05,2.43,4.12,0.85,16.78,54.35,129
Kotak Dynamic Bond Fund-Reg(G),2008-05-28,5430,1.94,2.32,4.34,0.18,4.01,25.05,0.12,0.15,0.27,0.18,0.02,0.1,17,10,9,10,4,9,NIFTY Composite Debt Index,Kotak Dynamic Bond Fund-Reg(G),1.71,2.86,5.38,0.17,3.45,198.99,22
Sundaram Multi Cap Fund(G),2000-10-25,2370,10.13,3.41,5.47,0.78,20.06,44.07,0.64,0.21,0.34,0.78,0.08,0.17,9,10,8,7,17,17,Nifty500 Multicap 50:25:25 - TRI,Sundaram Multi Cap Fund(G),10.94,3.11,4.94,0.81,18.99,41.77,33
Tata Ethical Fund-Reg(G),1996-05-24,3283,10.15,2.62,4.33,0.71,13.56,37.6,0.64,0.17,0.27,0.71,0.05,0.15,19,35,36,8,33,31,Nifty500 Shariah - TRI,Tata Ethical Fund-Reg(G),11.64,3.2,5.24,0.83,21.91,44.27,44
Union Liquid Fund(G),2011-06-15,14561,0.06,35.25,14.85,0.0,2.07,7289.15,0.0,2.22,0.94,0.0,0.01,28.93,5,4,26,26,17,15,CRISIL Liquid Debt Index,Union Liquid Fund(G),0.09,27.19,17.19,0.0,2.23,2407.77,36
DSP Ultra Short Fund-Reg(G),2006-07-31,702,0.31,12.93,29.91,0.0,4.06,-7680.83,0.02,0.81,1.88,0.0,0.02,-30.48,22,23,12,2,14,17,CRISIL Ultra Short Term Debt Index,DSP Ultra Short Fund-Reg(G),0.29,14.07,29.51,0.0,4.11,661.59,24
Kotak Business Cycle Fund-Reg(G),2022-09-28,46472,9.66,3.0,4.95,0.79,14.44,36.92,0.61,0.19,0.31,0.79,0.06,0.15,13,23,22,17,31,33,NIFTY 500 - TRI,Kotak Business Cycle Fund-Reg(G),11.64,3.2,5.24,0.83,21.91,44.27,44
HDFC NIFTY Bank ETF,2020-08-21,33563,12.91,0.75,1.25,1.06,-8.32,9.15,0.81,0.05,0.08,1.06,-0.03,0.04,71,121,121,118,122,122,NIFTY BANK - TRI,HDFC NIFTY Bank ETF,13.05,2.43,4.12,0.85,16.78,54.35,129
Mahindra Manulife Mid Cap Fund-Reg(G),2018-01-30,38444,13.86,3.6,5.39,0.83,34.45,59.72,0.87,0.23,0.34,0.83,0.14,0.24,26,9,18,27,5,9,Nifty Midcap 150 - TRI,Mahindra Manulife Mid Cap Fund-Reg(G),12.33,3.4,5.29,0.75,28.22,55.85,30
Baroda BNP Paribas Multi Cap Fund-Reg(G),2003-09-12,500,11.67,3.23,5.04,0.83,22.38,45.44,0.73,0.2,0.32,0.83,0.09,0.18,27,14,15,18,12,15,Nifty500 Multicap 50:25:25 - TRI,Baroda BNP Paribas Multi Cap Fund-Reg(G),10.94,3.11,4.94,0.81,18.99,41.77,33
Kotak Debt Hybrid Fund(G),2003-12-02,2051,3.6,3.61,5.98,0.18,12.47,71.16,0.23,0.23,0.38,0.18,0.05,0.28,19,12,14,16,2,13,CRISIL Hybrid 85+15 - Conservative Index,Kotak Debt Hybrid Fund(G),2.68,3.55,6.44,0.13,9.04,83.65,19
SBI CRISIL IBX Gilt Index - June 2036 Fund-Reg(G),2022-10-04,46941,3.04,1.3,2.21,0.35,3.0,11.26,0.19,0.08,0.14,0.35,0.01,0.04,13,13,15,13,17,14,CRISIL IBX Gilt Index - June 2036,SBI CRISIL IBX Gilt Index - June 2036 Fund-Reg(G),2.65,1.57,2.85,0.5,3.18,16.47,19
HSBC Infrastructure Fund-Reg(G),2007-09-27,594,14.01,3.73,5.84,0.87,36.16,59.85,0.88,0.24,0.37,0.87,0.14,0.24,10,16,16,10,11,11,Nifty Infrastructure - TRI,HSBC Infrastructure Fund-Reg(G),14.0,3.92,6.17,0.88,38.4,62.59,19
Franklin Build India Fund(G),2009-09-04,7864,13.66,4.38,6.8,0.88,43.6,67.91,0.86,0.28,0.43,0.88,0.17,0.27,8,1,2,12,6,6,S&P BSE India Infrastructure Index - TRI,Franklin Build India Fund(G),14.0,3.92,6.17,0.88,38.4,62.59,19
Bajaj Finserv Liquid Fund-Reg(G),2023-07-05,48041,,,,,,,,,,,,,,,,,,,Nifty Liquid Fund Index,Bajaj Finserv Liquid Fund-Reg(G),0.09,27.19,17.19,0.0,2.23,2407.77,36
DSP Banking & PSU Debt Fund-Reg(G),2013-09-14,22142,0.98,4.14,7.62,0.09,3.83,43.27,0.06,0.26,0.48,0.09,0.02,0.17,24,20,21,23,6,21,NIFTY Banking and PSU Debt Index,DSP Banking & PSU Debt Fund-Reg(G),0.74,5.41,10.61,0.07,3.62,-186.51,26
Quant Liquid Plan(G),2005-09-29,883,0.15,18.81,22.94,0.0,2.77,5104.56,0.01,1.18,1.44,0.0,0.01,20.26,30,29,7,32,5,20,CRISIL Liquid Debt Index,Quant Liquid Plan(G),0.09,27.19,17.19,0.0,2.23,2407.77,36
Mirae Asset Nifty 50 ETF,2018-11-20,41174,10.1,2.17,3.74,0.98,5.27,22.38,0.64,0.14,0.24,0.98,0.02,0.09,23,82,81,94,86,89,NIFTY 50 - TRI,Mirae Asset Nifty 50 ETF,13.05,2.43,4.12,0.85,16.78,54.35,129
ICICI Pru Nifty Private Bank ETF,2019-08-09,42119,13.15,0.55,0.9,1.07,-10.89,6.8,0.83,0.03,0.06,1.07,-0.04,0.03,78,124,125,124,126,125,Nifty Private Bank - TRI,ICICI Pru Nifty Private Bank ETF,13.05,2.43,4.12,0.85,16.78,54.35,129
HDFC Gilt Fund(G),2001-07-25,1269,1.73,2.38,4.37,0.19,3.6,21.22,0.11,0.15,0.28,0.19,0.01,0.08,11,10,10,11,10,9,Nifty All Duration G-Sec Index,HDFC Gilt Fund(G),1.98,2.2,4.08,0.22,3.38,20.1,35
SBI PSU Fund-Reg(G),2010-07-07,9252,21.35,3.51,5.48,1.14,53.75,65.39,1.34,0.22,0.34,1.14,0.21,0.26,44,14,16,44,1,4,S&P BSE PSU - TRI,SBI PSU Fund-Reg(G),11.64,3.2,5.24,0.83,21.91,44.27,44
HSBC Ultra Short Duration Fund-Reg(G),2020-01-29,44328,0.3,15.02,30.34,0.0,4.44,11584.69,0.02,0.95,1.91,0.0,0.02,45.97,14,3,7,14,7,5,NIFTY Ultra Short Duration Debt Index,HSBC Ultra Short Duration Fund-Reg(G),0.29,14.07,29.51,0.0,4.11,661.59,24
Tata Treasury Advantage Fund-Reg(G),2005-09-06,3205,0.34,12.46,24.65,0.01,4.18,353.53,0.02,0.78,1.55,0.01,0.02,1.4,14,15,16,12,8,11,CRISIL Low Duration Debt Index,Tata Treasury Advantage Fund-Reg(G),0.33,12.7,25.44,0.01,4.18,449.9,20
UTI Ultra Short Duration Fund-Reg(G),2003-08-29,3533,0.29,14.76,30.23,0.0,4.21,-16277.31,0.02,0.93,1.9,0.0,0.02,-64.59,10,6,9,7,11,23,NIFTY Ultra Short Duration Debt Index,UTI Ultra Short Duration Fund-Reg(G),0.29,14.07,29.51,0.0,4.11,661.59,24
DSP Healthcare Fund-Reg(G),2018-11-30,36002,10.64,3.92,7.06,0.46,34.57,91.48,0.67,0.25,0.44,0.46,0.14,0.36,1,4,5,6,5,7,S&P BSE Health Care - TRI,DSP Healthcare Fund-Reg(G),11.49,3.67,6.64,0.47,33.72,92.93,11
ICICI Pru Bharat Consumption Fund(G),2019-04-12,41946,7.93,4.26,7.35,0.55,23.59,61.01,0.5,0.27,0.46,0.55,0.09,0.24,1,1,1,2,2,1,Nifty India Consumption - TRI,ICICI Pru Bharat Consumption Fund(G),9.73,3.08,5.09,0.64,17.74,45.61,13
Tata ST Bond Fund-Reg(G),2002-08-08,3286,0.73,4.75,9.63,0.08,3.25,44.91,0.05,0.3,0.61,0.08,0.01,0.18,15,17,15,16,20,18,CRISIL Short Duration Debt Index,Tata ST Bond Fund-Reg(G),0.72,5.12,10.05,0.07,3.39,287.7,26
Bandhan Dynamic Bond Fund-Reg(G),2008-12-01,7455,3.16,1.52,2.74,0.32,3.91,14.77,0.2,0.1,0.17,0.32,0.02,0.06,22,21,20,22,6,19,NIFTY Composite Debt Index,Bandhan Dynamic Bond Fund-Reg(G),1.71,2.86,5.38,0.17,3.45,198.99,22
SBI Retirement Benefit Fund-Aggressive Plan-Reg(G),2021-02-10,30398,9.51,2.63,4.47,0.38,23.97,65.77,0.6,0.17,0.28,0.38,0.1,0.26,29,31,28,38,16,28,S&P BSE 500 - TRI,SBI Retirement Benefit Fund-Aggressive Plan-Reg(G),6.98,3.08,5.19,0.22,20.51,117.64,38
Canara Rob Focused Equity Fund-Reg(G),2021-05-17,45510,9.4,2.97,5.13,0.82,12.75,33.94,0.59,0.19,0.32,0.82,0.05,0.13,3,22,13,17,27,25,S&P BSE 500 - TRI,Canara Rob Focused Equity Fund-Reg(G),10.94,3.11,4.94,0.81,18.99,41.77,33
Kotak Nifty 50 ETF,2010-02-02,8469,10.12,2.16,3.74,0.98,5.22,22.38,0.64,0.14,0.24,0.98,0.02,0.09,24,84,82,88,88,84,NIFTY 50 - TRI,Kotak Nifty 50 ETF,13.05,2.43,4.12,0.85,16.78,54.35,129
Kotak Pioneer Fund-Reg(G),2019-10-25,43927,9.48,3.91,6.62,0.68,24.49,54.81,0.6,0.25,0.42,0.68,0.1,0.22,9,7,7,4,14,9,NIFTY 500 - TRI,Kotak Pioneer Fund-Reg(G),11.64,3.2,5.24,0.83,21.91,44.27,44
DSP Nifty SDL Plus G-Sec Jun 2028 30:70 Index Fund-Reg(G),2022-03-21,45863,1.12,3.33,6.49,0.13,3.38,28.25,0.07,0.21,0.41,0.13,0.01,0.11,23,24,25,32,30,32,Nifty SDL Plus G-Sec Jun 2028 70:30 Index,DSP Nifty SDL Plus G-Sec Jun 2028 30:70 Index Fund-Reg(G),1.31,3.18,6.27,0.13,3.32,30.82,52
DSP Focus Fund-Reg(G),2010-06-10,8463,11.55,2.97,4.77,0.86,18.5,39.97,0.73,0.19,0.3,0.86,0.07,0.16,26,21,22,24,19,22,NIFTY 500 - TRI,DSP Focus Fund-Reg(G),10.94,3.11,4.94,0.81,18.99,41.77,33
Aditya Birla SL Nifty 50 ETF,2011-07-21,12811,10.15,2.17,3.72,0.98,4.89,22.4,0.64,0.14,0.23,0.98,0.02,0.09,28,78,86,97,91,82,NIFTY 50 - TRI,Aditya Birla SL Nifty 50 ETF,13.05,2.43,4.12,0.85,16.78,54.35,129
Mirae Asset Healthcare Fund-Reg(G),2018-07-02,39122,11.86,3.48,6.26,0.48,32.46,86.21,0.75,0.22,0.39,0.48,0.13,0.34,9,8,8,8,8,9,S&P BSE Health Care - TRI,Mirae Asset Healthcare Fund-Reg(G),11.49,3.67,6.64,0.47,33.72,92.93,11
Nippon India ETF Nifty IT,2020-06-30,44506,17.84,0.95,1.82,0.96,0.68,17.69,1.12,0.06,0.11,0.96,0.0,0.07,116,108,107,75,110,109,NIFTY IT - TRI,Nippon India ETF Nifty IT,13.05,2.43,4.12,0.85,16.78,54.35,129
Bandhan Balanced Advantage Fund-Reg(G),2014-10-10,30671,4.86,3.13,5.17,0.2,14.69,76.83,0.31,0.2,0.33,0.2,0.06,0.3,3,14,13,16,25,23,NIFTY 50 Hybrid Composite Debt 50:50 Index,Bandhan Balanced Advantage Fund-Reg(G),6.63,3.2,5.31,0.18,20.36,115.89,26
Tata Business Cycle Fund-Reg(G),2021-08-04,45373,11.21,3.82,5.95,0.86,26.84,49.52,0.71,0.24,0.37,0.86,0.11,0.2,28,10,11,29,10,13,NIFTY 500 - TRI,Tata Business Cycle Fund-Reg(G),11.64,3.2,5.24,0.83,21.91,44.27,44
Bandhan G-Sec-Invest-Reg(G),2008-12-05,7483,3.2,1.66,3.02,0.33,4.41,16.25,0.2,0.1,0.19,0.33,0.02,0.06,35,31,29,34,3,22,CRISIL Dynamic Gilt Index,Bandhan G-Sec-Invest-Reg(G),1.98,2.2,4.08,0.22,3.38,20.1,35
ICICI Pru Silver ETF,2022-01-24,46214,21.44,1.13,2.0,1.16,21.47,20.79,1.35,0.07,0.13,1.16,0.09,0.08,19,15,15,20,3,16,Silver,ICICI Pru Silver ETF,15.05,1.28,2.32,0.67,16.56,41.09,21
UTI Infrastructure Fund-Reg(G),2004-04-19,3582,12.24,3.87,6.44,0.91,30.57,52.09,0.77,0.24,0.41,0.91,0.12,0.21,2,13,6,16,18,17,Nifty Infrastructure - TRI,UTI Infrastructure Fund-Reg(G),14.0,3.92,6.17,0.88,38.4,62.59,19
Quant Quantamental Fund-Reg(G),2021-04-30,45480,16.24,3.29,5.11,1.01,34.88,53.05,1.02,0.21,0.32,1.01,0.14,0.21,40,17,17,39,7,10,NIFTY 200 - TRI,Quant Quantamental Fund-Reg(G),11.64,3.2,5.24,0.83,21.91,44.27,44
Quant Multi Asset Fund(G),2001-03-20,869,11.59,3.41,5.41,0.16,39.14,248.75,0.73,0.22,0.34,0.16,0.16,0.99,13,9,10,3,1,2,S&P BSE 200 - TRI,Quant Multi Asset Fund(G),6.99,3.42,5.88,0.28,23.32,137.37,13
SBI Consumption Opp Fund-Reg(G),2013-01-01,19166,9.53,2.9,4.63,0.6,16.66,46.44,0.6,0.18,0.29,0.6,0.07,0.18,6,12,12,4,10,8,Nifty India Consumption - TRI,SBI Consumption Opp Fund-Reg(G),9.73,3.08,5.09,0.64,17.74,45.61,13
Templeton India Equity Income Fund(G),2006-05-18,3367,11.85,3.12,5.18,0.81,22.08,45.69,0.75,0.2,0.33,0.81,0.09,0.18,7,7,6,2,4,3,NIFTY 500 - TRI,Templeton India Equity Income Fund(G),11.31,3.38,5.51,0.86,22.16,44.17,9
Nippon India Silver ETF,2022-02-04,46199,21.22,0.95,1.68,1.14,17.64,17.77,1.34,0.06,0.11,1.14,0.07,0.07,18,17,16,17,6,19,Silver,Nippon India Silver ETF,15.05,1.28,2.32,0.67,16.56,41.09,21
Sundaram Multi Asset Allocation Fund-Reg(G),2024-01-25,48460,,,,,,,,,,,,,,,,,,,NIFTY 500 - TRI,Sundaram Multi Asset Allocation Fund-Reg(G),6.99,3.42,5.88,0.28,23.32,137.37,13
Canara Rob Mid Cap Fund-Reg(G),2022-12-02,46001,11.07,3.37,5.4,0.68,24.67,54.56,0.7,0.21,0.34,0.68,0.1,0.22,6,20,16,5,23,19,S&P BSE 150 MidCap - TRI,Canara Rob Mid Cap Fund-Reg(G),12.33,3.4,5.29,0.75,28.22,55.85,30
Edelweiss US Technology Equity FOF-Reg(G),2020-03-05,44630,23.34,1.59,2.84,0.67,35.15,55.31,1.47,0.1,0.18,0.67,0.14,0.22,54,22,22,48,4,24,Russell 1000 Equal Weighted Technology Index,Edelweiss US Technology Equity FOF-Reg(G),15.56,1.15,2.06,0.46,15.97,64.47,56
Mahindra Manulife Large & Mid Cap Fund-Reg(G),2019-12-30,43915,13.75,2.94,4.43,0.93,23.23,43.32,0.87,0.19,0.28,0.93,0.09,0.17,25,21,22,26,8,14,NIFTY LargeMidcap 250 - TRI,Mahindra Manulife Large & Mid Cap Fund-Reg(G),11.1,3.22,5.06,0.82,20.51,43.16,26
Canara Rob Multi Cap Fund-Reg(G),2023-07-28,46370,,,,,,,,,,,,,,,,,,,Nifty500 Multicap 50:25:25 - TRI,Canara Rob Multi Cap Fund-Reg(G),10.94,3.11,4.94,0.81,18.99,41.77,33
Axis Balanced Advantage Fund-Reg(G),2017-08-01,37918,6.85,3.13,5.38,0.23,20.79,91.78,0.43,0.2,0.34,0.23,0.08,0.36,17,15,11,22,11,21,NIFTY 50 Hybrid Composite Debt 50:50 Index,Axis Balanced Advantage Fund-Reg(G),6.63,3.2,5.31,0.18,20.36,115.89,26
Sundaram Flexi Cap Fund-Reg(G),2022-09-06,46622,9.9,2.43,3.91,0.89,7.74,27.19,0.62,0.15,0.25,0.89,0.03,0.11,13,37,37,28,38,38,NIFTY 500 - TRI,Sundaram Flexi Cap Fund-Reg(G),10.67,3.04,4.92,0.83,17.02,38.61,41
