MF Code,incept_date,schemecode,sdx_returns,sharpex_returns,sotinox_returns,betax_returns,alphax_returns,treynorx_returns,sdy_returns,sharpey_returns,sotinoy_returns,betay_returns,alphay_returns,treynory_returns,rank_sd,rank_sharpe,rank_sotino,rank_beta,rank_alpha,rank_treynor,index_name,s_name,avg_std_dev,avg_sharpe,avg_sotino,avg_beta,avg_alpha,avg_treyno,no_of_funds_total
Navi Nifty Midcap 150 Index Fund-Reg(G),2022-03-11,45861,13.28,3.4,5.0,0.83,29.91,54.68,0.84,0.21,0.32,0.83,0.12,0.22,52,37,39,14,38,42,Nifty Midcap 150 - TRI,Navi Nifty Midcap 150 Index Fund-Reg(G),12.53,2.87,4.64,0.89,20.19,42.06,91
Bank of India Credit Risk Fund-Reg(G),2015-02-27,30390,1.13,3.47,19.95,0.0,3.93,-1292.89,0.07,0.22,1.26,0.0,0.02,-5.13,11,11,3,2,9,15,CRISIL Credit Risk Debt Index,Bank of India Credit Risk Fund-Reg(G),1.34,5.42,14.44,0.05,4.57,-35.88,15
Invesco India Credit Risk Fund(G),2014-09-04,21522,1.68,3.12,15.52,0.06,5.07,82.28,0.11,0.2,0.98,0.06,0.02,0.33,13,13,6,13,2,10,NIFTY Credit Risk Bond Index,Invesco India Credit Risk Fund(G),1.34,5.42,14.44,0.05,4.57,-35.88,15
Shriram Multi Asset Allocation Fund-Reg(G),2023-09-08,48029,,,,,,,,,,,,,,,,,,,NIFTY 50 - TRI,Shriram Multi Asset Allocation Fund-Reg(G),6.99,3.42,5.88,0.28,23.32,137.37,13
Baroda BNP Paribas Banking and Fin Serv Fund-Reg(G),2012-06-22,16955,12.17,1.74,2.92,0.99,3.0,21.5,0.77,0.11,0.18,0.99,0.01,0.09,12,5,5,14,5,5,Nifty Financial Services - TRI,Baroda BNP Paribas Banking and Fin Serv Fund-Reg(G),11.88,1.66,2.76,0.94,2.02,20.65,15
DSP World Energy Fund-Reg(G),2009-08-14,7866,16.96,0.04,0.06,0.83,-1.81,0.76,1.07,0.0,0.0,0.83,-0.01,0.0,40,49,49,52,50,48,MSCI World,DSP World Energy Fund-Reg(G),15.56,1.15,2.06,0.46,15.97,64.47,56
Aditya Birla SL FMP-US-100D-Reg(G),2024-01-10,48501,,,,,,,,,,,,,,,,,,,CRISIL Ultra Short Term Debt Index,Aditya Birla SL FMP-US-100D-Reg(G),0.74,5.42,11.05,0.05,3.0,-245.9,92
SBI FMP-47-1434D-Reg(G),2021-07-23,45660,0.42,4.15,8.28,0.03,1.69,53.15,0.03,0.26,0.52,0.03,0.01,0.21,18,45,52,19,69,22,CRISIL Medium Duration Debt Index,SBI FMP-47-1434D-Reg(G),0.74,5.42,11.05,0.05,3.0,-245.9,92
ICICI Pru Debt Mgmt Fund(FOF)(G),2003-12-18,1707,0.93,5.03,10.32,0.1,4.41,47.07,0.06,0.32,0.65,0.1,0.02,0.19,3,2,2,13,44,42,CRISIL Composite Bond Index,ICICI Pru Debt Mgmt Fund(FOF)(G),7.57,3.08,5.37,0.27,19.97,112.01,53
Kotak India Growth Fund-Sr 4(G),2018-02-15,38109,10.98,3.55,5.75,0.88,21.9,44.4,0.69,0.22,0.36,0.88,0.09,0.18,19,7,6,27,13,16,NIFTY 200,Kotak India Growth Fund-Sr 4(G),10.94,3.11,4.94,0.81,18.99,41.77,33
Axis NIFTY IT ETF,2021-03-25,45427,17.82,0.95,1.82,0.96,0.66,17.67,1.12,0.06,0.11,0.96,0.0,0.07,115,110,109,73,112,111,NIFTY IT - TRI,Axis NIFTY IT ETF,13.05,2.43,4.12,0.85,16.78,54.35,129
Union Gilt Fund-Reg(G),2022-08-08,46221,2.32,1.69,3.03,0.26,3.2,14.92,0.15,0.11,0.19,0.26,0.01,0.06,27,29,28,28,19,29,CRISIL Dynamic Gilt Index,Union Gilt Fund-Reg(G),1.98,2.2,4.08,0.22,3.38,20.1,35
LIC MF Focused 30 Equity Fund-Reg(G),2017-11-17,32627,9.99,1.97,3.0,0.81,4.69,24.24,0.63,0.12,0.19,0.81,0.02,0.1,16,35,35,3,34,34,NIFTY 500 - TRI,LIC MF Focused 30 Equity Fund-Reg(G),10.38,2.81,4.68,0.9,12.74,32.6,36
Groww Nifty Total Market Index Fund-Reg(G),2023-10-23,48247,,,,,,,,,,,,,,,,,,,Nifty Total Market - TRI,Groww Nifty Total Market Index Fund-Reg(G),12.53,2.87,4.64,0.89,20.19,42.06,91
HDFC NIFTY Midcap 150 Index Fund-Reg(G),2023-04-21,46619,13.25,3.4,5.01,0.82,29.89,54.76,0.83,0.21,0.32,0.82,0.12,0.22,51,35,37,13,39,41,Nifty Midcap 150 - TRI,HDFC NIFTY Midcap 150 Index Fund-Reg(G),12.53,2.87,4.64,0.89,20.19,42.06,91
Mirae Asset Nifty India Manufacturing ETF,2022-01-27,45869,11.72,4.17,6.99,0.82,34.9,59.55,0.74,0.26,0.44,0.82,0.14,0.24,59,1,4,36,23,21,Nifty India Manufacturing - TRI,Mirae Asset Nifty India Manufacturing ETF,13.05,2.43,4.12,0.85,16.78,54.35,129
JM Short Duration Fund-Reg(G),2022-08-29,46751,0.66,4.69,9.7,0.07,2.92,47.17,0.04,0.3,0.61,0.07,0.01,0.19,5,19,14,9,23,17,CRISIL Short Duration Debt Index,JM Short Duration Fund-Reg(G),0.72,5.12,10.05,0.07,3.39,287.7,26
Aditya Birla SL CRISIL IBX SDL Jun 2032 Index Fund-Reg(G),2023-02-14,47592,1.97,1.94,3.89,0.14,3.43,26.89,0.12,0.12,0.24,0.14,0.01,0.11,4,4,2,5,3,4,CRISIL IBX SDL Index - June 2032,Aditya Birla SL CRISIL IBX SDL Jun 2032 Index Fund-Reg(G),2.65,1.57,2.85,0.5,3.18,16.47,19
LIC MF Gold ETF,2011-11-09,15131,11.37,1.38,2.46,0.29,15.02,54.33,0.72,0.09,0.15,0.29,0.06,0.22,12,9,10,8,12,7,Gold-India,LIC MF Gold ETF,15.05,1.28,2.32,0.67,16.56,41.09,21
ICICI Pru Nifty50 Value 20 ETF,2016-06-17,33839,11.43,2.54,4.74,0.92,13.48,31.63,0.72,0.16,0.3,0.92,0.05,0.13,55,68,56,64,70,71,Nifty50 Value 20 - TRI,ICICI Pru Nifty50 Value 20 ETF,13.05,2.43,4.12,0.85,16.78,54.35,129
HSBC Global Equity Climate Change FoF-Reg(G),2021-03-22,45333,15.32,0.63,1.16,0.6,8.22,16.3,0.97,0.04,0.07,0.6,0.03,0.06,27,41,40,46,41,41,MSCI AC World Index,HSBC Global Equity Climate Change FoF-Reg(G),15.56,1.15,2.06,0.46,15.97,64.47,56
ICICI Pru Nifty Infrastructure ETF,2022-08-17,45998,13.2,3.69,6.28,1.03,31.27,47.45,0.83,0.23,0.4,1.03,0.12,0.19,82,7,6,111,34,47,Nifty Infrastructure - TRI,ICICI Pru Nifty Infrastructure ETF,13.05,2.43,4.12,0.85,16.78,54.35,129
SBI FMP-52-1848D-Reg(G),2021-09-28,45915,0.6,3.02,6.0,0.04,1.74,41.88,0.04,0.19,0.38,0.04,0.01,0.17,34,66,67,41,60,46,CRISIL Medium to Long Term Debt Index,SBI FMP-52-1848D-Reg(G),0.74,5.42,11.05,0.05,3.0,-245.9,92
Bank of India Balanced Advantage Fund-Reg(G),2014-03-14,21917,8.44,2.58,4.3,0.2,21.29,111.41,0.53,0.16,0.27,0.2,0.08,0.44,24,24,23,15,7,13,NIFTY 50 Hybrid Composite Debt 50:50 Index,Bank of India Balanced Advantage Fund-Reg(G),6.63,3.2,5.31,0.18,20.36,115.89,26
Taurus Mid Cap Fund-Reg(G),1994-09-05,3306,15.94,2.65,3.81,0.9,25.6,46.8,1.0,0.17,0.24,0.9,0.1,0.19,30,29,29,29,21,28,Nifty Midcap 150 - TRI,Taurus Mid Cap Fund-Reg(G),12.33,3.4,5.29,0.75,28.22,55.85,30
ICICI Pru Retirement Fund-Pure Debt Plan(G),2019-02-27,25670,0.86,4.22,8.31,0.08,3.4,45.13,0.05,0.27,0.52,0.08,0.01,0.18,1,1,1,4,37,35,NIFTY Composite Debt Index,ICICI Pru Retirement Fund-Pure Debt Plan(G),6.98,3.08,5.19,0.22,20.51,117.64,38
Nippon India ETF Nifty 50 Value 20,2015-06-18,31920,11.41,2.54,4.73,0.92,13.38,31.55,0.72,0.16,0.3,0.92,0.05,0.13,54,69,59,62,71,72,Nifty50 Value 20 - TRI,Nippon India ETF Nifty 50 Value 20,13.05,2.43,4.12,0.85,16.78,54.35,129
Union Retirement Fund-Reg(G),2022-09-22,45735,10.24,3.15,4.93,0.21,31.7,151.78,0.65,0.2,0.31,0.21,0.13,0.6,32,18,23,19,5,8,S&P BSE 500 - TRI,Union Retirement Fund-Reg(G),6.98,3.08,5.19,0.22,20.51,117.64,38
Kotak FMP-329-90D(G),2024-03-21,48720,,,,,,,,,,,,,,,,,,,Nifty Liquid Fund Index,Kotak FMP-329-90D(G),0.74,5.42,11.05,0.05,3.0,-245.9,92
Baroda BNP Paribas NIFTY SDL Dec 2026 Index Fund-Reg(G),2023-01-25,47387,0.91,4.25,8.84,0.04,3.73,91.17,0.06,0.27,0.56,0.04,0.01,0.36,10,10,9,4,7,3,NIFTY SDL December 2026 Index,Baroda BNP Paribas NIFTY SDL Dec 2026 Index Fund-Reg(G),1.31,3.18,6.27,0.13,3.32,30.82,52
ICICI Pru FMP-88-1226D-F(G),2022-12-08,47232,0.93,4.09,8.48,0.08,3.55,44.73,0.06,0.26,0.53,0.08,0.01,0.18,72,50,46,66,45,34,CRISIL Medium Duration Debt Index,ICICI Pru FMP-88-1226D-F(G),0.74,5.42,11.05,0.05,3.0,-245.9,92
Bandhan Nifty 100 Index Fund-Reg(G),2022-02-24,46119,10.18,2.61,4.4,0.96,8.9,27.75,0.64,0.16,0.28,0.96,0.04,0.11,25,59,54,60,61,61,NIFTY 100 - TRI,Bandhan Nifty 100 Index Fund-Reg(G),12.53,2.87,4.64,0.89,20.19,42.06,91
Kotak Nifty Alpha 50 ETF,2021-12-22,45687,17.76,3.55,5.42,0.99,46.02,63.35,1.12,0.22,0.34,0.99,0.18,0.25,114,21,35,103,4,15,Nifty Alpha 50 - TRI,Kotak Nifty Alpha 50 ETF,13.05,2.43,4.12,0.85,16.78,54.35,129
Invesco India Banking and PSU Fund(G),2012-12-29,17249,1.02,3.84,7.25,0.1,3.65,38.98,0.06,0.24,0.46,0.1,0.01,0.15,25,24,22,25,14,24,NIFTY Banking and PSU Debt Index,Invesco India Banking and PSU Fund(G),0.74,5.41,10.61,0.07,3.62,-186.51,26
SBI FMP-46-1850D-Reg(G),2021-07-07,45620,0.56,3.02,6.25,0.04,1.61,39.84,0.04,0.19,0.39,0.04,0.01,0.16,26,65,64,40,78,51,CRISIL Medium to Long Term Debt Index,SBI FMP-46-1850D-Reg(G),0.74,5.42,11.05,0.05,3.0,-245.9,92
Aditya Birla SL Silver ETF FOF-Reg(G),2022-02-03,46225,19.03,1.22,2.34,1.05,20.26,22.05,1.2,0.08,0.15,1.05,0.08,0.09,50,47,46,51,28,50,Silver,Aditya Birla SL Silver ETF FOF-Reg(G),7.57,3.08,5.37,0.27,19.97,112.01,53
Groww Largecap Fund-Reg(G),2012-02-10,15997,10.37,2.85,4.92,0.94,12.07,31.25,0.65,0.18,0.31,0.94,0.05,0.12,25,17,14,34,16,17,NIFTY 100 - TRI,Groww Largecap Fund-Reg(G),10.38,2.81,4.68,0.9,12.74,32.6,36
PGIM India Gilt Fund(G),2008-10-27,7012,2.31,1.83,3.59,0.25,3.53,16.78,0.15,0.12,0.23,0.25,0.01,0.07,25,21,16,22,11,19,CRISIL Dynamic Gilt Index,PGIM India Gilt Fund(G),1.98,2.2,4.08,0.22,3.38,20.1,35
Aditya Birla SL Long Duration Fund-Reg(G),2022-08-08,46711,2.61,1.59,2.9,0.28,3.4,14.72,0.16,0.1,0.18,0.28,0.01,0.06,12,10,9,9,5,7,NIFTY Long Duration Debt Index,Aditya Birla SL Long Duration Fund-Reg(G),2.65,1.57,2.85,0.5,3.18,16.47,19
Nippon India Strategic Debt Fund(G),2014-06-26,21911,0.94,3.67,6.88,0.1,3.15,33.06,0.06,0.23,0.43,0.1,0.01,0.13,15,20,21,18,24,21,CRISIL Medium Duration Debt Index,Nippon India Strategic Debt Fund(G),0.92,4.49,9.12,0.09,3.44,60.43,30
Union Equity Savings Fund-Reg(G),2018-08-09,40627,3.6,3.08,5.15,0.11,10.79,105.29,0.23,0.19,0.32,0.11,0.04,0.42,13,35,35,16,47,33,Crisil Equity Savings Index,Union Equity Savings Fund-Reg(G),5.85,3.2,5.39,0.16,19.01,135.62,53
Kotak FMP-310-1131D(G),2023-03-27,47871,0.93,4.03,8.29,0.09,3.5,43.62,0.06,0.25,0.52,0.09,0.01,0.17,73,52,51,70,47,42,NIFTY Medium Duration Debt Index,Kotak FMP-310-1131D(G),0.74,5.42,11.05,0.05,3.0,-245.9,92
Nippon India FMP-XLVI-1(G),2023-12-20,48149,,,,,,,,,,,,,,,,,,,NIFTY Ultra Short Duration Debt Index,Nippon India FMP-XLVI-1(G),0.74,5.42,11.05,0.05,3.0,-245.9,92
Axis S&P BSE Sensex ETF,2023-03-24,47768,10.17,1.86,3.22,0.99,2.04,19.03,0.64,0.12,0.2,0.99,0.01,0.08,31,99,97,100,102,104,S&P BSE SENSEX - TRI,Axis S&P BSE Sensex ETF,13.05,2.43,4.12,0.85,16.78,54.35,129
PGIM India Arbitrage Fund-Reg(G),2014-08-27,28514,0.88,4.77,9.35,0.01,4.18,445.03,0.06,0.3,0.59,0.01,0.02,1.77,9,20,21,8,22,7,Nifty 50 Arbitrage,PGIM India Arbitrage Fund-Reg(G),0.9,5.14,10.29,0.01,4.58,-58.4,24
Quantum Equity FoF-Reg(G),2009-07-20,19904,9.6,3.08,4.94,0.28,28.78,107.33,0.6,0.19,0.31,0.28,0.11,0.43,38,32,34,44,11,24,S&P BSE 200 - TRI,Quantum Equity FoF-Reg(G),7.57,3.08,5.37,0.27,19.97,112.01,53
ICICI Pru Global Stable Equity Fund(FOF)(G),2013-09-13,16718,9.76,0.52,0.9,0.5,3.63,10.16,0.62,0.03,0.06,0.5,0.01,0.04,3,42,42,38,44,45,MSCI World,ICICI Pru Global Stable Equity Fund(FOF)(G),15.56,1.15,2.06,0.46,15.97,64.47,56
Kotak Nifty SDL Jul 2026 Index Fund-Reg(G),2022-12-22,46729,0.75,5.3,12.72,0.03,3.88,125.07,0.05,0.33,0.8,0.03,0.02,0.5,4,4,2,3,2,2,Nifty SDL Jul 2026 Index,Kotak Nifty SDL Jul 2026 Index Fund-Reg(G),1.31,3.18,6.27,0.13,3.32,30.82,52
Bandhan All Seasons Bond Fund-Reg(G),2004-09-13,2850,0.8,4.64,9.17,0.09,3.48,43.02,0.05,0.29,0.58,0.09,0.01,0.17,2,4,3,9,51,45,NIFTY Medium Duration Debt Index,Bandhan All Seasons Bond Fund-Reg(G),7.57,3.08,5.37,0.27,19.97,112.01,53
DSP FMP 268-1281D-Reg(G),2022-11-24,47124,0.74,5.49,12.8,0.03,4.01,151.12,0.05,0.35,0.81,0.03,0.02,0.6,53,22,21,16,17,4,CRISIL Medium Duration Debt Index,DSP FMP 268-1281D-Reg(G),0.74,5.42,11.05,0.05,3.0,-245.9,92
Bandhan Regular Savings Fund-Reg(G),2010-02-25,8465,3.32,2.0,3.45,0.17,6.17,39.46,0.21,0.13,0.22,0.17,0.02,0.16,17,18,18,14,16,16,NIFTY AAA Short Duration Bond Index,Bandhan Regular Savings Fund-Reg(G),2.68,3.55,6.44,0.13,9.04,83.65,19
SBI FMP-78-1170D-Reg(G),2023-02-21,47638,0.46,3.62,7.23,0.04,1.59,39.89,0.03,0.23,0.46,0.04,0.01,0.16,22,58,57,39,81,50,CRISIL Medium Duration Debt Index,SBI FMP-78-1170D-Reg(G),0.74,5.42,11.05,0.05,3.0,-245.9,92
Sundaram Global Brand Fund(G),2007-08-22,3005,11.18,1.41,2.42,0.15,15.3,106.04,0.7,0.09,0.15,0.15,0.06,0.42,7,28,28,8,27,15,MSCI AC World Index,Sundaram Global Brand Fund(G),15.56,1.15,2.06,0.46,15.97,64.47,56
Quantum Gold Saving Fund-Reg(G),2011-05-19,19961,10.49,1.44,2.71,0.27,14.41,56.52,0.66,0.09,0.17,0.27,0.06,0.22,5,8,8,10,13,10,Gold-India,Quantum Gold Saving Fund-Reg(G),12.65,1.38,2.57,0.46,15.57,76.96,15
Invesco India Gold ETF,2010-03-19,8505,11.17,1.37,2.46,0.29,14.67,52.67,0.7,0.09,0.16,0.29,0.06,0.21,9,11,9,9,15,8,Gold-India,Invesco India Gold ETF,15.05,1.28,2.32,0.67,16.56,41.09,21
Kotak FMP-326-175D(G),2023-12-26,48420,,,,,,,,,,,,,,,,,,,NIFTY Ultra Short Duration Debt Index,Kotak FMP-326-175D(G),0.74,5.42,11.05,0.05,3.0,-245.9,92
Sundaram Money Market Fund-Reg(G),2018-09-26,39625,0.32,13.97,30.07,0.0,4.44,3978.48,0.02,0.88,1.89,0.0,0.02,15.79,15,14,13,18,11,11,Nifty Money Market Index,Sundaram Money Market Fund-Reg(G),0.31,14.27,29.99,0.0,4.43,-2556.91,21
Bandhan CRISIL IBX 90:10 SDL Plus Gilt - Nov 2026 Index Fund-Reg(G),2022-11-17,46213,0.81,4.81,10.49,0.05,3.78,83.99,0.05,0.3,0.66,0.05,0.02,0.33,8,7,5,6,5,5,CRISIL IBX 90:10 SDL Plus Gilt Index - November 2026,Bandhan CRISIL IBX 90:10 SDL Plus Gilt - Nov 2026 Index Fund-Reg(G),1.31,3.18,6.27,0.13,3.32,30.82,52
Bandhan Equity Savings Fund-Reg(G),2008-06-09,5300,2.11,3.65,6.67,0.06,7.53,128.19,0.13,0.23,0.42,0.06,0.03,0.51,6,16,9,7,52,13,CRISIL Liquid Debt Index,Bandhan Equity Savings Fund-Reg(G),5.85,3.2,5.39,0.16,19.01,135.62,53
PGIM India Dynamic Bond Fund(G),2012-01-12,15247,1.85,2.16,4.47,0.19,3.48,21.19,0.12,0.14,0.28,0.19,0.01,0.08,16,15,7,14,13,16,CRISIL Dynamic Bond Index,PGIM India Dynamic Bond Fund(G),1.71,2.86,5.38,0.17,3.45,198.99,22
WOC Pharma and Healthcare Fund-Reg(G),2024-02-06,48472,,,,,,,,,,,,,,,,,,,S&P BSE Health Care - TRI,WOC Pharma and Healthcare Fund-Reg(G),11.49,3.67,6.64,0.47,33.72,92.93,11
SBI FMP-50-1843D-Reg(G),2021-09-07,45842,0.6,2.81,5.54,0.06,1.61,29.23,0.04,0.18,0.35,0.06,0.01,0.12,35,71,71,49,76,64,CRISIL Medium to Long Term Debt Index,SBI FMP-50-1843D-Reg(G),0.74,5.42,11.05,0.05,3.0,-245.9,92
DSP Silver ETF,2022-08-19,46354,20.68,0.96,1.68,1.17,17.31,17.01,1.3,0.06,0.11,1.17,0.07,0.07,14,16,17,21,7,20,Silver,DSP Silver ETF,15.05,1.28,2.32,0.67,16.56,41.09,21
Edelweiss Emerging Markets Opp Eq. Offshore Fund-Reg(G),2014-07-07,20281,13.62,0.7,1.26,0.42,8.24,22.88,0.86,0.04,0.08,0.42,0.03,0.09,19,39,39,32,40,38,MSCI Emerging Market Index,Edelweiss Emerging Markets Opp Eq. Offshore Fund-Reg(G),15.56,1.15,2.06,0.46,15.97,64.47,56
Union Dynamic Bond(G),2012-02-13,16032,2.19,1.53,2.69,0.25,2.65,13.1,0.14,0.1,0.17,0.25,0.01,0.05,19,20,21,21,20,20,CRISIL Dynamic Bond Index,Union Dynamic Bond(G),1.71,2.86,5.38,0.17,3.45,198.99,22
Mirae Asset Nifty 100 ESG Sector Leaders FoF-Reg(G),2020-11-18,45135,10.34,2.33,4.07,0.34,23.16,71.42,0.65,0.15,0.26,0.34,0.09,0.28,43,42,42,46,19,38,Nifty100 ESG Sector Leaders - TRI,Mirae Asset Nifty 100 ESG Sector Leaders FoF-Reg(G),7.57,3.08,5.37,0.27,19.97,112.01,53
Bajaj Finserv Banking and PSU Fund-Reg(G),2023-11-13,48214,,,,,,,,,,,,,,,,,,,NIFTY Banking and PSU Debt Index,Bajaj Finserv Banking and PSU Fund-Reg(G),0.74,5.41,10.61,0.07,3.62,-186.51,26
SBI FMP-92-91D-Reg(G),2024-02-06,48470,,,,,,,,,,,,,,,,,,,CRISIL Liquid Debt Index,SBI FMP-92-91D-Reg(G),0.74,5.42,11.05,0.05,3.0,-245.9,92
ICICI Pru India Equity (FOF)(G),2020-02-25,44626,9.57,4.09,6.76,0.22,38.51,181.21,0.6,0.26,0.43,0.22,0.15,0.72,37,7,13,37,5,7,S&P BSE 500 - TRI,ICICI Pru India Equity (FOF)(G),7.57,3.08,5.37,0.27,19.97,112.01,53
SBI FMP-43-1616D-Reg(G),2021-04-29,45525,0.42,4.35,8.41,0.04,1.76,47.33,0.03,0.27,0.53,0.04,0.01,0.19,19,36,50,35,59,27,CRISIL Medium Duration Debt Index,SBI FMP-43-1616D-Reg(G),0.74,5.42,11.05,0.05,3.0,-245.9,92
Tata Nifty G-Sec Dec 2026 Index Fund-Reg(G),2023-01-16,47436,0.95,3.68,7.46,0.09,3.23,37.02,0.06,0.23,0.47,0.09,0.01,0.15,17,19,17,15,23,15,Nifty G-sec Dec 2026 Index,Tata Nifty G-Sec Dec 2026 Index Fund-Reg(G),0.92,4.49,9.12,0.09,3.44,60.43,30
LIC MF Long Term Value Fund-Reg(G),2018-08-20,39956,10.78,2.8,4.49,0.91,13.46,33.26,0.68,0.18,0.28,0.91,0.05,0.13,8,21,20,15,21,21,NIFTY 500 - TRI,LIC MF Long Term Value Fund-Reg(G),11.51,3.42,5.51,0.88,23.32,45.03,21
HSBC Nifty Next 50 Index Fund-Reg(G),2020-04-15,33548,13.96,3.66,5.85,0.88,34.98,58.41,0.88,0.23,0.37,0.88,0.14,0.23,63,13,18,36,20,19,NIFTY NEXT 50 - TRI,HSBC Nifty Next 50 Index Fund-Reg(G),12.53,2.87,4.64,0.89,20.19,42.06,91
SBI Magnum Childrens Benefit Fund-Savings Plan,2002-01-28,2748,3.39,4.19,8.22,0.05,14.06,282.74,0.21,0.26,0.52,0.05,0.06,1.12,7,3,2,1,26,2,NIFTY 50 Hybrid Composite Debt 15:85 Index,SBI Magnum Childrens Benefit Fund-Savings Plan,6.98,3.08,5.19,0.22,20.51,117.64,38
Nippon India Nifty G-Sec Oct 2028 Maturity Index Fund-Reg(G),2023-03-06,47629,1.42,2.59,4.63,0.16,3.25,23.03,0.09,0.16,0.29,0.16,0.01,0.09,34,34,35,37,35,34,Nifty G-Sec Oct 2028 Index,Nippon India Nifty G-Sec Oct 2028 Maturity Index Fund-Reg(G),1.31,3.18,6.27,0.13,3.32,30.82,52
Canara Rob Dynamic Bond Fund-Reg(G),2009-05-29,7792,2.15,1.37,2.37,0.23,2.32,12.85,0.14,0.09,0.15,0.23,0.01,0.05,18,22,22,20,21,22,CRISIL Dynamic Bond Index,Canara Rob Dynamic Bond Fund-Reg(G),1.71,2.86,5.38,0.17,3.45,198.99,22
Tata Gold ETF,2024-01-12,48435,,,,,,,,,,,,,,,,,,,Gold-India,Tata Gold ETF,15.05,1.28,2.32,0.67,16.56,41.09,21
HSBC Conservative Hybrid Fund(G),2004-02-24,1458,3.34,3.68,6.55,0.2,11.74,61.77,0.21,0.23,0.41,0.2,0.05,0.25,18,10,9,18,4,14,NIFTY 50 Hybrid Composite Debt 15:85 Index,HSBC Conservative Hybrid Fund(G),2.68,3.55,6.44,0.13,9.04,83.65,19
Kotak Nifty 100 Low Volatility 30 ETF,2022-03-23,45688,9.51,2.99,5.02,0.76,15.45,37.35,0.6,0.19,0.32,0.76,0.06,0.15,4,48,46,28,58,58,Nifty100 Low Volatility 30 - TRI,Kotak Nifty 100 Low Volatility 30 ETF,13.05,2.43,4.12,0.85,16.78,54.35,129
ICICI Pru S&P BSE 500 ETF FOF-Reg(G),2021-12-01,45726,10.14,2.99,4.95,0.36,29.36,84.67,0.64,0.19,0.31,0.36,0.12,0.34,42,36,33,47,9,34,S&P BSE 500 - TRI,ICICI Pru S&P BSE 500 ETF FOF-Reg(G),7.57,3.08,5.37,0.27,19.97,112.01,53
WOC Balanced Hybrid Fund-Reg(G),2023-10-27,48213,,,,,,,,,,,,,,,,,,,CRISIL Hybrid 50+50 - Moderate Index,WOC Balanced Hybrid Fund-Reg(G),6.63,3.2,5.31,0.18,20.36,115.89,26
Canara Rob Gilt Fund-Reg(G),1999-12-29,538,2.23,1.7,3.07,0.24,3.15,15.95,0.14,0.11,0.19,0.24,0.01,0.06,18,27,27,18,22,24,CRISIL Dynamic Gilt Index,Canara Rob Gilt Fund-Reg(G),1.98,2.2,4.08,0.22,3.38,20.1,35
ICICI Pru Nifty Healthcare ETF,2021-05-18,45383,13.56,3.04,5.65,0.5,32.76,82.71,0.85,0.19,0.36,0.5,0.13,0.33,92,46,30,14,27,11,Nifty Healthcare Index - TRI,ICICI Pru Nifty Healthcare ETF,13.05,2.43,4.12,0.85,16.78,54.35,129
Union Medium Duration Fund-Reg(G),2020-09-14,44157,1.14,2.95,5.16,0.13,3.0,25.33,0.07,0.19,0.32,0.13,0.01,0.1,24,27,28,26,28,26,CRISIL Medium Duration Debt Index,Union Medium Duration Fund-Reg(G),0.92,4.49,9.12,0.09,3.44,60.43,30
Aditya Birla SL Retirement Fund-40-Reg(G),2019-03-11,42770,7.44,3.07,5.02,0.17,22.35,131.64,0.47,0.19,0.32,0.17,0.09,0.52,18,21,22,12,18,10,CRISIL Hybrid 35+65 - Aggressive Index,Aditya Birla SL Retirement Fund-40-Reg(G),6.98,3.08,5.19,0.22,20.51,117.64,38
Nippon India ETF Nifty Infrastructure BeES,2010-10-04,12859,13.16,3.65,6.21,1.02,30.64,46.95,0.83,0.23,0.39,1.02,0.12,0.19,81,14,9,110,35,49,Nifty Infrastructure - TRI,Nippon India ETF Nifty Infrastructure BeES,13.05,2.43,4.12,0.85,16.78,54.35,129
Nippon India FHF-XLV-4-1111D(G),2023-03-31,47822,0.94,4.09,8.44,0.09,3.6,44.3,0.06,0.26,0.53,0.09,0.01,0.18,80,51,49,75,38,39,CRISIL Medium Duration Debt Index,Nippon India FHF-XLV-4-1111D(G),0.74,5.42,11.05,0.05,3.0,-245.9,92
PGIM India Emerging Markets Equity Fund(G),2007-09-11,815,13.57,1.7,3.1,0.05,22.88,454.43,0.86,0.11,0.2,0.05,0.09,1.8,18,18,17,3,18,1,MSCI Emerging Market Index,PGIM India Emerging Markets Equity Fund(G),15.56,1.15,2.06,0.46,15.97,64.47,56
Axis NIFTY IT Index Fund-Reg(G),2023-07-14,47983,,,,,,,,,,,,,,,,,,,NIFTY IT - TRI,Axis NIFTY IT Index Fund-Reg(G),12.53,2.87,4.64,0.89,20.19,42.06,91
Mirae Asset Nifty Bank ETF,2023-07-20,47993,,,,,,,,,,,,,,,,,,,NIFTY BANK - TRI,Mirae Asset Nifty Bank ETF,13.05,2.43,4.12,0.85,16.78,54.35,129
Aditya Birla SL FMP-UR-85D-Reg(G),2023-12-20,48407,,,,,,,,,,,,,,,,,,,CRISIL Liquid Debt Index,Aditya Birla SL FMP-UR-85D-Reg(G),0.74,5.42,11.05,0.05,3.0,-245.9,92
Nippon India Nifty Bank Index Fund-Reg(G),2024-02-22,48148,,,,,,,,,,,,,,,,,,,NIFTY BANK - TRI,Nippon India Nifty Bank Index Fund-Reg(G),12.53,2.87,4.64,0.89,20.19,42.06,91
Navi Aggressive Hybrid Fund-Reg(G),2018-04-30,39479,7.3,2.67,4.34,0.16,19.05,123.18,0.46,0.17,0.27,0.16,0.08,0.49,31,47,47,29,26,19,CRISIL Hybrid 35+65 - Aggressive Index,Navi Aggressive Hybrid Fund-Reg(G),5.85,3.2,5.39,0.16,19.01,135.62,53
Mirae Asset Nifty AAA PSU Bond Plus SDL Apr 2026 50:50 Index Fund-Reg(G),2022-10-20,47038,0.59,6.7,13.81,0.04,3.83,99.74,0.04,0.42,0.87,0.04,0.02,0.4,4,4,4,2,5,1,Nifty AAA Bond Plus SDL Apr 2026 50:50 Index,Mirae Asset Nifty AAA PSU Bond Plus SDL Apr 2026 50:50 Index Fund-Reg(G),0.74,5.41,10.61,0.07,3.62,-186.51,26
ICICI Pru Nifty 5 yr Benchmark G-SEC ETF,2022-03-07,46440,1.59,2.28,4.04,0.19,3.2,19.5,0.1,0.14,0.25,0.19,0.01,0.08,37,38,39,39,39,38,Nifty 5 yr Benchmark G-Sec Index TRI,ICICI Pru Nifty 5 yr Benchmark G-SEC ETF,1.31,3.18,6.27,0.13,3.32,30.82,52
Kotak FMP-304-3119D(G),2022-12-30,47401,2.69,1.61,2.75,0.25,3.65,17.09,0.17,0.1,0.17,0.25,0.01,0.07,92,89,89,92,32,77,NIFTY Long Duration Debt Index,Kotak FMP-304-3119D(G),0.74,5.42,11.05,0.05,3.0,-245.9,92
ICICI Pru Strategic Metal and Energy Equity FoF-Reg(G),2022-02-02,46205,19.77,0.64,1.08,0.06,12.55,222.44,1.25,0.04,0.07,0.06,0.05,0.88,48,40,41,4,32,2,NYSE Arca Gold Miners Index,ICICI Pru Strategic Metal and Energy Equity FoF-Reg(G),15.56,1.15,2.06,0.46,15.97,64.47,56
Motilal Oswal Multi Asset Fund-Reg(G),2020-08-04,45017,5.91,1.74,3.07,0.16,9.85,64.51,0.37,0.11,0.19,0.16,0.04,0.26,3,13,13,4,13,13,CRISIL Short Term Bond Index,Motilal Oswal Multi Asset Fund-Reg(G),6.99,3.42,5.88,0.28,23.32,137.37,13
TRUSTMF Short Duration Fund-Reg(G),2021-08-06,45652,0.68,4.94,9.77,0.07,3.18,51.43,0.04,0.31,0.62,0.07,0.01,0.2,8,14,13,8,22,11,CRISIL Short Duration Debt Index,TRUSTMF Short Duration Fund-Reg(G),0.72,5.12,10.05,0.07,3.39,287.7,26
Edelweiss US Value Equity Offshore Fund-Reg(G),2013-08-07,21920,10.71,1.47,2.65,0.4,14.62,38.96,0.67,0.09,0.17,0.4,0.06,0.15,5,27,27,31,28,31,Russell 1000 Index,Edelweiss US Value Equity Offshore Fund-Reg(G),15.56,1.15,2.06,0.46,15.97,64.47,56
Helios Overnight Fund-Reg(G),2023-10-25,48295,,,,,,,,,,,,,,,,,,,CRISIL Liquid Overnight Index,Helios Overnight Fund-Reg(G),0.04,127.22,16.16,0.0,1.88,13338.93,32
Samco ELSS Tax Saver Fund-Reg(G),2022-12-22,46606,9.64,2.94,4.71,0.53,18.5,53.22,0.61,0.18,0.3,0.53,0.07,0.21,12,32,32,1,29,7,NIFTY 500 - TRI,Samco ELSS Tax Saver Fund-Reg(G),10.76,2.99,4.81,0.81,17.33,40.7,59
Nippon India Nifty IT Index Fund-Reg(G),2024-02-22,48568,,,,,,,,,,,,,,,,,,,NIFTY IT - TRI,Nippon India Nifty IT Index Fund-Reg(G),12.53,2.87,4.64,0.89,20.19,42.06,91
PGIM India Corp Bond Fund(G),2003-01-30,854,0.7,4.83,9.8,0.07,3.2,50.58,0.04,0.3,0.62,0.07,0.01,0.2,8,16,12,7,19,13,CRISIL Composite Bond Index,PGIM India Corp Bond Fund(G),0.74,5.41,10.34,0.07,3.7,65.9,21
ICICI Pru Nifty LargeMidcap 250 Index Fund-Reg(G),2024-03-13,48643,,,,,,,,,,,,,,,,,,,NIFTY LargeMidcap 250 - TRI,ICICI Pru Nifty LargeMidcap 250 Index Fund-Reg(G),12.53,2.87,4.64,0.89,20.19,42.06,91
UTI Gold ETF FoF-Reg(G),2022-10-28,47003,10.36,1.56,2.99,0.25,15.47,64.21,0.65,0.1,0.19,0.25,0.06,0.25,4,3,3,8,8,8,Gold-India,UTI Gold ETF FoF-Reg(G),12.65,1.38,2.57,0.46,15.57,76.96,15
Mirae Asset Nifty Smallcap 250 Momentum Quality 100 ETF FoF-Reg(G),2024-03-01,48497,,,,,,,,,,,,,,,,,,,Nifty Smallcap250 Momentum Quality 100 - TRI,Mirae Asset Nifty Smallcap 250 Momentum Quality 100 ETF FoF-Reg(G),7.57,3.08,5.37,0.27,19.97,112.01,53
JM Focused Fund-Reg(G),2008-03-05,4282,12.55,3.37,5.25,0.88,26.11,48.08,0.79,0.21,0.33,0.88,0.1,0.19,34,4,6,12,2,2,S&P BSE 500 - TRI,JM Focused Fund-Reg(G),10.38,2.81,4.68,0.9,12.74,32.6,36
Quantum Dynamic Bond Fund-Reg(G),2015-05-19,37428,2.26,2.37,4.17,0.21,4.79,25.1,0.14,0.15,0.26,0.21,0.02,0.1,20,8,13,18,1,8,CRISIL Dynamic Bond Index,Quantum Dynamic Bond Fund-Reg(G),1.71,2.86,5.38,0.17,3.45,198.99,22
Axis Silver ETF,2022-09-21,46369,25.01,0.85,1.42,1.16,18.7,18.37,1.58,0.05,0.09,1.16,0.07,0.07,20,21,21,19,4,18,Silver,Axis Silver ETF,15.05,1.28,2.32,0.67,16.56,41.09,21
TRUSTMF Money Market Fund-Reg(G),2022-08-17,46735,0.3,14.54,30.33,0.0,4.33,3458.04,0.02,0.92,1.91,0.0,0.02,13.72,4,10,11,19,14,14,CRISIL Money Market Index,TRUSTMF Money Market Fund-Reg(G),0.31,14.27,29.99,0.0,4.43,-2556.91,21
Aditya Birla SL Nifty Next 50 Index Fund-Reg(G),2022-02-18,46360,13.95,3.65,5.85,0.88,34.83,58.21,0.88,0.23,0.37,0.88,0.14,0.23,61,17,22,39,24,24,NIFTY NEXT 50 - TRI,Aditya Birla SL Nifty Next 50 Index Fund-Reg(G),12.53,2.87,4.64,0.89,20.19,42.06,91
Kotak Global Emerging Mkt Fund(G),2007-09-26,2047,11.82,1.16,2.08,0.17,13.18,78.5,0.74,0.07,0.13,0.17,0.05,0.31,8,31,31,10,30,18,MSCI Emerging Market Index,Kotak Global Emerging Mkt Fund(G),15.56,1.15,2.06,0.46,15.97,64.47,56
Edelweiss CRISIL IBX 50:50 Gilt Plus SDL June 2027 Index Fund-Reg(G),2022-10-18,46999,0.99,3.65,6.83,0.11,3.3,32.38,0.06,0.23,0.43,0.11,0.01,0.13,14,16,20,25,34,24,CRISIL IBX 50:50 Gilt Plus SDL Index - June 2027,Edelweiss CRISIL IBX 50:50 Gilt Plus SDL June 2027 Index Fund-Reg(G),1.31,3.18,6.27,0.13,3.32,30.82,52
Aditya Birla SL CRISIL IBX Gilt April 2033 Index Fund-Reg(G),2023-12-22,48411,,,,,,,,,,,,,,,,,,,CRISIL IBX Gilt Index - April 2033,Aditya Birla SL CRISIL IBX Gilt April 2033 Index Fund-Reg(G),2.65,1.57,2.85,0.5,3.18,16.47,19
PGIM India Equity Savings Fund(G),2004-02-05,845,1.76,3.4,6.25,0.07,5.8,80.84,0.11,0.21,0.39,0.07,0.02,0.32,3,23,15,8,53,49,NIFTY 50 Equity Savings Index,PGIM India Equity Savings Fund(G),5.85,3.2,5.39,0.16,19.01,135.62,53
Shriram Flexi Cap Fund-Reg(G),2018-09-28,38781,12.65,3.02,4.8,0.89,21.8,42.89,0.8,0.19,0.3,0.89,0.09,0.17,36,20,22,29,9,12,NIFTY 500 - TRI,Shriram Flexi Cap Fund-Reg(G),10.67,3.04,4.92,0.83,17.02,38.61,41
