MF Code,incept_date,schemecode,sdx_returns,sharpex_returns,sotinox_returns,betax_returns,alphax_returns,treynorx_returns,sdy_returns,sharpey_returns,sotinoy_returns,betay_returns,alphay_returns,treynory_returns,rank_sd,rank_sharpe,rank_sotino,rank_beta,rank_alpha,rank_treynor,index_name,s_name,avg_std_dev,avg_sharpe,avg_sotino,avg_beta,avg_alpha,avg_treyno,no_of_funds_total
SBI Nifty 50 ETF,2015-07-22,33369,13.32,1.59,2.47,0.99,4.79,21.39,0.84,0.1,0.16,0.99,0.02,0.08,33,90,99,64,97,96,NIFTY 50 - TRI,SBI Nifty 50 ETF,16.29,1.83,2.98,1.08,13.44,15.21,136
SBI BSE Sensex ETF,2013-03-15,20447,13.26,1.39,2.18,0.99,2.04,18.6,0.84,0.09,0.14,0.99,0.01,0.07,25,100,108,74,110,109,BSE SENSEX - TRI,SBI BSE Sensex ETF,16.29,1.83,2.98,1.08,13.44,15.21,136
HDFC Balanced Advantage Fund(G),2000-09-11,1273,11.04,2.38,3.26,1.97,20.56,13.31,0.7,0.15,0.21,1.97,0.08,0.05,23,8,15,24,2,12,NIFTY 50 Hybrid Composite Debt 50:50 Index,HDFC Balanced Advantage Fund(G),8.7,2.16,3.2,1.49,14.18,13.05,27
Parag Parikh Flexi Cap Fund-Reg(G),2013-05-28,21520,10.98,2.55,3.94,0.7,15.27,40.19,0.69,0.16,0.25,0.7,0.06,0.16,1,10,8,1,17,9,NIFTY 500 - TRI,Parag Parikh Flexi Cap Fund-Reg(G),14.39,2.16,3.2,0.94,13.96,33.2,45
HDFC Mid-Cap Opportunities Fund(G),2007-06-25,1305,15.54,2.36,3.49,0.9,20.24,40.67,0.98,0.15,0.22,0.9,0.08,0.16,16,18,17,16,19,18,Nifty Midcap 150 - TRI,HDFC Mid-Cap Opportunities Fund(G),16.0,2.36,3.53,0.91,21.06,41.37,30
SBI Liquid Fund-Reg(G),2007-03-11,2828,0.07,9.85,5.06,0.0,0.68,-1530.9,0.0,0.62,0.32,0.0,0.0,-6.08,17,28,34,22,35,26,Nifty Liquid Fund Index,SBI Liquid Fund-Reg(G),0.09,10.4,6.88,0.0,0.89,-1539.37,37
HDFC Liquid Fund(G),2000-10-17,1286,0.07,10.06,5.31,0.0,0.73,-575.52,0.0,0.63,0.33,0.0,0.0,-2.28,21,23,23,8,22,10,CRISIL Liquid Debt Index,HDFC Liquid Fund(G),0.09,10.4,6.88,0.0,0.89,-1539.37,37
ICICI Pru Bluechip Fund(G),2008-05-23,4980,12.76,2.28,3.49,0.91,12.5,31.95,0.8,0.14,0.22,0.91,0.05,0.13,10,4,5,13,10,10,NIFTY 100 - TRI,ICICI Pru Bluechip Fund(G),13.81,1.99,3.03,0.94,10.16,29.09,36
HDFC Flexi Cap Fund(G),1995-01-01,1131,11.86,2.69,4.17,0.83,16.86,38.63,0.75,0.17,0.26,0.83,0.07,0.15,3,5,5,6,14,11,NIFTY 500 - TRI,HDFC Flexi Cap Fund(G),14.39,2.16,3.2,0.94,13.96,33.2,45
ICICI Pru Balanced Advantage Fund(G),2006-12-30,1470,5.56,2.99,4.94,0.9,14.04,18.55,0.35,0.19,0.31,0.9,0.06,0.07,1,1,1,1,11,2,CRISIL Hybrid 50+50 - Moderate Index,ICICI Pru Balanced Advantage Fund(G),8.7,2.16,3.2,1.49,14.18,13.05,27
UTI Nifty 50 ETF,2015-09-01,33150,13.37,1.6,2.48,0.99,4.84,21.6,0.84,0.1,0.16,0.99,0.02,0.09,38,82,90,61,94,90,NIFTY 50 - TRI,UTI Nifty 50 ETF,16.29,1.83,2.98,1.08,13.44,15.21,136
Kotak Equity Arbitrage Fund(G),2005-09-29,1979,1.01,3.71,7.98,-0.13,4.11,-29.56,0.06,0.23,0.5,-0.13,0.02,-0.12,17,1,4,19,1,25,Nifty 50 Arbitrage,Kotak Equity Arbitrage Fund(G),1.0,3.27,7.05,-0.14,3.65,-24.08,25
Kotak Flexicap Fund(G),2009-09-11,7874,15.11,1.81,2.59,1.03,8.42,26.49,0.95,0.11,0.16,1.03,0.03,0.11,30,37,39,37,35,39,NIFTY 500 - TRI,Kotak Flexicap Fund(G),14.39,2.16,3.2,0.94,13.96,33.2,45
Aditya Birla SL Liquid Fund(G),2004-03-30,293,0.07,10.19,5.36,0.0,0.73,-2412.8,0.0,0.64,0.34,0.0,0.0,-9.57,23,21,20,24,21,30,Nifty Liquid Fund Index,Aditya Birla SL Liquid Fund(G),0.09,10.4,6.88,0.0,0.89,-1539.37,37
SBI BlueChip Fund-Reg(G),2006-01-20,2711,11.63,1.83,2.87,0.83,6.3,25.6,0.73,0.12,0.18,0.83,0.02,0.1,1,28,23,3,32,29,BSE 100 - TRI,SBI BlueChip Fund-Reg(G),13.81,1.99,3.03,0.94,10.16,29.09,36
ICICI Pru Liquid Fund(G),2005-11-17,1659,0.08,9.75,5.38,0.0,0.73,-833.69,0.0,0.61,0.34,0.0,0.0,-3.31,27,31,16,10,24,16,CRISIL Liquid Debt Index,ICICI Pru Liquid Fund(G),0.09,10.4,6.88,0.0,0.89,-1539.37,37
ICICI Pru Value Discovery Fund(G),2004-08-16,1492,11.27,2.84,4.37,0.8,17.44,40.09,0.71,0.18,0.28,0.8,0.07,0.16,2,2,2,2,11,4,NIFTY 500 - TRI,ICICI Pru Value Discovery Fund(G),15.31,2.33,3.44,0.98,17.49,36.33,22
ICICI Pru Multi-Asset Fund(G),2002-10-31,1495,7.57,3.03,4.79,1.17,19.61,19.68,0.48,0.19,0.3,1.17,0.08,0.08,4,3,3,6,6,3,NIFTY 200 - TRI,ICICI Pru Multi-Asset Fund(G),8.87,2.36,3.6,1.29,17.0,4.58,15
UTI BSE Sensex ETF,2015-09-01,33151,13.31,1.4,2.19,0.99,2.04,18.8,0.84,0.09,0.14,0.99,0.01,0.07,30,96,105,73,111,105,BSE SENSEX - TRI,UTI BSE Sensex ETF,16.29,1.83,2.98,1.08,13.44,15.21,136
CPSE ETF,2014-03-28,27621,28.66,2.31,3.3,3.66,57.41,18.09,1.81,0.15,0.21,3.66,0.23,0.07,131,40,48,136,1,113,Nifty CPSE,CPSE ETF,16.29,1.83,2.98,1.08,13.44,15.21,136
Mirae Asset Large & Midcap Fund-Reg(G),2010-07-09,9767,14.46,1.89,2.72,0.97,9.65,28.22,0.91,0.12,0.17,0.97,0.04,0.11,9,22,21,14,21,22,NIFTY LargeMidcap 250 - TRI,Mirae Asset Large & Midcap Fund-Reg(G),14.92,2.24,3.29,0.89,16.03,35.36,26
ICICI Pru Equity & Debt Fund(G),1999-11-03,1482,10.21,2.67,3.99,1.64,22.53,16.68,0.64,0.17,0.25,1.64,0.09,0.07,37,10,12,35,4,13,CRISIL Hybrid 35+65 - Aggressive Index,ICICI Pru Equity & Debt Fund(G),7.75,2.24,3.41,1.24,14.36,14.98,52
SBI Contra Fund-Reg(G),1999-07-14,2809,13.94,2.31,3.29,0.91,15.9,35.58,0.88,0.15,0.21,0.91,0.06,0.14,6,12,12,4,13,13,BSE 500 - TRI,SBI Contra Fund-Reg(G),15.31,2.33,3.44,0.98,17.49,36.33,22
Axis ELSS Tax Saver Fund-Reg(G),2009-12-29,8408,12.38,2.2,3.58,0.8,12.83,34.25,0.78,0.14,0.23,0.8,0.05,0.14,8,24,14,7,35,33,NIFTY 500 - TRI,Axis ELSS Tax Saver Fund-Reg(G),14.34,2.1,3.13,0.91,13.54,33.36,59
Nippon India Multi Cap Fund(G),2005-03-28,2466,14.56,2.32,3.34,0.91,17.16,37.04,0.92,0.15,0.21,0.91,0.07,0.15,19,13,17,17,13,13,Nifty500 Multicap 50:25:25 - TRI,Nippon India Multi Cap Fund(G),14.46,2.19,3.24,0.87,14.86,34.59,34
SBI Focused Equity Fund-Reg(G),2004-10-11,2817,11.19,1.82,2.82,0.69,7.89,29.51,0.7,0.11,0.18,0.69,0.03,0.12,2,30,28,1,31,30,BSE 500 - TRI,SBI Focused Equity Fund-Reg(G),14.46,2.19,3.24,0.87,14.86,34.59,34
Axis Bluechip Fund-Reg(G),2010-01-05,8250,12.45,1.94,3.1,0.89,8.01,27.14,0.78,0.12,0.2,0.89,0.03,0.11,7,21,13,9,26,23,BSE 100 - TRI,Axis Bluechip Fund-Reg(G),13.81,1.99,3.03,0.94,10.16,29.09,36
HDFC Small Cap Fund-Reg(G),2008-04-03,4455,15.29,1.9,2.74,0.8,14.52,36.44,0.96,0.12,0.17,0.8,0.06,0.14,7,22,22,8,21,21,BSE 250 Small Cap - TRI,HDFC Small Cap Fund-Reg(G),15.94,2.25,3.27,0.83,20.93,43.49,24
Nippon India Growth Fund(G),1995-10-08,2573,16.52,2.43,3.56,0.96,22.65,41.76,1.04,0.15,0.22,0.96,0.09,0.17,21,13,13,22,13,16,Nifty Midcap 150 - TRI,Nippon India Growth Fund(G),16.0,2.36,3.53,0.91,21.06,41.37,30
Kotak Liquid Fund-Reg(G),2003-11-04,2060,0.16,10.05,13.22,0.0,1.64,-982.45,0.01,0.63,0.83,0.0,0.01,-3.9,37,24,3,2,2,20,Nifty Liquid Fund Index,Kotak Liquid Fund-Reg(G),0.09,10.4,6.88,0.0,0.89,-1539.37,37
Nippon India Large Cap Fund(G),2007-08-08,2455,14.04,1.98,2.88,0.99,9.75,28.07,0.88,0.12,0.18,0.99,0.04,0.11,22,15,22,27,18,18,BSE 100 - TRI,Nippon India Large Cap Fund(G),13.81,1.99,3.03,0.94,10.16,29.09,36
Nippon India ETF Nifty 50 BeES,2001-12-28,2272,13.37,1.6,2.48,0.99,4.84,21.62,0.84,0.1,0.16,0.99,0.02,0.09,37,79,87,58,92,85,NIFTY 50 - TRI,Nippon India ETF Nifty 50 BeES,16.29,1.83,2.98,1.08,13.44,15.21,136
Nippon India Liquid Fund(G),2003-12-09,2637,0.07,9.88,5.24,0.0,0.71,-2910.2,0.0,0.62,0.33,0.0,0.0,-11.55,25,27,27,27,31,31,Nifty Liquid Fund Index,Nippon India Liquid Fund(G),0.09,10.4,6.88,0.0,0.89,-1539.37,37
SBI Balanced Advantage Fund-Reg(G),2021-08-31,32097,6.29,2.56,3.8,1.12,12.9,14.41,0.4,0.16,0.24,1.12,0.05,0.06,3,4,4,6,16,7,NIFTY 50 Hybrid Composite Debt 50:50 Index,SBI Balanced Advantage Fund-Reg(G),8.7,2.16,3.2,1.49,14.18,13.05,27
SBI Arbitrage Opportunities Fund-Reg(G),2006-11-03,2709,1.01,3.35,7.28,-0.12,3.73,-26.99,0.06,0.21,0.46,-0.12,0.01,-0.11,15,13,11,21,14,19,Nifty 50 Arbitrage,SBI Arbitrage Opportunities Fund-Reg(G),1.0,3.27,7.05,-0.14,3.65,-24.08,25
Aditya Birla SL Frontline Equity Fund(G),2002-08-30,447,13.19,1.96,2.99,0.96,8.47,27.09,0.83,0.12,0.19,0.96,0.03,0.11,13,20,17,17,24,24,NIFTY 100 - TRI,Aditya Birla SL Frontline Equity Fund(G),13.81,1.99,3.03,0.94,10.16,29.09,36
HDFC Corp Bond Fund(G),2010-06-29,8241,0.71,5.72,8.94,0.27,3.3,15.32,0.04,0.36,0.56,0.27,0.01,0.06,7,3,7,6,1,3,NIFTY Corporate Bond Index,HDFC Corp Bond Fund(G),0.76,4.97,8.52,0.32,2.81,12.33,21
ICICI Pru Money Market Fund(G),2006-03-08,1690,0.33,10.95,22.93,0.01,3.53,305.75,0.02,0.69,1.44,0.01,0.01,1.21,20,5,5,5,4,4,Nifty Money Market Index,ICICI Pru Money Market Fund(G),0.31,10.37,21.77,0.01,3.22,306.37,22
Axis Liquid Fund-Reg(G),2009-10-09,8029,0.07,10.26,5.57,0.0,0.76,-1029.47,0.0,0.65,0.35,0.0,0.0,-4.09,26,19,12,17,14,21,Nifty Liquid Fund Index,Axis Liquid Fund-Reg(G),0.09,10.4,6.88,0.0,0.89,-1539.37,37
HDFC Money Market Fund-Reg(G),2000-01-03,1119,0.32,11.03,22.72,0.02,3.43,228.41,0.02,0.7,1.43,0.02,0.01,0.91,9,3,10,20,9,18,CRISIL Money Market Index,HDFC Money Market Fund-Reg(G),0.31,10.37,21.77,0.01,3.22,306.37,22
Kotak Money Market Fund(G),2003-07-14,1999,0.33,10.87,23.08,0.01,3.53,268.91,0.02,0.68,1.45,0.01,0.01,1.07,21,8,2,13,5,7,CRISIL Money Market Index,Kotak Money Market Fund(G),0.31,10.37,21.77,0.01,3.22,306.37,22
SBI Large & Midcap Fund-Reg(G),1993-02-28,2801,12.57,2.09,3.1,0.84,11.16,31.35,0.79,0.13,0.2,0.84,0.04,0.12,2,17,17,4,20,18,NIFTY LargeMidcap 250 - TRI,SBI Large & Midcap Fund-Reg(G),14.92,2.24,3.29,0.89,16.03,35.36,26
SBI Long Term Equity Fund-Reg(G),1993-03-31,2815,13.86,2.84,4.21,0.9,23.11,43.65,0.87,0.18,0.27,0.9,0.09,0.17,27,4,5,28,4,5,BSE 500 - TRI,SBI Long Term Equity Fund-Reg(G),14.34,2.1,3.13,0.91,13.54,33.36,59
Aditya Birla SL Money Manager Fund(G),2005-10-13,394,0.32,11.16,22.94,0.01,3.55,249.23,0.02,0.7,1.44,0.01,0.01,0.99,15,1,4,17,1,12,CRISIL Money Market Index,Aditya Birla SL Money Manager Fund(G),0.31,10.37,21.77,0.01,3.22,306.37,22
Tata Money Market Fund-Reg(G),2003-05-22,3267,0.33,10.92,22.76,0.01,3.53,246.56,0.02,0.69,1.43,0.01,0.01,0.98,19,7,9,18,7,14,CRISIL Money Market Index,Tata Money Market Fund-Reg(G),0.31,10.37,21.77,0.01,3.22,306.37,22
ICICI Pru Corp Bond Fund(G),2009-08-11,7925,0.64,5.71,9.79,0.24,2.95,15.12,0.04,0.36,0.62,0.24,0.01,0.06,5,4,2,4,8,5,NIFTY Corporate Bond Index,ICICI Pru Corp Bond Fund(G),0.76,4.97,8.52,0.32,2.81,12.33,21
Mirae Asset ELSS Tax Saver Fund-Reg(G),2015-12-28,33536,13.78,1.97,2.87,0.95,9.78,28.53,0.87,0.12,0.18,0.95,0.04,0.11,25,37,36,41,45,45,NIFTY 500 - TRI,Mirae Asset ELSS Tax Saver Fund-Reg(G),14.34,2.1,3.13,0.91,13.54,33.36,59
Quant Small Cap Fund(G),1996-10-16,876,19.55,2.15,2.99,1.04,23.06,40.35,1.23,0.14,0.19,1.04,0.09,0.16,24,15,20,24,8,17,Nifty Smallcap 250 - TRI,Quant Small Cap Fund(G),15.94,2.25,3.27,0.83,20.93,43.49,24
Kotak Equity Opp Fund(G),2004-09-09,2069,15.16,2.16,3.11,0.98,14.84,33.47,0.96,0.14,0.2,0.98,0.06,0.13,17,16,16,19,16,16,NIFTY LargeMidcap 250 - TRI,Kotak Equity Opp Fund(G),14.92,2.24,3.29,0.89,16.03,35.36,26
Canara Rob Emerg Equities Fund-Reg(G),2005-03-11,523,13.83,2.33,3.6,0.89,15.9,36.04,0.87,0.15,0.23,0.89,0.06,0.14,8,11,8,7,13,12,NIFTY LargeMidcap 250 - TRI,Canara Rob Emerg Equities Fund-Reg(G),14.92,2.24,3.29,0.89,16.03,35.36,26
ICICI Pru Equity-Arbitrage Fund(G),2006-12-30,1467,0.97,3.51,7.58,-0.12,3.75,-27.87,0.06,0.22,0.48,-0.12,0.01,-0.11,7,7,7,23,11,23,Nifty 50 Arbitrage,ICICI Pru Equity-Arbitrage Fund(G),1.0,3.27,7.05,-0.14,3.65,-24.08,25
ICICI Pru India Opp Fund(G),2019-01-15,42140,10.84,3.01,4.83,0.73,19.28,44.6,0.68,0.19,0.3,0.73,0.08,0.18,1,3,2,6,20,7,NIFTY 500 - TRI,ICICI Pru India Opp Fund(G),15.66,2.27,3.42,0.91,17.47,37.03,52
Axis Small Cap Fund-Reg(G),2013-11-29,21651,13.75,2.22,3.37,0.74,17.21,41.48,0.87,0.14,0.21,0.74,0.07,0.16,4,11,9,4,18,13,Nifty Smallcap 250 - TRI,Axis Small Cap Fund-Reg(G),15.94,2.25,3.27,0.83,20.93,43.49,24
HDFC Large and Mid Cap Fund-Reg(G),1994-02-18,2271,14.84,2.23,3.19,0.98,15.3,33.92,0.93,0.14,0.2,0.98,0.06,0.13,13,12,15,15,14,14,NIFTY LargeMidcap 250 - TRI,HDFC Large and Mid Cap Fund-Reg(G),14.92,2.24,3.29,0.89,16.03,35.36,26
UTI Liquid Fund-Reg(G),2003-12-10,3590,0.07,10.65,5.33,0.0,0.73,-7534.17,0.0,0.67,0.34,0.0,0.0,-29.9,12,12,22,29,20,35,Nifty Liquid Fund Index,UTI Liquid Fund-Reg(G),0.09,10.4,6.88,0.0,0.89,-1539.37,37
SBI Flexicap Fund-Reg(G),2005-09-16,2799,12.44,1.79,2.63,0.85,6.83,26.03,0.78,0.11,0.17,0.85,0.03,0.1,6,41,37,10,41,40,BSE 500 - TRI,SBI Flexicap Fund-Reg(G),14.39,2.16,3.2,0.94,13.96,33.2,45
ICICI Pru Asset Allocator Fund(FOF)(G),2003-12-18,1704,4.5,3.56,6.05,0.85,13.48,18.8,0.28,0.22,0.38,0.85,0.05,0.07,13,4,4,18,29,17,CRISIL Hybrid 50+50 - Moderate Index,ICICI Pru Asset Allocator Fund(FOF)(G),9.16,2.38,3.86,1.09,15.55,21.19,53
SBI Magnum Midcap Fund-Reg(G),2005-03-29,2789,12.6,2.26,3.41,0.71,15.62,40.02,0.79,0.14,0.22,0.71,0.06,0.16,1,22,21,1,27,21,Nifty Midcap 150 - TRI,SBI Magnum Midcap Fund-Reg(G),16.0,2.36,3.53,0.91,21.06,41.37,30
Aditya Birla SL Corp Bond Fund(G),1997-03-03,453,0.94,4.52,7.7,0.44,2.97,9.68,0.06,0.28,0.49,0.44,0.01,0.04,20,17,17,21,3,19,NIFTY Corporate Bond Index,Aditya Birla SL Corp Bond Fund(G),0.76,4.97,8.52,0.32,2.81,12.33,21
Bharat 22 ETF,2017-11-24,38252,23.01,1.94,2.69,3.09,37.27,14.49,1.45,0.12,0.17,3.09,0.15,0.06,127,68,84,134,3,115,BSE Bharat 22 Index - TRI,Bharat 22 ETF,16.29,1.83,2.98,1.08,13.44,15.21,136
DSP Midcap Fund-Reg(G),2006-11-14,735,14.95,2.3,3.44,0.86,18.62,39.89,0.94,0.14,0.22,0.86,0.07,0.16,5,21,20,6,23,22,Nifty Midcap 150 - TRI,DSP Midcap Fund-Reg(G),16.0,2.36,3.53,0.91,21.06,41.37,30
Tata Liquid Fund-Reg(G),2004-09-01,3212,0.07,10.85,5.16,0.0,0.71,-1390.23,0.0,0.68,0.32,0.0,0.0,-5.52,9,10,31,21,33,25,CRISIL Liquid Debt Index,Tata Liquid Fund-Reg(G),0.09,10.4,6.88,0.0,0.89,-1539.37,37
UTI Nifty 50 Index Fund-Reg(G),2000-03-04,3641,13.41,1.58,2.45,0.99,3.18,21.45,0.84,0.1,0.15,0.99,0.01,0.09,30,69,72,49,74,73,NIFTY 50 - TRI,UTI Nifty 50 Index Fund-Reg(G),16.43,1.97,3.0,0.99,14.45,32.95,101
ICICI Pru Savings Fund(G),2002-09-27,1500,0.38,9.41,17.32,0.05,3.43,67.84,0.02,0.59,1.09,0.05,0.01,0.27,19,7,14,7,1,2,NIFTY Low Duration Debt Index,ICICI Pru Savings Fund(G),0.34,9.08,17.79,0.06,2.96,56.98,20
ICICI Pru Nifty 50 ETF,2013-03-20,20803,13.38,1.6,2.48,0.99,4.86,21.62,0.84,0.1,0.16,0.99,0.02,0.09,40,78,88,63,90,86,NIFTY 50 - TRI,ICICI Pru Nifty 50 ETF,16.29,1.83,2.98,1.08,13.44,15.21,136
BHARAT Bond ETF - April 2030,2019-12-30,44421,1.09,4.36,7.14,0.39,3.78,12.15,0.07,0.27,0.45,0.39,0.02,0.05,10,8,7,11,4,8,NIFTY BHARAT Bond Index - April 2030,BHARAT Bond ETF - April 2030,1.05,4.54,6.56,0.42,2.57,-405.22,19
DSP Liquidity Fund-Reg(G),2005-11-22,708,0.07,10.41,5.33,0.0,0.73,5706.67,0.0,0.66,0.34,0.0,0.0,22.65,15,15,21,33,19,1,CRISIL Liquid Debt Index,DSP Liquidity Fund-Reg(G),0.09,10.4,6.88,0.0,0.89,-1539.37,37
SBI Multicap Fund-Reg(G),2022-03-08,46405,12.5,2.42,3.66,0.73,17.01,41.3,0.79,0.15,0.23,0.73,0.07,0.16,4,9,8,2,14,6,Nifty500 Multicap 50:25:25 - TRI,SBI Multicap Fund-Reg(G),14.46,2.19,3.24,0.87,14.86,34.59,34
HSBC Liquid Fund(G),2004-06-01,1340,0.07,10.36,5.56,0.0,0.76,-960.22,0.0,0.65,0.35,0.0,0.0,-3.81,24,17,13,14,13,18,Nifty Liquid Fund Index,HSBC Liquid Fund(G),0.09,10.4,6.88,0.0,0.89,-1539.37,37
HDFC Index Fund-NIFTY 50 Plan(G)(Post Addendum),2002-07-17,12633,13.41,1.58,2.45,0.99,3.18,21.42,0.84,0.1,0.15,0.99,0.01,0.08,31,70,73,51,75,75,NIFTY 50 - TRI,HDFC Index Fund-NIFTY 50 Plan(G)(Post Addendum),16.43,1.97,3.0,0.99,14.45,32.95,101
Franklin India Flexi Cap Fund(G),1994-09-29,950,13.32,2.4,3.54,0.93,15.02,34.42,0.84,0.15,0.22,0.93,0.06,0.14,14,11,12,21,18,16,NIFTY 500 - TRI,Franklin India Flexi Cap Fund(G),14.39,2.16,3.2,0.94,13.96,33.2,45
Invesco India Contra Fund(G),2007-04-11,2169,15.01,2.55,3.72,1.0,20.08,38.3,0.95,0.16,0.23,1.0,0.08,0.15,12,5,6,12,7,8,BSE 500 - TRI,Invesco India Contra Fund(G),15.31,2.33,3.44,0.98,17.49,36.33,22
Kotak Small Cap Fund(G),2005-02-24,2066,13.74,2.46,3.59,0.73,20.51,46.47,0.87,0.16,0.23,0.73,0.08,0.18,3,4,3,3,11,6,Nifty Smallcap 250 - TRI,Kotak Small Cap Fund(G),15.94,2.25,3.27,0.83,20.93,43.49,24
Nippon India Money Market Fund(G),2005-06-15,2628,0.33,11.05,22.98,0.01,3.55,259.56,0.02,0.7,1.45,0.01,0.01,1.03,17,2,3,15,2,8,Nifty Money Market Index,Nippon India Money Market Fund(G),0.31,10.37,21.77,0.01,3.22,306.37,22
DSP ELSS Tax Saver Fund-Reg(G),2007-01-18,745,14.9,2.38,3.45,1.02,16.91,34.85,0.94,0.15,0.22,1.02,0.07,0.14,38,13,15,52,14,29,NIFTY 500 - TRI,DSP ELSS Tax Saver Fund-Reg(G),14.34,2.1,3.13,0.91,13.54,33.36,59
Invesco India Arbitrage Fund(G),2007-04-30,2167,1.0,3.54,7.92,-0.12,3.91,-28.45,0.06,0.22,0.5,-0.12,0.02,-0.11,13,5,5,22,5,24,Nifty 50 Arbitrage,Invesco India Arbitrage Fund(G),1.0,3.27,7.05,-0.14,3.65,-24.08,25
HDFC Multi Cap Fund-Reg(G),2021-12-10,46093,14.84,2.3,3.34,0.96,16.68,35.58,0.94,0.15,0.21,0.96,0.07,0.14,23,15,16,21,15,16,Nifty500 Multicap 50:25:25 - TRI,HDFC Multi Cap Fund-Reg(G),14.46,2.19,3.24,0.87,14.86,34.59,34
ICICI Pru Flexicap Fund(G),2021-07-19,45492,12.32,2.76,4.44,0.81,19.2,41.93,0.78,0.17,0.28,0.81,0.08,0.17,4,4,2,4,11,7,BSE 500 - TRI,ICICI Pru Flexicap Fund(G),14.39,2.16,3.2,0.94,13.96,33.2,45
Kotak Balanced Advantage Fund-Reg(G),2018-08-03,40623,6.89,2.39,3.72,1.24,12.85,13.26,0.43,0.15,0.23,1.24,0.05,0.05,7,7,6,10,17,14,NIFTY 50 Hybrid Composite Debt 50:50 Index,Kotak Balanced Advantage Fund-Reg(G),8.7,2.16,3.2,1.49,14.18,13.05,27
SBI Overnight Fund-Reg(G),2002-09-24,2787,0.01,40.72,2.31,0.0,0.3,-1321.26,0.0,2.57,0.15,0.0,0.0,-5.24,1,6,28,19,32,20,CRISIL Liquid Overnight Index,SBI Overnight Fund-Reg(G),0.04,26.72,4.08,0.0,0.48,-1478.06,34
Aditya Birla SL ELSS Tax Saver Fund(G),2008-03-10,4637,13.16,2.03,2.97,0.91,10.11,29.28,0.83,0.13,0.19,0.91,0.04,0.12,16,34,34,33,44,43,NIFTY 500 - TRI,Aditya Birla SL ELSS Tax Saver Fund(G),14.34,2.1,3.13,0.91,13.54,33.36,59
ICICI Pru Large & Mid Cap Fund(G),1998-07-09,1608,12.59,2.77,4.16,0.84,19.63,41.73,0.79,0.17,0.26,0.84,0.08,0.17,3,3,2,2,6,5,NIFTY LargeMidcap 250 - TRI,ICICI Pru Large & Mid Cap Fund(G),14.92,2.24,3.29,0.89,16.03,35.36,26
DSP Small Cap Fund-Reg(G),2007-06-14,714,15.57,2.09,3.11,0.76,18.8,43.12,0.98,0.13,0.2,0.76,0.07,0.17,12,19,15,6,13,11,BSE 250 Small Cap - TRI,DSP Small Cap Fund-Reg(G),15.94,2.25,3.27,0.83,20.93,43.49,24
Nippon India ELSS Tax Saver Fund(G),2005-09-21,2667,15.25,2.12,3.0,1.03,13.51,31.37,0.96,0.13,0.19,1.03,0.05,0.12,41,27,31,54,32,36,NIFTY 500 - TRI,Nippon India ELSS Tax Saver Fund(G),14.34,2.1,3.13,0.91,13.54,33.36,59
Kotak Bond Short Term Fund(G),2002-05-02,1971,0.79,4.45,7.83,0.35,2.47,10.03,0.05,0.28,0.49,0.35,0.01,0.04,19,20,22,21,16,22,Nifty Short Duration Debt Index,Kotak Bond Short Term Fund(G),0.71,4.61,8.37,0.29,2.33,-328.98,25
Motilal Oswal Midcap Fund-Reg(G),2014-02-24,22533,16.04,3.05,5.34,0.88,33.01,55.92,1.01,0.19,0.34,0.88,0.13,0.22,19,1,1,9,1,1,Nifty Midcap 150 - TRI,Motilal Oswal Midcap Fund-Reg(G),16.0,2.36,3.53,0.91,21.06,41.37,30
Nippon India Arbitrage Fund(G),2010-10-14,12938,0.96,3.49,7.38,-0.12,3.7,-27.44,0.06,0.22,0.47,-0.12,0.01,-0.11,5,9,9,24,15,21,Nifty 50 Arbitrage,Nippon India Arbitrage Fund(G),1.0,3.27,7.05,-0.14,3.65,-24.08,25
HDFC Arbitrage-WP(G),2007-10-23,1103,0.98,3.61,8.06,-0.13,3.88,-27.69,0.06,0.23,0.51,-0.13,0.02,-0.11,8,3,3,16,7,22,Nifty 50 Arbitrage,HDFC Arbitrage-WP(G),1.0,3.27,7.05,-0.14,3.65,-24.08,25
Axis Money Market Fund-Reg(G),2019-08-06,21218,0.33,10.92,22.92,0.01,3.53,247.36,0.02,0.69,1.44,0.01,0.01,0.98,16,6,6,16,6,13,Nifty Money Market Index,Axis Money Market Fund-Reg(G),0.31,10.37,21.77,0.01,3.22,306.37,22
UTI Money Market Fund-Reg(G),2009-07-09,7914,0.33,10.97,23.24,0.01,3.55,289.17,0.02,0.69,1.46,0.01,0.01,1.15,18,4,1,6,3,6,CRISIL Money Market Index,UTI Money Market Fund-Reg(G),0.31,10.37,21.77,0.01,3.22,306.37,22
ICICI Pru Ultra Short Term Fund Fund(G),2011-05-03,12454,0.31,10.44,22.4,0.01,3.25,457.96,0.02,0.66,1.41,0.01,0.01,1.82,21,8,4,3,4,2,NIFTY Ultra Short Duration Debt Index,ICICI Pru Ultra Short Term Fund Fund(G),0.3,9.78,20.72,0.01,2.9,255.56,24
ICICI Pru ELSS Tax Saver Fund(G),1999-08-19,1694,11.78,2.43,3.78,0.82,13.78,35.13,0.74,0.15,0.24,0.82,0.05,0.14,3,10,9,10,29,25,NIFTY 500 - TRI,ICICI Pru ELSS Tax Saver Fund(G),14.34,2.1,3.13,0.91,13.54,33.36,59
Canara Rob Bluechip Equity Fund-Reg(G),2010-08-20,8217,12.94,2.02,3.09,0.94,8.97,27.75,0.82,0.13,0.19,0.94,0.04,0.11,12,12,14,15,21,20,BSE 100 - TRI,Canara Rob Bluechip Equity Fund-Reg(G),13.81,1.99,3.03,0.94,10.16,29.09,36
HDFC Ultra Short Term Fund-Reg(G),2018-09-24,39949,0.3,10.71,22.51,0.01,3.2,259.81,0.02,0.67,1.42,0.01,0.01,1.03,15,4,3,13,5,6,CRISIL Ultra Short Term Debt Index,HDFC Ultra Short Term Fund-Reg(G),0.3,9.78,20.72,0.01,2.9,255.56,24
Franklin India Smaller Cos Fund(G),2006-01-13,952,15.43,2.42,3.51,0.83,22.18,44.91,0.97,0.15,0.22,0.83,0.09,0.18,9,6,5,14,9,9,Nifty Smallcap 250 - TRI,Franklin India Smaller Cos Fund(G),15.94,2.25,3.27,0.83,20.93,43.49,24
HDFC Focused 30 Fund(G),2004-09-17,1129,11.0,2.88,4.53,0.75,17.92,42.01,0.69,0.18,0.29,0.75,0.07,0.17,1,2,1,3,10,4,NIFTY 500 - TRI,HDFC Focused 30 Fund(G),14.46,2.19,3.24,0.87,14.86,34.59,34
ICICI Pru Multicap Fund(G),1994-10-01,1677,12.28,2.88,4.37,0.81,20.69,43.92,0.77,0.18,0.28,0.81,0.08,0.17,3,1,2,5,6,1,Nifty500 Multicap 50:25:25 - TRI,ICICI Pru Multicap Fund(G),14.46,2.19,3.24,0.87,14.86,34.59,34
DSP Equity Opportunities Fund-Reg(G),2000-05-16,716,14.94,2.44,3.55,0.98,18.62,37.22,0.94,0.15,0.22,0.98,0.07,0.15,15,8,9,18,10,11,NIFTY LargeMidcap 250 - TRI,DSP Equity Opportunities Fund-Reg(G),14.92,2.24,3.29,0.89,16.03,35.36,26
ICICI Pru Technology Fund(G),2000-03-03,1695,15.79,1.9,3.84,0.78,15.88,38.66,0.99,0.12,0.24,0.78,0.06,0.15,3,4,4,5,4,4,BSE TECk Index - TRI,ICICI Pru Technology Fund(G),15.94,1.99,3.84,0.77,17.35,40.53,7
Axis Focused Fund-Reg(G),2012-06-29,15557,12.76,1.97,3.16,0.82,10.21,30.52,0.8,0.12,0.2,0.82,0.04,0.12,6,27,20,6,29,26,NIFTY 500 - TRI,Axis Focused Fund-Reg(G),14.46,2.19,3.24,0.87,14.86,34.59,34
HDFC Short Term Debt Fund(G),2010-06-25,11925,0.7,5.74,9.89,0.3,3.15,13.46,0.04,0.36,0.62,0.3,0.01,0.05,10,1,4,11,1,4,CRISIL Short Duration Debt Index,HDFC Short Term Debt Fund(G),0.71,4.61,8.37,0.29,2.33,-328.98,25
BHARAT Bond ETF - April 2031,2020-07-27,45008,1.25,3.9,5.97,0.35,3.98,13.71,0.08,0.25,0.38,0.35,0.02,0.05,11,10,9,10,1,7,NIFTY BHARAT Bond Index - April 2031,BHARAT Bond ETF - April 2031,1.05,4.54,6.56,0.42,2.57,-405.22,19
Bandhan Banking & PSU Debt Fund-Reg(G),2013-03-07,20747,0.63,5.39,9.53,0.24,2.7,14.01,0.04,0.34,0.6,0.24,0.01,0.06,9,9,10,10,14,10,NIFTY Banking and PSU Debt Index,Bandhan Banking & PSU Debt Fund-Reg(G),0.74,5.03,9.03,0.28,2.77,15.63,26
HSBC Value Fund-Reg(G),2010-01-08,8262,17.1,2.22,3.14,1.07,18.52,35.53,1.08,0.14,0.2,1.07,0.07,0.14,16,14,16,17,9,14,NIFTY 500 - TRI,HSBC Value Fund-Reg(G),15.31,2.33,3.44,0.98,17.49,36.33,22
Aditya Birla SL Savings Fund-Reg(G),2003-04-16,468,0.33,10.45,21.81,0.01,3.4,549.84,0.02,0.66,1.37,0.01,0.01,2.18,23,6,8,1,2,1,NIFTY Ultra Short Duration Debt Index,Aditya Birla SL Savings Fund-Reg(G),0.3,9.78,20.72,0.01,2.9,255.56,24
Bandhan Corp Bond Fund-Reg(G),2016-01-12,31896,0.6,5.78,9.77,0.19,2.92,18.24,0.04,0.36,0.62,0.19,0.01,0.07,2,2,3,2,9,2,NIFTY Corporate Bond Index,Bandhan Corp Bond Fund-Reg(G),0.76,4.97,8.52,0.32,2.81,12.33,21
Canara Rob Flexi Cap Fund-Reg(G),2003-09-16,526,13.06,2.09,3.16,0.92,10.51,29.64,0.82,0.13,0.2,0.92,0.04,0.12,13,24,22,18,31,32,BSE 500 - TRI,Canara Rob Flexi Cap Fund-Reg(G),14.39,2.16,3.2,0.94,13.96,33.2,45
Kotak Corporate Bond Fund(G),2007-09-21,265,0.81,5.0,8.57,0.37,2.97,11.06,0.05,0.32,0.54,0.37,0.01,0.04,15,10,13,16,5,15,NIFTY Corporate Bond Index,Kotak Corporate Bond Fund(G),0.76,4.97,8.52,0.32,2.81,12.33,21
Nippon India ETF Nifty 1D Rate Liquid BeES,2003-07-08,2155,0.13,-3.04,-20.2,0.0,-0.38,114.13,0.01,-0.19,-1.27,0.0,0.0,0.45,2,19,19,1,19,3,Nifty 1D Rate Index,Nippon India ETF Nifty 1D Rate Liquid BeES,1.05,4.54,6.56,0.42,2.57,-405.22,19
SBI Short Term Debt Fund-Reg(G),2007-07-26,2843,0.67,5.15,9.2,0.29,2.62,12.05,0.04,0.32,0.58,0.29,0.01,0.05,5,7,6,9,11,6,CRISIL Short Duration Debt Index,SBI Short Term Debt Fund-Reg(G),0.71,4.61,8.37,0.29,2.33,-328.98,25
Axis Banking & PSU Debt Fund-Reg(G),2012-06-08,16903,0.61,5.38,9.67,0.19,2.75,17.16,0.04,0.34,0.61,0.19,0.01,0.07,8,10,9,8,11,8,NIFTY Banking and PSU Debt Index,Axis Banking & PSU Debt Fund-Reg(G),0.74,5.03,9.03,0.28,2.77,15.63,26
HDFC Manufacturing Fund-Reg(G),2024-05-16,48655,,,,,,,,,,,,,,,,,,,Nifty India Manufacturing - TRI,HDFC Manufacturing Fund-Reg(G),15.66,2.27,3.42,0.91,17.47,37.03,52
Axis Flexi Cap Fund-Reg(G),2017-11-17,38212,13.66,2.13,3.18,0.92,12.37,31.55,0.86,0.13,0.2,0.92,0.05,0.13,18,21,21,19,25,24,NIFTY 500 - TRI,Axis Flexi Cap Fund-Reg(G),14.39,2.16,3.2,0.94,13.96,33.2,45
ICICI Pru All Seasons Bond Fund(G),2010-01-20,8499,1.2,3.61,6.07,0.58,2.62,7.43,0.08,0.23,0.38,0.58,0.01,0.03,3,4,5,5,6,6,NIFTY Composite Bond Index,ICICI Pru All Seasons Bond Fund(G),1.8,3.11,5.49,0.87,2.35,15.07,22
Bandhan Liquid Fund-Reg(G),2004-04-02,1032,0.07,9.94,5.25,0.0,0.71,-819.66,0.0,0.63,0.33,0.0,0.0,-3.25,18,25,26,11,28,15,Nifty Liquid Fund Index,Bandhan Liquid Fund-Reg(G),0.09,10.4,6.88,0.0,0.89,-1539.37,37
Franklin India Prima Fund(G),1993-12-01,948,15.27,2.61,4.02,0.9,23.41,44.15,0.96,0.16,0.25,0.9,0.09,0.18,10,5,4,17,9,9,Nifty Midcap 150 - TRI,Franklin India Prima Fund(G),16.0,2.36,3.53,0.91,21.06,41.37,30
Franklin India Focused Equity Fund(G),2007-07-26,938,13.02,2.22,3.4,0.9,12.47,32.05,0.82,0.14,0.21,0.9,0.05,0.13,7,18,13,16,25,22,NIFTY 500 - TRI,Franklin India Focused Equity Fund(G),14.46,2.19,3.24,0.87,14.86,34.59,34
Nippon India ETF Gold BeES,2007-03-08,1024,12.24,1.48,2.35,0.32,17.39,56.75,0.77,0.09,0.15,0.32,0.07,0.23,4,6,5,2,6,2,Gold-India,Nippon India ETF Gold BeES,17.25,1.19,1.89,0.82,16.24,28.48,22
Sundaram Mid Cap Fund-Reg(G),2002-07-19,3067,15.39,2.69,4.04,0.88,25.3,46.92,0.97,0.17,0.25,0.88,0.1,0.19,14,3,3,11,7,4,Nifty Midcap 150 - TRI,Sundaram Mid Cap Fund-Reg(G),16.0,2.36,3.53,0.91,21.06,41.37,30
Mirae Asset Liquid Fund-Reg(G),2009-01-12,7554,0.07,10.73,5.73,0.0,0.78,-1126.14,0.0,0.68,0.36,0.0,0.0,-4.47,22,11,11,18,10,22,Nifty Liquid Fund Index,Mirae Asset Liquid Fund-Reg(G),0.09,10.4,6.88,0.0,0.89,-1539.37,37
