MF Code,incept_date,schemecode,sdx_returns,sharpex_returns,sotinox_returns,betax_returns,alphax_returns,treynorx_returns,sdy_returns,sharpey_returns,sotinoy_returns,betay_returns,alphay_returns,treynory_returns,rank_sd,rank_sharpe,rank_sotino,rank_beta,rank_alpha,rank_treynor,index_name,s_name,avg_std_dev,avg_sharpe,avg_sotino,avg_beta,avg_alpha,avg_treyno,no_of_funds_total
SBI Nifty 50 ETF,2015-07-22,33369,12.65,1.58,2.44,0.99,4.71,20.21,0.8,0.1,0.15,0.99,0.02,0.08,37,84,84,69,93,98,NIFTY 50 - TRI,SBI Nifty 50 ETF,15.49,1.89,3.02,1.11,15.21,59.48,129
SBI S&P BSE Sensex ETF,2013-03-15,20447,12.6,1.38,2.16,0.99,2.09,17.56,0.79,0.09,0.14,0.99,0.01,0.07,23,99,97,79,108,108,BSE SENSEX - TRI,SBI S&P BSE Sensex ETF,15.49,1.89,3.02,1.11,15.21,59.48,129
HDFC Balanced Advantage Fund(G),2000-09-11,1273,10.89,2.91,3.98,0.46,30.32,68.32,0.69,0.18,0.25,0.46,0.12,0.27,23,4,5,26,2,5,NIFTY 50 Hybrid Composite Debt 50:50 Index,HDFC Balanced Advantage Fund(G),8.44,2.29,3.38,0.76,18.16,54.02,26
SBI Liquid Fund-Reg(G),2007-03-11,2828,0.07,28.81,14.9,0.0,2.02,10706.8,0.0,1.81,0.94,0.0,0.01,42.49,15,16,27,20,34,10,Nifty Liquid Fund Index,SBI Liquid Fund-Reg(G),0.09,27.49,17.29,0.0,2.24,3051.29,36
SBI Equity Hybrid Fund-Reg(G),1996-01-06,2747,8.93,2.15,3.28,0.41,18.07,46.85,0.56,0.14,0.21,0.41,0.07,0.19,29,36,36,39,22,40,CRISIL Hybrid 35+65 - Aggressive Index,SBI Equity Hybrid Fund-Reg(G),7.34,2.39,3.65,0.32,17.16,61.83,52
Parag Parikh Flexi Cap Fund-Reg(G),2013-05-28,21520,10.46,2.65,4.15,0.68,16.18,40.67,0.66,0.17,0.26,0.68,0.06,0.16,2,8,5,2,13,7,NIFTY 500 - TRI,Parag Parikh Flexi Cap Fund-Reg(G),13.47,2.22,3.28,0.93,14.46,32.44,41
HDFC Mid-Cap Opportunities Fund(G),2007-06-25,1305,14.99,2.77,3.98,0.9,26.21,46.02,0.94,0.17,0.25,0.9,0.1,0.18,17,6,9,17,10,11,Nifty Midcap 150 - TRI,HDFC Mid-Cap Opportunities Fund(G),15.17,2.59,3.79,0.89,24.29,44.05,30
HDFC Liquid Fund(G),2000-10-17,1286,0.07,28.44,15.09,0.0,2.04,-14827.55,0.0,1.79,0.95,0.0,0.01,-58.84,20,21,15,4,27,30,CRISIL Liquid Debt Index,HDFC Liquid Fund(G),0.09,27.49,17.29,0.0,2.24,3051.29,36
ICICI Pru Balanced Advantage Fund(G),2006-12-30,1470,5.35,3.14,5.21,0.24,16.1,68.47,0.34,0.2,0.33,0.24,0.06,0.27,1,1,1,2,14,4,CRISIL Hybrid 50+50 - Moderate Index,ICICI Pru Balanced Advantage Fund(G),8.44,2.29,3.38,0.76,18.16,54.02,26
ICICI Pru Bluechip Fund(G),2008-05-23,4980,12.05,2.51,3.86,0.91,14.79,33.14,0.76,0.16,0.24,0.91,0.06,0.13,10,4,4,11,7,5,NIFTY 100 - TRI,ICICI Pru Bluechip Fund(G),13.06,2.05,3.1,0.94,10.9,28.43,36
HDFC Flexi Cap Fund(G),1995-01-01,1131,11.47,2.95,4.59,0.83,19.81,40.7,0.72,0.19,0.29,0.83,0.08,0.16,3,2,2,8,9,6,NIFTY 500 - TRI,HDFC Flexi Cap Fund(G),13.47,2.22,3.28,0.93,14.46,32.44,41
UTI Nifty 50 ETF,2015-09-01,33150,12.65,1.58,2.44,0.99,4.71,20.21,0.8,0.1,0.15,0.99,0.02,0.08,35,82,83,68,91,96,NIFTY 50 - TRI,UTI Nifty 50 ETF,15.49,1.89,3.02,1.11,15.21,59.48,129
Nippon India Small Cap Fund(G),2010-09-16,12758,15.46,2.63,3.62,0.86,26.06,47.1,0.97,0.17,0.23,0.86,0.1,0.19,17,6,8,21,7,10,Nifty Smallcap 250 - TRI,Nippon India Small Cap Fund(G),14.89,2.41,3.41,0.79,22.76,45.66,24
Kotak Flexicap Fund(G),2009-09-11,7874,14.16,2.04,2.91,1.02,11.59,28.38,0.89,0.13,0.18,1.02,0.05,0.11,30,29,29,33,27,31,NIFTY 500 - TRI,Kotak Flexicap Fund(G),13.47,2.22,3.28,0.93,14.46,32.44,41
ICICI Pru Liquid Fund(G),2005-11-17,1659,0.08,27.06,15.07,0.0,2.07,37797.18,0.0,1.7,0.95,0.0,0.01,149.99,24,24,16,7,18,1,CRISIL Liquid Debt Index,ICICI Pru Liquid Fund(G),0.09,27.49,17.29,0.0,2.24,3051.29,36
SBI BlueChip Fund-Reg(G),2006-01-20,2711,10.88,1.86,2.93,0.81,6.43,24.82,0.69,0.12,0.18,0.81,0.03,0.1,1,27,25,3,31,29,BSE 100 - TRI,SBI BlueChip Fund-Reg(G),13.06,2.05,3.1,0.94,10.9,28.43,36
Aditya Birla SL Liquid Fund(G),2004-03-30,293,0.07,28.43,15.01,0.0,2.07,10524.55,0.0,1.79,0.95,0.0,0.01,41.76,22,22,20,19,16,11,Nifty Liquid Fund Index,Aditya Birla SL Liquid Fund(G),0.09,27.49,17.29,0.0,2.24,3051.29,36
Kotak Equity Arbitrage Fund(G),2005-09-29,1979,0.98,5.47,11.69,0.01,5.34,601.73,0.06,0.34,0.74,0.01,0.02,2.39,15,1,3,19,1,11,Nifty 50 Arbitrage,Kotak Equity Arbitrage Fund(G),0.97,4.98,10.55,0.0,4.8,533.01,24
Kotak Emerging Equity Fund(G),2007-03-30,1977,13.96,2.66,3.89,0.84,22.83,44.02,0.88,0.17,0.24,0.84,0.09,0.17,5,16,15,9,20,19,Nifty Midcap 150 - TRI,Kotak Emerging Equity Fund(G),15.17,2.59,3.79,0.89,24.29,44.05,30
ICICI Pru Value Discovery Fund(G),2004-08-16,1492,10.87,2.98,4.67,0.8,18.82,40.35,0.68,0.19,0.29,0.8,0.07,0.16,2,2,2,2,11,5,NIFTY 500 - TRI,ICICI Pru Value Discovery Fund(G),14.58,2.51,3.69,0.98,20.01,37.53,22
CPSE ETF,2014-03-28,27621,27.73,2.74,3.87,0.93,73.79,81.85,1.75,0.17,0.24,0.93,0.29,0.32,125,8,27,45,1,9,Nifty CPSE,CPSE ETF,15.49,1.89,3.02,1.11,15.21,59.48,129
UTI BSE Sensex ETF,2015-09-01,33151,12.6,1.38,2.16,0.99,2.09,17.56,0.79,0.09,0.14,0.99,0.01,0.07,24,100,98,80,109,109,BSE SENSEX - TRI,UTI BSE Sensex ETF,15.49,1.89,3.02,1.11,15.21,59.48,129
ICICI Pru Multi-Asset Fund(G),2002-10-31,1495,7.39,3.53,5.76,0.3,25.28,86.91,0.47,0.22,0.36,0.3,0.1,0.34,4,2,1,5,3,4,NIFTY 200 - TRI,ICICI Pru Multi-Asset Fund(G),8.55,2.64,4.07,1.19,21.57,68.48,13
Mirae Asset Large Cap Fund-Reg(G),2008-04-04,4457,12.13,1.54,2.37,0.93,3.02,20.16,0.76,0.1,0.15,0.93,0.01,0.08,11,34,33,13,35,35,NIFTY 100 - TRI,Mirae Asset Large Cap Fund-Reg(G),13.06,2.05,3.1,0.94,10.9,28.43,36
Axis Liquid Fund-Reg(G),2009-10-09,8029,0.07,28.52,15.31,0.0,2.09,18189.26,0.0,1.8,0.96,0.0,0.01,72.18,23,20,13,16,14,6,Nifty Liquid Fund Index,Axis Liquid Fund-Reg(G),0.09,27.49,17.29,0.0,2.24,3051.29,36
Axis ELSS Tax Saver Fund-Reg(G),2009-12-29,8408,11.74,1.94,3.15,0.76,9.9,29.94,0.74,0.12,0.2,0.76,0.04,0.12,9,50,32,12,47,40,NIFTY 500 - TRI,Axis ELSS Tax Saver Fund-Reg(G),13.37,2.23,3.3,0.89,14.7,33.87,59
Mirae Asset Large & Midcap Fund-Reg(G),2010-07-09,9767,13.69,2.21,3.19,0.96,14.14,31.7,0.86,0.14,0.2,0.96,0.06,0.13,10,16,18,14,19,19,NIFTY LargeMidcap 250 - TRI,Mirae Asset Large & Midcap Fund-Reg(G),14.07,2.36,3.43,0.93,17.47,35.58,26
ICICI Pru Equity & Debt Fund(G),1999-11-03,1482,9.84,3.03,4.56,0.46,28.55,64.71,0.62,0.19,0.29,0.46,0.11,0.26,38,8,11,49,4,17,CRISIL Hybrid 35+65 - Aggressive Index,ICICI Pru Equity & Debt Fund(G),7.34,2.39,3.65,0.32,17.16,61.83,52
Nippon India Liquid Fund(G),2003-12-09,2637,0.07,28.28,14.96,0.0,2.04,9441.91,0.0,1.78,0.94,0.0,0.01,37.47,21,23,22,21,24,13,Nifty Liquid Fund Index,Nippon India Liquid Fund(G),0.09,27.49,17.29,0.0,2.24,3051.29,36
SBI Focused Equity Fund-Reg(G),2004-10-11,2817,10.45,2.35,3.73,0.67,13.18,36.54,0.66,0.15,0.24,0.67,0.05,0.14,1,18,9,1,23,18,BSE 500 - TRI,SBI Focused Equity Fund-Reg(G),13.58,2.34,3.45,0.9,16.33,35.19,33
HDFC Top 100 Fund(G),1996-09-03,1331,13.4,2.06,3.01,1.01,10.41,27.19,0.84,0.13,0.19,1.01,0.04,0.11,24,15,19,30,14,16,NIFTY 100 - TRI,HDFC Top 100 Fund(G),13.06,2.05,3.1,0.94,10.9,28.43,36
Axis Bluechip Fund-Reg(G),2010-01-05,8250,11.71,1.82,2.87,0.88,6.48,24.27,0.74,0.11,0.18,0.88,0.03,0.1,7,28,26,9,30,30,BSE 100 - TRI,Axis Bluechip Fund-Reg(G),13.06,2.05,3.1,0.94,10.9,28.43,36
Nippon India Multi Cap Fund(G),2005-03-28,2466,13.86,2.82,4.02,0.91,23.84,43.24,0.87,0.18,0.25,0.91,0.09,0.17,20,4,6,17,3,7,Nifty500 Multicap 50:25:25 - TRI,Nippon India Multi Cap Fund(G),13.58,2.34,3.45,0.9,16.33,35.19,33
Kotak Liquid Fund-Reg(G),2003-11-04,2060,0.16,18.51,24.12,0.0,3.02,9269.29,0.01,1.17,1.52,0.0,0.01,36.78,36,34,1,23,1,14,Nifty Liquid Fund Index,Kotak Liquid Fund-Reg(G),0.09,27.49,17.29,0.0,2.24,3051.29,36
SBI Arbitrage Opportunities Fund-Reg(G),2006-11-03,2709,0.97,5.18,11.02,0.01,5.01,546.31,0.06,0.33,0.69,0.01,0.02,2.17,13,11,10,20,7,12,Nifty 50 Arbitrage,SBI Arbitrage Opportunities Fund-Reg(G),0.97,4.98,10.55,0.0,4.8,533.01,24
SBI Contra Fund-Reg(G),1999-07-14,2809,13.52,2.68,3.84,0.91,20.92,39.94,0.85,0.17,0.24,0.91,0.08,0.16,7,5,7,6,7,6,BSE 500 - TRI,SBI Contra Fund-Reg(G),14.58,2.51,3.69,0.98,20.01,37.53,22
SBI Balanced Advantage Fund-Reg(G),2021-08-31,32097,6.3,3.01,4.56,0.27,18.22,70.53,0.4,0.19,0.29,0.27,0.07,0.28,4,3,3,4,11,3,NIFTY 50 Hybrid Composite Debt 50:50 Index,SBI Balanced Advantage Fund-Reg(G),8.44,2.29,3.38,0.76,18.16,54.02,26
HDFC Small Cap Fund-Reg(G),2008-04-03,4455,14.25,2.22,3.12,0.75,19.0,42.36,0.9,0.14,0.2,0.75,0.08,0.17,8,17,17,8,17,17,BSE 250 Small Cap - TRI,HDFC Small Cap Fund-Reg(G),14.89,2.41,3.41,0.79,22.76,45.66,24
HDFC Corp Bond Fund(G),2010-06-29,8241,0.75,5.99,9.87,0.07,4.31,68.52,0.05,0.38,0.62,0.07,0.02,0.27,7,4,4,4,3,4,NIFTY Corporate Bond Index,HDFC Corp Bond Fund(G),0.8,4.96,8.69,0.08,3.64,53.65,21
SBI Small Cap Fund-Reg(G),2009-09-09,7885,12.56,2.52,3.61,0.68,20.11,46.54,0.79,0.16,0.23,0.68,0.08,0.18,2,10,9,2,14,13,BSE 250 Small Cap - TRI,SBI Small Cap Fund-Reg(G),14.89,2.41,3.41,0.79,22.76,45.66,24
UTI Liquid Fund-Reg(G),2003-12-10,3590,0.07,30.21,15.11,0.0,2.04,22651.37,0.0,1.9,0.95,0.0,0.01,89.89,12,11,14,12,30,4,Nifty Liquid Fund Index,UTI Liquid Fund-Reg(G),0.09,27.49,17.29,0.0,2.24,3051.29,36
Nippon India Growth Fund(G),1995-10-08,2573,15.86,2.73,3.93,0.96,27.06,45.16,1.0,0.17,0.25,0.96,0.11,0.18,22,10,13,25,9,13,Nifty Midcap 150 - TRI,Nippon India Growth Fund(G),15.17,2.59,3.79,0.89,24.29,44.05,30
ICICI Pru Corp Bond Fund(G),2009-08-11,7925,0.68,6.94,12.52,0.06,4.54,79.46,0.04,0.44,0.79,0.06,0.02,0.32,4,2,2,3,1,2,NIFTY Corporate Bond Index,ICICI Pru Corp Bond Fund(G),0.8,4.96,8.69,0.08,3.64,53.65,21
Aditya Birla SL Frontline Equity Fund(G),2002-08-30,447,12.53,1.97,2.99,0.96,8.44,25.73,0.79,0.12,0.19,0.96,0.03,0.1,15,21,20,18,24,24,NIFTY 100 - TRI,Aditya Birla SL Frontline Equity Fund(G),13.06,2.05,3.1,0.94,10.9,28.43,36
Nippon India ETF Nifty 50 BeES,2001-12-28,2272,12.65,1.58,2.44,0.99,4.74,20.24,0.8,0.1,0.15,0.99,0.02,0.08,32,79,81,65,88,91,NIFTY 50 - TRI,Nippon India ETF Nifty 50 BeES,15.49,1.89,3.02,1.11,15.21,59.48,129
Nippon India Large Cap Fund(G),2007-08-08,2455,13.41,2.28,3.31,0.99,13.73,30.74,0.84,0.14,0.21,0.99,0.05,0.12,25,8,10,26,9,11,BSE 100 - TRI,Nippon India Large Cap Fund(G),13.06,2.05,3.1,0.94,10.9,28.43,36
Axis Midcap Fund-Reg(G),2011-02-18,13049,13.06,2.6,3.92,0.8,20.34,42.31,0.82,0.16,0.25,0.8,0.08,0.17,3,20,14,4,24,24,BSE 150 MidCap - TRI,Axis Midcap Fund-Reg(G),15.17,2.59,3.79,0.89,24.29,44.05,30
SBI Savings Fund-Reg(G),2004-07-14,2774,0.3,14.06,30.08,0.0,4.28,1675.72,0.02,0.89,1.89,0.0,0.02,6.65,6,16,12,16,17,15,CRISIL Money Market Index,SBI Savings Fund-Reg(G),0.31,14.37,30.12,0.0,4.45,1666.6,21
UTI Flexi Cap Fund-Reg(G),2005-08-01,3461,10.36,1.44,2.4,0.68,3.48,22.02,0.65,0.09,0.15,0.68,0.01,0.09,1,40,39,1,41,39,NIFTY 500 - TRI,UTI Flexi Cap Fund-Reg(G),13.47,2.22,3.28,0.93,14.46,32.44,41
SBI Long Term Equity Fund-Reg(G),1993-03-31,2815,13.11,3.26,4.82,0.89,27.72,48.01,0.83,0.21,0.3,0.89,0.11,0.19,30,1,3,31,2,1,BSE 500 - TRI,SBI Long Term Equity Fund-Reg(G),13.37,2.23,3.3,0.89,14.7,33.87,59
Aditya Birla SL Money Manager Fund(G),2005-10-13,394,0.32,15.1,30.95,0.0,4.81,2876.93,0.02,0.95,1.95,0.0,0.02,11.42,14,2,5,2,1,1,CRISIL Money Market Index,Aditya Birla SL Money Manager Fund(G),0.31,14.37,30.12,0.0,4.45,1666.6,21
SBI Large & Midcap Fund-Reg(G),1993-02-28,2801,12.06,2.23,3.3,0.83,12.83,32.43,0.76,0.14,0.21,0.83,0.05,0.13,3,15,15,3,21,16,NIFTY LargeMidcap 250 - TRI,SBI Large & Midcap Fund-Reg(G),14.07,2.36,3.43,0.93,17.47,35.58,26
HDFC Hybrid Equity Fund(G),2005-04-06,1311,9.38,1.79,2.64,0.39,15.75,43.7,0.59,0.11,0.17,0.39,0.06,0.17,32,47,46,35,28,47,NIFTY 50 Hybrid Composite Debt 65:35 Index,HDFC Hybrid Equity Fund(G),7.34,2.39,3.65,0.32,17.16,61.83,52
ICICI Pru Money Market Fund(G),2006-03-08,1690,0.32,14.82,30.69,0.0,4.76,2441.68,0.02,0.93,1.93,0.0,0.02,9.69,19,5,9,6,5,4,Nifty Money Market Index,ICICI Pru Money Market Fund(G),0.31,14.37,30.12,0.0,4.45,1666.6,21
HDFC Money Market Fund-Reg(G),2000-01-03,1119,0.31,15.19,30.78,0.0,4.69,2629.44,0.02,0.96,1.94,0.0,0.02,10.43,7,1,8,3,8,2,CRISIL Money Market Index,HDFC Money Market Fund-Reg(G),0.31,14.37,30.12,0.0,4.45,1666.6,21
Mirae Asset ELSS Tax Saver Fund-Reg(G),2015-12-28,33536,12.99,2.1,3.07,0.94,11.39,29.06,0.82,0.13,0.19,0.94,0.05,0.12,27,39,35,39,40,45,NIFTY 500 - TRI,Mirae Asset ELSS Tax Saver Fund-Reg(G),13.37,2.23,3.3,0.89,14.7,33.87,59
Aditya Birla SL Corp Bond Fund(G),1997-03-03,453,0.98,4.75,8.34,0.1,4.36,45.91,0.06,0.3,0.53,0.1,0.02,0.18,20,14,13,20,2,11,NIFTY Corporate Bond Index,Aditya Birla SL Corp Bond Fund(G),0.8,4.96,8.69,0.08,3.64,53.65,21
ICICI Pru Asset Allocator Fund(FOF)(G),2003-12-18,1704,4.45,3.79,6.54,0.22,16.25,78.5,0.28,0.24,0.41,0.22,0.06,0.31,15,4,4,17,33,9,CRISIL Hybrid 50+50 - Moderate Index,ICICI Pru Asset Allocator Fund(FOF)(G),8.66,2.51,4.1,0.43,18.46,61.56,53
Canara Rob Emerg Equities Fund-Reg(G),2005-03-11,523,12.6,2.37,3.63,0.87,15.15,34.3,0.79,0.15,0.23,0.87,0.06,0.14,5,13,11,6,17,14,NIFTY LargeMidcap 250 - TRI,Canara Rob Emerg Equities Fund-Reg(G),14.07,2.36,3.43,0.93,17.47,35.58,26
Kotak Equity Opp Fund(G),2004-09-09,2069,14.29,2.47,3.5,0.97,18.77,36.26,0.9,0.16,0.22,0.97,0.07,0.14,17,11,12,18,10,11,NIFTY LargeMidcap 250 - TRI,Kotak Equity Opp Fund(G),14.07,2.36,3.43,0.93,17.47,35.58,26
Quant Small Cap Fund(G),1996-10-16,876,19.32,2.56,3.49,1.06,31.53,46.67,1.22,0.16,0.22,1.06,0.13,0.19,24,8,11,24,2,12,Nifty Smallcap 250 - TRI,Quant Small Cap Fund(G),14.89,2.41,3.41,0.79,22.76,45.66,24
Tata Liquid Fund-Reg(G),2004-09-01,3212,0.07,31.45,14.8,0.0,2.04,16222.5,0.0,1.98,0.93,0.0,0.01,64.38,8,8,33,13,31,7,CRISIL Liquid Debt Index,Tata Liquid Fund-Reg(G),0.09,27.49,17.29,0.0,2.24,3051.29,36
SBI Flexicap Fund-Reg(G),2005-09-16,2799,11.86,1.8,2.68,0.85,6.85,24.95,0.75,0.11,0.17,0.85,0.03,0.1,6,36,35,11,36,36,BSE 500 - TRI,SBI Flexicap Fund-Reg(G),13.47,2.22,3.28,0.93,14.46,32.44,41
Aditya Birla SL Flexi Cap Fund(G),1998-08-27,445,12.82,2.17,3.32,0.94,11.87,29.51,0.81,0.14,0.21,0.94,0.05,0.12,18,19,15,24,26,25,NIFTY 500 - TRI,Aditya Birla SL Flexi Cap Fund(G),13.47,2.22,3.28,0.93,14.46,32.44,41
HSBC Liquid Fund(G),2004-06-01,1340,0.09,25.01,18.34,0.0,2.27,34682.03,0.01,1.58,1.16,0.0,0.01,137.63,26,26,11,15,11,3,Nifty Liquid Fund Index,HSBC Liquid Fund(G),0.09,27.49,17.29,0.0,2.24,3051.29,36
Kotak Money Market Fund(G),2003-07-14,1999,0.32,14.76,30.91,0.0,4.74,2282.01,0.02,0.93,1.95,0.0,0.02,9.06,18,7,7,10,6,6,CRISIL Money Market Index,Kotak Money Market Fund(G),0.31,14.37,30.12,0.0,4.45,1666.6,21
Axis Small Cap Fund-Reg(G),2013-11-29,21651,12.73,2.26,3.38,0.68,17.29,42.34,0.8,0.14,0.21,0.68,0.07,0.17,3,15,14,3,22,18,Nifty Smallcap 250 - TRI,Axis Small Cap Fund-Reg(G),14.89,2.41,3.41,0.79,22.76,45.66,24
SBI Corp Bond Fund-Reg(G),2019-02-01,40450,0.74,5.01,8.55,0.07,3.55,54.51,0.05,0.32,0.54,0.07,0.01,0.22,6,8,12,5,11,6,NIFTY Corporate Bond Index,SBI Corp Bond Fund-Reg(G),0.8,4.96,8.69,0.08,3.64,53.65,21
ICICI Pru Equity-Arbitrage Fund(G),2006-12-30,1467,0.93,5.34,11.37,0.01,4.94,847.58,0.06,0.34,0.72,0.01,0.02,3.36,5,5,7,14,10,6,Nifty 50 Arbitrage,ICICI Pru Equity-Arbitrage Fund(G),0.97,4.98,10.55,0.0,4.8,533.01,24
HDFC Large and Mid Cap Fund-Reg(G),1994-02-18,2271,14.18,2.61,3.69,0.97,20.54,38.0,0.89,0.16,0.23,0.97,0.08,0.15,15,7,10,19,8,9,NIFTY LargeMidcap 250 - TRI,HDFC Large and Mid Cap Fund-Reg(G),14.07,2.36,3.43,0.93,17.47,35.58,26
ICICI Pru Savings Fund(G),2002-09-27,1500,0.39,12.96,24.51,0.01,5.04,410.94,0.02,0.82,1.54,0.01,0.02,1.63,20,4,13,8,1,5,NIFTY Low Duration Debt Index,ICICI Pru Savings Fund(G),0.34,12.49,24.8,0.01,4.19,338.61,20
ICICI Pru India Opp Fund(G),2019-01-15,42140,10.84,3.39,5.57,0.75,23.97,48.69,0.68,0.21,0.35,0.75,0.1,0.19,4,4,2,11,12,5,NIFTY 500 - TRI,ICICI Pru India Opp Fund(G),14.76,2.4,3.6,0.94,19.76,37.65,46
BHARAT Bond ETF - April 2030,2019-12-30,44421,1.23,3.08,5.23,0.13,3.5,29.99,0.08,0.19,0.33,0.13,0.01,0.12,8,8,8,10,8,9,NIFTY BHARAT Bond Index - April 2030,BHARAT Bond ETF - April 2030,1.28,6.28,10.19,0.21,3.31,549.36,17
Tata Money Market Fund-Reg(G),2003-05-22,3267,0.33,14.7,31.0,0.0,4.79,1548.39,0.02,0.93,1.95,0.0,0.02,6.14,20,9,4,19,4,17,CRISIL Money Market Index,Tata Money Market Fund-Reg(G),0.31,14.37,30.12,0.0,4.45,1666.6,21
SBI Magnum Midcap Fund-Reg(G),2005-03-29,2789,12.17,2.47,3.79,0.69,18.4,43.57,0.77,0.16,0.24,0.69,0.07,0.17,1,25,19,1,27,21,Nifty Midcap 150 - TRI,SBI Magnum Midcap Fund-Reg(G),15.17,2.59,3.79,0.89,24.29,44.05,30
ICICI Pru Short Term Fund(G),2001-10-25,1682,0.79,5.69,10.91,0.09,4.26,51.99,0.05,0.36,0.69,0.09,0.02,0.21,17,3,2,17,2,6,Nifty Short Duration Debt Index,ICICI Pru Short Term Fund(G),0.76,4.87,8.65,0.08,3.36,287.4,26
Bharat 22 ETF,2017-11-24,38252,22.31,2.32,3.21,0.72,50.15,71.67,1.41,0.15,0.2,0.72,0.2,0.28,122,52,59,28,2,12,BSE Bharat 22 Index - TRI,Bharat 22 ETF,15.49,1.89,3.02,1.11,15.21,59.48,129
HDFC Low Duration Fund(G),1999-11-18,1114,0.34,12.72,24.09,0.01,4.33,474.62,0.02,0.8,1.52,0.01,0.02,1.88,13,9,16,4,4,4,NIFTY Low Duration Debt Index,HDFC Low Duration Fund(G),0.34,12.49,24.8,0.01,4.19,338.61,20
DSP Midcap Fund-Reg(G),2006-11-14,735,14.04,2.69,3.96,0.84,23.56,45.06,0.88,0.17,0.25,0.84,0.09,0.18,6,15,11,7,17,14,Nifty Midcap 150 - TRI,DSP Midcap Fund-Reg(G),15.17,2.59,3.79,0.89,24.29,44.05,30
UTI Nifty 50 Index Fund-Reg(G),2000-03-04,3641,12.68,1.56,2.41,0.99,3.1,20.03,0.8,0.1,0.15,0.99,0.01,0.08,27,65,67,48,67,70,NIFTY 50 - TRI,UTI Nifty 50 Index Fund-Reg(G),15.44,2.13,3.18,1.0,16.85,34.18,94
Nippon India Money Market Fund(G),2005-06-15,2628,0.32,15.07,31.22,0.0,4.79,2424.11,0.02,0.95,1.97,0.0,0.02,9.62,15,3,3,7,3,5,Nifty Money Market Index,Nippon India Money Market Fund(G),0.31,14.37,30.12,0.0,4.45,1666.6,21
Kotak Balanced Advantage Fund-Reg(G),2018-08-03,40623,6.38,2.28,3.52,0.35,13.58,41.98,0.4,0.14,0.22,0.35,0.05,0.17,5,12,10,11,23,24,NIFTY 50 Hybrid Composite Debt 50:50 Index,Kotak Balanced Advantage Fund-Reg(G),8.44,2.29,3.38,0.76,18.16,54.02,26
SBI Multicap Fund-Reg(G),2022-03-08,46405,11.71,2.36,3.56,0.71,15.65,38.96,0.74,0.15,0.22,0.71,0.06,0.15,4,17,14,2,19,11,Nifty500 Multicap 50:25:25 - TRI,SBI Multicap Fund-Reg(G),13.58,2.34,3.45,0.9,16.33,35.19,33
Aditya Birla SL ELSS Tax Saver Fund(G),2008-03-10,4637,12.3,2.15,3.15,0.9,11.19,29.31,0.78,0.14,0.2,0.9,0.04,0.12,17,33,31,34,42,43,NIFTY 500 - TRI,Aditya Birla SL ELSS Tax Saver Fund(G),13.37,2.23,3.3,0.89,14.7,33.87,59
Invesco India Arbitrage Fund(G),2007-04-30,2167,0.95,5.34,11.66,0.01,5.04,389.01,0.06,0.34,0.73,0.01,0.02,1.54,9,6,5,22,5,15,Nifty 50 Arbitrage,Invesco India Arbitrage Fund(G),0.97,4.98,10.55,0.0,4.8,533.01,24
Franklin India Flexi Cap Fund(G),1994-09-29,950,12.76,2.65,3.92,0.93,18.22,36.59,0.8,0.17,0.25,0.93,0.07,0.15,17,7,8,22,11,12,NIFTY 500 - TRI,Franklin India Flexi Cap Fund(G),13.47,2.22,3.28,0.93,14.46,32.44,41
Nippon India Arbitrage Fund(G),2010-10-14,12938,0.93,5.32,11.12,0.01,4.89,613.65,0.06,0.33,0.7,0.01,0.02,2.44,4,8,9,18,14,10,Nifty 50 Arbitrage,Nippon India Arbitrage Fund(G),0.97,4.98,10.55,0.0,4.8,533.01,24
Mirae Asset Midcap Fund-Reg(G),2019-07-29,43349,14.59,2.56,3.71,0.88,22.55,42.61,0.92,0.16,0.23,0.88,0.09,0.17,15,22,23,15,21,22,Nifty Midcap 150 - TRI,Mirae Asset Midcap Fund-Reg(G),15.17,2.59,3.79,0.89,24.29,44.05,30
SBI Overnight Fund-Reg(G),2002-09-24,2787,0.01,215.9,13.06,0.0,1.69,28377.97,0.0,13.6,0.82,0.0,0.01,112.61,1,1,15,4,30,9,CRISIL Liquid Overnight Index,SBI Overnight Fund-Reg(G),0.04,129.76,16.27,0.0,1.88,13522.41,32
Nippon India ELSS Tax Saver Fund(G),2005-09-21,2667,14.38,2.38,3.39,1.02,16.98,33.54,0.91,0.15,0.21,1.02,0.07,0.13,41,16,20,54,23,30,NIFTY 500 - TRI,Nippon India ELSS Tax Saver Fund(G),13.37,2.23,3.3,0.89,14.7,33.87,59
Kotak Bond Short Term Fund(G),2002-05-02,1971,0.83,4.51,8.24,0.09,3.5,40.35,0.05,0.28,0.52,0.09,0.01,0.16,20,19,21,21,14,20,Nifty Short Duration Debt Index,Kotak Bond Short Term Fund(G),0.76,4.87,8.65,0.08,3.36,287.4,26
ICICI Pru Nifty 50 ETF,2013-03-20,20803,12.65,1.59,2.45,0.99,4.74,20.24,0.8,0.1,0.15,0.99,0.02,0.08,34,77,80,71,90,94,NIFTY 50 - TRI,ICICI Pru Nifty 50 ETF,15.49,1.89,3.02,1.11,15.21,59.48,129
ICICI Pru Flexicap Fund(G),2021-07-19,45492,11.62,2.7,4.41,0.81,17.79,38.98,0.73,0.17,0.28,0.81,0.07,0.15,4,6,3,3,12,9,BSE 500 - TRI,ICICI Pru Flexicap Fund(G),13.47,2.22,3.28,0.93,14.46,32.44,41
DSP ELSS Tax Saver Fund-Reg(G),2007-01-18,745,14.05,2.45,3.54,1.0,17.44,34.32,0.89,0.15,0.22,1.0,0.07,0.14,37,11,12,52,20,28,NIFTY 500 - TRI,DSP ELSS Tax Saver Fund-Reg(G),13.37,2.23,3.3,0.89,14.7,33.87,59
Kotak Small Cap Fund(G),2005-02-24,2066,12.8,2.57,3.65,0.69,21.09,47.35,0.81,0.16,0.23,0.69,0.08,0.19,4,7,4,4,12,8,Nifty Smallcap 250 - TRI,Kotak Small Cap Fund(G),14.89,2.41,3.41,0.79,22.76,45.66,24
HSBC Small Cap Fund-Reg(G),2014-05-12,22139,15.54,2.53,3.64,0.8,25.7,48.89,0.98,0.16,0.23,0.8,0.1,0.19,18,9,5,18,8,5,Nifty Smallcap 250 - TRI,HSBC Small Cap Fund-Reg(G),14.89,2.41,3.41,0.79,22.76,45.66,24
HDFC ELSS Tax saver(G),1996-03-31,1329,11.92,3.05,4.79,0.87,21.7,41.91,0.75,0.19,0.3,0.87,0.09,0.17,15,3,4,22,7,13,NIFTY 500 - TRI,HDFC ELSS Tax saver(G),13.37,2.23,3.3,0.89,14.7,33.87,59
Invesco India Contra Fund(G),2007-04-11,2169,14.19,2.44,3.51,1.0,17.72,34.6,0.89,0.15,0.22,1.0,0.07,0.14,12,15,15,13,13,16,BSE 500 - TRI,Invesco India Contra Fund(G),14.58,2.51,3.69,0.98,20.01,37.53,22
Bandhan Liquid Fund-Reg(G),2004-04-02,1032,0.07,28.8,14.87,0.0,2.04,-35562.69,0.0,1.81,0.94,0.0,0.01,-141.12,19,17,31,6,26,35,Nifty Liquid Fund Index,Bandhan Liquid Fund-Reg(G),0.09,27.49,17.29,0.0,2.24,3051.29,36
HDFC Floating Rate Debt Fund(G),2007-10-23,3728,0.47,10.85,20.78,0.03,5.07,193.16,0.03,0.68,1.31,0.03,0.02,0.77,5,3,4,9,4,8,CRISIL Short Duration Debt Index,HDFC Floating Rate Debt Fund(G),0.64,8.77,17.59,0.04,4.71,294.87,13
HDFC Ultra Short Term Fund-Reg(G),2018-09-24,39949,0.3,15.01,31.11,0.0,4.41,2230.45,0.02,0.95,1.96,0.0,0.02,8.85,14,4,2,13,8,13,CRISIL Ultra Short Term Debt Index,HDFC Ultra Short Term Fund-Reg(G),0.29,14.1,29.55,0.0,4.13,2248.3,24
Bandhan Banking & PSU Debt Fund-Reg(G),2013-03-07,20747,0.69,5.26,9.54,0.06,3.45,57.48,0.04,0.33,0.6,0.06,0.01,0.23,10,13,13,8,18,10,NIFTY Banking and PSU Debt Index,Bandhan Banking & PSU Debt Fund-Reg(G),0.78,5.1,9.4,0.08,3.57,75.15,26
HDFC Index Fund-NIFTY 50 Plan(G)(Post Addendum),2002-07-17,12633,12.68,1.56,2.41,0.99,3.07,20.03,0.8,0.1,0.15,0.99,0.01,0.08,26,67,68,46,72,67,NIFTY 50 - TRI,HDFC Index Fund-NIFTY 50 Plan(G)(Post Addendum),15.44,2.13,3.18,1.0,16.85,34.18,94
UTI Money Market Fund-Reg(G),2009-07-09,7914,0.32,14.97,31.31,0.0,4.81,2222.16,0.02,0.94,1.97,0.0,0.02,8.82,16,4,1,12,2,8,CRISIL Money Market Index,UTI Money Market Fund-Reg(G),0.31,14.37,30.12,0.0,4.45,1666.6,21
DSP Small Cap Fund-Reg(G),2007-06-14,714,14.56,2.06,2.96,0.71,17.87,41.96,0.92,0.13,0.19,0.71,0.07,0.17,11,22,22,6,21,19,BSE 250 Small Cap - TRI,DSP Small Cap Fund-Reg(G),14.89,2.41,3.41,0.79,22.76,45.66,24
DSP Liquidity Fund-Reg(G),2005-11-22,708,0.07,29.05,14.88,0.0,2.04,9706.21,0.0,1.83,0.94,0.0,0.01,38.52,14,15,29,18,23,12,CRISIL Liquid Debt Index,DSP Liquidity Fund-Reg(G),0.09,27.49,17.29,0.0,2.24,3051.29,36
Axis Focused Fund-Reg(G),2012-06-29,15557,12.03,1.62,2.57,0.81,5.87,24.19,0.76,0.1,0.16,0.81,0.02,0.1,7,32,30,5,32,31,NIFTY 500 - TRI,Axis Focused Fund-Reg(G),13.58,2.34,3.45,0.9,16.33,35.19,33
HDFC Multi Cap Fund-Reg(G),2021-12-10,46093,13.96,2.6,3.73,0.94,20.46,38.76,0.88,0.16,0.23,0.94,0.08,0.15,21,9,10,19,12,12,Nifty500 Multicap 50:25:25 - TRI,HDFC Multi Cap Fund-Reg(G),13.58,2.34,3.45,0.9,16.33,35.19,33
Bandhan Corp Bond Fund-Reg(G),2016-01-12,31896,0.56,7.18,11.32,0.03,3.93,146.79,0.04,0.45,0.71,0.03,0.02,0.58,2,1,3,1,5,1,NIFTY Corporate Bond Index,Bandhan Corp Bond Fund-Reg(G),0.8,4.96,8.69,0.08,3.64,53.65,21
Axis Banking & PSU Debt Fund-Reg(G),2012-06-08,16903,0.67,5.41,9.83,0.06,3.48,63.81,0.04,0.34,0.62,0.06,0.01,0.25,9,9,11,7,17,7,NIFTY Banking and PSU Debt Index,Axis Banking & PSU Debt Fund-Reg(G),0.78,5.1,9.4,0.08,3.57,75.15,26
Aditya Birla SL Savings Fund-Reg(G),2003-04-16,468,0.32,14.57,29.87,0.0,4.69,3530.92,0.02,0.92,1.88,0.0,0.02,14.01,23,10,12,4,1,2,NIFTY Ultra Short Duration Debt Index,Aditya Birla SL Savings Fund-Reg(G),0.29,14.1,29.55,0.0,4.13,2248.3,24
BHARAT Bond ETF - April 2031,2020-07-27,45008,1.32,2.78,4.27,0.11,3.43,33.57,0.08,0.18,0.27,0.11,0.01,0.13,9,9,9,8,9,7,NIFTY BHARAT Bond Index - April 2031,BHARAT Bond ETF - April 2031,1.28,6.28,10.19,0.21,3.31,549.36,17
ICICI Pru ELSS Tax Saver Fund(G),1999-08-19,1694,11.13,2.24,3.47,0.81,11.21,30.79,0.7,0.14,0.22,0.81,0.04,0.12,4,25,16,15,41,36,NIFTY 500 - TRI,ICICI Pru ELSS Tax Saver Fund(G),13.37,2.23,3.3,0.89,14.7,33.87,59
ICICI Pru Large & Mid Cap Fund(G),1998-07-09,1608,12.11,2.91,4.42,0.84,21.04,41.93,0.76,0.18,0.28,0.84,0.08,0.17,4,2,1,4,7,5,NIFTY LargeMidcap 250 - TRI,ICICI Pru Large & Mid Cap Fund(G),14.07,2.36,3.43,0.93,17.47,35.58,26
HDFC Short Term Debt Fund(G),2010-06-25,11925,0.74,5.98,10.83,0.08,4.21,55.67,0.05,0.38,0.68,0.08,0.02,0.22,11,2,4,11,3,3,CRISIL Short Duration Debt Index,HDFC Short Term Debt Fund(G),0.76,4.87,8.65,0.08,3.36,287.4,26
Canara Rob Bluechip Equity Fund-Reg(G),2010-08-20,8217,12.14,1.95,2.96,0.93,7.91,25.38,0.76,0.12,0.19,0.93,0.03,0.1,12,23,23,14,25,25,BSE 100 - TRI,Canara Rob Bluechip Equity Fund-Reg(G),13.06,2.05,3.1,0.94,10.9,28.43,36
Kotak Savings Fund(G),2004-08-13,1995,0.3,14.26,29.13,0.0,4.26,1205.82,0.02,0.9,1.84,0.0,0.02,4.78,16,12,15,22,11,22,NIFTY Ultra Short Duration Debt Index,Kotak Savings Fund(G),0.29,14.1,29.55,0.0,4.13,2248.3,24
Aditya Birla SL Floating Rate Fund(G),2009-03-25,7727,0.41,11.69,21.93,0.02,4.76,270.32,0.03,0.74,1.38,0.02,0.02,1.07,3,2,3,3,7,4,NIFTY Low Duration Debt Index,Aditya Birla SL Floating Rate Fund(G),0.64,8.77,17.59,0.04,4.71,294.87,13
SBI Short Term Debt Fund-Reg(G),2007-07-26,2843,0.7,5.41,10.0,0.07,3.6,53.42,0.04,0.34,0.63,0.07,0.01,0.21,6,7,7,7,10,5,CRISIL Short Duration Debt Index,SBI Short Term Debt Fund-Reg(G),0.76,4.87,8.65,0.08,3.36,287.4,26
Franklin India Smaller Cos Fund(G),2006-01-13,952,14.71,2.9,4.14,0.8,29.11,53.35,0.93,0.18,0.26,0.8,0.12,0.21,13,2,2,16,5,2,Nifty Smallcap 250 - TRI,Franklin India Smaller Cos Fund(G),14.89,2.41,3.41,0.79,22.76,45.66,24
