MF Code,incept_date,schemecode,sdx_returns,sharpex_returns,sotinox_returns,betax_returns,alphax_returns,treynorx_returns,sdy_returns,sharpey_returns,sotinoy_returns,betay_returns,alphay_returns,treynory_returns,rank_sd,rank_sharpe,rank_sotino,rank_beta,rank_alpha,rank_treynor,index_name,s_name,avg_std_dev,avg_sharpe,avg_sotino,avg_beta,avg_alpha,avg_treyno,no_of_funds_total
Nippon India Index Fund-BSE Sensex Plan(G),2010-09-28,12865,12.74,1.61,2.51,0.99,0.3,20.61,0.8,0.1,0.16,0.99,0.0,0.08,29,88,88,56,90,89,BSE SENSEX - TRI,Nippon India Index Fund-BSE Sensex Plan(G),15.54,2.34,3.5,0.98,17.03,37.92,95
Franklin India NSE Nifty 50 Index Fund(G),2000-08-04,942,12.67,1.78,2.75,0.98,2.6,22.98,0.8,0.11,0.17,0.98,0.01,0.09,9,80,80,36,82,82,NIFTY 50,Franklin India NSE Nifty 50 Index Fund(G),15.54,2.34,3.5,0.98,17.03,37.92,95
Nippon India Nifty 50 Value 20 Index Fund-Reg(G),2021-02-19,45289,13.65,2.13,3.5,0.94,10.03,31.02,0.86,0.13,0.22,0.94,0.04,0.12,44,62,60,20,62,63,Nifty50 Value 20 - TRI,Nippon India Nifty 50 Value 20 Index Fund-Reg(G),15.54,2.34,3.5,0.98,17.03,37.92,95
SBI FMP-91-90D-Reg(G),2023-12-29,48431,,,,,,,,,,,,,,,,,,,CRISIL Liquid Debt Index,SBI FMP-91-90D-Reg(G),0.73,6.07,12.23,0.06,3.38,-73.89,91
HDFC Non-Cyclical Consumer Fund-Reg(G),2023-07-12,46357,,,,,,,,,,,,,,,,,,,Nifty India Consumption - TRI,HDFC Non-Cyclical Consumer Fund-Reg(G),11.17,2.56,4.53,0.61,16.16,46.59,13
ICICI Pru Silver ETF FOF(G),2022-02-01,46215,19.92,1.28,2.34,1.06,21.27,23.94,1.25,0.08,0.15,1.06,0.08,0.1,51,49,49,53,26,51,Silver,ICICI Pru Silver ETF FOF(G),8.66,2.8,4.6,0.43,20.15,68.23,53
Union Innovation & Opp Fund-Reg(G),2023-09-06,45727,,,,,,,,,,,,,,,,,,,NIFTY 500 - TRI,Union Innovation & Opp Fund-Reg(G),14.82,2.63,3.96,0.86,20.13,41.75,46
Baroda BNP Paribas Overnight Fund-Reg(G),2019-04-25,43376,0.01,201.65,12.81,0.0,1.71,33995.1,0.0,12.7,0.81,0.0,0.01,134.9,7,7,21,12,17,5,CRISIL Liquid Overnight Index,Baroda BNP Paribas Overnight Fund-Reg(G),0.04,131.62,16.18,0.0,1.88,22730.38,32
Tata Resources & Energy Fund-Reg(G),2015-12-28,33731,19.75,1.95,2.72,1.19,14.24,32.26,1.24,0.12,0.17,1.19,0.06,0.13,3,3,3,3,3,3,NIFTY COMMODITIES - TRI,Tata Resources & Energy Fund-Reg(G),18.93,2.62,3.73,1.15,26.16,44.97,3
Baroda BNP Paribas Focused Fund-Reg(G),2017-10-06,32452,16.87,2.07,2.89,1.08,12.98,32.31,1.06,0.13,0.18,1.08,0.05,0.13,41,38,41,42,25,33,NIFTY 500 - TRI,Baroda BNP Paribas Focused Fund-Reg(G),13.58,2.51,3.72,0.92,15.65,37.24,43
Motilal Oswal Liquid Fund-Reg(G),2018-12-19,41872,0.15,18.35,22.99,0.0,2.77,5724.89,0.01,1.16,1.45,0.0,0.01,22.72,33,34,7,35,5,17,CRISIL Liquid Debt Index,Motilal Oswal Liquid Fund-Reg(G),0.09,27.58,17.5,0.0,2.27,-3784.64,36
UTI Gilt Fund-Reg(G),2002-01-21,3560,2.33,2.14,3.49,0.26,3.98,19.33,0.15,0.13,0.22,0.26,0.02,0.08,20,26,31,17,18,19,CRISIL Dynamic Gilt Index,UTI Gilt Fund-Reg(G),2.05,2.67,4.83,0.24,4.05,23.5,35
SBI FMP-66-1361D-Reg(G),2022-07-19,46633,0.53,3.96,7.61,0.04,1.99,57.41,0.03,0.25,0.48,0.04,0.01,0.23,24,60,60,25,66,28,CRISIL Medium Duration Debt Index,SBI FMP-66-1361D-Reg(G),0.73,6.07,12.23,0.06,3.38,-73.89,91
ICICI Pru Nifty Next 50 ETF,2018-08-23,39950,18.32,2.78,4.01,1.1,30.21,46.29,1.15,0.18,0.25,1.1,0.12,0.18,104,12,35,104,18,33,NIFTY NEXT 50 - TRI,ICICI Pru Nifty Next 50 ETF,15.55,2.06,3.31,1.06,15.12,54.16,129
Parag Parikh Dynamic Asset Allocation Fund-Reg(G),2024-02-27,48512,,,,,,,,,,,,,,,,,,,CRISIL Hybrid 50+50 - Moderate Index,Parag Parikh Dynamic Asset Allocation Fund-Reg(G),8.46,2.53,3.74,0.72,19.65,59.09,26
DSP FMP 267-1246D-Reg(G),2022-11-14,47071,0.89,5.0,10.47,0.09,4.08,51.58,0.06,0.31,0.66,0.09,0.02,0.2,74,47,40,73,42,43,CRISIL Medium Duration Debt Index,DSP FMP 267-1246D-Reg(G),0.73,6.07,12.23,0.06,3.38,-73.89,91
HDFC Nifty G-Sec Jul 2031 Index Fund-Reg(G),2022-11-10,46620,2.24,2.15,3.56,0.26,3.81,18.67,0.14,0.14,0.22,0.26,0.02,0.07,17,23,29,16,26,24,Nifty G-Sec July 2031 Index,HDFC Nifty G-Sec Jul 2031 Index Fund-Reg(G),2.05,2.67,4.83,0.24,4.05,23.5,35
Tata Nifty 50 ETF,2019-01-01,41017,12.75,1.82,2.81,0.99,4.13,23.46,0.8,0.11,0.18,0.99,0.02,0.09,42,89,91,75,101,98,NIFTY 50 - TRI,Tata Nifty 50 ETF,15.55,2.06,3.31,1.06,15.12,54.16,129
Axis FTP-118-100D-Reg(G),2023-12-05,48251,,,,,,,,,,,,,,,,,,,CRISIL Ultra Short Term Debt Index,Axis FTP-118-100D-Reg(G),0.73,6.07,12.23,0.06,3.38,-73.89,91
Franklin India Banking & PSU Debt Fund(G),2014-04-25,28458,0.55,7.75,14.93,0.05,4.11,90.54,0.03,0.49,0.94,0.05,0.02,0.36,2,2,5,5,9,6,NIFTY Banking and PSU Debt Index,Franklin India Banking & PSU Debt Fund(G),0.77,5.78,10.56,0.08,3.96,79.72,26
Mirae Asset Low Duration Fund-Reg Savings Plan(G),2008-03-05,4609,0.33,13.02,25.76,0.01,4.28,315.98,0.02,0.82,1.62,0.01,0.02,1.25,6,9,6,9,10,10,NIFTY Low Duration Debt Index,Mirae Asset Low Duration Fund-Reg Savings Plan(G),0.34,12.92,25.34,0.01,4.34,355.12,20
DSP NIFTY Next 50 Index Fund-Reg(G),2019-02-21,41641,18.25,2.78,4.01,1.09,28.58,46.54,1.15,0.18,0.25,1.09,0.11,0.18,66,13,16,74,21,33,NIFTY NEXT 50 - TRI,DSP NIFTY Next 50 Index Fund-Reg(G),15.54,2.34,3.5,0.98,17.03,37.92,95
360 ONE Flexicap Fund-Reg(G),2023-06-30,47567,13.97,2.98,4.25,0.92,23.69,45.16,0.88,0.19,0.27,0.92,0.09,0.18,29,6,10,24,6,8,BSE 500 - TRI,360 ONE Flexicap Fund-Reg(G),13.58,2.51,3.72,0.92,15.65,37.24,43
Motilal Oswal BSE Enhanced Value Index Fund-Reg(G),2022-08-22,46741,24.76,2.74,3.92,1.41,39.21,48.11,1.56,0.17,0.25,1.41,0.16,0.19,95,33,33,95,1,16,BSE Enhanced Value Index - TRI,Motilal Oswal BSE Enhanced Value Index Fund-Reg(G),15.54,2.34,3.5,0.98,17.03,37.92,95
Kotak Consumption Fund-Reg(G),2023-11-16,47948,,,,,,,,,,,,,,,,,,,Nifty India Consumption - TRI,Kotak Consumption Fund-Reg(G),11.17,2.56,4.53,0.61,16.16,46.59,13
Motilal Oswal Nifty 200 Momentum 30 Index Fund-Reg(G),2022-02-10,46320,19.46,2.7,3.9,1.1,30.09,47.58,1.23,0.17,0.25,1.1,0.12,0.19,88,42,37,88,16,24,Nifty200 Momentum 30 - TRI,Motilal Oswal Nifty 200 Momentum 30 Index Fund-Reg(G),15.54,2.34,3.5,0.98,17.03,37.92,95
LIC MF Nifty Midcap 100 ETF,2024-02-19,48473,,,,,,,,,,,,,,,,,,,Nifty Midcap 100 - TRI,LIC MF Nifty Midcap 100 ETF,15.55,2.06,3.31,1.06,15.12,54.16,129
HDFC Nifty G-Sec Sep 2032 Index Fund-Reg(G),2022-12-09,46872,2.32,2.1,3.64,0.3,3.7,16.28,0.15,0.13,0.23,0.3,0.01,0.06,19,28,24,31,27,33,Nifty G-Sec Sep 2032 Index,HDFC Nifty G-Sec Sep 2032 Index Fund-Reg(G),2.05,2.67,4.83,0.24,4.05,23.5,35
SBI Magnum Comma Fund-Reg(G),2005-08-08,2750,20.31,1.88,2.61,1.16,14.64,32.84,1.28,0.12,0.16,1.16,0.06,0.13,41,45,46,41,31,36,NIFTY COMMODITIES - TRI,SBI Magnum Comma Fund-Reg(G),14.82,2.63,3.96,0.86,20.13,41.75,46
HDFC NIFTY200 Momentum 30 Index Fund-Reg(G),2024-02-28,48466,,,,,,,,,,,,,,,,,,,Nifty200 Momentum 30 - TRI,HDFC NIFTY200 Momentum 30 Index Fund-Reg(G),15.54,2.34,3.5,0.98,17.03,37.92,95
Nippon India Nifty G-Sec Jun 2036 Maturity Index Fund-Reg(G),2022-12-19,47190,3.08,1.88,3.12,0.37,4.36,15.75,0.19,0.12,0.2,0.37,0.02,0.06,34,35,35,35,8,35,Nifty G-Sec Jun 2036 Index,Nippon India Nifty G-Sec Jun 2036 Maturity Index Fund-Reg(G),2.05,2.67,4.83,0.24,4.05,23.5,35
Union Aggressive Hybrid Fund-Reg(G),2020-12-18,44512,10.02,2.33,3.34,0.4,21.85,59.09,0.63,0.15,0.21,0.4,0.09,0.23,45,41,43,37,20,34,CRISIL Hybrid 35+65 - Aggressive Index,Union Aggressive Hybrid Fund-Reg(G),7.37,2.65,4.06,0.33,19.06,68.13,52
HDFC MNC Fund-Reg(G),2023-03-09,47648,11.26,2.38,3.84,0.62,14.06,42.84,0.71,0.15,0.24,0.62,0.06,0.17,5,4,4,5,4,4,NIFTY MNC - TRI,HDFC MNC Fund-Reg(G),10.2,2.53,4.11,0.53,15.11,47.95,5
Franklin India Equity Savings Fund(G),2018-08-27,39645,2.34,3.72,5.83,0.1,8.32,89.01,0.15,0.23,0.37,0.1,0.03,0.35,5,2,3,4,48,7,NIFTY 50 Equity Savings Index,Franklin India Equity Savings Fund(G),7.37,2.65,4.06,0.33,19.06,68.13,52
Samco Dynamic Asset Allocation Fund-Reg(G),2023-12-28,48331,,,,,,,,,,,,,,,,,,,NIFTY 50 Hybrid Composite Debt 50:50 Index,Samco Dynamic Asset Allocation Fund-Reg(G),8.46,2.53,3.74,0.72,19.65,59.09,26
DSP BSE Liquid Rate ETF,2024-03-27,48724,,,,,,,,,,,,,,,,,,,BSE Liquid Rate Index,DSP BSE Liquid Rate ETF,1.26,6.73,11.19,0.21,3.76,2392.71,17
Tata Housing Opportunities Fund-Reg(G),2022-09-02,46764,15.04,2.37,3.53,0.95,16.46,37.72,0.95,0.15,0.22,0.95,0.07,0.15,32,28,31,31,26,28,Nifty Housing - TRI,Tata Housing Opportunities Fund-Reg(G),14.82,2.63,3.96,0.86,20.13,41.75,46
HSBC Credit Risk Fund-Reg(G),2009-10-08,8016,0.57,7.03,12.27,0.05,3.86,88.91,0.04,0.44,0.77,0.05,0.02,0.35,4,4,7,7,11,6,NIFTY Credit Risk Bond Index,HSBC Credit Risk Fund-Reg(G),1.43,5.33,12.66,0.06,4.95,-102.1,15
Axis CRISIL IBX 70:30 CPSE Plus SDL April 2025 Index Fund-Reg(G),2022-01-28,45992,0.41,10.74,23.31,0.02,4.38,230.63,0.03,0.68,1.47,0.02,0.02,0.92,2,2,2,1,3,1,CRISIL IBX 70:30 CPSE Plus SDL - April 2025,Axis CRISIL IBX 70:30 CPSE Plus SDL April 2025 Index Fund-Reg(G),0.93,5.23,10.38,0.09,3.95,66.93,30
Axis Global Innovation FoF-Reg(G),2021-05-28,45539,13.8,1.75,3.11,0.52,22.25,46.52,0.87,0.11,0.2,0.52,0.09,0.18,22,18,18,36,19,24,MSCI ACWI Net TRI,Axis Global Innovation FoF-Reg(G),15.29,1.1,1.96,0.46,13.91,62.07,56
Motilal Oswal Nifty Bank Index Fund-Reg(G),2019-09-06,43789,16.5,0.97,1.47,1.14,-7.16,14.01,1.04,0.06,0.09,1.14,-0.03,0.06,58,94,94,91,94,94,NIFTY BANK - TRI,Motilal Oswal Nifty Bank Index Fund-Reg(G),15.54,2.34,3.5,0.98,17.03,37.92,95
Kotak Nifty SDL Plus AAA PSU Bond Jul 2028 60:40 Index Fund-Reg(G),2022-10-13,46730,1.08,4.11,8.18,0.1,4.06,46.17,0.07,0.26,0.52,0.1,0.02,0.18,19,21,20,20,28,21,Nifty SDL Plus AAA PSU Bond Jul 2028 60:40 Index,Kotak Nifty SDL Plus AAA PSU Bond Jul 2028 60:40 Index Fund-Reg(G),1.32,3.83,7.37,0.13,3.93,51.13,52
Axis Value Fund-Reg(G),2021-09-22,45838,13.8,2.93,4.22,0.91,22.08,44.68,0.87,0.18,0.27,0.91,0.09,0.18,10,5,6,7,7,5,NIFTY 500 - TRI,Axis Value Fund-Reg(G),14.61,2.78,4.09,0.97,20.86,42.01,22
TRUSTMF Flexi Cap Fund-Reg(G),2024-04-26,48451,,,,,,,,,,,,,,,,,,,NIFTY 500 - TRI,TRUSTMF Flexi Cap Fund-Reg(G),13.58,2.51,3.72,0.92,15.65,37.24,43
Quant BFSI Fund-Reg(G),2023-06-20,47989,18.4,2.81,4.04,1.02,30.84,50.43,1.16,0.18,0.25,1.02,0.12,0.2,16,1,1,5,1,1,Nifty Financial Services - TRI,Quant BFSI Fund-Reg(G),15.68,1.58,2.32,1.08,3.45,23.68,16
PGIM India Large Cap Fund(G),2003-01-30,758,11.71,1.7,2.64,0.89,1.92,22.48,0.74,0.11,0.17,0.89,0.01,0.09,4,36,36,10,36,36,NIFTY 100 - TRI,PGIM India Large Cap Fund(G),13.08,2.27,3.44,0.94,10.72,31.77,36
Nippon India Nifty Pharma ETF,2021-07-06,45584,14.08,2.58,4.94,0.44,28.0,82.5,0.89,0.16,0.31,0.44,0.11,0.33,65,38,9,11,27,6,NIFTY PHARMA - TRI,Nippon India Nifty Pharma ETF,15.55,2.06,3.31,1.06,15.12,54.16,129
Bajaj Finserv Arbitrage Fund-Reg(G),2023-09-15,48064,,,,,,,,,,,,,,,,,,,Nifty 50 Arbitrage,Bajaj Finserv Arbitrage Fund-Reg(G),0.97,4.91,10.36,-0.01,4.77,111.27,24
Quantum Liquid Fund-Reg(G),2006-04-07,19756,0.05,34.86,14.17,0.0,1.92,10725.55,0.0,2.2,0.89,0.0,0.01,42.56,2,5,35,26,35,12,CRISIL Liquid Debt Index,Quantum Liquid Fund-Reg(G),0.09,27.58,17.5,0.0,2.27,-3784.64,36
SBI FMP-67-1467D-Reg(G),2022-07-29,46703,0.55,3.69,6.7,0.06,1.89,34.57,0.03,0.23,0.42,0.06,0.01,0.14,28,65,67,48,77,65,CRISIL Medium to Long Term Debt Index,SBI FMP-67-1467D-Reg(G),0.73,6.07,12.23,0.06,3.38,-73.89,91
LIC MF Aggressive Hybrid Fund(G),1991-01-01,2085,10.02,2.47,3.63,0.44,23.01,55.67,0.63,0.16,0.23,0.44,0.09,0.22,44,36,37,46,17,38,CRISIL Hybrid 35+65 - Aggressive Index,LIC MF Aggressive Hybrid Fund(G),7.37,2.65,4.06,0.33,19.06,68.13,52
ICICI Pru Nifty 10 yr Benchmark G-Sec ETF,2022-12-13,47331,2.67,1.77,3.01,0.33,3.55,14.21,0.17,0.11,0.19,0.33,0.01,0.06,4,3,3,6,2,4,Nifty 10 yr Benchmark G-Sec,ICICI Pru Nifty 10 yr Benchmark G-Sec ETF,2.64,1.76,3.0,0.32,3.41,14.5,6
Mirae Asset S&P 500 Top 50 ETF FoF-Reg(G),2021-09-22,45836,17.81,1.82,3.21,0.23,31.5,143.61,1.12,0.11,0.2,0.23,0.12,0.57,44,15,16,13,4,4,S&P 500 Top 50 TRI,Mirae Asset S&P 500 Top 50 ETF FoF-Reg(G),15.29,1.1,1.96,0.46,13.91,62.07,56
Kotak Silver ETF,2022-12-12,46627,21.61,1.23,2.19,1.1,22.68,24.07,1.36,0.08,0.14,1.1,0.09,0.1,19,15,14,19,4,18,Silver,Kotak Silver ETF,15.54,1.53,2.69,0.58,20.1,60.06,22
Navi Nifty Bank Index Fund-Reg(G),2022-02-04,45873,16.56,0.96,1.46,1.14,-7.28,13.94,1.04,0.06,0.09,1.14,-0.03,0.06,59,95,95,92,95,95,NIFTY BANK - TRI,Navi Nifty Bank Index Fund-Reg(G),15.54,2.34,3.5,0.98,17.03,37.92,95
Aditya Birla SL Equity Savings Fund-Reg(G),2014-11-28,30757,2.55,3.22,5.41,0.1,7.81,81.82,0.16,0.2,0.34,0.1,0.03,0.32,6,8,8,6,49,9,NIFTY 50 Equity Savings Index - TRI,Aditya Birla SL Equity Savings Fund-Reg(G),7.37,2.65,4.06,0.33,19.06,68.13,52
WOC Multi Asset Allocation Fund-Reg(G),2023-05-19,47946,4.95,3.47,5.65,0.27,16.15,64.41,0.31,0.22,0.36,0.27,0.06,0.26,2,3,3,4,12,9,CRISIL Composite Bond Index,WOC Multi Asset Allocation Fund-Reg(G),8.05,2.9,4.54,1.12,21.84,78.7,14
DSP NIFTY 50 Index Fund-Reg(G),2019-02-21,41642,12.72,1.81,2.79,0.99,2.95,23.31,0.8,0.11,0.18,0.99,0.01,0.09,17,69,69,44,70,70,NIFTY 50 - TRI,DSP NIFTY 50 Index Fund-Reg(G),15.54,2.34,3.5,0.98,17.03,37.92,95
Bank of India Multi Cap Fund-Reg(G),2023-03-03,46115,16.54,2.61,3.6,1.03,22.33,42.03,1.04,0.16,0.23,1.03,0.09,0.17,30,16,21,29,7,13,Nifty500 Multicap 50:25:25 - TRI,Bank of India Multi Cap Fund-Reg(G),13.72,2.58,3.79,0.85,17.12,39.52,32
Baroda BNP Paribas Business Cycle Fund-Reg(G),2021-09-15,45686,13.39,2.87,4.23,0.92,19.88,42.03,0.84,0.18,0.27,0.92,0.08,0.17,23,12,13,24,18,21,BSE 500 - TRI,Baroda BNP Paribas Business Cycle Fund-Reg(G),14.82,2.63,3.96,0.86,20.13,41.75,46
Invesco India ESG Integration Strategy Fund-Reg(G),2021-03-20,45348,12.69,2.24,3.47,0.87,10.76,32.71,0.8,0.14,0.22,0.87,0.04,0.13,20,35,36,20,36,37,NIFTY100 ESG - TRI,Invesco India ESG Integration Strategy Fund-Reg(G),14.82,2.63,3.96,0.86,20.13,41.75,46
Canara Rob Ultra Short Term Fund-Reg(G),2008-07-11,5902,0.28,13.83,28.43,0.0,3.93,1314.89,0.02,0.87,1.79,0.0,0.02,5.22,5,17,22,20,19,21,CRISIL Ultra Short Term Debt Index,Canara Rob Ultra Short Term Fund-Reg(G),0.3,14.31,30.07,0.0,4.25,2431.75,24
Nippon India ETF Hang Seng BeES,2010-03-09,8564,22.07,0.0,0.0,0.42,-1.54,0.08,1.39,0.0,0.0,0.42,-0.01,0.0,121,128,128,8,114,128,Hang Seng,Nippon India ETF Hang Seng BeES,15.55,2.06,3.31,1.06,15.12,54.16,129
Franklin India Pension Plan(G),1997-03-31,3396,5.41,2.88,4.18,0.26,14.59,59.62,0.34,0.18,0.26,0.26,0.06,0.24,13,10,12,10,27,16,CRISIL Composite Bond Index,Franklin India Pension Plan(G),8.74,2.68,4.13,0.77,20.82,62.02,38
LIC MF ULIS,1989-06-19,2154,9.62,2.05,3.2,0.43,18.07,45.81,0.61,0.13,0.2,0.43,0.07,0.18,20,35,34,21,22,27,CRISIL Hybrid 35+65 - Aggressive Index,LIC MF ULIS,8.74,2.68,4.13,0.77,20.82,62.02,38
HDFC BSE Sensex ETF,2015-12-09,34084,12.7,1.64,2.58,0.99,2.14,20.99,0.8,0.1,0.16,0.99,0.01,0.08,35,96,99,84,105,106,BSE SENSEX - TRI,HDFC BSE Sensex ETF,15.55,2.06,3.31,1.06,15.12,54.16,129
WOC Large Cap Fund-Reg(G),2022-12-01,47079,13.21,2.31,3.41,0.96,11.09,31.88,0.83,0.15,0.22,0.96,0.04,0.13,21,16,19,22,14,14,BSE 100 - TRI,WOC Large Cap Fund-Reg(G),13.08,2.27,3.44,0.94,10.72,31.77,36
Bandhan Transportation and Logistics Fund-Reg(G),2022-10-25,46986,13.34,3.48,5.66,0.71,31.93,64.94,0.84,0.22,0.36,0.71,0.13,0.26,1,1,3,1,2,1,Nifty Transportation & Logistics - TRI,Bandhan Transportation and Logistics Fund-Reg(G),14.19,3.31,5.69,0.67,31.47,61.95,4
Invesco India Gilt Fund(G),2008-02-09,4378,2.81,2.28,4.15,0.3,5.24,21.67,0.18,0.14,0.26,0.3,0.02,0.09,32,15,15,28,2,13,Nifty All Duration G-Sec Index,Invesco India Gilt Fund(G),2.05,2.67,4.83,0.24,4.05,23.5,35
Franklin India Overnight Fund(G),2019-05-08,43438,0.01,182.22,13.06,0.0,1.71,33855.7,0.0,11.48,0.82,0.0,0.01,134.35,13,12,12,11,16,6,Nifty 1D Rate Index,Franklin India Overnight Fund(G),0.04,131.62,16.18,0.0,1.88,22730.38,32
Axis Gold Fund-Reg(G),2011-10-20,15330,10.26,1.9,3.48,0.18,18.75,107.81,0.65,0.12,0.22,0.18,0.07,0.43,1,1,3,6,12,6,Gold-India,Axis Gold Fund-Reg(G),12.82,1.68,3.05,0.39,19.36,132.08,15
Mahindra Manulife Equity Savings Fund-Reg(G),2017-02-01,36671,5.59,2.61,3.79,0.22,13.73,65.09,0.35,0.16,0.24,0.22,0.05,0.26,22,31,33,19,35,24,NIFTY 50 Equity Savings Index - TRI,Mahindra Manulife Equity Savings Fund-Reg(G),7.37,2.65,4.06,0.33,19.06,68.13,52
Bandhan Bond Fund - Income Plan-Reg(G),2000-07-14,1090,2.38,1.7,2.91,0.28,2.95,14.26,0.15,0.11,0.18,0.28,0.01,0.06,9,19,18,8,19,19,NIFTY Medium to Long Duration Debt Index,Bandhan Bond Fund - Income Plan-Reg(G),2.7,2.12,3.76,0.53,4.44,21.14,19
Union Business Cycle Fund-Reg(G),2024-03-05,48599,,,,,,,,,,,,,,,,,,,NIFTY 500 - TRI,Union Business Cycle Fund-Reg(G),14.82,2.63,3.96,0.86,20.13,41.75,46
Bandhan CRISIL IBX Gilt April 2026 Index Fund-Reg(G),2022-10-20,46815,0.71,5.96,12.46,0.07,3.93,57.3,0.04,0.38,0.78,0.07,0.02,0.23,1,1,1,1,21,1,CRISIL IBX Gilt Index - April 2026,Bandhan CRISIL IBX Gilt April 2026 Index Fund-Reg(G),2.05,2.67,4.83,0.24,4.05,23.5,35
Mahindra Manulife Low Duration Fund-Reg(G),2017-02-15,36894,0.34,12.48,24.21,0.01,4.18,299.17,0.02,0.79,1.52,0.01,0.02,1.19,10,16,18,13,16,14,CRISIL Low Duration Debt Index,Mahindra Manulife Low Duration Fund-Reg(G),0.34,12.92,25.34,0.01,4.34,355.12,20
Edelweiss Money Market Fund-Reg(G),2008-06-27,5437,0.3,13.95,29.43,0.0,4.11,1976.44,0.02,0.88,1.85,0.0,0.02,7.84,1,1,1,1,10,1,CRISIL Money Market Index,Edelweiss Money Market Fund-Reg(G),1.82,3.18,5.68,0.19,3.97,114.52,22
Motilal Oswal Nifty 50 Index Fund-Reg(G),2019-12-23,44366,12.73,1.79,2.77,0.99,2.8,23.16,0.8,0.11,0.17,0.99,0.01,0.09,25,74,74,48,76,76,NIFTY 50 - TRI,Motilal Oswal Nifty 50 Index Fund-Reg(G),15.54,2.34,3.5,0.98,17.03,37.92,95
ICICI Pru Retirement Fund-Hybrid Aggressive Plan(G),2019-02-27,25669,13.72,2.86,4.11,0.45,37.52,87.8,0.86,0.18,0.26,0.45,0.15,0.35,35,11,14,26,2,4,CRISIL Hybrid 35+65 - Aggressive Index,ICICI Pru Retirement Fund-Hybrid Aggressive Plan(G),8.74,2.68,4.13,0.77,20.82,62.02,38
Edelweiss Technology Fund-Reg(G),2024-03-05,43844,,,,,,,,,,,,,,,,,,,BSE TECk Index - TRI,Edelweiss Technology Fund-Reg(G),15.02,2.05,3.99,0.7,16.19,43.48,5
Aditya Birla SL BSE Sensex ETF,2016-07-18,35815,12.76,1.64,2.57,1.0,1.71,21.02,0.8,0.1,0.16,1.0,0.01,0.08,46,97,105,89,111,105,BSE SENSEX - TRI,Aditya Birla SL BSE Sensex ETF,15.55,2.06,3.31,1.06,15.12,54.16,129
Mahindra Manulife Large Cap Fund-Reg(G),2019-03-15,38073,12.91,2.22,3.33,0.97,8.95,29.56,0.81,0.14,0.21,0.97,0.04,0.12,18,20,22,25,23,23,NIFTY 100 - TRI,Mahindra Manulife Large Cap Fund-Reg(G),13.08,2.27,3.44,0.94,10.72,31.77,36
ICICI Pru Nifty Alpha Low - Volatility 30 ETF FOF(G),2021-09-20,45389,11.35,3.38,5.88,0.25,37.4,152.46,0.71,0.21,0.37,0.25,0.15,0.6,39,11,9,22,5,1,NIFTY Alpha Low-Volatility 30 - TRI,ICICI Pru Nifty Alpha Low - Volatility 30 ETF FOF(G),8.66,2.8,4.6,0.43,20.15,68.23,53
UTI Dynamic Bond Fund-Reg(G),2010-06-23,11896,1.95,2.26,3.66,0.21,3.58,20.59,0.12,0.14,0.23,0.21,0.01,0.08,12,17,19,14,16,17,CRISIL Dynamic Bond Index,UTI Dynamic Bond Fund-Reg(G),1.82,3.18,5.68,0.19,3.97,114.52,22
Invesco India Aggressive Hybrid Fund-Reg(G),2018-06-30,39893,10.18,3.05,4.56,0.5,29.11,61.84,0.64,0.19,0.29,0.5,0.12,0.25,46,16,16,52,5,30,CRISIL Hybrid 35+65 - Aggressive Index,Invesco India Aggressive Hybrid Fund-Reg(G),7.37,2.65,4.06,0.33,19.06,68.13,52
Nippon India Nifty AAA PSU Bond Plus SDL - Sep 2026 Maturity 50:50 Index Fund-Reg(G),2022-10-27,47034,0.65,6.8,13.7,0.05,4.21,90.75,0.04,0.43,0.86,0.05,0.02,0.36,7,6,6,6,4,5,Nifty AAA PSU Bond Plus SDL Sep 2026 50:50 Index,Nippon India Nifty AAA PSU Bond Plus SDL - Sep 2026 Maturity 50:50 Index Fund-Reg(G),0.77,5.78,10.56,0.08,3.96,79.72,26
Axis Nifty 50 Index Fund-Reg(G),2021-12-03,45701,12.68,1.8,2.78,0.98,2.9,23.28,0.8,0.11,0.18,0.98,0.01,0.09,10,72,72,37,74,74,NIFTY 50 - TRI,Axis Nifty 50 Index Fund-Reg(G),15.54,2.34,3.5,0.98,17.03,37.92,95
Invesco India Short Duration Fund(G),2007-03-24,2262,0.92,4.7,9.72,0.09,3.98,45.76,0.06,0.3,0.61,0.09,0.02,0.18,24,21,15,22,8,20,Nifty Short Duration Debt Index,Invesco India Short Duration Fund(G),0.74,5.33,8.45,0.08,3.63,290.88,26
Axis Credit Risk Fund-Reg(G),2014-07-15,23018,0.58,7.87,14.95,0.05,4.33,86.97,0.04,0.5,0.94,0.05,0.02,0.35,5,3,4,11,9,7,CRISIL Credit Risk Debt Index,Axis Credit Risk Fund-Reg(G),1.43,5.33,12.66,0.06,4.95,-102.1,15
SBI FMP-42-1857D-Reg(G),2021-03-30,45447,0.49,4.18,7.86,0.04,1.97,54.84,0.03,0.26,0.49,0.04,0.01,0.22,23,58,59,29,68,31,CRISIL Medium to Long Term Debt Index,SBI FMP-42-1857D-Reg(G),0.73,6.07,12.23,0.06,3.38,-73.89,91
Nippon India Equity Savings Fund(G),2015-05-30,30963,3.27,2.87,4.39,0.16,8.74,59.07,0.21,0.18,0.28,0.16,0.03,0.23,8,20,18,11,47,35,NIFTY 50 Equity Savings Index,Nippon India Equity Savings Fund(G),7.37,2.65,4.06,0.33,19.06,68.13,52
SBI Nifty Midcap 150 Index Fund-Reg(G),2022-10-03,45376,16.13,2.75,3.9,0.94,25.4,47.28,1.02,0.17,0.25,0.94,0.1,0.19,51,30,38,23,37,28,Nifty Midcap 150 - TRI,SBI Nifty Midcap 150 Index Fund-Reg(G),15.54,2.34,3.5,0.98,17.03,37.92,95
Navi Nifty Next 50 Index Fund-Reg(G),2022-01-19,45860,18.3,2.75,3.97,1.09,28.17,46.12,1.15,0.17,0.25,1.09,0.11,0.18,73,29,28,82,28,44,NIFTY NEXT 50 - TRI,Navi Nifty Next 50 Index Fund-Reg(G),15.54,2.34,3.5,0.98,17.03,37.92,95
ICICI Pru Nifty Midcap 150 Index Fund-Reg(G),2021-12-22,46108,16.13,2.75,3.89,0.94,25.3,47.38,1.02,0.17,0.24,0.94,0.1,0.19,52,31,40,17,38,27,Nifty Midcap 150 - TRI,ICICI Pru Nifty Midcap 150 Index Fund-Reg(G),15.54,2.34,3.5,0.98,17.03,37.92,95
HDFC FMP-Sr 46-1861D-Mar 2022-Reg(G),2022-03-09,46453,0.92,5.07,9.94,0.1,4.28,48.51,0.06,0.32,0.63,0.1,0.02,0.19,79,44,51,77,27,47,NIFTY Medium to Long Duration Debt Index,HDFC FMP-Sr 46-1861D-Mar 2022-Reg(G),0.73,6.07,12.23,0.06,3.38,-73.89,91
HSBC Low Duration Fund-Reg(G),2010-12-04,13350,0.35,13.45,25.36,0.01,4.66,514.13,0.02,0.85,1.6,0.01,0.02,2.04,16,4,11,4,2,3,NIFTY Low Duration Debt Index,HSBC Low Duration Fund-Reg(G),0.34,12.92,25.34,0.01,4.34,355.12,20
UTI BSE Low Volatility Index Fund-Reg(G),2022-03-03,46409,10.45,2.95,5.28,0.63,17.92,48.56,0.66,0.19,0.33,0.63,0.07,0.19,3,4,2,2,50,15,BSE Low Volatility Index - TRI,UTI BSE Low Volatility Index Fund-Reg(G),15.54,2.34,3.5,0.98,17.03,37.92,95
LIC MF Infra Fund-Reg(G),2008-03-24,4324,18.96,3.49,4.97,0.97,46.39,68.17,1.19,0.22,0.31,0.97,0.18,0.27,13,2,2,3,1,1,Nifty Infrastructure - TRI,LIC MF Infra Fund-Reg(G),18.32,3.04,4.24,1.08,33.57,51.73,19
Kotak FMP-292-1735D(G),2021-08-13,45679,0.72,6.27,14.36,0.04,4.36,126.66,0.05,0.4,0.9,0.04,0.02,0.5,51,24,22,24,21,12,CRISIL Composite Bond Index,Kotak FMP-292-1735D(G),0.73,6.07,12.23,0.06,3.38,-73.89,91
Kotak FMP-292-1735D(IDCW),2021-08-13,45790,0.72,6.27,14.36,0.04,4.36,126.63,0.05,0.39,0.9,0.04,0.02,0.5,50,25,23,23,20,13,NIFTY Medium to Long Duration Debt Index,Kotak FMP-292-1735D(IDCW),0.73,6.07,12.23,0.06,3.38,-73.89,91
Bajaj Finserv Overnight Fund-Reg(G),2023-07-05,48051,,,,,,,,,,,,,,,,,,,CRISIL Liquid Overnight Index,Bajaj Finserv Overnight Fund-Reg(G),0.04,131.62,16.18,0.0,1.88,22730.38,32
ICICI Pru FMP-85-10Y-I(G),2019-03-15,43023,1.64,3.1,5.62,0.11,4.64,46.37,0.1,0.2,0.35,0.11,0.02,0.18,89,77,77,83,8,51,CRISIL Composite Bond Index,ICICI Pru FMP-85-10Y-I(G),0.73,6.07,12.23,0.06,3.38,-73.89,91
Motilal Oswal Nifty Midcap 100 ETF,2011-02-03,13595,17.45,2.61,3.68,1.03,26.26,44.43,1.1,0.16,0.23,1.03,0.1,0.18,96,34,55,94,34,42,Nifty Midcap 100 - TRI,Motilal Oswal Nifty Midcap 100 ETF,15.55,2.06,3.31,1.06,15.12,54.16,129
ICICI Pru Nifty Bank Index Fund-Reg(G),2022-03-02,45994,16.48,0.98,1.49,1.13,-6.93,14.21,1.04,0.06,0.09,1.13,-0.03,0.06,57,93,93,90,93,93,NIFTY BANK - TRI,ICICI Pru Nifty Bank Index Fund-Reg(G),15.54,2.34,3.5,0.98,17.03,37.92,95
ICICI Pru Nifty IT ETF,2020-08-17,44401,18.59,1.32,2.59,0.74,10.58,33.06,1.17,0.08,0.16,0.74,0.04,0.13,113,106,97,36,72,66,NIFTY IT - TRI,ICICI Pru Nifty IT ETF,15.55,2.06,3.31,1.06,15.12,54.16,129
Nippon India Nifty G-Sec Sep 2027 Maturity Index Fund-Reg(G),2022-12-06,47186,1.23,3.64,6.64,0.15,3.88,29.84,0.08,0.23,0.42,0.15,0.02,0.12,8,6,6,8,23,7,Nifty G-Sec Sep 2027 Index,Nippon India Nifty G-Sec Sep 2027 Maturity Index Fund-Reg(G),2.05,2.67,4.83,0.24,4.05,23.5,35
Axis Gilt Fund-Reg(G),2012-01-23,15652,2.45,2.46,4.54,0.3,4.84,20.13,0.15,0.15,0.29,0.3,0.02,0.08,25,13,12,30,4,15,CRISIL Dynamic Gilt Index,Axis Gilt Fund-Reg(G),2.05,2.67,4.83,0.24,4.05,23.5,35
Edelweiss Equity Savings Fund-Reg(G),2014-10-13,30730,3.47,3.93,6.19,0.18,12.95,74.67,0.22,0.25,0.39,0.18,0.05,0.3,9,1,2,12,39,14,NIFTY 50 Equity Savings Index,Edelweiss Equity Savings Fund-Reg(G),7.37,2.65,4.06,0.33,19.06,68.13,52
Aditya Birla SL CRISIL IBX AAA Mar 2024 Index Fund-Reg(G),2023-02-03,47555,0.33,14.62,30.7,0.0,4.76,6721.04,0.02,0.92,1.93,0.0,0.02,26.67,2,1,1,1,1,1,CRISIL IBX AAA Index - March 2024,Aditya Birla SL CRISIL IBX AAA Mar 2024 Index Fund-Reg(G),0.74,5.33,8.45,0.08,3.63,290.88,26
Mirae Asset Nifty 1D Rate Liquid ETF,2023-07-27,48119,,,,,,,,,,,,,,,,,,,Nifty 1D Rate Index,Mirae Asset Nifty 1D Rate Liquid ETF,1.26,6.73,11.19,0.21,3.76,2392.71,17
Nippon India Nifty Next 50 Junior BeES FoF-Reg(G),2019-03-08,40664,14.74,3.41,5.61,0.41,48.64,121.14,0.93,0.21,0.35,0.41,0.19,0.48,47,8,11,38,2,3,NIFTY NEXT 50,Nippon India Nifty Next 50 Junior BeES FoF-Reg(G),8.66,2.8,4.6,0.43,20.15,68.23,53
ITI Focused Equity Fund-Reg(G),2023-06-19,45722,15.75,2.39,3.34,1.0,17.19,37.45,0.99,0.15,0.21,1.0,0.07,0.15,37,26,31,32,16,19,NIFTY 500 - TRI,ITI Focused Equity Fund-Reg(G),13.58,2.51,3.72,0.92,15.65,37.24,43
Nippon India Taiwan Equity Fund-Reg(G),2021-12-11,45690,26.63,1.1,1.86,0.32,22.88,92.84,1.68,0.07,0.12,0.32,0.09,0.37,8,4,4,7,2,4,Taiwan Capitalization Weighted Stock Index,Nippon India Taiwan Equity Fund-Reg(G),15.13,1.11,1.93,0.23,12.0,90.13,8
Union Focused Fund-Reg(G),2019-08-05,22068,14.1,1.86,2.65,0.98,6.33,26.76,0.89,0.12,0.17,0.98,0.03,0.11,21,30,31,26,30,30,BSE 500 - TRI,Union Focused Fund-Reg(G),13.72,2.58,3.79,0.85,17.12,39.52,32
PGIM India Liquid Fund(G),2007-09-04,818,0.07,28.78,15.29,0.0,2.07,-34569.54,0.0,1.81,0.96,0.0,0.01,-137.18,17,18,22,7,32,34,CRISIL Liquid Debt Index,PGIM India Liquid Fund(G),0.09,27.58,17.5,0.0,2.27,-3784.64,36
PGIM India Large and Mid Cap Fund(G),2024-02-12,48543,,,,,,,,,,,,,,,,,,,NIFTY LargeMidcap 250 - TRI,PGIM India Large and Mid Cap Fund(G),14.12,2.62,3.82,0.92,18.12,40.01,26
