MF Code,incept_date,schemecode,sdx_returns,sharpex_returns,sotinox_returns,betax_returns,alphax_returns,treynorx_returns,sdy_returns,sharpey_returns,sotinoy_returns,betay_returns,alphay_returns,treynory_returns,rank_sd,rank_sharpe,rank_sotino,rank_beta,rank_alpha,rank_treynor,index_name,s_name,avg_std_dev,avg_sharpe,avg_sotino,avg_beta,avg_alpha,avg_treyno,no_of_funds_total
WOC Multi Cap Fund-Reg(G),2023-09-22,48199,,,,,,,,,,,,,,,,,,,Nifty500 Multicap 50:25:25 - TRI,WOC Multi Cap Fund-Reg(G),10.94,3.11,4.94,0.81,18.99,41.77,33
SBI International Access-US Equity FoF-Reg(G),2021-03-22,44224,14.29,2.2,3.94,0.28,30.72,111.64,0.9,0.14,0.25,0.28,0.12,0.44,24,2,3,20,9,14,S&P 500 ,SBI International Access-US Equity FoF-Reg(G),15.56,1.15,2.06,0.46,15.97,64.47,56
Mirae Asset Overnight Fund-Reg(G),2019-10-15,44008,0.06,30.91,25.43,0.0,1.97,23222.78,0.0,1.95,1.6,0.0,0.01,92.15,26,25,4,18,7,12,Nifty 1D Rate Index,Mirae Asset Overnight Fund-Reg(G),0.04,127.22,16.16,0.0,1.88,13338.93,32
DSP US Flexible Equity Fund-Reg(G),2012-08-03,17236,12.04,1.58,2.86,0.43,17.61,44.15,0.76,0.1,0.18,0.43,0.07,0.18,11,23,21,33,26,27,Russell 1000 Index,DSP US Flexible Equity Fund-Reg(G),15.56,1.15,2.06,0.46,15.97,64.47,56
Sundaram Dividend Yield Fund(G),2004-10-15,2337,11.13,3.27,5.23,0.9,19.68,40.24,0.7,0.21,0.33,0.9,0.08,0.16,4,4,5,8,8,7,NIFTY 500 - TRI,Sundaram Dividend Yield Fund(G),11.31,3.38,5.51,0.86,22.16,44.17,9
Mahindra Manulife ELSS Tax Saver Fund-Reg(G),2016-10-18,36058,10.25,2.7,4.29,0.89,11.31,31.17,0.65,0.17,0.27,0.89,0.04,0.12,30,44,44,49,51,52,NIFTY 500 - TRI,Mahindra Manulife ELSS Tax Saver Fund-Reg(G),10.76,2.99,4.81,0.81,17.33,40.7,59
Navi US Total Stock Market FoF-Reg(G),2022-02-24,45871,12.18,1.91,3.35,0.27,22.45,86.61,0.77,0.12,0.21,0.27,0.09,0.34,14,11,14,19,19,17,CRSP US Total Market Index,Navi US Total Stock Market FoF-Reg(G),15.56,1.15,2.06,0.46,15.97,64.47,56
SBI FMP-41-1498D-Reg(G),2021-03-25,45439,0.34,5.14,10.22,0.02,1.71,69.63,0.02,0.32,0.64,0.02,0.01,0.28,15,28,29,15,66,18,CRISIL Medium Duration Debt Index,SBI FMP-41-1498D-Reg(G),0.74,5.42,11.05,0.05,3.0,-245.9,92
Kotak Banking & Financial Services Fund-Reg(G),2023-02-27,46629,11.99,1.4,2.3,0.98,-1.39,17.11,0.76,0.09,0.15,0.98,-0.01,0.07,9,12,12,9,12,12,Nifty Financial Services - TRI,Kotak Banking & Financial Services Fund-Reg(G),11.88,1.66,2.76,0.94,2.02,20.65,15
Tata Nifty SDL Plus AAA PSU Bond Dec 2027 60:40 Index Fund-Reg(G),2022-03-30,46351,0.97,3.69,7.22,0.08,3.38,47.58,0.06,0.23,0.46,0.08,0.01,0.19,12,15,16,17,29,16,Nifty SDL Plus AAA PSU Bond Dec 2027 60: 40 Index - TRI,Tata Nifty SDL Plus AAA PSU Bond Dec 2027 60:40 Index Fund-Reg(G),1.31,3.18,6.27,0.13,3.32,30.82,52
Aditya Birla SL Nifty 50 Index Fund-Reg(G),2002-09-18,407,10.11,2.13,3.66,0.98,3.55,22.1,0.64,0.13,0.23,0.98,0.01,0.09,15,71,70,75,72,71,NIFTY 50 - TRI,Aditya Birla SL Nifty 50 Index Fund-Reg(G),12.53,2.87,4.64,0.89,20.19,42.06,91
Edelweiss CRISIL PSU Plus SDL 50:50 Oct 2025 Index Fund-Reg(G),2022-03-10,46448,0.48,8.21,17.99,0.03,3.86,118.39,0.03,0.52,1.13,0.03,0.02,0.47,3,3,3,3,7,3,CRISIL IBX 50:50 PSU + SDL Index - October 2025,Edelweiss CRISIL PSU Plus SDL 50:50 Oct 2025 Index Fund-Reg(G),0.92,4.49,9.12,0.09,3.44,60.43,30
Zerodha Nifty 1D Rate Liquid ETF,2024-01-17,48471,,,,,,,,,,,,,,,,,,,Nifty 1D Rate Index,Zerodha Nifty 1D Rate Liquid ETF,1.24,6.31,10.26,0.23,3.36,841.85,17
Motilal Oswal Large Cap Fund-Reg(G),2024-02-06,48488,,,,,,,,,,,,,,,,,,,NIFTY 100 - TRI,Motilal Oswal Large Cap Fund-Reg(G),10.38,2.81,4.68,0.9,12.74,32.6,36
Kotak Credit Risk Fund(G),2010-05-11,8472,1.26,3.6,7.41,0.03,4.46,166.22,0.08,0.23,0.47,0.03,0.02,0.66,12,10,13,3,6,1,CRISIL Credit Risk Debt Index,Kotak Credit Risk Fund(G),1.34,5.42,14.44,0.05,4.57,-35.88,15
Canara Rob Savings Fund-Reg(G),2005-03-04,535,0.35,12.24,25.02,0.01,4.26,291.14,0.02,0.77,1.58,0.01,0.02,1.16,19,17,13,19,7,18,CRISIL Low Duration Debt Index,Canara Rob Savings Fund-Reg(G),0.33,12.7,25.44,0.01,4.18,449.9,20
HSBC Business Cycles Fund-Reg(G),2014-08-20,29553,12.6,3.21,5.07,0.9,23.91,45.06,0.79,0.2,0.32,0.9,0.09,0.18,33,18,19,32,17,17,NIFTY 500 - TRI,HSBC Business Cycles Fund-Reg(G),11.64,3.2,5.24,0.83,21.91,44.27,44
HDFC Pharma and Healthcare Fund-Reg(G),2023-10-04,48220,,,,,,,,,,,,,,,,,,,S&P BSE Health Care - TRI,HDFC Pharma and Healthcare Fund-Reg(G),11.49,3.67,6.64,0.47,33.72,92.93,11
Mahindra Manulife Business Cycle Fund-Reg(G),2023-09-11,48179,,,,,,,,,,,,,,,,,,,NIFTY 500 - TRI,Mahindra Manulife Business Cycle Fund-Reg(G),11.64,3.2,5.24,0.83,21.91,44.27,44
SBI Nifty Next 50 Index Fund-Reg(G),2021-05-19,45529,13.97,3.67,5.88,0.88,35.15,58.59,0.88,0.23,0.37,0.88,0.14,0.23,68,11,12,38,17,17,NIFTY NEXT 50 - TRI,SBI Nifty Next 50 Index Fund-Reg(G),12.53,2.87,4.64,0.89,20.19,42.06,91
Baroda BNP Paribas Arbitrage Fund-Reg(G),2016-12-28,35820,0.88,5.53,11.78,0.01,4.84,337.43,0.06,0.35,0.74,0.01,0.02,1.34,10,6,1,11,5,10,Nifty 50 Arbitrage,Baroda BNP Paribas Arbitrage Fund-Reg(G),0.9,5.14,10.29,0.01,4.58,-58.4,24
ITI Mid Cap Fund-Reg(G),2021-03-05,45314,14.72,3.73,5.51,0.85,39.19,64.41,0.93,0.24,0.35,0.85,0.16,0.26,28,3,12,28,2,4,Nifty Midcap 150 - TRI,ITI Mid Cap Fund-Reg(G),12.33,3.4,5.29,0.75,28.22,55.85,30
ICICI Pru Long Term Bond Fund(G),1998-07-09,1617,2.48,1.55,2.68,0.3,3.05,12.98,0.16,0.1,0.17,0.3,0.01,0.05,10,11,11,12,15,11,CRISIL Long Duration Debt Index,ICICI Pru Long Term Bond Fund(G),2.65,1.57,2.85,0.5,3.18,16.47,19
Sundaram Equity Savings Fund(G),2002-05-23,2393,4.55,3.39,5.55,0.09,15.2,163.98,0.29,0.21,0.35,0.09,0.06,0.65,22,24,26,14,32,10,NIFTY 50 Equity Savings Index,Sundaram Equity Savings Fund(G),5.85,3.2,5.39,0.16,19.01,135.62,53
DSP Value Fund-Reg(G),2020-12-10,44293,8.82,3.76,6.74,0.61,25.65,54.33,0.56,0.24,0.42,0.61,0.1,0.22,2,3,2,1,5,3,NIFTY 500 - TRI,DSP Value Fund-Reg(G),11.51,3.42,5.51,0.88,23.32,45.03,21
Invesco India Financial Services Fund(G),2008-07-14,5348,11.95,2.35,4.02,0.87,12.05,32.28,0.75,0.15,0.25,0.87,0.05,0.13,7,1,1,2,1,1,Nifty Financial Services - TRI,Invesco India Financial Services Fund(G),11.88,1.66,2.76,0.94,2.02,20.65,15
Axis Childrens Gift Fund-No Lock in-Reg(G),2015-12-08,34004,7.3,1.89,3.05,0.24,13.15,56.62,0.46,0.12,0.19,0.24,0.05,0.22,16,38,38,25,28,32,NIFTY 50 Hybrid Composite Debt 65:35 Index,Axis Childrens Gift Fund-No Lock in-Reg(G),6.98,3.08,5.19,0.22,20.51,117.64,38
Axis Childrens Gift Fund-Compulsory Lock in-Reg(G),2015-12-08,34008,7.3,1.89,3.05,0.24,13.15,56.67,0.46,0.12,0.19,0.24,0.05,0.22,17,37,37,24,29,31,NIFTY 50 Hybrid Composite Debt 65:35 Index,Axis Childrens Gift Fund-Compulsory Lock in-Reg(G),6.98,3.08,5.19,0.22,20.51,117.64,38
Bandhan Financial Services Fund-Reg(G),2023-07-28,47389,,,,,,,,,,,,,,,,,,,Nifty Financial Services - TRI,Bandhan Financial Services Fund-Reg(G),11.88,1.66,2.76,0.94,2.02,20.65,15
HSBC Medium Duration Fund-Reg(G),2015-02-02,31014,1.03,3.96,7.86,0.11,3.78,35.76,0.07,0.25,0.49,0.11,0.02,0.14,20,16,13,21,10,18,NIFTY Medium Duration Debt Index,HSBC Medium Duration Fund-Reg(G),0.92,4.49,9.12,0.09,3.44,60.43,30
Edelweiss Multi Asset Allocation Fund-Reg(G),2023-06-23,47994,,,,,,,,,,,,,,,,,,,CRISIL Short Term Bond Index,Edelweiss Multi Asset Allocation Fund-Reg(G),6.99,3.42,5.88,0.28,23.32,137.37,13
Mirae Asset Nifty SDL Jun 2027 Index Fund-Reg(G),2022-03-30,46134,0.99,3.93,7.81,0.07,3.7,55.64,0.06,0.25,0.49,0.07,0.01,0.22,16,13,13,14,9,13,Nifty SDL Jun 2027 Index,Mirae Asset Nifty SDL Jun 2027 Index Fund-Reg(G),1.31,3.18,6.27,0.13,3.32,30.82,52
Aditya Birla SL Gold ETF,2011-05-13,13056,10.29,1.47,2.69,0.3,14.49,50.7,0.65,0.09,0.17,0.3,0.06,0.2,4,6,6,11,16,12,Gold-India,Aditya Birla SL Gold ETF,15.05,1.28,2.32,0.67,16.56,41.09,21
Nippon India Hybrid Bond Fund(G),2004-01-12,2649,1.35,4.61,9.08,0.06,6.07,108.86,0.08,0.29,0.57,0.06,0.02,0.43,1,3,2,2,17,4,CRISIL Hybrid 85+15 - Conservative Index,Nippon India Hybrid Bond Fund(G),2.68,3.55,6.44,0.13,9.04,83.65,19
HDFC Income Fund(G),2000-09-11,1281,2.12,1.64,2.82,0.25,2.8,13.86,0.13,0.1,0.18,0.25,0.01,0.06,52,48,48,52,46,49,CRISIL Medium to Long Term Debt Index,HDFC Income Fund(G),1.31,3.18,6.27,0.13,3.32,30.82,52
Sundaram Overnight Fund-Reg(G),2019-03-20,42000,0.01,191.85,12.9,0.0,1.69,19261.54,0.0,12.09,0.81,0.0,0.01,76.43,11,8,18,4,26,14,Nifty 1D Rate Index,Sundaram Overnight Fund-Reg(G),0.04,127.22,16.16,0.0,1.88,13338.93,32
Nippon India Consumption Fund(G),2004-09-30,2644,9.33,3.67,6.11,0.62,22.81,55.14,0.59,0.23,0.38,0.62,0.09,0.22,3,2,2,5,3,2,Nifty India Consumption - TRI,Nippon India Consumption Fund(G),9.73,3.08,5.09,0.64,17.74,45.61,13
LIC MF S&P BSE Sensex ETF,2015-11-30,33579,10.25,1.86,3.19,1.0,1.64,19.08,0.65,0.12,0.2,1.0,0.01,0.08,42,98,100,108,106,103,S&P BSE SENSEX - TRI,LIC MF S&P BSE Sensex ETF,13.05,2.43,4.12,0.85,16.78,54.35,129
Tata Gilt Securities Fund-Reg(G),1999-09-04,3230,2.27,1.52,2.46,0.26,2.75,13.31,0.14,0.1,0.16,0.26,0.01,0.05,23,33,34,26,32,33,CRISIL Dynamic Gilt Index,Tata Gilt Securities Fund-Reg(G),1.98,2.2,4.08,0.22,3.38,20.1,35
LIC MF Nifty 50 ETF,2015-11-20,33580,10.15,2.15,3.69,0.98,4.71,22.23,0.64,0.14,0.23,0.98,0.02,0.09,26,88,89,95,94,93,NIFTY 50 - TRI,LIC MF Nifty 50 ETF,13.05,2.43,4.12,0.85,16.78,54.35,129
Samco Active Momentum Fund-Reg(G),2023-07-05,47753,,,,,,,,,,,,,,,,,,,NIFTY 500 - TRI,Samco Active Momentum Fund-Reg(G),11.64,3.2,5.24,0.83,21.91,44.27,44
Sundaram Corp Bond Fund(G),2004-12-30,2955,0.8,4.86,9.34,0.09,3.63,44.35,0.05,0.31,0.59,0.09,0.01,0.18,16,15,15,19,11,19,NIFTY Corporate Bond Index,Sundaram Corp Bond Fund(G),0.74,5.41,10.34,0.07,3.7,65.9,21
Edelweiss Focused Fund-Reg(G),2022-08-01,46055,10.34,3.04,5.18,0.91,14.64,34.55,0.65,0.19,0.33,0.91,0.06,0.14,24,19,13,35,25,27,NIFTY 500 - TRI,Edelweiss Focused Fund-Reg(G),10.67,3.04,4.92,0.83,17.02,38.61,41
HDFC Nifty G-Sec Jun 2027 Index Fund-Reg(G),2022-12-09,46618,1.23,2.91,5.35,0.15,3.18,24.34,0.08,0.18,0.34,0.15,0.01,0.1,7,6,6,8,21,6,Nifty G-Sec Jun 2027 Index,HDFC Nifty G-Sec Jun 2027 Index Fund-Reg(G),1.98,2.2,4.08,0.22,3.38,20.1,35
Union Large & Midcap Fund-Reg(G),2019-12-06,44300,10.35,2.98,4.5,0.79,16.3,39.14,0.65,0.19,0.28,0.79,0.06,0.16,7,20,21,6,19,17,NIFTY LargeMidcap 250 - TRI,Union Large & Midcap Fund-Reg(G),11.1,3.22,5.06,0.82,20.51,43.16,26
Mahindra Manulife Balanced Advantage Fund-Reg(G),2021-12-30,45993,8.21,3.02,4.71,0.19,24.29,131.14,0.52,0.19,0.3,0.19,0.1,0.52,21,19,22,13,4,9,NIFTY 50 Hybrid Composite Debt 50:50 Index,Mahindra Manulife Balanced Advantage Fund-Reg(G),6.63,3.2,5.31,0.18,20.36,115.89,26
Aditya Birla SL Special Opp Fund-Reg(G),2020-10-23,45096,11.18,3.17,5.02,0.9,18.82,39.34,0.7,0.2,0.32,0.9,0.07,0.16,27,20,21,33,24,25,S&P BSE 500 - TRI,Aditya Birla SL Special Opp Fund-Reg(G),11.64,3.2,5.24,0.83,21.91,44.27,44
Invesco India Balanced Advantage Fund(G),2007-10-04,2171,6.36,3.41,5.83,0.24,21.07,92.18,0.4,0.21,0.37,0.24,0.08,0.37,15,8,8,23,8,20,NIFTY 50 Hybrid Composite Debt 50:50 Index,Invesco India Balanced Advantage Fund(G),6.63,3.2,5.31,0.18,20.36,115.89,26
Franklin India Corp Debt Fund-A(G),1997-06-23,3381,0.5,7.29,15.99,0.04,3.53,82.98,0.03,0.46,1.01,0.04,0.01,0.33,2,3,1,2,13,3,NIFTY Corporate Bond Index,Franklin India Corp Debt Fund-A(G),0.74,5.41,10.34,0.07,3.7,65.9,21
ICICI Pru Retirement Fund-Pure Equity Plan(G),2019-02-27,25667,13.12,3.59,5.56,0.2,46.54,232.82,0.83,0.23,0.35,0.2,0.18,0.92,38,8,12,17,1,4,NIFTY 500 - TRI,ICICI Pru Retirement Fund-Pure Equity Plan(G),6.98,3.08,5.19,0.22,20.51,117.64,38
Bank of India Mid & Small Cap Equity & Debt Fund-Reg(G),2016-07-20,32972,11.06,3.58,5.41,0.12,39.24,318.0,0.7,0.23,0.34,0.12,0.16,1.26,54,19,28,22,2,4,Nifty MidSmallcap 400 - TRI,Bank of India Mid & Small Cap Equity & Debt Fund-Reg(G),5.85,3.2,5.39,0.16,19.01,135.62,53
HDFC NIFTY G-Sec Jun 2036 Index Fund-Reg(G),2023-03-15,47714,3.06,1.34,2.27,0.35,3.12,11.59,0.19,0.08,0.14,0.35,0.01,0.05,14,12,12,14,14,13,Nifty G-Sec Jun 2036 Index,HDFC NIFTY G-Sec Jun 2036 Index Fund-Reg(G),2.65,1.57,2.85,0.5,3.18,16.47,19
360 ONE Liquid Fund-Reg(G),2013-11-13,15687,0.16,18.79,23.85,0.0,2.95,6175.61,0.01,1.18,1.5,0.0,0.01,24.51,34,30,2,31,3,17,CRISIL Liquid Debt Index,360 ONE Liquid Fund-Reg(G),0.09,27.19,17.19,0.0,2.23,2407.77,36
Samco Flexi Cap Fund-Reg(G),2022-02-04,46217,11.1,1.89,3.18,0.7,8.09,29.99,0.7,0.12,0.2,0.7,0.03,0.12,31,40,39,2,37,36,NIFTY 500 - TRI,Samco Flexi Cap Fund-Reg(G),10.67,3.04,4.92,0.83,17.02,38.61,41
SBI Nifty Smallcap 250 Index Fund-Reg(G),2022-10-03,46937,15.7,3.08,4.32,0.85,32.68,57.05,0.99,0.19,0.27,0.85,0.13,0.23,82,44,59,24,29,27,Nifty Smallcap 250 - TRI,SBI Nifty Smallcap 250 Index Fund-Reg(G),12.53,2.87,4.64,0.89,20.19,42.06,91
360 ONE Dynamic Bond Fund-Reg(G),2013-06-24,17578,1.56,2.65,4.81,0.16,3.7,26.61,0.1,0.17,0.3,0.16,0.01,0.11,7,5,5,8,8,7,CRISIL Dynamic Bond Index,360 ONE Dynamic Bond Fund-Reg(G),1.71,2.86,5.38,0.17,3.45,198.99,22
Bandhan Innovation Fund-Reg(G),2024-04-30,48656,,,,,,,,,,,,,,,,,,,NIFTY 500 - TRI,Bandhan Innovation Fund-Reg(G),11.64,3.2,5.24,0.83,21.91,44.27,44
Mirae Asset Equity Allocator FoF-Reg(G),2020-09-21,45064,10.04,2.99,4.84,0.27,29.31,111.26,0.63,0.19,0.3,0.27,0.12,0.44,41,35,38,42,10,23,NIFTY 200 - TRI,Mirae Asset Equity Allocator FoF-Reg(G),7.57,3.08,5.37,0.27,19.97,112.01,53
Axis NIFTY 50 ETF,2017-07-03,33980,10.09,2.17,3.75,0.98,5.32,22.43,0.64,0.14,0.24,0.98,0.02,0.09,14,74,75,85,80,80,NIFTY 50 - TRI,Axis NIFTY 50 ETF,13.05,2.43,4.12,0.85,16.78,54.35,129
Tata NIFTY 50 Index Fund-Reg(G),2003-02-25,3247,10.09,2.12,3.65,0.97,3.45,22.0,0.64,0.13,0.23,0.97,0.01,0.09,10,77,75,69,75,77,NIFTY 50 - TRI,Tata NIFTY 50 Index Fund-Reg(G),12.53,2.87,4.64,0.89,20.19,42.06,91
Aditya Birla SL Pharma & Healthcare Fund-Reg(G),2019-07-10,37591,11.36,3.95,7.32,0.43,37.04,104.88,0.72,0.25,0.46,0.43,0.15,0.42,6,2,3,3,2,1,S&P BSE Health Care - TRI,Aditya Birla SL Pharma & Healthcare Fund-Reg(G),11.49,3.67,6.64,0.47,33.72,92.93,11
Bandhan Hybrid Equity Fund-Reg(G),2016-12-30,34066,7.35,2.83,4.6,0.23,20.16,88.6,0.46,0.18,0.29,0.23,0.08,0.35,33,42,41,48,24,45,S&P BSE 200 - TRI,Bandhan Hybrid Equity Fund-Reg(G),5.85,3.2,5.39,0.16,19.01,135.62,53
Motilal Oswal Nifty Smallcap 250 Index Fund-Reg(G),2019-09-06,43811,15.7,3.08,4.33,0.85,32.76,57.1,0.99,0.19,0.27,0.85,0.13,0.23,84,43,58,25,27,26,Nifty Smallcap 250 - TRI,Motilal Oswal Nifty Smallcap 250 Index Fund-Reg(G),12.53,2.87,4.64,0.89,20.19,42.06,91
Kotak Quant Fund-Reg(G),2023-08-02,48083,,,,,,,,,,,,,,,,,,,NIFTY 200 - TRI,Kotak Quant Fund-Reg(G),11.64,3.2,5.24,0.83,21.91,44.27,44
PGIM India ELSS Tax Saver Fund-Reg(G),2015-12-11,26780,9.47,1.97,3.08,0.81,3.81,23.16,0.6,0.12,0.19,0.81,0.02,0.09,6,59,59,26,57,57,NIFTY 500 - TRI,PGIM India ELSS Tax Saver Fund-Reg(G),10.76,2.99,4.81,0.81,17.33,40.7,59
Mirae Asset Nifty Midcap 150 ETF,2022-03-09,46105,13.42,3.44,5.06,0.84,31.9,54.96,0.85,0.22,0.32,0.84,0.13,0.22,87,24,40,42,29,32,Nifty Midcap 150 - TRI,Mirae Asset Nifty Midcap 150 ETF,13.05,2.43,4.12,0.85,16.78,54.35,129
HDFC Dynamic Debt Fund(G),1997-04-28,1274,1.63,2.57,4.51,0.18,3.68,22.76,0.1,0.16,0.28,0.18,0.01,0.09,9,6,6,12,9,11,NIFTY Composite Debt Index,HDFC Dynamic Debt Fund(G),1.71,2.86,5.38,0.17,3.45,198.99,22
Aditya Birla SL ESG Integration Strategy Fund-Reg(G),2020-12-24,44736,9.96,2.33,3.94,0.84,7.76,27.69,0.63,0.15,0.25,0.84,0.03,0.11,18,41,40,25,43,43,NIFTY100 ESG - TRI,Aditya Birla SL ESG Integration Strategy Fund-Reg(G),11.64,3.2,5.24,0.83,21.91,44.27,44
Baroda BNP Paribas Overnight Fund-Reg(G),2019-04-25,43376,0.01,193.41,12.95,0.0,1.71,33995.1,0.0,12.18,0.82,0.0,0.01,134.9,9,7,15,5,16,2,CRISIL Liquid Overnight Index,Baroda BNP Paribas Overnight Fund-Reg(G),0.04,127.22,16.16,0.0,1.88,13338.93,32
Aditya Birla SL CRISIL IBX Gilt Apr 2029 Index Fund-Reg(G),2022-10-19,46950,1.75,2.18,3.87,0.2,3.28,19.33,0.11,0.14,0.24,0.2,0.01,0.08,12,12,14,12,17,13,CRISIL IBX Gilt Index - April 2029,Aditya Birla SL CRISIL IBX Gilt Apr 2029 Index Fund-Reg(G),1.98,2.2,4.08,0.22,3.38,20.1,35
JM Value Fund(G),1997-06-02,1849,13.78,3.71,5.59,0.91,34.35,56.35,0.87,0.23,0.35,0.91,0.14,0.22,19,4,9,13,2,2,S&P BSE 500 - TRI,JM Value Fund(G),11.51,3.42,5.51,0.88,23.32,45.03,21
360 ONE Balanced Hybrid Fund-Reg(G),2023-09-25,48144,,,,,,,,,,,,,,,,,,,NIFTY 50 Hybrid Composite Debt 50:50 Index,360 ONE Balanced Hybrid Fund-Reg(G),5.85,3.2,5.39,0.16,19.01,135.62,53
Invesco India Ultra Short Duration Fund(G),2010-12-30,13460,0.37,11.96,31.53,0.0,4.38,5074.78,0.02,0.75,1.99,0.0,0.02,20.14,24,24,1,18,9,9,NIFTY Ultra Short Duration Debt Index,Invesco India Ultra Short Duration Fund(G),0.29,14.07,29.51,0.0,4.11,661.59,24
HDFC Non-Cyclical Consumer Fund-Reg(G),2023-07-12,46357,,,,,,,,,,,,,,,,,,,Nifty India Consumption - TRI,HDFC Non-Cyclical Consumer Fund-Reg(G),9.73,3.08,5.09,0.64,17.74,45.61,13
Nippon India US Equity Opp Fund(G),2015-07-23,19246,13.31,1.84,3.29,0.24,20.59,103.02,0.84,0.12,0.21,0.24,0.08,0.41,3,3,3,1,3,1,S&P 500 - TRI,Nippon India US Equity Opp Fund(G),15.5,1.17,2.06,0.37,11.29,57.37,8
Franklin India NSE Nifty 50 Index Fund(G),2000-08-04,942,10.06,2.11,3.62,0.97,3.33,21.87,0.63,0.13,0.23,0.97,0.01,0.09,5,79,78,64,79,79,NIFTY 50,Franklin India NSE Nifty 50 Index Fund(G),12.53,2.87,4.64,0.89,20.19,42.06,91
Nippon India Index Fund-S&P BSE Sensex Plan(G),2010-09-28,12865,10.22,1.83,3.14,0.99,0.3,18.75,0.64,0.12,0.2,0.99,0.0,0.07,28,85,85,83,85,85,S&P BSE SENSEX - TRI,Nippon India Index Fund-S&P BSE Sensex Plan(G),12.53,2.87,4.64,0.89,20.19,42.06,91
SBI FMP-91-90D-Reg(G),2023-12-29,48431,,,,,,,,,,,,,,,,,,,CRISIL Liquid Debt Index,SBI FMP-91-90D-Reg(G),0.74,5.42,11.05,0.05,3.0,-245.9,92
Mirae Asset S&P 500 Top 50 ETF,2021-09-21,45835,13.45,2.1,3.79,0.08,28.1,350.0,0.85,0.13,0.24,0.08,0.11,1.39,89,89,74,2,45,2,S&P 500 Top 50 TRI,Mirae Asset S&P 500 Top 50 ETF,13.05,2.43,4.12,0.85,16.78,54.35,129
Quant PSU Fund-Reg(G),2024-02-20,48341,,,,,,,,,,,,,,,,,,,S&P BSE PSU - TRI,Quant PSU Fund-Reg(G),11.64,3.2,5.24,0.83,21.91,44.27,44
Quant Manufacturing Fund-Reg(G),2023-08-14,48120,,,,,,,,,,,,,,,,,,,Nifty India Manufacturing - TRI,Quant Manufacturing Fund-Reg(G),11.64,3.2,5.24,0.83,21.91,44.27,44
UTI Innovation Fund-Reg(G),2023-10-13,48238,,,,,,,,,,,,,,,,,,,NIFTY 500 - TRI,UTI Innovation Fund-Reg(G),11.64,3.2,5.24,0.83,21.91,44.27,44
Union Innovation & Opp Fund-Reg(G),2023-09-06,45727,,,,,,,,,,,,,,,,,,,NIFTY 500 - TRI,Union Innovation & Opp Fund-Reg(G),11.64,3.2,5.24,0.83,21.91,44.27,44
Nippon India Nifty 50 Value 20 Index Fund-Reg(G),2021-02-19,45289,11.39,2.53,4.73,0.91,12.0,31.65,0.72,0.16,0.3,0.91,0.05,0.13,44,62,44,51,60,60,Nifty50 Value 20 - TRI,Nippon India Nifty 50 Value 20 Index Fund-Reg(G),12.53,2.87,4.64,0.89,20.19,42.06,91
Nippon India Nifty Pharma ETF,2021-07-06,45584,13.53,3.29,6.25,0.48,36.34,92.43,0.85,0.21,0.39,0.48,0.14,0.37,91,38,8,11,22,8,NIFTY PHARMA - TRI,Nippon India Nifty Pharma ETF,13.05,2.43,4.12,0.85,16.78,54.35,129
UTI Gilt Fund-Reg(G),2002-01-21,3560,2.2,1.98,3.4,0.23,3.73,18.77,0.14,0.12,0.21,0.23,0.01,0.07,17,15,18,16,9,14,CRISIL Dynamic Gilt Index,UTI Gilt Fund-Reg(G),1.98,2.2,4.08,0.22,3.38,20.1,35
Kotak Nifty 50 Index Fund-Reg(G),2021-06-21,45556,10.11,2.13,3.65,0.97,3.43,22.05,0.64,0.13,0.23,0.97,0.01,0.09,16,75,74,68,77,74,NIFTY 50 - TRI,Kotak Nifty 50 Index Fund-Reg(G),12.53,2.87,4.64,0.89,20.19,42.06,91
DSP FMP 267-1246D-Reg(G),2022-11-14,47071,0.93,4.12,8.51,0.09,3.6,44.58,0.06,0.26,0.54,0.09,0.01,0.18,78,47,44,73,41,36,CRISIL Medium Duration Debt Index,DSP FMP 267-1246D-Reg(G),0.74,5.42,11.05,0.05,3.0,-245.9,92
Tata Nifty 50 ETF,2019-01-01,41017,10.15,2.16,3.7,0.98,4.79,22.3,0.64,0.14,0.23,0.98,0.02,0.09,27,87,88,96,93,92,NIFTY 50 - TRI,Tata Nifty 50 ETF,13.05,2.43,4.12,0.85,16.78,54.35,129
Franklin India Banking & PSU Debt Fund(G),2014-04-25,28458,0.53,7.46,15.88,0.04,3.81,92.81,0.03,0.47,1.0,0.04,0.02,0.37,2,2,2,4,8,3,NIFTY Banking and PSU Debt Index,Franklin India Banking & PSU Debt Fund(G),0.74,5.41,10.61,0.07,3.62,-186.51,26
SBI FMP-66-1361D-Reg(G),2022-07-19,46633,0.55,3.21,6.64,0.04,1.71,48.66,0.03,0.2,0.42,0.04,0.01,0.19,25,61,61,30,67,26,CRISIL Medium Duration Debt Index,SBI FMP-66-1361D-Reg(G),0.74,5.42,11.05,0.05,3.0,-245.9,92
Baroda BNP Paribas Focused Fund-Reg(G),2017-10-06,32452,12.9,2.64,4.12,0.94,16.63,36.11,0.81,0.17,0.26,0.94,0.07,0.14,39,35,34,40,20,24,NIFTY 500 - TRI,Baroda BNP Paribas Focused Fund-Reg(G),10.67,3.04,4.92,0.83,17.02,38.61,41
Axis FTP-118-100D-Reg(G),2023-12-05,48251,,,,,,,,,,,,,,,,,,,CRISIL Ultra Short Term Debt Index,Axis FTP-118-100D-Reg(G),0.74,5.42,11.05,0.05,3.0,-245.9,92
HDFC Nifty G-Sec Jul 2031 Index Fund-Reg(G),2022-11-10,46620,2.24,1.69,2.86,0.25,3.1,14.94,0.14,0.11,0.18,0.25,0.01,0.06,21,28,31,23,27,28,Nifty G-Sec July 2031 Index,HDFC Nifty G-Sec Jul 2031 Index Fund-Reg(G),1.98,2.2,4.08,0.22,3.38,20.1,35
Bandhan Nifty100 Low Volatility 30 Index Fund-Reg(G),2022-10-06,46607,9.45,2.8,4.65,0.75,12.68,35.36,0.6,0.18,0.29,0.75,0.05,0.14,2,57,48,6,59,52,Nifty100 Low Volatility 30 - TRI,Bandhan Nifty100 Low Volatility 30 Index Fund-Reg(G),12.53,2.87,4.64,0.89,20.19,42.06,91
UTI India Consumer Fund-Reg(G),2007-07-30,3581,9.67,3.05,5.2,0.68,16.93,43.24,0.61,0.19,0.33,0.68,0.07,0.17,7,8,6,10,9,10,Nifty India Consumption - TRI,UTI India Consumer Fund-Reg(G),9.73,3.08,5.09,0.64,17.74,45.61,13
DSP Banking & Financial Services Fund-Reg(G),2023-12-08,48350,,,,,,,,,,,,,,,,,,,Nifty Financial Services - TRI,DSP Banking & Financial Services Fund-Reg(G),11.88,1.66,2.76,0.94,2.02,20.65,15
Quantum Liquid Fund-Reg(G),2006-04-07,19756,0.06,33.76,13.89,0.0,1.86,6073.45,0.0,2.13,0.87,0.0,0.01,24.1,3,5,35,27,35,18,CRISIL Liquid Debt Index,Quantum Liquid Fund-Reg(G),0.09,27.19,17.19,0.0,2.23,2407.77,36
Canara Rob Infrastructure Fund-Reg(G),2005-12-02,547,14.1,3.96,6.58,0.87,39.66,63.96,0.89,0.25,0.41,0.87,0.16,0.25,11,9,5,8,8,9,S&P BSE India Infrastructure Index - TRI,Canara Rob Infrastructure Fund-Reg(G),14.0,3.92,6.17,0.88,38.4,62.59,19
SBI Magnum Comma Fund-Reg(G),2005-08-08,2750,15.98,2.57,4.0,0.93,23.91,44.28,1.01,0.16,0.25,0.93,0.09,0.18,39,38,39,36,16,19,NIFTY COMMODITIES - TRI,SBI Magnum Comma Fund-Reg(G),11.64,3.2,5.24,0.83,21.91,44.27,44
Mirae Asset Low Duration Fund-Reg Savings Plan(G),2008-03-05,4609,0.33,12.53,25.36,0.01,4.06,347.71,0.02,0.79,1.6,0.01,0.02,1.38,6,11,10,11,14,13,NIFTY Low Duration Debt Index,Mirae Asset Low Duration Fund-Reg Savings Plan(G),0.33,12.7,25.44,0.01,4.18,449.9,20
Baroda BNP Paribas Conservative Hybrid Fund-Reg(G),2004-09-23,210,2.47,3.83,6.65,0.12,9.1,77.21,0.16,0.24,0.42,0.12,0.04,0.31,5,8,8,9,11,10,CRISIL Hybrid 85+15 - Conservative Index,Baroda BNP Paribas Conservative Hybrid Fund-Reg(G),2.68,3.55,6.44,0.13,9.04,83.65,19
Union Aggressive Hybrid Fund-Reg(G),2020-12-18,44512,7.67,2.98,4.7,0.19,22.35,122.42,0.48,0.19,0.3,0.19,0.09,0.49,41,38,39,33,17,21,CRISIL Hybrid 35+65 - Aggressive Index,Union Aggressive Hybrid Fund-Reg(G),5.85,3.2,5.39,0.16,19.01,135.62,53
Tata Resources & Energy Fund-Reg(G),2015-12-28,33731,15.46,2.52,3.91,0.99,20.66,39.26,0.97,0.16,0.25,0.99,0.08,0.16,2,3,3,3,3,3,NIFTY COMMODITIES - TRI,Tata Resources & Energy Fund-Reg(G),14.92,3.4,5.59,0.9,33.16,55.05,3
Samco Dynamic Asset Allocation Fund-Reg(G),2023-12-28,48331,,,,,,,,,,,,,,,,,,,NIFTY 50 Hybrid Composite Debt 50:50 Index,Samco Dynamic Asset Allocation Fund-Reg(G),6.63,3.2,5.31,0.18,20.36,115.89,26
Parag Parikh Arbitrage Fund-Reg(G),2023-11-02,48215,,,,,,,,,,,,,,,,,,,Nifty 50 Arbitrage - TRI,Parag Parikh Arbitrage Fund-Reg(G),0.9,5.14,10.29,0.01,4.58,-58.4,24
PGIM India Large Cap Fund(G),2003-01-30,758,9.28,2.1,3.55,0.87,3.55,22.55,0.58,0.13,0.22,0.87,0.01,0.09,3,33,34,7,36,35,NIFTY 100 - TRI,PGIM India Large Cap Fund(G),10.38,2.81,4.68,0.9,12.74,32.6,36
HDFC MNC Fund-Reg(G),2023-03-09,47648,9.69,2.65,4.38,0.58,14.97,44.18,0.61,0.17,0.28,0.58,0.06,0.18,5,4,4,4,4,4,NIFTY MNC - TRI,HDFC MNC Fund-Reg(G),9.15,2.83,4.59,0.56,15.67,45.92,5
HSBC Credit Risk Fund-Reg(G),2009-10-08,8016,0.52,7.05,13.95,0.04,3.58,99.89,0.03,0.44,0.88,0.04,0.01,0.4,2,5,9,6,13,5,NIFTY Credit Risk Bond Index,HSBC Credit Risk Fund-Reg(G),1.34,5.42,14.44,0.05,4.57,-35.88,15
UTI Dynamic Bond Fund-Reg(G),2010-06-23,11896,1.83,2.2,3.7,0.19,3.5,21.27,0.12,0.14,0.23,0.19,0.01,0.08,13,14,17,16,12,15,CRISIL Dynamic Bond Index,UTI Dynamic Bond Fund-Reg(G),1.71,2.86,5.38,0.17,3.45,198.99,22
Nippon India Nifty G-Sec Jun 2036 Maturity Index Fund-Reg(G),2022-12-19,47190,2.99,1.35,2.3,0.35,3.1,11.57,0.19,0.09,0.15,0.35,0.01,0.05,34,35,35,35,26,35,Nifty G-Sec Jun 2036 Index,Nippon India Nifty G-Sec Jun 2036 Maturity Index Fund-Reg(G),1.98,2.2,4.08,0.22,3.38,20.1,35
Motilal Oswal Nifty Bank Index Fund-Reg(G),2019-09-06,43789,12.76,0.7,1.18,1.05,-10.51,8.47,0.8,0.04,0.07,1.05,-0.04,0.03,48,90,90,88,90,90,NIFTY BANK - TRI,Motilal Oswal Nifty Bank Index Fund-Reg(G),12.53,2.87,4.64,0.89,20.19,42.06,91
Tata Housing Opportunities Fund-Reg(G),2022-09-02,46764,11.54,2.76,4.51,0.81,16.83,39.19,0.73,0.17,0.28,0.81,0.07,0.16,31,29,31,20,29,26,Nifty Housing - TRI,Tata Housing Opportunities Fund-Reg(G),11.64,3.2,5.24,0.83,21.91,44.27,44
Axis Global Innovation FoF-Reg(G),2021-05-28,45539,14.18,1.56,2.73,0.51,20.61,43.17,0.89,0.1,0.17,0.51,0.08,0.17,23,25,26,39,20,29,MSCI ACWI Net TRI,Axis Global Innovation FoF-Reg(G),15.56,1.15,2.06,0.46,15.97,64.47,56
HDFC Nifty G-Sec Sep 2032 Index Fund-Reg(G),2022-12-09,46872,2.32,1.68,2.96,0.29,3.1,13.48,0.15,0.11,0.19,0.29,0.01,0.05,26,30,30,31,25,32,Nifty G-Sec Sep 2032 Index,HDFC Nifty G-Sec Sep 2032 Index Fund-Reg(G),1.98,2.2,4.08,0.22,3.38,20.1,35
Mahindra Manulife Low Duration Fund-Reg(G),2017-02-15,36894,0.33,12.48,24.6,0.01,4.03,334.53,0.02,0.79,1.55,0.01,0.02,1.33,8,14,17,13,15,14,CRISIL Low Duration Debt Index,Mahindra Manulife Low Duration Fund-Reg(G),0.33,12.7,25.44,0.01,4.18,449.9,20
Motilal Oswal Liquid Fund-Reg(G),2018-12-19,41872,0.15,18.12,22.63,0.0,2.72,3217.69,0.01,1.14,1.43,0.0,0.01,12.77,33,36,8,35,7,25,CRISIL Liquid Debt Index,Motilal Oswal Liquid Fund-Reg(G),0.09,27.19,17.19,0.0,2.23,2407.77,36
