MF Code,incept_date,schemecode,sdx_returns,sharpex_returns,sotinox_returns,betax_returns,alphax_returns,treynorx_returns,sdy_returns,sharpey_returns,sotinoy_returns,betay_returns,alphay_returns,treynory_returns,rank_sd,rank_sharpe,rank_sotino,rank_beta,rank_alpha,rank_treynor,index_name,s_name,avg_std_dev,avg_sharpe,avg_sotino,avg_beta,avg_alpha,avg_treyno,no_of_funds_total
Invesco India Focused Fund-Reg(G),2020-09-29,45058,15.35,3.34,5.13,0.89,35.1,57.76,0.97,0.21,0.32,0.89,0.14,0.23,32,1,1,14,1,1,BSE 500 - TRI,Invesco India Focused Fund-Reg(G),14.39,2.16,3.2,0.94,13.96,33.2,45
SBI Nifty Next 50 ETF,2015-03-20,30248,19.14,2.54,3.71,1.13,29.94,43.02,1.21,0.16,0.23,1.13,0.12,0.17,106,31,40,117,16,32,NIFTY NEXT 50 - TRI,SBI Nifty Next 50 ETF,16.29,1.83,2.98,1.08,13.44,15.21,136
Tata Flexi Cap Fund-Reg(G),2018-09-06,39283,12.67,2.06,3.0,0.83,10.89,31.3,0.8,0.13,0.19,0.83,0.04,0.12,9,28,28,7,29,25,NIFTY 500 - TRI,Tata Flexi Cap Fund-Reg(G),14.39,2.16,3.2,0.94,13.96,33.2,45
UTI Balanced Advantage Fund-Reg(G),2023-08-10,48102,6.69,2.24,3.59,1.18,11.57,12.7,0.42,0.14,0.23,1.18,0.05,0.05,6,14,7,7,22,16,NIFTY 50 Hybrid Composite Debt 50:50 Index,UTI Balanced Advantage Fund-Reg(G),8.7,2.16,3.2,1.49,14.18,13.05,27
Edelweiss Nifty PSU Bond Plus SDL Apr 2027 50:50 Index Fund-Reg(G),2021-10-14,45387,0.69,5.35,9.67,0.21,3.07,17.74,0.04,0.34,0.61,0.21,0.01,0.07,4,6,9,6,19,6,Nifty PSU Bond Plus SDL Apr 2027 50:50 Index,Edelweiss Nifty PSU Bond Plus SDL Apr 2027 50:50 Index Fund-Reg(G),1.24,3.76,7.28,0.49,2.77,11.01,52
Invesco India ELSS Tax Saver Fund(G),2006-12-29,2270,13.53,2.47,3.59,0.89,17.26,37.7,0.85,0.16,0.23,0.89,0.07,0.15,21,7,12,24,12,12,BSE 500 - TRI,Invesco India ELSS Tax Saver Fund(G),14.34,2.1,3.13,0.91,13.54,33.36,59
ICICI Pru Bond Fund(G),2008-08-18,6197,1.79,2.67,4.41,0.89,2.14,5.34,0.11,0.17,0.28,0.89,0.01,0.02,42,42,42,44,44,43,CRISIL Medium to Long Term Debt Index,ICICI Pru Bond Fund(G),1.24,3.76,7.28,0.49,2.77,11.01,52
DSP Healthcare Fund-Reg(G),2018-11-30,36002,11.94,3.59,6.61,0.4,36.11,108.11,0.75,0.23,0.42,0.4,0.14,0.43,4,3,3,1,2,1,BSE Health Care - TRI,DSP Healthcare Fund-Reg(G),12.79,3.25,5.93,0.46,32.72,89.59,12
UTI Short Duration Fund-Reg(G),2007-09-18,3656,0.69,5.49,10.36,0.27,3.0,14.16,0.04,0.35,0.65,0.27,0.01,0.06,8,4,1,4,3,1,CRISIL Short Duration Debt Index,UTI Short Duration Fund-Reg(G),0.71,4.61,8.37,0.29,2.33,-328.98,25
UTI Focused Fund-Reg(G),2021-08-25,45685,12.35,2.33,3.69,0.84,13.41,34.15,0.78,0.15,0.23,0.84,0.05,0.14,5,15,10,8,20,18,NIFTY 500 - TRI,UTI Focused Fund-Reg(G),14.39,2.16,3.2,0.94,13.96,33.2,45
ICICI Pru Nifty Bank ETF,2019-07-10,32451,16.94,0.62,0.92,1.11,-8.09,9.42,1.07,0.04,0.06,1.11,-0.03,0.04,87,124,124,108,125,122,NIFTY BANK - TRI,ICICI Pru Nifty Bank ETF,16.29,1.83,2.98,1.08,13.44,15.21,136
Kotak Nifty SDL Apr 2032 Top 12 Equal Weight Index Fund-Reg(G),2022-02-11,46390,2.01,2.3,4.5,0.75,2.44,6.2,0.13,0.15,0.28,0.75,0.01,0.02,6,11,6,4,12,4,Nifty SDL Apr 2032 Top 12 Equal Weight Index,Kotak Nifty SDL Apr 2032 Top 12 Equal Weight Index Fund-Reg(G),2.51,2.38,4.14,1.2,2.45,5.25,19
Tata Business Cycle Fund-Reg(G),2021-08-04,45373,14.89,2.27,3.2,0.98,15.95,34.5,0.94,0.14,0.2,0.98,0.06,0.14,28,25,32,37,27,32,NIFTY 500 - TRI,Tata Business Cycle Fund-Reg(G),15.66,2.27,3.42,0.91,17.47,37.03,52
Sundaram Multi Cap Fund(G),2000-10-25,2370,13.59,2.28,3.31,0.88,14.97,35.28,0.86,0.14,0.21,0.88,0.06,0.14,11,16,18,10,19,17,Nifty500 Multicap 50:25:25 - TRI,Sundaram Multi Cap Fund(G),14.46,2.19,3.24,0.87,14.86,34.59,34
DSP Ultra Short Fund-Reg(G),2006-07-31,702,0.32,9.06,20.78,0.01,2.85,414.89,0.02,0.57,1.31,0.01,0.01,1.65,22,20,14,2,14,3,CRISIL Ultra Short Term Debt Index,DSP Ultra Short Fund-Reg(G),0.3,9.78,20.72,0.01,2.9,255.56,24
Axis Business Cycles Fund-Reg(G),2023-02-22,47580,14.95,2.0,2.9,0.97,12.37,30.87,0.94,0.13,0.18,0.97,0.05,0.12,29,38,38,35,38,41,NIFTY 500 - TRI,Axis Business Cycles Fund-Reg(G),15.66,2.27,3.42,0.91,17.47,37.03,52
HSBC Infrastructure Fund-Reg(G),2007-09-27,594,20.56,2.06,2.83,1.18,20.82,35.94,1.3,0.13,0.18,1.18,0.08,0.14,17,16,16,16,14,14,Nifty Infrastructure - TRI,HSBC Infrastructure Fund-Reg(G),19.03,2.32,3.25,1.1,23.93,40.16,19
UTI Low Duration Fund-Reg(G),2007-04-23,3601,0.35,9.85,19.21,0.06,3.3,56.27,0.02,0.62,1.21,0.06,0.01,0.22,16,1,2,16,2,10,NIFTY Low Duration Debt Index,UTI Low Duration Fund-Reg(G),0.34,9.08,17.79,0.06,2.96,56.98,20
Kotak Debt Hybrid Fund(G),2003-12-02,2051,4.84,2.75,4.05,1.29,9.53,10.28,0.31,0.17,0.26,1.29,0.04,0.04,19,10,12,19,2,14,CRISIL Hybrid 85+15 - Conservative Index,Kotak Debt Hybrid Fund(G),3.49,2.68,4.22,0.8,6.94,12.51,19
Mirae Asset Healthcare Fund-Reg(G),2018-07-02,39122,12.65,3.09,5.69,0.46,30.69,84.95,0.8,0.19,0.36,0.46,0.12,0.34,7,10,9,7,10,10,BSE Health Care - TRI,Mirae Asset Healthcare Fund-Reg(G),12.79,3.25,5.93,0.46,32.72,89.59,12
Baroda BNP Paribas Multi Cap Fund-Reg(G),2003-09-12,500,15.72,2.36,3.37,0.96,19.56,38.51,0.99,0.15,0.21,0.96,0.08,0.15,27,10,15,22,7,11,Nifty500 Multicap 50:25:25 - TRI,Baroda BNP Paribas Multi Cap Fund-Reg(G),14.46,2.19,3.24,0.87,14.86,34.59,34
Aditya Birla SL Nifty 50 ETF,2011-07-21,12811,13.42,1.6,2.48,0.99,4.44,21.65,0.85,0.1,0.16,0.99,0.02,0.09,46,80,94,77,100,84,NIFTY 50 - TRI,Aditya Birla SL Nifty 50 ETF,16.29,1.83,2.98,1.08,13.44,15.21,136
ICICI Pru Bharat Consumption Fund(G),2019-04-12,41946,9.58,3.34,6.18,0.53,22.38,60.68,0.6,0.21,0.39,0.53,0.09,0.24,1,1,1,2,9,4,Nifty India Consumption - TRI,ICICI Pru Bharat Consumption Fund(G),11.72,2.86,5.03,0.63,21.96,54.07,15
Tata Ultra Short Term Fund-Reg(G),2019-01-22,41798,0.29,9.72,19.9,0.01,2.75,290.15,0.02,0.61,1.25,0.01,0.01,1.15,5,13,17,6,16,5,CRISIL Ultra Short Term Debt Index,Tata Ultra Short Term Fund-Reg(G),0.3,9.78,20.72,0.01,2.9,255.56,24
Quant Multi Asset Fund(G),2001-03-20,869,13.72,2.69,4.13,2.02,31.05,18.22,0.86,0.17,0.26,2.02,0.12,0.07,15,4,4,15,1,5,BSE 200 - TRI,Quant Multi Asset Fund(G),8.87,2.36,3.6,1.29,17.0,4.58,15
Kotak Pioneer Fund-Reg(G),2019-10-25,43927,11.91,2.91,4.64,0.74,21.19,47.12,0.75,0.18,0.29,0.74,0.08,0.19,10,6,5,8,15,6,NIFTY 500 - TRI,Kotak Pioneer Fund-Reg(G),15.66,2.27,3.42,0.91,17.47,37.03,52
Kotak Business Cycle Fund-Reg(G),2022-09-28,46472,12.82,2.4,3.67,0.85,15.25,36.34,0.81,0.15,0.23,0.85,0.06,0.14,18,17,15,18,29,27,NIFTY 500 - TRI,Kotak Business Cycle Fund-Reg(G),15.66,2.27,3.42,0.91,17.47,37.03,52
Bandhan Dynamic Bond Fund-Reg(G),2008-12-01,7455,3.36,2.13,3.7,1.76,2.04,4.06,0.21,0.13,0.23,1.76,0.01,0.02,22,21,21,22,16,21,NIFTY Composite Debt Index,Bandhan Dynamic Bond Fund-Reg(G),1.8,3.11,5.49,0.87,2.35,15.07,22
Aditya Birla SL Quant Fund-Reg(G),2024-06-28,48491,,,,,,,,,,,,,,,,,,,NIFTY 200 - TRI,Aditya Birla SL Quant Fund-Reg(G),15.66,2.27,3.42,0.91,17.47,37.03,52
Canara Rob Mid Cap Fund-Reg(G),2022-12-02,46001,15.39,2.41,3.61,0.89,20.79,41.55,0.97,0.15,0.23,0.89,0.08,0.16,15,15,12,15,16,17,BSE 150 MidCap - TRI,Canara Rob Mid Cap Fund-Reg(G),16.0,2.36,3.53,0.91,21.06,41.37,30
Quant Quantamental Fund-Reg(G),2021-04-30,45480,19.29,2.07,3.06,1.11,19.73,36.04,1.21,0.13,0.19,1.11,0.08,0.14,44,34,34,45,18,30,NIFTY 200 - TRI,Quant Quantamental Fund-Reg(G),15.66,2.27,3.42,0.91,17.47,37.03,52
SBI Magnum Childrens Benefit Fund-Investment Plan-Reg(G),2020-09-29,34199,11.33,3.15,5.37,1.0,32.79,35.53,0.71,0.2,0.34,1.0,0.13,0.14,24,3,3,9,1,1,CRISIL Hybrid 35+65 - Aggressive Index,SBI Magnum Childrens Benefit Fund-Investment Plan-Reg(G),9.19,2.31,3.56,1.6,15.6,13.51,38
Aditya Birla SL Nifty Bank ETF,2019-10-23,34434,16.86,0.62,0.93,1.1,-8.52,9.48,1.06,0.04,0.06,1.1,-0.03,0.04,81,120,120,100,130,118,NIFTY BANK - TRI,Aditya Birla SL Nifty Bank ETF,16.29,1.83,2.98,1.08,13.44,15.21,136
Bandhan G-Sec-Invest-Reg(G),2008-12-05,7483,3.4,2.27,3.97,1.78,2.57,4.33,0.21,0.14,0.25,1.78,0.01,0.02,35,31,28,35,13,32,CRISIL Dynamic Gilt Index,Bandhan G-Sec-Invest-Reg(G),1.96,2.91,5.21,0.95,2.37,6.34,35
HDFC Gilt Fund(G),2001-07-25,1269,1.82,2.89,4.87,0.93,2.55,5.64,0.11,0.18,0.31,0.93,0.01,0.02,12,11,12,12,14,12,Nifty All Duration G-Sec Index,HDFC Gilt Fund(G),1.96,2.91,5.21,0.95,2.37,6.34,35
Tata Treasury Advantage Fund-Reg(G),2005-09-06,3205,0.34,9.18,17.69,0.05,3.0,58.97,0.02,0.58,1.11,0.05,0.01,0.23,10,10,12,8,7,7,CRISIL Low Duration Debt Index,Tata Treasury Advantage Fund-Reg(G),0.34,9.08,17.79,0.06,2.96,56.98,20
ICICI Pru PSU Equity Fund-Reg(G),2022-09-12,46106,22.92,2.29,3.22,1.27,29.36,41.3,1.44,0.14,0.2,1.27,0.12,0.16,99,26,38,99,1,27,BSE PSU - TRI,ICICI Pru PSU Equity Fund-Reg(G),16.43,1.97,3.0,0.99,14.45,32.95,101
ICICI Pru Housing Opp Fund-Reg(G),2022-04-18,46546,14.67,1.93,2.74,0.98,10.46,28.95,0.92,0.12,0.17,0.98,0.04,0.11,27,42,46,36,44,44,Nifty Housing - TRI,ICICI Pru Housing Opp Fund-Reg(G),15.66,2.27,3.42,0.91,17.47,37.03,52
DSP Corp Bond Fund-Reg(G),2018-09-10,37709,0.62,5.34,8.7,0.22,2.67,15.3,0.04,0.34,0.55,0.22,0.01,0.06,3,5,11,3,16,4,CRISIL Corporate Bond Index,DSP Corp Bond Fund-Reg(G),0.76,4.97,8.52,0.32,2.81,12.33,21
Nippon India ETF Nifty IT,2020-06-30,44506,19.15,1.38,2.77,0.79,13.23,33.49,1.21,0.09,0.17,0.79,0.05,0.13,107,106,76,29,72,60,NIFTY IT - TRI,Nippon India ETF Nifty IT,16.29,1.83,2.98,1.08,13.44,15.21,136
Bajaj Finserv Money Market Fund-Reg(G),2023-07-24,48065,0.3,9.88,20.89,0.01,2.97,240.71,0.02,0.62,1.32,0.01,0.01,0.96,5,18,18,7,19,16,Nifty Money Market Index,Bajaj Finserv Money Market Fund-Reg(G),0.31,10.37,21.77,0.01,3.22,306.37,22
Mahindra Manulife Large & Mid Cap Fund-Reg(G),2019-12-30,43915,18.31,1.64,2.24,1.11,9.63,26.89,1.15,0.1,0.14,1.11,0.04,0.11,26,26,26,26,23,23,NIFTY LargeMidcap 250 - TRI,Mahindra Manulife Large & Mid Cap Fund-Reg(G),14.92,2.24,3.29,0.89,16.03,35.36,26
HDFC Infrastructure Fund(G),2008-03-10,4253,18.48,2.35,3.29,1.06,24.17,41.0,1.16,0.15,0.21,1.06,0.1,0.16,7,11,11,6,10,9,BSE India Infrastructure Index - TRI,HDFC Infrastructure Fund(G),19.03,2.32,3.25,1.1,23.93,40.16,19
Templeton India Equity Income Fund(G),2006-05-18,3367,15.79,2.34,3.42,0.95,19.73,39.06,0.99,0.15,0.22,0.95,0.08,0.16,7,4,4,4,4,4,NIFTY 500 - TRI,Templeton India Equity Income Fund(G),15.12,2.36,3.44,0.88,17.63,36.47,9
Mirae Asset Arbitrage Fund-Reg(G),2020-06-19,44983,1.05,3.3,7.1,-0.15,3.91,-22.98,0.07,0.21,0.45,-0.15,0.02,-0.09,22,14,15,3,4,9,Nifty 50 Arbitrage,Mirae Asset Arbitrage Fund-Reg(G),1.0,3.27,7.05,-0.14,3.65,-24.08,25
ICICI Pru Commodities Fund(G),2019-10-15,41999,20.81,1.27,1.86,1.18,4.81,22.3,1.31,0.08,0.12,1.18,0.02,0.09,46,52,52,46,52,52,NIFTY COMMODITIES - TRI,ICICI Pru Commodities Fund(G),15.66,2.27,3.42,0.91,17.47,37.03,52
Canara Rob Focused Equity Fund-Reg(G),2021-05-17,45510,13.29,2.26,3.39,0.92,13.28,32.68,0.84,0.14,0.21,0.92,0.05,0.13,9,17,14,19,22,21,BSE 500 - TRI,Canara Rob Focused Equity Fund-Reg(G),14.46,2.19,3.24,0.87,14.86,34.59,34
Axis Balanced Advantage Fund-Reg(G),2017-08-01,37918,8.88,2.48,3.78,1.65,17.34,13.38,0.56,0.16,0.24,1.65,0.07,0.05,18,5,5,20,3,11,NIFTY 50 Hybrid Composite Debt 50:50 Index,Axis Balanced Advantage Fund-Reg(G),8.7,2.16,3.2,1.49,14.18,13.05,27
Kotak Manufacture in India Fund-Reg(G),2022-02-22,46107,15.37,2.3,3.36,0.95,17.99,37.35,0.97,0.14,0.21,0.95,0.07,0.15,31,21,26,29,24,26,Nifty India Manufacturing - TRI,Kotak Manufacture in India Fund-Reg(G),15.66,2.27,3.42,0.91,17.47,37.03,52
UTI-Nifty Next 50 ETF,2017-08-04,37338,19.22,2.56,3.73,1.13,30.19,43.42,1.21,0.16,0.23,1.13,0.12,0.17,115,26,35,113,10,27,NIFTY NEXT 50,UTI-Nifty Next 50 ETF,16.29,1.83,2.98,1.08,13.44,15.21,136
SBI CRISIL IBX Gilt Index - June 2036 Fund-Reg(G),2022-10-04,46941,2.87,2.2,3.51,1.38,2.32,4.56,0.18,0.14,0.22,1.38,0.01,0.02,13,15,17,13,14,15,CRISIL IBX Gilt Index - June 2036,SBI CRISIL IBX Gilt Index - June 2036 Fund-Reg(G),2.51,2.38,4.14,1.2,2.45,5.25,19
HSBC Arbitrage Fund-Reg(G),2014-06-30,29550,1.03,3.19,6.56,-0.14,3.68,-23.54,0.06,0.2,0.41,-0.14,0.01,-0.09,20,17,20,14,17,11,Nifty 50 Arbitrage,HSBC Arbitrage Fund-Reg(G),1.0,3.27,7.05,-0.14,3.65,-24.08,25
Bandhan Multi Cap Fund-Reg(G),2021-12-02,45867,13.61,2.31,3.41,0.88,15.57,35.81,0.86,0.15,0.21,0.88,0.06,0.14,12,14,12,9,17,15,Nifty500 Multicap 50:25:25 - TRI,Bandhan Multi Cap Fund-Reg(G),14.46,2.19,3.24,0.87,14.86,34.59,34
Quant Liquid Plan(G),2005-09-29,883,0.15,9.85,12.13,0.0,1.46,-1590.6,0.01,0.62,0.76,0.0,0.01,-6.31,32,29,5,12,4,27,CRISIL Liquid Debt Index,Quant Liquid Plan(G),0.09,10.4,6.88,0.0,0.89,-1539.37,37
Tata Large Cap Fund-Reg(G),1998-05-07,3281,14.49,1.82,2.65,1.02,7.84,25.93,0.91,0.11,0.17,1.02,0.03,0.1,26,30,30,31,27,28,NIFTY 100 - TRI,Tata Large Cap Fund-Reg(G),13.81,1.99,3.03,0.94,10.16,29.09,36
ICICI Pru Nifty Private Bank ETF,2019-08-09,42119,16.7,0.44,0.67,1.07,-10.58,6.83,1.05,0.03,0.04,1.07,-0.04,0.03,77,131,131,95,132,129,Nifty Private Bank - TRI,ICICI Pru Nifty Private Bank ETF,16.29,1.83,2.98,1.08,13.44,15.21,136
HDFC NIFTY Bank ETF,2020-08-21,33563,16.94,0.61,0.92,1.11,-8.14,9.37,1.07,0.04,0.06,1.11,-0.03,0.04,88,126,126,109,128,124,NIFTY BANK - TRI,HDFC NIFTY Bank ETF,16.29,1.83,2.98,1.08,13.44,15.21,136
Navi Nifty 50 Index Fund-Reg(G),2021-07-15,45614,13.41,1.58,2.45,0.99,3.15,21.42,0.84,0.1,0.15,0.99,0.01,0.08,27,71,75,46,77,76,NIFTY 50 - TRI,Navi Nifty 50 Index Fund-Reg(G),16.43,1.97,3.0,0.99,14.45,32.95,101
Kotak Infra & Eco Reform Fund(G),2008-02-25,4228,17.37,2.41,3.39,1.0,23.66,42.03,1.09,0.15,0.21,1.0,0.09,0.17,2,10,7,2,12,7,Nifty Infrastructure - TRI,Kotak Infra & Eco Reform Fund(G),19.03,2.32,3.25,1.1,23.93,40.16,19
HSBC Overnight Fund-Reg(G),2019-05-22,42784,0.02,19.15,2.51,0.0,0.33,-811.77,0.0,1.21,0.16,0.0,0.0,-3.22,25,23,15,11,21,9,Nifty 1D Rate Index,HSBC Overnight Fund-Reg(G),0.04,26.72,4.08,0.0,0.48,-1478.06,34
Tata ST Bond Fund-Reg(G),2002-08-08,3286,0.71,4.67,8.67,0.32,2.37,10.26,0.04,0.29,0.55,0.32,0.01,0.04,13,14,14,17,19,21,CRISIL Short Duration Debt Index,Tata ST Bond Fund-Reg(G),0.71,4.61,8.37,0.29,2.33,-328.98,25
WOC Mid Cap Fund-Reg(G),2022-09-07,46769,15.28,2.5,3.7,0.89,21.92,42.87,0.96,0.16,0.23,0.89,0.09,0.17,11,9,10,13,14,11,BSE 150 MidCap - TRI,WOC Mid Cap Fund-Reg(G),16.0,2.36,3.53,0.91,21.06,41.37,30
Kotak Special Opportunities Fund-Reg(G),2024-06-29,48809,,,,,,,,,,,,,,,,,,,NIFTY 500 - TRI,Kotak Special Opportunities Fund-Reg(G),15.66,2.27,3.42,0.91,17.47,37.03,52
Sundaram Multi Asset Allocation Fund-Reg(G),2024-01-25,48460,,,,,,,,,,,,,,,,,,,NIFTY 500 - TRI,Sundaram Multi Asset Allocation Fund-Reg(G),8.87,2.36,3.6,1.29,17.0,4.58,15
Tata India Consumer Fund-Reg(G),2015-12-28,33728,11.96,3.02,5.44,0.6,25.12,59.95,0.75,0.19,0.34,0.6,0.1,0.24,11,6,6,6,3,6,Nifty India Consumption - TRI,Tata India Consumer Fund-Reg(G),11.72,2.86,5.03,0.63,21.96,54.07,15
SBI Credit Risk Fund-Reg(G),2004-07-14,2770,0.94,4.11,8.07,0.16,3.38,23.49,0.06,0.26,0.51,0.16,0.01,0.09,8,9,10,5,9,4,NIFTY Credit Risk Bond Index,SBI Credit Risk Fund-Reg(G),1.43,4.48,10.86,0.23,3.84,0.74,15
Motilal Oswal Small Cap Fund-Reg(G),2023-12-26,48388,,,,,,,,,,,,,,,,,,,Nifty Smallcap 250 - TRI,Motilal Oswal Small Cap Fund-Reg(G),15.94,2.25,3.27,0.83,20.93,43.49,24
ITI Small Cap Fund-Reg(G),2020-02-17,44399,18.75,2.5,3.47,1.0,28.63,46.8,1.18,0.16,0.22,1.0,0.11,0.19,22,3,7,23,3,5,Nifty Smallcap 250 - TRI,ITI Small Cap Fund-Reg(G),15.94,2.25,3.27,0.83,20.93,43.49,24
Quant Momentum Fund-Reg(G),2023-11-20,48334,,,,,,,,,,,,,,,,,,,NIFTY 500 - TRI,Quant Momentum Fund-Reg(G),15.66,2.27,3.42,0.91,17.47,37.03,52
Baroda BNP Paribas Large Cap Fund-Reg(G),2004-09-23,23,13.96,2.27,3.31,0.98,13.81,32.33,0.88,0.14,0.21,0.98,0.05,0.13,21,5,8,24,7,8,NIFTY 100 - TRI,Baroda BNP Paribas Large Cap Fund-Reg(G),13.81,1.99,3.03,0.94,10.16,29.09,36
Edelweiss Flexi Cap Fund-Reg(G),2015-02-03,31778,15.36,2.34,3.42,1.05,16.83,34.27,0.97,0.15,0.22,1.05,0.07,0.14,33,14,15,42,15,17,NIFTY 500 - TRI,Edelweiss Flexi Cap Fund-Reg(G),14.39,2.16,3.2,0.94,13.96,33.2,45
Bandhan Balanced Advantage Fund-Reg(G),2014-10-10,30671,6.43,2.3,3.35,1.06,11.74,13.94,0.4,0.14,0.21,1.06,0.05,0.06,4,12,13,4,21,9,NIFTY 50 Hybrid Composite Debt 50:50 Index,Bandhan Balanced Advantage Fund-Reg(G),8.7,2.16,3.2,1.49,14.18,13.05,27
Mirae Asset NYSE FANG+ ETF,2021-05-07,45379,24.8,1.57,2.58,-0.26,39.44,-147.65,1.56,0.1,0.16,-0.26,0.16,-0.59,129,92,85,1,2,135,NYSE FANG+ TRI,Mirae Asset NYSE FANG+ ETF,16.29,1.83,2.98,1.08,13.44,15.21,136
Union Flexi Cap Fund-Reg(G),2011-06-10,14559,14.0,1.8,2.56,0.95,7.91,26.56,0.88,0.11,0.16,0.95,0.03,0.11,24,40,40,26,39,38,BSE 500 - TRI,Union Flexi Cap Fund-Reg(G),14.39,2.16,3.2,0.94,13.96,33.2,45
Tata Banking & Financial Services Fund-Reg(G),2015-12-28,33726,15.33,1.1,1.6,0.98,-0.98,17.21,0.97,0.07,0.1,0.98,0.0,0.07,4,12,12,3,11,12,Nifty Financial Services - TRI,Tata Banking & Financial Services Fund-Reg(G),16.24,1.28,1.87,1.04,1.71,19.93,17
Quant Absolute Fund(G),2001-03-20,865,13.9,1.87,2.81,2.05,20.03,12.68,0.88,0.12,0.18,2.05,0.08,0.05,53,47,43,50,9,36,CRISIL Hybrid 25+75 - Aggressive Index,Quant Absolute Fund(G),7.75,2.24,3.41,1.24,14.36,14.98,52
HDFC Gold Fund(G),2011-11-01,15381,11.91,1.53,2.68,0.24,17.46,74.77,0.75,0.1,0.17,0.24,0.07,0.3,1,5,2,3,5,3,Gold-India,HDFC Gold Fund(G),14.31,1.35,2.31,0.74,16.31,163.18,15
Mirae Asset Flexi Cap Fund-Reg(G),2023-02-24,47596,13.88,1.73,2.51,0.96,6.45,24.97,0.87,0.11,0.16,0.96,0.03,0.1,21,42,42,28,43,43,NIFTY 500 - TRI,Mirae Asset Flexi Cap Fund-Reg(G),14.39,2.16,3.2,0.94,13.96,33.2,45
DSP Nifty SDL Plus G-Sec Jun 2028 30:70 Index Fund-Reg(G),2022-03-21,45863,1.02,4.13,7.96,0.44,2.97,9.7,0.06,0.26,0.5,0.44,0.01,0.04,21,20,23,32,32,33,Nifty SDL Plus G-Sec Jun 2028 70:30 Index,DSP Nifty SDL Plus G-Sec Jun 2028 30:70 Index Fund-Reg(G),1.24,3.76,7.28,0.49,2.77,11.01,52
Franklin India Balanced Advantage Fund-Reg(G),2022-09-06,46625,6.58,2.63,3.91,0.97,14.46,17.74,0.41,0.17,0.25,0.97,0.06,0.07,5,3,2,3,10,3,NIFTY 50 Hybrid Composite Debt 50:50 Index,Franklin India Balanced Advantage Fund-Reg(G),8.7,2.16,3.2,1.49,14.18,13.05,27
Motilal Oswal Nifty India Defence Index Fund-Reg(G),2024-07-03,48892,,,,,,,,,,,,,,,,,,,Nifty India Defence - TRI,Motilal Oswal Nifty India Defence Index Fund-Reg(G),16.43,1.97,3.0,0.99,14.45,32.95,101
HSBC Money Market Fund-Reg(G),2005-08-10,621,0.32,10.23,21.63,0.01,3.2,223.73,0.02,0.64,1.36,0.01,0.01,0.89,10,15,14,19,13,19,Nifty Money Market Index,HSBC Money Market Fund-Reg(G),0.31,10.37,21.77,0.01,3.22,306.37,22
Sundaram Flexi Cap Fund-Reg(G),2022-09-06,46622,12.77,1.8,2.7,0.9,6.58,25.5,0.8,0.11,0.17,0.9,0.03,0.1,10,39,36,16,42,41,NIFTY 500 - TRI,Sundaram Flexi Cap Fund-Reg(G),14.39,2.16,3.2,0.94,13.96,33.2,45
Axis CRISIL IBX SDL May 2027 Index Fund-Reg(G),2022-02-23,45999,0.91,4.44,8.39,0.23,3.35,17.31,0.06,0.28,0.53,0.23,0.01,0.07,16,15,17,10,4,8,CRISIL IBX SDL Index - May 2027,Axis CRISIL IBX SDL May 2027 Index Fund-Reg(G),1.24,3.76,7.28,0.49,2.77,11.01,52
BHARAT Bond ETF FOF - April 2033 -Reg(G),2022-12-14,47284,6.38,0.82,1.36,0.08,4.99,65.95,0.4,0.05,0.09,0.08,0.02,0.26,22,52,52,2,42,2,NIFTY BHARAT Bond Index - April 2033,BHARAT Bond ETF FOF - April 2033 -Reg(G),9.16,2.38,3.86,1.09,15.55,21.19,53
Tata Retirement Sav Fund - Mod Plan(G),2011-11-04,15379,12.21,2.02,2.88,1.75,19.63,14.11,0.77,0.13,0.18,1.75,0.08,0.06,28,28,29,26,13,16,CRISIL Hybrid 25+75 - Aggressive Index,Tata Retirement Sav Fund - Mod Plan(G),9.19,2.31,3.56,1.6,15.6,13.51,38
Parag Parikh Conservative Hybrid Fund-Reg(G),2021-05-26,45338,3.26,3.54,5.54,0.59,9.8,19.63,0.21,0.22,0.35,0.59,0.04,0.08,5,2,2,3,1,1,CRISIL Hybrid 85+15 - Conservative Index,Parag Parikh Conservative Hybrid Fund-Reg(G),3.49,2.68,4.22,0.8,6.94,12.51,19
Edelweiss US Technology Equity FOF-Reg(G),2020-03-05,44630,25.85,0.92,1.45,2.67,16.68,8.95,1.63,0.06,0.09,2.67,0.07,0.04,55,35,38,48,21,27,Russell 1000 Equal Weighted Technology Index,Edelweiss US Technology Equity FOF-Reg(G),16.47,0.98,1.65,1.7,10.35,15.83,56
Quant Large Cap Fund-Reg(G),2022-08-10,46678,15.61,2.13,3.28,0.9,16.76,36.77,0.98,0.13,0.21,0.9,0.07,0.15,32,8,10,11,3,2,NIFTY 100 - TRI,Quant Large Cap Fund-Reg(G),13.81,1.99,3.03,0.94,10.16,29.09,36
LIC MF Nifty 8-13 yr G-Sec ETF,2014-12-24,31581,2.33,2.38,3.89,1.16,2.67,4.76,0.15,0.15,0.25,1.16,0.01,0.02,17,17,16,17,13,15,Nifty 8-13 yr G-Sec,LIC MF Nifty 8-13 yr G-Sec ETF,1.05,4.54,6.56,0.42,2.57,-405.22,19
Kotak Bond Fund-Reg(G),1999-11-25,1968,1.97,2.42,4.03,1.03,1.76,4.64,0.12,0.15,0.25,1.03,0.01,0.02,47,45,46,49,46,47,CRISIL Medium to Long Term Debt Index,Kotak Bond Fund-Reg(G),1.24,3.76,7.28,0.49,2.77,11.01,52
Nippon India ETF Nifty 8-13 yr G-Sec Long Term Gilt,2016-07-05,35459,2.34,2.4,3.93,1.17,2.72,4.81,0.15,0.15,0.25,1.17,0.01,0.02,18,16,15,18,12,14,Nifty 8-13 yr G-Sec,Nippon India ETF Nifty 8-13 yr G-Sec Long Term Gilt,1.05,4.54,6.56,0.42,2.57,-405.22,19
Nippon India Innovation Fund-Reg(G),2023-08-28,48169,11.97,2.95,4.68,0.71,22.33,49.49,0.75,0.19,0.3,0.71,0.09,0.2,11,5,4,4,13,3,NIFTY 500 - TRI,Nippon India Innovation Fund-Reg(G),15.66,2.27,3.42,0.91,17.47,37.03,52
UTI Ultra Short Duration Fund-Reg(G),2003-08-29,3533,0.3,10.32,21.75,0.02,3.02,197.85,0.02,0.65,1.37,0.02,0.01,0.79,11,10,10,20,11,19,NIFTY Ultra Short Duration Debt Index,UTI Ultra Short Duration Fund-Reg(G),0.3,9.78,20.72,0.01,2.9,255.56,24
Motilal Oswal Focused Fund-Reg(G),2013-05-13,21769,15.25,1.96,2.94,0.85,14.41,35.15,0.96,0.12,0.19,0.85,0.06,0.14,30,18,20,4,6,5,NIFTY 500 - TRI,Motilal Oswal Focused Fund-Reg(G),13.81,1.99,3.03,0.94,10.16,29.09,36
DSP Overnight Fund-Reg(G),2019-01-09,41945,0.14,9.02,11.89,0.0,1.29,-2867.53,0.01,0.57,0.75,0.0,0.01,-11.38,32,28,2,10,2,30,CRISIL Liquid Overnight Index,DSP Overnight Fund-Reg(G),0.04,26.72,4.08,0.0,0.48,-1478.06,34
Tata Retirement Sav Fund - Prog Plan(G),2011-11-04,15380,14.18,2.08,2.97,1.9,23.99,15.5,0.89,0.13,0.19,1.9,0.1,0.06,33,26,27,31,5,8,NIFTY 500 - TRI,Tata Retirement Sav Fund - Prog Plan(G),9.19,2.31,3.56,1.6,15.6,13.51,38
Invesco India Flexi Cap Fund-Reg(G),2022-02-14,45945,13.78,2.94,4.42,0.9,23.99,44.81,0.87,0.18,0.28,0.9,0.1,0.18,20,2,3,15,5,3,BSE 500 - TRI,Invesco India Flexi Cap Fund-Reg(G),14.39,2.16,3.2,0.94,13.96,33.2,45
Edelweiss Aggressive Hybrid Fund-Reg(G),2009-08-11,7922,11.16,2.38,3.43,1.82,21.32,14.62,0.7,0.15,0.22,1.82,0.08,0.06,13,8,9,13,3,9,CRISIL Hybrid 35+65 - Aggressive Index,Edelweiss Aggressive Hybrid Fund-Reg(G),8.87,2.36,3.6,1.29,17.0,4.58,15
Franklin India Money Market Fund(G),2002-02-11,3361,0.32,10.82,22.88,0.01,3.45,252.0,0.02,0.68,1.44,0.01,0.01,1.0,14,9,8,14,8,11,Nifty Money Market Index,Franklin India Money Market Fund(G),0.31,10.37,21.77,0.01,3.22,306.37,22
JM Liquid Fund(G),1997-12-31,1909,0.05,12.74,5.1,0.0,0.68,-557.83,0.0,0.8,0.32,0.0,0.0,-2.21,3,3,33,7,34,9,CRISIL Liquid Debt Index,JM Liquid Fund(G),0.09,10.4,6.88,0.0,0.89,-1539.37,37
Aditya Birla SL G-Sec Fund(G),1999-10-11,399,2.5,2.46,4.3,1.32,2.27,4.66,0.16,0.15,0.27,1.32,0.01,0.02,30,24,20,30,22,26,Nifty All Duration G-Sec Index,Aditya Birla SL G-Sec Fund(G),1.96,2.91,5.21,0.95,2.37,6.34,35
ICICI Pru Bharat 22 FOF-(G),2018-06-29,40232,21.26,2.12,3.0,2.99,36.31,15.07,1.34,0.13,0.19,2.99,0.14,0.06,52,37,41,53,3,26,BSE Bharat 22 Index,ICICI Pru Bharat 22 FOF-(G),9.16,2.38,3.86,1.09,15.55,21.19,53
Franklin India Equity Hybrid Fund(G),1999-12-10,999,10.01,2.28,3.3,1.58,18.24,14.41,0.63,0.14,0.21,1.58,0.07,0.06,33,27,30,31,15,24,CRISIL Hybrid 35+65 - Aggressive Index,Franklin India Equity Hybrid Fund(G),7.75,2.24,3.41,1.24,14.36,14.98,52
SBI Gold-Reg(G),2011-09-12,14666,12.12,1.56,2.67,0.03,18.85,693.6,0.76,0.1,0.17,0.03,0.07,2.75,4,1,3,2,2,2,Gold-London Bullion Market association (LBMA),SBI Gold-Reg(G),14.31,1.35,2.31,0.74,16.31,163.18,15
Motilal Oswal Nifty 500 Index Fund-Reg(G),2019-09-06,43809,14.42,1.96,2.84,1.01,9.88,28.05,0.91,0.12,0.18,1.01,0.04,0.11,45,59,61,64,66,66,NIFTY 500 - TRI,Motilal Oswal Nifty 500 Index Fund-Reg(G),16.43,1.97,3.0,0.99,14.45,32.95,101
HSBC Large Cap Fund(G),2002-12-10,1348,14.73,1.85,2.7,1.03,8.42,26.36,0.93,0.12,0.17,1.03,0.03,0.1,28,27,29,33,25,27,NIFTY 100 - TRI,HSBC Large Cap Fund(G),13.81,1.99,3.03,0.94,10.16,29.09,36
Zerodha Nifty 1D Rate Liquid ETF,2024-01-17,48471,,,,,,,,,,,,,,,,,,,Nifty 1D Rate Index,Zerodha Nifty 1D Rate Liquid ETF,1.05,4.54,6.56,0.42,2.57,-405.22,19
HSBC Multi Asset Allocation Fund-Reg(G),2024-02-28,48468,,,,,,,,,,,,,,,,,,,BSE 200 - TRI,HSBC Multi Asset Allocation Fund-Reg(G),8.87,2.36,3.6,1.29,17.0,4.58,15
Kotak Gold Fund(G),2011-03-25,14148,12.22,1.53,2.55,0.51,17.21,36.49,0.77,0.1,0.16,0.51,0.07,0.14,5,4,6,9,7,9,Gold-India,Kotak Gold Fund(G),14.31,1.35,2.31,0.74,16.31,163.18,15
Bandhan Infrastructure Fund-Reg(G),2011-03-08,12459,20.25,2.63,3.67,1.14,32.58,46.54,1.28,0.17,0.23,1.14,0.13,0.18,16,3,3,14,2,3,BSE India Infrastructure Index - TRI,Bandhan Infrastructure Fund-Reg(G),19.03,2.32,3.25,1.1,23.93,40.16,19
DSP BSE Liquid Rate ETF,2024-03-27,48724,,,,,,,,,,,,,,,,,,,BSE Liquid Rate Index,DSP BSE Liquid Rate ETF,1.05,4.54,6.56,0.42,2.57,-405.22,19
HSBC CRISIL IBX 50:50 Gilt Plus SDL Apr 2028 Index Fund-Reg(G),2022-03-31,46506,1.05,4.01,7.99,0.42,2.97,9.98,0.07,0.25,0.5,0.42,0.01,0.04,22,23,22,30,29,31,CRISIL IBX 50:50 Gilt Plus SDL Index - April 2028,HSBC CRISIL IBX 50:50 Gilt Plus SDL Apr 2028 Index Fund-Reg(G),1.24,3.76,7.28,0.49,2.77,11.01,52
Tata Focused Equity Fund-Reg(G),2019-12-05,44148,15.07,2.09,3.0,1.02,13.03,31.05,0.95,0.13,0.19,1.02,0.05,0.12,24,23,24,29,23,25,NIFTY 500 - TRI,Tata Focused Equity Fund-Reg(G),14.46,2.19,3.24,0.87,14.86,34.59,34
Sundaram Ultra Short Duration Fund(G),2007-12-28,4186,0.27,8.6,18.06,0.01,2.27,224.28,0.02,0.54,1.14,0.01,0.01,0.89,2,23,23,7,23,16,NIFTY Ultra Short Duration Debt Index,Sundaram Ultra Short Duration Fund(G),0.3,9.78,20.72,0.01,2.9,255.56,24
Helios Flexi Cap Fund-Reg(G),2023-11-13,48299,,,,,,,,,,,,,,,,,,,NIFTY 500 - TRI,Helios Flexi Cap Fund-Reg(G),14.39,2.16,3.2,0.94,13.96,33.2,45
Nippon India Gold Savings Fund(G),2011-03-07,14108,12.86,1.44,2.39,0.66,16.56,28.1,0.81,0.09,0.15,0.66,0.07,0.11,8,9,10,11,11,11,Gold-India,Nippon India Gold Savings Fund(G),14.31,1.35,2.31,0.74,16.31,163.18,15
