MF Code,incept_date,schemecode,sdx_returns,sharpex_returns,sotinox_returns,betax_returns,alphax_returns,treynorx_returns,sdy_returns,sharpey_returns,sotinoy_returns,betay_returns,alphay_returns,treynory_returns,rank_sd,rank_sharpe,rank_sotino,rank_beta,rank_alpha,rank_treynor,index_name,s_name,avg_std_dev,avg_sharpe,avg_sotino,avg_beta,avg_alpha,avg_treyno,no_of_funds_total
Aditya Birla SL Nifty Next 50 Index Fund-Reg(G),2022-02-18,46360,19.16,2.53,3.68,1.12,27.92,43.09,1.21,0.16,0.23,1.12,0.11,0.17,73,20,18,85,14,21,NIFTY NEXT 50 - TRI,Aditya Birla SL Nifty Next 50 Index Fund-Reg(G),16.43,1.97,3.0,0.99,14.45,32.95,101
Axis All Seasons Debt FOFs-Reg(G),2020-01-28,43840,1.95,2.86,4.8,1.01,2.62,5.49,0.12,0.18,0.3,1.01,0.01,0.02,6,14,11,21,53,53,NIFTY Composite Debt Index,Axis All Seasons Debt FOFs-Reg(G),9.16,2.38,3.86,1.09,15.55,21.19,53
Nippon India Nifty IT Index Fund-Reg(G),2024-02-22,48568,,,,,,,,,,,,,,,,,,,NIFTY IT - TRI,Nippon India Nifty IT Index Fund-Reg(G),16.43,1.97,3.0,0.99,14.45,32.95,101
LIC MF Arbitrage Fund-Reg(G),2019-01-25,39948,0.91,3.25,7.15,-0.15,3.4,-19.38,0.06,0.2,0.45,-0.15,0.01,-0.08,1,15,14,2,21,3,Nifty 50 Arbitrage,LIC MF Arbitrage Fund-Reg(G),1.0,3.27,7.05,-0.14,3.65,-24.08,25
Baroda BNP Paribas Credit Risk Fund-Reg(G),2015-01-23,25569,0.59,7.0,14.1,0.16,3.68,26.54,0.04,0.44,0.89,0.16,0.01,0.11,4,2,3,4,6,2,CRISIL Credit Risk Debt Index,Baroda BNP Paribas Credit Risk Fund-Reg(G),1.43,4.48,10.86,0.23,3.84,0.74,15
ICICI Pru Nifty Healthcare ETF,2021-05-18,45383,14.25,2.76,5.13,0.47,31.37,83.06,0.9,0.17,0.32,0.47,0.12,0.33,63,14,10,7,7,5,Nifty Healthcare Index - TRI,ICICI Pru Nifty Healthcare ETF,16.29,1.83,2.98,1.08,13.44,15.21,136
ICICI Pru Nifty Auto Index Fund-Reg(G),2022-10-11,45995,17.02,2.59,4.56,0.89,27.72,49.19,1.07,0.16,0.29,0.89,0.11,0.2,5,4,3,5,2,3,NIFTY AUTO - TRI,ICICI Pru Nifty Auto Index Fund-Reg(G),15.48,2.72,4.48,0.85,26.59,49.61,5
Invesco India Credit Risk Fund(G),2014-09-04,21522,1.69,2.97,12.86,0.3,4.13,16.66,0.11,0.19,0.81,0.3,0.02,0.07,13,12,4,13,3,8,NIFTY Credit Risk Bond Index,Invesco India Credit Risk Fund(G),1.43,4.48,10.86,0.23,3.84,0.74,15
Taurus Mid Cap Fund-Reg(G),1994-09-05,3306,19.42,1.38,1.9,1.08,7.08,24.82,1.22,0.09,0.12,1.08,0.03,0.1,30,30,30,30,30,30,Nifty Midcap 150 - TRI,Taurus Mid Cap Fund-Reg(G),16.0,2.36,3.53,0.91,21.06,41.37,30
Bank of India Balanced Advantage Fund-Reg(G),2014-03-14,21917,11.61,1.47,2.1,1.93,11.42,8.82,0.73,0.09,0.13,1.93,0.05,0.04,25,27,27,23,24,27,NIFTY 50 Hybrid Composite Debt 50:50 Index,Bank of India Balanced Advantage Fund-Reg(G),8.7,2.16,3.2,1.49,14.18,13.05,27
DSP World Energy Fund-Reg(G),2009-08-14,7866,18.78,0.3,0.51,3.22,-4.08,1.76,1.18,0.02,0.03,3.22,-0.02,0.01,42,49,49,53,49,48,MSCI World,DSP World Energy Fund-Reg(G),16.47,0.98,1.65,1.7,10.35,15.83,56
SBI FMP-47-1434D-Reg(G),2021-07-23,45660,0.33,2.64,4.05,0.06,0.73,14.06,0.02,0.17,0.25,0.06,0.0,0.06,15,61,65,15,81,35,CRISIL Medium Duration Debt Index,SBI FMP-47-1434D-Reg(G),0.67,4.58,9.19,0.19,2.25,-152.64,91
WOC Balanced Hybrid Fund-Reg(G),2023-10-27,48213,,,,,,,,,,,,,,,,,,,CRISIL Hybrid 50+50 - Moderate Index,WOC Balanced Hybrid Fund-Reg(G),8.7,2.16,3.2,1.49,14.18,13.05,27
Bandhan Long Duration Fund-Reg(G),2024-03-20,48582,,,,,,,,,,,,,,,,,,,NIFTY Long Duration Debt Index,Bandhan Long Duration Fund-Reg(G),2.51,2.38,4.14,1.2,2.45,5.25,19
Canara Rob Corp Bond Fund-Reg(G),2014-02-07,23504,0.63,5.26,9.59,0.26,2.57,12.95,0.04,0.33,0.6,0.26,0.01,0.05,4,6,4,5,18,6,CRISIL Corporate Bond Index,Canara Rob Corp Bond Fund-Reg(G),0.76,4.97,8.52,0.32,2.81,12.33,21
HSBC Nifty Next 50 Index Fund-Reg(G),2020-04-15,33548,19.18,2.53,3.69,1.12,28.07,43.22,1.21,0.16,0.23,1.12,0.11,0.17,78,16,17,88,7,15,NIFTY NEXT 50 - TRI,HSBC Nifty Next 50 Index Fund-Reg(G),16.43,1.97,3.0,0.99,14.45,32.95,101
Mirae Asset Nifty 100 ESG Sector Leaders ETF,2020-11-18,45134,13.38,1.82,2.87,0.98,7.99,24.9,0.84,0.11,0.18,0.98,0.03,0.1,44,74,68,47,88,81,Nifty100 ESG Sector Leaders - TRI,Mirae Asset Nifty 100 ESG Sector Leaders ETF,16.29,1.83,2.98,1.08,13.44,15.21,136
Bandhan Nifty200 Momentum 30 Index Fund-Reg(G),2022-09-02,46608,20.84,2.16,3.15,1.18,23.74,38.25,1.31,0.14,0.2,1.18,0.09,0.15,95,35,40,96,30,39,Nifty200 Momentum 30 - TRI,Bandhan Nifty200 Momentum 30 Index Fund-Reg(G),16.43,1.97,3.0,0.99,14.45,32.95,101
Mirae Asset Nifty EV and New Age Automotive ETF,2024-07-10,48935,,,,,,,,,,,,,,,,,,,Nifty EV and New Age Automotive - TRI,Mirae Asset Nifty EV and New Age Automotive ETF,16.29,1.83,2.98,1.08,13.44,15.21,136
DSP World Mining Fund-Reg(G),2009-12-29,8359,23.15,0.0,0.0,3.03,-9.25,-0.03,1.46,0.0,0.0,3.03,-0.04,0.0,54,50,50,50,53,49,MSCI ACWI Metals & Mining 30% Buffer 10/40 (1994) Net TRI,DSP World Mining Fund-Reg(G),16.47,0.98,1.65,1.7,10.35,15.83,56
Axis NIFTY IT Index Fund-Reg(G),2023-07-14,47983,19.17,1.35,2.68,0.78,11.67,33.09,1.21,0.08,0.17,0.78,0.05,0.13,75,96,70,6,62,55,NIFTY IT - TRI,Axis NIFTY IT Index Fund-Reg(G),16.43,1.97,3.0,0.99,14.45,32.95,101
Quantum Equity FoF-Reg(G),2009-07-20,19904,13.24,2.17,3.17,2.11,22.6,13.61,0.83,0.14,0.2,2.11,0.09,0.05,43,35,37,50,10,33,BSE 200 - TRI,Quantum Equity FoF-Reg(G),9.16,2.38,3.86,1.09,15.55,21.19,53
Shriram Flexi Cap Fund-Reg(G),2018-09-28,38781,17.8,1.82,2.54,1.09,12.5,29.69,1.12,0.11,0.16,1.09,0.05,0.12,44,35,41,43,24,30,NIFTY 500 - TRI,Shriram Flexi Cap Fund-Reg(G),14.39,2.16,3.2,0.94,13.96,33.2,45
Aditya Birla SL Long Duration Fund-Reg(G),2022-08-08,46711,2.61,2.41,4.19,1.37,2.29,4.59,0.16,0.15,0.26,1.37,0.01,0.02,12,9,9,12,16,14,NIFTY Long Duration Debt Index,Aditya Birla SL Long Duration Fund-Reg(G),2.51,2.38,4.14,1.2,2.45,5.25,19
Axis BSE Sensex ETF,2023-03-24,47768,13.27,1.39,2.17,0.99,1.94,18.6,0.84,0.09,0.14,0.99,0.01,0.07,26,103,110,62,113,110,BSE SENSEX - TRI,Axis BSE Sensex ETF,16.29,1.83,2.98,1.08,13.44,15.21,136
TRUSTMF Short Duration Fund-Reg(G),2021-08-06,45652,0.7,4.49,7.85,0.28,2.32,11.21,0.04,0.28,0.49,0.28,0.01,0.04,11,19,21,5,20,10,CRISIL Short Duration Debt Index,TRUSTMF Short Duration Fund-Reg(G),0.71,4.61,8.37,0.29,2.33,-328.98,25
Groww Largecap Fund-Reg(G),2012-02-10,15997,14.27,1.96,2.97,1.02,9.45,27.52,0.9,0.12,0.19,1.02,0.04,0.11,25,19,19,30,19,22,NIFTY 100 - TRI,Groww Largecap Fund-Reg(G),13.81,1.99,3.03,0.94,10.16,29.09,36
Union Equity Savings Fund-Reg(G),2018-08-09,40627,4.75,1.79,2.6,0.82,6.12,10.33,0.3,0.11,0.16,0.82,0.02,0.04,13,49,50,17,47,50,Crisil Equity Savings Index,Union Equity Savings Fund-Reg(G),7.75,2.24,3.41,1.24,14.36,14.98,52
JM Short Duration Fund-Reg(G),2022-08-29,46751,0.66,4.52,8.39,0.27,2.19,11.16,0.04,0.28,0.53,0.27,0.01,0.04,4,17,15,3,23,12,CRISIL Short Duration Debt Index,JM Short Duration Fund-Reg(G),0.71,4.61,8.37,0.29,2.33,-328.98,25
ICICI Pru Debt Mgmt Fund(FOF)(G),2003-12-18,1707,0.96,4.29,7.22,0.44,2.82,9.32,0.06,0.27,0.46,0.44,0.01,0.04,3,3,3,9,51,47,CRISIL Composite Bond Index,ICICI Pru Debt Mgmt Fund(FOF)(G),9.16,2.38,3.86,1.09,15.55,21.19,53
Motilal Oswal BSE Enhanced Value ETF,2022-08-22,46740,25.85,2.06,2.94,1.46,28.75,36.39,1.63,0.13,0.19,1.46,0.11,0.14,130,59,62,126,19,52,BSE Enhanced Value Index - TRI,Motilal Oswal BSE Enhanced Value ETF,16.29,1.83,2.98,1.08,13.44,15.21,136
LIC MF Value Fund-Reg(G),2018-08-20,39956,14.91,2.2,3.27,0.99,14.82,33.19,0.94,0.14,0.21,0.99,0.06,0.13,11,15,13,11,15,15,NIFTY 500 - TRI,LIC MF Value Fund-Reg(G),15.31,2.33,3.44,0.98,17.49,36.33,22
ICICI Pru FMP-88-1226D-F(G),2022-12-08,47232,0.78,4.86,9.67,0.28,3.0,13.71,0.05,0.31,0.61,0.28,0.01,0.05,70,42,43,70,34,39,CRISIL Medium Duration Debt Index,ICICI Pru FMP-88-1226D-F(G),0.67,4.58,9.19,0.19,2.25,-152.64,91
SBI FMP-46-1850D-Reg(G),2021-07-07,45620,0.49,2.19,3.92,0.14,0.78,7.66,0.03,0.14,0.25,0.14,0.0,0.03,25,75,69,30,75,68,CRISIL Medium to Long Term Debt Index,SBI FMP-46-1850D-Reg(G),0.67,4.58,9.19,0.19,2.25,-152.64,91
ICICI Pru BSE 500 ETF FOF-Reg(G),2021-12-01,45726,12.45,2.25,3.39,2.54,20.61,11.01,0.78,0.14,0.21,2.54,0.08,0.04,41,34,33,52,14,44,BSE 500 - TRI,ICICI Pru BSE 500 ETF FOF-Reg(G),9.16,2.38,3.86,1.09,15.55,21.19,53
Kotak FMP-329-90D(G),2024-03-21,48720,,,,,,,,,,,,,,,,,,,Nifty Liquid Fund Index,Kotak FMP-329-90D(G),0.67,4.58,9.19,0.19,2.25,-152.64,91
HDFC Silver ETF FoF-Reg(G),2022-10-28,46465,21.25,0.84,1.44,1.81,12.52,9.8,1.34,0.05,0.09,1.81,0.05,0.04,14,14,14,13,13,13,Silver,HDFC Silver ETF FoF-Reg(G),14.31,1.35,2.31,0.74,16.31,163.18,15
Kotak FMP-310-1131D(G),2023-03-27,47871,0.78,4.79,9.47,0.28,2.92,13.33,0.05,0.3,0.6,0.28,0.01,0.05,68,45,46,73,41,44,NIFTY Medium Duration Debt Index,Kotak FMP-310-1131D(G),0.67,4.58,9.19,0.19,2.25,-152.64,91
Nippon India Nifty Bank Index Fund-Reg(G),2024-02-22,48148,,,,,,,,,,,,,,,,,,,NIFTY BANK - TRI,Nippon India Nifty Bank Index Fund-Reg(G),16.43,1.97,3.0,0.99,14.45,32.95,101
Axis Nifty Bank Index Fund-Reg(G),2024-05-24,48680,,,,,,,,,,,,,,,,,,,NIFTY BANK - TRI,Axis Nifty Bank Index Fund-Reg(G),16.43,1.97,3.0,0.99,14.45,32.95,101
Canara Rob Overnight Fund-Reg(G),2019-07-24,43350,0.01,40.71,2.39,0.0,0.33,-1392.0,0.0,2.56,0.15,0.0,0.0,-5.52,13,7,21,24,19,21,CRISIL Liquid Overnight Index,Canara Rob Overnight Fund-Reg(G),0.04,26.72,4.08,0.0,0.48,-1478.06,34
Samco ELSS Tax Saver Fund-Reg(G),2022-12-22,46606,14.87,1.44,2.12,0.79,7.03,27.09,0.94,0.09,0.13,0.79,0.03,0.11,37,59,59,6,51,50,NIFTY 500 - TRI,Samco ELSS Tax Saver Fund-Reg(G),14.34,2.1,3.13,0.91,13.54,33.36,59
Quantum Gold Saving Fund-Reg(G),2011-05-19,19961,11.93,1.56,2.7,0.5,17.16,37.45,0.75,0.1,0.17,0.5,0.07,0.15,2,2,1,7,8,7,Gold-India,Quantum Gold Saving Fund-Reg(G),14.31,1.35,2.31,0.74,16.31,163.18,15
SBI Magnum Childrens Benefit Fund-Savings Plan,2002-01-28,2748,3.93,4.3,7.75,0.66,14.99,25.63,0.25,0.27,0.49,0.66,0.06,0.1,6,1,1,4,21,2,NIFTY 50 Hybrid Composite Debt 15:85 Index,SBI Magnum Childrens Benefit Fund-Savings Plan,9.19,2.31,3.56,1.6,15.6,13.51,38
SBI Nifty IT ETF,2020-10-19,45110,19.08,1.37,2.75,0.79,13.13,33.16,1.2,0.09,0.17,0.79,0.05,0.13,104,109,81,32,76,63,NIFTY IT - TRI,SBI Nifty IT ETF,16.29,1.83,2.98,1.08,13.44,15.21,136
DSP FMP 268-1281D-Reg(G),2022-11-24,47124,0.71,5.28,12.08,0.16,3.3,22.96,0.04,0.33,0.76,0.16,0.01,0.09,57,29,26,40,14,14,CRISIL Medium Duration Debt Index,DSP FMP 268-1281D-Reg(G),0.67,4.58,9.19,0.19,2.25,-152.64,91
ICICI Pru Retirement Fund-Pure Debt Plan(G),2019-02-27,25670,0.87,3.5,5.93,0.35,2.02,8.67,0.05,0.22,0.37,0.35,0.01,0.03,2,2,2,2,37,35,NIFTY Composite Debt Index,ICICI Pru Retirement Fund-Pure Debt Plan(G),9.19,2.31,3.56,1.6,15.6,13.51,38
Tata Nifty India Digital ETF,2022-03-31,45944,16.63,2.23,4.01,0.91,21.39,40.65,1.05,0.14,0.25,0.91,0.08,0.16,72,42,27,39,41,39,Nifty India Digital  - TRI,Tata Nifty India Digital ETF,16.29,1.83,2.98,1.08,13.44,15.21,136
Kotak Nifty SDL Jul 2026 Index Fund-Reg(G),2022-12-22,46729,0.7,5.37,12.97,0.19,3.2,19.5,0.04,0.34,0.82,0.19,0.01,0.08,5,4,1,4,10,2,Nifty SDL Jul 2026 Index,Kotak Nifty SDL Jul 2026 Index Fund-Reg(G),1.24,3.76,7.28,0.49,2.77,11.01,52
SBI FMP-78-1170D-Reg(G),2023-02-21,47638,0.41,2.2,3.6,0.12,0.63,7.46,0.03,0.14,0.23,0.12,0.0,0.03,20,73,79,23,87,70,CRISIL Medium Duration Debt Index,SBI FMP-78-1170D-Reg(G),0.67,4.58,9.19,0.19,2.25,-152.64,91
Tata Nifty G-Sec Dec 2026 Index Fund-Reg(G),2023-01-16,47436,0.8,4.79,9.42,0.3,2.92,12.63,0.05,0.3,0.59,0.3,0.01,0.05,11,11,11,12,16,12,Nifty G-sec Dec 2026 Index,Tata Nifty G-Sec Dec 2026 Index Fund-Reg(G),0.86,4.78,9.3,0.35,2.77,15.17,30
SBI Nifty 200 Quality 30 ETF,2018-12-10,41015,12.41,2.56,4.29,0.73,19.71,43.55,0.78,0.16,0.27,0.73,0.08,0.17,15,25,22,23,52,26,NIFTY200 Quality 30 - TRI,SBI Nifty 200 Quality 30 ETF,16.29,1.83,2.98,1.08,13.44,15.21,136
Canara Rob Gilt Fund-Reg(G),1999-12-29,538,2.37,2.31,3.9,1.23,1.86,4.46,0.15,0.15,0.25,1.23,0.01,0.02,25,27,30,24,29,29,CRISIL Dynamic Gilt Index,Canara Rob Gilt Fund-Reg(G),1.96,2.91,5.21,0.95,2.37,6.34,35
Bandhan Conservative Hybrid Fund-Reg(G),2010-02-25,8465,3.51,2.46,4.34,0.66,6.73,13.05,0.22,0.16,0.27,0.66,0.03,0.05,11,13,8,7,11,9,NIFTY AAA Short Duration Bond Index,Bandhan Conservative Hybrid Fund-Reg(G),3.49,2.68,4.22,0.8,6.94,12.51,19
Mirae Asset Nifty India Manufacturing ETF FoF-Reg(G),2022-01-31,46053,15.35,2.61,3.93,2.06,34.07,19.48,0.97,0.16,0.25,2.06,0.14,0.08,46,20,24,48,4,13,Nifty India Manufacturing - TRI,Mirae Asset Nifty India Manufacturing ETF FoF-Reg(G),9.16,2.38,3.86,1.09,15.55,21.19,53
Canara Rob Income Fund-Reg(G),2002-09-19,542,1.98,2.01,3.35,1.0,1.08,4.01,0.12,0.13,0.21,1.0,0.0,0.02,48,51,51,48,52,52,CRISIL Medium to Long Term Debt Index,Canara Rob Income Fund-Reg(G),1.24,3.76,7.28,0.49,2.77,11.01,52
Nippon India Nifty G-Sec Oct 2028 Maturity Index Fund-Reg(G),2023-03-06,47629,1.23,3.5,5.87,0.5,2.85,8.64,0.08,0.22,0.37,0.5,0.01,0.03,31,31,35,36,39,35,Nifty G-Sec Oct 2028 Index,Nippon India Nifty G-Sec Oct 2028 Maturity Index Fund-Reg(G),1.24,3.76,7.28,0.49,2.77,11.01,52
Baroda BNP Paribas NIFTY SDL Dec 2026 Index Fund-Reg(G),2023-01-25,47387,0.86,4.48,10.1,0.25,3.1,15.4,0.05,0.28,0.64,0.25,0.01,0.06,11,13,8,14,14,14,NIFTY SDL December 2026 Index,Baroda BNP Paribas NIFTY SDL Dec 2026 Index Fund-Reg(G),1.24,3.76,7.28,0.49,2.77,11.01,52
SBI FMP-50-1843D-Reg(G),2021-09-07,45842,0.52,2.23,3.86,0.16,0.81,7.11,0.03,0.14,0.24,0.16,0.0,0.03,31,71,74,41,72,71,CRISIL Medium to Long Term Debt Index,SBI FMP-50-1843D-Reg(G),0.67,4.58,9.19,0.19,2.25,-152.64,91
Bandhan CRISIL IBX 90:10 SDL Plus Gilt - Nov 2026 Index Fund-Reg(G),2022-11-17,46213,0.74,5.12,11.56,0.23,3.12,16.2,0.05,0.32,0.73,0.23,0.01,0.06,8,8,4,12,13,12,CRISIL IBX 90:10 SDL Plus Gilt Index - November 2026,Bandhan CRISIL IBX 90:10 SDL Plus Gilt - Nov 2026 Index Fund-Reg(G),1.24,3.76,7.28,0.49,2.77,11.01,52
Aditya Birla SL Retirement Fund-40-Reg(G),2019-03-11,42770,10.18,2.01,2.89,1.72,15.47,11.89,0.64,0.13,0.18,1.72,0.06,0.05,21,29,28,25,20,23,CRISIL Hybrid 35+65 - Aggressive Index,Aditya Birla SL Retirement Fund-40-Reg(G),9.19,2.31,3.56,1.6,15.6,13.51,38
PGIM India Gilt Fund(G),2008-10-27,7012,2.45,2.3,4.18,1.3,1.84,4.33,0.15,0.14,0.26,1.3,0.01,0.02,29,29,23,29,30,33,CRISIL Dynamic Gilt Index,PGIM India Gilt Fund(G),1.96,2.91,5.21,0.95,2.37,6.34,35
Kotak FMP-326-175D(G),2023-12-26,48420,,,,,,,,,,,,,,,,,,,NIFTY Ultra Short Duration Debt Index,Kotak FMP-326-175D(G),0.67,4.58,9.19,0.19,2.25,-152.64,91
UTI Silver ETF,2023-04-17,46881,23.2,0.8,1.3,1.44,14.99,12.85,1.46,0.05,0.08,1.44,0.06,0.05,20,20,20,14,15,14,Silver,UTI Silver ETF,17.25,1.19,1.89,0.82,16.24,28.48,22
Sundaram Global Brand Fund(G),2007-08-22,3005,11.7,0.86,1.36,0.84,7.59,12.0,0.74,0.05,0.09,0.84,0.03,0.05,7,38,39,11,35,22,MSCI AC World Index,Sundaram Global Brand Fund(G),16.47,0.98,1.65,1.7,10.35,15.83,56
HDFC NIFTY Realty Index Fund-Reg(G),2024-03-26,48654,,,,,,,,,,,,,,,,,,,NIFTY REALTY - TRI,HDFC NIFTY Realty Index Fund-Reg(G),16.43,1.97,3.0,0.99,14.45,32.95,101
Helios Financial Services Fund-Reg(G),2024-06-24,48897,,,,,,,,,,,,,,,,,,,Nifty Financial Services - TRI,Helios Financial Services Fund-Reg(G),16.24,1.28,1.87,1.04,1.71,19.93,17
ITI Overnight Fund-Reg(G),2019-10-24,44267,0.01,12.08,1.3,0.0,0.18,-217.05,0.0,0.76,0.08,0.0,0.0,-0.86,21,26,33,4,33,3,CRISIL Liquid Overnight Index,ITI Overnight Fund-Reg(G),0.04,26.72,4.08,0.0,0.48,-1478.06,34
SBI FMP-43-1616D-Reg(G),2021-04-29,45525,0.34,2.77,4.36,0.08,0.76,11.84,0.02,0.17,0.27,0.08,0.0,0.05,17,59,57,18,78,53,CRISIL Medium Duration Debt Index,SBI FMP-43-1616D-Reg(G),0.67,4.58,9.19,0.19,2.25,-152.64,91
PGIM India Arbitrage Fund-Reg(G),2014-08-27,28514,0.96,3.14,6.62,-0.11,3.33,-27.27,0.06,0.2,0.42,-0.11,0.01,-0.11,4,19,19,25,22,20,Nifty 50 Arbitrage,PGIM India Arbitrage Fund-Reg(G),1.0,3.27,7.05,-0.14,3.65,-24.08,25
Edelweiss US Value Equity Offshore Fund-Reg(G),2013-08-07,21920,11.54,1.23,2.06,1.29,10.71,11.01,0.73,0.08,0.13,1.29,0.04,0.04,4,27,25,23,30,25,Russell 1000 Index,Edelweiss US Value Equity Offshore Fund-Reg(G),16.47,0.98,1.65,1.7,10.35,15.83,56
Canara Rob Dynamic Bond Fund-Reg(G),2009-05-29,7792,2.24,1.96,3.21,1.14,1.06,3.86,0.14,0.12,0.2,1.14,0.0,0.02,19,22,22,19,22,22,CRISIL Dynamic Bond Index,Canara Rob Dynamic Bond Fund-Reg(G),1.8,3.11,5.49,0.87,2.35,15.07,22
Mirae Asset Nifty IT ETF,2023-10-20,48250,,,,,,,,,,,,,,,,,,,NIFTY IT - TRI,Mirae Asset Nifty IT ETF,16.29,1.83,2.98,1.08,13.44,15.21,136
Bajaj Finserv Banking and PSU Fund-Reg(G),2023-11-13,48214,,,,,,,,,,,,,,,,,,,NIFTY Banking and PSU Debt Index,Bajaj Finserv Banking and PSU Fund-Reg(G),0.74,5.03,9.03,0.28,2.77,15.63,26
Motilal Oswal Multi Asset Fund-Reg(G),2020-08-04,45017,7.68,1.28,2.14,0.71,7.79,13.81,0.48,0.08,0.13,0.71,0.03,0.05,5,15,15,2,14,10,NIFTY 500 - TRI,Motilal Oswal Multi Asset Fund-Reg(G),8.87,2.36,3.6,1.29,17.0,4.58,15
PGIM India Dynamic Bond Fund(G),2012-01-12,15247,2.01,2.67,5.06,1.06,2.27,5.07,0.13,0.17,0.32,1.06,0.01,0.02,15,11,8,17,11,14,CRISIL Dynamic Bond Index,PGIM India Dynamic Bond Fund(G),1.8,3.11,5.49,0.87,2.35,15.07,22
Nippon India FHF-XLV-4-1111D(G),2023-03-31,47822,0.79,4.89,9.74,0.28,3.02,13.61,0.05,0.31,0.61,0.28,0.01,0.05,74,40,42,75,31,42,CRISIL Medium Duration Debt Index,Nippon India FHF-XLV-4-1111D(G),0.67,4.58,9.19,0.19,2.25,-152.64,91
Mirae Asset Nifty 100 ESG Sector Leaders FoF-Reg(G),2020-11-18,45135,13.09,1.84,2.89,2.09,18.04,11.52,0.82,0.12,0.18,2.09,0.07,0.05,42,43,45,49,21,39,Nifty100 ESG Sector Leaders - TRI,Mirae Asset Nifty 100 ESG Sector Leaders FoF-Reg(G),9.16,2.38,3.86,1.09,15.55,21.19,53
LIC MF Short Duration Fund-Reg(G),2019-02-01,34304,0.69,4.87,8.89,0.29,2.52,11.72,0.04,0.31,0.56,0.29,0.01,0.05,7,9,11,8,15,7,CRISIL Short Duration Debt Index,LIC MF Short Duration Fund-Reg(G),0.71,4.61,8.37,0.29,2.33,-328.98,25
Helios Overnight Fund-Reg(G),2023-10-25,48295,,,,,,,,,,,,,,,,,,,CRISIL Liquid Overnight Index,Helios Overnight Fund-Reg(G),0.04,26.72,4.08,0.0,0.48,-1478.06,34
Kotak FMP-304-3119D(G),2022-12-30,47401,2.43,2.59,4.24,1.06,3.18,5.95,0.15,0.16,0.27,1.06,0.01,0.02,91,62,59,91,25,80,NIFTY Long Duration Debt Index,Kotak FMP-304-3119D(G),0.67,4.58,9.19,0.19,2.25,-152.64,91
UTI Long Duration Fund-Reg(G),2023-03-17,47733,3.28,2.15,3.74,1.64,2.22,4.28,0.21,0.14,0.24,1.64,0.01,0.02,15,17,13,17,17,18,NIFTY Long Duration Debt Index,UTI Long Duration Fund-Reg(G),2.51,2.38,4.14,1.2,2.45,5.25,19
Quantum Dynamic Bond Fund-Reg(G),2015-05-19,37428,2.37,2.41,4.08,1.21,2.17,4.74,0.15,0.15,0.26,1.21,0.01,0.02,20,17,16,20,15,18,CRISIL Dynamic Bond Index,Quantum Dynamic Bond Fund-Reg(G),1.8,3.11,5.49,0.87,2.35,15.07,22
HSBC Global Equity Climate Change FoF-Reg(G),2021-03-22,45333,15.58,0.92,1.65,2.57,7.99,5.57,0.98,0.06,0.1,2.57,0.03,0.02,26,36,35,44,33,38,MSCI AC World Index,HSBC Global Equity Climate Change FoF-Reg(G),16.47,0.98,1.65,1.7,10.35,15.83,56
ICICI Pru Nifty Auto ETF,2022-01-12,46229,17.03,2.61,4.6,0.9,29.41,49.34,1.07,0.16,0.29,0.9,0.12,0.2,97,19,18,38,17,12,NIFTY AUTO - TRI,ICICI Pru Nifty Auto ETF,16.29,1.83,2.98,1.08,13.44,15.21,136
DSP Nifty Midcap 150 Quality 50 ETF,2021-12-23,46157,14.02,1.98,3.17,0.81,14.19,34.22,0.88,0.12,0.2,0.81,0.06,0.14,56,65,54,35,64,56,NIFTY Midcap150 Quality 50 - TRI,DSP Nifty Midcap 150 Quality 50 ETF,16.29,1.83,2.98,1.08,13.44,15.21,136
Motilal Oswal Gold and Silver ETFs FoF-Reg(G),2022-10-13,17788,14.11,1.27,2.15,1.05,14.84,17.01,0.89,0.08,0.14,1.05,0.06,0.07,12,12,12,12,12,12,Gold-India,Motilal Oswal Gold and Silver ETFs FoF-Reg(G),14.31,1.35,2.31,0.74,16.31,163.18,15
PGIM India Overnight Fund-Reg(G),2019-08-27,24529,0.02,21.6,2.5,0.0,0.35,-4783.64,0.0,1.36,0.16,0.0,0.0,-18.98,24,21,17,32,14,33,Nifty 1D Rate Index,PGIM India Overnight Fund-Reg(G),0.04,26.72,4.08,0.0,0.48,-1478.06,34
Quant Gilt Fund-Reg(G),2022-12-21,47345,1.07,3.08,5.64,0.52,1.79,6.43,0.07,0.19,0.36,0.52,0.01,0.03,8,10,9,9,31,10,CRISIL Dynamic Gilt Index,Quant Gilt Fund-Reg(G),1.96,2.91,5.21,0.95,2.37,6.34,35
LIC MF Nifty Next 50 Index Fund(G),2010-09-20,12836,19.11,2.53,3.69,1.12,27.97,43.22,1.2,0.16,0.23,1.12,0.11,0.17,66,15,16,81,12,14,NIFTY NEXT 50 - TRI,LIC MF Nifty Next 50 Index Fund(G),16.43,1.97,3.0,0.99,14.45,32.95,101
Mahindra Manulife Arbitrage Fund-Reg(G),2020-08-24,45042,1.01,2.09,4.35,-0.15,2.52,-14.49,0.06,0.13,0.27,-0.15,0.01,-0.06,19,25,25,5,25,1,Nifty 50 Arbitrage,Mahindra Manulife Arbitrage Fund-Reg(G),1.0,3.27,7.05,-0.14,3.65,-24.08,25
Motilal Oswal Nifty 200 Momentum 30 ETF,2022-02-10,46325,20.99,2.22,3.24,1.18,26.71,39.26,1.32,0.14,0.2,1.18,0.11,0.16,122,44,50,122,24,43,Nifty200 Momentum 30 - TRI,Motilal Oswal Nifty 200 Momentum 30 ETF,16.29,1.83,2.98,1.08,13.44,15.21,136
ICICI Pru Quant Fund(G),2020-12-11,42805,11.49,2.57,3.94,0.76,15.65,38.76,0.72,0.16,0.25,0.76,0.06,0.15,5,11,12,12,28,22,BSE 200 - TRI,ICICI Pru Quant Fund(G),15.66,2.27,3.42,0.91,17.47,37.03,52
PGIM India Corp Bond Fund(G),2003-01-30,854,0.71,4.82,8.71,0.3,2.55,11.54,0.04,0.3,0.55,0.3,0.01,0.05,6,14,10,7,19,10,CRISIL Composite Bond Index,PGIM India Corp Bond Fund(G),0.76,4.97,8.52,0.32,2.81,12.33,21
ICICI Pru Nifty 100 ETF,2013-08-20,22404,13.97,1.84,2.76,1.02,8.62,25.17,0.88,0.12,0.17,1.02,0.03,0.1,54,71,79,88,84,79,NIFTY 100 - TRI,ICICI Pru Nifty 100 ETF,16.29,1.83,2.98,1.08,13.44,15.21,136
Sundaram Nifty 100 Equal Weight Fund(G),1999-07-27,2384,15.03,2.41,3.55,0.98,18.45,37.14,0.95,0.15,0.22,0.98,0.07,0.15,47,22,22,26,42,43,Nifty100 Equal Weight - TRI,Sundaram Nifty 100 Equal Weight Fund(G),16.43,1.97,3.0,0.99,14.45,32.95,101
Edelweiss CRISIL IBX 50:50 Gilt Plus SDL June 2027 Index Fund-Reg(G),2022-10-18,46999,0.87,4.57,8.21,0.33,3.0,12.02,0.05,0.29,0.52,0.33,0.01,0.05,12,11,20,18,27,18,CRISIL IBX 50:50 Gilt Plus SDL Index - June 2027,Edelweiss CRISIL IBX 50:50 Gilt Plus SDL June 2027 Index Fund-Reg(G),1.24,3.76,7.28,0.49,2.77,11.01,52
Motilal Oswal BSE Low Volatility Index Fund-Reg(G),2022-03-23,46438,10.85,2.61,4.59,0.66,16.41,43.24,0.68,0.16,0.29,0.66,0.07,0.17,4,5,5,3,50,13,BSE Low Volatility Index - TRI,Motilal Oswal BSE Low Volatility Index Fund-Reg(G),16.43,1.97,3.0,0.99,14.45,32.95,101
Edelweiss Nifty 50 Index Fund-Reg(G),2021-10-08,45957,13.35,1.56,2.4,0.99,2.82,21.09,0.84,0.1,0.15,0.99,0.01,0.08,12,82,85,29,88,86,NIFTY 50 - TRI,Edelweiss Nifty 50 Index Fund-Reg(G),16.43,1.97,3.0,0.99,14.45,32.95,101
Motilal Oswal Nifty 5 Year Benchmark G-Sec ETF,2020-12-10,45196,1.45,3.35,5.58,0.64,3.28,7.56,0.09,0.21,0.35,0.64,0.01,0.03,13,14,12,15,7,12,Nifty 5 yr Benchmark G-Sec Index TRI,Motilal Oswal Nifty 5 Year Benchmark G-Sec ETF,1.05,4.54,6.56,0.42,2.57,-405.22,19
Tata Silver ETF,2024-01-12,48436,,,,,,,,,,,,,,,,,,,Silver,Tata Silver ETF,17.25,1.19,1.89,0.82,16.24,28.48,22
Motilal Oswal Nifty Smallcap 250 ETF,2024-03-15,48657,,,,,,,,,,,,,,,,,,,Nifty Smallcap 250 - TRI,Motilal Oswal Nifty Smallcap 250 ETF,16.29,1.83,2.98,1.08,13.44,15.21,136
Invesco India Nifty 50 ETF,2011-06-16,12694,13.43,1.6,2.47,0.99,4.38,21.6,0.85,0.1,0.16,0.99,0.02,0.09,49,88,97,80,102,89,NIFTY 50 - TRI,Invesco India Nifty 50 ETF,16.29,1.83,2.98,1.08,13.44,15.21,136
ICICI Pru Nifty 200 Quality 30 ETF,2023-08-07,48118,12.46,2.59,4.34,0.73,20.11,44.25,0.78,0.16,0.27,0.73,0.08,0.18,16,23,20,24,50,24,NIFTY200 Quality 30 - TRI,ICICI Pru Nifty 200 Quality 30 ETF,16.29,1.83,2.98,1.08,13.44,15.21,136
Edelweiss Nifty Alpha Low Volatility 30 Index Fund-Reg(G),2024-05-16,48808,,,,,,,,,,,,,,,,,,,NIFTY Alpha Low-Volatility 30 - TRI,Edelweiss Nifty Alpha Low Volatility 30 Index Fund-Reg(G),16.43,1.97,3.0,0.99,14.45,32.95,101
DSP Nifty SDL Plus G-Sec Sep 2027 50:50 Index Fund-Reg(G),2023-02-14,47548,0.92,4.42,8.99,0.39,2.95,10.53,0.06,0.28,0.57,0.39,0.01,0.04,18,16,12,24,33,27,Nifty SDL Plus G-Sec Sep 2027 50:50 Index,DSP Nifty SDL Plus G-Sec Sep 2027 50:50 Index Fund-Reg(G),1.24,3.76,7.28,0.49,2.77,11.01,52
Kotak FMP-308-1125D(G),2023-03-29,47570,0.53,7.26,13.46,0.11,3.55,34.88,0.03,0.46,0.85,0.11,0.01,0.14,35,16,17,21,7,12,NIFTY Medium Duration Debt Index,Kotak FMP-308-1125D(G),0.67,4.58,9.19,0.19,2.25,-152.64,91
Quantum ESG Best In Class Strategy Fund-Reg(G),2019-07-12,43878,11.7,2.15,3.52,0.75,11.47,33.52,0.74,0.14,0.22,0.75,0.05,0.13,8,30,20,10,42,35,NIFTY100 ESG - TRI,Quantum ESG Best In Class Strategy Fund-Reg(G),15.66,2.27,3.42,0.91,17.47,37.03,52
Union Medium Duration Fund-Reg(G),2020-09-14,44157,1.05,3.64,6.02,0.46,2.47,8.29,0.07,0.23,0.38,0.46,0.01,0.03,25,25,28,22,25,24,CRISIL Medium Duration Debt Index,Union Medium Duration Fund-Reg(G),0.86,4.78,9.3,0.35,2.77,15.17,30
Axis FTP-113-1228D-Reg(G),2023-03-21,47799,0.6,5.42,10.09,0.15,2.8,21.17,0.04,0.34,0.64,0.15,0.01,0.08,45,23,35,34,51,16,CRISIL Medium Duration Debt Index,Axis FTP-113-1228D-Reg(G),0.67,4.58,9.19,0.19,2.25,-152.64,91
Mirae Asset Nifty AAA PSU Bond Plus SDL Apr 2026 50:50 Index Fund-Reg(G),2022-10-20,47038,0.56,6.2,12.44,0.16,3.0,22.02,0.04,0.39,0.78,0.16,0.01,0.09,4,3,3,3,4,3,Nifty AAA Bond Plus SDL Apr 2026 50:50 Index,Mirae Asset Nifty AAA PSU Bond Plus SDL Apr 2026 50:50 Index Fund-Reg(G),0.74,5.03,9.03,0.28,2.77,15.63,26
Kotak Global Emerging Mkt Fund(G),2007-09-26,2047,12.21,0.74,1.29,1.92,3.05,4.71,0.77,0.05,0.08,1.92,0.01,0.02,8,41,40,35,42,39,MSCI Emerging Market Index,Kotak Global Emerging Mkt Fund(G),16.47,0.98,1.65,1.7,10.35,15.83,56
Aditya Birla SL CRISIL IBX Gilt April 2033 Index Fund-Reg(G),2023-12-22,48411,,,,,,,,,,,,,,,,,,,CRISIL IBX Gilt Index - April 2033,Aditya Birla SL CRISIL IBX Gilt April 2033 Index Fund-Reg(G),2.51,2.38,4.14,1.2,2.45,5.25,19
Sundaram LT Micro Cap Tax Adv Fund-Sr III-Reg(G),2016-11-18,36026,16.19,1.76,2.53,0.82,13.58,34.88,1.02,0.11,0.16,0.82,0.05,0.14,49,50,49,11,30,28,Nifty Smallcap 100,Sundaram LT Micro Cap Tax Adv Fund-Sr III-Reg(G),14.34,2.1,3.13,0.91,13.54,33.36,59
LIC MF BSE Sensex Index Fund-Reg(G),2002-11-28,2133,13.33,1.34,2.08,0.99,-0.28,17.94,0.84,0.08,0.13,0.99,0.0,0.07,9,97,97,45,97,97,BSE SENSEX - TRI,LIC MF BSE Sensex Index Fund-Reg(G),16.43,1.97,3.0,0.99,14.45,32.95,101
Tata Gold ETF FoF-Reg(G),2024-01-19,48437,,,,,,,,,,,,,,,,,,,Gold-India,Tata Gold ETF FoF-Reg(G),9.16,2.38,3.86,1.09,15.55,21.19,53
